,metadata_visibility,eprintid,eprint_status,datestamp,documents,lastmod,userid,refereed,event_dates,title,pres_type,creators,type,event_location,subjects,event_title,date_type,date,uri,abstract,funders,event_type,dir,divisions,ispublished,rev_number,status_changed,full_text_status,corp_creators,publisher,related_url,issn,id_number,pagerange,number,official_url,volume,publication
0,show,24897,archive,2020-11-11 05:19:03,"[{'security': 'public', 'pos': 1, 'uri': 'http://repository.lppm.unila.ac.id/id/document/38641', 'eprintid': 24897, 'placement': 1, 'mime_type': 'application/pdf', 'language': 'en', 'rev_number': 1, 'format': 'text', 'files': [{'hash': '571e80caf363463170aa3006a0b6c820', 'mime_type': 'application/pdf', 'datasetid': 'document', 'fileid': 225530, 'filename': 'SNKPPM UNDIP-PKM Mural sebagai aspek MDGs dan Pandemik.pdf', 'uri': 'http://repository.lppm.unila.ac.id/id/file/225530', 'filesize': 408821, 'objectid': 38641, 'mtime': '2020-11-11 03:39:48', 'hash_type': 'MD5'}], 'main': 'SNKPPM UNDIP-PKM Mural sebagai aspek MDGs dan Pandemik.pdf', 'docid': 38641}]",2020-11-11 05:19:03,31,TRUE,15 Oktober 2020,"Perbaikan Kampung Kota melalui Kegiatan Mural dalam Mendukung Program
MDGs dan Ketahanan Pandemic",paper,"[{'name': {'given': 'Dini', 'family': 'Hardilla', 'lineage': None, 'honourific': None}, 'id': 'dinihd90@gmail.com'}, {'id': 'agung.cahyo@eng.unila.ac.id', 'name': {'given': 'Agung Cahyo', 'family': 'Nugroho', 'lineage': None, 'honourific': None}}, {'id': 'nug.ifadianto@gmail.com', 'name': {'given': 'Nugroho', 'family': 'Ifadianto', 'lineage': None, 'honourific': None}}, {'name': {'family': 'KURNIAWAN', 'lineage': None, 'honourific': None, 'given': 'PANJI'}, 'id': 'panji.kurniawan@eng.unila.ac.id'}]",conference_item,UNDIP Semarang,"['HN', 'NA']",Seminar Nasional Pengabdian Kepada Masyarakat untuk Mendukung Sustainable Development Goal di Era Pandemi Covid 19 di Universitas Diponegoro 2020,submitted,2020-10-07 00:00:00.000000000,http://repository.lppm.unila.ac.id/id/eprint/24897,"Pembuatan Mural merupakan cara mempercantik melalui permukiman pengecatan sehingga menjadi
Kampung wisata. Hal ini menyebabkan permukiman yang sebelumnya belum layak huni bagi masyarakat, menjadi meningkat kualitas permukimannya. Oleh karena itu, dengan adanya kegiatan pendampingan ini, akan memberikan inspirasi bagi masyarakat bahwa kawasan permukiman mereka memiliki nilai lebih yaitu dapat mejadi potensi pariwisata perkotaan, yang nantinya dapat menghasilkan income tambahan bagi masyarakat sekitar. Selain itu, kegiatan ini dapat menjadi titik mula bagi masyarakat dan pemerintah dalam meningkatkan kesadaran masyarakat untuk peduli dalam manajemen pengelolaan sanitasi perkotaan dan sebagai bentuk kesadaran dalam menghadapi pandemic covid 19 melalui penyediaan ruang-ruang komunla yang bersifat privat.. Metode pelaksanaannya adalah melalui pendekatan dan mengikutsertakan masyarakat dalam proses kegiatan penggambaran mural pada dinding rumah warga. Kegiatan pengabdian masyarakat yang diusulkan adalah pendampingan masyarakat untuk peningkatan kualitas lingkungan terutama sanitasi melalui parsisipasi langsung masyarakat dengan kegiatan mural. Tujuan program ini adalah untuk meningkatkan rasa kepemilikan dan kebanggaan atas kepemilikan kampung bagi masyarakat, serta untuk memperindah kampung dan mendorong kampung sebagai potensi baru pariwisata perkotaan, serta meningkatkan minat masyarakat untuk berjalan kaki. Manfaat dari kegiatan ini adalah sebagai kegiatan yang dapat mendorong kreatifitas warga, dan dapat menjadi alat untuk pengakuan publik yang lebih baik bagi Kampung Sawah Brebes sebagai kampung kota wisata di
Bandar Lampung
Kata kunci — Bandar Lampung, Covid 19, Kampung Sawah Brebes, Kualitas Permukiman, Mural",['DIPA FT UNILA'],conference,disk0/00/02/48/97,['FT12'],inpress,9,2020-11-11 05:19:03,public,,,,,,,,,,
1,show,26133,archive,2020-11-19 11:30:37,"[{'language': 'en', 'rev_number': 1, 'mime_type': 'application/pdf', 'files': [{'uri': 'http://repository.lppm.unila.ac.id/id/file/235650', 'filename': 'Persada_2020_IOP_Conf._Ser.__Earth_Environ._Sci._556_012005.pdf', 'objectid': 40011, 'filesize': 910074, 'mtime': '2020-11-18 23:48:12', 'hash_type': 'MD5', 'hash': '93123f79508f53862e94da8f26c524a5', 'mime_type': 'application/pdf', 'fileid': 235650, 'datasetid': 'document'}], 'main': 'Persada_2020_IOP_Conf._Ser.__Earth_Environ._Sci._556_012005.pdf', 'docid': 40011, 'format': 'text', 'pos': 1, 'uri': 'http://repository.lppm.unila.ac.id/id/document/40011', 'security': 'public', 'placement': 1, 'eprintid': 26133}]",2020-11-19 11:30:37,408,TRUE,,"Developing a Framework for Assessing City Sustainability
(Case Study: Bandar Lampung and Metro City,
Lampung Province, Indonesia)",,"[{'id': 'citra.persada@eng.unila.ac.id', 'name': {'honourific': None, 'lineage': None, 'family': 'Persada', 'given': 'Citra'}}, {'id': 'stugiono@yahoo.com', 'name': {'lineage': None, 'family': 'Tugiono', 'honourific': None, 'given': 'Subuh'}}, {'id': 'ikakustiani@yahoo.com', 'name': {'given': 'Ika', 'family': 'Kustiani', 'lineage': None, 'honourific': None}}]",article,,['TA'],,published,2020-09-22 00:00:00.000000000,http://repository.lppm.unila.ac.id/id/eprint/26133,"Sustainable city development is influenced by the availability of sustainable infrastructure. High population growth in urban areas requires improvements in many aspects, especially infrastructure.  However, the need for improvements is often not fulfilled.  As a result, various problems that would ultimately affect the city sustainability emerge. To overcome the problems, it is important to develop comprehensive and integrated policies and strategies framework that enables a city to meet the demand for improvement and sustainability.  The very first stage of developing a city development framework is to understand the current condition of city performance and sustainability.  The main objective of this paper is to develop an indicator framework of a sustainable city. The stages of developing the framework consist (1) defining the criteria and indicators of sustainable city; (2) measuring performance and sustainability level of a city and (3) identifying the influential indicators that increase the city sustainability status.  The criteria of sustainability framework were developed based on the Triple Bottom Line (TBL) Sustainability of people, planet, and profit.  Subsequently, the level of sustainability is measured by using a weighted-score method. This paper presented the results of the performance and sustainability assessment of two cities in the Lampung Province (Bandar Lampung and Metro City) based on the performance and sustainability framework developed in this study. It can be concluded that Bandar Lampung City is less sustainable than Metro.",['Pemerintah Provinsi Lampung'],,disk0/00/02/61/33,['FT12'],pub,15,2020-11-19 11:30:37,public,"['Universitas Lampung', 'Universitas Lampung', 'Universitas Lampung']",IOP Publishing,"[{'url': 'https://iopscience.iop.org/article/10.1088/1755-1315/556/1/012005', 'type': 'org'}]",doi:10.1088/1755-1315/556/1/012005,12005.0,1-10,12005.0,https://iopscience.iop.org/article/10.1088/1755-1315/556/1/012005,556.0,IOP Conference Series: Earth and Environmental Science
2,show,44857,archive,2022-09-12 01:13:22,"[{'format': 'text', 'docid': 166764, 'main': 'HASIL PENILAIAN SEJAWAT SEBIDANG ATAU PEER REVIEW (1).pdf', 'files': [{'filename': 'HASIL PENILAIAN SEJAWAT SEBIDANG ATAU PEER REVIEW (1).pdf', 'uri': 'http://repository.lppm.unila.ac.id/id/file/484142', 'filesize': 377791, 'objectid': 166764, 'mtime': '2022-09-09 04:00:00', 'hash_type': 'MD5', 'mime_type': 'application/pdf', 'hash': 'a84c843ec947789037ec25e3d50f0a35', 'fileid': 484142, 'datasetid': 'document'}], 'language': 'en', 'rev_number': 1, 'mime_type': 'application/pdf', 'eprintid': 44857, 'placement': 1, 'security': 'public', 'pos': 1, 'uri': 'http://repository.lppm.unila.ac.id/id/document/166764'}]",2022-09-12 01:13:22,306,,,Profile of Sweet Potato Fermentation using Leuconostoc Mesenteroides as a Starter,,"[{'name': {'given': 'Neti', 'honourific': None, 'family': 'Yuliana', 'lineage': None}, 'id': 'neti.yuliana@fp.unila.ac.id'}, {'id': 'dewikincai@yahoo.com', 'name': {'honourific': None, 'lineage': None, 'family': 'Sartika', 'given': 'Dewi'}}, {'id': 'sutiknolampung@yahoo.com', 'name': {'honourific': None, 'family': 'Sutikno', 'lineage': None, 'given': 'Sutikno'}}, {'name': {'honourific': None, 'family': 'Jatmiko', 'lineage': None, 'given': 'Edo'}, 'id': None}]",other,,['S1'],,published,1970-01-01 00:00:00.000002020,http://repository.lppm.unila.ac.id/id/eprint/44857,,,,disk0/00/04/48/57,"['FP19', 'FP22', 'FT9', 'FT13', 'FT14', 'FT12', 'FT3', 'FT2']",pub,7,2022-09-12 01:13:22,public,,Proceedings of the 6th Food Ingredient Asia Conference,,,,,,,,
