,subjects,date_type,uri,date,abstract,divisions,publisher,dir,ispublished,rev_number,status_changed,full_text_status,metadata_visibility,editors,eprint_status,eprintid,datestamp,pages,documents,lastmod,userid,refereed,title,type,place_of_pub,contact_email,official_url,referencetext,event_dates,creators,pres_type,event_title,succeeds,event_type,contributors,id_number,pagerange,number,publication,issn,volume,event_location,funders,corp_creators,projects,keywords,note,department,institution,monograph_type,related_url,patent_applicant,isbn,book_title
25,"['H1', 'HV']",published,http://repository.lppm.unila.ac.id/id/eprint/36603,2021-09-30 00:00:00.000000000,"The phenomenon of stunting is one of the priority issues of national health development in the Republic of Indonesia. In Lampung Province, the government responded to this problem by establishing the Lampung Stunting Agency (LSA), which facilitates collaboration between various parties to overcome stunting. In connection with this development, this article tries to measure the governance of collaborative practices in managing stunting in Lampung Province. This article define collaboration as process in which autonomous or semi-autonomous actors interact through formal and informal negotiation, jointly creating rules and structures governing their relationships and ways to act or decide on the issues that brought them together. It is a process involving shared norms and mutually beneficial interactions and consists five dimensions (governance, administration, organizational autonomy, mutuality, and norms). The researcher distributed questionnaires to 200 respondents who were selected purposively, both offline and online, who intersect with LSA. Primary data were analyzed using principal component analysis (PCA) techniques, reliability test, and confirmatory factor analysis (CFA). The results of PCA indicate that all governance indicators in this study are unidimensional and have internal consistency. The finding confirms that there is governance in the reduction of stunting in Lampung Province empirically. However, this governance still needs to be strengthened, especially in the context of formal agreements, collective decision making, and informal relations.","['FISIP1', 'FISIP2', 'FISIP3']",,disk0/00/03/66/03,inpress,8,2021-11-13 02:19:15,public,show,,archive,36603,2021-11-13 02:19:15,,"[{'security': 'public', 'uri': 'http://repository.lppm.unila.ac.id/id/document/157515', 'pos': 1, 'eprintid': 36603, 'placement': 1, 'language': 'en', 'mime_type': 'application/pdf', 'rev_number': 1, 'format': 'text', 'files': [{'uri': 'http://repository.lppm.unila.ac.id/id/file/421886', 'filename': '125961287.pdf', 'filesize': 360726, 'objectid': 157515, 'mtime': '2021-11-12 23:05:21', 'hash_type': 'MD5', 'hash': '405c661a6973b36a4c0ba3079a603008', 'mime_type': 'application/pdf', 'datasetid': 'document', 'fileid': 421886}], 'main': '125961287.pdf', 'docid': 157515}]",2021-11-13 02:19:15,145,FALSE,"Measuring the Governance of Collaborative Practices for Stunting Management 
in Lampung, Indonesia",conference_item,,,https://fia.ub.ac.id/aicobpa/#,"[1]	M. Umakaapa, “Strategi 2020 melawan stunting,” www.detik.com, 2020. [Online]. Available: https://news.detik.com/kolom/d-4858547/strategi-2020-melawan-stunting. [Accessed: 20-Aug-2020].
[2]	A. Atika, “Empat kabupaten kasus tertinggi stunting,” www.lampost.co, Bandar Lampung, Lampung, Indonesia, 02-Oct-2019.
[3]	M. Hossain, et al., “Evidence-based approaches to childhood stunting in low and middle income countries: A systematic review,” Arch. Dis. Child., vol. 102, no. 10, pp. 903–909, 2017.
[4]	J. Jap, S. Sumarmi, and N.A. Damayanti, “Importance of collaborative intervention of preconception nutrition in suppressing the stunting case in East Nusa Tenggara, Indonesia,” Indian J. Public Heal. Res. Dev., vol. 10, no. 9, pp. 698–702, 2019.
[5]	S. Muljati, A. Triwinarto, and B. Budiman, “Determinan stunting pada anak usia 2-3 tahun di tingkat provinsi,” Penelit. Gizi dan Makanan, vol. 34, no. 1, pp. 50–62, 2011.
[6]	C.R. Titaley, I. Ariawan, D. Hapsari, A. Muasyaroh, and M.J. Dibley, “Determinants of the stunting of children under two years old in Indonesia: A multilevel analysis of the 2013 Indonesia basic health survey,” Nutrients, vol. 11, no. 5, p. 1106, May 2019.
[7]	H. Torlesse, A.A. Cronin, S.K. Sebayang, and R. Nandy, “Determinants of stunting in Indonesian children: Evidence from a cross-sectional survey indicate a prominent role for the water, sanitation and hygiene sector in stunting reduction,” BMC Public Health, vol. 16, no. 1, pp. 1–11, 2016.
[8]	M.F. Rizal and E. van Doorslaer, “Explaining the fall of socioeconomic inequality in childhood stunting in Indonesia,” SSM - Popul. Heal., vol. 9, p. 100469, 2019.
[9]	Ramli, K.E. Agho, K.J. Inder, S.J. Bowe, J. Jacobs, and M.J. Dibley, “Prevalence and risk factors for stunting and severe stunting among under-fives in North Maluku province of Indonesia,” BMC Pediatr., vol. 9, no. 1, p. 64, Dec. 2009.
[10]	D. Arini, Nursalam, Mahmudah, and I. Faradilah, “The incidence of stunting, the frequency/duration of diarrhea and acute respiratory infection in toddlers,” J. Public health Res., vol. 9, no. 1816, pp. 117–120, Jul. 2020.
[11]	T. Mahmudiono, T. Nindya, D. Andrias, H. Megatsari, and R. Rosenkranz, “Household food insecurity as a predictor of stunted children and overweight/obese mothers (SCOWT) in urban Indonesia,” Nutrients, vol. 10, no. 5, p. 535, Apr. 2018.
[12]	C.N. Rachmi, K.E. Agho, M. Li, and L.A. Baur, “Stunting, underweight and overweight in children aged 2.0–4.9 years in Indonesia: Prevalence trends and associated risk factors,” PLoS One, vol. 11, no. 5, p. e0154756, May 2016.

[13]	M. Aries, H. Hardinsyah, and H. Tuhiman, “Determinan gizi kurang dan stunting anak umur 0-36 bulan berdasarkan data program keluarga harapan (PKH) 2007,” J. Gizi dan Pangan, vol. 7, no. 1, pp. 19–26, Mar. 2012.
[14]	D. Kusuma, M. McConnell, P. Berman, and J. Cohen, “The impact of household and community cash transfers on children’s food consumption in Indonesia,” Prev. Med. (Baltim)., vol. 100, pp. 152–158, 2017.
[15]	T. A. Ahmad, N.K.T. Martuti, S.B. Nugraha, A. Amidi, W. Aksin, and B.N. Sidiq, “Kajian kelayakan penerima manfaat (Gakin PKH) terhadap program bantuan pemerintah di kota Semarang,” J. Riptek, vol. 13, no. 2, pp. 114–123, 2019.
[16]	S.M. Damanik, D. Wanda, and H. Hayati, “Feeding practices for toddlers with stunting in Jakarta: A case study,” Pediatr. Rep., vol. 12(s1), no. 8695, pp. 18–22, Jun. 2020.
[17]	P.D. Novitasari, and D. Wanda, “Maternal feeding practice and its relationship with stunting in children,” Pediatr. Rep., vol. 12(s1), no. 8698, pp. 30–33, Jun. 2020.
[18]	C. Starkweather, et al., “An interpersonal nutrition campaign and maternal knowledge and childhood feeding practices: a case study from mothers in rural Indonesia,” Arch. Public Heal., vol. 78, no. 62, pp. 1–6, Dec. 2020.
[19]	M. Sekiyama, et al., “Double burden of malnutrition in rural West Java: Household-level analysis for father-child and mother-Child pairs and the association with dietary intake,” Nutrients, vol. 7, no. 10, pp. 8376–8391, Oct. 2015.
[20]	D. Roberts, R. Van Wyck, and N. Dhanpat, “Validation of the Thomson, Perry, and Miller (2007) collaboration instrument in the South African context,” SA Journal of Human Resource Management, vol.15, no. 0, pp. 1-11, 2017.
[21]	A.M. Thomson, J.L. Perry, and T.K. Miller, “Conceptualizing and measuring collaboration,” J. Public Adm. Res. Theory, vol. 19, no. 1, pp. 23–56, Nov. 2007.
[22]	J. Kooiman, Modern Governance: New-Government Society Relations, London: Sage, 1993.
[23]	M. Asaduzzaman, and  P. Virtanen, “Governance theories and models, In A. Farazman (eds), Global Encyclopedia of Public Administration, Public Policy, and Governance, Springer, 2016. 
[24]	J. Graham, B. Amos, and T. Plumptre, “Governance principles for protected areas in the 21st century”, Ontario, Canada: Institute on Governance, 2003.
[25]	P. Landell-Mills, and I. Serageldin, “Governance and the external factor”, The World Bank Economic Review, vol. 5, pp. 303-320, 1991.
[26]	G. Stoker, “Governance as theory: Five propositions, International Social Science Journal, vo. 50, pp. 17-28, 1998.
[27]	C. Ansell, and A. Gash, “Collaborative governance in theory and practice”, Journal of Public Administration Research and Theory, vol. 18, pp. 543-571, 2007.
[28]	L.E. Lynn Jr., C.J. Heinrich, and C.J. Hill, “Studying governance and public management: Challenges and prospects,” J. Public Adm. Res. Theory J-PART, vol. 10, no. 2, pp. 233–261, 2000.
[29]	E. Ostrom, “Beyond markets and states: Polycentric governance of complex economic systems,” Am. Econ. Rev., vol. 100, no. 3, pp. 641–672, 2010.
[30]	I. Bode and O. Firbank, “Barriers to co-governance: Examining the ‘chemistry’ of home-care networks in Germany, England, and Quebec,” Policy Stud. J., vol. 37, no. 2, pp. 325–351, 2009.
[31]	I. Blanco, V. Lowndes, and L. Pratchett, “Policy networks and governance networks: Towards greater conceptual clarity,” Polit. Stud. Rev., vol. 9, no. 3, pp. 297–308, 2011.
[32]	R.H. Dehoog, “Collaborations and partnerships across sectors: Preparing the next generation for governance,” J. Public Aff. Educ., vol. 21, no. 3, pp. 401–416, 2015","2020, October 26","[{'name': {'given': 'Feni', 'honourific': None, 'lineage': None, 'family': 'Rosalia'}, 'id': 'feni.rosalia@fisip.unila.ac.id'}, {'name': {'honourific': None, 'lineage': None, 'family': 'Wulandari', 'given': 'Jeni'}, 'id': 'jeni.wulandari@fisip.unila.ac.id'}, {'name': {'family': 'Yulianto', 'lineage': None, 'honourific': None, 'given': 'Yulianto'}, 'id': 'yulianto@fisip.unila.ac.id'}]",paper,ANNUAL INTERNATIONAL CONFERENCE ON BUSINESS AND PUBLIC ADMINISTRATION 2020,26659.0,conference,"[{'id': 'feni.rosalia@fisip.unila.ac.id', 'name': {'given': 'Feni', 'lineage': None, 'family': 'Rosalia', 'honourific': None}, 'type': 'http://www.loc.gov/loc.terms/relators/AUT'}, {'type': 'http://www.loc.gov/loc.terms/relators/AUT', 'name': {'honourific': None, 'family': 'Wulandari', 'lineage': None, 'given': 'Jeni'}, 'id': 'jeni.wulandari@fisip.unila.ac.id'}, {'id': 'yulianto@fisip.unila.ac.id', 'name': {'given': 'Yulianto', 'family': 'Yulianto', 'lineage': None, 'honourific': None}, 'type': 'http://www.loc.gov/loc.terms/relators/AUT'}]",,435-439,,,,,Universitas Brawijaya,['This research was fully funded by the Rector of the University of Lampung through the Professorship Grant scheme in 2020.'],"['Department of Government Studies, Universitas Lampung', 'Department of Business Administration, Universitas Lampung', 'Department of Public Administration, Universitas Lampung']",,Collaboration; governance; stunting; health; Lampung,,,,,"[{'url': 'https://www.atlantis-press.com/proceedings/aicobpa-20/125961287', 'type': 'org'}]",,,
26,['HB'],,http://repository.lppm.unila.ac.id/id/eprint/39495,1970-01-01 00:00:00.000002021,,['FISIP1'],Fakutas Ilmu Sosial dan Ilmu Politik UNILA,disk0/00/03/94/95,pub,7,2022-02-18 09:05:57,public,show,,archive,39495,2022-02-18 09:05:57,,"[{'language': 'en', 'rev_number': 1, 'mime_type': 'application/pdf', 'format': 'text', 'main': 'Review Analisis.pdf', 'files': [{'mtime': '2022-02-18 04:09:43', 'hash_type': 'MD5', 'uri': 'http://repository.lppm.unila.ac.id/id/file/443736', 'filename': 'Review Analisis.pdf', 'objectid': 160776, 'filesize': 677918, 'mime_type': 'application/pdf', 'hash': '5d72b204020afa3e28d49645348f2168', 'datasetid': 'document', 'fileid': 443736}], 'docid': 160776, 'security': 'public', 'pos': 1, 'uri': 'http://repository.lppm.unila.ac.id/id/document/160776', 'eprintid': 39495, 'placement': 1}]",2022-02-18 09:05:57,145,,"Penilaian Rekan Sejawat: Analisis Foreign Branding, Harga Dan Kualitas Produk Dalam Keputusan Pembelian",other,,,,,,"[{'name': {'honourific': None, 'lineage': None, 'family': 'Sarah', 'given': 'Uswatun H'}, 'id': None}, {'name': {'given': 'Wulandari', 'honourific': None, 'family': 'Jeni', 'lineage': None}, 'id': 'jeni.wulandari@fisip.unila.ac.id'}, {'id': None, 'name': {'given': 'Subagja', 'lineage': None, 'family': 'Ghia', 'honourific': None}}]",,,,,,,,,,,,,,,,,,,,,,,,
27,['H1'],published,http://repository.lppm.unila.ac.id/id/eprint/36573,2021-03-01 00:00:00.000000000,"This study aims to determine and explain the influence of brand image, product quality and service quality on
loyalty to consumers of Sonhaji Sony's Chicken Meatballs & Noodles in Bandar Lampung. This type of research
uses explanatory research with a quantitative approach. The sampling technique in this study is non-probability
sampling with a sample of 100 consumers. The data collection technique used a questionnaire with a Likert
scale. Based on the results of the research and data analysis conducted, it is known that of the three independent
variables, namely brand image, product quality and service quality, the variables that have a partially
significant effect on loyalty are the variables of service quality and product quality. While the brand image
variable has no significant effect direction toconsumer loyalty. The implementation of the results of this study is
to improve product quality and service quality at Sonhaji Sony's Chicken Meatballs & Noodles in order to create
consumer loyalty.
Keywords: Brand Image, Product Quality, Service Quality, Loyalty",['FISIP1'],Jurusan Ilmu Administrasi Bisnis,disk0/00/03/65/73,pub,6,2021-11-13 02:17:45,public,show,,archive,36573,2021-11-13 02:17:45,,"[{'language': 'en', 'rev_number': 1, 'mime_type': 'application/pdf', 'main': 'SELVI JKB.pdf', 'files': [{'fileid': 421695, 'datasetid': 'document', 'mime_type': 'application/pdf', 'hash': '29210a317d3f91dff710309df45bc565', 'hash_type': 'MD5', 'mtime': '2021-11-12 13:58:32', 'objectid': 157488, 'filesize': 1324530, 'uri': 'http://repository.lppm.unila.ac.id/id/file/421695', 'filename': 'SELVI JKB.pdf'}], 'docid': 157488, 'format': 'text', 'uri': 'http://repository.lppm.unila.ac.id/id/document/157488', 'pos': 1, 'security': 'public', 'placement': 1, 'eprintid': 36573}]",2021-11-13 02:17:45,1005,FALSE,"PENGARUH CITRA MEREK, KUALITAS PRODUK DAN KUALITAS
PELAYANAN TERHADAP LOYALITAS",article,,,https://jkb.fisip.unila.ac.id/.,,,"[{'name': {'given': 'Milasari', 'honourific': None, 'family': 'Selvi', 'lineage': None}, 'id': 'selvimilasari@gmail.com'}, {'name': {'honourific': None, 'family': 'Dian', 'lineage': None, 'given': 'Komarsyah'}, 'id': 'dian.komarsyah@fisip.unila.ac.id'}, {'name': {'given': 'Nugeraha', 'honourific': None, 'family': 'Prasetya', 'lineage': None}, 'id': 'prasetya.Nugeraha@fisip.unila.ac.id'}]",,,,,,,235-259,5.0,Jurnal Kompetitif Bisnis,2775-7781,1.0,,,,,,,,,,,,,
28,['H1'],published,http://repository.lppm.unila.ac.id/id/eprint/42411,2021-11-30 00:00:00.000000000,"This  study  aims  to  determine  the  effect  of  operating  capacity,  operating  cash  flow  and  agency  cost  on  financial distress in infrastructure, utility and transportation sector companies listed on the Indonesia Stock Exchange in 2015-2019.This  typeof  research  uses  associative  causal  with  a  quantitative  approach  and  sampling  using purposive sampling technique obtained by 12 companies for 5 years.The analysis method used in this research is panel  data  regression  analysis  using  Eviews  software.The  results  of  this  study  indicate  that  partially  operating capacity has a significant effect on financialdistress.Meanwhile, partially, operating cash flow and agency cost do not have a significant effect on financial distress.Then simultaneously operating capacity, operating cash flow and agency cost have an influence on financial distress",['FISIP1'],Jurusan Ilmu Administrasi Bisnis,disk0/00/04/24/11,pub,6,2022-06-14 01:15:44,public,show,,archive,42411,2022-06-14 01:15:44,,"[{'eprintid': 42411, 'placement': 1, 'security': 'public', 'uri': 'http://repository.lppm.unila.ac.id/id/document/164123', 'pos': 1, 'format': 'text', 'docid': 164123, 'main': '43-Article Text-295-1-10-20211213.pdf', 'files': [{'hash_type': 'MD5', 'mtime': '2022-06-13 14:01:54', 'filesize': 371060, 'objectid': 164123, 'uri': 'http://repository.lppm.unila.ac.id/id/file/466295', 'filename': '43-Article Text-295-1-10-20211213.pdf', 'datasetid': 'document', 'fileid': 466295, 'hash': '28a7a1195122a8a7080dd0b852546840', 'mime_type': 'application/pdf'}], 'language': 'en', 'mime_type': 'application/pdf', 'rev_number': 1}]",2022-06-14 01:15:44,370,TRUE,"PENGARUH OPERATING CAPACITY, OPERATING CASH FLOW DANAGENCY COSTYANG TERDAFTAR DI BURSA EFEK INDONESIA",article,,,http://jpb.fisip.unila.ac.id/index.php/jpb/issue/view/5,,,"[{'id': None, 'name': {'family': 'Septianing', 'lineage': None, 'honourific': None, 'given': 'Tuhundika'}}, {'name': {'lineage': None, 'family': 'Damayanti', 'honourific': None, 'given': '-'}, 'id': 'dame.suzuka@gmail.com'}, {'id': 'mediya.destalia@fisip.unila.ac.id', 'name': {'given': 'Mediya', 'honourific': None, 'family': 'Destalia', 'lineage': None}}, {'name': {'given': 'Damayanti', 'honourific': None, 'family': 'Damayanti', 'lineage': None}, 'id': None}]",,,,,"[{'name': {'family': 'Damayanti', 'lineage': None, 'honourific': None, 'given': 'Damayanti'}, 'type': 'http://www.loc.gov/loc.terms/relators/AUT', 'id': 'damayanti.1981@fisip.unila.ac.id'}, {'id': None, 'type': 'http://www.loc.gov/loc.terms/relators/AUT', 'name': {'family': 'Destalia', 'lineage': None, 'honourific': None, 'given': 'Mediya'}}, {'name': {'given': 'Damayanti', 'honourific': None, 'family': 'Damayanti', 'lineage': None}, 'type': None, 'id': None}, {'id': None, 'type': None, 'name': {'honourific': None, 'lineage': None, 'family': 'Damayanti', 'given': 'Damayanti'}}]",,92-103,2.0,Jurnal Perspektif Bisnis,E-ISSN: 2721-1363,4.0,,,,,,,,,,"[{'url': 'http://jpb.fisip.unila.ac.id/index.php/jpb/issue/view/5', 'type': 'pub'}]",,,
29,"['HF', 'HT']",published,http://repository.lppm.unila.ac.id/id/eprint/38594,2021-09-01 00:00:00.000000000,"This study aims to explore the social involvement impact of Micro, Small dan Medium Enterprises (MSMEs), consumers and a social community through the Corporate Social Initiative (CSI) program carried out by involving the social behaviour of consumers and community for their business sustainability in the future. This research uses a case study method with a qualitative approach, so the data collection technique is carried out by deep interviews and observations to MSME actors who implement CSI program indirectly. These informants consist of one owner, four managers, four employees and five consumers from one of the MSMEs engaged in the coffee industry. The results of this study show the important of CSI, which is a model and a solution for creating good relationships between MSMEs, consumers and social communities, it has a positive impact on the MSMEs image. The CSI program which done by MSMEs is inviting consumers to be actively involved in every social activity organized by MSMEs which collaborate with a social community. It has an impact on consumers who feel they are part of the MSMEs. MSMEs will have a very good competitive advantage for sustainability of their business.",['FISIP1'],,disk0/00/03/85/94,pub,11,2022-01-28 07:05:00,public,show,,archive,38594,2022-01-28 07:05:00,,"[{'placement': 1, 'eprintid': 38594, 'pos': 1, 'uri': 'http://repository.lppm.unila.ac.id/id/document/159702', 'security': 'public', 'main': '125961213.pdf', 'files': [{'datasetid': 'document', 'fileid': 436756, 'mime_type': 'application/pdf', 'hash': 'c81832d0dc66ea7f5f565f71d097aa0e', 'filesize': 447887, 'objectid': 159702, 'uri': 'http://repository.lppm.unila.ac.id/id/file/436756', 'filename': '125961213.pdf', 'hash_type': 'MD5', 'mtime': '2022-01-28 03:34:28'}], 'docid': 159702, 'format': 'text', 'language': 'en', 'rev_number': 1, 'mime_type': 'application/pdf'}, {'docid': 159703, 'main': 'aicobpa-20/125961213', 'files': [{'hash_type': 'MD5', 'mtime': '2022-01-28 03:35:03', 'filesize': 34894, 'objectid': 159703, 'filename': 'aicobpa-20/125961213', 'uri': 'http://repository.lppm.unila.ac.id/id/file/436759', 'fileid': 436759, 'datasetid': 'document', 'mime_type': 'text/html', 'hash': '6abb52cc2b919c97c3e192ed0d6a9712'}], 'format': 'text', 'language': 'en', 'mime_type': 'text/html', 'rev_number': 2, 'placement': 2, 'eprintid': 38594, 'pos': 2, 'uri': 'http://repository.lppm.unila.ac.id/id/document/159703', 'security': 'public'}]",2022-01-28 07:05:00,370,TRUE,"Development of Corporate Social Initiative (CSI) Model for Micro, Small and Medium Enterprises in Indonesia",conference_item,,,https://dx.doi.org/10.2991/aebmr.k.210928.004,,2020,"[{'name': {'given': 'Ghia', 'family': 'Subagja', 'lineage': None, 'honourific': None}, 'id': 'ghia.subagja@fisip.unila.ac.id'}, {'name': {'given': 'Damayanti', 'honourific': None, 'lineage': None, 'family': 'Damayanti'}, 'id': 'damayanti.1981@fisip.unila.ac.id'}, {'id': None, 'name': {'honourific': None, 'family': 'Mediya Destalia', 'lineage': None, 'given': 'Damayanti'}}, {'name': {'given': 'Damayanti', 'honourific': None, 'lineage': None, 'family': 'Damayanti'}, 'id': None}]",paper,Conference on Public and Business Administration (AICoBPA 2020),,conference,"[{'name': {'given': 'Ghia', 'lineage': None, 'family': 'Subagja', 'honourific': None}, 'type': 'http://www.loc.gov/loc.terms/relators/AUT'}, {'type': 'http://www.loc.gov/loc.terms/relators/AUT', 'name': {'lineage': None, 'family': 'Damayanti', 'honourific': None, 'given': 'Damayanti'}}, {'type': 'http://www.loc.gov/loc.terms/relators/AUT', 'name': {'family': 'Destalia', 'lineage': None, 'honourific': None, 'given': 'Mediya'}}]",,,,,,,Malang,,,,,,,,,,,,
30,['HG'],published,http://repository.lppm.unila.ac.id/id/eprint/40131,2021-11-29 00:00:00.000000000,HKI Buku Tingkat Nasional Dasar-Dasar Ilmu Manajemen,['FISIP1'],,disk0/00/04/01/31,pub,7,2022-03-11 14:20:19,public,show,,archive,40131,2022-03-11 14:20:19,,"[{'pos': 1, 'uri': 'http://repository.lppm.unila.ac.id/id/document/161432', 'security': 'public', 'placement': 1, 'eprintid': 40131, 'rev_number': 1, 'language': 'en', 'mime_type': 'application/pdf', 'main': 'Lembar Hasil Penilaian Sejawat Sebidang  dan File Untuk HKI Dasar-Dasar Ilmu Manajemen.pdf', 'docid': 161432, 'files': [{'mime_type': 'application/pdf', 'hash': 'd8d457afca647c3461d6632b4c8840ab', 'datasetid': 'document', 'fileid': 448610, 'mtime': '2022-03-11 09:46:16', 'hash_type': 'MD5', 'filename': 'Lembar Hasil Penilaian Sejawat Sebidang  dan File Untuk HKI Dasar-Dasar Ilmu Manajemen.pdf', 'uri': 'http://repository.lppm.unila.ac.id/id/file/448610', 'filesize': 313506, 'objectid': 161432}], 'format': 'text'}]",2022-03-11 14:20:19,1247,,HKI Dasar-Dasar Ilmu Manajemen,patent,,,https://books.google.co.id/books/about/DASAR_DASAR_ILMU_MANAJEMEN.html?id=2oJTEAAAQBAJ&redir_esc=y,,,"[{'name': {'given': 'Supriyanto', 'lineage': None, 'family': 'Supriyanto', 'honourific': None}, 'id': 'supriyanto.1989@fisip.unila.ac.id'}]",,,,,"[{'id': 'supriyanto.1989@fisip.unila.ac.id', 'type': 'http://www.loc.gov/loc.terms/relators/AUT', 'name': {'given': 'Supriyanto', 'honourific': None, 'lineage': None, 'family': 'Supriyanto'}}]",EC0020211118,,,,,,,,['Universitas Lampung'],,,,,,,,Hak Cipta,,
31,['HG'],published,http://repository.lppm.unila.ac.id/id/eprint/40147,2021-10-13 00:00:00.000000000,Impact of Oil Prices and Stock Returns: Evidence of Oil and Gas Mining Companies in Indonesia During the Covid-19 Period,['FISIP1'],EconJournals,disk0/00/04/01/47,pub,6,2022-03-11 14:21:34,public,show,,archive,40147,2022-03-11 14:21:34,,"[{'files': [{'hash_type': 'MD5', 'mtime': '2022-03-11 10:38:32', 'objectid': 161448, 'filesize': 338303, 'uri': 'http://repository.lppm.unila.ac.id/id/file/448710', 'filename': 'Lembar Hasil Penilaian Sejawat Sebidang  dan File Untuk Jurnal Internasional Scopus Impact of Oil Prices and Stock Returns Evidence.pdf', 'datasetid': 'document', 'fileid': 448710, 'hash': '92a50ec4fcea3617479a495479b3be44', 'mime_type': 'application/pdf'}], 'main': 'Lembar Hasil Penilaian Sejawat Sebidang  dan File Untuk Jurnal Internasional Scopus Impact of Oil Prices and Stock Returns Evidence.pdf', 'docid': 161448, 'format': 'text', 'rev_number': 1, 'language': 'en', 'mime_type': 'application/pdf', 'placement': 1, 'eprintid': 40147, 'uri': 'http://repository.lppm.unila.ac.id/id/document/161448', 'pos': 1, 'security': 'public'}]",2022-03-11 14:21:34,1247,TRUE,Jurnal Ilmiah Internasional Impact of Oil Prices and Stock Returns: Evidence of Oil and Gas Mining Companies in Indonesia During the Covid-19 Period,article,,,,,,"[{'name': {'honourific': None, 'family': 'Supriyanto', 'lineage': None, 'given': 'Supriyanto'}, 'id': 'supriyanto.1989@fisip.unila.ac.id'}]",,,,,"[{'id': 'supriyanto.1989@fisip.unila.ac.id', 'type': 'http://www.loc.gov/loc.terms/relators/AUT', 'name': {'lineage': None, 'family': 'Supriyanto', 'honourific': None, 'given': 'Supriyanto'}}]",,,6.0,International Journal of Energy Economics and Policy,2146-4553,11.0,,,['Universitas Lampung'],,,,,,,,,,
