,subjects,date_type,uri,date,abstract,divisions,publisher,dir,ispublished,rev_number,status_changed,full_text_status,metadata_visibility,editors,eprint_status,eprintid,datestamp,pages,documents,lastmod,userid,refereed,title,type,place_of_pub,contact_email,official_url,referencetext,event_dates,creators,pres_type,event_title,succeeds,event_type,contributors,id_number,pagerange,number,publication,issn,volume,event_location,funders,corp_creators,projects,keywords,note,department,institution,monograph_type,related_url,patent_applicant,isbn,book_title
32,['HG'],published,http://repository.lppm.unila.ac.id/id/eprint/40136,2021-05-01 00:00:00.000000000,Faktor-Faktor yang Dapat Mempengaruhi Corporate Social Responsibility Disclosure pada Perusahaan Perbankan,['FISIP1'],,disk0/00/04/01/36,pub,6,2022-03-11 14:20:46,public,show,,archive,40136,2022-03-11 14:20:46,,"[{'language': 'en', 'mime_type': 'application/pdf', 'rev_number': 1, 'format': 'text', 'files': [{'mtime': '2022-03-11 10:06:46', 'hash_type': 'MD5', 'uri': 'http://repository.lppm.unila.ac.id/id/file/448644', 'filename': 'Lembar Hasil Penilaian Sejawat Sebidang  dan File Untuk Jurnal Nasional Faktor-Faktor.pdf', 'filesize': 373837, 'objectid': 161437, 'mime_type': 'application/pdf', 'hash': '94da83d91d06869bda427aca40f1b2a6', 'datasetid': 'document', 'fileid': 448644}], 'main': 'Lembar Hasil Penilaian Sejawat Sebidang  dan File Untuk Jurnal Nasional Faktor-Faktor.pdf', 'docid': 161437, 'security': 'public', 'pos': 1, 'uri': 'http://repository.lppm.unila.ac.id/id/document/161437', 'eprintid': 40136, 'placement': 1}]",2022-03-11 14:20:46,1247,TRUE,"Jurnal Ilmiah Nasional ""Faktor-Faktor yang Dapat Mempengaruhi Corporate Social Responsibility Disclosure pada Perusahaan Perbankan""",article,,,,,,"[{'name': {'family': 'Supriyanto', 'lineage': None, 'honourific': None, 'given': 'Supriyanto'}, 'id': 'supriyanto.1989@fisip.unila.ac.id'}]",,,,,,,,1.0,Faktor-Faktor yang Dapat Mempengaruhi Corporate Social Responsibility Disclosure pada Perusahaan Perbankan,p-2338-1115 e-2721-1363,4.0,,,['Universitas Lampung'],,,,,,,,,,
33,['HG'],,http://repository.lppm.unila.ac.id/id/eprint/40108,1970-01-01 00:00:00.000002021,,['FISIP1'],Yayasan Penerbit Muhammad Zaini,disk0/00/04/01/08,pub,7,2022-03-11 04:11:46,public,show,,archive,40108,2022-03-11 04:11:46,,"[{'pos': 1, 'uri': 'http://repository.lppm.unila.ac.id/id/document/161397', 'security': 'public', 'placement': 1, 'eprintid': 40108, 'rev_number': 1, 'language': 'en', 'mime_type': 'application/pdf', 'main': 'Lembar Hasil Penilaian Sejawat Sebidang  dan File Untuk Buku Ilmiah Metode Penelitian Ekonomi.pdf', 'files': [{'objectid': 161397, 'filesize': 297699, 'uri': 'http://repository.lppm.unila.ac.id/id/file/448414', 'filename': 'Lembar Hasil Penilaian Sejawat Sebidang  dan File Untuk Buku Ilmiah Metode Penelitian Ekonomi.pdf', 'hash_type': 'MD5', 'mtime': '2022-03-11 03:27:20', 'fileid': 448414, 'datasetid': 'document', 'mime_type': 'application/pdf', 'hash': '45d20561fd303fc39c93c9f5866a9ae7'}], 'docid': 161397, 'format': 'text'}]",2022-03-11 04:11:46,1247,TRUE,Metode Penelitian Ekonomi,book,,,,,,"[{'name': {'given': 'Supriyanto', 'honourific': None, 'family': 'Supriyanto', 'lineage': None}, 'id': 'supriyanto.1989@fisip.unila.ac.id'}]",,,,,,,,,,,,,,['Universitas Lampung'],,,,,,,,,978-623-97420-2-7,
34,['HG'],,http://repository.lppm.unila.ac.id/id/eprint/40112,1970-01-01 00:00:00.000002021,"Operasi Bisnis adalah Sebuah buku yang mampu membantu
mahasiswa yang mengalami kesulitan dalam memecahkan soalsoal
yang
diujikan
dalam

matakuliah operasi bisnis. Kesulitan ini
terutama disebabkan mereka tidak mempunyai pola dan sikap
pikir dalam melakukan pendekatan terhadap soal-soal yang
dihadapinya.",['FISIP1'],CV.Pena Persada,disk0/00/04/01/12,pub,7,2022-03-11 04:11:52,public,show,,archive,40112,2022-03-11 04:11:52,,"[{'uri': 'http://repository.lppm.unila.ac.id/id/document/161401', 'pos': 1, 'security': 'public', 'placement': 1, 'eprintid': 40112, 'mime_type': 'application/pdf', 'language': 'en', 'rev_number': 1, 'files': [{'objectid': 161401, 'filesize': 297419, 'filename': 'Lembar Hasil Penilaian Sejawat Sebidang  dan File Untuk Buku Ilmiah Operasi Bisnis.pdf', 'uri': 'http://repository.lppm.unila.ac.id/id/file/448445', 'hash_type': 'MD5', 'mtime': '2022-03-11 03:44:12', 'datasetid': 'document', 'fileid': 448445, 'hash': 'f579ed299b59b9d303f1813b280238c4', 'mime_type': 'application/pdf'}], 'main': 'Lembar Hasil Penilaian Sejawat Sebidang  dan File Untuk Buku Ilmiah Operasi Bisnis.pdf', 'docid': 161401, 'format': 'text'}]",2022-03-11 04:11:52,1247,TRUE,Operasi Bisnis (Latihan Pemecahan Soal),book,,,,,,"[{'name': {'given': 'Supriyanto', 'honourific': None, 'family': 'Supriyanto', 'lineage': None}, 'id': 'supriyanto.1989@fisip.unila.ac.id'}]",,,,,"[{'name': {'given': 'Supriyanto', 'honourific': None, 'lineage': None, 'family': 'Supriyanto'}, 'type': 'http://www.loc.gov/loc.terms/relators/AUT', 'id': 'supriyanto.1989@fisip.unila.ac.id'}]",,,,,,,,,['Universitas Lampung'],,,,,,,,,978-623-315-591-5,
35,['HG'],,http://repository.lppm.unila.ac.id/id/eprint/40115,1970-01-01 00:00:00.000002021,"Buku ini merupakan karya kolaboratif dosen lintas perguruan
tinggi. Hadirnya buku ini merupakan bentuk perhatian para
akademisi mengenai pendidikan di Indonesia. Diharapkan
dengan adanya buku ini, bisa berkontribusi dalam memajukan
pendidikan di negeri tercinta ini melalui pandangan-pandangan
kritis dan solutif.",['FISIP1'],Dotplus Publisher,disk0/00/04/01/15,pub,7,2022-03-11 14:17:50,public,show,,archive,40115,2022-03-11 14:17:50,,"[{'placement': 1, 'eprintid': 40115, 'pos': 1, 'uri': 'http://repository.lppm.unila.ac.id/id/document/161403', 'security': 'public', 'main': 'Lembar Hasil Penilaian Sejawat Sebidang  dan File Untuk Buku Ilmiah Pengantar Ilmu Pendidikan.pdf', 'files': [{'datasetid': 'document', 'fileid': 448474, 'hash': '15336e4da667da7b8c56a0f42cce96a9', 'mime_type': 'application/pdf', 'hash_type': 'MD5', 'mtime': '2022-03-11 04:43:17', 'filesize': 296891, 'objectid': 161403, 'uri': 'http://repository.lppm.unila.ac.id/id/file/448474', 'filename': 'Lembar Hasil Penilaian Sejawat Sebidang  dan File Untuk Buku Ilmiah Pengantar Ilmu Pendidikan.pdf'}], 'docid': 161403, 'format': 'text', 'language': 'en', 'rev_number': 1, 'mime_type': 'application/pdf'}]",2022-03-11 14:17:50,1247,TRUE,Pengantar Ilmu Pendidikan,book,,,,,,"[{'id': 'supriyanto.1989@fisip.unila.ac.id', 'name': {'given': 'Supriyanto', 'honourific': None, 'family': 'Supriyanto', 'lineage': None}}]",,,,,"[{'type': 'http://www.loc.gov/loc.terms/relators/AUT', 'name': {'lineage': None, 'family': 'Supriyanto', 'honourific': None, 'given': 'Supriyanto'}, 'id': 'supriyanto.1989@fisip.unila.ac.id'}]",,,,,,,,,['Universitas Lampung'],,,,,,,,,978-623-6428-07-8,
36,['HG'],,http://repository.lppm.unila.ac.id/id/eprint/40116,1970-01-01 00:00:00.000002021,"Buku ajar ini memuat informasi tentang metode, prosedur, dan teknik yang dapat
diterapkan dalam memahami perpajakan. Penyajian bagian alir dan contoh-contoh
penerapan dalam buku ini membantu untuk menjelaskan konsep yang rumit agar
menjadi lebih mudah dimengerti oleh mahasiswa sebagai bahan kajian dalam
menambah wawasan dan pengetahuan tentang perpajakan. Urutan penulisan yang
disesuaikan dengan pemahaman dasar sampai studi kasus dan contoh perhitungan
pajak juga memudahkan mahasiswa untuk mempelajari buku ini.",['FISIP1'],Pustaka Aksara,disk0/00/04/01/16,pub,7,2022-03-11 14:17:58,public,show,,archive,40116,2022-03-11 14:17:58,,"[{'eprintid': 40116, 'placement': 1, 'security': 'public', 'pos': 1, 'uri': 'http://repository.lppm.unila.ac.id/id/document/161404', 'format': 'text', 'files': [{'hash_type': 'MD5', 'mtime': '2022-03-11 04:47:39', 'filesize': 297332, 'objectid': 161404, 'uri': 'http://repository.lppm.unila.ac.id/id/file/448481', 'filename': 'Lembar Hasil Penilaian Sejawat Sebidang  dan File Untuk Buku Ilmiah Pengantar Perpajakan.pdf', 'fileid': 448481, 'datasetid': 'document', 'hash': 'e111f111e95636fae13ea8c0ea4b80f0', 'mime_type': 'application/pdf'}], 'main': 'Lembar Hasil Penilaian Sejawat Sebidang  dan File Untuk Buku Ilmiah Pengantar Perpajakan.pdf', 'docid': 161404, 'mime_type': 'application/pdf', 'language': 'en', 'rev_number': 1}]",2022-03-11 14:17:58,1247,TRUE,Pengantar Perpajakan,book,,,,,,"[{'name': {'given': 'Supriyanto', 'honourific': None, 'lineage': None, 'family': 'Supriyanto'}, 'id': 'supriyanto.1989@fisip.unila.ac.id'}]",,,,,"[{'name': {'honourific': None, 'lineage': None, 'family': 'Supriyanto', 'given': 'Supriyanto'}, 'type': 'http://www.loc.gov/loc.terms/relators/AUT', 'id': 'supriyanto.1989@fisip.unila.ac.id'}]",,,,,,,,,['Universitas Lampung'],,,,,,,,,978-623-6168-84-4,
37,['HG'],published,http://repository.lppm.unila.ac.id/id/eprint/40133,2021-02-15 00:00:00.000000000,HKI Buku Tingkat Nasional Mengetik Cepat,['FISIP1'],,disk0/00/04/01/33,pub,7,2022-03-11 14:20:31,public,show,,archive,40133,2022-03-11 14:20:31,,"[{'docid': 161434, 'main': 'Lembar Hasil Penilaian Sejawat Sebidang  dan File Untuk HKI Mengetik Cepat.pdf', 'files': [{'fileid': 448624, 'datasetid': 'document', 'hash': '11df669278a0c503d7718b210a75bbf2', 'mime_type': 'application/pdf', 'hash_type': 'MD5', 'mtime': '2022-03-11 09:54:27', 'objectid': 161434, 'filesize': 312807, 'uri': 'http://repository.lppm.unila.ac.id/id/file/448624', 'filename': 'Lembar Hasil Penilaian Sejawat Sebidang  dan File Untuk HKI Mengetik Cepat.pdf'}], 'format': 'text', 'language': 'en', 'rev_number': 1, 'mime_type': 'application/pdf', 'placement': 1, 'eprintid': 40133, 'pos': 1, 'uri': 'http://repository.lppm.unila.ac.id/id/document/161434', 'security': 'public'}]",2022-03-11 14:20:31,1247,,HKI Mengetik Cepat,patent,,,http://repository.lppm.unila.ac.id/27882/1/Mengetik%20Cepat%20Menggunakan%2010%20Jari_FullText.pdf,,,"[{'name': {'lineage': None, 'family': 'Supriyanto', 'honourific': None, 'given': 'Supriyanto'}, 'id': 'supriyanto.1989@fisip.unila.ac.id'}, {'name': {'given': 'Putri Irmala Sari', 'honourific': None, 'family': 'Putri Irmala Sari', 'lineage': None}, 'id': 'putri.irmalasari@gmail.com'}]",,,,,"[{'id': 'supriyanto.1989@fisip.unila.ac.id', 'name': {'given': 'Supriyanto', 'honourific': None, 'family': 'Supriyanto', 'lineage': None}, 'type': 'http://www.loc.gov/loc.terms/relators/AUT'}]",EC0020211136,,,,,,,,['Universitas Lampung'],,,,,,,,Hak Cipta,,
38,['HG'],published,http://repository.lppm.unila.ac.id/id/eprint/40151,1970-01-01 00:00:00.000002021,"Impact of Green Innovation, Cultural Environment, Company Performance During Covid-19",['FISIP1'],,disk0/00/04/01/51,pub,6,2022-03-11 14:21:54,public,show,,archive,40151,2022-03-11 14:21:54,,"[{'security': 'public', 'uri': 'http://repository.lppm.unila.ac.id/id/document/161452', 'pos': 1, 'eprintid': 40151, 'placement': 1, 'mime_type': 'application/pdf', 'language': 'en', 'rev_number': 1, 'format': 'text', 'main': 'Lembar Hasil Penilaian Sejawat Sebidang  dan File Untuk Prosiding Impact of Green Innovation, Cultural Environment.pdf', 'docid': 161452, 'files': [{'hash': '0e54d8ce21a5b486eab5b7340f7640a2', 'mime_type': 'application/pdf', 'datasetid': 'document', 'fileid': 448734, 'filename': 'Lembar Hasil Penilaian Sejawat Sebidang  dan File Untuk Prosiding Impact of Green Innovation, Cultural Environment.pdf', 'uri': 'http://repository.lppm.unila.ac.id/id/file/448734', 'filesize': 383490, 'objectid': 161452, 'mtime': '2022-03-11 10:49:26', 'hash_type': 'MD5'}]}]",2022-03-11 14:21:54,1247,TRUE,"Jurnal Ilmiah Internasional Impact of Green Innovation, Cultural Environment, Company Performance During Covid-19",article,,,,,,"[{'name': {'family': 'Supriyanto', 'lineage': None, 'honourific': None, 'given': 'Supriyanto'}, 'id': 'supriyanto.1989@fisip.unila.ac.id'}, {'id': 'putri.irmalasari@gmail.com', 'name': {'family': 'Putri Irmala Sari', 'lineage': None, 'honourific': None, 'given': 'Putri Irmala Sari'}}]",,,,,"[{'id': 'supriyanto.1989@fisip.unila.ac.id', 'type': 'http://www.loc.gov/loc.terms/relators/AUT', 'name': {'given': 'Supriyanto', 'lineage': None, 'family': 'Supriyanto', 'honourific': None}}]",,,,"Impact of Green Innovation, Cultural Environment, Company Performance During Covid-19",978-94-6239-477-3,,,,['Universitas Lampung'],,,,,,,,,,
39,['HG'],,http://repository.lppm.unila.ac.id/id/eprint/40106,1970-01-01 00:00:00.000002021,"Buku fisika smp untuk kelas 7, 8 dan 9 ini merupakan buku 
yang dapat digunakan sebagai bahan ajar mata pelajaran Fisika
untuk siswa di Sekolah Menengah Pertama (SMP) dan Madrasah
Tsanawiyah (MTs). Buku ini memenuhi kebutuhan pembelajaran
IPA Terpaduyang membangun siswa agar memiliki sikap
ilmiah, objektif, jujur, berfikir kritis, bisa bekerjasama maupun
bekerja mandiri.",['FISIP1'],Bintang Pustaka Madani,disk0/00/04/01/06,pub,8,2022-03-11 04:11:41,public,show,,archive,40106,2022-03-11 04:11:41,,"[{'security': 'public', 'pos': 1, 'uri': 'http://repository.lppm.unila.ac.id/id/document/161395', 'eprintid': 40106, 'placement': 1, 'language': 'en', 'mime_type': 'application/pdf', 'rev_number': 1, 'format': 'text', 'main': 'Lembar Hasil Penilaian Sejawat Sebidang  dan File Untuk Buku Ilmiah Materi Fisika.pdf', 'files': [{'mtime': '2022-03-11 03:17:58', 'hash_type': 'MD5', 'uri': 'http://repository.lppm.unila.ac.id/id/file/448392', 'filename': 'Lembar Hasil Penilaian Sejawat Sebidang  dan File Untuk Buku Ilmiah Materi Fisika.pdf', 'objectid': 161395, 'filesize': 297705, 'mime_type': 'application/pdf', 'hash': '4f65a84d94f74604a4441f4935349118', 'fileid': 448392, 'datasetid': 'document'}], 'docid': 161395}]",2022-03-11 04:11:41,1247,TRUE,Materi Fisika SMP,book_section,,,,,,"[{'id': 'supriyanto.1989@fisip.unila.ac.id', 'name': {'given': 'Supriyanto', 'honourific': None, 'family': 'Supriyanto', 'lineage': None}}, {'name': {'family': 'Putri Irmala Sari', 'lineage': None, 'honourific': None, 'given': 'Putri Irmala Sari'}, 'id': 'putri.irmalasari@gmail.com'}]",,,,,,,,,,,,,,['Universitas Lampung'],,,,,,,,,978-623-6209-90-5,"Materi Fisika SMP Kelas 7, 8 dan 9"
40,['HG'],,http://repository.lppm.unila.ac.id/id/eprint/40107,1970-01-01 00:00:00.000002021,"Mengetik Cepat adalah mata kuliah wajib bagi semua
program studi di Perguruan Tinggi dari berbagai jenjang baik
akademi, sekolah tinggi, insitut maupun universitas. Masing-masainh
program
studi
mendapatkan
matakuliah mengetik

cepat
dengan nama yang berbeda-beda
disesuaikan dengan

bidang
ilmu yang ditekuni, seperti mengetik cepat,
komputer
sekretaris,
Typing dan lain sebagainya.",['FISIP1'],Bintang Pustaka Madani,disk0/00/04/01/07,pub,7,2022-03-11 04:11:43,public,show,,archive,40107,2022-03-11 04:11:43,,"[{'placement': 1, 'eprintid': 40107, 'uri': 'http://repository.lppm.unila.ac.id/id/document/161396', 'pos': 1, 'security': 'public', 'main': 'Lembar Hasil Penilaian Sejawat Sebidang  dan File Untuk Buku Ilmiah Mengetik Cepat.pdf', 'docid': 161396, 'files': [{'datasetid': 'document', 'fileid': 448406, 'hash': '39e754c87b7b215ba71a0f394f8db12f', 'mime_type': 'application/pdf', 'hash_type': 'MD5', 'mtime': '2022-03-11 03:22:15', 'filesize': 297556, 'objectid': 161396, 'uri': 'http://repository.lppm.unila.ac.id/id/file/448406', 'filename': 'Lembar Hasil Penilaian Sejawat Sebidang  dan File Untuk Buku Ilmiah Mengetik Cepat.pdf'}], 'format': 'text', 'mime_type': 'application/pdf', 'language': 'en', 'rev_number': 1}]",2022-03-11 04:11:43,1247,TRUE,Mengetik Cepat,book_section,,,,,,"[{'name': {'given': 'Supriyanto', 'family': 'Supriyanto', 'lineage': None, 'honourific': None}, 'id': 'supriyanto.1989@fisip.unila.ac.id'}, {'name': {'honourific': None, 'lineage': None, 'family': 'Putri Irmala Sari', 'given': 'Putri Irmala Sari'}, 'id': 'putri.irmalasari@gmail.com'}]",,,,,,,,,,,,,,['Universitas Lampung'],,,,,,,,,978-623-6786-91-8,Mengetik Cepat
41,"['HB', 'HG']",,http://repository.lppm.unila.ac.id/id/eprint/27421,2021-01-06 00:00:00.000000000,"Akuntansi Bisnis adalah proses yang mengolah data-data keuangan perusahaan atau bisnis menjadi laporan keuangan untuk dikomunikasikan kepada para penggunanya  yang sering disebut stakeholder.
Proses Akuntansi meliputi kegiaatan identifikasi transaksi, pencatatan dan penyusunan laporan keuangan yang dilakukan secara berulang sehingga membentuk suatu siklus setiap periodenya.
Kegiatan identifikasi dan pencatatan dilakukan setiap terjadi kejadian ekonomi yang mempengaruhi posisi keuangan perusahaan atau disebut sebagai transaksi. Sedangkan kegiatan penyusunan laporan keuangan dilakukan setiap akhir periode yang ditentukan oleh perusahaan dapat mingguan, bulanan, triwulan, semesteran dan umumnya tahunan.",['FISIP1'],PUSTAKA AKSARA,disk0/00/02/74/21,pub,8,2021-01-22 02:56:49,public,show,,archive,27421,2021-01-22 02:56:49,,"[{'eprintid': 27421, 'placement': 1, 'security': 'public', 'uri': 'http://repository.lppm.unila.ac.id/id/document/41425', 'pos': 1, 'format': 'text', 'main': 'AKUNTANSI BISNIS TERAPAN.pdf', 'files': [{'filename': 'AKUNTANSI BISNIS TERAPAN.pdf', 'uri': 'http://repository.lppm.unila.ac.id/id/file/245224', 'objectid': 41425, 'filesize': 239430, 'mtime': '2021-01-22 02:06:19', 'hash_type': 'MD5', 'mime_type': 'application/pdf', 'hash': '1ac5008046ee4e312daab9a28ac353a3', 'fileid': 245224, 'datasetid': 'document'}], 'docid': 41425, 'language': 'en', 'rev_number': 1, 'mime_type': 'application/pdf'}]",2021-01-22 02:56:49,1247,TRUE,AKUNTANSI BISNIS TERAPAN,book,,,https://scholar.google.co.id/citations?user=QnZJcFUAAAAJ&hl=id,,,"[{'name': {'family': 'Supriyanto', 'lineage': None, 'honourific': None, 'given': 'Supriyanto'}, 'id': 'supriyanto.1989@fisip.unila.ac.id'}, {'id': 'putri.irmalasari@gmail.com', 'name': {'lineage': None, 'family': 'Putri Irmala Sari', 'honourific': None, 'given': 'Putri Irmala Sari'}}, {'id': 'riptounila@gmail.com', 'name': {'family': 'Suripto', 'lineage': None, 'honourific': None, 'given': 'Suripto'}}]",,,,,,,,,,,,,,['Universitas Lampung'],,,,,,,,,978-623-95464-8-9,
42,['HG'],,http://repository.lppm.unila.ac.id/id/eprint/40118,1970-01-01 00:00:00.000002021,"Buku ajar ini memuat informasi tentang metode, prosedur, dan teknik yang dapat
diterapkan dalam memahami perpajakan. Penyajian bagian alir dan contoh-contoh
penerapan dalam buku ini membantu untuk menjelaskan konsep yang rumit agar
menjadi lebih mudah dimengerti oleh mahasiswa sebagai bahan kajian dalam
menambah wawasan dan pengetahuan tentang perpajakan. Urutan penulisan yang
disesuaikan dengan pemahaman dasar sampai studi kasus dan contoh perhitungan
pajak juga memudahkan mahasiswa untuk mempelajari buku ini.",['FISIP1'],Pustaka Aksara,disk0/00/04/01/18,pub,7,2022-03-11 14:18:21,public,show,,archive,40118,2022-03-11 14:18:21,,"[{'format': 'text', 'docid': 161406, 'main': 'Lembar Hasil Penilaian Sejawat Sebidang Untuk Buku Ilmiah Akuntansi Bisnis Terapan.pdf', 'files': [{'filesize': 297988, 'objectid': 161406, 'uri': 'http://repository.lppm.unila.ac.id/id/file/448496', 'filename': 'Lembar Hasil Penilaian Sejawat Sebidang Untuk Buku Ilmiah Akuntansi Bisnis Terapan.pdf', 'hash_type': 'MD5', 'mtime': '2022-03-11 04:52:47', 'datasetid': 'document', 'fileid': 448496, 'mime_type': 'application/pdf', 'hash': '4c678af245bcb03671f79f70b4d9c0f0'}], 'rev_number': 1, 'language': 'en', 'mime_type': 'application/pdf', 'eprintid': 40118, 'placement': 1, 'security': 'public', 'uri': 'http://repository.lppm.unila.ac.id/id/document/161406', 'pos': 1}]",2022-03-11 14:18:21,1247,TRUE,Akuntansi Bisnis Terapan,book,,,,,,"[{'id': 'supriyanto.1989@fisip.unila.ac.id', 'name': {'honourific': None, 'lineage': None, 'family': 'Supriyanto', 'given': 'Supriyanto'}}, {'id': 'putri.irmalasari@gmail.com', 'name': {'given': 'Putri Irmala Sari', 'honourific': None, 'lineage': None, 'family': 'Putri Irmala Sari'}}, {'name': {'family': 'Suripto', 'lineage': None, 'honourific': None, 'given': 'Suripto'}, 'id': 'riptounila@gmail.com'}]",,,,,"[{'name': {'family': 'Supriyanto', 'lineage': None, 'honourific': None, 'given': 'Supriyanto'}, 'type': 'http://www.loc.gov/loc.terms/relators/AUT', 'id': 'supriyanto.1989@fisip.unila.ac.id'}]",,,,,,,,,['Universitas Lampung'],,,,,,,,,978-623-95464-8-9,
43,['HG'],published,http://repository.lppm.unila.ac.id/id/eprint/40150,1970-01-01 00:00:00.000002021,Implementation of Forecasting Hedging Model During the Covid-19 Pandemic with the Event Windows Approch to Asean Stock Prices 6,['FISIP1'],,disk0/00/04/01/50,pub,6,2022-03-11 14:21:46,public,show,,archive,40150,2022-03-11 14:21:46,,"[{'format': 'text', 'files': [{'mtime': '2022-03-11 10:46:07', 'hash_type': 'MD5', 'uri': 'http://repository.lppm.unila.ac.id/id/file/448728', 'filename': 'Lembar Hasil Penilaian Sejawat Sebidang  dan File Untuk Prosiding Hedging.pdf', 'filesize': 386086, 'objectid': 161451, 'hash': 'bc3f35bbf0738a29ba46a88bd507b12a', 'mime_type': 'application/pdf', 'datasetid': 'document', 'fileid': 448728}], 'main': 'Lembar Hasil Penilaian Sejawat Sebidang  dan File Untuk Prosiding Hedging.pdf', 'docid': 161451, 'language': 'en', 'mime_type': 'application/pdf', 'rev_number': 1, 'eprintid': 40150, 'placement': 1, 'security': 'public', 'pos': 1, 'uri': 'http://repository.lppm.unila.ac.id/id/document/161451'}]",2022-03-11 14:21:46,1247,TRUE,Jurnal Ilmiah Internasional Implementation of Forecasting Hedging Model During the Covid-19 Pandemic with the Event Windows Approch to Asean Stock Prices 6,article,,,,,,"[{'name': {'honourific': None, 'lineage': None, 'family': 'Supriyanto', 'given': 'Supriyanto'}, 'id': 'supriyanto.1989@fisip.unila.ac.id'}, {'id': 'putri.irmalasari@gmail.com', 'name': {'honourific': None, 'family': 'Putri Irmala Sari', 'lineage': None, 'given': 'Putri Irmala Sari'}}, {'id': 'maulana.agung@fisip.unila.ac.id', 'name': {'honourific': None, 'lineage': None, 'family': 'maulana agung', 'given': 'pratama'}}]",,,,,"[{'id': 'supriyanto.1989@fisip.unila.ac.id', 'type': 'http://www.loc.gov/loc.terms/relators/AUT', 'name': {'family': 'Supriyanto', 'lineage': None, 'honourific': None, 'given': 'Supriyanto'}}]",,,,Implementation of Forecasting Hedging Model During the Covid-19 Pandemic with the Event Windows Approch to Asean Stock Prices 6,978-94-6239-509-1,,,,['Universitas Lampung'],,,,,,,,,,
44,['H1'],,http://repository.lppm.unila.ac.id/id/eprint/37328,1970-01-01 00:00:00.000002021,"The purpose of this study is to determine the awareness of oil and gas companies who are involved in inexperienced
innovation practices and have an impact on corporation performance. Especially from the effect on the cultural
environment on corporation performance, with inexperienced innovation as a mediating variable for oil and gas
corporations listed on the Indonesia Stock Exchange in 2019-2021 for the period of the Covid-19 pandemic. The
populace in this study are oil and fuel corporations listed on the IDX. The method used in this research is quantitative.
The statistics gathered have been 10 oil and gas companies 2019-2021. The results of this study indicate that the
cultural surroundings have a fantastic effect and are confirmed to have a sizable impact on agency overall
performance which is mediated by green innovation. The originality of this research includes: the use of green
innovation via oil and fuel groups all through the Covid-19 pandemic as a mediator - something that has never been
done with the aid of different researchers, specifically in Indonesia; dimension the usage of most important records on
an ordinal scale, and inspecting oil and gas corporations. 
Keywords: Green Innovation, Environment Culture, The Performance of Oil and Gas Companies, Covid-19.",['FISIP1'],,disk0/00/03/73/28,pub,8,2021-12-16 10:16:06,public,show,,archive,37328,2021-12-16 10:16:06,,"[{'uri': 'http://repository.lppm.unila.ac.id/id/document/158232', 'pos': 1, 'security': 'public', 'placement': 1, 'eprintid': 37328, 'mime_type': 'application/pdf', 'language': 'en', 'rev_number': 1, 'main': 'Ilicos (2).pdf', 'files': [{'fileid': 427139, 'datasetid': 'document', 'mime_type': 'application/pdf', 'hash': 'fd1b2d998179c601daef00832276f885', 'hash_type': 'MD5', 'mtime': '2021-12-16 01:51:33', 'objectid': 158232, 'filesize': 403887, 'filename': 'Ilicos (2).pdf', 'uri': 'http://repository.lppm.unila.ac.id/id/file/427139'}], 'docid': 158232, 'format': 'text'}]",2021-12-16 10:16:06,639,TRUE,"Impact of Green Innovation, Cultural Environment,
Company Performance During Covid-19",conference_item,,,,,,"[{'id': 'supriyanto.1989@fisip.unila.ac.id', 'name': {'given': 'Supriyanto', 'family': 'Supriyanto', 'lineage': None, 'honourific': None}}, {'name': {'family': 'suripto', 'lineage': None, 'honourific': None, 'given': 'suripto'}, 'id': None}, {'id': None, 'name': {'given': 'Mohammad', 'lineage': None, 'family': 'Benny', 'honourific': None}}, {'name': {'given': 'Putri Irmala', 'honourific': None, 'lineage': None, 'family': 'Sari'}, 'id': None}]",paper,2nd International Indonesia Conference on Interdisciplinary Studies (IICIS 2021),,conference,,,,,,,,,,,,,,,,,,,,
