,subjects,date_type,uri,date,abstract,divisions,publisher,dir,ispublished,rev_number,status_changed,full_text_status,metadata_visibility,editors,eprint_status,eprintid,datestamp,pages,documents,lastmod,userid,refereed,title,type,place_of_pub,contact_email,official_url,referencetext,event_dates,creators,pres_type,event_title,succeeds,event_type,contributors,id_number,pagerange,number,publication,issn,volume,event_location,funders,corp_creators,projects,keywords,note,department,institution,monograph_type,related_url,patent_applicant,isbn,book_title
16,['HD28'],published,http://repository.lppm.unila.ac.id/id/eprint/36590,2021-05-31 00:00:00.000000000,"This study examines purchasing decisions of The Executive product, viewed from the aspect of
foreig branding, price, and product quality in the perspective of consumer behavior. A quantitative
approach was applied, using a questionnaire to 400 respondents. The sampling technique using
purposive sampling. Data were analyzed using multiple linear regression analysis. The results of
the study indicated that foreign branding, price, and product quality influence purchasing
decisions partially and simultaneously had positive and significant effect on purchasing decision.
The highest effect in this study was product quality, with comfort and quality of raw material which
the main factor need to be maintened because they determined the purchasing decision of The
Executive as a fashion product",['FISIP1'],FISIP Unila,disk0/00/03/65/90,pub,12,2021-11-13 02:18:28,public,show,,archive,36590,2021-11-13 02:18:28,,"[{'security': 'public', 'uri': 'http://repository.lppm.unila.ac.id/id/document/157500', 'pos': 1, 'eprintid': 36590, 'placement': 1, 'language': 'en', 'mime_type': 'application/pdf', 'rev_number': 1, 'format': 'text', 'main': 'document.pdf', 'docid': 157500, 'files': [{'hash_type': 'MD5', 'mtime': '2021-11-12 16:28:34', 'filesize': 916565, 'objectid': 157500, 'uri': 'http://repository.lppm.unila.ac.id/id/file/421785', 'filename': 'document.pdf', 'fileid': 421785, 'datasetid': 'document', 'mime_type': 'application/pdf', 'hash': 'a15ce50072f11bcfc1be624ac487ab73'}]}]",2021-11-13 02:18:28,145,FALSE,"ANALISIS FOREIGN BRANDING, HARGA DAN KUALITAS
PRODUK DALAM KEPUTUSAN PEMBELIAN",article,,,http://jpb.unila.ac.id,,,"[{'id': 'sarahuswatunhasanah@gmail.com', 'name': {'given': 'Sarah Uswatun', 'lineage': None, 'family': 'Hasanah', 'honourific': None}}, {'id': 'jeni.wulandari@fisip.unila.ac.id', 'name': {'given': 'Jeni', 'family': 'Wulandari', 'lineage': None, 'honourific': None}}, {'id': 'ghia.subagja@fisip.unila.ac.id', 'name': {'honourific': None, 'family': 'Subagja', 'lineage': None, 'given': 'Ghia'}}]",,,,,,https://doi.org/10.23960/jpb.v4i1,1-13,1.0,Perspektif Bisnis,2721-1363,4.0,,,"['Jurusan Ilmu Administrasi Bisnis, Fakultas Ilmu Sosial dan Politik, Universitas Lampung', 'Jurusan Ilmu Administrasi Bisnis, Fakultas Ilmu Sosial dan Politik, Universitas Lampung', 'Jurusan Ilmu Administrasi Bisnis, Fakultas Ilmu Sosial dan Politik, Universitas Lampung']",,,,,,,"[{'type': 'pub', 'url': 'http://jpb.fisip.unila.ac.id/index.php/jpb/article/view/25'}]",,,
17,['H1'],,http://repository.lppm.unila.ac.id/id/eprint/39497,1970-01-01 00:00:00.000002021,,['FISIP1'],Atlantis Press,disk0/00/03/94/97,pub,10,2022-02-18 09:06:00,public,show,,archive,39497,2022-02-18 09:06:00,,"[{'mime_type': 'application/pdf', 'language': 'en', 'rev_number': 1, 'main': 'Review Green.pdf', 'files': [{'filesize': 746765, 'objectid': 160777, 'uri': 'http://repository.lppm.unila.ac.id/id/file/443743', 'filename': 'Review Green.pdf', 'hash_type': 'MD5', 'mtime': '2022-02-18 04:15:18', 'fileid': 443743, 'datasetid': 'document', 'mime_type': 'application/pdf', 'hash': '9fd7b4c0d4c9543109229def6ea022e6'}], 'docid': 160777, 'format': 'text', 'uri': 'http://repository.lppm.unila.ac.id/id/document/160777', 'pos': 1, 'security': 'public', 'placement': 1, 'eprintid': 39497}]",2022-02-18 09:06:00,145,,Penilaian Rekan Sejawat: Green Products Image in the Perspective of Young Consumer,other,,,,,,"[{'name': {'honourific': None, 'lineage': None, 'family': 'Irma', 'given': 'Ramadhani'}, 'id': None}, {'id': 'jeni.wulandari@fisip.unila.ac.id', 'name': {'lineage': None, 'family': 'Jeni', 'honourific': None, 'given': 'Wulandari'}}, {'id': None, 'name': {'given': 'Subagja', 'family': 'Ghia', 'lineage': None, 'honourific': None}}]",,,,,,,,,,,,,,,,,,,,,,,,
18,['HG'],published,http://repository.lppm.unila.ac.id/id/eprint/38216,2021-11-01 00:00:00.000000000,"Penelitian ini bertujuan untuk mengetahui dan menganalisis pengaruh implementasi good corporate governance, corporate social responsibility, dan leverage terhadap nilai perusahaan. Jenis penelitian yang digunakan yaitu statistik deskriptif dengan pendekatan penelitian kuantitatif. Teknik pengambilan sampel penelitian ini menggunakan purposive sampling. Sampel dalam penelitian ini berjumlah 8 perusahaan dengan waktu pengamatan 4 tahun. Teknik analisis data yang digunakan dalam penelitian ini adalah analisis regresi data panel. Hasil penelitian ini menunjukan bahwa secara parsial GCG dan DER (leverage) berpengaruh negatif tidak signifikan terhadap nilai perusahaan, Namun, CSR berpengaruh negatif signifikan terhadap nilai perusahaan. Walaupun demikian, secara simultan GCG, CSR, dan Leverage (DER) berpengaruh signifikan terhadap nilai perusahaan.",['FISIP1'],,disk0/00/03/82/16,pub,6,2022-01-24 01:15:38,public,show,,archive,38216,2022-01-24 01:15:38,,"[{'placement': 1, 'eprintid': 38216, 'uri': 'http://repository.lppm.unila.ac.id/id/document/159228', 'pos': 1, 'security': 'public', 'files': [{'filename': 'Jurnal CSR Widia & Aku.pdf', 'uri': 'http://repository.lppm.unila.ac.id/id/file/433746', 'filesize': 340449, 'objectid': 159228, 'mtime': '2022-01-21 14:49:14', 'hash_type': 'MD5', 'hash': 'f5065e168240e7045ae11fac3f980b8b', 'mime_type': 'application/pdf', 'fileid': 433746, 'datasetid': 'document'}], 'main': 'Jurnal CSR Widia & Aku.pdf', 'docid': 159228, 'format': 'text', 'rev_number': 1, 'language': 'en', 'mime_type': 'application/pdf'}]",2022-01-24 01:15:38,170,TRUE,"ANALISIS NILAI PERUSAHAAN YANG DIPENGARUHI OLEH GOOD CORPORATE GOVERNANCE, CORPORATE SOCIAL RESPONSIBILITY, DAN LEVERAGE",article,,,,,,"[{'id': 'widiaayuninglestari@gmail.com', 'name': {'given': 'Widia Ayuning', 'family': 'Lestari', 'lineage': None, 'honourific': None}}, {'name': {'given': 'Kussuyatmono Bagus', 'lineage': None, 'family': 'Wardianto', 'honourific': None}, 'id': 'kussuyatmono.bagus@fisip.unila.ac.id'}, {'id': None, 'name': {'given': 'M. Iqbal', 'lineage': None, 'family': 'Harori', 'honourific': None}}]",,,,,,,126-137,2.0,Jurnal Perspektif Bisnis,2721-1363,4.0,,,,,,,,,,,,,
19,['AC'],published,http://repository.lppm.unila.ac.id/id/eprint/29650,1970-01-01 00:00:00.000002021,PenReer Review,['FISIP1'],International journal of Entrepreneurship.,disk0/00/02/96/50,pub,8,2021-04-27 05:13:29,public,show,,archive,29650,2021-04-27 05:13:29,,"[{'format': 'text', 'files': [{'fileid': 262461, 'datasetid': 'document', 'mime_type': 'application/pdf', 'hash': 'd44ce5473664d258f79540ea20efff30', 'hash_type': 'MD5', 'mtime': '2021-04-27 02:45:52', 'filesize': 394554, 'objectid': 43851, 'uri': 'http://repository.lppm.unila.ac.id/id/file/262461', 'filename': 'devi Reviewer Fostering 2021.pdf'}], 'main': 'devi Reviewer Fostering 2021.pdf', 'docid': 43851, 'language': 'en', 'mime_type': 'application/pdf', 'rev_number': 2, 'eprintid': 29650, 'placement': 1, 'security': 'public', 'pos': 1, 'uri': 'http://repository.lppm.unila.ac.id/id/document/43851'}]",2021-04-27 05:13:29,63,,ostering Entrepreneurial Ecosystem Within Rural Enterpreneurship,other,,,,,,"[{'id': 'intan.fitri@fisip.unila.ac.id', 'name': {'family': 'Meutia', 'lineage': None, 'honourific': None, 'given': 'Intan Fitri'}}, {'name': {'given': 'Devi', 'lineage': None, 'family': 'Yulianti', 'honourific': None}, 'id': 'devi.yulianti@fisip.unila.ac.id'}, {'id': 'gita.djausal@fisip.unila.ac.id', 'name': {'given': 'Gita Paramita', 'lineage': None, 'family': 'Djausal', 'honourific': None}}, {'id': 'bayu.sujadmiko@fh.unila.ac.id', 'name': {'lineage': None, 'family': 'Sujadmiko', 'honourific': None, 'given': 'Bayu'}}]",,,,,,,,,,,,,,,,,,,,,,,,
20,['H1'],,http://repository.lppm.unila.ac.id/id/eprint/29809,2021-03-01 00:00:00.000000000,Lembar Penilaian Teman Sejawat (Reviwer) dengan judul Gaya Hidup Remaja di Masa Pandemik dan Dampaknya Terhadap Keputusan Berkunjung ke Ritel Modern,['FISIP1'],Jurusan Sosiologi FISIP Universitas Lampung,disk0/00/02/98/09,pub,7,2021-05-03 01:19:56,public,show,,archive,29809,2021-05-03 01:19:56,,"[{'language': 'en', 'rev_number': 1, 'mime_type': 'application/pdf', 'format': 'text', 'main': 'Prasetya Nugeraha.pdf', 'docid': 44012, 'files': [{'uri': 'http://repository.lppm.unila.ac.id/id/file/263748', 'filename': 'Prasetya Nugeraha.pdf', 'objectid': 44012, 'filesize': 1059376, 'mtime': '2021-04-30 07:46:03', 'hash_type': 'MD5', 'hash': '9dd8ff04cd558bea54990c340ccefa89', 'mime_type': 'application/pdf', 'datasetid': 'document', 'fileid': 263748}], 'security': 'public', 'pos': 1, 'uri': 'http://repository.lppm.unila.ac.id/id/document/44012', 'eprintid': 29809, 'placement': 1}]",2021-05-03 01:19:56,8119,,Gaya Hidup Remaja di Masa Pandemik dan Dampaknya Terhadap Keputusan Berkunjung ke Ritel Modern,other,,,,,,"[{'name': {'given': 'Prasetya', 'family': 'Nugeraha', 'lineage': None, 'honourific': None}, 'id': 'prasetya.nugeraha@fisip.unila.ac.id'}]",,,,,,,,,,,,,,,,,,,,,,,,
21,['HD'],submitted,http://repository.lppm.unila.ac.id/id/eprint/36088,2021-10-24 00:00:00.000000000,"Sekolah Menengah Kejuruan merupakan lembaga pendidikan yang sangat dibutuhkan untuk membekali calon tenaga kerja profesional dengan keterampilan praktis sehingga mereka siap untuk bersaing di pasar tenaga kerja.  Untuk bisa menjadi lembaga pendidikan yang unggul diperlukan manajemen sekolah, guru, dan kurikulum yang baik.  Namun sayangnya tidak banyak SMK yang mampu memenuhi kriteria ini yang disebabkan oleh kurangnya sumber pendanaan lembaga.  Untuk mengatasi hal ini sekolah perlu mengimplementasikan edupreneurship.  Permasalahan yang dihadapi oleh mitra yang dalam hal ini adalah sekolah SMK Plus Bani Salim Bandar Lampung yaitu kurangnya pengetahuan dan keterampilan guru dan manajemen sekolah untuk mengimplementasikan edupreneurship dan kewirausahaan.  Berdasarkan analisis situasi ini maka tujuan kegiatan pengabdian pada masyarakat ini adalah untuk meningkatkan pengetahuan dan keterampilan guru dalam mengimplementasikan edupreneurship. 
	Metode yang digunakan adalah dengan melakukan pemberdayaan terhadap guru dan manajemen sekolah. Kegiatan pemberdayaan ini dilakukan dalam bentuk workshop, pelatihan, dan pendampingan. Untuk mengatasi permasalahan ini maka solusi yang diberikan adalah dengan mengimplementasikan edupreneurship melalui pemberdayaan guru.  Target kegiatan ini adalah terimolementasinya edupreneurship di SMK Plus Bani Salim.  Luaran dari kegiatan ini adalah terjadinya peningkatan pengetahuan guru dan manajemen sekolah dalam mengimplementasikan edupreneurship.  Luaran lainnya adalah sebuah artikel jurnal nasional bereputasi.
	Kegiatan workshop dan pelatihan dilaksanakan pada hari Sabtu dan Minggu tanggal 31 Juli dan 1 Agustus 2021 bertempat di SMK Plus Bani Salim.  Kegiatan ini berjalan dengan baik dan berhasil meningkatkan pengetahuan peserta dengan rata-rata peningkatan 40,44%.  Capaian indikator keberhasilan workshop telah melampaui target dimana semua peserta memiliki nilai post test 75 atau lebih.  Sedangkan indikator keberhasilan kegiatan pelatihan belum dapat dicapai secara maksimal karena unit bisnis yang akan sedang direncanakan membutuhkan anggaran yang cukup besar.  Meskipun demikian peserta pelatihan telah dapat melakukan analisis kelayakan bisnis dengan cukup baik. 

Kata Kunci : Edupreneurship, kewirausahaan, Sekolah Kejuruan",['FISIP1'],Universitas Negeri Malang,disk0/00/03/60/88,submitted,11,2021-11-11 07:36:32,public,show,,archive,36088,2021-11-11 07:36:32,,"[{'rev_number': 3, 'language': 'id', 'mime_type': 'text/html', 'content': 'submitted', 'files': [{'fileid': 418346, 'datasetid': 'document', 'hash': '2715f687e1a538473fdfba5c940813b3', 'mime_type': 'text/html', 'objectid': 157058, 'filesize': 16784, 'uri': 'http://repository.lppm.unila.ac.id/id/file/418346', 'filename': 'login_source=%2Findex.php%2Fjgp%2Fauthor', 'hash_type': 'MD5', 'mtime': '2021-11-11 07:32:49'}], 'main': 'login_source=%2Findex.php%2Fjgp%2Fauthor', 'docid': 157058, 'format': 'text', 'uri': 'http://repository.lppm.unila.ac.id/id/document/157058', 'pos': 1, 'security': 'public', 'placement': 1, 'eprintid': 36088}]",2021-11-11 07:36:32,468,TRUE,Implementasi Edupreneuship Melalui Pemberdayaan Guru Smk Di Kelurahan Way Laga Kecamatan Sukabumi Bandar Lampung,article,,,http://journal2.um.ac.id/index.php/jgp/author/submission/24610,,,"[{'name': {'given': 'Nur', 'lineage': None, 'family': 'Nur Efendi', 'honourific': None}, 'id': 'nur.efendi@fisip.unila.ac.id'}, {'id': 'gusri.akhyar@eng.unila.ac.id', 'name': {'given': 'Gusri', 'honourific': None, 'lineage': None, 'family': 'Gusri Ahyar Ibrahim'}}, {'name': {'lineage': None, 'family': 'Sri Waluyo', 'honourific': None, 'given': 'Sri'}, 'id': 'sri.waluyo@fp.unila.ac.id'}]",,,,,,24610,,,JUrnal Graha Pengabdian,E-ISSN 2715-5714,,,['LPPM Unila'],['Universitas Lampung'],['Pengabdian Unggulan 2021'],,,,,,"[{'url': 'http://journal2.um.ac.id/index.php/jgp/author/', 'type': 'pub'}]",,,
22,"['H1', 'L1', 'S1']",published,http://repository.lppm.unila.ac.id/id/eprint/38753,2021-12-20 00:00:00.000000000,"Usaha Kecil Mikro dan Menengah (UMKM) harus mampu menjadi lembaga yang
dimanfaatkan untuk menciptakan kesejahteraan bagi masyarakat desa. UMKM
juga harus mampu menjadi ruang yang dapat menciptakan masyarakat mandiri
untuk memperoleh drajat kemakmuran, sehingga UMKM menjadi lembaga yang
dapat menciptakan sumber penghidupan masyarakat desa yang lebih berkualitas.
Jika dibandingkan dengan pertumbuhan UMKM di Provinsi Lampung,
pertumbukan di Kabupaten Tanggamus tidak jauh berbeda taraf pertumbuhannya
meskipun masih berada di bawah tingkat pertumbuhan provinsi. UMKM di
Kabupaten Tanggamus mengalami penurunan dari 0,959 pada tahun 2017,
menjadi 0,842. Namun pada tahun 2019 pertumbuhan UMKM di Kabupaten
Tanggamus mengalami peningkatan yang signifikan, dimana pertumbuhannya
berada di atas pertumbuhan provinsi.
Di sisi lain, Desa memiliki karakteristik yang berbeda dan beragam. Keberagaman
ini akan berimplikasi kepada model kerja UMKM yang beragam pula. Oleh
karena itu, perlu adanya model bisnis yang mampu bersifat implementatif dalam
konteks yang spesifik, sesuai dengan kreteria model UMKM yang ada di suatu
desa. Dengan demikian, kajian mengenai model bisnis perlu dilakukan. Kajian ini
akan menggunakan metode kuantitaif dan jenis penelitian explanatory. Berangkat
dari hal tersebut, Penelitian ini dilakukan untuk menemukan model bisnis UMKM
yang disesuaikan pasar",['FISIP1'],,disk0/00/03/87/53,pub,9,2022-01-31 01:21:16,public,show,,archive,38753,2022-01-31 01:21:16,,"[{'security': 'public', 'uri': 'http://repository.lppm.unila.ac.id/id/document/159869', 'pos': 1, 'eprintid': 38753, 'placement': 1, 'rev_number': 1, 'language': 'en', 'mime_type': 'application/pdf', 'format': 'text', 'docid': 159869, 'main': 'Prasetya Nugeraha_PN_DIPAFISIP_Laporan.pdf', 'files': [{'mime_type': 'application/pdf', 'hash': '54076117f0c754c04fa1f639140888c3', 'fileid': 437922, 'datasetid': 'document', 'uri': 'http://repository.lppm.unila.ac.id/id/file/437922', 'filename': 'Prasetya Nugeraha_PN_DIPAFISIP_Laporan.pdf', 'filesize': 1508493, 'objectid': 159869, 'mtime': '2022-01-30 13:14:01', 'hash_type': 'MD5'}]}]",2022-01-31 01:21:16,378,,"perumusan Model Bisnis menggunakan Strategi
Segmentasi Pasar dalam persepktif Kompetitif
Marketing pada UMKM",experiment,,,,,,"[{'name': {'honourific': None, 'family': 'Prasetya', 'lineage': None, 'given': 'Nugeraha'}, 'id': 'prasetya.nugeraha@fisip.unila.ac.id'}, {'id': '.effendi@fisip.unila.ac.id', 'name': {'given': 'A', 'lineage': None, 'family': 'Effendi', 'honourific': None}}]",,,,,"[{'type': 'http://www.loc.gov/loc.terms/relators/AUT', 'name': {'family': 'prasetya', 'lineage': None, 'honourific': None, 'given': 'Nugeraha'}, 'id': 'prasetya.nugeraha@fisip.unila.ac.id'}, {'id': '.effendi@fisip.unila.ac.id', 'name': {'given': 'A', 'lineage': None, 'family': 'Effendi', 'honourific': None}, 'type': 'http://www.loc.gov/loc.terms/relators/CSP'}]",,,,,,,,,,,,,,,,,,,
23,['H1'],,http://repository.lppm.unila.ac.id/id/eprint/37498,2021-01-01 00:00:00.000000000,,['FISIP1'],Jurusan Administrasi Negara,disk0/00/03/74/98,unpub,7,2021-12-29 10:36:23,public,show,,archive,37498,2021-12-29 10:36:23,,"[{'mime_type': 'application/pdf', 'language': 'en', 'rev_number': 1, 'files': [{'uri': 'http://repository.lppm.unila.ac.id/id/file/428459', 'filename': 'Efektivitas e court (nilai).pdf', 'filesize': 796705, 'objectid': 158436, 'mtime': '2021-12-29 07:11:12', 'hash_type': 'MD5', 'hash': '8a239f89d746bfd15557a7ef5dee1964', 'mime_type': 'application/pdf', 'datasetid': 'document', 'fileid': 428459}], 'main': 'Efektivitas e court (nilai).pdf', 'docid': 158436, 'format': 'text', 'uri': 'http://repository.lppm.unila.ac.id/id/document/158436', 'pos': 1, 'security': 'public', 'placement': 1, 'eprintid': 37498}]",2021-12-29 10:36:23,307,,EFEKTIVITAS PENERAPAN APLIKASI E-COURT DALAM UPAYA PENINGKATAN KUALITAS PELAYANAN PUBLIK (STUDI DI PENGADILAN NEGERI TANJUNG KARANG KELAS 1A),other,,,,,,"[{'name': {'honourific': None, 'lineage': None, 'family': 'Prihantika', 'given': 'Ita'}, 'id': 'itaprihantika@fisip.unila.ac.id'}]",,,,,[{'type': 'http://www.loc.gov/loc.terms/relators/AUT'}],,,,,,,,,['Universitas Lampung'],,,,,,,,,,
24,"['HD28', 'HT']",published,http://repository.lppm.unila.ac.id/id/eprint/38234,1970-01-01 00:00:00.000002021,"Green products are becoming a trend for the business world to be involved in environmental conservation. However,
few studies have examined its effect on corporate image, especially among young people in developing countries.
This study provides an overview of the relationship between green products and advertising on green brand image in
young consumers' perspectives. A quantitative approach uses in this study to 100 samples of young consumers.
Theoretical and practical support can contribute to this research in expanding the use and campaign of green products.",['FISIP1'],Atlantis Press,disk0/00/03/82/34,pub,7,2022-01-24 01:16:03,public,show,,archive,38234,2022-01-24 01:16:03,,"[{'eprintid': 38234, 'placement': 1, 'security': 'public', 'uri': 'http://repository.lppm.unila.ac.id/id/document/159249', 'pos': 1, 'format': 'text', 'main': 'green product-atlantis-IICIS.pdf', 'files': [{'datasetid': 'document', 'fileid': 433852, 'mime_type': 'application/pdf', 'hash': 'dc8af12c347dba7da161367ea3269d83', 'hash_type': 'MD5', 'mtime': '2022-01-22 16:48:38', 'objectid': 159249, 'filesize': 277284, 'filename': 'green product-atlantis-IICIS.pdf', 'uri': 'http://repository.lppm.unila.ac.id/id/file/433852'}], 'docid': 159249, 'mime_type': 'application/pdf', 'language': 'en', 'rev_number': 1}]",2022-01-24 01:16:03,145,TRUE,"Green Products Image in the Perspective of Young
Consumers",article,,,https://www.atlantis-press.com/proceedings/iicis-21/125965493,"[1] I. Manisalidis, E. Stavropoulou, A.
Stavropoulos, and E. Bezirtzoglou,
“Environmental and Health Impacts of Air
Pollution: A Review,” Frontiers in Public
Health, vol. 8, Feb. 2020, doi:
10.3389/fpubh.2020.00014.
[2] R. Yadav and G. S. Pathak, “Young consumers’
intention towards buying green products in a
developing nation: Extending the theory of
planned behavior,” Journal of Cleaner
Production, vol. 135, Nov. 2016, doi:
10.1016/j.jclepro.2016.06.120.
[3] T. Chen and L. Chai, “Attitude towards the
environment and green products: Consumers’
perspective,” Management Science and
Engineering, vol. 4, no. 2, 2010.
[4] D. H. Jayani and A. Mutia, “5 Alasan
Konsumen Belanja Produk Ramah
Lingkungan,” https://databoks.katadata.co.id,
Aug. 24, 2021.
https://databoks.katadata.co.id/datapublishembe
d/122304/5-alasan-konsumen-belanja-produkramah-lingkungan (accessed Oct. 10, 2021).
[5] A. Wijaya, J. Wulandari, and P. Nugeraha,
“Kajian Tentang Keputusan Pembelian Produk
Ramah Lingkungan dalam Perspektif Theory of
Planned Behavior,” Jurnal Sosial Humaniora,
vol. 11, no. 2, 2020, doi: 10.30997/jsh.
v11i2.2658.
[6] R. Supriyanto, F. Mandasari, and A. K. Yapie,
“Consumer Behavior Model for Green Product
Consumption: Determinant and Impact of Green
Satisfaction on Green Loyalty,” Proceeding of
International …, no. April, 2019.
[7] C. N. L. Tan, A. O. Ojo, and R. Thurasamy,
“Determinants of green product buying decision
among young consumers in Malaysia,” Young
Consumers, vol. 20, no. 2, 2019, doi:
10.1108/YC-12-2018-0898.
[8] R. B. Lestari and Kardinal, “Minat Beli Produk
Hijau pada Generasi Milenial,” Jurnal Ilmiah
Ekonomi Global Masa Kini, vol. 9, no. 2, 2018.
[9] J. Paul, A. Modi, and J. Patel, “Predicting green
product consumption using theory of planned
behavior and reasoned action,” Journal of
Retailing and Consumer Services, vol. 29, Mar.
2016, doi: 10.1016/j.jretconser.2015.11.006.
[10] Y. Joshi and Z. Rahman, Factors Affecting
Green Purchase Behaviour and Future Research
Directions, vol. 3, no. 1–2. Holy Spirit
University of Kaslik, 2015. doi:
10.1016/j.ism.2015.04.001.
[11] E. Muslim and D. R. Indriani, “Analisis
Pengaruh Eco-Label terhadap Kesadaran
Konsumen untuk Membeli Green Product,”
Jurnal Manajemen Teknologi, vol. 13, no. 1, pp.
86–100, 2014, doi: 10.12695/jmt.2014.13.1.6.
[12] F. Varah, M. Mahongnao, B. Pani, and S.
Khamrang, “Exploring young consumers’
intention toward green products: applying an
extended theory of planned behavior,”
Environment, Development and Sustainability,
vol. 23, no. 6, Jun. 2021, doi: 10.1007/s10668-
020-01018-z.
[13] I. Naderi and E. van Steenburg, “Me first, then
the environment: young Millennials as green
consumers,” Young Consumers, vol. 19, no. 3,
pp. 280–295, Aug. 2018, doi: 10.1108/YC-08-
2017-00722.
[14] Y. S. Chen, “The drivers of green brand equity:
Green brand image, green satisfaction, and
green trust,” Journal of Business Ethics, vol. 93,
no. 2, pp. 307–319, May 2010, doi:
10.1007/s10551-009-0223-9.
[15] S. Avrinella Silaban, S. Sinulingga, and C.
Author, “The Effect of Green Marketing on
Purchase Decisions and Brand Image as
Intervening Variables (Case Study at: Pt. Sari
Coffee Indonesia - Starbucks Focal Point
Medan),” International Journal of Research and
Review (ijrrjournal.com), vol. 8, p. 1, 2021.
[16] D. P. Alamsyah, N. A. Othman, and H. A. A.
Mohammed, “The awareness of
environmentally friendly products: The impact
of green advertising and green brand image,”
Management Science Letters, vol. 10, no. 9, pp.
1961–1968, 2020, doi:
10.5267/J.MSL.2020.2.017.
[17] H. Purnama, “The effect of green packaging and
green advertising on brand image and purchase
decision of Teh Kotak product,” 2019. doi:
10.2991/insyma-19.2019.34.
[18] C. D’Souza, M. Taghian, P. Lamb, and R.
Peretiatkos, “Green products and corporate
strategy: an empirical investigation,” Society
and Business Review, vol. 1, no. 2, pp. 144–
157, May 2006, doi:
10.1108/17465680610669825.
[19] P. BSingh and K. K. Pandey, “Green Marketing:
Policies and Practices for Sustainable
Development,” Integral Review-A Journal of
Management, vol. 5, no. 1, 2012, Accessed: Oct.
11, 2021. [Online]. Available:
http://sbinfocanada.about.com
[20] X. Guo Li, X. Wang, and Y. Juan Cai,
“Corporate-, Product-, and User-Image
Dimensions and Purchase Intentions the
Mediating Role of Cognitive and Affective
Attitudes,” 2011, doi: 10.4304/jcp.6.9.1875-
1879.
[21] N. R. Dianti and E. L. Paramita, “Green Product
dan Keputusan Pembelian Konsumen Muda,”
Jurnal Samudra Ekonomi dan Bisnis, vol. 12,
no. 1, Jan. 2021, doi: 10.33059/jseb.
v12i1.2301.
[22] S. Vaux Halliday and A. Astafyeva, “Millennial
cultural consumers: co-creating value through
brand communities,” Arts Marketing: An
International Journal, vol. 4, no. 1/2, 2014, doi:
10.1108/am-01-2014-0003.",,"[{'id': 'irmanramad03@gmail.com', 'name': {'given': 'Irma', 'honourific': None, 'family': 'Ramadhani', 'lineage': None}}, {'id': 'jeni.wulandari@fisip.unila.ac.id', 'name': {'given': 'Jeni', 'honourific': None, 'family': 'Wulandari', 'lineage': None}}, {'id': 'ghia.subagja@fisip.unila.ac.id', 'name': {'given': 'Ghia', 'family': 'Subagja', 'lineage': None, 'honourific': None}}]",,,,,,,259-264,,"Advances in Social Science, Education and Humanities Research (ASSEHR)",2352-5398,606.0,,,"['Jurusan Ilmu Administrasi Bisnis, FISIP', 'Jurusan Ilmu Administrasi Bisnis, FISIP', 'Jurusan Ilmu Administrasi Bisnis, FISIP']",,,,,,,,,,
