,subjects,date_type,uri,date,abstract,divisions,publisher,dir,ispublished,rev_number,status_changed,full_text_status,metadata_visibility,editors,eprint_status,eprintid,datestamp,pages,documents,lastmod,userid,refereed,title,type,place_of_pub,contact_email,official_url,referencetext,event_dates,creators,pres_type,event_title,succeeds,event_type,contributors,id_number,pagerange,number,publication,issn,volume,event_location,funders,corp_creators,projects,keywords,note,department,institution,monograph_type,related_url,patent_applicant,isbn,book_title
0,"['HD', 'HD28']",submitted,http://repository.lppm.unila.ac.id/id/eprint/35139,2021-10-29 00:00:00.000000000,"Covid-19 bukan hanya sekedar masalah kesehatan. Namun lebih jauh lagi, Covid-19 meluas menjadi masalah sistemik, yang menjalar dalam lingkup sosial budaya, ekonomi, politik, pertahanan dan keamanan negara. 

Meluasnya dampak covid-19 menggelitik banyak pihak untuk turut berkisah. Tidak hanya melalui labirin jendela di rumah-rumah, sekolah, pasar, atau kantor, yang tiba-tiba menjadi ruang sunyi. Banyak yang kemudian ingin mengabadikan kisah panjang itu dalam karya tulisan, agar terkenang dalam sejarah. Begitu pun pada anak-anak muda yang mewakili generasi Z dalam buku ini. 

Terhimpun beberapa pandangan, baik berupa deskripsi faktual, maupun kritik, khususnya tantangan dalam pengelolaan SDM dan UMKM di masa pandemi Covid-19, serta gagasan inovatif dalam perspektif bisnis.

Semoga buku sederhana ini dapat mewakili komunitas Gen Z dalam menyelami ‘makna’ dan hikmah dari kejadian Covid-19.
Tidak hanya sekedar catatan, tetapi juga harapan, agar pandemi ini segera berlalu.",['FISIP1'],FISIP Unila,disk0/00/03/51/39,submitted,8,2021-11-06 02:19:22,public,show,"[{'id': 'jeni.wulandari@fisip.unila.ac.id', 'name': {'given': 'Jeni', 'lineage': None, 'family': 'Wulandari', 'honourific': None}}, {'name': {'honourific': None, 'lineage': None, 'family': 'Ali', 'given': 'Suprihatin'}, 'id': None}, {'name': {'given': 'Kussuyatmono Bagus', 'family': 'Wardianto', 'lineage': None, 'honourific': None}, 'id': 'kussuyatmono.bagus@fisip.unila.ac.id'}]",archive,35139,2021-11-06 02:19:22,116.0,"[{'placement': 1, 'eprintid': 35139, 'pos': 1, 'uri': 'http://repository.lppm.unila.ac.id/id/document/155918', 'security': 'public', 'files': [{'fileid': 410809, 'datasetid': 'document', 'hash': 'd9f6375f955c8eb00fb0e7def3166a67', 'mime_type': 'application/pdf', 'hash_type': 'MD5', 'mtime': '2021-11-05 15:53:11', 'filesize': 4407282, 'objectid': 155918, 'filename': 'BOOK CHAPTER.pdf', 'uri': 'http://repository.lppm.unila.ac.id/id/file/410809'}], 'main': 'BOOK CHAPTER.pdf', 'docid': 155918, 'format': 'text', 'mime_type': 'application/pdf', 'language': 'en', 'rev_number': 1}]",2021-11-06 02:19:22,145,FALSE,"Covid-19: Peluang dan Tantangan dalam Perspektif Bisnis
(Sebuah Catatan dari Generasi Z)",book,Bandar Lampung,unitpublikasi@fisip.unila.ac.id,,,,,,,,,,,,,,,,,,,,,,,,,,,,
1,"['S1', 'T1', 'TJ', 'TK']",published,http://repository.lppm.unila.ac.id/id/eprint/49463,1970-01-01 00:00:00.000002021,"Plastic has become the dominant problems in recent years since it become the dominant material for food packaging. More than 600 thousand tons of plastic becoming waste in 2019. Leaf as food packaging material has been known since the dawn of civilization In Indonesia itself leaf and other plant’s organic material commonly used as traditional food wrapper. Commonly known leaves such as banana leaf, waru leaf, tepus leaf, simpur leaf, syzygium leaf and also tembakak leaf are used for wrapping traditional food. Thus triggering for the use of environmentally friendly tebakak leaf plates that are easily biodegradable, easy to produce, hygienic, and have lampung cultural background. One main question can the consumer shift from plastic based disposable plate to greener leaf base plate. Can tebakak leaf plate as an eco-friendly product try to replace plastic or just another plastic alternative. And, the consumer’s perspective of tebakak leaf plates as an eco-friendly product. We learn that both leaf plates (tebakak leaf plates and teak leaf plates) can be contender for plastic plates and paper plates while styrofoam plates has the lowest value. The consumer agrees that tebakak leaf plates and the teak leaf plates are green and want to use them. The main hindrance of using the leaf plates is the availability on the market and its higher price.","['FISIP1', 'FP5', 'FT5', 'FT8', 'FT7']",,disk0_bak/00/04/94/63,pub,9,2023-03-31 00:49:15,public,show,,archive,49463,2023-03-31 00:49:15,,"[{'eprintid': 49463, 'placement': 1, 'security': 'public', 'uri': 'http://repository.lppm.unila.ac.id/id/document/189038', 'pos': 1, 'format': 'text', 'docid': 189038, 'main': 'conference_paper--m_gd_et_al-tebakak_leaves_plates_as_an_eco-friendly_disposable_plates.pdf', 'files': [{'fileid': 536667, 'datasetid': 'document', 'hash': 'e5894cfd9b856f2e7f7b1c7bcedc96e0', 'mime_type': 'application/pdf', 'hash_type': 'MD5', 'mtime': '2022-02-04 16:46:50', 'objectid': 189038, 'filesize': 867620, 'uri': 'http://repository.lppm.unila.ac.id/id/file/536667', 'filename': 'conference_paper--m_gd_et_al-tebakak_leaves_plates_as_an_eco-friendly_disposable_plates.pdf'}], 'language': 'en', 'rev_number': 2, 'mime_type': 'application/pdf'}, {'eprintid': 49463, 'placement': 2, 'formatdesc': 'Plain Text Bibliography', 'security': 'public', 'pos': 2, 'uri': 'http://repository.lppm.unila.ac.id/id/document/189039', 'format': 'other', 'main': 'bibliography.txt', 'files': [{'filesize': 1952, 'objectid': 189039, 'uri': 'http://repository.lppm.unila.ac.id/id/file/536668', 'filename': 'bibliography.txt', 'hash_type': 'MD5', 'mtime': '2022-02-04 16:46:57', 'datasetid': 'document', 'fileid': 536668, 'hash': '8a4a1a7338a808011ef3057569a35162', 'mime_type': 'text/plain'}], 'docid': 189039, 'content': 'bibliography', 'language': 'en', 'mime_type': 'text/plain', 'rev_number': 3}, {'main': 'martinus+meizano-prosiding-2021-Tebakak Leaves Plates as an Eco-friendly Disposable Plates.pdf.pdf', 'docid': 189040, 'files': [{'fileid': 536670, 'datasetid': 'document', 'hash': '8bcdbab00887fa78c99226052c3c1edc', 'mime_type': 'application/pdf', 'hash_type': 'MD5', 'mtime': '2023-03-30 17:43:48', 'filesize': 836299, 'objectid': 189040, 'uri': 'http://repository.lppm.unila.ac.id/id/file/536670', 'filename': 'martinus+meizano-prosiding-2021-Tebakak Leaves Plates as an Eco-friendly Disposable Plates.pdf.pdf'}], 'format': 'text', 'rev_number': 2, 'language': 'en', 'mime_type': 'application/pdf', 'content': 'other', 'placement': 3, 'eprintid': 49463, 'uri': 'http://repository.lppm.unila.ac.id/id/document/189040', 'pos': 3, 'formatdesc': 'similiarity', 'security': 'public'}, {'format': 'text', 'docid': 189041, 'main': 'martinus-korespondensi-Tebakak Leaves Plates as an Eco-friendly.pdf', 'files': [{'hash_type': 'MD5', 'mtime': '2023-03-30 17:44:20', 'objectid': 189041, 'filesize': 93429, 'uri': 'http://repository.lppm.unila.ac.id/id/file/536673', 'filename': 'martinus-korespondensi-Tebakak Leaves Plates as an Eco-friendly.pdf', 'fileid': 536673, 'datasetid': 'document', 'hash': '61846bec5ccd933115833f67010caacc', 'mime_type': 'application/pdf'}], 'content': 'other', 'rev_number': 2, 'language': 'en', 'mime_type': 'application/pdf', 'eprintid': 49463, 'placement': 4, 'security': 'public', 'formatdesc': 'Korespondensi M1', 'uri': 'http://repository.lppm.unila.ac.id/id/document/189041', 'pos': 4}, {'language': 'en', 'rev_number': 2, 'mime_type': 'application/pdf', 'content': 'other', 'docid': 189042, 'main': 'meizano-korespondensi-Tebakak Leaves Plates as an Eco-friendly.pdf', 'files': [{'uri': 'http://repository.lppm.unila.ac.id/id/file/536675', 'filename': 'meizano-korespondensi-Tebakak Leaves Plates as an Eco-friendly.pdf', 'objectid': 189042, 'filesize': 93411, 'mtime': '2023-03-30 17:44:27', 'hash_type': 'MD5', 'hash': 'fba8435d8680bed99ddc10b64a66bc61', 'mime_type': 'application/pdf', 'datasetid': 'document', 'fileid': 536675}], 'format': 'text', 'uri': 'http://repository.lppm.unila.ac.id/id/document/189042', 'pos': 5, 'formatdesc': 'Korespondensi M2', 'security': 'public', 'placement': 5, 'eprintid': 49463}]",2023-03-31 00:49:15,1199,TRUE,"Tebakak Leaves Plates as an Eco-friendly Disposable Plates: Cultural Roots, Technology and People Transformations",conference_item,,,https://www.atlantis-press.com/proceedings/iicis-21/125965484,"[1] D. R. Haque, “Plastics: Wonder Material in Trouble,” Paradigm, vol. 3, pp. 160-163, Jan. 1999. 

[2] M. Yudell, D. Roberts, R. DeSalle, and S. Tishkoff, “NIH must confront the use of race in science,” Science (80-. )., vol. 369, no. 6509, pp. 1314-1315, 2020. 

[3] A. J. Kora, “Leaves as dining plates, food wraps and food packing material: Importance of renewable resources in Indian culture,” Bull. Natl. Res. Cent., vol. 43, no. 1, 2019. 

[4] R. Rini, Y. Fakhrurrozi, and D. Akbarini, “Pemanfaatan Daun Sebagai Pembungkus Makanan Tradisional Oleh Masyarakat Bangka (Studi Kasus di Kecamatan Merawang),” EKOTONIA J. Penelit. Biol. Bot. Zool. dan Mikrobiol., vol. 2, no. 1, pp. 20-32, 2018. 

[5] Dawud Achroni, Belajar dari Makanan Tradisional Jawa. 2017. 

[6] V. AC et al., “Global research priorities to mitigate plastic pollution impacts on marine wildlife ,” Endanger. Species Res., vol. 25, no. 3, pp. 225-247, 2014. 

[7] “Indonesia Consumers Are Most Pessimistic in 16 Years on Outbreak - Bloomberg.” [Online]. Available: https://www.bloomberg.com/news/articles/2021 -09-08/indonesia-consumers-are-most pessimistic-in-16-years-on-outbreak. [Accessed: 20-Oct-2021]. 

[8] “Consumer Survey March 2021: Consumer Confidence Continues to Grow.” [Online]. Available: https://www.bi.go.id/en/publikasi/ruang media/news-release/Pages/sp_239121.aspx. [Accessed: 20-Oct-2021]. bangsa/kebudayaan/suku-bangsa. [Accessed: 19-Oct-2021]. [10] “Suku Bangsa di Indonesia Sangat Beragam, Apa Penyebabnya? | kumparan.com.” [Online]. Available: https://kumparan.com/berita update/suku-bangsa-di-indonesia-sangat beragam-apa-penyebabnya-1v0EWRGG96x. [Accessed: 19-Oct-2021]. [11] R. Setiawan, “Memaknai Kuliner Tradisional diNusantara : Sebuah Tinjauan Etis Rudi Setiawan,” Respons, vol. Gabriele W, no. 01, pp. 113-140, 2016. [12] Y. Sari, B. Afriyansyah, and L. Juairiah, “Pemanfaatan Daun sebagai Bahan Pembungkus Ma",26-27 October 2021,"[{'id': 'martinus@eng.unila.ac.id', 'name': {'given': 'Martinus', 'honourific': None, 'lineage': None, 'family': '.'}}, {'id': 'gita.djausal@fisip.unila.ac.id', 'name': {'honourific': None, 'lineage': None, 'family': 'Djausal', 'given': 'Gita Paramita'}}, {'name': {'honourific': None, 'lineage': None, 'family': 'Sulistiyanti', 'given': 'Sri Ratna'}, 'id': 'sr_sulistiyanti@eng.unila.ac.id'}, {'id': 'meizano@eng.unila.ac.id', 'name': {'family': 'Muhammad', 'lineage': None, 'honourific': None, 'given': 'Meizano Ardhi'}}, {'name': {'honourific': None, 'lineage': None, 'family': 'Telaumbanua', 'given': 'Mareli'}, 'id': 'mareli.telaumbanua@fp.unila.ac.id'}]",paper,2nd International Indonesia Conference on Interdisciplinary Studies (IICIS 2021),39054.0,conference,,,,,,,,,,,,,,,,,,,,
2,"['H1', 'HN', 'SB']",,http://repository.lppm.unila.ac.id/id/eprint/38296,2021-09-21 00:00:00.000000000,"Perubahan perilaku dimasyarakat yang terjadi saat pandemi merupakan hal yang telah membuat pola hidup menjadi berbeda. Pesisir pantai yang banyak terdapat di Lampung menjadi pusat interaksi yang m=di ikuti oleh kegiatan lainnya. Dengan memakai konsep pendekatan SDGs penelitian ini mencoba tiga pengukuran yaitu ekonomi,produksi dan konsumsi, serta lingkungan.",['FISIP1'],,disk0/00/03/82/96,unpub,13,2022-01-25 09:57:54,public,show,,archive,38296,2022-01-25 09:57:54,,"[{'eprintid': 38296, 'placement': 1, 'security': 'public', 'uri': 'http://repository.lppm.unila.ac.id/id/document/159365', 'pos': 1, 'format': 'text', 'files': [{'uri': 'http://repository.lppm.unila.ac.id/id/file/434465', 'filename': 'Diang_Adistya_FISIP_PDP_Prof.pdf', 'filesize': 2108817, 'objectid': 159365, 'mtime': '2022-01-25 04:46:01', 'hash_type': 'MD5', 'hash': '218423b9b96dc599806fc10731a00a14', 'mime_type': 'application/pdf', 'datasetid': 'document', 'fileid': 434465}], 'main': 'Diang_Adistya_FISIP_PDP_Prof.pdf', 'docid': 159365, 'rev_number': 1, 'language': 'en', 'mime_type': 'application/pdf'}]",2022-01-25 09:57:54,2444,,"SDGs(Sustainable Development Goals) : Coastal
land management in overcoming poverty and
environmental sustainability",experiment,,,,,,"[{'id': 'diang.adistya@fisip.unila.ac.id', 'name': {'given': 'Diang', 'honourific': None, 'lineage': None, 'family': 'Adistya'}}, {'id': '.effendi@fisip.unila.ac.id', 'name': {'given': 'A', 'lineage': None, 'family': 'Effendi', 'honourific': None}}, {'id': 'lilihmuflihah@gmail.com', 'name': {'honourific': None, 'lineage': None, 'family': 'Lilih Muflih', 'given': 'Lilih'}}]",,,,,"[{'id': 'diang.adistya@fisip.unila.ac.id', 'type': 'http://www.loc.gov/loc.terms/relators/AUT', 'name': {'given': 'Diang', 'honourific': None, 'family': 'Adistya', 'lineage': None}}, {'id': 'a.effendi@fisip.unila.ac.id', 'name': {'family': 'Effendi', 'lineage': None, 'honourific': None, 'given': 'A'}, 'type': 'http://www.loc.gov/loc.terms/relators/CSP'}, {'id': 'lilihmuflihah@gmail.com', 'name': {'given': 'Lilih', 'honourific': None, 'family': 'Muflihah', 'lineage': None}, 'type': 'http://www.loc.gov/loc.terms/relators/CSL'}]",,,,,,,,,,,,,,,,,,,
3,['H1'],published,http://repository.lppm.unila.ac.id/id/eprint/44987,1970-01-01 00:00:00.000002021,"Companies need a system that can support company activities by utilizing 
information technology. This system is expected to assist and facilitate the 
management of the company's activities to run effectively and efficiently. This 
system is then called the electronic office or electronic office (e-office). This study 
aims to determine the use of e-office as a paperless office practice in life 
insurance companies. This research is case study research with a qualitative 
approach. The selection of informants was done intentionally (purposive 
sampling). Collecting data using participatory observation, in-depth interviews, 
and documentation. Meanwhile, for data analysis using an interactive model 
developed by Miles & Huberman to test the validity of the data using 
triangulation techniques. The results show that the e-office used by life insurance 
companies is very complete. Apart from being intended for marketers to 
complete work, the use of e-office can also be used by marketers to establish 
communication with customers. Utilization of e-office for marketers is not only 
to achieve job targets, but can also be used to assess performance. With the e�office, companies can not only save time but also cut paper costs and also the 
cost of sending letters/documents. Therefore, by utilizing the e-office application, 
the company's target to implement a paperless office as a solution to 
environmental issues can be achieved.",['FISIP1'],Jurusan Administrasi Negara,disk0/00/04/49/87,pub,6,2022-09-19 01:19:48,public,show,,archive,44987,2022-09-19 01:19:48,,"[{'rev_number': 1, 'language': 'en', 'mime_type': 'application/pdf', 'format': 'text', 'main': '12 Administrativa Aprlia dan Cahyaningtias.pdf', 'files': [{'uri': 'http://repository.lppm.unila.ac.id/id/file/485122', 'filename': '12 Administrativa Aprlia dan Cahyaningtias.pdf', 'objectid': 166910, 'filesize': 1153368, 'mtime': '2022-09-18 07:13:02', 'hash_type': 'MD5', 'hash': 'e4e249b9a32440a9c7f3b7cca716314a', 'mime_type': 'application/pdf', 'datasetid': 'document', 'fileid': 485122}], 'docid': 166910, 'security': 'public', 'pos': 1, 'uri': 'http://repository.lppm.unila.ac.id/id/document/166910', 'eprintid': 44987, 'placement': 1}]",2022-09-19 01:19:48,22742,TRUE,Pemanfaatan E-Office sebagai Praktik Paperless Office,article,,hani.damayanti@fisip.unila.ac.id,https://administrativa.fisip.unila.ac.id/,,,"[{'name': {'given': 'Hani Damayanti', 'lineage': None, 'family': 'Aprilia', 'honourific': None}, 'id': 'hani.damayanti@fisip.unila.ac.id,'}, {'id': None, 'name': {'given': 'Akgis', 'honourific': None, 'family': 'Cahyaningtias', 'lineage': None}}]",,,,,,377-384,385-392,3.0,"Administrativa: Jurnal Birokrasi, Kebijakan dan Pelayanan Publik",2714-7673,3.0,,,,,,,,,,,,,
4,['H1'],published,http://repository.lppm.unila.ac.id/id/eprint/44988,1970-01-01 00:00:00.000002021,"The development of the times and technology demands the creation of a system that can improve company 
performance. One system that is believed to be able to improve company performance is the use of e-office. 
With e-office, companies can achieve optimal performance. Achieving optimal company performance with the 
Excellent Performance Model (MKE) is the focus of various companies today. This study aims to identify, 
describe, and analyze the use of e-office in improving company performance. The method used in this research is 
descriptive research type, using a qualitative approach—data collection techniques with interviews and literature 
study. Technical data analysis uses interactive model data analysis with triangulation for data validity. The 
results show that e-office is able to provide convenience for companies in the administration of work to create a 
paperless office. The company's support for the enormous e-office, combined with the company's human capital, 
is an added value for the company. for achieving excellent performance.",['FISIP1'],,disk0/00/04/49/88,pub,7,2022-09-19 01:19:51,public,show,,archive,44988,2022-09-19 01:19:51,,"[{'eprintid': 44988, 'placement': 1, 'security': 'public', 'pos': 1, 'uri': 'http://repository.lppm.unila.ac.id/id/document/166911', 'format': 'text', 'main': 'IICIS E OFFICE HANI.pdf', 'docid': 166911, 'files': [{'hash_type': 'MD5', 'mtime': '2022-09-18 07:34:31', 'objectid': 166911, 'filesize': 310009, 'filename': 'IICIS E OFFICE HANI.pdf', 'uri': 'http://repository.lppm.unila.ac.id/id/file/485129', 'datasetid': 'document', 'fileid': 485129, 'hash': '28fa3494270f8dbaef47a14c3582272e', 'mime_type': 'application/pdf'}], 'rev_number': 1, 'language': 'en', 'mime_type': 'application/pdf'}]",2022-09-19 01:19:51,22742,TRUE,"The Using of E-Office in Efforts to Achieve 
Company Performance with Excellent Performance 
Model",conference_item,,hani.damayanti@fisip.unila.ac.id,https://www.atlantis-press.com/proceedings/iicis-21/125965472,,26-27 October 2021,"[{'id': 'hani.damayanti@fisip.unila.ac.id,', 'name': {'lineage': None, 'family': 'Aprilia', 'honourific': None, 'given': 'Hani Damayanti'}}, {'id': 'dame.suzuka@gmail.com', 'name': {'lineage': None, 'family': 'Damayanti', 'honourific': None, 'given': '-'}}]",paper,2nd International Indonesia Conference on Interdisciplinary Studies (IICIS 2021),,conference,,,265-271,,,,,Bandar Lampung,,,,,,,,,,,,
5,['H1'],published,http://repository.lppm.unila.ac.id/id/eprint/37204,2021-12-07 00:00:00.000000000,"This paper discusses the urban waste management issues that many cities in developing countries face. Waste that is 
not properly managed has an impact on the quality of human health and the environment. This study takes a case 
study approach, with data collected through in-depth interviews, observation, and documentation. This case study was conducted in Metro City, an Adipura-winning city with waste management issues. Because the government has 
limited resources for waste management, involving the private sector and civil society is a viable option, according to the research findings. Waste management necessitates the collaboration of many parties, each with their own set of responsibilities, such as the government's regulatory and facilitation functions. Meanwhile, the private sector is split into two sections: waste management and waste management as a sponsor or donor. Furthermore, to strengthen partnerships between the regional government, the private sector, and the community through socialization and the implementation of the Waste Bank as a model for managing waste sourced from the market in order to improve waste 
management and achieve sustainable development.",['FISIP1'],,disk0/00/03/72/04,pub,8,2021-12-08 09:04:55,public,show,,archive,37204,2021-12-08 09:04:55,,"[{'eprintid': 37204, 'placement': 1, 'security': 'public', 'uri': 'http://repository.lppm.unila.ac.id/id/document/158105', 'pos': 1, 'format': 'text', 'main': '125965487.pdf', 'files': [{'fileid': 426188, 'datasetid': 'document', 'mime_type': 'application/pdf', 'hash': '43aec6cb7013457364223f2949181920', 'objectid': 158105, 'filesize': 661886, 'uri': 'http://repository.lppm.unila.ac.id/id/file/426188', 'filename': '125965487.pdf', 'hash_type': 'MD5', 'mtime': '2021-12-08 03:29:41'}], 'docid': 158105, 'mime_type': 'application/pdf', 'language': 'en', 'rev_number': 1}]",2021-12-08 09:04:55,307,TRUE,Boosting Public-Private Partnership for Sustainable Waste Management in Metro City,conference_item,,,https://www.atlantis-press.com/proceedings/iicis-21/125965487,,26-27 Oktober 2021,"[{'name': {'family': 'Bakti', 'lineage': None, 'honourific': None, 'given': 'Dadang Karya'}, 'id': None}, {'name': {'given': 'Suprihatin', 'honourific': None, 'family': 'Ali', 'lineage': None}, 'id': None}, {'name': {'given': 'Toni', 'family': 'Wijaya', 'lineage': None, 'honourific': None}, 'id': 'suratoni@gmail.com'}, {'name': {'given': 'Ita', 'honourific': None, 'family': 'Prihantika', 'lineage': None}, 'id': 'itaprihantika@fisip.unila.ac.id'}]",paper,Proceedings of the 2nd International Indonesia Conference on Interdisciplinary Studies (IICIS 2021),,conference,"[{'type': 'http://www.loc.gov/loc.terms/relators/AUT'}, {'type': 'http://www.loc.gov/loc.terms/relators/AUT'}, {'type': 'http://www.loc.gov/loc.terms/relators/AUT'}, {'type': 'http://www.loc.gov/loc.terms/relators/AUT'}]",,306-311,,,,,"Bandar Lampung, Indonesia",['LPPM Universitas Lampung'],"['Universitas Lampung', 'Universitas Lampung', 'Universitas Lampung', 'Universitas Lampung']",['Penelitian Dasar 2021'],,,,,,,,,
6,['HB'],,http://repository.lppm.unila.ac.id/id/eprint/43392,1970-01-01 00:00:00.000002021,,['FISIP1'],FISIP Unila,disk0/00/04/33/92,pub,7,2022-07-19 06:43:31,public,show,,archive,43392,2022-07-19 06:43:31,,"[{'uri': 'http://repository.lppm.unila.ac.id/id/document/165264', 'pos': 1, 'security': 'public', 'placement': 1, 'eprintid': 43392, 'language': 'en', 'rev_number': 1, 'mime_type': 'application/pdf', 'main': 'PENGARUH OPERATING CAPACITY, OPERATING CASH FLOW DAN AGENCY COST YANG TERDAFTAR DI BURSA EFEK INDONESIA.pdf', 'files': [{'hash_type': 'MD5', 'mtime': '2022-07-19 02:19:10', 'filesize': 444591, 'objectid': 165264, 'filename': 'PENGARUH OPERATING CAPACITY, OPERATING CASH FLOW DAN AGENCY COST YANG TERDAFTAR DI BURSA EFEK INDONESIA.pdf', 'uri': 'http://repository.lppm.unila.ac.id/id/file/473852', 'datasetid': 'document', 'fileid': 473852, 'hash': '36901ad32add1d79e34717aac5db6463', 'mime_type': 'application/pdf'}], 'docid': 165264, 'format': 'text'}]",2022-07-19 06:43:31,370,,"Penilaian Rekan Sejawat : PENGARUH OPERATING CAPACITY, OPERATING CASH FLOW DAN AGENCY COST YANG TERDAFTAR DI BURSA EFEK INDONESIA",other,,,,,,"[{'id': None, 'name': {'given': 'Damayanti', 'honourific': None, 'family': 'Damayanti', 'lineage': None}}, {'id': 'mediya.destalia@fisip.unila.ac.id', 'name': {'honourific': None, 'family': 'Mediya Destalia', 'lineage': None, 'given': 'Mediya'}}]",,,,,,,,,,,,,,,,,,,,,,,,
7,['HB'],,http://repository.lppm.unila.ac.id/id/eprint/43391,1970-01-01 00:00:00.000002021,,['FISIP1'],FISIP Unila,disk0/00/04/33/91,pub,8,2022-07-19 06:43:23,public,show,,archive,43391,2022-07-19 06:43:23,,"[{'pos': 1, 'uri': 'http://repository.lppm.unila.ac.id/id/document/165263', 'security': 'public', 'placement': 1, 'eprintid': 43391, 'language': 'en', 'mime_type': 'application/pdf', 'rev_number': 1, 'main': 'PENGARUH INFLASI, BIiRATE,.DAN NILAI TUKAR RUPIAH TERHADAP PERUBAHAN INDEKS HARGA SAHAM.SEKTOR CONSUMER GOODS.pdf', 'files': [{'objectid': 165263, 'filesize': 443328, 'uri': 'http://repository.lppm.unila.ac.id/id/file/473843', 'filename': 'PENGARUH INFLASI, BIiRATE,.DAN NILAI TUKAR RUPIAH TERHADAP PERUBAHAN INDEKS HARGA SAHAM.SEKTOR CONSUMER GOODS.pdf', 'hash_type': 'MD5', 'mtime': '2022-07-19 02:15:47', 'datasetid': 'document', 'fileid': 473843, 'hash': '81e4f329a3d241844313b12827562c0b', 'mime_type': 'application/pdf'}], 'docid': 165263, 'format': 'text'}]",2022-07-19 06:43:23,370,,"Penilaian Rekan Sejawat : PENGARUH INFLASI, BIiRATE,.DAN NILAI TUKAR RUPIAH TERHADAP PERUBAHAN INDEKS HARGA SAHAM.SEKTOR CONSUMER GOODS",other,,,,,,"[{'name': {'given': 'Damayanti', 'honourific': None, 'family': 'Damayanti', 'lineage': None}}, {'name': {'family': 'iqbal', 'lineage': None, 'honourific': None, 'given': 'harori'}}]",,,,,,,,,,,,,,,,,,,,,,,,
