,datestamp,id_number,eprintid,eprint_status,metadata_visibility,pagerange,userid,number,official_url,lastmod,documents,type,creators,title,refereed,date_type,subjects,abstract,volume,uri,related_url,publication,dir,divisions,issn,full_text_status,status_changed,ispublished,rev_number,publisher,keywords,contact_email,referencetext,contributors,corp_creators,event_location,pres_type,event_dates,event_type,event_title,funders,projects,succeeds
29,2020-05-29 10:19:17,,21072,archive,show,,637,,,2020-05-29 10:19:17,"[{'eprintid': 21072, 'placement': 1, 'security': 'public', 'uri': 'http://repository.lppm.unila.ac.id/id/document/34457', 'pos': 1, 'format': 'text', 'files': [{'datasetid': 'document', 'fileid': 196557, 'hash': 'a8c9cb34e2a04cdf5d2f398864a01094', 'mime_type': 'application/pdf', 'hash_type': 'MD5', 'mtime': '2020-05-29 09:59:23', 'filesize': 100977, 'objectid': 34457, 'uri': 'http://repository.lppm.unila.ac.id/id/file/196557', 'filename': 'Artikel Pengabdian Masyarakat Syaiful Bahri  SEmNas FEB 2019.pdf'}], 'main': 'Artikel Pengabdian Masyarakat Syaiful Bahri  SEmNas FEB 2019.pdf', 'docid': 34457, 'language': 'en', 'mime_type': 'application/pdf', 'rev_number': 1}]",article,"[{'id': 'syaiful.bahri@fmipa.unila.ac.id', 'name': {'family': 'Bahri', 'lineage': None, 'honourific': None, 'given': 'Syaiful'}}, {'id': 'yuli.ambarwati@fmipa.unila.ac.id', 'name': {'given': 'Yuli', 'family': 'Ambarwati', 'lineage': None, 'honourific': None}}, {'id': 'yulmartin@eng.unila.ac.id', 'name': {'honourific': None, 'family': 'Martin', 'lineage': None, 'given': 'Yul'}}, {'id': 'lina.marlina@fp.unila.ac.id', 'name': {'given': 'Lina', 'honourific': None, 'lineage': None, 'family': 'Marlina'}}]",Edukasi Pengolahan Sampah Plastik Menjadi BBM di Desa Hajimena Kecamatan Natar Kabupaten Lampung Selatan,TRUE,,['QC'],"Kegiatan pengabdian ini bertujuan untuk:  (1) meningkatkan pengetahuan dan kesadaran masyakat untuk memilah sampah organik dan anorganik sebagai kunci awal penerapan konsep 3R (2) meningkatkan pengetahuan dan keterampilan masyarakat dalam pengolahan sampah plastik menjadi BBM jenis solar, minyak tanah dan premium (3) Terjalinnya inisiatif kerjasama perguruan tinggi, pemerintah desa dan warga  dalam rangka pemberdayaan ekonnomi masyarakat menju pengolahan sampah mandiri dan terpadu. Khalayak sasaran kegiatan PPM adalah aparat desa, para pengurus BUMDES, ibu-ibu PKK, dan remaja di Desa Hajimena sebanyak 50 orang. Kegiatan telah dilaksanakan pada tanggal 9 Oktober 2019.  Metode kegiatan PPM menggunakan metode ceramah dan demonstrasi. Langkah-langkah kegiatan PPM adalah ceramah untuk menjelaskan kajian sampah, jenis sampah, dan sumber sampah, pengelolaan sampah dan 3R (reduce, reuse, recycle), serta pengelolaan sampah anorganik khususnya sampah plastik menjadi bahan bakar minyak.  Kegiatan dilanjutkan dengan tanya jawab, demonstrasi pengelolaan sampah plastik menjadi bahan bakar minyak.  Faktor pendukung kegiatan pengabdian adalah adanya dukungan dari Kepala Desa, Ibu Ketua PKK, dan antusiasme peserta pengabdian, sedangkan faktor penghambat kegiatan adalah keterbatasan waktu pelaksanaan pengabdian.  Kegiatan pengabdian secara keseluruhan dapat dikatakan baik dan berhasil, dilihat dari keberhasilan target jumlah peserta pelatihan (100%), ketercapaian tujuan pelatihan (80%), ketercapaian target materi yang telah direncanakan (80%), dan kemampuan peserta dalam penguasaan materi (80%). Kegiatan pengabdian dapat meningkatkan pengetahuan warga tentang pemilahan sampah organik dan anorganik serta pengelolaan sampah anorganik khususnya sampah palstik menjadi bahan bakar minyak. 

Kata kunci: sampah plastik, bahan bakar minyak, konsep 3R",,http://repository.lppm.unila.ac.id/id/eprint/21072,,call for paper & seminar nasional FEB 2019,disk0/00/02/10/72,['FMIPA4'],,public,2020-05-29 10:19:17,pub,6,,,,,,['Lampung University'],,,,,,,,
30,2023-05-02 01:44:07,,50908,archive,show,,800,,,2023-05-02 01:44:07,"[{'format': 'text', 'main': 'Jurnal Pengabdian Darma Wacana.pdf', 'files': [{'mtime': '2023-05-02 01:33:04', 'hash_type': 'MD5', 'filename': 'Jurnal Pengabdian Darma Wacana.pdf', 'uri': 'http://repository.lppm.unila.ac.id/id/file/547923', 'objectid': 190621, 'filesize': 258484, 'hash': '27f4c0d8766b6cae845a3bcccd5ab85a', 'mime_type': 'application/pdf', 'datasetid': 'document', 'fileid': 547923}], 'docid': 190621, 'mime_type': 'application/pdf', 'language': 'en', 'rev_number': 1, 'eprintid': 50908, 'placement': 1, 'security': 'public', 'pos': 1, 'uri': 'http://repository.lppm.unila.ac.id/id/document/190621'}]",article,"[{'name': {'lineage': None, 'family': 'Bahri', 'honourific': None, 'given': 'Syaiful'}, 'id': 'syaiful.bahri@fmipa.unila.ac.id'}, {'name': {'given': 'Lina', 'family': 'Marlina', 'lineage': None, 'honourific': None}, 'id': 'lina.marlina@fp.unila.ac.id'}, {'id': 'rasmizakiahoktarlina@gmail.com', 'name': {'given': 'Rasmi Zakiah', 'family': 'Oktarlina', 'lineage': None, 'honourific': None}}, {'id': 'yuli.ambarwati@fmipa.unila.ac.id', 'name': {'lineage': None, 'family': 'Ambarwati', 'honourific': None, 'given': 'Yuli'}}, {'name': {'given': 'Mulyono', 'honourific': None, 'lineage': None, 'family': 'Mulyono'}, 'id': 'mulyono@fmipa.unila.ac.id'}, {'id': 'aspita.laila@fmipa.unila.ac.id', 'name': {'family': 'Laila', 'lineage': None, 'honourific': None, 'given': 'Aspita'}}]","Pemberdayaan Masyarakat Desa Kedamaian melalui 
Program Tabur Kompas Darat",TRUE,,['Q1'],"The amount of waste generation in TPA of Kota Agung reaches 9.73 tons per day based on data per 2018, 
which is not managed relatively. Household waste is dominant that approximately 87.75% with compositions 
of the waste around 55.20% organic waste, 16% food waste, and inorganic waste remains. This program is 
initiated due to low public awareness and a lack of concern for waste management. The method to empowering 
the community with a program of Tabur Kompas Darat is drum composting, which is expected to be a solution 
to solve the problem of organic waste, especially kitchen waste, vegetable waste, and food waste. Through the 
composting process using organic waste, it is acquired compost and liquid organic fertilizer that is used to
implement by farmers, especially in the Village of Peace, Kota Agung, Tanggamus, Lampung Province, 
Indonesia. Besides, in order to educate to improve knowledge, awareness, skills, and build tripartite cooperation 
through universities, village officials, and communities represented by BUMDES to implement waste 
management independently with the concept of reuse, reduce, and recycle (3R), this program is carried out. 
Keywords: composter, composting drum, organic waste, compost, liquid organic fertilizer",,http://repository.lppm.unila.ac.id/id/eprint/50908,,Jurnal Pengabdian Dharma Wacana,disk0_bak/00/05/09/08,['FMIPA4'],2776-0030 (e),public,2023-05-02 01:44:07,pub,7,Yayasan Pendidikan dan Kebudayaan Dharma Wacana,,,,,['Universitas Lampung'],,,,,,,,
31,2021-11-09 10:05:35,,35664,archive,show,,637,,,2021-11-09 10:05:35,"[{'eprintid': 35664, 'placement': 1, 'security': 'public', 'uri': 'http://repository.lppm.unila.ac.id/id/document/156591', 'pos': 1, 'format': 'text', 'files': [{'mtime': '2021-11-09 07:38:04', 'hash_type': 'MD5', 'uri': 'http://repository.lppm.unila.ac.id/id/file/415012', 'filename': 'Artikel Jurnal Pengabdian - Desa Rukti Endah.docx', 'filesize': 67725, 'objectid': 156591, 'hash': '5093c9b8e5a8077db39ac47946afdc89', 'mime_type': 'application/vnd.openxmlformats-officedocument.wordprocessingml.document', 'fileid': 415012, 'datasetid': 'document'}], 'main': 'Artikel Jurnal Pengabdian - Desa Rukti Endah.docx', 'docid': 156591, 'mime_type': 'application/vnd.openxmlformats-officedocument.wordprocessingml.document', 'language': 'en', 'rev_number': 1}]",article,"[{'name': {'family': 'Bahri', 'lineage': None, 'honourific': None, 'given': 'Syaiful'}, 'id': 'syaiful.bahri@fmipa.unila.ac.id'}, {'name': {'given': 'Yul', 'honourific': None, 'lineage': None, 'family': 'Martin'}, 'id': 'yulmartin@eng.unila.ac.id'}, {'name': {'given': 'Notiragayu', 'family': 'Notiragayu', 'lineage': None, 'honourific': None}, 'id': 'notiragayu@fmipa.unila.ac.id'}, {'id': 'lina.marlina@fp.unila.ac.id', 'name': {'given': 'Lina', 'honourific': None, 'lineage': None, 'family': 'Marlina'}}]",Pupuk Organik Dari Limbah Dapur Untuk Mengatasi Keterbatasan Pupuk Subsidi  Di Desa Rukti Endah Kecamatan Seputih Raman Kabupaten Lampung Tengah,FALSE,,['QD'],"Keterbatasan pupuk subsidi di Desa Rukti Endah Kecamatan Seputih Raman menjadi  permasalahan sebagian besar petani yang berdampak kepada menurunnya hasil pertanian. Solusi permasalahan tersebut dilakukan dalam kegiatan penyuluhan pembuatan pupuk organik yang dilakukan oleh akademisi Universitas Lampung dalam program pengabdian masyarakat dengan tema “Pupuk Organik dari sampah dapur untuk mengatasi keterbatasan pupuk subsidi”. Pengolahan sampah organik menjadi kompos dilakukan dengan menggunakan tabung biru sebagai wadah pengomposan, dan bioaktivator berupa mikroorganisme lokal (MoL) untuk mengubah sampah organik berupa sayur, buah, dan daun menjadi pupuk organic cair (POC) dan kompos. Kegiatan pengabdian dilakukan pada tanggal 29 Juni 2021 berupa demonstrasi pembuatan kompos di Balai Desa Rukti Endah yang dihadiri oleh 30 orang masyarakat serta aparat desa, dimulai dengan pembuatan mikroorganisme lokal (MoL) berbahan dasar air cucian beras, hasil fermentasi yang telah ditambahkan dengan larutan gula merah menghasilkan Mol yang digunakan sebagai pengurai sampah organik. Disamping penggunaan MoL juga dilakukan pembuatan larutan induk berbahan dasar minyak nabati, minyak hewani dan minyak bumi. Larutan induk dicampur dengan temu-temuan untuk selanjutnya digunakan sebagai bahan pembuat turunan dari pupuk organic cair.  Dengan penggunaan larutan induk, proses pengomposan berjalan lebih cepat sehingga pupuk organik cair (POC) dihasilkan pada hari ke-7 setelah pelaksanaan, dan kompos pada hari ke 14. Kegiatan ini telah mengubah pola pikir masyarakat terhadap sampah domestic, khususnya sampah organik. Pembinaan lanjutan oleh aparat Desa diharapkan dapat menjaga kebiasaan baru ini sehingga tercipta lingkungan yang bersih, sehat dan pertanian yang lebih subur.

Kata kunci : Kompos; pupuk organik cair (POC); sampah organik.",,http://repository.lppm.unila.ac.id/id/eprint/35664,,Community Empowerment,disk0/00/03/56/64,['FMIPA4'],2621-4024,public,2021-11-09 10:05:35,submitted,6,Universitas Muhammadiyah Magelang,,,,,,,,,,,,,
32,2023-05-15 01:19:53,,51526,archive,show,,134,,https://journal.ubb.ac.id/index.php/jtms/article/view/3819/2089,2023-05-15 01:19:53,"[{'format': 'text', 'main': 'Darmawan-1.pdf', 'docid': 249059, 'files': [{'filename': 'Darmawan-1.pdf', 'uri': 'http://repository.lppm.unila.ac.id/id/file/610413', 'objectid': 249059, 'filesize': 4957037, 'mtime': '2023-05-12 13:23:15', 'hash_type': 'MD5', 'mime_type': 'application/pdf', 'hash': '27472d476b074ddda55bcd399ef17591', 'datasetid': 'document', 'fileid': 610413}], 'language': 'en', 'rev_number': 1, 'mime_type': 'application/pdf', 'eprintid': 51526, 'placement': 1, 'security': 'public', 'pos': 1, 'uri': 'http://repository.lppm.unila.ac.id/id/document/249059'}]",article,"[{'name': {'given': 'Muhammad', 'lineage': None, 'family': 'Darmawan', 'honourific': None}, 'id': None}, {'id': 'agus.setyawan@fp.unila.ac.id', 'name': {'lineage': None, 'family': 'Setyawan', 'honourific': None, 'given': 'Agus'}}, {'name': {'given': 'Ni Luh Gede Ratna', 'honourific': None, 'lineage': None, 'family': 'Juliasih'}, 'id': 'niluhratna.juliasih@fmipa.ac.id'}, {'name': {'given': 'Hilma Putri', 'honourific': None, 'lineage': None, 'family': 'Fidyandini'}, 'id': 'hilma.putri@fp.unila.ac.id'}]",The effectiveness of pacific white shrimp (Litopenaus vannamei) protection against white spot syndrome virus (WSSV) infection by supplementation of sodium alginate of Sargassum sp. from Lampung waters and combination with vitamin C,TRUE,,['Q1'],"White   spot   syndrome   virus   (WSSV)   merupakan   salah   satu   penyakit   infeksi   virus   yang   dapat menyebabkan  tingginya  mortalitas  pada budidaya  udang  vaname.  Natrium  alginat  terbukti  dapat merangsang  dan  meningkatkan  respon  imun  nonspesifik  pada  udang.  Penelitian  ini  bertujuan  untuk mengevaluasi efektivitas pemberian natriumalginat Sargassumsp. dari perairan Lampung dan kombinasi denganvitamin  C  sebagai  perlindungan  terhadap  serangan  white  spot  syndrome  virus  (WSSV)  pada udang vaname (Litopenaeus vannamei). Udang (±19 g) dipelihara dalam 9 kontainer dengan kepadatan masing-masing  10  ekor/kontainer  dan  diberi  pakan  3%  dari  bobot  biomassasetiap  hari.  Udang dikelompokkan menjadi tiga perlakuan dengan masing-masing 3 ulangan yaitu pakan tanpa suplementasi alginat sebagai kontrol, suplementasi pakan natrium alginat Sargassumsp. dengan dosis 1 g/kg pakan + vitamin C 0,2 g/kg pakan, dan suplementasi pakan natrium alginat Sargassumsp. dengan dosis 2 g/kg pakan.  Setelah  14  hari  diberi  perlakuan,  udang  diinjeksikan  filtrat white  spot  syndrome  virusdan phosphate  buffer  saline(PBS)dengan  perbandingan  1:1  untuk  uji  tantang.Parameter  yang  diamati meliputi  kelangsungan  hidup, relative  percent  survival(RPS), mean  time  to  death(MTD),  tingkah  laku dan gejala klinis udang, histologi hepatopankreas, identifikasi white spot syndrome virusdengan PCR, dan kualitas air. Hasil penelitian menunjukkan bahwa suplementasi natrium alginat Sargassumsp. melindungi udang terhadap white spot syndrome virus14,80 jam lebih lama dalam kelangsungan hidup dibandingkan dengan  kelompok  kontrol.  Namun  suplementasi  natrium  alginat Sargassumsp.  dari  perairan  Lampung belum  mampu  melindungi  udang  terhadap white  spot  syndrome  virussetelah  72  jam  terinfeksi.  Perlu pengujian konsentrasi virus (LD50) sebelum uji tantang untuk menghindari konsentrasi virus yang terlalu tinggi saat uji tantang.Kata kunci :Imunoproteksi, udang vaname, Sargassum sp., natrium alginat, white spot syndrome virus",,http://repository.lppm.unila.ac.id/id/eprint/51526,,Journal of Tropical Marine Science,disk0_bak/00/05/15/26,['FMIPA4'],2623-2235,public,2023-05-15 01:19:53,pub,6,"Fakultas Pertanian Perikanan dan Biologi, Universitas Bangka Belitung",,,,,['Universitas Lampung'],,,,,,,,
33,2020-11-12 02:18:09,,24974,archive,show,,3269,,https://sites.google.com/fmipa.unila.ac.id/icasmi-2020,2020-11-12 02:18:09,"[{'placement': 1, 'eprintid': 24974, 'pos': 1, 'uri': 'http://repository.lppm.unila.ac.id/id/document/38731', 'security': 'public', 'main': 'Devi Nur Anisa.docx', 'docid': 38731, 'files': [{'mime_type': 'application/vnd.openxmlformats-officedocument.wordprocessingml.document', 'hash': 'b63e8a0f4264629a32b99524aad415e1', 'datasetid': 'document', 'fileid': 226250, 'mtime': '2020-11-11 09:24:13', 'hash_type': 'MD5', 'uri': 'http://repository.lppm.unila.ac.id/id/file/226250', 'filename': 'Devi Nur Anisa.docx', 'objectid': 38731, 'filesize': 254970}], 'format': 'text', 'language': 'en', 'rev_number': 1, 'mime_type': 'application/vnd.openxmlformats-officedocument.wordprocessingml.document'}]",conference_item,"[{'name': {'honourific': None, 'family': 'Devi Nur Anisa', 'lineage': None, 'given': 'Anisa'}, 'id': 'devinur@fmipa.unila.ac.id'}, {'name': {'given': 'Ilim', 'honourific': None, 'family': 'Ilim', 'lineage': None}, 'id': 'ilim@fmipa.unila.ac.id'}, {'name': {'honourific': None, 'family': 'Chairil Anwar', 'lineage': None, 'given': 'Anwar'}, 'id': 'chanwar@ugm.ac.id'}, {'id': 'endangastuti.ugm@gmail.com', 'name': {'honourific': None, 'family': 'Endang Astuti', 'lineage': None, 'given': 'Astuti'}}]",Synthesis of Curcumin Analogs Under Ultrasound Irradiation,FALSE,,['QD'],"Curcumin is a secondary metabolite compound which is known to have important biological activities, such as antibacterial, anticancer, antioxidant, antidiabetic and anti-inflammatory properties. In this research, synthesis of curcumin analog compound based on veratraldehyde has been performed. The synthesis stage involves the Claisen-Schimdt condensation of veratraldehyde and cyclopentanone using a base catalyst (KOH) in ethanol as a solvent and performed by ultrasound method for 15 minutes, producing a curcumin analogue compound ((2E, 5E) -2,5-bis (3,4-dimethoxibenzylidine) ) cyclopentanon). The results of these compounds were analyzed using DI-MS, and FTIR spectra. The results showed that 15.4 mmol veratraldehyde synthesized with 7 mmol cyclopentanone using a base catalyst (KOH) in ethanol solvent resulted in a yield of 85.71% and a molecular weight of 380 g/mol. The results of the synthesis of curcumin analog compounds from the ultrasound method are yellow solids with a melting point of 194 °C.",,http://repository.lppm.unila.ac.id/id/eprint/24974,,,disk0/00/02/49/74,['FMIPA4'],,public,2020-11-12 02:18:09,unpub,7,,,,,,"['Universitas Lampung', 'Universitas Gadjah Mada']",FMIPA Universitas Lampung,lecture,3-4 september 2020,conference,3RD INTERNATIONAL CONFERENCE ON APPLIED SCIENCE MATHEMATICS AND INFORMATICS  (3RD ICASMI),,,
34,2022-07-06 07:41:24,,43001,archive,show,,958,,,2022-07-06 07:41:24,"[{'uri': 'http://repository.lppm.unila.ac.id/id/document/164844', 'pos': 1, 'security': 'public', 'placement': 1, 'eprintid': 43001, 'language': 'en', 'mime_type': 'application/pdf', 'rev_number': 1, 'main': 'SK Pembimbing Tesis smt genap 20-21.pdf', 'docid': 164844, 'files': [{'hash_type': 'MD5', 'mtime': '2022-07-06 05:00:16', 'objectid': 164844, 'filesize': 1142247, 'uri': 'http://repository.lppm.unila.ac.id/id/file/470716', 'filename': 'SK Pembimbing Tesis smt genap 20-21.pdf', 'datasetid': 'document', 'fileid': 470716, 'mime_type': 'application/pdf', 'hash': '4a676919d6954a1b709a14c443148ef2'}], 'format': 'text'}]",other,"[{'name': {'given': 'Chansyanah', 'lineage': None, 'family': 'Diawati', 'honourific': None}, 'id': 'chansyanah.diawati@fkip.unila.ac.id'}]",SK Pembimbing Tesis S2 Pendidikan IPA Semester Genap 2020/2021,,,['LB2300'],,,http://repository.lppm.unila.ac.id/id/eprint/43001,,,disk0/00/04/30/01,['FMIPA4'],,public,2022-07-06 07:41:24,unpub,7,FKIP Unila,,,,,,,,,,,,,
35,2021-04-13 02:12:40,,29128,archive,show,,564,,,2021-04-13 02:12:40,"[{'pos': 1, 'uri': 'http://repository.lppm.unila.ac.id/id/document/43236', 'security': 'public', 'placement': 1, 'eprintid': 29128, 'mime_type': 'application/pdf', 'language': 'en', 'rev_number': 1, 'main': '2-REVIEWED PROS-NASIONAL.pdf', 'docid': 43236, 'files': [{'filesize': 9834834, 'objectid': 43236, 'uri': 'http://repository.lppm.unila.ac.id/id/file/258340', 'filename': '2-REVIEWED PROS-NASIONAL.pdf', 'hash_type': 'MD5', 'mtime': '2021-04-12 03:50:43', 'datasetid': 'document', 'fileid': 258340, 'mime_type': 'application/pdf', 'hash': '05fbc885a121b1ae67f773b787e81697'}], 'format': 'text'}]",other,"[{'name': {'given': 'Sildianto', 'honourific': None, 'family': 'Dicky', 'lineage': None}, 'id': None}, {'id': 'noviany@fmipa.unila.ac.id', 'name': {'lineage': None, 'family': 'Noviany', 'honourific': None, 'given': 'Noviany'}}, {'name': {'family': 'Andi', 'lineage': None, 'honourific': None, 'given': 'Setiawan'}, 'id': 'andi.setiawan@fmipa.unila.ac.id'}]",Peer reviewed of Optimasi Pemisahan Ekstrak Metanol Kulit Batang Tumbuhan Binahong (Anredera cordifolia) Secara MPLC,,,['QD'],,,http://repository.lppm.unila.ac.id/id/eprint/29128,,,disk0/00/02/91/28,['FMIPA4'],,public,2021-04-13 02:12:40,pub,7,FKIP Universitas  Jambi,,,,,,,,,,,,,
36,2019-04-29 08:17:47,,11272,archive,show,,416,,,2019-04-29 08:17:47,"[{'eprintid': 11272, 'placement': 1, 'security': 'public', 'pos': 1, 'uri': 'http://repository.lppm.unila.ac.id/id/document/24277', 'format': 'text', 'docid': 24277, 'main': '17394-39243-1-PB.pdf', 'files': [{'mtime': '2019-04-24 03:05:33', 'hash_type': 'MD5', 'uri': 'http://repository.lppm.unila.ac.id/id/file/102729', 'filename': '17394-39243-1-PB.pdf', 'filesize': 860367, 'objectid': 24277, 'hash': 'b4b13409fd22db9ed6e7ba256dff15c9', 'mime_type': 'application/pdf', 'datasetid': 'document', 'fileid': 102729}], 'language': 'en', 'mime_type': 'application/pdf', 'rev_number': 1}]",article,"[{'name': {'lineage': None, 'family': 'Emmawaty Sofia', 'honourific': None, 'given': 'ES'}}, {'name': {'honourific': None, 'lineage': None, 'family': 'Tasviri Efkar', 'given': 'TE'}}]",Pengaruh Metode Eksperimen terhadap Peningkatan Keterampilan Berpikir Kritis dan Penguasaan Konsep Termokimia,TRUE,,['L1'],"Penelitian ini bertujuan untuk mendeskripsikan pengaruh metode eksperimen dalam meningkatkan keterampilan berpikir kritis dan penguasaan konsep siswa pada materi termokimia. Penelitian ini menggunakan   metode quasi   experimentdengan   desain pretest-posttest   non equivalent control group. Populasi penelitian ini adalah siswakelas XI IPA salah satu  SMAdi Bandar  Lampung. Penentuansampel  menggunakan cluster  random sampling, diperoleh kelas XI IPA 5 sebagai kelas eksperimen dan XI IPA 7 sebagai kelas  kontrol. Pengaruh metode  eksperimen ditunjukan  dengan  n-Gain  rata-rata keterampilan berpikir kritis dan penguasaan konsep termokimia, serta didukung uji ukuran  pengaruh, dengan n-Gainpadakelas  ekperimen  lebih  tinggi  daripada n-Gainsiswa  di  kelas  kontrol. Hasil  perhitungan uji  pengaruh menunjukan  bahwa nilai  uji  pengaruh  pada kelas  eksperimen  sebesar  0,92  yang  termasuk  dalam kategori “besar”. Berdasarkan hasil tersebut, dapat disimpulkan bahawametode eksperimen  berpengaruh besar dalam  meningkatkan keterampilan berpikir  kritis dan penguasaan konsep siswa pada materi termokimia",,http://repository.lppm.unila.ac.id/id/eprint/11272,,Jurnal Pendidikan dan Pembelajaran Kimia,disk0/00/01/12/72,['FMIPA4'],ISSN: 2302-1772,public,2019-04-29 08:17:47,pub,6,FKIP Unila,,,,,,,,,,,,,
37,2022-12-05 08:12:51,,47134,archive,show,1-8,134,3,https://tabikpun.fmipa.unila.ac.id/index.php/jpkm_tp,2022-12-05 08:12:51,"[{'format': 'text', 'docid': 186099, 'main': 'Tabikpun_November 2022.pdf', 'files': [{'filesize': 897149, 'objectid': 186099, 'uri': 'http://repository.lppm.unila.ac.id/id/file/517748', 'filename': 'Tabikpun_November 2022.pdf', 'hash_type': 'MD5', 'mtime': '2022-12-05 03:18:59', 'fileid': 517748, 'datasetid': 'document', 'mime_type': 'application/pdf', 'hash': '3ddf90ba9af6ece7d16ca56be12c7d72'}], 'rev_number': 1, 'language': 'en', 'mime_type': 'application/pdf', 'eprintid': 47134, 'placement': 1, 'security': 'public', 'pos': 1, 'uri': 'http://repository.lppm.unila.ac.id/id/document/186099'}]",article,"[{'id': 'simparmin@gmail.com', 'name': {'given': 'Simparmin', 'honourific': None, 'lineage': None, 'family': 'Ginting'}}, {'id': 'nur.hasanah@fmipa.unila.ac.id', 'name': {'honourific': None, 'lineage': None, 'family': 'Nurhasanah', 'given': 'Nurhasanah'}}, {'id': None, 'name': {'lineage': None, 'family': 'wardoyo', 'honourific': None, 'given': 'heri'}}, {'name': {'lineage': None, 'family': 'Juliasih', 'honourific': None, 'given': 'Ni Luh Gede Ratna'}, 'id': 'niluhratna.juliasih@fmipa.ac.id'}, {'name': {'given': 'Thalya', 'family': 'Miranda', 'lineage': None, 'honourific': None}, 'id': None}, {'id': None, 'name': {'given': 'Nabila', 'lineage': None, 'family': 'Ulliane', 'honourific': None}}]",Edukasi Teknologi Ecoenzyme dalam Pengolahan Sampah Organik Bagi Tim Penggerak PKK Desa Fajar Baru,TRUE,published,['Q1'],"Teknologi ecoenzyme merupakan salah satu cara pengolahan sampah organik
yang melibatkan proses fermentasi dikombinasikan dengan gula merah/molase
dan air dengan perbandingan tertentu. Cairan ecoenzyme yang dihasilkan
merupakan bahan aktif yang dapat digunakan untuk berbagai kepentingan.
Tujuan kegiatan ini memberikan edukasi kepada Tim Penggerak PKK Desa Fajar
Baru dalam pengolahan sampah organik melalui teknologi ecoenzyme. Kegiatan
dilakukan dalam bentuk ceramah, diskusi dan praktik pembuatan ecoenzyme.
Secara keseluruhan kegiatan edukasi ini memberikan dampak positif bagi Tim
Penggerak PKK Desa Fajar Baru. Hal ini ditunjukkan dengan peningkatan
pengetahuan dalam pengolahan sampah organik untuk dijadikan bahan aktif
dengan skor rata-rata 67,75 %. Berdasarkan hasil tersebut dapat disimpulkan
adanya edukasi teknologi ecoenzyme dapat meningkatkan pengetahuan
masyarakat dalam mengelola sampah organik di lingkungan.
Kata Kunci: Ecoenzyme, Fajar Baru, Lingkungan, Molase, Sampah Organik",3,http://repository.lppm.unila.ac.id/id/eprint/47134,,JURNAL PENGABDIAN KEPADA MASYARAKAT TABIKPUN,disk0/00/04/71/34,['FMIPA4'],745-7699,public,2022-12-05 08:12:51,pub,7,"Fakultas MIPA, UNILA",,,,,['Universitas Lampung'],,,,,,,,
