,datestamp,id_number,eprintid,eprint_status,metadata_visibility,pagerange,userid,number,official_url,lastmod,documents,type,creators,title,refereed,date_type,subjects,abstract,volume,uri,related_url,publication,dir,divisions,issn,full_text_status,status_changed,ispublished,rev_number,publisher,keywords,contact_email,referencetext,contributors,corp_creators,event_location,pres_type,event_dates,event_type,event_title,funders,projects,succeeds
91,2020-07-08 03:56:41,,23038,archive,show,,320,,,2020-07-08 03:56:41,"[{'language': 'en', 'rev_number': 1, 'mime_type': 'application/pdf', 'format': 'text', 'main': '8. Influence Of Gambier Extrakt Modification as Inhibitor of Calcium Sulfate Scale Formation.pdf', 'docid': 36597, 'files': [{'uri': 'http://repository.lppm.unila.ac.id/id/file/211319', 'filename': '8. Influence Of Gambier Extrakt Modification as Inhibitor of Calcium Sulfate Scale Formation.pdf', 'filesize': 939971, 'objectid': 36597, 'mtime': '2020-07-08 03:16:02', 'hash_type': 'MD5', 'mime_type': 'application/pdf', 'hash': '793ae4029834621ade567372ba98f409', 'fileid': 211319, 'datasetid': 'document'}], 'security': 'public', 'pos': 1, 'uri': 'http://repository.lppm.unila.ac.id/id/document/36597', 'eprintid': 23038, 'placement': 1}]",other,"[{'id': 'heri.satria@fmipa.unila.ac.id', 'name': {'given': 'Heri', 'honourific': None, 'lineage': None, 'family': 'Satria'}}]","Peer Review Journal Suharso, Suharso and ., Buhani and Tugiyono, Tugiyono and Satria, Heri (2019) INFLUENCE OF GAMBIER EXTRACT MODIFICATION AS INHIBITOR OF CALCIUM SULFATE SCALE FORMATION. Desalination and Water Treatment, 169. pp. 22-28. ISSN 19443994, 19443986",,,['QD'],,,http://repository.lppm.unila.ac.id/id/eprint/23038,,,disk0/00/02/30/38,['FMIPA4'],,public,2020-07-08 03:56:41,pub,7,Desalination and Water Treatment,,,,,,,,,,,,,
92,2020-07-08 03:56:50,,23041,archive,show,,320,,,2020-07-08 03:56:50,"[{'mime_type': 'application/pdf', 'language': 'en', 'rev_number': 1, 'files': [{'fileid': 211337, 'datasetid': 'document', 'mime_type': 'application/pdf', 'hash': '554a1fb6f9556cba0c7e56c5040407d8', 'objectid': 36600, 'filesize': 517249, 'uri': 'http://repository.lppm.unila.ac.id/id/file/211337', 'filename': '9. Liquid Smoke of Coconut Shell As Green Inhibitor of Calsium Carbonate Scale Formations.pdf', 'hash_type': 'MD5', 'mtime': '2020-07-08 03:24:00'}], 'main': '9. Liquid Smoke of Coconut Shell As Green Inhibitor of Calsium Carbonate Scale Formations.pdf', 'docid': 36600, 'format': 'text', 'uri': 'http://repository.lppm.unila.ac.id/id/document/36600', 'pos': 1, 'security': 'public', 'placement': 1, 'eprintid': 23041}]",other,"[{'id': 'heri.satria@fmipa.unila.ac.id', 'name': {'honourific': None, 'family': 'Satria', 'lineage': None, 'given': 'Heri'}}]","Peer Review Journal Suharso, Suharso and Kiswandono, Agung Abadi and ., Buhani and Satria, Heri (2019) LIQUID SMOKE OF COCONUT SHELL AS GREEN INHIBITOR OF CALCIUM CARBONATE SCALE FORMATION. Desalination and Water Treatment, 169. pp. 29-37. ISSN 19443994, 19443986",,,['QD'],,,http://repository.lppm.unila.ac.id/id/eprint/23041,,,disk0/00/02/30/41,['FMIPA4'],,public,2020-07-08 03:56:50,pub,7,Desalination and Water Treatment,,,,,,,,,,,,,
93,2020-07-08 01:28:19,,23021,archive,show,,320,,,2020-07-08 01:28:19,"[{'placement': 1, 'eprintid': 23021, 'uri': 'http://repository.lppm.unila.ac.id/id/document/36580', 'pos': 1, 'security': 'public', 'main': '4. Efficient Hydrolysis of Lignocellulose by Acidic Ionic Liquids under Low-Toxic Condition to Microorganisms.pdf', 'files': [{'fileid': 211182, 'datasetid': 'document', 'hash': 'f38f953c9206948f298f1e63c1013b28', 'mime_type': 'application/pdf', 'objectid': 36580, 'filesize': 942271, 'filename': '4. Efficient Hydrolysis of Lignocellulose by Acidic Ionic Liquids under Low-Toxic Condition to Microorganisms.pdf', 'uri': 'http://repository.lppm.unila.ac.id/id/file/211182', 'hash_type': 'MD5', 'mtime': '2020-07-07 08:52:22'}], 'docid': 36580, 'format': 'text', 'rev_number': 1, 'language': 'en', 'mime_type': 'application/pdf'}]",other,"[{'id': 'heri.satria@fmipa.unila.ac.id', 'name': {'given': 'Heri', 'lineage': None, 'family': 'Satria', 'honourific': None}}]","Peer Review Jurnal Kuroda, Kosuke and Inoue, Ken and Miyamura, Kyohei and Satria, Heri and Takada, Kenji and Ninomiya, Kazuaki and Takahashi, Kenji (2017) Efficient Hydrolysis of Lignocellulose by Acidic Ionic Liquids under Low-Toxic Condition to Microorganisms. Catalysts, 7 (4). pp. 108-117.",,,['QD'],,,http://repository.lppm.unila.ac.id/id/eprint/23021,,,disk0/00/02/30/21,['FMIPA4'],,public,2020-07-08 01:28:19,pub,7,MDPI Open Access Journal,,,,,,,,,,,,,
94,2020-07-08 01:37:40,,23031,archive,show,,320,,,2020-07-08 01:37:40,"[{'mime_type': 'application/pdf', 'language': 'en', 'rev_number': 1, 'files': [{'hash_type': 'MD5', 'mtime': '2020-07-07 09:42:03', 'filesize': 541828, 'objectid': 36590, 'uri': 'http://repository.lppm.unila.ac.id/id/file/211252', 'filename': '11. Carboxylate type zwitterion with DMSO co-solvent for one-pot ethanol fermentation from plant biomass.pdf', 'datasetid': 'document', 'fileid': 211252, 'hash': '41e6b2e512c03e0400de959288e9d52a', 'mime_type': 'application/pdf'}], 'main': '11. Carboxylate type zwitterion with DMSO co-solvent for one-pot ethanol fermentation from plant biomass.pdf', 'docid': 36590, 'format': 'text', 'uri': 'http://repository.lppm.unila.ac.id/id/document/36590', 'pos': 1, 'security': 'public', 'placement': 1, 'eprintid': 23031}]",other,"[{'id': 'heri.satria@fmipa.unila.ac.id', 'name': {'honourific': None, 'lineage': None, 'family': 'Satria', 'given': 'Heri'}}]","Peer Review Poster Satria, Heri and Kuroda, Kosuke and Miyamura, Kyohei and Ninomiya, Kazuaki and Takahashi, Kenji (2016) Poster : Carboxylate type zwitterion with DMSO co-solvent for one-pot ethanol fermentation from plant biomass. In: Hokuriku district lecture and research presentation, 25 November 2017, Fukui Institute of Technology Fukui Campus, JAPAN.",,,['QD'],,,http://repository.lppm.unila.ac.id/id/eprint/23031,,,disk0/00/02/30/31,['FMIPA4'],,public,2020-07-08 01:37:40,pub,7,Fukui Institute of Technology Fukui Campus,,,,,,,,,,,,,
95,2020-07-08 01:38:19,,23032,archive,show,,320,,,2020-07-08 01:38:19,"[{'security': 'public', 'uri': 'http://repository.lppm.unila.ac.id/id/document/36591', 'pos': 1, 'eprintid': 23032, 'placement': 1, 'language': 'en', 'mime_type': 'application/pdf', 'rev_number': 1, 'format': 'text', 'files': [{'mtime': '2020-07-07 09:44:22', 'hash_type': 'MD5', 'uri': 'http://repository.lppm.unila.ac.id/id/file/211259', 'filename': '12.  Efficient hydrolysis of polysaccharides in bagasse by in situ synthesis of an acidic ionic liquid..pdf', 'filesize': 977271, 'objectid': 36591, 'hash': '9b1e97af88375dc4d8f2ed607eb3fb90', 'mime_type': 'application/pdf', 'fileid': 211259, 'datasetid': 'document'}], 'main': '12.  Efficient hydrolysis of polysaccharides in bagasse by in situ synthesis of an acidic ionic liquid..pdf', 'docid': 36591}]",other,"[{'id': 'heri.satria@fmipa.unila.ac.id', 'name': {'given': 'Heri', 'family': 'Satria', 'lineage': None, 'honourific': None}}]","Peer Review Poster Satria, Heri and Kuroda, Kosuke and Ninomiya, Kazuaki and Takahashi, Kenji (2016) POSTER : Efficient hydrolysis of polysaccharides in bagasse by in situ synthesis of an acidic ionic liquid. In: 6th Ionic Liquid Meeting, Ionic Liquid Research Assosiation Japan, 26-27 October 2015, Doshisha University, Kyoto, JAPAN.",,,['QD'],,,http://repository.lppm.unila.ac.id/id/eprint/23032,,,disk0/00/02/30/32,['FMIPA4'],,public,2020-07-08 01:38:19,pub,7,Ionic Liquid Research Assosiation Japan,,,,,,,,,,,,,
96,2020-07-08 01:27:42,,23016,archive,show,,320,,,2020-07-08 01:27:42,"[{'language': 'en', 'mime_type': 'application/pdf', 'rev_number': 1, 'main': '2. Design of Wall-Destructive but Membrane-Compatible Solvents.pdf', 'files': [{'hash_type': 'MD5', 'mtime': '2020-07-07 08:34:39', 'objectid': 36576, 'filesize': 548083, 'filename': '2. Design of Wall-Destructive but Membrane-Compatible Solvents.pdf', 'uri': 'http://repository.lppm.unila.ac.id/id/file/211152', 'datasetid': 'document', 'fileid': 211152, 'mime_type': 'application/pdf', 'hash': '6634c085b3aaaa116b45abf630d29238'}], 'docid': 36576, 'format': 'text', 'pos': 1, 'uri': 'http://repository.lppm.unila.ac.id/id/document/36576', 'security': 'public', 'placement': 1, 'eprintid': 23016}]",other,"[{'id': 'heri.satria@fmipa.unila.ac.id', 'name': {'given': 'Heri', 'lineage': None, 'family': 'Satria', 'honourific': None}}]","Peer Review of Kuroda, Kosuke and Satria, Heri and Miyamura, Kyohei and Tsuge, Yota and Ninomiya, Kazuaki and Takahashi, Kenji (2017) Design of Wall-Destructive but Membrane-Compatible Solvents. Journal of The American Chemical Society, 139 (45). pp. 16052-16055. ISSN 0002-7863",,,['QD'],,,http://repository.lppm.unila.ac.id/id/eprint/23016,,,disk0/00/02/30/16,['FMIPA4'],,public,2020-07-08 01:27:42,pub,7,Royal Society of Chemistry,,,,,,,,,,,,,
97,2020-07-08 01:28:01,,23017,archive,show,,320,,,2020-07-08 01:28:01,"[{'pos': 1, 'uri': 'http://repository.lppm.unila.ac.id/id/document/36577', 'security': 'public', 'placement': 1, 'eprintid': 23017, 'language': 'en', 'rev_number': 1, 'mime_type': 'application/pdf', 'main': 'Design_of_Wall_Destructive_but_Membrane_Compatible.pdf', 'docid': 36577, 'files': [{'hash_type': 'MD5', 'mtime': '2020-07-07 08:36:46', 'filesize': 1714805, 'objectid': 36577, 'uri': 'http://repository.lppm.unila.ac.id/id/file/211159', 'filename': 'Design_of_Wall_Destructive_but_Membrane_Compatible.pdf', 'datasetid': 'document', 'fileid': 211159, 'mime_type': 'application/pdf', 'hash': '48b1b99f2bb90dc61f46f8f4f23c4e17'}], 'format': 'text'}]",other,"[{'id': 'heri.satria@fmipa.unila.ac.id', 'name': {'given': 'Heri', 'honourific': None, 'lineage': None, 'family': 'Satria'}}]","Peer Review of Kuroda, Kosuke and Satria, Heri and Miyamura, Kyohei and Tsuge, Yota and Ninomiya, Kazuaki and Takahashi, Kenji (2017) Design of Wall-Destructive but Membrane-Compatible Solvents. Journal of The American Chemical Society, 139 (45). pp. 16052-16055. ISSN 0002-7863",,,['QD'],,,http://repository.lppm.unila.ac.id/id/eprint/23017,,,disk0/00/02/30/17,['FMIPA4'],,public,2020-07-08 01:28:01,pub,7,Royal Society of Chemistry,,,,,,,,,,,,,
98,2020-07-08 01:34:23,,23029,archive,show,,320,,,2020-07-08 01:34:23,"[{'security': 'public', 'uri': 'http://repository.lppm.unila.ac.id/id/document/36588', 'pos': 1, 'eprintid': 23029, 'placement': 1, 'language': 'en', 'mime_type': 'application/pdf', 'rev_number': 1, 'format': 'text', 'docid': 36588, 'main': '10. Impact Ionic Liquid [Emim]OAc to Cellulose Hydrolysis Activities of Indigenous Microorganisms (IMO’s) on Cassava Peels Substrate..pdf', 'files': [{'hash_type': 'MD5', 'mtime': '2020-07-07 09:25:21', 'objectid': 36588, 'filesize': 946527, 'filename': '10. Impact Ionic Liquid [Emim]OAc to Cellulose Hydrolysis Activities of Indigenous Microorganisms (IMO’s) on Cassava Peels Substrate..pdf', 'uri': 'http://repository.lppm.unila.ac.id/id/file/211238', 'datasetid': 'document', 'fileid': 211238, 'hash': '3835d85775578922ef49b9b0f19570e6', 'mime_type': 'application/pdf'}]}]",other,"[{'id': 'heri.satria@fmipa.unila.ac.id', 'name': {'honourific': None, 'family': 'Satria', 'lineage': None, 'given': 'Heri'}}]","Peer Review of Satria, Heri and Nurhasanah, Nurhasanah and Laila, Aspita and Herasari, Dian (2018) PROSIDING : Impact Ionic Liquid [Emim]OAc to Cellulose Hydrolysis Activities of Indigenous Microorganisms (IMO’s) on Cassava Peels Substrate. In: 5th International Symposium on Innovative Bio-Production Indonesia, 10 Oct 2018, Bogor, Indonesia.",,,['QD'],,,http://repository.lppm.unila.ac.id/id/eprint/23029,,,disk0/00/02/30/29,['FMIPA4'],,public,2020-07-08 01:34:23,pub,7,ISIBIO Proceeding,,,,,,,,,,,,,
99,2020-07-08 01:23:52,https://doi.org/10.1039/C8NJ01912F,23014,archive,show,,320,,http://pubs.rsc.org/en/content/articlehtml/2018/nj/c8nj01912f,2020-07-08 01:23:52,"[{'rev_number': 1, 'language': 'en', 'mime_type': 'application/pdf', 'main': '1. Dimethyl sulfoxide enhances both the cellulose dissolution ability and biocompatibility of a carboxylate-type liquid zwitterion.pdf', 'files': [{'mtime': '2020-07-07 08:28:09', 'hash_type': 'MD5', 'filename': '1. Dimethyl sulfoxide enhances both the cellulose dissolution ability and biocompatibility of a carboxylate-type liquid zwitterion.pdf', 'uri': 'http://repository.lppm.unila.ac.id/id/file/211137', 'objectid': 36574, 'filesize': 542869, 'hash': '78aea4df4d36a71bff3b97b996670432', 'mime_type': 'application/pdf', 'datasetid': 'document', 'fileid': 211137}], 'docid': 36574, 'format': 'text', 'uri': 'http://repository.lppm.unila.ac.id/id/document/36574', 'pos': 1, 'security': 'public', 'placement': 1, 'eprintid': 23014}]",other,"[{'name': {'given': 'Heri', 'honourific': None, 'family': 'Satria', 'lineage': None}, 'id': 'heri.satria@fmipa.unila.ac.id'}]","Peer review Satria, Heri and Kuroda, Kosuke and Tsuge, Yota and Ninomiya, Kazuaki and Takahashi, Kenji (2018) Dimethyl sulfoxide enhances both the cellulose dissolution ability and biocompatibility of a carboxylate-type liquid zwitterion. New Journal of Chemistry, 42 (16). pp. 13225-13228. ISSN 1144-0546",,published,['QD'],"The cellulose dissolution ability of a liquid zwitterion, the most biocompatible cellulose solvent, was improved by adding a co-solvent, dimethylsulfoxide. Moreover, the biocompatibility of the liquid zwitterion was also improved by adding dimethylsulfoxide although it is toxic relative to the liquid zwitterion. This mixture is an efficient and extremely biocompatible cellulose solvent.",,http://repository.lppm.unila.ac.id/id/eprint/23014,,,disk0/00/02/30/14,['FMIPA4'],,public,2020-07-08 01:23:52,pub,8,Royal Society of Chemistry,,,,,,,,,,,,,
100,2021-03-10 02:52:50,,28321,archive,show,,320,,,2021-03-10 02:52:50,"[{'language': 'en', 'rev_number': 1, 'mime_type': 'application/pdf', 'format': 'text', 'docid': 42363, 'main': 'Similarity_Extracellular_hydrolytic_enzyme_activities_Heri Satria.pdf', 'files': [{'mtime': '2021-03-10 02:44:44', 'hash_type': 'MD5', 'uri': 'http://repository.lppm.unila.ac.id/id/file/251818', 'filename': 'Similarity_Extracellular_hydrolytic_enzyme_activities_Heri Satria.pdf', 'filesize': 2634081, 'objectid': 42363, 'hash': '249aea1c2b88f4b4708afb063646ed1d', 'mime_type': 'application/pdf', 'fileid': 251818, 'datasetid': 'document'}], 'security': 'public', 'pos': 1, 'uri': 'http://repository.lppm.unila.ac.id/id/document/42363', 'eprintid': 28321, 'placement': 1}]",other,"[{'id': 'heri.satria@fmipa.unila.ac.id', 'name': {'family': 'Satria', 'lineage': None, 'honourific': None, 'given': 'Heri'}}]",Similarity Check Biocatalysis and Agricultural Biotechnology,,,['QD'],,,http://repository.lppm.unila.ac.id/id/eprint/28321,,,disk0/00/02/83/21,['FMIPA4'],,public,2021-03-10 02:52:50,unpub,7,Biocatalysis and Agricultural Biotechnology,,,,,,,,,,,,,
101,2020-07-08 03:56:45,,23040,archive,show,,320,,,2020-07-08 03:56:45,"[{'files': [{'fileid': 211330, 'datasetid': 'document', 'hash': '3f37fb72c66326f3a1e9ca1def3a3075', 'mime_type': 'application/pdf', 'hash_type': 'MD5', 'mtime': '2020-07-08 03:21:12', 'filesize': 2706031, 'objectid': 36599, 'uri': 'http://repository.lppm.unila.ac.id/id/file/211330', 'filename': 'INFLUENCE_OF_GAMBIER_EXTRACT_MODIFICATION_AS_INHIB.pdf'}], 'main': 'INFLUENCE_OF_GAMBIER_EXTRACT_MODIFICATION_AS_INHIB.pdf', 'docid': 36599, 'format': 'text', 'rev_number': 1, 'language': 'en', 'mime_type': 'application/pdf', 'placement': 1, 'eprintid': 23040, 'uri': 'http://repository.lppm.unila.ac.id/id/document/36599', 'pos': 1, 'security': 'public'}]",other,"[{'id': 'heri.satria@fmipa.unila.ac.id', 'name': {'given': 'Heri', 'honourific': None, 'lineage': None, 'family': 'Satria'}}]","Similarity Check Result od Suharso, Suharso and ., Buhani and Tugiyono, Tugiyono and Satria, Heri (2019) INFLUENCE OF GAMBIER EXTRACT MODIFICATION AS INHIBITOR OF CALCIUM SULFATE SCALE FORMATION. Desalination and Water Treatment, 169. pp. 22-28. ISSN 19443994, 19443986",,,['QD'],,,http://repository.lppm.unila.ac.id/id/eprint/23040,,,disk0/00/02/30/40,['FMIPA4'],,public,2020-07-08 03:56:45,pub,7,Desalination and Water Treatment,,,,,,,,,,,,,
102,2020-07-08 01:33:07,,23026,archive,show,,320,,,2020-07-08 01:33:07,"[{'language': 'en', 'rev_number': 1, 'mime_type': 'application/pdf', 'main': 'Hydrolysis_of_Cellulose_Using_an_Acidic_and_Hydrop (1).pdf', 'docid': 36585, 'files': [{'objectid': 36585, 'filesize': 2481161, 'filename': 'Hydrolysis_of_Cellulose_Using_an_Acidic_and_Hydrop (1).pdf', 'uri': 'http://repository.lppm.unila.ac.id/id/file/211217', 'hash_type': 'MD5', 'mtime': '2020-07-07 09:18:59', 'datasetid': 'document', 'fileid': 211217, 'mime_type': 'application/pdf', 'hash': 'f4cd25641dfb097395919474f72ea2af'}], 'format': 'text', 'pos': 1, 'uri': 'http://repository.lppm.unila.ac.id/id/document/36585', 'security': 'public', 'placement': 1, 'eprintid': 23026}]",other,"[{'name': {'given': 'Heri', 'honourific': None, 'family': 'Satria', 'lineage': None}, 'id': 'heri.satria@fmipa.unila.ac.id'}]","Similarity Check Result of Kuroda, Kosuke and Miyamura, Kyohei and Satria, Heri and Takada, Kenji and Ninomiya, Kazuaki and Takashi, Kenji (2016) Hydrolysis of Cellulose Using an Acidic and Hydrophobic Ionic Liquid and Subsequent Separation of Glucose Aqueous Solution from the Ionic Liquid and 5‑(Hydroxymethyl)furfural. ACS Sustainable Chemistry & Engineering, 4 (6). pp. 3352-3356. ISSN 2168-0485",,,['QD'],,,http://repository.lppm.unila.ac.id/id/eprint/23026,,,disk0/00/02/30/26,['FMIPA4'],,public,2020-07-08 01:33:07,pub,7,Royal Society of Chemistry,,,,,,,,,,,,,
103,2020-07-08 01:31:07,,23024,archive,show,,320,,,2020-07-08 01:31:07,"[{'format': 'text', 'main': 'Efficient_Hydrolysis_of_Polysaccharides_in_Bagasse.pdf', 'docid': 36583, 'files': [{'hash_type': 'MD5', 'mtime': '2020-07-07 09:15:03', 'objectid': 36583, 'filesize': 2556724, 'filename': 'Efficient_Hydrolysis_of_Polysaccharides_in_Bagasse.pdf', 'uri': 'http://repository.lppm.unila.ac.id/id/file/211203', 'fileid': 211203, 'datasetid': 'document', 'hash': 'cc3ae69994747e3a88403c120c1abb19', 'mime_type': 'application/pdf'}], 'language': 'en', 'mime_type': 'application/pdf', 'rev_number': 1, 'eprintid': 23024, 'placement': 1, 'security': 'public', 'uri': 'http://repository.lppm.unila.ac.id/id/document/36583', 'pos': 1}]",other,"[{'id': 'heri.satria@fmipa.unila.ac.id', 'name': {'given': 'Heri', 'honourific': None, 'lineage': None, 'family': 'Satria'}}]","Similarity Check Result of Satria, Heri and Kuroda, Kosuke and Endo, Takatsugu and Takada, Kenji and Ninomiya, Kazuaki and Takahashi, Kenji (2016) Efficient Hydrolysis of Polysaccharides in Bagasse by in Situ Synthesis of an Acidic Ionic Liquid after Pretreatment. ACS Sustainable Chemistry and Engineering, 5 (1). pp. 708-713. ISSN 2168-0485",,,['QD'],,,http://repository.lppm.unila.ac.id/id/eprint/23024,,,disk0/00/02/30/24,['FMIPA4'],,public,2020-07-08 01:31:07,pub,7,Royal Society of Chemistry,,,,,,,,,,,,,
104,2020-07-08 01:34:09,,23028,archive,show,,320,,,2020-07-08 01:34:09,"[{'security': 'public', 'pos': 1, 'uri': 'http://repository.lppm.unila.ac.id/id/document/36587', 'eprintid': 23028, 'placement': 1, 'rev_number': 1, 'language': 'en', 'mime_type': 'application/pdf', 'format': 'text', 'main': 'Production_of_Reducing_Sugar_from_Cassava_Solid_Wa.pdf', 'files': [{'datasetid': 'document', 'fileid': 211231, 'hash': 'e910bb9344b8c6e46544b9172c1a3852', 'mime_type': 'application/pdf', 'hash_type': 'MD5', 'mtime': '2020-07-07 09:23:38', 'filesize': 1829417, 'objectid': 36587, 'uri': 'http://repository.lppm.unila.ac.id/id/file/211231', 'filename': 'Production_of_Reducing_Sugar_from_Cassava_Solid_Wa.pdf'}], 'docid': 36587}]",other,"[{'id': 'heri.satria@fmipa.unila.ac.id', 'name': {'given': 'Heri', 'honourific': None, 'lineage': None, 'family': 'Satria'}}]","Similarity Check Result of Simanjuntak, Wasinton and Satria, Heri and Utami, Nurul (2014) PRODUCTION OF REDUCING SUGAR FROM CASSAVA SOLID WASTE BY SIMULTANEOUS ULTRASONICATION AND ACID HYDROLYSIS. Indonesian Journal of Chemistry, 14 (3). pp. 233-238. ISSN 1411 9420",,,['QD'],,,http://repository.lppm.unila.ac.id/id/eprint/23028,,,disk0/00/02/30/28,['FMIPA4'],,public,2020-07-08 01:34:09,pub,7,Indonesian Journal of Chemistry,,,,,,,,,,,,,
105,2020-07-08 03:56:54,,23042,archive,show,,320,,,2020-07-08 03:56:54,"[{'language': 'en', 'rev_number': 1, 'mime_type': 'application/pdf', 'main': 'LIQUID_SMOKE_OF_COCONUT_SHELL_AS_GREEN_INHIBITOR_O.pdf', 'files': [{'mime_type': 'application/pdf', 'hash': 'c378aea6a0025aa34b6e5364a5a0926f', 'datasetid': 'document', 'fileid': 211344, 'mtime': '2020-07-08 03:25:29', 'hash_type': 'MD5', 'uri': 'http://repository.lppm.unila.ac.id/id/file/211344', 'filename': 'LIQUID_SMOKE_OF_COCONUT_SHELL_AS_GREEN_INHIBITOR_O.pdf', 'filesize': 3385144, 'objectid': 36601}], 'docid': 36601, 'format': 'text', 'uri': 'http://repository.lppm.unila.ac.id/id/document/36601', 'pos': 1, 'security': 'public', 'placement': 1, 'eprintid': 23042}]",other,"[{'id': 'heri.satria@fmipa.unila.ac.id', 'name': {'given': 'Heri', 'honourific': None, 'family': 'Satria', 'lineage': None}}]","Similarity Check Result of Suharso, Suharso and Kiswandono, Agung Abadi and ., Buhani and Satria, Heri (2019) LIQUID SMOKE OF COCONUT SHELL AS GREEN INHIBITOR OF CALCIUM CARBONATE SCALE FORMATION. Desalination and Water Treatment, 169. pp. 29-37. ISSN 19443994, 19443986",,,['QD'],,,http://repository.lppm.unila.ac.id/id/eprint/23042,,,disk0/00/02/30/42,['FMIPA4'],,public,2020-07-08 03:56:54,pub,7,Desalination and Water Treatment,,,,,,,,,,,,,
106,2020-07-08 01:27:04,,23020,archive,show,,320,,,2020-07-08 01:27:04,"[{'pos': 1, 'uri': 'http://repository.lppm.unila.ac.id/id/document/36579', 'security': 'public', 'placement': 1, 'eprintid': 23020, 'language': 'en', 'rev_number': 1, 'mime_type': 'application/pdf', 'files': [{'hash_type': 'MD5', 'mtime': '2020-07-07 08:50:25', 'objectid': 36579, 'filesize': 2236470, 'uri': 'http://repository.lppm.unila.ac.id/id/file/211175', 'filename': 'Efficient_recovery_of_ionic_liquid_by_electrodialy.pdf', 'fileid': 211175, 'datasetid': 'document', 'hash': '6526d3b53ea07aec305cbed1f523d44f', 'mime_type': 'application/pdf'}], 'main': 'Efficient_recovery_of_ionic_liquid_by_electrodialy.pdf', 'docid': 36579, 'format': 'text'}]",other,"[{'id': 'heri.satria@fmipa.unila.ac.id', 'name': {'family': 'Satria', 'lineage': None, 'honourific': None, 'given': 'Heri'}}]","Similarity Check ResultEndo, Takatsugu and Tatsumi, Mai and Kuroda, Kosuke and Satria, Heri and Shimada, Yumiko and Ninomiya, Kazuaki and Takahashi, Kenji (2017) Efficient recovery of ionic liquid by electrodialysis in the acid hydrolysis process. Separation Science and Technology, 52 (7). pp. 1240-1245. ISSN 1520-5754",,,['QD'],,,http://repository.lppm.unila.ac.id/id/eprint/23020,,,disk0/00/02/30/20,['FMIPA4'],,public,2020-07-08 01:27:04,pub,7,Taylor & Francis online,,,,,,,,,,,,,
107,2020-07-08 01:37:29,,23030,archive,show,,320,,,2020-07-08 01:37:29,"[{'placement': 1, 'eprintid': 23030, 'pos': 1, 'uri': 'http://repository.lppm.unila.ac.id/id/document/36589', 'security': 'public', 'main': 'Impact_Ionic_Liquid__Emim_OAc_to_Cellulose_Hydroly.pdf', 'docid': 36589, 'files': [{'datasetid': 'document', 'fileid': 211245, 'mime_type': 'application/pdf', 'hash': '011050839d005e04ae211480746f61f6', 'hash_type': 'MD5', 'mtime': '2020-07-07 09:31:26', 'objectid': 36589, 'filesize': 2178705, 'uri': 'http://repository.lppm.unila.ac.id/id/file/211245', 'filename': 'Impact_Ionic_Liquid__Emim_OAc_to_Cellulose_Hydroly.pdf'}], 'format': 'text', 'mime_type': 'application/pdf', 'language': 'en', 'rev_number': 1}]",other,"[{'name': {'given': 'Heri', 'lineage': None, 'family': 'Satria', 'honourific': None}, 'id': 'heri.satria@fmipa.unila.ac.id'}]","Similarity CheckResult of Satria, Heri and Nurhasanah, Nurhasanah and Laila, Aspita and Herasari, Dian (2018) PROSIDING : Impact Ionic Liquid [Emim]OAc to Cellulose Hydrolysis Activities of Indigenous Microorganisms (IMO’s) on Cassava Peels Substrate. In: 5th International Symposium on Innovative Bio-Production Indonesia, 10 Oct 2018, Bogor, Indonesia.",,,['QD'],,,http://repository.lppm.unila.ac.id/id/eprint/23030,,,disk0/00/02/30/30,['FMIPA4'],,public,2020-07-08 01:37:29,pub,7,ISIBIO Proceeding,,,,,,,,,,,,,
108,2021-02-18 03:57:11,,27959,archive,show,,320,,,2021-02-18 03:57:11,"[{'pos': 1, 'uri': 'http://repository.lppm.unila.ac.id/id/document/41966', 'security': 'public', 'placement': 1, 'eprintid': 27959, 'mime_type': 'application/pdf', 'language': 'en', 'rev_number': 1, 'docid': 41966, 'main': 'Similarity_Review_Extracellular_hydrolytic_enzyme_activities_Heri Satria.pdf', 'files': [{'hash_type': 'MD5', 'mtime': '2021-02-18 02:34:05', 'filesize': 3863910, 'objectid': 41966, 'uri': 'http://repository.lppm.unila.ac.id/id/file/249073', 'filename': 'Similarity_Review_Extracellular_hydrolytic_enzyme_activities_Heri Satria.pdf', 'fileid': 249073, 'datasetid': 'document', 'mime_type': 'application/pdf', 'hash': 'b6be4a087cabab584c50d9493eff3256'}], 'format': 'text'}]",other,"[{'name': {'family': 'Satria', 'lineage': None, 'honourific': None, 'given': 'Heri'}, 'id': 'heri.satria@fmipa.unila.ac.id'}]",Similarity Test and Review OfJournal Biocatalysis and Agricultural Biotechnology- Heri Satria,,,['QD'],,,http://repository.lppm.unila.ac.id/id/eprint/27959,,,disk0/00/02/79/59,['FMIPA4'],,public,2021-02-18 03:57:11,pub,8,Biocatalysis and Agricultural Biotechnology,,,,,,,,,,,,,
