,title,refereed,creators,type,official_url,lastmod,documents,userid,metadata_visibility,datestamp,eprintid,eprint_status,ispublished,rev_number,issn,full_text_status,status_changed,succeeds,divisions,publisher,publication,dir,uri,date,abstract,corp_creators,volume,date_type,subjects,related_url,number,pagerange,id_number,contributors,referencetext,contact_email,event_type,event_title,event_location,event_dates,pres_type,funders
0,Design software for adjusting the frequency of the laser modulation infrared diode portable photoacoustic spectroscopy,FALSE,"[{'name': {'given': 'Donni Kis', 'lineage': None, 'family': 'Apriyanto', 'honourific': None}, 'id': 'donni.kis@fmipa.unila.ac.id'}, {'id': 'gurum@fmipa.unila.ac.id', 'name': {'lineage': None, 'family': 'Pauzi', 'honourific': None, 'given': 'Gurum Ahmad'}}, {'id': 'humairoh.ratu@fmipa.unila.ac.id', 'name': {'honourific': None, 'lineage': None, 'family': 'ayu', 'given': 'Humairoh ratu'}}]",article,https://iopscience.iop.org,2021-06-04 02:55:29,"[{'pos': 7, 'uri': 'http://repository.lppm.unila.ac.id/id/document/145007', 'security': 'public', 'placement': 7, 'eprintid': 32001, 'language': 'en', 'rev_number': 2, 'mime_type': 'application/pdf', 'main': 'Apriyanto_2021_J._Phys. _Conf._Ser._1751_012077.pdf', 'files': [{'fileid': 378772, 'datasetid': 'document', 'mime_type': 'application/pdf', 'hash': '907acfb3558165a7ddf582006cbb3961', 'hash_type': 'MD5', 'mtime': '2021-05-19 09:02:08', 'objectid': 145007, 'filesize': 1440908, 'filename': 'Apriyanto_2021_J._Phys. _Conf._Ser._1751_012077.pdf', 'uri': 'http://repository.lppm.unila.ac.id/id/file/378772'}], 'docid': 145007, 'format': 'text'}]",2782,show,2021-06-04 02:55:29,32001,archive,pub,5,Print : 1742-6588 Online : 1742-6596,public,2021-06-04 02:55:29,30223.0,['FMIPA1'],IOP Publishing,Journal of Physics: Conference Series,disk0/00/03/20/01,http://repository.lppm.unila.ac.id/id/eprint/32001,2021-01-01 00:00:00.000000000,"Photoacoustic spectroscopy can apply in various fields, including in the fields of biology (measuring trachea volume and observing insect breathing patterns), medicine (a measurement of internal disease biomarkers through respiratory gases), environment (measuring NO2 gas in the environment near roads), and agriculture (measurement ethylene gas in postharvest fruit). The existing photoacoustic spectroscopy still has a large size and high operating costs, so it is necessary to design photoacoustic spectroscopy portable and low operating costs. Photoacoustic effects can occur when a modulated radiation source is present in this research, designing software to adjust the infrared diode laser's modulation frequency. There are two tests to see the characteristics of the software made in this study, test for Arduino and the software programs created. Arduino testing resulted in a calibration factor of f_o= 0.9068f_i  + 109.33. Meanwhile, software testing resulted in a calibration factor of f_o= 0.7343f_i  + 462.74. The two tests that have been carried out have different output results. The frequency of the software being made has a smaller calibration factor than the Arduino program's direct output.","['Universitas Lampung', 'Universitas Lampung', 'Universitas Lampung']",1751.0,published,['QC'],,,,,,,,,,,,,
1,Pembinaan Pembuatan Alat Deteksi Dini Gempa Bumi Sederhana dan Trauma Healing untuk Guru-Guru SDN 2 dan SDN 3 Merak Belantung,TRUE,"[{'id': 'donni.kis@fmipa.unila.ac.id', 'name': {'honourific': None, 'lineage': None, 'family': 'Apriyanto', 'given': 'Donni Kis'}}, {'name': {'given': 'Arif', 'honourific': None, 'lineage': None, 'family': 'Surtono'}, 'id': 'arif.surtono@fmipa.unila.ac.id'}, {'id': 'gurum@fmipa.unila.ac.id', 'name': {'honourific': None, 'family': 'Pauzi', 'lineage': None, 'given': 'Gurum Ahmad'}}, {'name': {'lineage': None, 'family': 'Humairoh Ratu Ayu', 'honourific': None, 'given': 'HRA'}, 'id': 'humairoh.ratu@fmipa.unila.ac.id'}, {'name': {'given': 'Syaiful', 'honourific': None, 'family': 'Anwar', 'lineage': None}, 'id': None}, {'id': None, 'name': {'honourific': None, 'lineage': None, 'family': 'Siregar', 'given': 'Gerhat Sebastian'}}]",article,http://ejournal.amikompurwokerto.ac.id,2021-11-06 02:16:37,"[{'eprintid': 35129, 'placement': 7, 'security': 'public', 'uri': 'http://repository.lppm.unila.ac.id/id/document/155910', 'pos': 7, 'format': 'text', 'main': '1132-2938-1-PB.pdf', 'docid': 155910, 'files': [{'mime_type': 'application/pdf', 'hash': '13096eb70833b3e6143c039275257c91', 'fileid': 410753, 'datasetid': 'document', 'mtime': '2021-11-05 15:14:32', 'hash_type': 'MD5', 'filename': '1132-2938-1-PB.pdf', 'uri': 'http://repository.lppm.unila.ac.id/id/file/410753', 'filesize': 605093, 'objectid': 155910}], 'mime_type': 'application/pdf', 'language': 'en', 'rev_number': 1}]",2782,show,2021-11-06 02:16:37,35129,archive,pub,9,26568241,public,2021-11-06 02:16:37,24497.0,['FMIPA1'],Universitas Amikom Purwokerto,Jurnal Pengabdian Mitra Masyarakat,disk0/00/03/51/29,http://repository.lppm.unila.ac.id/id/eprint/35129,2021-04-01 00:00:00.000000000,"Bencana adalah peristiwa atau rangkaian peristiwa yang mengancam dan mengganggu kehidupan dan penghidupan masyarakat yang baik disebabkan, alam oleh faktor dan/atau faktor nonalam maupun faktor manusia sehingga mengakibatkan timbulnya korban jiwa manusia, kerusakan lingkungan, kerugian harta benda, dan dampak psikologis. Indonesia memiliki berbagai ancaman bencana gempa bumi yang dapat terjadi kapanpun. Zona subduksi di sepanjang pantai barat dan sesar aktif yang berada di pulau Sumatera merupakan sumber gempa bumi yang aktif. Berdasarkan hasil studi hazard seismik, diperoleh beberapa kota besar di Sumatra yang mempunyai hazard seismik tinggi seperti Banda Aceh, Padang, Bengkulu dan Bandar Lampung. Kalianda merupakan salah satu kota di Lampung Selatan yang berpeluang mengalami gempa bumi. Kegiatan PkM ini ditujukan untuk meningkatkan pengetahuan  guru-guru yang berasal dari SDN 2 dan SDN 3 Merak Belantung mengenai gempa bumi dan dampaknya. Selain itu, kegiatan ini juga membina guru-guru untuk membuat alat peringatan dini gempa bumi sederhana dan melakukan penyembuhan trauma yang diakibatkan bencana.","['Universitas Lampung', 'Universitas Lampung', 'Universitas Lampung', 'Universitas Lampung', 'Universitas Lampung', 'Universitas Lampung']",3.0,published,['QC'],[{'url': 'https://ejournal.amikompurwokerto.ac.id/index.php/jpmm/article/view/1132'}],1.0,18-27,,,,,,,,,,
2,Improvement High Purity Biogenic Amorphous SiO2 Derived from Rice Husk Ash: Synthesis and its Characterizat,TRUE,"[{'name': {'honourific': None, 'lineage': None, 'family': 'Asmi', 'given': 'Dwi'}, 'id': 'dwiasmi82@yahoo.com'}, {'name': {'family': 'Zulfia', 'lineage': None, 'honourific': None, 'given': 'Anne'}, 'id': 'anne@metal.ui.ac.id'}, {'id': 'mbruddin@eng.unila.ac.id', 'name': {'given': 'Mohammad', 'lineage': None, 'family': 'Badaruddin', 'honourific': None}}]",article,https://www.scientific.net/MSF,2021-11-06 08:22:50,"[{'uri': 'http://repository.lppm.unila.ac.id/id/document/156052', 'pos': 1, 'security': 'public', 'placement': 1, 'eprintid': 35254, 'mime_type': 'application/pdf', 'language': 'en', 'rev_number': 1, 'main': 'MSF.1029.175.pdf', 'files': [{'hash': 'c20242b3d0f4c1bb57a3f59453664254', 'mime_type': 'application/pdf', 'datasetid': 'document', 'fileid': 411732, 'mtime': '2021-11-06 05:58:49', 'hash_type': 'MD5', 'uri': 'http://repository.lppm.unila.ac.id/id/file/411732', 'filename': 'MSF.1029.175.pdf', 'filesize': 787662, 'objectid': 156052}], 'docid': 156052, 'format': 'text'}]",451,show,2021-11-06 08:22:50,35254,archive,pub,6,1662-9752,public,2021-11-06 08:22:50,,['FMIPA1'],"Trans Tech Publications, Switzerland",Materials Science Forum,disk0/00/03/52/54,http://repository.lppm.unila.ac.id/id/eprint/35254,2021-05-04 00:00:00.000000000,"In this work a simple process for the production of high purity biogenic amorphous SiO2 derived from rice husk ash have been studied. Rice husk ash obtained from heat treatment of rice husk and citric acid leaching of rice husk at 700 o C for 6 h. Improvement of purity SiO2 from rice husk ash conducted by precipitation technique. The precipitated SiO2 particles obtained were characterized by x-ray fluorescence (XRF) analysis, Fourier transform infrared (FTIR) spectroscopy, and x-ray diffraction analysis (XRD). The XRF result shows that the high purity of biogenic amorphous SiO2 obtained is 99.258 %. The XRD result shows the silica have amorphous phase and for the FTIR results shows bending and stretching vibration of Si-O and Si-O-Si.",,1029.0,published,['QC'],,1.0,175-180,https://doi.org/10.4028/www.scientific.net/MSF.1029.175,,,,,,,,,
3,"Aplikasi Sensor TGS2620 dan MQ138 untuk Mendeteksi 
Kematangan Buah Durian Berbasis Raspberry Pi 3B",TRUE,"[{'id': 'dewipuspita1060@gmail.com,', 'name': {'given': 'Dewi', 'lineage': None, 'family': 'Dewi Puspitasari', 'honourific': None}}, {'id': 'arif.surtono@fmipa.unila.ac.id', 'name': {'given': 'arifs', 'honourific': None, 'family': 'Arif Surtono', 'lineage': None}}, {'name': {'given': 'suciyati', 'family': 'Sri Wahyu Suciati', 'lineage': None, 'honourific': None}, 'id': 'sri.wahyu@fmipa.unila.ac.id'}, {'name': {'given': 'gurum', 'lineage': None, 'family': 'Gurum Ahmad  Pauzi', 'honourific': None}, 'id': 'gurum@fimpa.unila.ac.id'}]",article,http://jurnal.fmipa.unila.ac.id/index.php/jtaf/,2022-06-06 01:26:24,"[{'pos': 1, 'uri': 'http://repository.lppm.unila.ac.id/id/document/163773', 'security': 'public', 'placement': 1, 'eprintid': 42079, 'mime_type': 'application/pdf', 'language': 'en', 'rev_number': 1, 'main': 'JTAF9-2-2021-DEwiP.pdf', 'files': [{'filesize': 629090, 'objectid': 163773, 'filename': 'JTAF9-2-2021-DEwiP.pdf', 'uri': 'http://repository.lppm.unila.ac.id/id/file/463936', 'hash_type': 'MD5', 'mtime': '2022-06-03 10:01:20', 'fileid': 463936, 'datasetid': 'document', 'mime_type': 'application/pdf', 'hash': 'abf27baf2d50cec1a799a3a3efa45f24'}], 'docid': 163773, 'format': 'text'}]",672,show,2022-06-06 01:26:24,42079,archive,pub,8,2303-016X,public,2022-06-06 01:26:24,,['FMIPA1'],Jurusan Fisika FMIPA Universitas Lampung,Jurnal Teori dan Aplikasi Fisika,disk0/00/04/20/79,http://repository.lppm.unila.ac.id/id/eprint/42079,2021-07-01 00:00:00.000000000,"Research has been carried out by application of the TGS 2620 (alcohol level) and MQ 138 
(methane level) gas sensors to detect the maturity of durian based on Raspberry Pi 3b. This research was 
conducted to produce a detection instrument for the level of durian maturity. Durian is inserted into the 
sample room which contain a gas sensors. The classification method used to determine fruit maturity uses K�Nearest Neighbor (KNN). The KNN test in the durian maturity classification using a gas sensor has accuracy 
based on maturity level, ripe 93,3%; rare 96.6%; raw 93,3%
 
Keywords: Maturity of durian, gas sensor, raspberry pi 3b, KNN","['Universitas Lampung', 'Universitas Lampung', 'Universitas Lampung', 'Universitas Lampung']",9.0,published,['QC'],[{'url': 'http://jurnal.fmipa.unila.ac.id/index.php/jtaf/'}],2.0,167-173,,"[{'type': 'http://www.loc.gov/loc.terms/relators/AUT'}, {'type': 'http://www.loc.gov/loc.terms/relators/AUT'}, {'type': 'http://www.loc.gov/loc.terms/relators/AUT'}, {'type': 'http://www.loc.gov/loc.terms/relators/AUT'}, {'type': 'http://www.loc.gov/loc.terms/relators/AUT'}]",,,,,,,,
4,"Kajian Simulasi Dinamika Molekul Adsorpsi Hidrogen
pada Carbone Nanotube dengan Variasi Chirality dan 
Temperatur Menggunakan Kode LAMMPS",FALSE,"[{'name': {'given': 'E Marinda', 'lineage': None, 'family': 'Erika Marinda M', 'honourific': None}, 'id': ') erikammufida1998@gmail.com'}, {'name': {'given': 'sw suciyati', 'honourific': None, 'lineage': None, 'family': 'Sri Wahyu Suciyati'}, 'id': 'sri.wahyu@fmipa.unila.ac.id'}, {'id': None, 'name': {'family': 'Gurum AP', 'lineage': None, 'honourific': None, 'given': 'Gurum AP'}}, {'name': {'given': 'AMIR SUPRIYANTO', 'honourific': None, 'lineage': None, 'family': 'AMIR SUPRIYANTO'}, 'id': None}]",article,http://jemit.fmipa.unila.ac.id/,2021-11-08 10:13:11,"[{'language': 'id', 'mime_type': 'text/html', 'rev_number': 3, 'content': 'published', 'main': 26, 'docid': 156418, 'files': [{'mtime': '2021-11-08 09:53:36', 'hash_type': 'MD5', 'uri': 'http://repository.lppm.unila.ac.id/id/file/413993', 'filename': 26, 'filesize': 3514, 'objectid': 156418, 'mime_type': 'text/html', 'hash': '964b5cd11fce53712d829ddd6780ed1e', 'fileid': 413993, 'datasetid': 'document'}], 'format': 'text', 'pos': 1, 'uri': 'http://repository.lppm.unila.ac.id/id/document/156418', 'security': 'public', 'placement': 1, 'eprintid': 35543}]",672,show,2021-11-08 10:13:11,35543,archive,pub,8,2747-2043,public,2021-11-08 10:13:11,,['FMIPA1'],Universitas Lampung,"Journal of Energy, Material, and Instrumentation Technology",disk0/00/03/55/43,http://repository.lppm.unila.ac.id/id/eprint/35543,2021-05-31 00:00:00.000000000,"Telah disimulasikan adsorpsi hidrogen pada carbone nanotube untuk
penyerapan optimum hidrogen. Parameter yang mempengaruhi banyaknya
hidrogen terserap telah dikaji, seperti pengaruh chirality dan temperatur
terhadap penyerapan hidrogen pada CNT. Metode simulasi adsorpsi hidrogen
pada carbone nanotube menggunakan simulasi dinamika molekul kode
LAMMPS, menerapkan potensial interatomik Lennard-Jones dan pergerakan
atom hidrogen menggunakan gaya Van Der Waals dengan Ensemble
Mikrokanonikal. Data analisis merupakan keluaran dari LAMMPS berupa data
dengan format XYZ. Data tersebut berisi informasi berupa step integrasi,
jumlah atom, temperatur, tekanan, energi potensial, energi kinetik, volume,
energi van der waals, total waktu simulasi dan penyerapan hidrogen. Hasil
simulasi menunjukkan bahwa penyerapan optimum terjadi pada run 10000
dan temperatur 100 K, untuk chirality armchair sebesar 10 atom, chirality
chiral sebesar 12 atom dan chrality zigzag sebesar 5 atom. Pembentukkan
koordinat hidrogen dengan software Avogadro, pembentukan koordinat CNT
dengan sofware VMD dan visualisasi adsorpsi hidrogen pada CNT
menggunakan software VMD","['Universitas Lampung', 'Universitas Lampung', 'Universitas Lampung', 'Universitas Lampung']",2.0,published,['QC'],,2.0,40-50,https://doi.org/10.23960/jemit.v2i2,"[{'type': 'http://www.loc.gov/loc.terms/relators/AUT'}, {'type': 'http://www.loc.gov/loc.terms/relators/AUT'}, {'type': 'http://www.loc.gov/loc.terms/relators/AUT'}, {'type': 'http://www.loc.gov/loc.terms/relators/AUT'}]",,,,,,,,
5,"Synthesis and characterization of TiO2 from Lampung’s
Iron Sand using leaching method with temperature
variation",TRUE,"[{'name': {'given': 'Iqbal', 'honourific': None, 'lineage': None, 'family': 'Firdaus'}, 'id': 'iqbal.firdaus@fmipa.unila.ac.id'}, {'id': 'roniyus.1977@fmipa.unila.ac.id', 'name': {'honourific': None, 'family': 'Marjunus', 'lineage': None, 'given': 'Roniyus'}}, {'id': 'reip65@yahoo.com', 'name': {'honourific': None, 'family': 'Manurung', 'lineage': None, 'given': 'Posman'}}]",article,https://iptek.its.ac.id/index.php/jfa/issue/view/710,2021-07-15 07:44:57,"[{'eprintid': 33230, 'placement': 1, 'security': 'public', 'pos': 1, 'uri': 'http://repository.lppm.unila.ac.id/id/document/151749', 'format': 'text', 'docid': 151749, 'main': 'Iqbal Firdaus - Synthesis and characterization of TiO2 from Lampung’s.pdf', 'files': [{'hash_type': 'MD5', 'mtime': '2021-07-14 15:42:42', 'objectid': 151749, 'filesize': 1152584, 'filename': 'Iqbal Firdaus - Synthesis and characterization of TiO2 from Lampung’s.pdf', 'uri': 'http://repository.lppm.unila.ac.id/id/file/393659', 'fileid': 393659, 'datasetid': 'document', 'hash': 'b39b7ee143a942f5774f24456666c636', 'mime_type': 'application/pdf'}], 'language': 'en', 'mime_type': 'application/pdf', 'rev_number': 1}]",2743,show,2021-07-15 07:44:57,33230,archive,pub,6,2460-4682,public,2021-07-15 07:44:57,,['FMIPA1'],LPPM-ITS,Jurnal Fisika dan Aplikasinya,disk0/00/03/32/30,http://repository.lppm.unila.ac.id/id/eprint/33230,2021-06-02 00:00:00.000000000,"Ilmenite is a natural material in the form of sand which contains heavy metal minerals that are
very abundant in Lampung province. This research aims to determine the content of TiO2 from Lampungs iron
sand by leaching method with temperature variation. The iron sand are mixed with sodium hydrogen carbonate
(NaHCO3), then heated at 700◦C for an hour. This research uses 5 samples with leaching temperature variation
of 70, 80, 90, 100, and 110◦C for 2 hours. The acid leaching process uses HCl 12 M with a ratio of iron
sand and HCl of 1:4, while the water leaching process uses 50 ml of distilled water. Furthermore, the samples
are characterized using XRD and XRF to determine TiO2 content in the iron sand. The result shows that the
highest amount of TiO2 is obtained in the sample with the leaching temperature of 110◦C for 2 hours, which is
approximately 61%.",,17.0,published,['QC'],,2.0,37-40,http://dx.doi.org/10.12962/j24604682.v17i2.7921,,"[1] Zulfalina et al., ”Identifikasi Senyawa dan Ekstraksi Titanium
Dioksida dari Pasir Besi Mineral”, Jurnal Sains Materi Indonesia, vol. 5, pp.40-50, 2004.
[2] O. Carp et al., ”Photoinduced reactivity of titanium dioxide.
Progress in Solid State Chemistry”, vol. 32, pp. 33-177, 2004.
[3] J. Nowotny, ”Oxide Semiconductors for Solar Energy Conversion: Titanium Dioxide”, CRC Press, p. 156, 2011.
[4] N. Duraisamy et al., ”Fabrication of TiO2 Fabrication of TiO2
thin film memristor device using electrohydrodynamic Inject
Printing”, Thin Solid Film, vol.520, pp. 5070-5074, 2012.
[5] J.B.Rosebaum, ”Titanium technology trend”, Jurnal Online
Mahasiswa, vol. 34, pp.76-79, 1982.
[6] Mehdilo and M.Irannajad, ”Applied Mineralogical : Studies on
Iranian Hard Rock Titanium Deposi”, Journal Minerals & Materials Characterization Engineering, vol. 9, no. 3, pp. 247-262,
2010.
[7] Hao X, et al., ”Solvent extraction of titanium from the simulated ilmenite sulfuric acid leachate by trialkylphosphine oxide”, J. Hydromet. Vol. 113114 185191, 2012 .
[8] Aliwarga, L, et al., ”Deposition of titanium on iron sand solution in sulphic acid”, J.Min. and Coal Tech. Vol. 15 109 118,
2015.
[9] Wu, Feixiang et al., ”Hydrogen Peroxide Leaching of Hydrolyzed Titania Residue Prepared from Mechanically Activated Panzhihua ilmenite Leached by Hydrochloric Acid”, International Journal Mineral Processing, 98, 106-112, 2010.
[10] Zhang, Li et al., Hydrochloric Acid Leaching Behavior of Different Treated Panxi Ilmenite Concentration. Hydrometallurgy,
107, 40-47, 2011
[11] Tao Tao et al., ”TiO2 nanoparticles prepared by hydrochloric
acid leaching of mechanically activated and carbothermic reduced ilmenite”, Trans. Nonferrous Met. Soc. China, 22, 1232-
1238.
[12] L.D. Setiawati et al., ”Extraction of titanium dioxide (TiO2)
from iron sand by hydrometallurgical method”, Proce. of Semirata, FMIPA University of Lampung, Lampung, 2013, pp. 467-
468.
[13] R. Ermawati et al., ”Monitoring and extraction of TiO2 from
mineralsand”, Journal of Chemical and Packaging, vol. 33, no.
2, pp. 131-136, 2011.
[14] M.V. Purwani and Suyanti, ”Ashrinking particle model at leaching of titanium in ilmnenite use HCl”, Proce of Meeting and
Scientific Presentation. BATAN: Accelerator science and technology center. 2016: 44.
[15] T. Indrawati et al., ”Extraction of titanium dioxide (TiO2) from
iron sand smelting waste (slag) by caustic method”, Journal of
Applied Physics, vol. 2, pp. 61-64, 2014.",,,,,,,
6,Pemanfaatan Limbah Aki dan Komponen Elektronik sebagai Sumber Energi Listrik Ramah Lingkungan,TRUE,"[{'id': 'junaidi.1982@fmipa.unila.ac.id', 'name': {'family': 'Junaidi', 'lineage': None, 'honourific': None, 'given': 'Junaidi'}}, {'name': {'given': 'Riyanto', 'honourific': None, 'family': 'Agus', 'lineage': None}, 'id': 'agus.riyanto@fmipa.unila.ac.id'}, {'name': {'honourific': None, 'family': 'GURUM A. PAUZI', 'lineage': None, 'given': 'GURUM A. PAUZI'}, 'id': None}, {'id': 'iqbal.firdaus@fmipa.unila.ac.id', 'name': {'given': 'I.F', 'family': 'Iqbal Firdaus', 'lineage': None, 'honourific': None}}]",article,http://ppm.ejournal.id/index.php/pengabdian/article/view/717,2022-07-11 08:25:01,"[{'main': 'document.pdf', 'docid': 165062, 'files': [{'mtime': '2022-07-11 08:20:28', 'hash_type': 'MD5', 'uri': 'http://repository.lppm.unila.ac.id/id/file/472288', 'filename': 'document.pdf', 'filesize': 536590, 'objectid': 165062, 'hash': '235634518f94cfb5351a8958edc39f0c', 'mime_type': 'application/pdf', 'datasetid': 'document', 'fileid': 472288}], 'format': 'text', 'language': 'en', 'rev_number': 1, 'mime_type': 'application/pdf', 'placement': 1, 'eprintid': 43199, 'uri': 'http://repository.lppm.unila.ac.id/id/document/165062', 'pos': 1, 'security': 'public'}]",181,show,2022-07-11 08:25:01,43199,archive,pub,6,2540-8747,public,2022-07-11 08:25:01,,['FMIPA1'],"LEMBAGA PENELITIAN, PENGABDIAN, DAN PENGEMBANGAN MASYARAKAT UNIVERSITAS MATHLA’UL ANWAR BANTEN",JURNAL PENGABDIAN PADA MASYARAKAT,disk0/00/04/31/99,http://repository.lppm.unila.ac.id/id/eprint/43199,1970-01-01 00:00:00.000002021,"UTILIZATION   OF   ACCU   WASTE   AND   ELECTRONIC   COMPONENTS   AS   AN ENVIRONMENTALLY  FRIENDLY  ELECTRICAL  ENERGY  SOURCE. This  community service is a form of community development activity in the utilization of Accu waste and electronic components as an alternative energy source for mini-inverters. The mini-invertermodule is made using the Joule Thief method. This method is able to increase low electric power  from  a 1.5-voltbattery  source  into  AC  alternating  current  that  can  turn  on  LED lights.  The  service  activity  will  be  carried  out  in  Hajimena  Village,  Natar  District,  South Lampung  Regency  in  August  2020.  This  community  service  activity  was  attended  by  32 participants.  Each  service  participant  has  been  fostered and  guided  about the  process of making mini-invertermodules  from  waste  batteries  and  components  that  are  no  longer used  so  that  they  are  ready  to  use  and  suitable  for  use  and  of  economic  value.  The components used in the manufacture of mini-invertersare all obtained from components from AKI and used electronic components as alternative energy sources. With this activity, it is hoped that the partner community will understand how to utilize waste that is difficult to decompose into ready-to-sell goods",,6.0,published,['QC'],,2.0,,https://doi.org/10.30653/002.202162.717,,,,,,,,,
7,Rancang Bangun Mesin Penggulung Lilitan Kawat Transformator Otomatis Berbasis Arduino Uno,TRUE,"[{'id': 'junaidi.1982@fmipa.unila.ac.id', 'name': {'given': 'Junaidi', 'lineage': None, 'family': 'Junaidi', 'honourific': None}}, {'id': 'arif.surtono@fmipa.unila.ac.id', 'name': {'honourific': None, 'family': 'Arif Surtono', 'lineage': None, 'given': 'arifs'}}]",article,https://jemit.fmipa.unila.ac.id/index.php/jurnal/article/view/63,2022-06-21 02:57:36,"[{'uri': 'http://repository.lppm.unila.ac.id/id/document/164405', 'pos': 1, 'security': 'public', 'placement': 1, 'eprintid': 42684, 'rev_number': 1, 'language': 'en', 'mime_type': 'application/pdf', 'docid': 164405, 'main': '2021-Deni Irfan_Jemit.pdf', 'files': [{'datasetid': 'document', 'fileid': 468210, 'hash': 'fc34ef48313ff1543fcaaefd87d33bfd', 'mime_type': 'application/pdf', 'objectid': 164405, 'filesize': 1629502, 'uri': 'http://repository.lppm.unila.ac.id/id/file/468210', 'filename': '2021-Deni Irfan_Jemit.pdf', 'hash_type': 'MD5', 'mtime': '2022-06-21 01:45:02'}], 'format': 'text'}]",181,show,2022-06-21 02:57:36,42684,archive,pub,6,2747-2043,public,2022-06-21 02:57:36,,['FMIPA1'],Universitas Lampung,"Journal of Energy, Material, and Instrumentation Technology",disk0/00/04/26/84,http://repository.lppm.unila.ac.id/id/eprint/42684,1970-01-01 00:00:00.000002021,"Research on application of the design an Arduino Uno-based automatic transformer wire winding machine has been carried out. The research aim was to make an automatic winding machine using wire coils that can be adjusted for rotation speed and high accuracy of the number of turns. In testing system, the enamel wire was wrapped around with a different number of turns, that is 200;400;600;800;1000 turns. The calibration method in this study was carried out manually, that is recounting the turns on the koker that had been wrapped using an automatic winding machine. The speed of the winding machine is calibrated using a tachometer. The results of the calculation of the average rolling accuracy of 99,73%.",,2.0,,['QC'],,3.0,,https://doi.org/10.23960/jemit.v2i3.63,,,,,,,,,
