,title,refereed,creators,type,official_url,lastmod,documents,userid,metadata_visibility,datestamp,eprintid,eprint_status,ispublished,rev_number,issn,full_text_status,status_changed,succeeds,divisions,publisher,publication,dir,uri,date,abstract,corp_creators,volume,date_type,subjects,related_url,number,pagerange,id_number,contributors,referencetext,contact_email,event_type,event_title,event_location,event_dates,pres_type,funders
35,Peningkatan peran rumah belajar garasi dalam menjaga semangat belajar anak-anak di masa pandemi,TRUE,"[{'name': {'honourific': None, 'family': 'Riyanto', 'lineage': None, 'given': 'Agus'}, 'id': 'agus.riyanto@fmipa.unila.ac.id'}, {'id': 'junaidi.1982@fmipa.unila.ac.id', 'name': {'lineage': None, 'family': 'Junaidi', 'honourific': None, 'given': 'Junaidi'}}, {'name': {'honourific': None, 'family': 'Iqbal Firdaus', 'lineage': None, 'given': 'I.F'}, 'id': 'iqbal.firdaus@fmipa.unila.ac.id'}, {'name': {'honourific': None, 'lineage': None, 'family': 'Simon', 'given': 'Sembiring'}, 'id': 'dsimon.sembiring@fmipa.unila.ac.id'}]",article,https://journal.uinmataram.ac.id/index.php/transformasi/article/view/4007,2022-06-22 07:02:39,"[{'placement': 1, 'eprintid': 42698, 'uri': 'http://repository.lppm.unila.ac.id/id/document/164418', 'pos': 1, 'security': 'public', 'docid': 164418, 'main': '2021_Agus R dkk.pdf', 'files': [{'hash_type': 'MD5', 'mtime': '2022-06-22 01:47:49', 'filesize': 3527707, 'objectid': 164418, 'filename': '2021_Agus R dkk.pdf', 'uri': 'http://repository.lppm.unila.ac.id/id/file/468307', 'datasetid': 'document', 'fileid': 468307, 'mime_type': 'application/pdf', 'hash': '1e186fc9484ffaa5492285c981e1c2ce'}], 'format': 'text', 'language': 'en', 'rev_number': 1, 'mime_type': 'application/pdf'}]",181,show,2022-06-22 07:02:39,42698,archive,pub,6,p-ISSN 1858-3571 | e-ISSN 2580-9628,public,2022-06-22 07:02:39,,['FMIPA1'],"Universitas Islam Negeri Mataram, Indonesia",Jurnal Pengabdian Masyarakat Transformasi,disk0/00/04/26/98,http://repository.lppm.unila.ac.id/id/eprint/42698,1970-01-01 00:00:00.000002021,"Pandemi Covid-19 yang melanda seluruh dunia mempengaruhi proses pembelajaran anak sekolah, khususnya di Indonesia. Mereka diharuskan belajar dari rumah secara daring sehingga memerlukan pendampingan dari orang tua. Orang tua dari anak-anak dengan berbagai latar belakang pendidikannya belum optimal dalam melakukan pendampingan belajar ini. Program pengabdian kepada masyarakat ini bertujuan untuk meningkatkan peran Rumah Belajar Garasi dalam menjaga semangat belajar anak-anak di lingkungan RT 04 Jalan Kramat Jaya, Desa Hajimena, Natar, Lampung Selatan. Untuk mencapai tujuan tersebut, tim pengabdian bersama pengelola rumah belajar membuat perangkat media pembelajaran berupa modul dan video yang disebut dengan Garasi kids serta pemberian edukasi kepada warga selaku orang tua. Tim pengabdian juga membuat program pendukung lainnya seperti kegiatan mewarnai dan membuat mozaik untuk anak serta menghadirkan mobil pintar di Rumah Belajar Garasi. Pelaksanaan kegiatan pengabdian ini dilakukan melalui dua pendekatan yaitu edukasi terhadap orang tua dan pendampingan anak mereka dalam proses belajar. Edukasi kepada orang tua ditujukan agar mereka memiliki kemampuan untuk membimbing anak-anaknya saat belajar di rumah. Sementara pendampingan kepada anak ditujukan agar mereka lebih mudah untuk memahami materi pelajaran khususnya bernalar matematika. Hasil pengabdian menunjukkan bahwa penggunaan Garasi kids pada Rumah Belajar Garasi yang disertai keaktifan, semangat belajar, anak dan juga dukungan orang tua mampu meningkatkan kemampuan bernalar matematika anak-anak secara signifikan. Meskipun terdapat sebagian kecil anak-anak berada pada predikat cukup baik dalam menyerap matematika, namun mereka memiliki keunggulan di bidang seni dan kemampuan bekerja sama dengan teman-temannya. Minat baca anak-anak juga tumbuh dengan kehadiran mobil pintar di Rumah Belajar Garasi. Dengan demikian, optimalisasi Rumah Belajar Garasi melalui Garasi kids dapat memberikan kontribusi positif terhadap proses pembelajaran anak di rumah pada masa pendemi.",,17.0,published,['QC'],,2.0,233-244,https://doi.org/10.20414/transformasi.v17i2.4007,,,,,,,,,
36,"Rietveld analysis of geopolymer prepared from amorphous rice husk
silica with different thermal treatment",TRUE,"[{'id': 'agus.riyanto@fmipa.unila.ac.id', 'name': {'family': 'Riyanto', 'lineage': None, 'honourific': None, 'given': 'Agus'}}, {'name': {'given': 'Simon', 'lineage': None, 'family': 'Sembiring', 'honourific': None}, 'id': 'simon.sembiring@fmipa.'}, {'id': 'iqbal.firdaus@fmipa.unila.ac.id', 'name': {'given': 'Iqbal', 'lineage': None, 'family': 'Firdaus', 'honourific': None}}]",conference_item,https://iopscience.iop.org/article/10.1088/1742-6596/1751/1/012070,2021-03-16 01:41:52,"[{'eprintid': 28396, 'placement': 1, 'security': 'public', 'uri': 'http://repository.lppm.unila.ac.id/id/document/42426', 'pos': 1, 'format': 'text', 'files': [{'hash': '2e3e978592908b7162ade8813d8e09dc', 'mime_type': 'application/pdf', 'fileid': 252312, 'datasetid': 'document', 'uri': 'http://repository.lppm.unila.ac.id/id/file/252312', 'filename': 'Riyanto_2021_J._Phys.__Conf._Ser._1751_012070.pdf', 'objectid': 42426, 'filesize': 1555420, 'mtime': '2021-03-15 08:44:31', 'hash_type': 'MD5'}], 'main': 'Riyanto_2021_J._Phys.__Conf._Ser._1751_012070.pdf', 'docid': 42426, 'rev_number': 1, 'language': 'en', 'mime_type': 'application/pdf'}]",2743,show,2021-03-16 01:41:52,28396,archive,pub,8,,public,2021-03-16 01:41:52,,['FMIPA1'],,,disk0/00/02/83/96,http://repository.lppm.unila.ac.id/id/eprint/28396,2021-01-27 00:00:00.000000000,"The work aims to study the temperature effect on the geopolymer's crystal structure 
prepared from amorphous silica rice husk. The samples were prepared via the sol-gel method 
and then subjected to thermal at a temperature of 250-650 oC. EDS identified the element and 
compound composition on the surface of the sample. The crystal structure of samples 
identified by Rietveld refinement of XRD. The sample was dominated by the gibbsite phase at 
relatively low temperatures (250 oC). The boehmite phase dominates at a temperature of 350-
450 oC. The amorphous structure of the geopolymer was formed at a temperature of 550-650 
oC. The geopolymer mainly formed from the reaction of boehmite and silica. This study shows 
a significant effect of temperature on the formation of the geopolymer structure.",,,published,['QC'],,,1-7,,,"[1] Davidovits J 1991 J. Thermal. Anal. 37 1633-56
[2] Azimi E A, Mustafa M, Bakri A, Ming L Y, Yong H C, Hussin K, and Aziz I H 2016 Rev. Adv. 
Mater. Sci 44 273–85
[3] Saravanan G, Jeyasehar C A, Kandasamy S 2013 J. Eng. Sci. Tech. Rev. 6(1) 25–32
[4] Srivastava S and Gadhave R 2015 Orient. J. Chem. 31(4) 2475–80
[5] Steinerova M 2011 Ceram. Silik. 55(4) 362–72
[6] Steins P, Poulesquen A, Frizon F, Diat O, Jestin J, Causse J, Lambertin D, and Rossignol S
2014 J. Appl.Cryst. 47(1) 316–24
[7] Sharma S, Medpelli D, Chen S, and Seo D K 2015 RSC Adv. 5(80) 65454–61
[8] Hamaideh A, Al-qarallah B, Hamdi M R, Ali S, and Mallouh A 2014 J. Water Resource Prot. 6
507–13
[9] Rovnaník P and Šafránková K 2016 Materials 9(7) 1–13
[10] Cui X M, Zheng G J, Han Y.C, Su, F, and Zhou J 2008 J. Power Sources 184 652–56
[11] Kusak I, Lunak M, and Rovnanik P 2016 Procedia Eng. 151 157–61
[12] Cui X M, Liu L P, He Y, Chen J Y, and Zhou J 2011 Mater. Chem. Phys. 130(1-2) 1–4. 
[13] Duxson P, Fernández-Jiménez A, Provis J L, Lukey G C, Palomo A, and Van Deventer J S J
2007 J. Mater. Sci. 42(9) 2917–33 
[14] Patankar S V, Ghugal Y M, and Jamkar S S 2014 Indian J. Mater. S. 2014 1–6
[15] Abdul Rahim R H, Azizli K A, Man Z, Rahmiati T, and Nuruddin M F 2014 J. Appl. Sci. 14(23)
3381–84
[16] Nath S K, Mukherjee S, Maitra S, and Kumar S 2017 J. Therm. Anal. Calorim 127(3) 1953–61 
[17] Škavara F, Duong N A, and Cilova Z Z 2014 Ceram. Silik. 58(1) 12–20.
[18] Onutai S, Jiemsirilers S, Thavorniti P, and Kobayashi T 2015 Constr. Build. Mater. 101 298–
308.
[19] Abdullah M M A B, Jamaludin L, Hussin K, Bnhussain M, Ghazali C M R, and Ahmad M I
2012 Int. J. Mol. Sci. 13(12) 4388–95
[20] Allahverdi A, Kani E N, and Yazdanipour M 2011 Ceram. Silik. 55(1) 68–78
[21] Mostafa N Y, Mohsen Q, and El-Maghraby A 2014 Int. J. Min. Met. Mater. 21(6) 609–19
[22] Faheem M M T, Al Bakri A M M, Kamarudin H, Binhussain M, Ruzaidi C M, and Izzat A M
2013 Adv. Mat. Res. 626 878–82
[23] Chen L, Wang Z, Wang Y, and Feng J 2016 Materials 9(767) 1–12
[24] Gao K, Lin K L, Wang D, Hwang C L, Shiu H S, Chang Y M, and Cheng T W 2014 Constr.
Build. Mater. 53 503–10
[25] Ferone C, Colangelo F, Roviello G, Asprone D, Menna C, Balsamo A, Prota A, Cioffi R, and 
Manfredi G 2013 Materials 6(5) 1920–39
[26] Srinivasan K and Sivakumar A. 2013 ISRN Polymer Sci. 2013 1–8
[27] Heah C Y, Kamarudin H, Mustafa Al Bakri A M, Binhussain M, Luqman M, Khairul Nizar I,
Ruzaidi C M, and Liew Y M 2011 Phys. Procedia 22 305–11
[28] Li X, Wang Z, and Jiao Z 2013 Materials 6(11) 5069–76
[29] Sivasakthi M, Jeyalakshmi R, Rajamane N P, and Revathi T 2017 Orient. J. Chem 33(3) 2103–
10
[30] Mužek M N, Zelić J, and Jozić D 2012 Chem. Biochem. Eng. Q. 26(2) 89–95
[31] Kramar S, and Ducman V 2015 Chem. Ind. Chem. Eng. Q. 21(1) 13–22
[32] Louati S, Baklouti S, and Samet B 2016 Adv. Mater. Sci. Eng. 2016 1–7
[33] Payakaniti P, Pinitsoontorn S, Thongbai P, Amornkitbamrung V, Chindaprasirt P 2017 Const. 
Build. Mater. 135 164–76 
[34] Zheng G, Cui X, Zhang W, and Tong Z 2009 J. Mater. Sci. 44(15) 3991–96
[35] Bakar R A, Yahya R, and Gan S N 2016 Procedia Chem. 19 189–95
[36] Fernandes I J, Calheiro D, Sánchezb F A L, Camachob A L D, Rocha T L A de C R, Moraes C 
A M, and Sousaa V C de 2017 Mater. Res. 20(2) 512–18
[37] Sousa A M de, Visconte L, Mansur C, and Furtado C 2009 Chem. Chem. Technol. 3(4) 321–26
[38] Yuvakkumar R, Elango V, Rajendran V, and Kannan N 2014 J. Exp. Nanosci. 9(3) 272–81
[39] Kalapathy U, Proctor A, and Shultz J 2000 Bioresour. Technol. 73(3) 257–62
[40] Sembiring S, Simanjuntak W, Situmeang R, and Riyanto A 2016 Ceram. Int. 42(7) 8431–37
[41] Sembiring S, Simanjuntak W, Situmeang R, Riyanto A, and Karo-Karo P 2017 J. Asian. Ceram.
Soc. 5(2) 186–92
[42] Sembiring S, Simanjuntak W, Situmeang R, Riyanto A, and Junaidi 2018 Ceram. Silik. 62(2)
163–72
[43] Sembiring S, Riyanto A, Simanjuntak W, and Situmeang R 2017 Orient. J. Chem. 33(4) 1828–
36
[44] Riyanto A, Sembiring S, Amalia A R, Astika A, and Marjunus R 2020 J Phys. Conf. Ser. 1572
1-9
[45] Riyanto A, Sembiring S, and Junaidi 2017 Reaktor 17(2) 96-103
[46] Altomare A, Corriero N, Cuocci C, Falcicchio A, Moliterni A, and Rizzi R 2015 J. Appl. 
Cryst. 48 598-603.
[47] Kisi E H 1994 Mater. Forum 135-55
[48] Wu E, Kisi E H, and Gray A EM 1998 J. Appl. Cryst. 31 363-68",agus.riyanto@fmipa.unila.ac.id,conference,ICASMI 2020,Bandar Lampung,3-4 September 2020,paper,
37,Comparative study of Cladophora sp. cellulose by using FTIR and XRD,TRUE,"[{'id': 'sri.wahyu@fmipa.unila.ac.id', 'name': {'given': 'S W Suciyati', 'honourific': None, 'family': 'S W Suciyati', 'lineage': None}}, {'name': {'honourific': None, 'family': 'P Manurung', 'lineage': None, 'given': 'P Manurung'}, 'id': 'reip65@yahoo.com'}, {'name': {'given': 'S Sembiring', 'honourific': None, 'lineage': None, 'family': 'S Sembiring'}, 'id': 'simon.sembiring@fmipa.unila.ac.id'}, {'id': 'rudy.tahan@fmipa.unila.ac.id', 'name': {'honourific': None, 'lineage': None, 'family': 'R Situmeang', 'given': 'R Situmeang'}}]",article,,2021-05-17 02:00:56,"[{'pos': 1, 'uri': 'http://repository.lppm.unila.ac.id/id/document/135455', 'security': 'public', 'placement': 1, 'eprintid': 30151, 'language': 'en', 'mime_type': 'application/pdf', 'rev_number': 1, 'main': 'Suciyati_2021_J._Phys.__Conf._Ser._1751_012075.pdf', 'docid': 135455, 'files': [{'datasetid': 'document', 'fileid': 357481, 'mime_type': 'application/pdf', 'hash': 'c3c393342b2be767af6dda13ae2f7e6c', 'hash_type': 'MD5', 'mtime': '2021-05-13 03:28:13', 'objectid': 135455, 'filesize': 1290938, 'uri': 'http://repository.lppm.unila.ac.id/id/file/357481', 'filename': 'Suciyati_2021_J._Phys.__Conf._Ser._1751_012075.pdf'}], 'format': 'text'}]",672,show,2021-05-17 02:00:56,30151,archive,pub,6,1751 (2021) 012075,public,2021-05-17 02:00:56,,['FMIPA1'],IOP Publishing,Journal of Physics: Conference Series,disk0/00/03/01/51,http://repository.lppm.unila.ac.id/id/eprint/30151,2021-01-01 00:00:00.000000000,"Cellulose Crystalline Cladophora sp. (CCC) was successfully isolated from the 
freshwater algae Cladophora sp. by used the hydrolysis method. The alkaline treatment can 
affect the structure of CCC that is showed by the spectrum of Fourier Transform Infrared 
(FTIR). The typical range for lignin does not appear here, which indicates the delignification 
process using NaOH plus hydrolysis of HCl has succeeded in removing lignin. The spectrum 
associated with functional group impurity (1800-1050 cm-1
) with lipid, protein, and nucleid 
acid content are still seen after alkaline treatment and acid hydrolysis. Analysis of crystallinity 
with X-ray Diffraction (XRD) data showed that CCC had the highest crystallinity index on 
CD-K (93.4%), Cd-P (66.6%), and Cd-S (63.04%). The smallest particle size for each cellulose 
is Cd-K (9.5 nm), Cd-S (25.23 nm), and Cd-P (49.57 nm). Based on these results, the CCC 
production from Cladophora sp. using alkaline and acid hydrolysis treatment is enough to get 
samples with high crystallinity. The CCC product has the potential to be an excellent
reinforcing material for biomaterial-based polymer materials",['Universitas Lampung'],,published,['QC'],,1751.0,1-9,doi:10.1088/1742-6596/1751/1/012075,"[{'type': 'http://www.loc.gov/loc.terms/relators/AUT'}, {'type': 'http://www.loc.gov/loc.terms/relators/AUT'}, {'type': 'http://www.loc.gov/loc.terms/relators/AUT'}, {'type': 'http://www.loc.gov/loc.terms/relators/AUT'}]",,,,,,,,
