,title,refereed,creators,type,official_url,lastmod,documents,userid,metadata_visibility,datestamp,eprintid,eprint_status,ispublished,rev_number,issn,full_text_status,status_changed,succeeds,divisions,publisher,publication,dir,uri,date,abstract,corp_creators,volume,date_type,subjects,related_url,number,pagerange,id_number,contributors,referencetext,contact_email,event_type,event_title,event_location,event_dates,pres_type,funders
15,"Sintering temperature effect on optical properties of zinc oxide thin film
on glass substrate prepared by sol-gel spin coating method",TRUE,"[{'name': {'honourific': None, 'family': 'Leni', 'lineage': None, 'given': 'Rumiyanti'}, 'id': 'lenirumiyanti@fmipa.unila.ac.id'}, {'id': None, 'name': {'given': 'Ariyanto', 'lineage': None, 'family': 'Didik', 'honourific': None}}, {'name': {'given': 'Gracia', 'honourific': None, 'lineage': None, 'family': 'Shania'}, 'id': None}, {'name': {'given': 'Syafriadi', 'family': 'Syafriadi', 'lineage': None, 'honourific': None}, 'id': None}, {'name': {'given': 'I.F', 'honourific': None, 'lineage': None, 'family': 'Iqbal Firdaus'}, 'id': 'iqbal.firdaus@fmipa.unila.ac.id'}]",article,https://iopscience.iop.org/article/10.1088/1742-6596/1751/1/012068,2021-05-24 04:42:04,"[{'language': 'en', 'mime_type': 'application/pdf', 'rev_number': 1, 'format': 'text', 'docid': 137620, 'main': '1. Rumiyanti_2021_J._Phys.__Conf._Ser._1751_012068.pdf', 'files': [{'objectid': 137620, 'filesize': 1303323, 'filename': '1. Rumiyanti_2021_J._Phys.__Conf._Ser._1751_012068.pdf', 'uri': 'http://repository.lppm.unila.ac.id/id/file/362416', 'hash_type': 'MD5', 'mtime': '2021-05-24 03:56:23', 'datasetid': 'document', 'fileid': 362416, 'hash': 'f4d468093dfe82837775e9fd9eeefe82', 'mime_type': 'application/pdf'}], 'security': 'public', 'pos': 1, 'uri': 'http://repository.lppm.unila.ac.id/id/document/137620', 'eprintid': 30574, 'placement': 1}]",1167,show,2021-05-24 04:42:04,30574,archive,pub,7,Print : 1742-6588 Online : 1742-6596,public,2021-05-24 04:42:04,,['FMIPA1'],IOP Publishing,Journal of Physics: Conference Series,disk0/00/03/05/74,http://repository.lppm.unila.ac.id/id/eprint/30574,2021-05-12 00:00:00.000000000,". Research on the optical properties of the ZnO thin film with the use of sol-gel method 
and spin coating method using 0.5 M concentrate solution of (Zn(CH3COO)2·2H2O) and 30 mL 
isopropyl alcohol as a solvent has been carried out. The production process of ZnO solution and 
the fabrication of the thin film with the optical properties test of the thin film are included in the 
scope of this research. UV-Vis Spectroscopy is used to obtain the transmittance and absorbance 
values on each wavelength and the band gap energy value using the Tauc Plot method. The 
transmittance value obtained is directly proportional with the temperature. The absorbance value 
obtained is inversely proportional with the temperature due to higher temperature causes the 
reaction rate to become faster and in turn causes the absorbance value to become lower. The 
band gap energy value obtained is on the range of 3.23 eV – 3.27 eV and it fit with the literature",['Universitas Lampung'],751.0,published,['QC'],,,1-8,10.1088/1742-6596/1751/1/012068,,"[1] Bednarek P. 2010. Ceramic Materials – Forming Methods and Properties of Final 
Elements. Warszawa. Warsaw University of Technology.
[2] Bizarro M, Sanches A, Garduno W, Alonso J, dan Ortiz A. 2011. Synthesis and 
Characterization of ZnO and ZnO:Al by Spray Pyrolysis with High Photocatalytic 
Properties. Catalysis Today. 2 127
[3] Hoffmann A, Claus F, Bruno K, Andreas W, dan Johannes M. 2010. Zinc Oxide: From 
Fundamental Properties Towards Novel Application. Springer. 15 9 
[4] Gupta P, Shishoda, dan Kapoor A. 2010. Non-Crystalline Solids: Glasses and 
Amorphous Solids. Journal Of Non Crystallin Solids. 2 31
[5] Hafdallah A, Yanineb F, Aida M, dan Attaf N. 2011. In Doped ZnO Thin Films. Journal 
of Alloys and Compounds. 509 7267
[6] Bu I. 2014. Sol-Gel Production of Alumunium Doped Zinc Oxide Using Alumunium 
Nitrate. Materials Science in Semiconductor Processing. 27 19
[7] Li Y, Meng J, Ziqiang X, dan Cheng H. 2014. Al-Doping Effects on Structure and Optical 
Properties of ZnO Nanostructures. Materials Science. 9 260
[8] Bhushan, B. 2007. Handbook of Nanotechnology. Ohio State University. Columbus USA. 
[9] Paveena L, Vittaya A, Supapan S, dan Santi M. 2010. Characterization and Magnetic 
Propetis of Nanocrystalline CuFe2O4, NiFe2O4, ZnFe2O4 Powders Prepared by Aloe 
Vera Extract Solution. Current Applied Physics. 11 101
[10] Brinker C. 1990. Sol-Gel Science. London. Academic Press
[11] Luurtsema G. 1997. Spin Coating for Rectangular Substrates (Thesis). University of 
California. Barkeley. 2 7
[12] Hellstrom S. 2007. Basics Models of Spin Coating. Submitted As Coursework For 
Physics. California. Standford University 
[13] Kittel C. 1996. Introduction to Solid State Physics. New York. John Wiley and Sons
[14] Firdaus C, Rizam M, Rusop M, dan Hidayah S. 2012. Characterization of ZnO and ZnO: 
TiO2 Thin Films Prepared by Sol-Gel Spray-Spin Coating Technique. Original 
Research Article Procedia Engineering. 41 1367
[15] Khopkar S. 1990. Konsep Dasar Kimia Analitik. Jakarta. Universitas Indonesia Press.
[16] Mikrajuddin A, dan Khairurrijal. 2010. Karakterisasi Nanomaterial. Jurnal Nanosains 
dan Nanoteknologi. 2 9
[17] Kusnandar A, Rachmawati H, Budi P, dan Suhandono S. 2013. Curcumin Nanoemultion 
for Transdermal Application: Formulation and Evaluation. Proceedings Workshop 
Nanotechnology. 1 560
[18] Miller G. 1959. Use of Dinitrosalicylic Acid Reagent for Determination of Reducing 
Sugar. Analytical Chemistry. 31 426",lenirumiyanti@fmipa.unila.ac.id,,,,,,
16,Sintering temperature effect on optical properties of zinc oxide thin film on glass substrate prepared by the sol-gel spin coating method,TRUE,"[{'id': 'lenirumiyanti@fmipa.unila.ac.id', 'name': {'given': 'Rumiyanti', 'family': 'Leni', 'lineage': None, 'honourific': None}}, {'name': {'honourific': None, 'lineage': None, 'family': 'Didik', 'given': 'Ariyanto'}, 'id': None}, {'id': None, 'name': {'lineage': None, 'family': 'Shania', 'honourific': None, 'given': 'Gracia'}}, {'id': 'syafriadifisikamipa@gmail.com', 'name': {'lineage': None, 'family': 'Syafriadi', 'honourific': None, 'given': 'Syafriadi'}}, {'id': None, 'name': {'family': 'Simon', 'lineage': None, 'honourific': None, 'given': 'Sembiring'}}]",article,https://iopscience.iop.org/article/10.1088/1742-6596/1751/1/012068,2021-05-21 08:21:47,"[{'security': 'public', 'pos': 1, 'uri': 'http://repository.lppm.unila.ac.id/id/document/136680', 'eprintid': 30395, 'placement': 1, 'rev_number': 1, 'language': 'en', 'mime_type': 'application/pdf', 'format': 'text', 'main': '1. Rumiyanti_2021_J._Phys.__Conf._Ser._1751_012068.pdf', 'docid': 136680, 'files': [{'mime_type': 'application/pdf', 'hash': 'f4d468093dfe82837775e9fd9eeefe82', 'datasetid': 'document', 'fileid': 360262, 'filename': '1. Rumiyanti_2021_J._Phys.__Conf._Ser._1751_012068.pdf', 'uri': 'http://repository.lppm.unila.ac.id/id/file/360262', 'objectid': 136680, 'filesize': 1303323, 'mtime': '2021-05-21 07:45:01', 'hash_type': 'MD5'}]}]",1167,show,2021-05-21 08:21:47,30395,archive,pub,7,Print : 1742-6588 Online : 1742-6596,public,2021-05-21 08:21:47,,['FMIPA1'],IOP Publishing,Journal of Physics: Conference Series,disk0/00/03/03/95,http://repository.lppm.unila.ac.id/id/eprint/30395,2021-05-10 00:00:00.000000000,"Research on the optical properties of the ZnO thin film with the use of sol-gel method and spin coating method using 0.5 M concentrate solution of (Zn(CH3COO)2·2H2O) and 30 mL isopropyl alcohol as a solvent has been carried out. The production process of ZnO solution and the fabrication of the thin film with the optical properties test of the thin film are included in the scope of this research. UV-Vis Spectroscopy is used to obtain the transmittance and absorbance values on each wavelength and the band gap energy value using the Tauc Plot method. The transmittance value obtained is directly proportional with the temperature. The absorbance value obtained is inversely proportional with the temperature due to higher temperature causes the reaction rate to become faster and in turn causes the absorbance value to become lower. The 
band gap energy value obtained is on the range of 3.23 eV – 3.27 eV and it fit with the literature",['Universitas Lampung'],1751.0,published,['QC'],,,1-8,10.1088/1742-6596/1751/1/012068,,"[1] Bednarek P. 2010. Ceramic Materials – Forming Methods and Properties of Final 
Elements. Warszawa. Warsaw University of Technology.
[2] Bizarro M, Sanches A, Garduno W, Alonso J, dan Ortiz A. 2011. Synthesis and 
Characterization of ZnO and ZnO:Al by Spray Pyrolysis with High Photocatalytic 
Properties. Catalysis Today. 2 127
[3] Hoffmann A, Claus F, Bruno K, Andreas W, dan Johannes M. 2010. Zinc Oxide: From 
Fundamental Properties Towards Novel Application. Springer. 15 9 
[4] Gupta P, Shishoda, dan Kapoor A. 2010. Non-Crystalline Solids: Glasses and 
Amorphous Solids. Journal Of Non Crystallin Solids. 2 31
[5] Hafdallah A, Yanineb F, Aida M, dan Attaf N. 2011. In Doped ZnO Thin Films. Journal 
of Alloys and Compounds. 509 7267
[6] Bu I. 2014. Sol-Gel Production of Alumunium Doped Zinc Oxide Using Alumunium 
Nitrate. Materials Science in Semiconductor Processing. 27 19
[7] Li Y, Meng J, Ziqiang X, dan Cheng H. 2014. Al-Doping Effects on Structure and Optical 
Properties of ZnO Nanostructures. Materials Science. 9 260
[8] Bhushan, B. 2007. Handbook of Nanotechnology. Ohio State University. Columbus USA. 
[9] Paveena L, Vittaya A, Supapan S, dan Santi M. 2010. Characterization and Magnetic 
Propetis of Nanocrystalline CuFe2O4, NiFe2O4, ZnFe2O4 Powders Prepared by Aloe 
Vera Extract Solution. Current Applied Physics. 11 101
[10] Brinker C. 1990. Sol-Gel Science. London. Academic Press
[11] Luurtsema G. 1997. Spin Coating for Rectangular Substrates (Thesis). University of 
California. Barkeley. 2 7
[12] Hellstrom S. 2007. Basics Models of Spin Coating. Submitted As Coursework For 
Physics. California. Standford University 
[13] Kittel C. 1996. Introduction to Solid State Physics. New York. John Wiley and Sons
[14] Firdaus C, Rizam M, Rusop M, dan Hidayah S. 2012. Characterization of ZnO and ZnO: 
TiO2 Thin Films Prepared by Sol-Gel Spray-Spin Coating Technique. Original 
Research Article Procedia Engineering. 41 1367
[15] Khopkar S. 1990. Konsep Dasar Kimia Analitik. Jakarta. Universitas Indonesia Press.
[16] Mikrajuddin A, dan Khairurrijal. 2010. Karakterisasi Nanomaterial. Jurnal Nanosains 
dan Nanoteknologi. 2 9
[17] Kusnandar A, Rachmawati H, Budi P, dan Suhandono S. 2013. Curcumin Nanoemultion 
for Transdermal Application: Formulation and Evaluation. Proceedings Workshop 
Nanotechnology. 1 560
[18] Miller G. 1959. Use of Dinitrosalicylic Acid Reagent for Determination of Reducing 
Sugar. Analytical Chemistry. 31 426",lenirumiyanti@fmipa.unila.ac.id,,,,,,
17,"Structure analysis of electromagnetic waves absorbing material a
lanthanum manganite system of (La0.8Ba0.2)(Mn(1-x)/2Znx
Fe(1-x)/2)O3",TRUE,"[{'id': 'lenirumiyanti@fmipa.unila.ac.id', 'name': {'given': 'Rumiyanti', 'honourific': None, 'family': 'Leni', 'lineage': None}}, {'id': None, 'name': {'honourific': None, 'lineage': None, 'family': 'Intan', 'given': 'Wandira'}}, {'name': {'honourific': None, 'lineage': None, 'family': 'Wisnu', 'given': 'Ari Adi'}, 'id': None}, {'id': None, 'name': {'honourific': None, 'lineage': None, 'family': 'Simon', 'given': 'Sembiring'}}, {'name': {'given': 'Junaidi', 'honourific': None, 'family': 'Junaidi', 'lineage': None}, 'id': 'junaidi.1982@fmipa.unila.ac.id'}]",article,https://iopscience.iop.org/article/10.1088/1742-6596/1751/1/012069,2021-05-24 04:42:16,"[{'files': [{'hash_type': 'MD5', 'mtime': '2021-05-24 04:03:12', 'objectid': 137643, 'filesize': 1374321, 'filename': '2. Rumiyanti_2021_J._Phys.__Conf._Ser._1751_012069.pdf', 'uri': 'http://repository.lppm.unila.ac.id/id/file/362468', 'fileid': 362468, 'datasetid': 'document', 'hash': '4dc73d4aae027294ac917d4684c20d4d', 'mime_type': 'application/pdf'}], 'main': '2. Rumiyanti_2021_J._Phys.__Conf._Ser._1751_012069.pdf', 'docid': 137643, 'format': 'text', 'language': 'en', 'mime_type': 'application/pdf', 'rev_number': 1, 'placement': 1, 'eprintid': 30577, 'uri': 'http://repository.lppm.unila.ac.id/id/document/137643', 'pos': 1, 'security': 'public'}]",1167,show,2021-05-24 04:42:16,30577,archive,pub,7,Print : 1742-6588 Online : 1742-6596,public,2021-05-24 04:42:16,,['FMIPA1'],IOP Publishing,Journal of Physics: Conference Series,disk0/00/03/05/77,http://repository.lppm.unila.ac.id/id/eprint/30577,2021-05-12 00:00:00.000000000,"Solid compound of lanthanum manganite system of (La0.8Ba0.2)(Mn(1-x)/2ZnxFe(1-
x)/2)O3 has been synthesized via conventional solid state reaction route using lanthanum oxide
(La2O3), barium carbonate (BaCO3), zinc oxide (ZnO), ferric oxide (Fe2O3) and manganese 
carbonate (MnCO3) powders as it raw materials. High energy ball milling was used to mix the 
material for 5 hours. It is then sintered at 1000°C for 5 hours. X-ray powder diffraction method 
(XRD) and scanning electron microscopy (SEM) was used to analyze the change of structure 
of the solid compound. The refinement pattern result of the XRD shown that a single phase 
was occurred in the form of (La0.8Ba0.2)(Mn0.4Zn0.2Fe0.4)O3. It has trigonal lattice crystal 
structure of (r-3c) point group with lattice parameter of a = b = 5.515 Å and c = 13.551 Å, α = 
β = 90° and γ = 120°, a volume unit cell of V = 356.904 Å3
and a density of ρ = 6.745 g.cm-3
. 
The SEM result shown that the surface morphology of (La0.8Ba0.2)(Mn0.4Zn0.2Fe0.4)O3 has a 
homogeneous sphere structure. The XRD and SEM structure analysis result of the lanthanum 
manganite system of (La0.8Ba0.2)(Mn0.4Zn0.2Fe0.4)O3 shown that the compound is feasible for 
further studied.",['Universitas Lampung'],1751.0,published,['QC'],,,1-8,10.1088/1742-6596/1751/1/012069,,"[1] An Y J, Nishida. K, Yamamoto T, Ueda S and Deguchi T. 2008. Characteristic Evaluation of 
Microwave Absorbers Using Dielectric and Magnetic Composite Material. Journal of 
Ceramic Processing Research. 9 430
[2] Hardell L and Sage C. 2008. Biological Effects from Electromagnetic Field Exposure and 
Public Exposure Standards. Journal of Biomedicine and Pharmacotherapy. 62 104
[3] Gross R., Alff L, Buchner B, Freitag B, Hofene C, Klein J, Lu Y, Mader W, Philipp J, Rao M, 
Reutler P, Ritter S, Thienhaus S, Uhlenbruck S, Weidenhorst B. 2000. Physics of Grain 
Boundaries in the Colossal Magnetoresistance Manganites. Journal of Magnetism and 
Magnetic Materials. 211 150
[4] Zhang H, Yao X, Wu M and Zhang L. 2003. Complex Permittivity and Permeability of Zn–Co 
Substituted Z Type Hexaferrite Prepared by Citrate Sol–Gel Process. British Ceramic 
Transactions. 102 10
[5] Dho J, Lee E, Park J and Hu N. 2005. Effects of the Grain Boundary on the Coercivity of 
Barium Ferrite BaFe12O19. Journal of Magnetism and Magnetic Materials. 285 164
[6] Bueno A, Gregori R and Nobrega M. 2008. Microwave-Absorbing Properties of Ni0.50–xZn0.50-
xMe2xFe2O4 (Me=Cu, Mn, Mg) Ferrite–wax Composite in X-Band Frequencies. Journal 
of Magnetism and Magnetic Materials. 32 864
[7] Kallel N, Dezanneau G, Dhahri J, Oumezzine M and Vincent H. 2003. Structure, Magnetic and 
Electrical Behaviour of La0.7Sr0.3Mn1-xTixO3 with 0≤x≤0.3. Journal of Magnetism and 
Magnetic Materials. 261 56
[8] Henchiri C, Hamdi R, Mnasari T, Valente M A, Prezas P R and Dhahri E. 2019. Structural and 
Magnetic Properties of La1‑xBaxMnO3 (x = 0.1; 0.2 and 0.3) Manganites. Applied 
Physics A Materials Science and Processing. 125 725
[9] Zhou K, Xia H, Huang K, Deng L, Wang D, Zhou Y and Gao S. 2009. The Microwave 
Absorption Properties of La0.8Sr0.2Mn1-yFeyO3 Nanocrystalline Powders in The Frequency 
Range 2–18 GHz. Physica B Condensed Matter. 404 175
[10] Sardjono P and Adi W . 2013. Structural, Magnetic and Electrical Propertise of La1-xBaxMnO3
(x = 0-0.7) for Absorber Electromagnetic wave. Jurnal of Basic and Applied Scientific 
Research. 3 230
[11] Toby B. 2006. R Factors in Rietveld Analysis: How Good is Good Enaough?. Powder 
Diffraction. 21 67
[12] Maignan A, Michel C, Hervieu M and Raveau B. 1997. A Monoclinic Manganite, La0.9Mn0.3-ð
With Colossal Magnetoresistance Properties Near Room Temperature. Journal of 
Magnetism and Magnetic Materials. 101 277
[13] Wyckoff R. W. G. 1931. The Structure of Crystals. New York. The Chemical Catalog Company. 
[14] Izumi, F. 1997. A Rietveld-Refinement Program RIETAN-94 for Angle-Dispersive X-Ray and 
Neutron Powder Diffraction. Japan. National Institute for Research in Inorganik 
Materials.
[15] Adi W A, Indro M N and Kusumastuti A A. 2017. Effect of Manganese Addition on The 
Structure, Magnetic Properties and Microwave Absorption of La0.8Ba0.2MnxFe½(1-x)Ti½(1-
x)O3. IOP Conf. Series: Earth and Environmental Science. 58 012047
[16] Sardjono P and Adi W. 2014. Thermal Analysis and Magnetic Properties of Lanthanum Barium 
Manganite Perovskite. Journal of Advanced Materials Research. 896 381.",lenirumiyanti@fmipa.unila.ac.id,,,,,,
18,Pengaruh Variasi Polivinilpirolidon (PVP) Terhadap Pembentukan Serat Nano Titanium Dioksida (TiO2) Menggunakan Metode Electrospinning,TRUE,"[{'id': 'reip65@yahoo.com', 'name': {'honourific': None, 'family': 'Manurung', 'lineage': None, 'given': 'Posman'}}, {'id': None, 'name': {'given': 'Vega', 'honourific': None, 'family': 'Rahmawati', 'lineage': None}}, {'id': 'junaidi.1982@fmipa.unila.ac.id', 'name': {'lineage': None, 'family': 'Junaidi', 'honourific': None, 'given': 'Junaidi'}}, {'name': {'lineage': None, 'family': 'Karo Karo', 'honourific': None, 'given': 'Pulung'}, 'id': None}]",article,https://jemit.fmipa.unila.ac.id/index.php/jurnal/article/view/49/22,2021-06-03 06:38:58,"[{'format': 'text', 'files': [{'mtime': '2021-06-03 04:08:33', 'hash_type': 'MD5', 'filename': 'Bukti Artikel Pengaruh PVP elektrospinning Vega.pdf', 'uri': 'http://repository.lppm.unila.ac.id/id/file/376884', 'objectid': 144140, 'filesize': 527638, 'mime_type': 'application/pdf', 'hash': '398920ddf2e5f5b2563d3d47499d637a', 'fileid': 376884, 'datasetid': 'document'}], 'main': 'Bukti Artikel Pengaruh PVP elektrospinning Vega.pdf', 'docid': 144140, 'mime_type': 'application/pdf', 'language': 'en', 'rev_number': 1, 'eprintid': 31825, 'placement': 1, 'security': 'public', 'uri': 'http://repository.lppm.unila.ac.id/id/document/144140', 'pos': 1}]",781,show,2021-06-03 06:38:58,31825,archive,pub,6,ISSN: 2747-2043E-ISSN:2774-2091,public,2021-06-03 06:38:58,,['FMIPA1'],Jurusan Fisika FMIPA Universitas Lampung,Pengaruh Variasi Polivinilpirolidon (PVP) Terhadap Pembentukan Serat Nano Titanium Dioksida (TiO2) Menggunakan Metode Electrospinning,disk0/00/03/18/25,http://repository.lppm.unila.ac.id/id/eprint/31825,1970-01-01 00:00:00.000002021,"Research  on  the  formation  of  TiO2  nanofiber  has  been  carried  out  with  PVP variations of 1.1; 1,2; 1.3; 1.4 and 1.5 grams using electrospinning. This study aims to  determine  the  effect  of  PVP variation  on  the  viscosity  and  morphology  of  TiO2 nanofibers and to determine the crystal structure of the fibers. Synthesis of TiO2 was carried out using the sol-gel method. TTIP is used as a precursor, ethanol as a solvent, acetic acid as a catalyst and PVP as a fiber-forming polymer. The results of the viscosity measurement show that the amount of PVP used in the sample is directly proportional to the level of solution viscosity. Based on the results of SEM characterization,  it  showed  relatively  uniform  nanofiber  morphology  with  fiber diameter ranging from 94 nm -735 μm. The results of TEM characterization showed that the size of TiO2 nanofiber particles ranged from 7-15 nm. The results of XRD analysis showed that the crystal structures formed at a calcination temperature of 450 oC were the anatase and rutile phases.",,2.0,published,['QC'],[{'url': 'https://jemit.fmipa.unila.ac.id/index.php/jurnal/article/view/49/22'}],1.0,1-6,,[{'type': 'http://www.loc.gov/loc.terms/relators/AUT'}],,,,,,,,
19,Photocatalysis Activity Nanotitania under Sunlight Irradiations,TRUE,"[{'name': {'given': 'Posman', 'honourific': None, 'lineage': None, 'family': 'Manurung'}, 'id': 'reip65@yahoo.com'}, {'name': {'lineage': None, 'family': 'Rahmayanti', 'honourific': None, 'given': 'Dita'}, 'id': 'dita.rahmayanti21@gmail.com'}, {'id': 'renita.renita@gmail.com', 'name': {'given': 'Renita', 'family': 'Maharani', 'lineage': None, 'honourific': None}}, {'id': 'roniyus.1977@fmipa.unila.ac.id', 'name': {'honourific': None, 'lineage': None, 'family': 'Marjunus', 'given': 'Roniyus'}}]",article,https://worldresearchlibrary.org/proceeding.php?pid=4160,2021-06-03 06:39:27,"[{'eprintid': 31826, 'placement': 1, 'security': 'public', 'pos': 1, 'uri': 'http://repository.lppm.unila.ac.id/id/document/144146', 'format': 'text', 'files': [{'mime_type': 'application/pdf', 'hash': '34fbf9395373f2f39b5e52c0a98cf4f2', 'fileid': 376896, 'datasetid': 'document', 'uri': 'http://repository.lppm.unila.ac.id/id/file/376896', 'filename': 'Bukti Prosiding Posman Dita.pdf', 'objectid': 144146, 'filesize': 430868, 'mtime': '2021-06-03 04:22:00', 'hash_type': 'MD5'}], 'main': 'Bukti Prosiding Posman Dita.pdf', 'docid': 144146, 'mime_type': 'application/pdf', 'language': 'en', 'rev_number': 1}]",781,show,2021-06-03 06:39:27,31826,archive,pub,6,,public,2021-06-03 06:39:27,,['FMIPA1'],The IRES International Conference,Photocatalysis Activity Nanotitania under Sunlight Irradiations,disk0/00/03/18/26,http://repository.lppm.unila.ac.id/id/eprint/31826,1970-01-01 00:00:00.000002021,"The synthesis of nanotitania was prepared using the sol gel method with the addition of ethanolamine as a surfatan. This research was conducted to determine the effect of ethanolamine addition on the photocatalyst activity and energy gap of nanotitania. In this study, the use of titanium butoxide acts as a precursor, ethanol as a solvent and HCl as a converter for sol to gel. The addition of varied ethanolamine is 0; 0.5; 1; 1.5; and 2 ml. The sample was calcined at 500ºC for 4 hours. Nanotitania were characterized using Raman Spectroscopy, UV-Vis Spectrophotometry, and UV-Visible Diffuse Reflectance Spectroscopy (UV-Vis DRS) using the Kubelka-Munk method. The results of the characterization of Raman spectroscopy showed that the C-1 sample formed anatase, rutile and brookite phases. Test the photocatalyst activity by degrading remazole yellow solution using sunlight as the trigger. The results of the UV-Vis DRS characterization of the energy gap of each samples are 3.18; 3.2; 3.03; 3.15  and  3.2 eV for samples of A-0, B-0.5, C-1, D-1.5 and  E-2 respectivly",,,published,['QC'],[{'url': 'https://worldresearchlibrary.org/proceeding.php?pid=4160'}],,1-4,,[{'type': 'http://www.loc.gov/loc.terms/relators/ACT'}],,,,,,,,
20,Photocatalysis Activity Nanotitania under Sunlight Irradiations,TRUE,"[{'id': 'reip65@yahoo.com', 'name': {'given': 'Posman', 'lineage': None, 'family': 'Manurung', 'honourific': None}}, {'name': {'given': 'Dita', 'honourific': None, 'lineage': None, 'family': 'Rahmayanti'}, 'id': 'dita.rahmayanti21@gmail.com'}, {'id': 'renita.renita@gmail.com', 'name': {'given': 'Renita', 'honourific': None, 'lineage': None, 'family': 'Maharani'}}, {'id': 'roniyus.1977@fmipa.unila.ac.id', 'name': {'honourific': None, 'lineage': None, 'family': 'Marjunus', 'given': 'Roniyus'}}]",article,http://ijaseat.iraj.in/index.php,2021-11-11 04:51:04,"[{'format': 'text', 'main': 'Jurnal IJASEAT 2021.pdf', 'files': [{'hash': '84fcf5ad63d6d3d9556644bc3dc45414', 'mime_type': 'application/pdf', 'fileid': 416757, 'datasetid': 'document', 'filename': 'Jurnal IJASEAT 2021.pdf', 'uri': 'http://repository.lppm.unila.ac.id/id/file/416757', 'filesize': 635414, 'objectid': 156842, 'mtime': '2021-11-11 02:52:45', 'hash_type': 'MD5'}], 'docid': 156842, 'mime_type': 'application/pdf', 'language': 'en', 'rev_number': 1, 'eprintid': 35893, 'placement': 3, 'security': 'public', 'pos': 3, 'uri': 'http://repository.lppm.unila.ac.id/id/document/156842'}]",781,show,2021-11-11 03:23:30,35893,archive,pub,3,2321-8991; 2321 –9009,public,2021-11-11 03:23:30,,['FMIPA1'],Institute of Research and Journals,"International Journal of Advances in Science, Engineering and Technology(IJASEAT)",disk0/00/03/58/93,http://repository.lppm.unila.ac.id/id/eprint/35893,2021-01-01 00:00:00.000000000,"The synthesis of nanotitania was prepared using the sol gel method with the addition of ethanolamine as a surfatan. This research was conducted to determine the effect of ethanolamine addition on the photocatalyst activity and energy gap of nanotitania. In this study, the use of titanium butoxide acts as a precursor, ethanol as a solvent and HCl as a converter for sol to gel. The addition of varied ethanolamine is 0; 0.5; 1; 1.5; and 2 ml. The sample was calcined at 500ºC for 4 hours. Nanotitania were characterized using Raman Spectroscopy, UV-Vis Spectrophotometry, and UV-Visible Diffuse Reflectance Spectroscopy (UV-Vis DRS) using the Kubelka-Munk method. The results of the characterization of Raman spectroscopy showed that the C-1 sample formed anatase, rutile and brookite phases. Test the photocatalyst activity by degrading remazole yellow solution using sunlight as the trigger. The results of the UV-Vis DRS characterization of the energy gap of each samples are 3.18; 3.2; 3.03; 3.15 and 3.2 eV for samples of A-0, B-0.5, C-1, D-1.5 and E-2 respectivly. Keywords - Energy gap, Ethanolamine, Nanotitania, Photocatalyst, Remazol Yellow.",,9.0,published,['QC'],[{'url': 'http://ijaseat.iraj.in/paper_detail.php?paper_id=17795&name=Photocatalysis_Activity_Nanotitania_under_Sunlight_Irradiations'}],1.0,12-15,,,,,,,,,,
