,title,refereed,creators,type,official_url,lastmod,documents,userid,metadata_visibility,datestamp,eprintid,eprint_status,ispublished,rev_number,issn,full_text_status,status_changed,succeeds,divisions,publisher,publication,dir,uri,date,abstract,corp_creators,volume,date_type,subjects,related_url,number,pagerange,id_number,contributors,referencetext,contact_email,event_type,event_title,event_location,event_dates,pres_type,funders
27,"Study of Binary, Ternary, and Quaternary Basicity in Reduction
of Saprolitic Nickel Ore",TRUE,"[{'id': None, 'name': {'given': 'Fajar', 'honourific': None, 'lineage': None, 'family': 'Nurjaman'}}, {'name': {'family': 'Sari', 'lineage': None, 'honourific': None, 'given': 'Yuliana'}, 'id': None}, {'name': {'family': 'Manurung', 'lineage': None, 'honourific': None, 'given': 'Posman'}, 'id': 'reip65@yahoo.com'}, {'name': {'honourific': None, 'lineage': None, 'family': 'Handoko', 'given': 'Anton'}, 'id': None}]",article,http://www.speciation.net/Database/Journals/Transactions-of-the-Indian-Institute-of-Metals-;i2459,2021-11-11 04:54:14,"[{'pos': 1, 'uri': 'http://repository.lppm.unila.ac.id/id/document/156875', 'security': 'public', 'placement': 1, 'eprintid': 35911, 'rev_number': 1, 'language': 'en', 'mime_type': 'application/pdf', 'files': [{'mtime': '2021-11-11 03:40:51', 'hash_type': 'MD5', 'uri': 'http://repository.lppm.unila.ac.id/id/file/417034', 'filename': 'Study of Binary Transactions_of_the_Indian_Institute_of_Metals 2021.pdf', 'filesize': 3590797, 'objectid': 156875, 'hash': 'be10c59c74f2c2f15183bdb958dbde1d', 'mime_type': 'application/pdf', 'fileid': 417034, 'datasetid': 'document'}], 'main': 'Study of Binary Transactions_of_the_Indian_Institute_of_Metals 2021.pdf', 'docid': 156875, 'format': 'text'}]",781,show,2021-11-11 04:54:14,35911,archive,inpress,6,"0019-493X, 0972-2815",public,2021-11-11 04:54:14,,['FMIPA1'],Springer,Trans Indian Inst Met,disk0/00/03/59/11,http://repository.lppm.unila.ac.id/id/eprint/35911,2021-08-01 00:00:00.000000000,"In the selective reduction process of lateritic
nickel ore, the formation of the liquidus phase could be
obtained by increasing the temperature and additive,
resulting in an uneconomic process. Nevertheless, it could
also be obtained by modifying the ore basicity by adding
low-cost ﬂuxes, such as CaO, SiO2, MgO, and Al. In
this work, the effect of three types of basicity (binary,
ternary, and quaternary) in selective reduction of saprolitic nickel ore on metallic grade and recovery, phase transformation,and microstructure of ferronickel was investigated clearly. The nickel ore, sodium sulfate, coal, and ﬂux mixture was reduced to 1150 �C for 60 min. Then, the wet magnetic separation process was continued to separate
ferronickel from impurities. The result showed that the
optimum basicity for the selective reduction of saprolitic
nickel ore was 0.6 of ternary basicity (CaO ? MgO/SiO
),modiﬁed by CaO addition. It produced 16.11% and 50.57%
for nickel grade and recovery in concentrate, respectively.
Modiﬁed basicity with CaO addition is more effective than
MgO, Al2O3, and SiO22addition due to its ability to break
the forsterite structure and release iron and nickel. It also could be reacted with magnesium silicate structure to form calcium-magnesium silicate structure such as mullite and monticellite.

Keywords Saprolitic nickel ore � Basicity �
Selective reduction � Ferronickel � Impurities",,,published,['QC'],[{'url': 'http://www.speciation.net/Database/Journals/Transactions-of-the-Indian-Institute-of-Metals-;i2459'}],,,,,,,,,,,,
28,"Study of Binary, Ternary, and Quaternary Basicity in Reduction
of Saprolitic Nickel Ore",TRUE,"[{'id': None, 'name': {'honourific': None, 'family': 'Nurjaman', 'lineage': None, 'given': 'Fajar'}}, {'id': None, 'name': {'honourific': None, 'family': 'Sari', 'lineage': None, 'given': 'Yuliana'}}, {'id': 'reip65@yahoo.com', 'name': {'lineage': None, 'family': 'Manurung', 'honourific': None, 'given': 'Posman'}}, {'name': {'given': 'Anton', 'honourific': None, 'family': 'Handoko', 'lineage': None}, 'id': None}]",article,,2021-11-22 01:13:58,"[{'main': 'Jurnal Nurjaman2021_Article_StudyOfBinaryTernaryAndQuatern lengkap.pdf', 'docid': 157966, 'files': [{'datasetid': 'document', 'fileid': 425120, 'mime_type': 'application/pdf', 'hash': '6e569c43be38cf3cb868614cb1e7af9e', 'hash_type': 'MD5', 'mtime': '2021-11-20 09:20:58', 'filesize': 3586222, 'objectid': 157966, 'filename': 'Jurnal Nurjaman2021_Article_StudyOfBinaryTernaryAndQuatern lengkap.pdf', 'uri': 'http://repository.lppm.unila.ac.id/id/file/425120'}], 'format': 'text', 'rev_number': 1, 'language': 'en', 'mime_type': 'application/pdf', 'placement': 1, 'eprintid': 37057, 'pos': 1, 'uri': 'http://repository.lppm.unila.ac.id/id/document/157966', 'security': 'public'}]",781,show,2021-11-22 01:13:58,37057,archive,pub,6,"0019-493X, 0972-2815",public,2021-11-22 01:13:58,,['FMIPA1'],Springer,Trans Indian Inst Met,disk0/00/03/70/57,http://repository.lppm.unila.ac.id/id/eprint/37057,2021-09-01 00:00:00.000000000,"Abstract In the selective reduction process of lateritic
nickel ore, the formation of the liquidus phase could be
obtained by increasing the temperature and additive,
resulting in an uneconomic process. Nevertheless, it could
also be obtained by modifying the ore basicity by adding
low-cost ﬂuxes, such as CaO, SiO
2
, MgO, and Al
.In
this work, the effect of three types of basicity (binary,
ternary, and quaternary) in selective reduction of saprolitic
nickel ore on metallic grade and recovery, phase transformation,
and microstructure of ferronickel was investigated
clearly. The nickel ore, sodium sulfate, coal, and ﬂux
mixture was reduced to 1150 �C for 60 min. Then, the wet
magnetic separation process was continued to separate
ferronickel from impurities. The result showed that the
optimum basicity for the selective reduction of saprolitic
nickel ore was 0.6 of ternary basicity (CaO ? MgO/SiO
),
modiﬁed by CaO addition. It produced 16.11% and 50.57%
for nickel grade and recovery in concentrate, respectively.
Modiﬁed basicity with CaO addition is more effective than
MgO, Al
2
O
3
, and SiO
2
2
addition due to its ability to break
the forsterite structure and release iron and nickel. It also
could be reacted with magnesium silicate structure to form
& Fajar Nurjaman
fajar.nurjaman@lipi.go.id
& Bambang Suharno
suharno@metal.ui.ac.id
1
2
3
Metallurgy and Materials Engineering Department,
Universitas Indonesia, Depok, Indonesia
Research Unit for Mineral Technology, Indonesian Institute
of Sciences, Lampung, Indonesia
Department of Physics, University of Lampung, Lampung,
Indonesia
O
3
2
•
Anton Sapto Handoko
2
•
calcium–magnesium silicate structure such as melilite and
monticellite.
Keywords Saprolitic nickel ore � Basicity �
Selective reduction � Ferronickel � Impurities",,74.0,published,['QC'],,12.0,3240-3263,,,,,,,,,,
29,Pengaruh Variasi Polivinilpirolidon (PVP) Terhadap Pembentukan Serat Nano TiO2 Menggunakan Metode Electrospinning,TRUE,"[{'id': 'posman65@unila.ac.id', 'name': {'honourific': None, 'family': 'Posman Manurung', 'lineage': None, 'given': 'Posman'}}, {'id': 'junaidi.1982@fmipa.unila.ac.id', 'name': {'honourific': None, 'lineage': None, 'family': 'Junaidi', 'given': 'Junaidi'}}, {'id': 'pulung.karokaro@gmail.com', 'name': {'given': 'Pulung', 'lineage': None, 'family': 'Karo Karo', 'honourific': None}}]",article,https://jemit.fmipa.unila.ac.id/index.php/jurnal/article/view/49,2022-06-21 02:57:38,"[{'language': 'en', 'rev_number': 1, 'mime_type': 'application/pdf', 'format': 'text', 'main': '2021_Vega R_Jemit.pdf', 'docid': 164406, 'files': [{'fileid': 468216, 'datasetid': 'document', 'mime_type': 'application/pdf', 'hash': 'ce017135e1366a4af494d33a7bc9eeb5', 'objectid': 164406, 'filesize': 1752207, 'filename': '2021_Vega R_Jemit.pdf', 'uri': 'http://repository.lppm.unila.ac.id/id/file/468216', 'hash_type': 'MD5', 'mtime': '2022-06-21 01:49:35'}], 'security': 'public', 'uri': 'http://repository.lppm.unila.ac.id/id/document/164406', 'pos': 1, 'eprintid': 42685, 'placement': 1}]",181,show,2022-06-21 02:57:38,42685,archive,pub,6,2747-2043,public,2022-06-21 02:57:38,,['FMIPA1'],Universitas Lampung,"Journal of Energy, Material, and Instrumentation Technology",disk0/00/04/26/85,http://repository.lppm.unila.ac.id/id/eprint/42685,1970-01-01 00:00:00.000002021,"Research on the formation of TiO2 nanofiber has been carried out with PVP variations of 1.1; 1,2; 1.3; 1.4 and 1.5 grams using electrospinning. This study aims to determine the effect of PVP variation on the viscosity and morphology of TiO2 nanofibers and to determine the crystal structure of the fibers. Synthesis of TiO2 was carried out using the sol-gel method. TTIP is used as a precursor, ethanol as a solvent, acetic acid as a catalyst and PVP as a fiber-forming polymer. The results of the viscosity measurement show that the amount of PVP used in the sample is directly proportional to the level of solution viscosity. Based on the results of SEM characterization, it showed relatively uniform nanofiber morphology with fiber diameter ranging from 94 nm - 735 µm. The results of TEM characterization showed that the size of TiO2 nanofiber particles ranged from 7-15 nm. The results of XRD analysis showed that the crystal structures formed at a calcination temperature of 450 oC were the anatase and rutile phases.",,2.0,published,['QC'],,1.0,,https://doi.org/10.23960/jemit.v2i1.49,,,,,,,,,
30,Sistem Identifikasi Tingkat Kematangan Buah Nanas Secara Non-Destruktif Berbasis Computer Vision,TRUE,"[{'id': None, 'name': {'given': 'A Nevalen', 'honourific': None, 'lineage': None, 'family': 'Prasetyo'}}, {'id': 'arif.surtono@fmipa.unila.ac.id', 'name': {'given': 'Arif', 'honourific': None, 'family': 'Surtono', 'lineage': None}}, {'id': 'junaidi.1982@fmipa.unila.ac.id', 'name': {'honourific': None, 'family': 'Junaidi', 'lineage': None, 'given': 'Junaidi'}}, {'name': {'lineage': None, 'family': 'Pauzi', 'honourific': None, 'given': 'Gurum Ahmad'}, 'id': 'gurum.ahmadpauzi@fmipa.unila.ac.id'}]",article,http://jemit.fmipa.unila.ac.id/index.php/jurnal,2021-11-14 12:16:51,"[{'format': 'text', 'files': [{'hash': '5f16e527cfb9339be4a6f4efe67b5dd1', 'mime_type': 'text/html', 'datasetid': 'document', 'fileid': 423067, 'mtime': '2021-11-14 07:28:37', 'hash_type': 'MD5', 'uri': 'http://repository.lppm.unila.ac.id/id/file/423067', 'filename': 26, 'objectid': 157689, 'filesize': 38612}], 'main': 26, 'docid': 157689, 'mime_type': 'text/html', 'language': 'en', 'rev_number': 2, 'eprintid': 36772, 'placement': 1, 'security': 'public', 'pos': 1, 'uri': 'http://repository.lppm.unila.ac.id/id/document/157689'}]",419,show,2021-11-14 12:16:51,36772,archive,pub,7,2747-2043,public,2021-11-14 12:16:51,,['FMIPA1'],Universitas Lampung,"Journal of Energy, Material, and Instrumentation Technology",disk0/00/03/67/72,http://repository.lppm.unila.ac.id/id/eprint/36772,2021-05-01 00:00:00.000000000,"A computer vision-based non-destructive pineapple maturity level identification system has been realized. This research was conducted to create a system capable of identifying six indexes of pineapple maturity level. An artificial neural network is used as a classifier for the level of maturity pineapples. Artificial neural network input is a statistical parameter consisting of mean, standard deviation, variance, kurtosis, and skewness of RGB and HSV color models pineapple images. Statistical parameters of the color model with a Pearson correlation value greater than 0.5 were used to characterize pineapple images. A total of 360 pineapple images were used in the training process with a percentage of 75% of training data and 25% of validation data. An image segmentation process is applied to separate the pineapple image from the image background. The result of this research is a pineapple maturity level identification system consisting of software and hardware which is able to identify six indexes of pineapple maturity level with average accuracy value of 98,4%.",,2.0,published,['QC'],,1.0,,,,,,,,,,,
31,Sistem Identifikasi Tingkat Kematangan Buah Nanas Secara Non-Destruktif Berbasis Computer Vision,TRUE,"[{'name': {'honourific': None, 'family': 'Prasetyo', 'lineage': None, 'given': 'Nevalen A'}, 'id': None}, {'id': 'arif.surtono@fmipa.unila.ac.id', 'name': {'given': 'Arif', 'honourific': None, 'lineage': None, 'family': 'Surtono'}}, {'name': {'family': 'Junaidi', 'lineage': None, 'honourific': None, 'given': 'Junaidi'}, 'id': 'junaidi.1982@fmipa.unila.ac.id'}, {'id': 'gurum.ahmadpauzi@fmipa.unila.ac.id', 'name': {'given': 'Gurum Ahmad', 'honourific': None, 'family': 'Pauzi', 'lineage': None}}]",article,http://jemit.fmipa.unila.ac.id/index.php/jurnal,2021-06-03 06:40:12,"[{'placement': 1, 'eprintid': 31857, 'pos': 1, 'uri': 'http://repository.lppm.unila.ac.id/id/document/144258', 'security': 'public', 'main': '19-Article Text-136-1-10-20210603.pdf', 'files': [{'hash': '8bd762954bc98d1574b242fbb6296cdd', 'mime_type': 'application/pdf', 'datasetid': 'document', 'fileid': 377142, 'mtime': '2021-06-03 06:00:35', 'hash_type': 'MD5', 'filename': '19-Article Text-136-1-10-20210603.pdf', 'uri': 'http://repository.lppm.unila.ac.id/id/file/377142', 'objectid': 144258, 'filesize': 560558}], 'docid': 144258, 'format': 'text', 'language': 'en', 'rev_number': 1, 'mime_type': 'application/pdf'}]",419,show,2021-06-03 06:40:12,31857,archive,pub,6,2747-2043,public,2021-06-03 06:40:12,,['FMIPA1'],Universitas Lampung,"Journal of Energy, Material, and Instrumentation Technology",disk0/00/03/18/57,http://repository.lppm.unila.ac.id/id/eprint/31857,2021-02-28 00:00:00.000000000,"Telah direalisasikan sebuah sistem identifikasi tingkat kematangan buah nanas secara non-destruktif berbasis computer vision. Penelitian ini dilakukan untuk membuat sistem yang mampu mengidentifikasi kematangan buah nanas menjadi enam indeks tingkat kematangan. Jaringan saraf tiruan digunakan sebagai pengklasifikasi tingkat kematangan buah nanas. Masukan jaringan saraf tiruan berupa parameter statistik warna, yaitu mean, standar deviasi, varian, kurtosis, dan skewness dari model warna RGB dan HSV citra buah nanas. Hanya parameter statistik model warna dengan nilai korelasi Pearson lebih besar dari 0,5 yang digunakan sebagai ciri citra buah nanas. Sejumlah 360 citra buah nanas digunakan pada proses pelatihan dengan persentase pembagian 75% data latih dan 25% data validasi. Proses segmentasi citra diterapkan untuk memisahkan antara bagian buah nanas dengan latar belakang citra. Penelitian ini menghasilkan sebuah sistem pemutuan buah nanas yang terdiri dari perangkat lunak dan perangkat keras yang mampu mengidentifikasi enam indeks tingkat kematangan buah nanas dengan akurasi rerata sebesar 98,4%.",,2.0,published,['QC'],[{'url': 'http://jemit.fmipa.unila.ac.id/index.php/jurnal/article/view/26'}],1.0,1-9,,,,,,,,,,
32,"The Effect of Addition Basalt Stone and Coal as
Substitution Material for Producing Cement Clinker",TRUE,"[{'name': {'given': 'Rajiman', 'honourific': None, 'lineage': None, 'family': 'Rajiman'}, 'id': None}, {'id': None, 'name': {'given': 'Mohamad', 'lineage': None, 'family': 'Amin', 'honourific': None}}, {'name': {'given': 'Mohamad', 'honourific': None, 'lineage': None, 'family': 'Muttaqqi'}, 'id': None}, {'id': 'reip65@yahoo.com', 'name': {'honourific': None, 'lineage': None, 'family': 'Manurung', 'given': 'Posman'}}, {'id': None, 'name': {'lineage': None, 'family': 'Riadini', 'honourific': None, 'given': 'Ajeng'}}]",article,https://www.sysrevpharm.org/articles/the-effect-of-addition-basalt-stone-and-coal-as-substitution-material-for-producing-cement-clinker.pdf,2021-06-04 01:33:38,"[{'rev_number': 1, 'language': 'en', 'mime_type': 'application/pdf', 'format': 'text', 'main': 'Bukti jurnal the effect of addition basalt-stone.pdf', 'docid': 144430, 'files': [{'hash': 'c6b81661d74828755f6a1140a048d9be', 'mime_type': 'application/pdf', 'fileid': 377533, 'datasetid': 'document', 'uri': 'http://repository.lppm.unila.ac.id/id/file/377533', 'filename': 'Bukti jurnal the effect of addition basalt-stone.pdf', 'objectid': 144430, 'filesize': 1720628, 'mtime': '2021-06-03 08:44:19', 'hash_type': 'MD5'}], 'security': 'public', 'pos': 1, 'uri': 'http://repository.lppm.unila.ac.id/id/document/144430', 'eprintid': 31900, 'placement': 1}]",781,show,2021-06-04 01:33:38,31900,archive,pub,7,,public,2021-06-04 01:33:38,,['FMIPA1'],Systematic Reviews in Pharmacy,Sys Rev Pharm 2021;12(2):456-466,disk0/00/03/19/00,http://repository.lppm.unila.ac.id/id/eprint/31900,1970-01-01 00:00:00.000002021,"National infrastructure development in Indonesia
requires supporting materials, one of which is cement. This increases cement clinker production. The
composition of limestone as the main raw material
required in the manufacture of clinker is 81%. Basalt is
used as an alternative raw material because it contains
SiO2, Al2O3, and Fe2O3 with a total of >70%. It meets the
chemical requirements of ASTM C618 as a substitute
material for cement making. This study aims to determine
the effect of adding 10% basalt rock and coal variations
as a limestone substitution in cement clinker
manufacture. Coal is obtained from the Tanggamus
district with the variations used, namely 5, 10, 15, and
20% outside the total mass. Raw materials such as
limestone, silica stone, clay, basalt stone, coal, and iron
sand are ground with a ball mill and formed into pellets
followed by burning at sintering temperatures of 1100, 1200, and 1300
oC with a holding time of 2 h. The clinker
was analyzed using XRF (X-Ray Fluorescence), XRD (X-Ray
Diffraction), and OM (Optical Microscope). This study
aims to know the effect of coal on the cement clinker. The results showed that the manufacture of cement
clinker at 15% substitution of coal at 1300
oC obtained a
CaO compound of 66.384% and SiO2 of 22.747% with
sample results close to ASTM requirements (C150-99). The phases formed are alite, belite, aluminate, and ferrite. From microanalysis with a 100 µm magnification, it can
be seen that the phases alite and belite.",,12.0,published,['QC'],[{'url': 'https://www.sysrevpharm.org/articles/the-effect-of-addition-basalt-stone-and-coal-as-substitution-material-for-producing-cement-clinker.pdf'}],2.0,456-466,,[{'type': 'http://www.loc.gov/loc.terms/relators/AUT'}],,,,,,,,
33,Characteristics of zinc ferrite nanoparticles (ZnFe2O4) from natural iron ore,TRUE,"[{'name': {'given': 'Agus', 'lineage': None, 'family': 'Riyanto', 'honourific': None}, 'id': 'agus.riyanto@fmipa.unila.ac.id'}]",article,https://iopscience.iop.org/article/10.1088/1755-1315/758/1/012001,2021-05-27 02:39:31,"[{'language': 'en', 'mime_type': 'application/pdf', 'rev_number': 1, 'main': 'Husain_2021_IOP_Conf._Ser.__Earth_Environ._Sci._758_012001.pdf', 'files': [{'mime_type': 'application/pdf', 'hash': '9db53e63ce33b4fcac1206ffd016781e', 'fileid': 366607, 'datasetid': 'document', 'mtime': '2021-05-27 01:53:29', 'hash_type': 'MD5', 'filename': 'Husain_2021_IOP_Conf._Ser.__Earth_Environ._Sci._758_012001.pdf', 'uri': 'http://repository.lppm.unila.ac.id/id/file/366607', 'filesize': 1484128, 'objectid': 139580}], 'docid': 139580, 'format': 'text', 'pos': 1, 'uri': 'http://repository.lppm.unila.ac.id/id/document/139580', 'security': 'public', 'placement': 1, 'eprintid': 30918}]",1168,show,2021-05-27 02:39:31,30918,archive,pub,6,,public,2021-05-27 02:39:31,,['FMIPA1'],IOP Publishing,IOP Conf. Series: Earth and Environmental Science,disk0/00/03/09/18,http://repository.lppm.unila.ac.id/id/eprint/30918,1970-01-01 00:00:00.000002021,"Synthesis of zinc ferrite nanoparticles (ZnFe2O4) of iron ore taken in Tanah Laut has been done. The Synthesis uses the coprecipitation method. ZnFe2O4 nanoparticles were 
characterized using X-Ray Diffraction (XRD), Transmission Electron Microscopy (TEM), Vibrating Sample Magnetometer (VSM), Fourier Transform Infrared (FTIR), and UV-Vis 
Spectrophotometer. Using XRD, it was found that ZnFe2O4 has an average crystal size of 8.80 nm. ZnFe2O4 is superparamagnetic because it has a narrow loop area of about 10 kOe.emu/g. 
Using FTIR, the Zn-O and Fe-O groups were obtained at wave numbers 556.58 and 598.87 cm�1
. The absorption spectrum is in the range of UV light (200 nm) to visible light (600 nm) and at 
wavelength of 288 nm is observed absorption.",['Universitas Lampung'],2021.0,published,['QC'],[{'url': 'https://iopscience.iop.org/article/10.1088/1755-1315/758/1/012001'}],758.0,1-9,,"[{'id': 'agus.riyanto@fmipa.unila.ac.id', 'type': 'http://www.loc.gov/loc.terms/relators/AUT', 'name': {'given': 'Agus', 'honourific': None, 'lineage': None, 'family': 'Riyanto'}}]",,,,,,,,
34,"PENINGKATAN PERAN RUMAH BELAJAR GARASI DALAM MENJAGA SEMANGAT 
BELAJAR ANAK-ANAK DI MASA PANDEMI",TRUE,"[{'name': {'given': 'Agus', 'honourific': None, 'lineage': None, 'family': 'Riyanto'}, 'id': 'agus.riyanto@fmipa.unila.ac.id'}, {'id': 'junaidi.1982@fmipa.unila.ac.id', 'name': {'given': 'Junaidi', 'honourific': None, 'lineage': None, 'family': 'Junaidi'}}, {'name': {'given': 'Iqbal', 'family': 'Firdaus', 'lineage': None, 'honourific': None}, 'id': 'iqbal.firdaus@fmipa.unila.ac.id'}, {'name': {'given': 'Simon', 'family': 'Sembiring', 'lineage': None, 'honourific': None}, 'id': 'simon.sembiring@fmipa.'}]",article,https://journal.uinmataram.ac.id/index.php/transformasi/article/view/4007,2022-06-28 02:46:32,"[{'pos': 1, 'uri': 'http://repository.lppm.unila.ac.id/id/document/164474', 'security': 'public', 'placement': 1, 'eprintid': 42755, 'language': 'en', 'rev_number': 1, 'mime_type': 'application/pdf', 'main': 'Agus Riyanto dkk 2022.pdf', 'docid': 164474, 'files': [{'hash_type': 'MD5', 'mtime': '2022-06-28 00:50:42', 'filesize': 899579, 'objectid': 164474, 'filename': 'Agus Riyanto dkk 2022.pdf', 'uri': 'http://repository.lppm.unila.ac.id/id/file/468718', 'fileid': 468718, 'datasetid': 'document', 'mime_type': 'application/pdf', 'hash': 'fad79390c01719c2e52dad3d1448b30c'}], 'format': 'text'}]",1168,show,2022-06-28 02:46:32,42755,archive,pub,6,1858-3571,public,2022-06-28 02:46:32,,['FMIPA1'],,Transformasi: Jurnal Pengabdian Masyarakat,disk0/00/04/27/55,http://repository.lppm.unila.ac.id/id/eprint/42755,1970-01-01 00:00:00.000002021,"Pandemi Covid-19 yang melanda seluruh dunia mempengaruhi proses pembelajaran anak sekolah, khususnya di Indonesia. Mereka diharuskan belajar dari rumah secara daring 
sehingga memerlukan pendampingan dari orang tua. Orang tua dari anak-anak dengan berbagai latar belakang pendidikannya belum optimal dalam melakukan pendampingan belajar ini. Program pengabdian kepada masyarakat ini bertujuan untuk meningkatkan peran Rumah Belajar Garasi dalam menjaga semangat belajar anak-anak di lingkungan RT 04 Jalan 
Kramat Jaya, Desa Hajimena, Natar, Lampung Selatan. Untuk mencapai tujuan tersebut, tim pengabdian bersama pengelola rumah belajar membuat perangkat media pembelajaran 
berupa modul dan video yang disebut dengan Garasi kids serta pemberian edukasi kepada warga selaku orang tua. Tim pengabdian juga membuat program pendukung lainnya seperti 
kegiatan mewarnai dan membuat mozaik untuk anak serta menghadirkan mobil pintar di Rumah Belajar Garasi. Pelaksanaan kegiatan pengabdian ini dilakukan melalui dua pendekatan yaitu edukasi terhadap orang tua dan pendampingan anak mereka dalam proses belajar. Edukasi kepada orang tua ditujukan agar mereka memiliki kemampuan untuk membimbing 
anak-anaknya saat belajar di rumah. Sementara pendampingan kepada anak ditujukan agar mereka lebih mudah untuk memahami materi pelajaran khususnya bernalar matematika. Hasil 
pengabdian menunjukkan bahwa penggunaan Garasi kids pada Rumah Belajar Garasi yang disertai keaktifan, semangat belajar, anak dan juga dukungan orang tua mampu meningkatkan kemampuan bernalar matematika anak-anak secara signifikan. Meskipun terdapat sebagian kecil anak-anak berada pada predikat cukup baik dalam menyerap matematika, namun mereka memiliki keunggulan di bidang seni dan kemampuan bekerja 
sama dengan teman-temannya. Minat baca anak-anak juga tumbuh dengan kehadiran mobil pintar di Rumah Belajar Garasi. Dengan demikian, optimalisasi Rumah Belajar Garasi melalui 
Garasi kids dapat memberikan kontribusi positif terhadap proses pembelajaran anak di rumah pada masa pendemi.",['Universitas Lampung'],17.0,published,['QC'],,2.0,233-244,,,,,,,,,,['Universitas Lampung']
