,date,uri,abstract,volume,date_type,subjects,ispublished,rev_number,full_text_status,issn,status_changed,succeeds,publisher,dir,publication,divisions,lastmod,documents,userid,number,metadata_visibility,pagerange,datestamp,eprintid,eprint_status,title,refereed,creators,type,thesis_name,pages,thesis_type,contributors,department,institution,corp_creators
0,2015-04-01,http://repository.lppm.unila.ac.id/id/eprint/51227,"Dalam penataan kawasan perkotaan, khususnya penataan koridor jalan, survei visual menjadi salah satu metode yang signifikan yang dapat memberikan persepsi dan data empiris kawasan yang berguna dalam pemecahan masalah perancangan. Salah satu metode dalam melakukan survei dan sekaligus analisis ruang perkotaan adalah dengan pengamatan terhadap aspek spatial enclosure adalah tingkatan atau derajat ketertutupan ruang yang memberikan kesan dan persepsi psikologis terhadap pengamat. Persepsi psikologis ini berbeda-beda, tergantung pada proporsi dan skala ruang yang terbentuk berdasarkan perbandingan antara jarak elemen vertical dan ketinggian elemen vertikalnya. Melalui survei visual terhadap proporsi dan skala ruang jalan, maka dapat diketahui tingkat ketertutupan ruang suatu jalan yang menjadi dasar dalam analisis dan perencanaan ruang jalan. Proporsi diketahui dengan mengukur ketinggian pelingkup vertical (dinding/h) terhadap jarak datar (lantai/tanah/d) yang dibentuk oleh elemen keras (hardscape) maupun lunak (softscape). Penelitian ini bertujuan untuk mengetahui spatial enclosure pada koridor jalan di kawasan perdagangan Teluk Betung melalui analisis rancangan yang terbentuk. Hasil penelitian menunjukkan bahwa rancangan ruang jalan di area studi terdiri atas main enclosure dan secondary enclosure. Mein enclosure memberikan efek psikologis dalam konteks skala kawasan dan kota, sementara secondary enclosure memberikan efek psikologis pada tingkat kawasan dan mikro. Penataan lebih rinci pada area secondary enclosure dapat menjadi kunci dalam melunakkan efek psikologis ruang yang ditimbulkan dan menciptakan koridor yang berkarakter.
Kata Kunci : spatial enclosure, hardscape, softscape",19.0,published,['NA'],pub,4,public,0852-7733,2023-05-08 07:48:17,26447.0,Jurusan Teknik Sipil Fakultas Teknik Universitas Lampung,disk0_bak/00/05/12/27,"Rekayasa, Jurnal Teknik Sipil dan Perencanaan",['FT9'],2023-05-08 07:48:17,"[{'pos': 1, 'uri': 'http://repository.lppm.unila.ac.id/id/document/190986', 'security': 'public', 'placement': 1, 'eprintid': 51227, 'language': 'en', 'rev_number': 2, 'mime_type': 'application/pdf', 'files': [{'mtime': '2020-11-20 05:03:48', 'hash_type': 'MD5', 'uri': 'http://repository.lppm.unila.ac.id/id/file/550397', 'filename': 'jurnal rekayasa 2015.pdf', 'filesize': 21978223, 'objectid': 190986, 'mime_type': 'application/pdf', 'hash': '9a8ac791d35698938b6df77718998d77', 'datasetid': 'document', 'fileid': 550397}], 'main': 'jurnal rekayasa 2015.pdf', 'docid': 190986, 'format': 'text'}]",190,2.0,show,53-65,2023-05-08 07:48:17,51227,archive,"KAJIAN SPATIAL ENCLOSURE PADA PENATAAN RUANG JALAN 
Studi Kasus : Penataan Koridor Perdagangan di Kawasan Teluk Betung Bandar Lampung",TRUE,"[{'id': 'kelik.hendro@eng.unila.ac.id', 'name': {'given': 'Kelik Hendro', 'family': 'Basuki', 'lineage': None, 'honourific': None}}]",article,,,,,,,
1,2015-08-11,http://repository.lppm.unila.ac.id/id/eprint/6181,"CITRA PERSADA. Policy Model of  Sustainable Infrastructure (Case Study: Bandar-lampung City). Under supervision of  SANTUN R.P. SITORUS as the Chairman, MARIMIN, and RUCHYAT DENI DJAKAPERMANA each as Members.
Infrastructure development does not only affect the economic aspect, but also social and environmental, those are the main dimensions of sustainable development. Many aspects and actors involved in infrastructure development requires a comprehensive and integrated policy towards sustainability. Therefore, it is necessary to formulate an infrastructure development policy that considers various dimensions of sustainable development. The main objective of this research is to formulate policy of sustainable infrastructure development, with specific objectives are: firstly, to measure the level of sustainability of the city's infrastructure; secondly, to formulate the indicators that influence the sustainability of city infrastructure development and thirdly, to design a policy model of sustainable urban infrastructure with dynamic system. This research was conducted in Bandarlampung City. This study use a comprehensive modeling, namely the Multi Dimensional Scaling (MDS) with Rapid Appraisal of Infrastructure (Rapinfra) to measure the level of sustainability of urban infrastructure development and search key indicators, and it uses of Analytic Network Process (ANP) to determine the effect indicators of sustainable infrastructure development. The findings of the MDS analysis showed that the status of Bandarlampung City infrastructure sustainability is less sustainable with the index value of 38.05 %. ANP analysis produces 8 main indicators of the most influential in the development of sustainable infrastructure. The dynamic model offered 4 scenarios of sustainable urban infrastructure policy model. The best scenario was implemented into 3 policies consist of:  the integrated  infrastructure management, the population control, and the local economy development. The results of this study are expected to be useful for stakeholders, especially the governments as a reference in the development of sustainable urban infrastructure development policy.

Keywords: ANP,  dynamic   model,  policy,  Rapinfra,  sustainability,   urban infrastructure",,completed,['TD'],submitted,11,public,,2019-11-08 05:08:20,,,disk0/00/00/61/81,,['FT9'],2019-11-08 05:08:20,"[{'uri': 'http://repository.lppm.unila.ac.id/id/document/19108', 'pos': 1, 'security': 'public', 'placement': 1, 'eprintid': 6181, 'mime_type': 'application/pdf', 'language': 'en', 'rev_number': 1, 'docid': 19108, 'main': 'RINGKASAN-disertasi-buku.pdf', 'files': [{'mtime': '2017-12-01 23:32:26', 'hash_type': 'MD5', 'uri': 'http://repository.lppm.unila.ac.id/id/file/56786', 'filename': 'RINGKASAN-disertasi-buku.pdf', 'filesize': 1590954, 'objectid': 19108, 'mime_type': 'application/pdf', 'hash': 'e9a126ba3092dcf27702ffbac05c133d', 'fileid': 56786, 'datasetid': 'document'}], 'format': 'text'}]",408,,show,,2019-11-08 05:08:20,6181,archive,"MODEL KEBIJAKAN PEMBANGUNAN 
INFRASTRUKTUR BERKELANJUTAN
(Studi Kasus : Kota Bandarlampung)",,"[{'name': {'given': 'Citra', 'honourific': None, 'lineage': None, 'family': 'Persada'}, 'id': 'citrapersada8@yahoo.com'}]",thesis,phd,161.0,doctoral,"[{'type': 'http://www.loc.gov/loc.terms/relators/SAD', 'name': {'given': 'Santun', 'honourific': None, 'family': 'Sitorus', 'lineage': None}}, {'name': {'given': 'Marimin', 'family': 'Marimin', 'lineage': None, 'honourific': None}, 'type': 'http://www.loc.gov/loc.terms/relators/SAD'}, {'name': {'given': 'Ruchyat Deni', 'honourific': None, 'lineage': None, 'family': 'Djakapermana'}, 'type': 'http://www.loc.gov/loc.terms/relators/SAD'}]",Pengelolaan Lingkungan dan Sumber Daya Alam,Institut Pertanian Bogor,['Universitas Lampung']
