,status_changed,full_text_status,issn,rev_number,ispublished,divisions,publisher,publication,dir,volume,abstract,date,uri,subjects,date_type,creators,type,refereed,title,number,userid,documents,official_url,lastmod,eprint_status,eprintid,datestamp,metadata_visibility
0,2020-11-19 04:30:18,public,1978-6034,6,pub,['FEB5'],Jurusan Ekonomi dan Bisnis Polinela,Jurnal Ilmiah ESAI,disk0/00/02/61/80,5,"Regency augmentation performs interesting phenomenon approximating the new
autonomous region in Lampung Province. There had been 10 the new autonomous
regions since 1991 until 2008. The regency augmentation has been presenting the
opportunity and new hope for the autonomous region to arrange its own region
dialed with welfare escalation and enlargement distribution. Even though, Regency
financing still depend on centralization transfer called general fund allocation. This
paper purposes to analyze the regional inequality between regency and the regency
dependency on fiscal toward general fund allocation in Lampung Province. This
study did in June until October 2010 with the purposive sampling regency included
West Lampung, Tanggamus, Tulang Bawang, East Lampung, Way Kanan and Metro
regency. Time series data analysis with Williamson inequality index and finance
dependency with share portion. Based on the analysis, the Williamson index on
region inequality between the new autonomous region and the elderly region
performed on lower condition. It is indicating that regency augmentation has been
succeeding in creating the development distribution in Lampung Province. Fiscal
dependency on general fund allocation accessible is more than 60% until 80% on
income region. In general, this means that the new autonomous region still depend
on general fund allocation significantly, except Tanggamus regency.",2011-01-01,http://repository.lppm.unila.ac.id/id/eprint/26180,['H1'],published,"[{'name': {'given': 'ambya', 'honourific': None, 'lineage': None, 'family': 'ambya'}, 'id': 'ambya.1959@feb.unila.ac.id'}]",article,TRUE,Pemekaran Kabupaten dan Pemerataan Pembangunan di Propinsi Lampung,1,914,"[{'eprintid': 26180, 'placement': 1, 'security': 'public', 'pos': 1, 'uri': 'http://repository.lppm.unila.ac.id/id/document/40064', 'format': 'text', 'main': '1033-File Utama Naskah-2125-1-10-20180712 (1).pdf', 'files': [{'mime_type': 'application/pdf', 'hash': 'bb009afbd7553a3301285cd3b92f1fdd', 'fileid': 235990, 'datasetid': 'document', 'uri': 'http://repository.lppm.unila.ac.id/id/file/235990', 'filename': '1033-File Utama Naskah-2125-1-10-20180712 (1).pdf', 'objectid': 40064, 'filesize': 151493, 'mtime': '2020-11-19 03:05:50', 'hash_type': 'MD5'}], 'docid': 40064, 'language': 'en', 'mime_type': 'application/pdf', 'rev_number': 1}]",http://jurnal.polinela.ac.id/index.php/ESAI/article/download/1033/718,2020-11-19 04:30:18,archive,26180,2020-11-19 04:30:18,show
