,datestamp,eprint_status,eprintid,metadata_visibility,pagerange,userid,number,lastmod,documents,type,creators,title,refereed,subjects,abstract,volume,date,uri,publisher,dir,publication,divisions,issn,full_text_status,status_changed,rev_number,ispublished,official_url,date_type,related_url,id_number,contributors,corp_creators
0,2019-05-09 08:20:59,archive,12279,show,50-58,980,1,2019-05-09 08:20:59,"[{'format': 'text', 'docid': 25259, 'main': '17352-40852-1-PB.pdf', 'files': [{'fileid': 109562, 'datasetid': 'document', 'mime_type': 'application/pdf', 'hash': 'dccf6155805aa381fdc385f7b239970a', 'objectid': 25259, 'filesize': 1577072, 'filename': '17352-40852-1-PB.pdf', 'uri': 'http://repository.lppm.unila.ac.id/id/file/109562', 'hash_type': 'MD5', 'mtime': '2019-05-09 06:59:44'}], 'language': 'en', 'rev_number': 1, 'mime_type': 'application/pdf', 'eprintid': 12279, 'placement': 1, 'security': 'public', 'uri': 'http://repository.lppm.unila.ac.id/id/document/25259', 'pos': 1}]",article,"[{'id': 'risma_msinaga@gmail.com', 'name': {'given': 'RMS', 'family': 'Risma M Sinaga', 'lineage': None, 'honourific': None}}, {'name': {'given': 'Trisna', 'lineage': None, 'family': 'Trisnaningsih', 'honourific': None}, 'id': 'trisna_unila@yahoo.co.id'}, {'id': 'pujiatifkipunila@gmail.com', 'name': {'honourific': None, 'family': 'Pujiati', 'lineage': None, 'given': 'P'}}, {'name': {'given': 'sudarmansyah', 'honourific': None, 'lineage': None, 'family': 'didi'}, 'id': 'didisudarmansyah77@gmail.com'}]",Development of Learning Media Based on Mobile Learning Applications,TRUE,['L1'],"Abstract: Development of mobile learning application-based media. Objectives: The purpose of this study is to develop a more dynamic learning media by utilizing technology in the form of applications onsmartphone devices to improve student learning outcomes. Methods: This study uses research  and development methods with data collection techniques in the form of questionnaires, feasibility tests and effectiveness of mobile learning applications developed as learning media through stages design edaccording to the ADDHIE model. Findings: Product development in the form  of mobile
learning applications is feasible as a learning medium and effective for improving  student  learning outcomes with an increase in the average value of 28 students from 57.32 to 81.43. Conclusion: Mobile learning application is a good choice as a learning media.

Keywords: Learning media, mobile learning application, research and development",9,1970-01-01 00:00:00.000002019,http://repository.lppm.unila.ac.id/id/eprint/12279,FKIP UNILA,disk0/00/01/22/79,Jurnal Pendidikan Progresif,['FKIP10'],2087-9849,public,2019-05-09 08:20:59,6,pub,,,,,,
1,2019-11-04 08:09:58,archive,15205,show,18-27,1087,14,2019-11-04 08:09:58,"[{'language': 'en', 'rev_number': 1, 'mime_type': 'application/pdf', 'files': [{'mime_type': 'application/pdf', 'hash': '0e346715df41abd34676977cbe02fb38', 'fileid': 130879, 'datasetid': 'document', 'mtime': '2019-11-04 03:27:03', 'hash_type': 'MD5', 'uri': 'http://repository.lppm.unila.ac.id/id/file/130879', 'filename': '09. Publikasi Jurnal.pdf', 'filesize': 406925, 'objectid': 28344}], 'main': '09. Publikasi Jurnal.pdf', 'docid': 28344, 'format': 'text', 'pos': 1, 'uri': 'http://repository.lppm.unila.ac.id/id/document/28344', 'security': 'public', 'placement': 1, 'eprintid': 15205}]",article,"[{'name': {'given': 'SUDJARWO', 'family': 'SUDJARWO', 'lineage': None, 'honourific': None}, 'id': 'profdrsudjarwo@gmail.com'}]","Development of Android-Based Mobile Learning: Answering the
Challenges of the Industrial Revolution 4.0",TRUE,"['H1', 'L1']","Economic Learning in the Social Sciences Department at Al-Kautsar High School in Bandar Lampung is more
teacher-oriented. The use of media is only limited to the use of powerpoint. In addition, the low percentage of
KKM achievement (minimum completeness criteria) of students in several daily tests. Learning that uses mobile learning media is an alternative learning to increase student academic achievement in formative and summative tests as well. This development research aims to produce products that is mobile learning android-based in economic learning in order to answer the challenges of the industrial revolution 4.0. This study uses the Research and Development method with the ADDIE model (analysis, design, development, implementation and
evaluation). The results of the study show that mobile learning has a significant influence on student academic
achievement.
Keywords: mobile learning, academic achievement, android, economic learning.",10,2019-05-31 00:00:00.000000000,http://repository.lppm.unila.ac.id/id/eprint/15205,http://www.iiste.org,disk0/00/01/52/05,Journal of Education and Practice,['FKIP10'],2222-288X,public,2019-11-04 08:09:58,7,pub,http://www.iiste.org,published,[{'url': 'http://www.iiste.org'}],,,
2,2019-11-04 08:09:49,archive,15195,show,167-171,1087,5,2019-11-04 08:09:49,"[{'rev_number': 1, 'language': 'en', 'mime_type': 'application/pdf', 'main': 'Relationships between Organizational Climate and organizational commitment A literature review in the asian context.pdf', 'docid': 28336, 'files': [{'hash_type': 'MD5', 'mtime': '2019-11-04 03:03:00', 'filesize': 439851, 'objectid': 28336, 'filename': 'Relationships between Organizational Climate and organizational commitment A literature review in the asian context.pdf', 'uri': 'http://repository.lppm.unila.ac.id/id/file/130789', 'datasetid': 'document', 'fileid': 130789, 'mime_type': 'application/pdf', 'hash': '3591ba32a2d2f2d2523d4d814213cf08'}], 'format': 'text', 'pos': 1, 'uri': 'http://repository.lppm.unila.ac.id/id/document/28336', 'security': 'public', 'placement': 1, 'eprintid': 15195}]",article,"[{'name': {'lineage': None, 'family': 'SUDJARWO', 'honourific': None, 'given': 'SUDJARWO'}, 'id': 'profdrsudjarwo@gmail.com'}]","Relationships between Organizational Climate and
Organizational Commitment: A Literature Review in the Asian Context",TRUE,"['H1', 'L1']","The importance of organizational climate in an organization attracts researchers to investigate it, and this paper is to examine the relationship between organizational climate and organizational commitment. There are a few articles about review of the relationship between organizational climate and organizational commitment, especially in Asia context, that can be found. The purpose of this review is to examine the
relationship between organizational climate and organizational commitment in Asia. Based on the results of literature review from various countries and organizations in Asia, we found that organizational climate and organizational commitment has a positive and significant relationship.",3,2019-05-01 00:00:00.000000000,http://repository.lppm.unila.ac.id/id/eprint/15195,www.rsisinternational.org,disk0/00/01/51/95,International Journal of Research and Innovation in Social Science (IJRISS),['FKIP10'],2454-6186,public,2019-11-04 08:09:49,12,pub,http://www.rsisinternational.org,published,[{'url': 'http://www.rsisinternational.org'}],5.0,,
3,2019-08-01 07:28:22,archive,13659,show,50-58,820,1,2019-08-01 07:28:22,"[{'security': 'public', 'uri': 'http://repository.lppm.unila.ac.id/id/document/26672', 'pos': 1, 'eprintid': 13659, 'placement': 1, 'mime_type': 'application/pdf', 'language': 'en', 'rev_number': 1, 'format': 'text', 'docid': 26672, 'main': 'SINAGA_R_MARGARETHA_DEVELOPMENT_OF_MOBILE.pdf', 'files': [{'mtime': '2019-07-25 04:55:38', 'hash_type': 'MD5', 'uri': 'http://repository.lppm.unila.ac.id/id/file/119204', 'filename': 'SINAGA_R_MARGARETHA_DEVELOPMENT_OF_MOBILE.pdf', 'filesize': 3859332, 'objectid': 26672, 'mime_type': 'application/pdf', 'hash': 'ee195da0893fac6a90f6f8b04afa18e9', 'datasetid': 'document', 'fileid': 119204}]}]",article,"[{'id': 'sinaga_rmargaretha@yahoo.com', 'name': {'family': 'Sinaga', 'lineage': None, 'honourific': None, 'given': 'Risma Margaretha'}}, {'name': {'given': 'Trisna', 'honourific': None, 'lineage': None, 'family': 'Trisnaningsih'}, 'id': 'trisna_unila@yahoo.co.id'}, {'id': 'pujiatifkipunila@gmail.com', 'name': {'honourific': None, 'family': 'Pujiati', 'lineage': None, 'given': 'P'}}, {'id': None, 'name': {'given': 'Didi', 'lineage': None, 'family': 'Sudarmansyah', 'honourific': None}}]",Development of Learning Media Based on Mobile Learning Applications,TRUE,['L1'],"Objectives: The purpose
of this study is to develop a more dynamic learning media by utilizing technology in the form of
applications on smartphone devices to improve student learning outcomes. Methods: This study uses
research and development methods with data collection techniques in the form of questionnaires,
feasibility tests and effectiveness of mobile learning applications developed as learning media through
stages designed accordingto theADDHIEmodel. Findings: Product development intheform of mobile
learning applications is feasible as a learning medium and effective for improving student learning
outcomes with an increase in the average value of 28 students from 57.32 to 81.43. Conclusion:
Mobile learning application is a good choice as a learning media.
Keywords: Learning media, mobile learning application, research and development",9,1970-01-01 00:00:00.000002019,http://repository.lppm.unila.ac.id/id/eprint/13659,FKIP Unila,disk0/00/01/36/59,Jurnal Pendidikan Progresif,['FKIP10'],2087-9849,public,2019-08-01 07:28:22,7,pub,http://jurnal.fkip.unila.ac.id/,,,,"[{'type': 'http://www.loc.gov/loc.terms/relators/AUT'}, {'type': 'http://www.loc.gov/loc.terms/relators/AUT'}, {'type': 'http://www.loc.gov/loc.terms/relators/AUT'}, {'type': 'http://www.loc.gov/loc.terms/relators/AUT'}]","['Jurusan Pendidikan IPS FKIP Unila', 'Jurusan Pendidikan IPS FKIP Unila', 'Jurusan Pendidikan IPS FKIP Unila', 'Jurusan Pendidikan IPS FKIP Unila']"
4,2019-05-09 08:15:42,archive,12266,show,40-49,980,1,2019-05-09 08:15:42,"[{'rev_number': 1, 'language': 'en', 'mime_type': 'application/pdf', 'files': [{'mime_type': 'application/pdf', 'hash': '2b6ec4888102bfbbc67109b48fd3590f', 'datasetid': 'document', 'fileid': 109488, 'uri': 'http://repository.lppm.unila.ac.id/id/file/109488', 'filename': '17351-40795-1-PB.pdf', 'filesize': 984974, 'objectid': 25249, 'mtime': '2019-05-09 06:34:38', 'hash_type': 'MD5'}], 'main': '17351-40795-1-PB.pdf', 'docid': 25249, 'format': 'text', 'uri': 'http://repository.lppm.unila.ac.id/id/document/25249', 'pos': 1, 'security': 'public', 'placement': 1, 'eprintid': 12266}]",article,"[{'id': 'trisna_unila@yahoo.co.id', 'name': {'honourific': None, 'family': 'Trisnaningsih', 'lineage': None, 'given': 'Trisna'}}, {'id': 'risma_msinaga@gmail.com', 'name': {'lineage': None, 'family': 'Risma M Sinaga', 'honourific': None, 'given': 'RMS'}}, {'name': {'lineage': None, 'family': 'Pujiati', 'honourific': None, 'given': 'P'}, 'id': 'pujiatifkipunila@gmail.com'}, {'id': 'buchoriasyik@yahoo.co.id', 'name': {'given': 'Buchori', 'family': 'Buchori asyik', 'lineage': None, 'honourific': None}}]",Soft Skills In The Teachers’ Professional Development Perspective,TRUE,['L1'],"Abstract: Soft skills in the teachers’ professional development perspective. Objectives: This study aims to determine the role of soft skills in teacher professional development. Methods: This study used a survey method for a number of Social Sciences Education teachers in junior high
schools. Data was collected using a questionnaire regarding teacher identity and soft skill instruments as a result of development that had been expertly tested and small group tests according to the Borg and Galls design. Findings: There was a significant relationship between age and the quality of soft skills scores (r = -0.292, p < 0.05.). In line with that, a negative correlation was also obtained between age and personal attributes (r = -0.287, p < 0.05. Conclusions: Soft skills tended to decrease for
teachers as they grew older, the soft skills the teachers had differed in terms of rank and class and
Soft skills were closely related to teacher professional development.",9,1970-01-01 00:00:00.000002019,http://repository.lppm.unila.ac.id/id/eprint/12266,FKIP UNILA,disk0/00/01/22/66,Jurnal Pendidikan Progresif,['FKIP10'],2087-9849,public,2019-05-09 08:15:42,6,pub,http://jurnal.fkip.unila.ac.id/index.php/jpp/issue/view/972,,,,,
