,rev_number,ispublished,succeeds,status_changed,full_text_status,issn,dir,publication,divisions,uri,volume,abstract,subjects,date_type,refereed,title,type,creators,documents,lastmod,official_url,number,userid,pagerange,metadata_visibility,eprint_status,eprintid,datestamp,publisher
0,4,pub,26972.0,2020-12-10 04:59:44,public,ISSN 2454-6186,disk0/00/02/69/83,Internasional Journal Of Research and Inovation in Social Science,['FKIP10'],http://repository.lppm.unila.ac.id/id/eprint/26983,IV,"The purpose of this study is to analyse
how the social changes of transmigration society.
It is viewed from some perspectives, which are
seen from social, economic and cultural aspects of
the society in Margo Mulyo village, Jati Agung
Subdistrict, South Lampung Regency. This
research uses qualitative research by descriptive
approach. The sampling technique used
is snowball sampling . Data collection technique is
done by a complete interviews, observation and
photo documentation. The results show that (1)
Land ownership by transmigration society from
generation to generation was running out and
cause the last generation need to gain income from
other islands (2) On average, child from
transmigration society attended education to the
middle level and the next generation got education
to senior high school level but there were also
come to college (3) Institutions in Margo Mulyo
village started with only a small number of village
officials and now have developed into various
village organizations from generation to
generation (4) transmigrants have a livelihood as
farmers but with own land and wider land (5) The
income of transmigration society has changed
better (6) Transmigrants brought a lot of Javanese
Culture to their destination and some have
flourished until now but as the change of modern
era, some traditions have left by the generation.
Keywords : Social Change, Transmigration, Social,
Economic and Cultural Rights",['L1'],published,TRUE,"SOCIAL CHANGES OF
TRANSMIGRATION SOCIETY ON
SOCIAL, ECONOMIC AND CULTURAL
PERSPECTIVE IN MARGO MULYO
VILLAGE",article,"[{'name': {'given': 'Ririn', 'honourific': None, 'lineage': None, 'family': 'Ririn Wuryani'}, 'id': None}, {'id': 'profdrsudjarwo@gmail.com', 'name': {'given': 'SUDJARWO', 'honourific': None, 'family': 'SUDJARWO', 'lineage': None}}, {'id': 'pujiatifkipunila@gmail.com', 'name': {'given': 'P', 'honourific': None, 'family': 'Pujiati', 'lineage': None}}]","[{'placement': 1, 'eprintid': 26983, 'pos': 1, 'uri': 'http://repository.lppm.unila.ac.id/id/document/40998', 'security': 'public', 'files': [{'hash': '13464c9b9cdbe067d95526e52d090de7', 'mime_type': 'application/pdf', 'datasetid': 'document', 'fileid': 242053, 'filename': 'Jurnal Ririn W, sudjarwo, pujiati_compressed.pdf', 'uri': 'http://repository.lppm.unila.ac.id/id/file/242053', 'filesize': 1770906, 'objectid': 40998, 'mtime': '2020-12-02 23:15:32', 'hash_type': 'MD5'}], 'main': 'Jurnal Ririn W, sudjarwo, pujiati_compressed.pdf', 'docid': 40998, 'format': 'text', 'mime_type': 'application/pdf', 'language': 'en', 'rev_number': 2}]",2020-12-10 04:59:44,https://www.rsisinternational.org/journals/ijriss/Digital...4.../431-434.pdf,VI,85,431-434,show,archive,26983,2020-12-10 04:59:44,
1,8,pub,,2022-01-03 10:00:37,public,,disk0/00/03/75/71,,['FKIP10'],http://repository.lppm.unila.ac.id/id/eprint/37571,,,['L1'],,,Ragam Hias Motif Belah Ketupat Masyarakat Tanggamus,other,"[{'id': 'risma_msinaga@gmail.com', 'name': {'given': 'RMS', 'honourific': None, 'family': 'Risma M Sinaga', 'lineage': None}}, {'id': 'henry.susanto@fkip.unila.ac.id', 'name': {'given': 'Henry', 'honourific': None, 'family': 'Susanto', 'lineage': None}}, {'id': 'erimson.siregar@fkip.unila.ac.id', 'name': {'given': 'Erimson', 'family': 'Siregar', 'lineage': None, 'honourific': None}}, {'name': {'given': 'Valensy', 'family': 'Rachmedita', 'lineage': None, 'honourific': None}, 'id': 'valensy.rachmedita02@fkip.unila.ac.id'}]","[{'docid': 158506, 'main': '1090.pdf', 'files': [{'hash_type': 'MD5', 'mtime': '2022-01-03 07:17:40', 'filesize': 2182518, 'objectid': 158506, 'filename': '1090.pdf', 'uri': 'http://repository.lppm.unila.ac.id/id/file/429012', 'fileid': 429012, 'datasetid': 'document', 'hash': 'fe97eee54262963852c2c347f3a6ab3c', 'mime_type': 'application/pdf'}], 'format': 'text', 'mime_type': 'application/pdf', 'language': 'en', 'rev_number': 2, 'placement': 1, 'eprintid': 37571, 'uri': 'http://repository.lppm.unila.ac.id/id/document/158506', 'pos': 1, 'security': 'public'}]",2022-01-03 10:00:37,,,654,,show,archive,37571,2022-01-03 10:00:37,KEMENTERIAN HUKUM DAN HAK ASASI MANUSIA
2,13,pub,,2022-03-08 07:21:10,public,2087-9849,disk0/00/03/99/27,Jurnal Pendidikan Progresif,['FKIP10'],http://repository.lppm.unila.ac.id/id/eprint/39927,,"Analisis Klasifikasi Mitos Dalam Tradisi Lisan Masyarakat Lampung. Tujuan
penelitian ini adalah untuk menganalisis karakter mitos dilihat dari ragam dan varian sebagai tradisi
lisan masyarakat Lampung, dan melihatnya sebagai penanda atau identitas. Data diperoleh melalui
metode survei, wawancara dan dokumetasi dan dianalisis secara kualitatif. Hasil penelitian menunjukkan
terdapat karakter dan pengkategorian mitos pada masyarakat Lampung berdasarkan wilayah adat
masyarakatnya yang beradat Papadun maupun Saibatin. Dalam ragam mitos ditemukan nilai-nilai
yang menjadi karakter masyarakat Lampung seperti teguh pada pendirian, rela mati demi harga diri,
dan terbuka kepada orang lain. Mitos juga memiliki berbagai fungsi dan dalam kehidupan masyarakat
yang benilai pendidikan, nilai sosial, nilai hiburan dan nilai mistis, dan bahkan menjadi identitas sosial
dan budaya masyarakat Lampung.",['L1'],,TRUE,Analisis Klasifikasi Mitos dalam Tradisi Lisan Masyarakat Lampung,article,"[{'id': 'sinaga_rmargaretha@yahoo.com', 'name': {'given': 'Risma Margaretha', 'honourific': None, 'family': 'Sinaga', 'lineage': None}}]","[{'eprintid': 39927, 'placement': 1, 'security': 'public', 'pos': 1, 'uri': 'http://repository.lppm.unila.ac.id/id/document/161217', 'format': 'text', 'docid': 161217, 'main': '14836-32851-1-SM.pdf', 'files': [{'mtime': '2022-03-08 04:19:07', 'hash_type': 'MD5', 'filename': '14836-32851-1-SM.pdf', 'uri': 'http://repository.lppm.unila.ac.id/id/file/447028', 'objectid': 161217, 'filesize': 767004, 'hash': '9b1fc52569326bc8650112537010e725', 'mime_type': 'application/pdf', 'fileid': 447028, 'datasetid': 'document'}], 'language': 'en', 'mime_type': 'application/pdf', 'rev_number': 2}]",2022-03-08 07:21:10,,,820,,show,archive,39927,2022-03-08 07:21:10,Unit Database dan Publikasi Ilmiah FKIP kerjasama dengan ISPI
3,7,pub,,2022-03-08 07:21:13,public,2087-9849,disk0/00/03/99/28,Jurnal Pendidikan Progresif,['FKIP10'],http://repository.lppm.unila.ac.id/id/eprint/39928,,"Soft Skills in the Teachers’ Professional Development Perspective. Objectives: This study aims to determine the role of soft skills in teacher professional development. Methods: This study used a survey method for a number of Social Sciences Education teachers in junior high schools. Data was collected using a questionnaire regarding teacher identity and soft skill instruments as a result of development that had been expertly tested and small group tests according to the Borg and Galls design. Findings: There was a significant relationship between age and the quality of soft skills scores (r = -0.292, p < 0.05.). In line with that, a negative correlation was also obtained between age and personal attributes (r = -0.287, p < 0.05. Conclusions: Soft skills tended to decrease for teachers as they grew older, the soft skills the teachers had differed in terms of rank and class and Soft skills were closely related to teacher professional development.

Keywords: Soft skills, social demography, professionalism",['L1'],,TRUE,Soft Skills in the Teachers’ Demographic and Professional Development Perspective,article,"[{'name': {'given': 'Risma Margaretha', 'lineage': None, 'family': 'Sinaga', 'honourific': None}, 'id': 'sinaga_rmargaretha@yahoo.com'}]","[{'docid': 161218, 'main': '17352-40852-1-PB.pdf', 'files': [{'mtime': '2022-03-08 04:25:56', 'hash_type': 'MD5', 'filename': '17352-40852-1-PB.pdf', 'uri': 'http://repository.lppm.unila.ac.id/id/file/447038', 'filesize': 1577072, 'objectid': 161218, 'mime_type': 'application/pdf', 'hash': 'dccf6155805aa381fdc385f7b239970a', 'datasetid': 'document', 'fileid': 447038}], 'format': 'text', 'mime_type': 'application/pdf', 'language': 'en', 'rev_number': 2, 'placement': 1, 'eprintid': 39928, 'pos': 1, 'uri': 'http://repository.lppm.unila.ac.id/id/document/161218', 'security': 'public'}]",2022-03-08 07:21:13,,,820,,show,archive,39928,2022-03-08 07:21:13,Unit Database dan Publikasi Ilmiah FKIP kerjasama dengan ISPI
4,6,pub,,2020-05-29 10:18:33,public,2525-3409,disk0/00/02/10/60,"Research, Society and Development",['FKIP10'],http://repository.lppm.unila.ac.id/id/eprint/21060,,"This study aims to know the development and effectiveness of teaching material application
for trading accounting using visual basic program in enhancing students’ ability to draft
financial statements. The methodology used in this study is research and development using
pre-experimental design. There are ten steps in analyzing the teaching material using research
and development approach. However, this study only uses six steps including (1) Research
and Information Collection, (2) Planning, (3) Develop Preliminary Form of Product, (4)
Preliminary Field Testing, (5) Main Product Revision, and (6) Main Field Testing. This study
is done in Al-Kautsar High School in Bandar Lampung with 35 students of 12th grade as the
sample study. The result found that the teaching material application development for trading
accounting using visual basic program had been validated by experts and declared feasible to
be used. The effectiveness also can be seen from the difference in students’ pretest and
posttest scores which done before and after using the teaching material application. Thus, in
summary, the use of teaching material application for trading accounting using visual basic
program is able to enhance students’ ability to become better.
Keywords: Teaching material application; Visual basic program; Drafting ability.",['L1'],,TRUE,The development of teaching material application based on visual basic program to enhance ability in drafting financial statements,article,"[{'id': 'satarwarya@gmail.com', 'name': {'given': 'Satar', 'honourific': None, 'lineage': None, 'family': 'Warya'}}, {'name': {'honourific': None, 'family': 'SUDJARWO', 'lineage': None, 'given': 'SUDJARWO'}, 'id': 'profdrsudjarwo@gmail.com'}, {'id': 'pujiatifkipunila@gmail.com', 'name': {'family': 'Pujiati', 'lineage': None, 'honourific': None, 'given': 'P'}}]","[{'main': '2217-9359-1-PB (1) jurnal bu puji.pdf', 'docid': 34439, 'files': [{'hash_type': 'MD5', 'mtime': '2020-05-29 09:06:08', 'filesize': 760625, 'objectid': 34439, 'uri': 'http://repository.lppm.unila.ac.id/id/file/196436', 'filename': '2217-9359-1-PB (1) jurnal bu puji.pdf', 'fileid': 196436, 'datasetid': 'document', 'hash': '9abed47df8dfdbc6b65ca24fd66a05d7', 'mime_type': 'application/pdf'}], 'format': 'text', 'language': 'en', 'mime_type': 'application/pdf', 'rev_number': 1, 'placement': 1, 'eprintid': 21060, 'uri': 'http://repository.lppm.unila.ac.id/id/document/34439', 'pos': 1, 'security': 'public'}]",2020-05-29 10:18:33,,,85,,show,archive,21060,2020-05-29 10:18:33,
