,datestamp,eprint_status,eprintid,id_number,pagerange,contributors,userid,number,official_url,documents,refereed,abstract,corp_creators,date,related_url,publisher,full_text_status,issn,ispublished,metadata_visibility,lastmod,creators,type,title,date_type,subjects,volume,uri,publication,dir,divisions,status_changed,rev_number,contact_email,place_of_pub,pages,isbn,series,event_title,event_type,event_dates,pres_type,event_location,succeeds,book_title,editors
16,2021-11-11 01:12:27,archive,35840,,,,331,2.0,,"[{'main': 257, 'docid': 156788, 'files': [{'mtime': '2021-11-10 15:09:53', 'hash_type': 'MD5', 'uri': 'http://repository.lppm.unila.ac.id/id/file/416337', 'filename': 257, 'filesize': 38578, 'objectid': 156788, 'mime_type': 'text/html', 'hash': '10fbc67ab2647188ebcd72d50394d16e', 'datasetid': 'document', 'fileid': 416337}], 'format': 'text', 'rev_number': 2, 'language': 'en', 'mime_type': 'text/html', 'placement': 1, 'eprintid': 35840, 'pos': 1, 'uri': 'http://repository.lppm.unila.ac.id/id/document/156788', 'security': 'public'}, {'security': 'public', 'uri': 'http://repository.lppm.unila.ac.id/id/document/156789', 'pos': 2, 'eprintid': 35840, 'placement': 2, 'rev_number': 2, 'language': 'en', 'mime_type': 'text/html', 'format': 'text', 'docid': 156789, 'main': 257, 'files': [{'filesize': 38578, 'objectid': 156789, 'filename': 257, 'uri': 'http://repository.lppm.unila.ac.id/id/file/416340', 'hash_type': 'MD5', 'mtime': '2021-11-10 15:10:31', 'datasetid': 'document', 'fileid': 416340, 'hash': '8cefe15356bb37432e6c28e9a79387ac', 'mime_type': 'text/html'}]}]",TRUE,"Turnover can also be defined as the movement of workers out of the organization. Turnover refers to the final reality faced by an organization in the form of the number of employees who leave the organization in a certain period, while the desire of employees to move (turnover intentions) refers to the results of individual evaluations regarding the continuation of relationships with the organization that have not been manifested in definite actions to leave the organization. This study aims to determine the effect of Financial Compensation on Turnover Intention, Knowing the effect of Non-Financial Compensation on Turnover Intention and Knowing the effect of Job Satisfaction on Turnover Intention. In this study, sample selection was carried out using purposive sampling method. The purposive sampling method is a sampling technique with certain considerations. The sample in the study was selected using purposive sampling and obtained 65 samples. Based on the research results, financial compensation has no significant positive effect on the dependent variable, namely Turnover intention (Y), non-financial compensation has no effect on the dependent variable, namely Turnover intention (Y) and Job Satisfaction has no effect on the dependent variable, namely Turnover intention.",['University of Lampung'],2021-07-01 00:00:00.000000000,,Fakultas Ekonomi Universitas Lampung,public,,pub,show,2021-11-11 01:12:27,"[{'id': None, 'name': {'lineage': None, 'family': 'Fitriyana', 'honourific': None, 'given': 'Tika Zelin'}}, {'id': 'fajargd@yahoo.com', 'name': {'given': 'Fajar Gustiawaty', 'honourific': None, 'lineage': None, 'family': 'Dewi'}}, {'name': {'given': 'Pigo', 'family': 'Nauli', 'lineage': None, 'honourific': None}, 'id': 'pigo.nauli@feb.unila.ac.id'}]",article,Pengaruh Kompensasi Dan Kepuasan Kerja Terhadap Keinginan Untuk Pindah Dari Perusahaan (Studi Kasus Pada Dealer Di Bandarlampung),published,['H1'],26,http://repository.lppm.unila.ac.id/id/eprint/35840,Jurnal Akuntansi dan Keuangan,disk0/00/03/58/40,['FEB4'],2021-11-11 01:12:27,10,,,,,,,,,,,,,
17,2021-06-02 01:06:59,archive,31593,,,,571,,http://dx.doi.org/10.4108/eai.1-10-2020.2305577,"[{'language': 'en', 'rev_number': 1, 'mime_type': 'application/pdf', 'format': 'text', 'main': 'Accrual Accounting- Rindu Rika Gamayuni-prosiding ICEBE3 2020.pdf', 'docid': 142921, 'files': [{'mtime': '2021-06-01 07:43:46', 'hash_type': 'MD5', 'uri': 'http://repository.lppm.unila.ac.id/id/file/374283', 'filename': 'Accrual Accounting- Rindu Rika Gamayuni-prosiding ICEBE3 2020.pdf', 'objectid': 142921, 'filesize': 439497, 'hash': '533d91b0679fc173e718e6a243fe7784', 'mime_type': 'application/pdf', 'fileid': 374283, 'datasetid': 'document'}], 'security': 'public', 'pos': 1, 'uri': 'http://repository.lppm.unila.ac.id/id/document/142921', 'eprintid': 31593, 'placement': 1}]",FALSE,"This research is a bibliometric analysis study of accrual accounting in government financial
reporting. The purpose of this research is to examine the development of research in this field as a basis for
determining the direction of further research. Phenomenon that occurs is the benefits of implementing accrual
accounting in government which aims to produce information for decision making, is still a debate. In the
previous research, there is no bibliometric analysis on the development of government accrual accounting.
The research methodology was carried out with bibliometric analysis conducted on 200 Scopus indexed
papers published between 2010 and 2019. The Finding is there are 7 clusters of study areas on government
accrual accounting with different levels of theoretical maturity. So research on Government accrual
accounting still needs to be researched more deeply at this time regarding the benefits of accrual accounting
for decision making",,2021-04-01 00:00:00.000000000,,EAI,public,,pub,show,2021-06-02 01:06:59,"[{'name': {'lineage': None, 'family': 'Gamayuni', 'honourific': None, 'given': 'Rindu Rika'}, 'id': 'rindu.gamayuni@yahoo.com'}]",book,Accrual Accounting at Government: a Bibliometric Study,published,['HJ'],,http://repository.lppm.unila.ac.id/id/eprint/31593,,disk0/00/03/15/93,['FEB4'],2021-06-02 01:06:59,7,,,5.0,978-1-63190-298-7,CCER,,,,,,,,
18,2021-11-10 01:43:50,archive,35712,,,,571,,,"[{'language': 'en', 'mime_type': 'application/vnd.openxmlformats-officedocument.wordprocessingml.document', 'rev_number': 1, 'format': 'text', 'main': 'Paper ICEBE4 2021 Submit 5Sept2021.docx', 'docid': 156642, 'files': [{'mime_type': 'application/vnd.openxmlformats-officedocument.wordprocessingml.document', 'hash': 'b5c5a71067f530e56975b0034624349a', 'datasetid': 'document', 'fileid': 415369, 'mtime': '2021-11-10 00:43:37', 'hash_type': 'MD5', 'uri': 'http://repository.lppm.unila.ac.id/id/file/415369', 'filename': 'Paper ICEBE4 2021 Submit 5Sept2021.docx', 'filesize': 4736283, 'objectid': 156642}], 'security': 'public', 'pos': 1, 'uri': 'http://repository.lppm.unila.ac.id/id/document/156642', 'eprintid': 35712, 'placement': 1}, {'security': 'public', 'pos': 2, 'uri': 'http://repository.lppm.unila.ac.id/id/document/156643', 'eprintid': 35712, 'placement': 2, 'rev_number': 1, 'language': 'en', 'mime_type': 'application/pdf', 'format': 'text', 'main': 'LOA ICEBE 2021-039-1.pdf', 'files': [{'datasetid': 'document', 'fileid': 415371, 'hash': 'f889517d4eff8180dd2ea011666ba284', 'mime_type': 'application/pdf', 'objectid': 156643, 'filesize': 447112, 'filename': 'LOA ICEBE 2021-039-1.pdf', 'uri': 'http://repository.lppm.unila.ac.id/id/file/415371', 'hash_type': 'MD5', 'mtime': '2021-11-10 00:45:19'}], 'docid': 156643}, {'uri': 'http://repository.lppm.unila.ac.id/id/document/156644', 'pos': 3, 'security': 'public', 'placement': 3, 'eprintid': 35712, 'language': 'en', 'rev_number': 1, 'mime_type': 'application/pdf', 'files': [{'hash_type': 'MD5', 'mtime': '2021-11-10 00:48:52', 'filesize': 792951, 'objectid': 156644, 'uri': 'http://repository.lppm.unila.ac.id/id/file/415373', 'filename': 'Program Guide Book_ICEBE 2021 (1).pdf', 'datasetid': 'document', 'fileid': 415373, 'mime_type': 'application/pdf', 'hash': 'dde07f2c040ecc933b52aa2460d17c2d'}], 'main': 'Program Guide Book_ICEBE 2021 (1).pdf', 'docid': 156644, 'format': 'text'}]",FALSE,"Describe: this research is a bibliometric analysis study of abnormal accruals in government. The purpose of this study is to classify articles related to abnormal accruals in the financial statements of local governments in various countries and to examine the development of research related to abnormal accruals or the management of local government financial statements. Background Problems: there is still no conclusive and limited theory and empirical evidence about abnormal accruals in the public sector as a non-profit organization. The need to apply accrual accounting in government financial statements to create accountable and relevant financial reports is still in doubt because of abnormal accruals or the practice of managing numbers in local government financial statements. Novelty: conducting a bibliometric study to map research developments related to abnormal accruals so that further research is expected to contribute to science and government policy practitioners. Research Methods: the analysis was carried out using a bibliometric study using the Publish or Perish application and Vos Viewer to map 1000 articles from Google Scholar in the last 20 years (2000-2021). Finding / Results: there are four research groups related to abnormal accruals in government, and the development of theories and variables studied from the year 2000 to the present. Conclusion: Further research is needed to find the reasons and causes for abnormal accrual and the impact of abnormal accrual on the actual performance of the government organization.",,2021-11-07 00:00:00.000000000,,,public,,inpress,show,2021-11-10 01:43:50,"[{'id': 'rindu.gamayuni@yahoo.com', 'name': {'given': 'Rindu Rika', 'honourific': None, 'lineage': None, 'family': 'Gamayuni'}}]",conference_item,"A REVIEW OF ABNORMAL ACCRUAL AT GOVERNMENT: A BIBLIOMETRIC
STUDY",completed,['HJ'],,http://repository.lppm.unila.ac.id/id/eprint/35712,,disk0/00/03/57/12,['FEB4'],2021-11-10 01:43:50,9,,,,,,the 4th International Conference of Economics Business and Entrepreneurship” (ICEBE).,conference,7 November 2021,paper,"Novotel Hotel, bandarlampung",,,
19,2022-05-30 01:44:23,archive,41867,,64-77,,609,2.0,,"[{'mime_type': 'application/pdf', 'language': 'en', 'rev_number': 1, 'format': 'text', 'main': '491-85-4143-1-10-20211211_3.pdf', 'docid': 163536, 'files': [{'fileid': 462189, 'datasetid': 'document', 'mime_type': 'application/pdf', 'hash': '37953cc40626fba80456a38d7326b693', 'filesize': 532963, 'objectid': 163536, 'uri': 'http://repository.lppm.unila.ac.id/id/file/462189', 'filename': '491-85-4143-1-10-20211211_3.pdf', 'hash_type': 'MD5', 'mtime': '2022-05-26 08:23:47'}], 'security': 'public', 'uri': 'http://repository.lppm.unila.ac.id/id/document/163536', 'pos': 1, 'eprintid': 41867, 'placement': 1}]",TRUE,"Public space is part of the urban element that facilitates the interaction and communication needs of the society and describes the quality of urban space. The provision of public space affects social, economic, environmental and community quality activities, so a quality public space is needed. Parks as public spaces in Tanggamus Regency have not been evenly distributed because they are only available in 3 sub-districts, namely Taman Kota Ir. Soekarno (Kota Agung Pusat District), Rest Area Taman Gisting (Gisting District), and Rest Area Pugung (Pugung District) showed that the provision of public space had not met the distribution and quantity aspects. Rest Area Taman Gisting is located in Gisting Urban, which acts as a public space, so it is necessary to identify its quality because it has to serve the surrounding sub-districts. In addition, the declining quality of facilities and various other problems affect its quality as a public space. This study aims to determine the visitor's perception of the quality of the Gisting Park Rest Area as a public space. This study uses quantitative research methods with descriptive statistical analysis techniques and scoring methods (Likert scale). Based on the results of the study, visitors' perceptions of the quality of the Rest Area Taman Gisting as a public space are sufficient to meet the needs of visitors, sufficient to protect the rights of visitors, and sufficient to provide meaning for visitors.",,2021-12-01 00:00:00.000000000,,Prodi Perencanaan Wilayah dan Kota ITERA,public,2775-0566,pub,show,2022-05-30 01:44:23,"[{'name': {'lineage': None, 'family': 'Gunawan', 'honourific': None, 'given': 'Ferri Anggara Ade'}, 'id': None}, {'id': 'indahlistiana@yahoo.com', 'name': {'given': 'Indah', 'family': 'Listiana', 'lineage': None, 'honourific': None}}, {'id': None, 'name': {'given': 'Yudha', 'honourific': None, 'lineage': None, 'family': 'Rahman'}}]",article,PERSEPSI PENGUNJUNG TERHADAP KUALITAS REST AREA TAMAN GISTING SEBAGAI RUANG PUBLIK,,['S1'],1,http://repository.lppm.unila.ac.id/id/eprint/41867,JURNAL PERENCANAAN DAN PENGEMBANGAN KEBIJAKAN,disk0/00/04/18/67,"['FEB4', 'FEB5']",2022-05-30 01:44:23,7,,,,,,,,,,,,,
20,2021-11-11 01:12:58,archive,35855,,4288-4302,,571,2.0,http://psychologyandeducation.net/pae/index.php/pae,"[{'pos': 1, 'uri': 'http://repository.lppm.unila.ac.id/id/document/156808', 'security': 'public', 'placement': 1, 'eprintid': 35855, 'mime_type': 'application/pdf', 'language': 'en', 'rev_number': 1, 'main': 'artikel wuri dkk.pdf', 'files': [{'fileid': 416451, 'datasetid': 'document', 'hash': '02c7c7c3689cf6ec21845f94969ecbb5', 'mime_type': 'application/pdf', 'hash_type': 'MD5', 'mtime': '2021-11-11 00:44:44', 'objectid': 156808, 'filesize': 511132, 'filename': 'artikel wuri dkk.pdf', 'uri': 'http://repository.lppm.unila.ac.id/id/file/416451'}], 'docid': 156808, 'format': 'text'}]",FALSE,"Purpose: In regard of the significant contribution of service to a firm’s performance, this study investigates the impact of strategic
performance measurement sytstem (SPMS) on sustainability. Design, Methodology, and Approach: Our survey method is to
collect the research data by distributing questionnaires to the top management at airline industry office in Indonesia. Findings:
Based on the 105 usable data analysed using SmartPLS, this study showsthat service strategy and SPMS affect a firm’s performance.
SPMS has a significant influence on a firm’s performance when it is related to business strategy, especially service strategy. More
specifically, the alignment of service strategy with the business strategy can improve financial performance in the Indonesian airline
industry. Research limitations and implications: This study implies that organizations should design SPMS that links to service strategy with the company environment to improve performance. Originality and Value: The study contributes to the literature of SPMS, service strategy and company performance in in the airline industry in a way that is hardly to be found in the management accounting field.",,1970-01-01 00:00:00.000002021,,Psychology and Education,public,333077,pub,show,2021-11-11 01:12:58,"[{'id': ': wuri.septihandayani@budiluhur.ac.id', 'name': {'family': 'Handayani', 'lineage': None, 'honourific': None, 'given': 'Wuri Septi'}}, {'id': 'sari_170870@yahoo.com', 'name': {'honourific': None, 'family': 'Lindrianasari', 'lineage': None, 'given': 'Lindrianasari'}}, {'id': 'yuliansyah@feb.unila.ac.id', 'name': {'given': 'Yuliansyah', 'family': 'Yuliansyah', 'lineage': None, 'honourific': None}}, {'id': 'rindu.gamayuni@yahoo.com', 'name': {'given': 'Rindu Rika', 'lineage': None, 'family': 'Gamayuni', 'honourific': None}}]",article,"THE EFFECT OF STRATEGIC PERFORMANCE MEASUREMENT
SYSTEM AND SERVICE STRATEGY ON A FIRM’S PERFORMANCE",published,['HJ'],58,http://repository.lppm.unila.ac.id/id/eprint/35855,PSYCHOLOGY AND EDUCATION,disk0/00/03/58/55,['FEB4'],2021-11-11 01:12:58,7,,,,,,,,,,,,,
21,2021-10-08 07:10:27,archive,34398,,,"[{'id': None, 'name': {'family': 'Hildayati', 'lineage': None, 'honourific': None, 'given': 'Intan'}, 'type': 'http://www.loc.gov/loc.terms/relators/AUT'}, {'type': 'http://www.loc.gov/loc.terms/relators/AUT', 'name': {'lineage': None, 'family': 'Sarumpaet', 'honourific': None, 'given': 'Susi'}, 'id': 'susi.sarumpaet@feb.unila.ac.id'}, {'name': {'lineage': None, 'family': 'Sukmasari', 'honourific': None, 'given': 'Dewi'}, 'type': 'http://www.loc.gov/loc.terms/relators/AUT', 'id': None}]",790,,https://gamaiceb.feb.ugm.ac.id/,"[{'format': 'text', 'main': 'Conference Guideline for Presenters.pdf', 'docid': 154920, 'files': [{'mtime': '2021-09-23 06:57:43', 'hash_type': 'MD5', 'uri': 'http://repository.lppm.unila.ac.id/id/file/405000', 'filename': 'Conference Guideline for Presenters.pdf', 'objectid': 154920, 'filesize': 390193, 'mime_type': 'application/pdf', 'hash': '78da22ade4aa6b0cd6d9bf2d9a8be075', 'datasetid': 'document', 'fileid': 405000}], 'language': 'en', 'mime_type': 'application/pdf', 'rev_number': 8, 'eprintid': 34398, 'placement': 4, 'security': 'public', 'pos': 2, 'uri': 'http://repository.lppm.unila.ac.id/id/document/154920'}, {'docid': 154921, 'main': 'Invitation Letter for Presenter in Room 1.pdf', 'files': [{'filename': 'Invitation Letter for Presenter in Room 1.pdf', 'uri': 'http://repository.lppm.unila.ac.id/id/file/405001', 'filesize': 51036, 'objectid': 154921, 'mtime': '2021-09-23 06:57:49', 'hash_type': 'MD5', 'mime_type': 'application/pdf', 'hash': '5f6640ddda7d194f327eb47d8fab25d0', 'fileid': 405001, 'datasetid': 'document'}], 'format': 'text', 'mime_type': 'application/pdf', 'language': 'en', 'rev_number': 12, 'placement': 5, 'eprintid': 34398, 'uri': 'http://repository.lppm.unila.ac.id/id/document/154921', 'pos': 3, 'security': 'public'}, {'pos': 4, 'uri': 'http://repository.lppm.unila.ac.id/id/document/154922', 'security': 'public', 'placement': 2, 'eprintid': 34398, 'language': 'en', 'rev_number': 9, 'mime_type': 'application/pdf', 'docid': 154922, 'main': 'Gamacieb2021-paper.pdf', 'files': [{'hash': 'a068aa9f500a95aa136fcead0f9c4c1a', 'mime_type': 'application/pdf', 'datasetid': 'document', 'fileid': 405004, 'mtime': '2021-10-08 06:51:49', 'hash_type': 'MD5', 'uri': 'http://repository.lppm.unila.ac.id/id/file/405004', 'filename': 'Gamacieb2021-paper.pdf', 'objectid': 154922, 'filesize': 1238016}], 'format': 'text'}, {'uri': 'http://repository.lppm.unila.ac.id/id/document/154923', 'pos': 5, 'security': 'public', 'placement': 3, 'eprintid': 34398, 'rev_number': 9, 'language': 'en', 'mime_type': 'application/pdf', 'files': [{'filename': 'SERTIF PRESENTER GAMAICEB_SUSI SARUMPAET.pdf', 'uri': 'http://repository.lppm.unila.ac.id/id/file/405006', 'objectid': 154923, 'filesize': 138205, 'mtime': '2021-10-08 06:52:03', 'hash_type': 'MD5', 'mime_type': 'application/pdf', 'hash': '35fc3d74f0be0fc5433cd93be0ec005c', 'fileid': 405006, 'datasetid': 'document'}], 'main': 'SERTIF PRESENTER GAMAICEB_SUSI SARUMPAET.pdf', 'docid': 154923, 'format': 'text'}]",TRUE,"Introduction/Main Objective: This research aims to examine the impact that news of
corporate social responsibility actions covered by online media on the market reaction in the
current global issue of Covid 19 pandemic. Background Problem: The impacts caused by
Covid 19 spreading toward socio-economic condition has opened the opportunities for
companies to carry out their corporate social responsibility program as a form of social care.
Novelty: Generally, a company has their annual CSR programs but since the outbreak of the
Covid 19 pandemic, a company is re-adapting their CSR programs according to the current
situation where the targets of CSR programs are more appropriate for those who are affected.
By paying the attention to the role of online media, this research is going to find whether there
is a significant difference in market reaction between news of Covid CSR and news of NonCovid

CSR during corona virus crisis. Research Methods: Using a sample of 42 news of
corporate social responsibility from most visited online news and media ranked by SimilarWeb
which are seperated into two groups based on Covid and Non-Covid purposes, this research
provides an event study analysis by using Man-Whitney Test to compare both groups.
Finding/Results: The result shows that sig 2-tailed value>0,05 which indicates that both Covid
CSR news and Non-Covid CSR news have no significant difference in the abnormal returns
received by company during the spread of Covid 19 pandemic. Moreover, this research also
finds that during Covid 19 pandemic, CSR news does not contain an information that can affect
the stock price of an entity around the day the CSR news was published that is proven by the
value of sig 2-tailed>0,05 on each days of window period. Conclusion: This research provides
an information to the shareholders and market participants regarding their investment
consideration toward the published CSR news during pandemic period. However, no research
has emerged to examine the difference in market reactions to CSR news with different purposes
during the pandemic.

Keywords: CSR news, Media, Stock price, Market reaction, Covid 19 pandemic.",,2021-09-25 00:00:00.000000000,[{'url': 'https://gamaiceb.feb.ugm.ac.id/'}],,public,,unpub,show,2021-10-08 07:10:27,"[{'id': None, 'name': {'given': 'Intan', 'honourific': None, 'family': 'Hildayati', 'lineage': None}}, {'name': {'lineage': None, 'family': 'Sarumpaet', 'honourific': None, 'given': 'Susi'}, 'id': 'susi.sarumpaet@feb.unila.ac.id'}, {'id': 'dewsukma@gmail.com', 'name': {'honourific': None, 'family': 'Sukmasari', 'lineage': None, 'given': 'Dewi'}}]",conference_item,Market Reaction on CSR Media News during Covid 19 Pandemic,completed,['HF5601'],,http://repository.lppm.unila.ac.id/id/eprint/34398,,disk0/00/03/43/98,['FEB4'],2021-10-08 07:10:27,23,,,,,,Gadjah Mada International Conference on Economics and Business,conference,25 September 2021,paper,Yogyakarta Indonesia,34144.0,,
22,2023-02-15 01:42:42,archive,48375,,,"[{'name': {'given': 'Niken', 'family': 'Kusumawardani', 'lineage': None, 'honourific': None}, 'type': 'http://www.loc.gov/loc.terms/relators/AUT', 'id': 'niken.kusumawardani@feb.unila.ac.id'}]",1129,,http://dx.doi.org/10.4108/eai.1-10-2020.2305566,"[{'security': 'public', 'pos': 1, 'uri': 'http://repository.lppm.unila.ac.id/id/document/187664', 'eprintid': 48375, 'placement': 1, 'rev_number': 1, 'language': 'en', 'mime_type': 'application/pdf', 'format': 'text', 'files': [{'filename': 'Corporate Governance on Share Price Performance of Big Cap Issuers During Covid-19 Pandemic.pdf', 'uri': 'http://repository.lppm.unila.ac.id/id/file/528204', 'objectid': 187664, 'filesize': 191630, 'mtime': '2023-02-14 05:13:53', 'hash_type': 'MD5', 'hash': '547efdb7ff41a50a332e11a8c795b43c', 'mime_type': 'application/pdf', 'fileid': 528204, 'datasetid': 'document'}], 'main': 'Corporate Governance on Share Price Performance of Big Cap Issuers During Covid-19 Pandemic.pdf', 'docid': 187664}]",TRUE,"Abstract. This study aims to determine the effect of corporate governance on the share price performance of big cap issuers during the Covid-19 pandemic in Indonesia. In this study, corporate governance used five components such as institutional ownership, board size, CEO duality, independent commissioners and ownership concentration while share price performance used stock returns. Hypothesis testing using multiple linear regression. The sample of this research included twenty corporate of big cap issuers in Indonesia Stock Exchange (BEI). The results of hypothesis testing indicate that there is an insignificant relationship between the variables of institutional ownership, board size, CEO duality, and independent commissioners on stock returns, while ownership concentration indicate a significant negative relationship with stock returns during the Covid-19 pandemic. From the results of the study, the components of corporate governance on share price performance during Covid-19 pandemic need more researchable.  
 
Keywords: corporate governance, share price performance, big cap issuers, Covid-19",['Universitas Lampung'],2021-04-19 00:00:00.000000000,,,public,,pub,show,2023-02-15 01:42:42,"[{'name': {'family': 'Kusumawardani', 'lineage': None, 'honourific': None, 'given': 'Niken'}, 'id': 'niken.kusumawardani@feb.unila.ac.id'}]",conference_item,Corporate Governance on Share Price Performance of Big Cap Issuers During Covid-19 Pandemic,published,['AI'],,http://repository.lppm.unila.ac.id/id/eprint/48375,,disk0_bak/00/04/83/75,['FEB4'],2023-02-15 01:42:42,7,,,,,,ICEBE 2020: Proceedings of the First International Conference of Economics,conference,,paper,,,,
