,datestamp,eprint_status,eprintid,id_number,pagerange,contributors,userid,number,official_url,documents,refereed,abstract,corp_creators,date,related_url,publisher,full_text_status,issn,ispublished,metadata_visibility,lastmod,creators,type,title,date_type,subjects,volume,uri,publication,dir,divisions,status_changed,rev_number,contact_email,place_of_pub,pages,isbn,series,event_title,event_type,event_dates,pres_type,event_location,succeeds,book_title,editors
36,2021-06-01 03:01:51,archive,31557,https://doi.org/10.9734/ajeba/2021/v21i230349,34-52,,260,2.0,https://www.journalajeba.com/index.php/AJEBA/article/view/30349,"[{'mime_type': 'application/pdf', 'language': 'en', 'rev_number': 1, 'format': 'text', 'main': 'Academic Fraud in Online System during the Covid_19.pdf', 'docid': 142770, 'files': [{'mtime': '2021-05-31 17:17:37', 'hash_type': 'MD5', 'uri': 'http://repository.lppm.unila.ac.id/id/file/373924', 'filename': 'Academic Fraud in Online System during the Covid_19.pdf', 'objectid': 142770, 'filesize': 361271, 'hash': '1c6bc5a848652521737f16a5868e64f5', 'mime_type': 'application/pdf', 'fileid': 373924, 'datasetid': 'document'}], 'security': 'public', 'pos': 1, 'uri': 'http://repository.lppm.unila.ac.id/id/document/142770', 'eprintid': 31557, 'placement': 1}]",TRUE,"This study aims to find indications of academic fraud in the implementation of final semester
assessment online from the perspective of diamond fraud theory consisting of four dimensions;
pressure, opportunity, rationalization, and capability. This quantitative study with a questionnaire
created with Microsoft Form to collect the required data. This research was conducted in Lampung
Tengah on December 14, 2020, from 07.30 to 15.00 WIB using the Microsoft Form questionnaire.
The number of samples in this study was 81. Respondents in this study were 3 vocational high school students in Lampung Tengah Regency who participated in the final semester assessment online. The data obtained is processed using the line analysis method with Smart PLS 3.3.2 software. The results showed that pressures and opportunities have no significant effect on academic cheating in the implementation of final semester assessment online. While rationalization and positive ability have a significant effect on academic cheating in the assessment of the finalsemester online. In addition to the impact of academic fraud, the results of this study provide solutions to reduce the occurrence of academic fraud in Vocational High School students conducted online.","['University of Lampung', 'Universitas Lampung', 'Universitas Lampung']",2021-02-20 00:00:00.000000000,"[{'url': 'https://www.journalajeba.com/index.php/AJEBA/article/view/30349', 'type': 'pub'}]",copernicus,public,ISSN: 2456-639X,pub,show,2021-06-01 03:01:51,"[{'id': None, 'name': {'lineage': None, 'family': 'Purwatmiasih', 'honourific': None, 'given': 'Fajar'}}, {'id': 'reni.oktavia@feb.unila.ac.id', 'name': {'lineage': None, 'family': 'Oktavia', 'honourific': None, 'given': 'Reni'}}, {'name': {'family': 'Sudrajat', 'lineage': None, 'honourific': None, 'given': 'Sudrajat'}, 'id': 'drajat239@gmail.com'}]",article,"Academic Fraud in Online System during the
COVID-19 Pandemic: Evidence from Lampung -
Indonesia",published,['H1'],vol 21,http://repository.lppm.unila.ac.id/id/eprint/31557,"Asian Journal of Economics, Business and Accounting",disk0/00/03/15/57,['FEB4'],2021-06-01 03:01:51,11,,,,,,,,,,,,,
37,2022-09-09 00:57:05,archive,44841,,91-108,,245,1.0,http://ejournal.stiesyariahbengkalis.ac.id/index.php/iqtishaduna/article/view/337,"[{'security': 'public', 'pos': 1, 'uri': 'http://repository.lppm.unila.ac.id/id/document/166746', 'eprintid': 44841, 'placement': 1, 'language': 'en', 'rev_number': 1, 'mime_type': 'application/pdf', 'format': 'text', 'main': 'Raihan, Susi, Sukmasari - Penerimaan Pajak Daerah Kota.pdf', 'files': [{'mtime': '2022-09-08 12:40:14', 'hash_type': 'MD5', 'filename': 'Raihan, Susi, Sukmasari - Penerimaan Pajak Daerah Kota.pdf', 'uri': 'http://repository.lppm.unila.ac.id/id/file/484017', 'objectid': 166746, 'filesize': 587357, 'mime_type': 'application/pdf', 'hash': '34e9baa401c14436707c7ef0068d0c22', 'fileid': 484017, 'datasetid': 'document'}], 'docid': 166746}]",TRUE,"The research objectives were to examine the differences between the achievement of tax revenues in Bandar Lampung before and after using the tapping box; moreover, to analyze the implementation, obstacles, and efforts to overcome the obstacles during the use of the tapping box. This research uses mixed methods, namely quantitative and qualitative approaches. This study uses primary and secondary data. Primary data includes interviews with the regional tax and retribution management agency (RTRMA) and restaurant, hotel, entertainment, and parking businesses. Secondary data includes reports on the realization and target of restaurant taxes, hotel taxes, entertainment taxes, and parking taxes every month during the 2017-2019 period, totalling 24 data obtained from the RTRMA of Bandar Lampung. The hypothesis testing was using paired sample t- test. The results showed significant differences in the tax achievement of restaurants, hotels, entertainment, and parking between before and after using the tapping box sequentially. The implementation of the use of tapping box was going well, and it is proven that the tax achievement of restaurants, hotels, entertainment, and parking increases every month. So, the use of the tapping box already provided supervision to taxpayers. So, tax leaks can be minimized and increase the original local government revenue of Bandar Lampung.
Keywords: Local Revenue, Local Tax, Tapping Box.",,2021-06-29 00:00:00.000000000,,PPPM STIE Syari'ah Bengkalis,public,eISSN 2684-8228,pub,show,2022-09-09 00:57:05,"[{'id': 'mhdraihan011@gmail.com', 'name': {'given': 'Muhammad', 'family': 'Raihan', 'lineage': None, 'honourific': None}}, {'name': {'honourific': None, 'lineage': None, 'family': 'Sarumpaet', 'given': 'Susi'}, 'id': 'susi.sarumpaet@feb.unila.ac.id'}, {'name': {'family': 'Sukmasari', 'lineage': None, 'honourific': None, 'given': 'Dewi'}, 'id': 'dewsukma@gmail.com'}]",article,PENERIMAAN PAJAK DAERAH KOTA BANDAR LAMPUNG SEBELUM DAN SESUDAH PENGGUNAAN TAPPING BOX,published,['HF5601'],10,http://repository.lppm.unila.ac.id/id/eprint/44841,IQTISHADUNA: Jurnal Ilmiah Ekonomi Kita,disk0/00/04/48/41,['FEB4'],2022-09-09 00:57:05,6,,,,,,,,,,,,,
38,2021-08-12 00:37:20,archive,33408,,667-691,"[{'type': 'http://www.loc.gov/loc.terms/relators/AUT', 'name': {'honourific': None, 'lineage': None, 'family': 'Sarumpaet', 'given': 'Susi'}, 'id': 'susi.sarumpaet@feb.unila.ac.id'}, {'name': {'honourific': None, 'lineage': None, 'family': 'Fauzi', 'given': 'Hasan'}, 'type': 'http://www.loc.gov/loc.terms/relators/AUT', 'id': None}]",790,,https://link.springer.com/referenceworkentry/10.1007%2F978-3-030-22438-7_81-1,"[{'placement': 1, 'eprintid': 33408, 'uri': 'http://repository.lppm.unila.ac.id/id/document/152966', 'pos': 1, 'security': 'public', 'files': [{'uri': 'http://repository.lppm.unila.ac.id/id/file/396161', 'filename': 'Sarumpaet-Fauzi2021_ReferenceWorkEntry_ModernSlaveryDisclosuresInAVol.pdf', 'objectid': 152966, 'filesize': 352016, 'mtime': '2021-08-11 02:14:18', 'hash_type': 'MD5', 'hash': 'f5cb855649fce51b10d9b6972e29fe1a', 'mime_type': 'application/pdf', 'datasetid': 'document', 'fileid': 396161}], 'main': 'Sarumpaet-Fauzi2021_ReferenceWorkEntry_ModernSlaveryDisclosuresInAVol.pdf', 'docid': 152966, 'format': 'text', 'rev_number': 1, 'language': 'en', 'mime_type': 'application/pdf'}]",TRUE,,,2021-01-21 00:00:00.000000000,[{'url': 'https://link.springer.com/referenceworkentry/10.1007%2F978-3-030-22438-7_81-1'}],"Palgrave Macmillan, Cham",public,,pub,show,2021-08-12 00:37:20,"[{'name': {'honourific': None, 'lineage': None, 'family': 'Sarumpaet', 'given': 'Susi'}, 'id': 'ssarum@feb.unila.ac.id'}]",book_section,Modern Slavery Disclosures in a Voluntary Regime: A Political Cost Perspective,published,['HF5601'],,http://repository.lppm.unila.ac.id/id/eprint/33408,,disk0/00/03/34/08,['FEB4'],2021-08-12 00:37:20,7,,,1240.0,978-3-030-22438-7,,,,,,,,"The Palgrave Handbook of Corporate Social Responsibility. Palgrave Macmillan, Cham.","[{'name': {'given': 'David', 'lineage': None, 'family': 'Crowther', 'honourific': None}}, {'name': {'honourific': None, 'lineage': None, 'family': 'Seifi', 'given': 'Shahla'}}]"
39,2021-10-08 07:10:25,archive,34396,,,"[{'id': 'susi.sarumpaet@feb.unila.ac.id', 'name': {'honourific': None, 'family': 'Sarumpaet', 'lineage': None, 'given': 'Susi'}, 'type': 'http://www.loc.gov/loc.terms/relators/AUT'}, {'name': {'given': 'Roger', 'lineage': None, 'family': 'Burritt', 'honourific': None}, 'type': 'http://www.loc.gov/loc.terms/relators/AUT', 'id': 'roger.burritt@anu.edu.au'}, {'id': 'catherine.christ@unisa.edu.au', 'type': 'http://www.loc.gov/loc.terms/relators/AUT', 'name': {'given': 'Katherine', 'family': 'Christ', 'lineage': None, 'honourific': None}}]",790,,https://yogyakarta2021.irsa.or.id/,"[{'eprintid': 34396, 'placement': 1, 'security': 'public', 'uri': 'http://repository.lppm.unila.ac.id/id/document/154918', 'pos': 1, 'format': 'text', 'docid': 154918, 'main': 'IRSA 2021- Modern slavery and business in Indonesia.pdf', 'files': [{'fileid': 404995, 'datasetid': 'document', 'mime_type': 'application/pdf', 'hash': '3a813cedb4d8f9193652b75d532801ca', 'filesize': 2139271, 'objectid': 154918, 'filename': 'IRSA 2021- Modern slavery and business in Indonesia.pdf', 'uri': 'http://repository.lppm.unila.ac.id/id/file/404995', 'hash_type': 'MD5', 'mtime': '2021-10-08 06:37:53'}], 'language': 'en', 'rev_number': 2, 'mime_type': 'application/pdf'}]",TRUE,"The risk of modern slavery, such as through forced and child labour, is particularly prevalent in developing country supply chains. Several developed countries have introduced legislation to eliminatethe practice, but little is known about how modern slavery is perceived. To build knowledge of this sensitive area, anonymised results from interviews of managers in different parts of the Indonesian coffee supply chain are obtained and thematically analysed. Findings across the supply chain reveal: a lack of understanding of the term modern slavery and misconceptions about the meaning of child, forced and debt bonded labour in a modern slavery context; a general lack of knowledge of national andinternational regulations, standards and guidelines on modern slavery; a broad absence of policy on the issue at the entity level; and a greater concern for economic issues, especially since the COVID-19 pandemic. This exploratory research concludes to avoid being overtaken by events in operations and global supply chains continued growth of the industry, both within Indonesia and through exports, awareness raising is a critical first step in overcoming the lack of knowledge revealed.   

Keywords: Modern slavery, Indonesia, business manager perceptions, supply chain, coffee industry.",,2021-07-12 00:00:00.000000000,[{'url': 'https://yogyakarta2021.irsa.or.id/'}],,public,,unpub,show,2021-10-08 07:10:25,"[{'name': {'given': 'Susi', 'family': 'Sarumpaet', 'lineage': None, 'honourific': None}, 'id': 'ssarum@feb.unila.ac.id'}]",conference_item,Modern slavery and business in Indonesia,,['HF5601'],,http://repository.lppm.unila.ac.id/id/eprint/34396,,disk0/00/03/43/96,['FEB4'],2021-10-08 07:10:25,3,,,,,,The 16th IRSA International Conference,conference,12-13 July 2021,paper,Yogyakarta Indonesia,34395.0,,
40,2021-08-12 00:37:13,archive,33406,,91-108,"[{'name': {'given': 'Muhammad', 'honourific': None, 'lineage': None, 'family': 'Raihan'}, 'type': 'http://www.loc.gov/loc.terms/relators/AUT', 'id': None}, {'id': 'susi.sarumpaet@feb.uniila.ac.id', 'type': 'http://www.loc.gov/loc.terms/relators/AUT', 'name': {'given': 'Susi', 'honourific': None, 'family': 'Sarumpaet', 'lineage': None}}, {'id': None, 'type': 'http://www.loc.gov/loc.terms/relators/AUT', 'name': {'honourific': None, 'lineage': None, 'family': 'Sukmasari', 'given': 'Dewi'}}]",790,1.0,https://ejournal.stiesyariahbengkalis.ac.id/,"[{'eprintid': 33406, 'placement': 1, 'security': 'public', 'pos': 1, 'uri': 'http://repository.lppm.unila.ac.id/id/document/152957', 'format': 'text', 'files': [{'datasetid': 'document', 'fileid': 396140, 'mime_type': 'application/pdf', 'hash': '34e9baa401c14436707c7ef0068d0c22', 'objectid': 152957, 'filesize': 587357, 'filename': 'Iqtishaduna-vol 10-1-2021.pdf', 'uri': 'http://repository.lppm.unila.ac.id/id/file/396140', 'hash_type': 'MD5', 'mtime': '2021-08-11 01:22:25'}], 'main': 'Iqtishaduna-vol 10-1-2021.pdf', 'docid': 152957, 'content': 'published', 'rev_number': 2, 'language': 'id', 'mime_type': 'application/pdf'}]",TRUE,,,2021-06-01 00:00:00.000000000,[{'url': 'https://ejournal.stiesyariahbengkalis.ac.id/index.php/iqtishaduna/article/view/337/264'}],STIE Bengkalis,public,pISSN 2303-3568 | eISSN 2684-8228,pub,show,2021-08-12 00:37:13,"[{'id': 'ssarum@feb.unila.ac.id', 'name': {'given': 'Susi', 'lineage': None, 'family': 'Sarumpaet', 'honourific': None}}]",article,Penerimaan Pajak Daerah Kota Bandar Lampung Sebelum Dan Sesudah Penggunaan Tapping Box,,['HF5601'],10,http://repository.lppm.unila.ac.id/id/eprint/33406,QTISHADUNA: Jurnal Ilmiah Ekonomi Kita,disk0/00/03/34/06,['FEB4'],2021-08-12 00:37:13,6,,,,,,,,,,,,,
41,2022-01-18 07:21:08,archive,37972,https://doi.org/10.23960/ijebe.v4i1.89,,,3295,,https://ijebe.feb.unila.ac.id/index.php/ijebe/article/view/89,"[{'mime_type': 'application/pdf', 'language': 'en', 'rev_number': 1, 'main': 'Hasil reviewer jurnal Sri Suningsih.pdf', 'files': [{'filename': 'Hasil reviewer jurnal Sri Suningsih.pdf', 'uri': 'http://repository.lppm.unila.ac.id/id/file/431880', 'objectid': 158912, 'filesize': 270677, 'mtime': '2022-01-18 03:36:06', 'hash_type': 'MD5', 'mime_type': 'application/pdf', 'hash': 'f83c270ca682eb4b93c196952ddea0e5', 'datasetid': 'document', 'fileid': 431880}], 'docid': 158912, 'format': 'text', 'pos': 1, 'uri': 'http://repository.lppm.unila.ac.id/id/document/158912', 'security': 'public', 'placement': 1, 'eprintid': 37972}]",,"This study aims to investigate how the English is used in the business workplace. The researcher used a quantitative and descriptive qualitative method. The data used in this study are from open-ended questionnaire to the employees working in economics and business. The results showed that of the 17 worker participants, 11 participants (36.67%) thought that reading was most useful in the workplace, such as analyzing or auditing financial reports, preparing documents and calculating bills, operating software and understanding documents of export and import goods, processing data on a computer, using applications related to data calculation input, studying information about international bank rules, reading journals, opening current and personal savings accounts, reading financial reports, and other activities. Meanwhile, 9 participants (30%) agreed that speaking skills are often used in the workplace. The speaking activity is serving customers from various countries, being interviewed in the recruitment process. Listening skills were obtained by 5 participants (16.67%), which mean that they are rarely applied by the participants. In applying Listening skills, participants use them in understanding conversations. There were 5 participants (16.67%) who chose writing such as answering emails, writing essays, opening checking accounts, and saving savings, making financial reports. The result also reflects the workers’ learning experiences while learning English in the colleges that show several topic discussion they learnt such as Introduction, and general English, the topics about finance/ accounting, financial reports, venture capital, stocks and bonds, which are usually useful in meetings with foreign principals or other employees and the supervisor, writing, reading, discussion, communication, vocabularies, determination of the stock price index, management, recruitment, accounting, financial statement, Learn accounting in English and also conversation is very useful at work, and vocabularies about accounts related to financial statements. In addition, other participants responded that English learnt on campus and applied at work are different. Not all English skills are applied in the respondents' workplace, only reading is used most often. In term of English needs in the workplace, the professionals also need Speaking skills and English terms in the business context.",,2021-06-29 00:00:00.000000000,"[{'type': 'author', 'url': 'http://ijebe.feb.unila.ac.id/index.php/ijebe/article/view/89'}]",Faculty of Economics and Business The University of Lampung,public,,pub,show,2022-01-18 07:21:08,"[{'id': 'sri.suningsih@feb.unila.ac.id', 'name': {'family': 'Sri', 'lineage': None, 'honourific': None, 'given': 'Suningsih'}}, {'name': {'given': 'Ciptawaty', 'lineage': None, 'family': 'Ukhti', 'honourific': None}, 'id': 'ukhti.ciptawaty@feb.unila.ac.id'}, {'id': 'nuzulinasnabilaa@gmail.com', 'name': {'given': 'Inas Nabila', 'family': 'Nuzul', 'lineage': None, 'honourific': None}}, {'id': 'winiawaziana@gmail.com', 'name': {'family': 'Winia', 'lineage': None, 'honourific': None, 'given': 'Waziana'}}]",other,THE EMPLOYEES' PERCEPTIONS OF LEARNING ENGLISH IN A BUSINESS CONTEXT,published,"['H1', 'L1', 'PE']",,http://repository.lppm.unila.ac.id/id/eprint/37972,,disk0/00/03/79/72,['FEB4'],2022-01-18 07:21:08,9,,"International Journal of Economics, Business, and Entrepreneurship (IJEBE).",,,,,,,,,,,
42,2021-06-02 01:07:10,archive,31598,,,,571,,http://dx.doi.org/10.4108/eai.1-10-2020.2305576,"[{'main': 'eai.1-10-2020.2305576 Sudrajad, Gamayuni, Lalilatul Qodri-The Effectiveness of Carrot and Stick Incentive in.pdf', 'files': [{'mtime': '2021-06-01 08:21:46', 'hash_type': 'MD5', 'filename': 'eai.1-10-2020.2305576 Sudrajad, Gamayuni, Lalilatul Qodri-The Effectiveness of Carrot and Stick Incentive in.pdf', 'uri': 'http://repository.lppm.unila.ac.id/id/file/374348', 'filesize': 168676, 'objectid': 142956, 'mime_type': 'application/pdf', 'hash': 'a351b86dbe7b28b25bf221d8f7b96b2e', 'datasetid': 'document', 'fileid': 374348}], 'docid': 142956, 'format': 'text', 'mime_type': 'application/pdf', 'language': 'en', 'rev_number': 1, 'placement': 1, 'eprintid': 31598, 'uri': 'http://repository.lppm.unila.ac.id/id/document/142956', 'pos': 1, 'security': 'public'}]",FALSE,"This study aims to prove the factors that can reduce fraud in the public sector in Indonesia, especially
in Lampung Province. Fraud is an action that endangers the sustainability of an organization because the
organization will massively be destroyed when fraudulent practices cannot be detected. Collecting data in this
study through a questionnaire with respondents internal and external auditors of local government in Lampung
Province. The data were processed using the PLS Structural Equational Model (SEM). The results showed that
gender and task complexity did not affect fraud. The audit process is conducted in accordance with State
Financial Audit Standards so that whoever carries out the audit, will give the same conclusion. The complexity
of the auditor's duties does not affect fraud practice. When the auditor has several duties, the completion process
will always go through the supervision of the supervisor so that the audit process still in high quality.",,2021-04-01 00:00:00.000000000,,EAI,public,,pub,show,2021-06-02 01:07:10,"[{'id': 'drajat239@gmail.com', 'name': {'honourific': None, 'family': 'Sudrajat', 'lineage': None, 'given': 'Sudrajat'}}, {'name': {'lineage': None, 'family': 'Gamayuni', 'honourific': None, 'given': 'Rindu Rika'}, 'id': 'rindu.gamayuni@yahoo.com'}, {'name': {'honourific': None, 'lineage': None, 'family': 'Qodry', 'given': 'Lailatul'}, 'id': None}]",book,"Fraud Phenomenon in The Government Sector in
Indonesia",published,['HJ'],,http://repository.lppm.unila.ac.id/id/eprint/31598,,disk0/00/03/15/98,['FEB4'],2021-06-02 01:07:10,7,,,5.0,978-1-63190-298-7,CCER,,,,,,,,
43,2022-01-31 07:10:46,archive,38791,,,"[{'id': 'saring.suhendro@feb.unila.ac.id.', 'type': 'http://www.loc.gov/loc.terms/relators/AUT', 'name': {'family': 'Suhendro', 'lineage': None, 'honourific': None, 'given': 'Saring'}}, {'name': {'lineage': None, 'family': 'Degita Aziz', 'honourific': None, 'given': 'Azolla'}, 'type': 'http://www.loc.gov/loc.terms/relators/AUT', 'id': None}, {'id': None, 'name': {'family': 'Wahyu Maulana Zulma', 'lineage': None, 'honourific': None, 'given': 'Gandy'}, 'type': 'http://www.loc.gov/loc.terms/relators/AUT'}]",455,,"http://ekonomis.unbari.ac.id,","[{'main': 'JURNAL NASIONAL- SINTA 5 N 6 Pengaruh Governance terhadap Penerimaan Pajak Daerah-1.pdf', 'docid': 159906, 'files': [{'mtime': '2022-01-31 05:48:37', 'hash_type': 'MD5', 'uri': 'http://repository.lppm.unila.ac.id/id/file/438317', 'filename': 'JURNAL NASIONAL- SINTA 5 N 6 Pengaruh Governance terhadap Penerimaan Pajak Daerah-1.pdf', 'filesize': 2008542, 'objectid': 159906, 'hash': '48d8c01864450ca33a78d14e8746f250', 'mime_type': 'application/pdf', 'datasetid': 'document', 'fileid': 438317}], 'format': 'other', 'rev_number': 3, 'language': 'id', 'mime_type': 'application/pdf', 'content': 'published', 'placement': 1, 'eprintid': 38791, 'pos': 1, 'uri': 'http://repository.lppm.unila.ac.id/id/document/159906', 'formatdesc': 'Jurnal Nasional berbahasa Indonesia (terindeks pada database yang diakui Kemenristekdikti Peringkat 5 dan 6)', 'security': 'public'}]",,"Abstract.  This paper  examines  that  good  government  governance  has  directly  and  moderating  effect  on  local  income  tax determination. Using data from 33 province government in Indonesia for year 2008 and 2012, this research shows that good government governance is significant factor that improve local tax income directly and moderate variable. Good government governance strengthens positive correlation of per capita income and local tax income. While good government governance has not proven negative weakness of inflation and local tax.

Keywords: governance; local tax",,1970-01-01 00:00:00.000002021,[{'type': 'author'}],Ekonomis: Journal of Economics and Business,public,,pub,show,2022-01-31 07:10:46,"[{'name': {'family': 'Suhendro', 'lineage': None, 'honourific': None, 'given': 'Saring'}, 'id': 'saring.suhendro@feb.unila.ac.id.'}, {'name': {'lineage': None, 'family': 'Degita Aziz', 'honourific': None, 'given': 'Azolla'}, 'id': None}, {'name': {'given': 'Gandy', 'honourific': None, 'family': 'Wahyu Maulana Zulma', 'lineage': None}, 'id': None}]",other,Pengaruh Governance terhadap Penerimaan Pajak Daerah,published,['H1'],,http://repository.lppm.unila.ac.id/id/eprint/38791,,disk0/00/03/87/91,['FEB4'],2022-01-31 07:10:46,9,,Lembaga Penelitian dan Pengabdian kepada Masyarakat Universitas Batanghari Jambi,,,,,,,,,,,
