,datestamp,eprint_status,eprintid,id_number,pagerange,contributors,userid,number,official_url,documents,refereed,abstract,corp_creators,date,related_url,publisher,full_text_status,issn,ispublished,metadata_visibility,lastmod,creators,type,title,date_type,subjects,volume,uri,publication,dir,divisions,status_changed,rev_number,contact_email,place_of_pub,pages,isbn,series,event_title,event_type,event_dates,pres_type,event_location,succeeds,book_title,editors
23,2023-02-14 04:16:46,archive,48369,,55-67,,1129,1.0,https://www.penerbitgoodwood.com/index.php/jastaka/index,"[{'main': 'Adelyn+Niken+Ki Agus Andi.pdf', 'files': [{'datasetid': 'document', 'fileid': 528150, 'hash': '68f08f43c1111e306cfdb71cd02944f7', 'mime_type': 'application/pdf', 'hash_type': 'MD5', 'mtime': '2023-02-14 03:54:37', 'filesize': 383480, 'objectid': 187658, 'uri': 'http://repository.lppm.unila.ac.id/id/file/528150', 'filename': 'Adelyn+Niken+Ki Agus Andi.pdf'}], 'docid': 187658, 'format': 'text', 'rev_number': 1, 'language': 'en', 'mime_type': 'application/pdf', 'placement': 1, 'eprintid': 48369, 'uri': 'http://repository.lppm.unila.ac.id/id/document/187658', 'pos': 1, 'security': 'public'}]",TRUE,"Abstract
Purpose:
This   study   aimed   to   provide   empirical   evidence 
regarding     the     effect     of     budget   participation, financial compensation and non-financial compensation on the performance of employees of PT. Budi Berlian Motors in Lampung.
Research  methodology:
The  population  in  this  study  were  all 
employees of PT. Budi Berlian Motors in Lampung, with a sample of  100 respondents.  The  methods  of  data  analysis  were  multiple regression with the F test and T-test as a hypothesis test.
Results:
This   study   shows   empirical   evidence   that   budget 
participation  does  not  have  a  positive  and  significant  effect  on employee  performance,  while  financial  compensation  and  non-financial  compensation  have  a  positive  and  significant  effect  on employee performance.
Limitations:
The  results  of  the  questionnaire  are  based  on  the 
respondents responses   to   the   questions   in   the   questionnaire presented  so  that   the  answers  generated   may  not  necessarily correspond to actual conditions that occur in the company.
Contribution:
This study can provide information about the effect 
of   budgetary   participation,   financial   compensation   and   non-financial  compensation  on  the  performance  of  employees  of  PT. Budi Berlian in Lampung.",,2021-07-25 00:00:00.000000000,,Goodwood Publishers,public,2776-7574,pub,show,2023-02-14 04:16:46,"[{'name': {'given': 'Adelyn Gibona', 'honourific': None, 'lineage': None, 'family': 'Manik'}, 'id': None}, {'id': 'kgs_andi@yahoo.com', 'name': {'family': 'Andi', 'lineage': None, 'honourific': None, 'given': 'Kiagus'}}, {'id': 'niken.kusumawardani@feb.unila.ac.id', 'name': {'family': 'Kusumawardani', 'lineage': None, 'honourific': None, 'given': 'Niken'}}]",article,"Pengaruh partisipasi  anggaran,  kompensasi  finansial  dan 
kompensasi  nonfinansial  terhadap  kinerja  karyawan  PT.
Budi Berlian Motors di Lampung",published,['AI'],1,http://repository.lppm.unila.ac.id/id/eprint/48369,Jurnal Studi Pemerintahan dan Akuntabilitas,disk0_bak/00/04/83/69,['FEB4'],2023-02-14 04:16:46,4,,,,,,,,,,,48252.0,,
24,2021-11-11 01:10:55,archive,35787,https://doi.org/10.24843/JIAB.2021.v16.i01.p07,96-114,"[{'type': 'http://www.loc.gov/loc.terms/relators/AUT'}, {'type': 'http://www.loc.gov/loc.terms/relators/AUT'}]",608,1.0,https://ojs.unud.ac.id/index.php/jiab/article/view/62693,"[{'format': 'text', 'date_embargo': '2021-11-25', 'main': 62693, 'files': [{'filename': 62693, 'uri': 'http://repository.lppm.unila.ac.id/id/file/415951', 'objectid': 156729, 'filesize': 46448, 'mtime': '2021-11-10 07:35:04', 'hash_type': 'MD5', 'mime_type': 'text/html', 'hash': '46b48c3ebf3d2ae19e436adbdaf7a8f1', 'fileid': 415951, 'datasetid': 'document'}], 'docid': 156729, 'content': 'published', 'language': 'en', 'mime_type': 'text/html', 'rev_number': 3, 'eprintid': 35787, 'placement': 1, 'security': 'validuser', 'formatdesc': 'Jurnal Ilmiah Akuntansi dan Bisnis', 'pos': 1, 'uri': 'http://repository.lppm.unila.ac.id/id/document/156729'}]",TRUE,"This study examines triggers factors of the fraud triangle, core of all fraud auditing standards, for assessing the likelihood of fraudulent financial reporting. The Fourth Industrial Revolution (Industry 4.0) brings vital changes to industries, which forces people to face and act on these changes and may get impacted on fraudulent financial reporting. As Industry 4.0 ushers the use of new technology, the use of computerized systems for huge data analysis has advantage and disadvantage in audit and fraud detection. Therefore, our research uses the integration of technology 4.0 as a moderating variable on fraudulent financial reporting. This study also aims to determine fraud with the Beneish M-Score as a financial forensic tool to gage potential fraud in firms' financial statements. The population of this study was drawn from five priority sectors of the Making Indonesia 4.0 program, namely industries in five manufacturing subsectors listed on the Indonesia Stock Exchange. Results indicate that pressure does not have significant effect on fraudulent financial reporting. On the other hand, the opportunity with effective monitoring variable has a negative significant effect on fraudulent financial reporting, whereas rationalization has a positive significant effect on fraudulent financial reporting. The integration of Industry 4.0 variable moderates the effect of fraud on fraudulent financial reporting.


Keywords:  fraud triangle, technology industry, pressure, opportunity, rationalization","['Faculty of Economics, Universitas Budi Luhur, Indonesia', 'Faculty of Economics and Business, Universitas Lampung, Indonesia']",2021-11-01 00:00:00.000000000,[{'url': 'https://ojs.unud.ac.id/index.php/jiab/article/view/62693'}],Accounting Department-Udayana University,restricted,2303-1018,pub,show,2021-11-11 01:10:55,"[{'id': 'gustinam7808@gmail.com', 'name': {'given': 'Agoestina', 'honourific': None, 'family': 'Mappadang', 'lineage': None}}, {'id': 'yuliansyah@feb.unila.ac.id', 'name': {'family': 'Yuliansyah', 'lineage': None, 'honourific': None, 'given': 'Yuliansyah'}}]",article,Trigger Factors of Fraud Triangle Toward Fraud On Financial Reporting Moderated by Integration Of Technology Industry 4.0,published,['HF5601'],16,http://repository.lppm.unila.ac.id/id/eprint/35787,Jurnal Ilmiah Akuntansi dan Bisnis,disk0/00/03/57/87,['FEB4'],2021-11-11 01:10:55,7,,,,,,,,,,,,,
25,2021-06-24 08:28:32,archive,32843,,166-175,,732,2.0,https://www.inderscience.com/info/inarticle.php?artid=114067,"[{'files': [{'mtime': '2021-06-24 08:17:39', 'hash_type': 'MD5', 'uri': 'http://repository.lppm.unila.ac.id/id/file/388889', 'filename': '2021_IJTGM-25317_Jurnal Publikasi.pdf', 'filesize': 307417, 'objectid': 149635, 'hash': 'fbec97310aee22e36dfddea40860642a', 'mime_type': 'application/pdf', 'fileid': 388889, 'datasetid': 'document'}], 'main': '2021_IJTGM-25317_Jurnal Publikasi.pdf', 'docid': 149635, 'format': 'text', 'mime_type': 'application/pdf', 'language': 'en', 'rev_number': 1, 'placement': 1, 'eprintid': 32843, 'uri': 'http://repository.lppm.unila.ac.id/id/document/149635', 'pos': 1, 'security': 'public'}]",TRUE,"This study aimed to assess the accrual concept applied by the government, whether it is in accordance with the accrual concept applied to corporations. Accrual-based accounting in the government is a global issue. This study used a conflict-ambiguity model perspective with a combined method, public document analysis, and Inspectorate survey. The study found that there was 1.94% from total receivable general allocation funds (GAFs) that had not been given to regional government. However, in the government's financial statements in Lampung region, there was no record of receivables within the GAF.",,1970-01-01 00:00:00.000002021,,Inder Science,public,1742-755X,pub,show,2021-06-24 08:28:32,"[{'id': None, 'name': {'lineage': None, 'family': 'Muhammad Nur', 'honourific': None, 'given': 'Ramdan'}}, {'name': {'given': 'Nurdiono', 'honourific': None, 'family': 'Nurdiono', 'lineage': None}, 'id': 'nurdiono_pb@yahoo.com'}, {'id': 'eindeevana@yahoo.co.id', 'name': {'given': 'Evana', 'lineage': None, 'family': 'Einde', 'honourific': None}}, {'id': None, 'name': {'given': 'gustiwaty', 'honourific': None, 'family': 'fajar', 'lineage': None}}, {'name': {'given': 'Lindrianasari', 'honourific': None, 'family': 'Lindrianasari', 'lineage': None}, 'id': 'sari_170870@yahoo.com'}]",article,"Implementation of accrual accounting concept in
Indonesian government: is it the true concept?",published,['HG'],14,http://repository.lppm.unila.ac.id/id/eprint/32843,International Journal of Trade and Global Markets,disk0/00/03/28/43,['FEB4'],2021-06-24 08:28:32,7,,,,,,,,,,,,,
26,2021-06-25 05:37:32,archive,32849,,,,732,,,"[{'placement': 1, 'eprintid': 32849, 'uri': 'http://repository.lppm.unila.ac.id/id/document/149681', 'pos': 1, 'security': 'public', 'files': [{'fileid': 388976, 'datasetid': 'document', 'hash': '6d68a8c38191f71a4c66d6bdeb5aa883', 'mime_type': 'application/vnd.openxmlformats-officedocument.wordprocessingml.document', 'hash_type': 'MD5', 'mtime': '2021-06-25 03:22:24', 'filesize': 47171, 'objectid': 149681, 'uri': 'http://repository.lppm.unila.ac.id/id/file/388976', 'filename': 'Nurdiono 2021.docx'}], 'main': 'Nurdiono 2021.docx', 'docid': 149681, 'format': 'text', 'language': 'en', 'rev_number': 1, 'mime_type': 'application/vnd.openxmlformats-officedocument.wordprocessingml.document'}]",,"Tujuan umum laporan keuangan adalah menyajikan informasi mengenai posisi keuangan,  realisasi anggaran,  arus kas,  dan kinerja keuangan suatu entitas pelaporan yang bermanfaat bagi para pengguna dalam membuat mengevaluasi keputusan mengenai alokasi sumber daya.  Laporan keuangan pemerintah daerah dalam rangka pertanggungjawaban pelaksanaan APBD merupakan hasil akhir dari proses akuntansi di pemerintah daerah.  Laporan keuangan disusun untuk menyediakan informasi yang relevan mengenai posisi keuangan dan seluruh transaksi yang dilakukan oleh suatu entitas pelaporan selama satu periode pelaporan.",,1970-01-01 00:00:00.000002021,,-,public,,unpub,show,2021-06-25 05:37:32,"[{'id': 'nurdiono_pb@yahoo.com', 'name': {'given': 'Nurdiono', 'honourific': None, 'lineage': None, 'family': 'Nurdiono'}}]",other,PENELITIAN MANDIRI - ANALISIS PENINGKATAN KUALITAS LAPORAN KEUANGAN PENDEKATAN META ANALISIS,,['HG'],,http://repository.lppm.unila.ac.id/id/eprint/32849,,disk0/00/03/28/49,['FEB4'],2021-06-25 05:37:32,7,,,,,,,,,,,,,
27,2022-01-26 10:05:35,archive,38430,,,,260,,,"[{'main': '9.The Impact of an Implementation Performace..._Reni Oktavi (1).pdf', 'docid': 159530, 'files': [{'hash_type': 'MD5', 'mtime': '2022-01-26 09:27:08', 'objectid': 159530, 'filesize': 307822, 'uri': 'http://repository.lppm.unila.ac.id/id/file/435440', 'filename': '9.The Impact of an Implementation Performace..._Reni Oktavi (1).pdf', 'fileid': 435440, 'datasetid': 'document', 'mime_type': 'application/pdf', 'hash': 'b864575e3d4bf5f2a4035f8557ee36be'}], 'format': 'text', 'mime_type': 'application/pdf', 'language': 'en', 'rev_number': 1, 'placement': 1, 'eprintid': 38430, 'uri': 'http://repository.lppm.unila.ac.id/id/document/159530', 'pos': 1, 'security': 'public'}]",,Non,['Universitas Lampung'],2021-12-01 00:00:00.000000000,,Private,public,,unpub,show,2022-01-26 10:05:35,"[{'id': 'reni.oktavia@feb.unila.ac.id', 'name': {'lineage': None, 'family': 'Oktavia', 'honourific': None, 'given': 'Reni'}}]",other,"Hasil Peer Review Karya Ilmiah "":  The Impact of An Implementation Performance Based Budgeting (PBB) on An Efficiency of Financial Performance on Local Governance in Indonesia""",,['H1'],,http://repository.lppm.unila.ac.id/id/eprint/38430,,disk0/00/03/84/30,['FEB4'],2022-01-26 10:05:35,7,,,,,,,,,,,,,
28,2022-01-26 10:05:37,archive,38431,,,,260,,,"[{'language': 'en', 'rev_number': 1, 'mime_type': 'application/pdf', 'docid': 159531, 'main': '10.Academic Fraud in online System during the covid _Reni Oktavi.pdf', 'files': [{'objectid': 159531, 'filesize': 275167, 'filename': '10.Academic Fraud in online System during the covid _Reni Oktavi.pdf', 'uri': 'http://repository.lppm.unila.ac.id/id/file/435447', 'hash_type': 'MD5', 'mtime': '2022-01-26 09:31:06', 'fileid': 435447, 'datasetid': 'document', 'mime_type': 'application/pdf', 'hash': 'afa6a0be70ae053bc3ec598062b0ec89'}], 'format': 'text', 'pos': 1, 'uri': 'http://repository.lppm.unila.ac.id/id/document/159531', 'security': 'public', 'placement': 1, 'eprintid': 38431}]",,-,['Universitas Lampung'],2021-12-01 00:00:00.000000000,,Private,public,,unpub,show,2022-01-26 10:05:37,"[{'id': 'reni.oktavia@feb.unila.ac.id', 'name': {'given': 'Reni', 'honourific': None, 'family': 'Oktavia', 'lineage': None}}]",other,"Hasil Peer Review Karya Ilmiah "": Academic Fraud in Online System during the Covid-19 Pandemic : Evidence From Lampung-Indonesia""",,['H1'],,http://repository.lppm.unila.ac.id/id/eprint/38431,,disk0/00/03/84/31,['FEB4'],2022-01-26 10:05:37,7,,,,,,,,,,,,,
29,2022-01-26 10:05:29,archive,38427,,,,260,,,"[{'eprintid': 38427, 'placement': 1, 'security': 'public', 'uri': 'http://repository.lppm.unila.ac.id/id/document/159527', 'pos': 1, 'format': 'text', 'main': '7.Analisis Pengaruh Penyajian informasi Keuangan..._Reni Oktavi.pdf', 'docid': 159527, 'files': [{'hash': '5ee2db8ac830d24ab4d6b85f0d72072e', 'mime_type': 'application/pdf', 'fileid': 435420, 'datasetid': 'document', 'mtime': '2022-01-26 09:15:05', 'hash_type': 'MD5', 'uri': 'http://repository.lppm.unila.ac.id/id/file/435420', 'filename': '7.Analisis Pengaruh Penyajian informasi Keuangan..._Reni Oktavi.pdf', 'filesize': 279877, 'objectid': 159527}], 'mime_type': 'application/pdf', 'language': 'en', 'rev_number': 1}]",,-,['Universitas Lampung'],2021-12-01 00:00:00.000000000,,Privat,public,,unpub,show,2022-01-26 10:05:29,"[{'name': {'lineage': None, 'family': 'Oktavia', 'honourific': None, 'given': 'Reni'}, 'id': 'reni.oktavia@feb.unila.ac.id'}]",other,"Hasil Peer Review Karya Ilmiah ""Analisis Pengaruh Penyajian Informasi Keuangan Berbentuk Grafik: Peranan Modalitas Informasi Manusia, Pendekatan Eksperimen""",,['H1'],,http://repository.lppm.unila.ac.id/id/eprint/38427,,disk0/00/03/84/27,['FEB4'],2022-01-26 10:05:29,7,,,,,,,,,,,,,
30,2022-01-26 10:05:27,archive,38426,,,,260,,,"[{'placement': 1, 'eprintid': 38426, 'pos': 1, 'uri': 'http://repository.lppm.unila.ac.id/id/document/159526', 'security': 'public', 'docid': 159526, 'main': '8.Dampak Emisi Obligasi terhadap Kinerja Keuangan..._Reni Oktavi.pdf', 'files': [{'fileid': 435412, 'datasetid': 'document', 'mime_type': 'application/pdf', 'hash': '93d8738ff247d23761086fae4a5476aa', 'filesize': 264519, 'objectid': 159526, 'uri': 'http://repository.lppm.unila.ac.id/id/file/435412', 'filename': '8.Dampak Emisi Obligasi terhadap Kinerja Keuangan..._Reni Oktavi.pdf', 'hash_type': 'MD5', 'mtime': '2022-01-26 09:11:07'}], 'format': 'text', 'language': 'en', 'rev_number': 1, 'mime_type': 'application/pdf'}]",,non,['Universitas Lampung'],2021-12-01 00:00:00.000000000,,Privat,public,,unpub,show,2022-01-26 10:05:27,"[{'id': 'reni.oktavia@feb.unila.ac.id', 'name': {'given': 'Reni', 'honourific': None, 'lineage': None, 'family': 'Oktavia'}}]",other,"Hasil Peer Review Karya Ilmiah ""Dampak Emisi Obligasi Terhadap Kinerja Keuangan Perusahaan""",,['H1'],,http://repository.lppm.unila.ac.id/id/eprint/38426,,disk0/00/03/84/26,['FEB4'],2022-01-26 10:05:27,8,,,,,,,,,,,,,
31,2022-01-26 10:05:31,archive,38428,,,,260,,,"[{'files': [{'uri': 'http://repository.lppm.unila.ac.id/id/file/435427', 'filename': 'Finance sustainability to the environmental investm _Reni Oktavi (1).pdf', 'filesize': 248504, 'objectid': 159528, 'mtime': '2022-01-26 09:18:20', 'hash_type': 'MD5', 'mime_type': 'application/pdf', 'hash': 'd390594034d94a7c00445bfaf7c194b1', 'datasetid': 'document', 'fileid': 435427}], 'main': 'Finance sustainability to the environmental investm _Reni Oktavi (1).pdf', 'docid': 159528, 'format': 'text', 'rev_number': 1, 'language': 'en', 'mime_type': 'application/pdf', 'placement': 1, 'eprintid': 38428, 'pos': 1, 'uri': 'http://repository.lppm.unila.ac.id/id/document/159528', 'security': 'public'}]",,Non,['Universitas Lampung'],2021-12-01 00:00:00.000000000,,Private,public,,unpub,show,2022-01-26 10:05:31,"[{'name': {'given': 'Reni', 'lineage': None, 'family': 'Oktavia', 'honourific': None}, 'id': 'reni.oktavia@feb.unila.ac.id'}]",other,"Hasil Peer Review Karya Ilmiah ""Finance Sustainability to the Environmental Investment""",,['H1'],,http://repository.lppm.unila.ac.id/id/eprint/38428,,disk0/00/03/84/28,['FEB4'],2022-01-26 10:05:31,7,,,,,,,,,,,,,
32,2022-01-26 10:05:23,archive,38424,,,,260,,,"[{'language': 'en', 'rev_number': 1, 'mime_type': 'application/pdf', 'docid': 159524, 'main': '5.The Comparative Analysis of Agriculture sector...._Reni Oktavi.pdf', 'files': [{'mtime': '2022-01-26 08:32:14', 'hash_type': 'MD5', 'filename': '5.The Comparative Analysis of Agriculture sector...._Reni Oktavi.pdf', 'uri': 'http://repository.lppm.unila.ac.id/id/file/435397', 'filesize': 243679, 'objectid': 159524, 'mime_type': 'application/pdf', 'hash': '951a94e678c6e024b671fd288eb62baf', 'fileid': 435397, 'datasetid': 'document'}], 'format': 'text', 'uri': 'http://repository.lppm.unila.ac.id/id/document/159524', 'pos': 1, 'security': 'public', 'placement': 1, 'eprintid': 38424}]",,no,['Universits Lampung'],2021-12-01 00:00:00.000000000,,privat,public,,unpub,show,2022-01-26 10:05:23,"[{'name': {'given': 'Reni', 'lineage': None, 'family': 'Oktavia', 'honourific': None}, 'id': 'reni.oktavia@feb.unila.ac.id'}]",other,"Hasil Peer Review karya ilmiah ""The Comparative Analysis Of Agriculture Sector Regulations Before And After Implementation Of PSAK 69 Agriculture""",,['H1'],,http://repository.lppm.unila.ac.id/id/eprint/38424,,disk0/00/03/84/24,['FEB4'],2022-01-26 10:05:23,8,,,,,,,,,,,,,
33,2022-01-26 10:05:25,archive,38425,,,,260,,,"[{'security': 'public', 'uri': 'http://repository.lppm.unila.ac.id/id/document/159525', 'pos': 1, 'eprintid': 38425, 'placement': 1, 'rev_number': 1, 'language': 'en', 'mime_type': 'application/pdf', 'format': 'text', 'docid': 159525, 'main': '6.Expert System sistem Informasi Akuntansi ...._Reni Oktavi.pdf', 'files': [{'hash_type': 'MD5', 'mtime': '2022-01-26 09:06:47', 'objectid': 159525, 'filesize': 289316, 'filename': '6.Expert System sistem Informasi Akuntansi ...._Reni Oktavi.pdf', 'uri': 'http://repository.lppm.unila.ac.id/id/file/435405', 'datasetid': 'document', 'fileid': 435405, 'hash': '4e5f2053a466618f5685795a0f36074e', 'mime_type': 'application/pdf'}]}]",,-,['Universitas Lampung'],2021-12-01 00:00:00.000000000,,Privat,public,,unpub,show,2022-01-26 10:05:25,"[{'name': {'lineage': None, 'family': 'Oktavia', 'honourific': None, 'given': 'Reni'}, 'id': 'reni.oktavia@feb.unila.ac.id'}]",other,"Hasil Peer review karya ilmiah ""Expert System: Sistem Informasi Akuntansi Berbasis Knowledge""",,['H1'],,http://repository.lppm.unila.ac.id/id/eprint/38425,,disk0/00/03/84/25,['FEB4'],2022-01-26 10:05:25,7,,,,,,,,,,,,,
34,2021-11-11 01:12:31,archive,35841,,,,331,1.0,,"[{'language': 'en', 'mime_type': 'text/html', 'rev_number': 2, 'files': [{'fileid': 416348, 'datasetid': 'document', 'mime_type': 'text/html', 'hash': 'd9379afc72acf78a322323c936039a8c', 'hash_type': 'MD5', 'mtime': '2021-11-10 15:19:26', 'objectid': 156790, 'filesize': 35573, 'filename': 237, 'uri': 'http://repository.lppm.unila.ac.id/id/file/416348'}], 'main': 237, 'docid': 156790, 'format': 'text', 'uri': 'http://repository.lppm.unila.ac.id/id/document/156790', 'pos': 1, 'security': 'public', 'placement': 1, 'eprintid': 35841}, {'docid': 156791, 'main': 237, 'files': [{'hash': 'ff62e0da06bdf96a1438e71d839e9b47', 'mime_type': 'text/html', 'fileid': 416351, 'datasetid': 'document', 'filename': 237, 'uri': 'http://repository.lppm.unila.ac.id/id/file/416351', 'objectid': 156791, 'filesize': 35573, 'mtime': '2021-11-10 15:20:00', 'hash_type': 'MD5'}], 'format': 'text', 'mime_type': 'text/html', 'language': 'en', 'rev_number': 2, 'placement': 2, 'eprintid': 35841, 'pos': 2, 'uri': 'http://repository.lppm.unila.ac.id/id/document/156791', 'security': 'public'}]",TRUE,"Layoffs carried out by construction companies are caused by the weak performance of employees working at the company.  Apart from being based on labor issues, layoffs are also influenced by internal problems in construction service companies.  Given this phenomenon, it is necessary to conduct research on the performance of construction company employees.  In order to improve employee performance, internal control is needed that can reduce the occurrence of actions that are not in accordance with the rules.  Where good internal control is shown by an efficient and effective accounting information system, especially in presenting information in accordance with the needs of management and other parties who need it.  In addition, employee performance can also decrease, this is due to a decrease in work motivation in employees.  Work motivation is also related to the capacity of human resources, so that employee performance must be supported by the capacity of competent human resources to provide optimal benefits.",['University of Lampung'],2021-01-01 00:00:00.000000000,,Fakultas Ekonomi Universitas Lampung,public,,pub,show,2021-11-11 01:12:31,"[{'name': {'given': 'FS', 'lineage': None, 'family': 'Patraini', 'honourific': None}}, {'name': {'honourific': None, 'lineage': None, 'family': 'Dewi', 'given': 'Fajar Gustiawaty'}}, {'name': {'lineage': None, 'family': 'Sukmasari', 'honourific': None, 'given': 'Dewi'}}]",article,"Pengaruh Pengendalian Internal, Sistem Informasi Akuntansi, Motivasi Kerja Dan Kapasitas Sumber Daya Manusia Terhadap Kinerja Karyawan
(Studi Kasus Pada Perusahaan Jasakonstruksi Di Kota Bandar Lampung)",published,['H1'],26,http://repository.lppm.unila.ac.id/id/eprint/35841,Jurnal Akuntansi dan Keuangan,disk0/00/03/58/41,['FEB4'],2021-11-11 01:12:31,9,,,,,,,,,,,,,
35,2021-11-11 01:11:18,archive,35799,https://doi.org/10.35912/jastaka.v1i1.290,83-95,"[{'type': 'http://www.loc.gov/loc.terms/relators/AUT'}, {'type': 'http://www.loc.gov/loc.terms/relators/AUT'}, {'type': 'http://www.loc.gov/loc.terms/relators/AUT'}, {'type': 'http://www.loc.gov/loc.terms/relators/AUT'}]",608,1.0,https://www.penerbitgoodwood.com/index.php/jastaka,"[{'formatdesc': 'Jurnal Studi Pemerintahan dan Akuntabilitas', 'security': 'validuser', 'uri': 'http://repository.lppm.unila.ac.id/id/document/156746', 'pos': 1, 'eprintid': 35799, 'placement': 1, 'content': 'published', 'language': 'id', 'rev_number': 2, 'mime_type': 'application/pdf', 'date_embargo': '2021-11-25', 'format': 'text', 'main': '290-Article Text-1237-2-10-20210528 (1).pdf', 'docid': 156746, 'files': [{'objectid': 156746, 'filesize': 367391, 'uri': 'http://repository.lppm.unila.ac.id/id/file/416051', 'filename': '290-Article Text-1237-2-10-20210528 (1).pdf', 'hash_type': 'MD5', 'mtime': '2021-11-10 08:31:07', 'datasetid': 'document', 'fileid': 416051, 'hash': '9fe4ad9194fdcd2238458baecb69ca89', 'mime_type': 'application/pdf'}]}]",TRUE,"Abstract
Purpose: This study aimed to identify the impact of Political Connection on Cumulative Abnormal Return (CAR) and Trading Volume Activity  (TVA) for companies that associate with political figures in the presidential election of 2019.


Research methodology: This study used quantitative methods, with a population of 25 companies on the Indonesian stock exchange, through daily stock prices.


Result: This investigation showed no significant difference in the Cumulative Abnormal Return between before and after the announcement of the Constitutional Court. Then, there was no significance value on Trading Volume Activity and Cumulative Abnormal Return between before and after the announcement of General Election Commissions.


Limitations: In this study, the limitation is observation time which is only 36 days. The number of samples is limited, which only 25 companies with the scope of research of companies that have affiliations with the winners of the 2019 general election.


Contribution: This research implicates companies affiliated with politics. This is in the 2019 general election against the winners of the general election in 2019.","['Jurusan Akuntansi, Fakultas Ekonomi dan Bisnis, UniversitasLampung,BandarLampung', 'Jurusan Akuntansi, Fakultas Ekonomi dan Bisnis, UniversitasLampung,BandarLampung', 'Jurusan Akuntansi, Fakultas Ekonomi dan Bisnis, UniversitasLampung,BandarLampung', 'Jurusan Akuntansi, Fakultas Ekonomi dan Bisnis, UniversitasLampung,BandarLampung']",2021-11-25 00:00:00.000000000,[{'url': 'https://www.penerbitgoodwood.com/index.php/jastaka/article/view/290'}],Penerbit Goodwood,restricted,2776-7574,pub,show,2021-11-11 01:11:19,"[{'id': 'eldampradana83@gmail.com', 'name': {'honourific': None, 'lineage': None, 'family': 'Pradana', 'given': 'Eldam'}}, {'id': 'drajat239@gmail.com', 'name': {'family': 'Sudrajat', 'lineage': None, 'honourific': None, 'given': 'Sudrajat'}}, {'id': 'pigonauli@gmail.com', 'name': {'honourific': None, 'lineage': None, 'family': 'Nauli', 'given': 'Pigo'}}, {'name': {'given': 'Yuliansyah', 'honourific': None, 'lineage': None, 'family': 'Yuliansyah'}, 'id': 'yuliansyah@feb.unila.ac.id'}]",article,Pengaruh Political Connection terhadap Cumulative Abnormal Return dan Trading Volume Activity pada Pemilihan Presiden 2019,published,['HF5601'],1,http://repository.lppm.unila.ac.id/id/eprint/35799,Jurnal Studi Pemerintahan dan Akuntabilitas,disk0/00/03/57/99,['FEB4'],2021-11-11 01:11:18,8,,,,,,,,,,,,,
