,datestamp,eprint_status,eprintid,id_number,pagerange,contributors,userid,number,official_url,documents,refereed,abstract,corp_creators,date,related_url,publisher,full_text_status,issn,ispublished,metadata_visibility,lastmod,creators,type,title,date_type,subjects,volume,uri,publication,dir,divisions,status_changed,rev_number,contact_email,place_of_pub,pages,isbn,series,event_title,event_type,event_dates,pres_type,event_location,succeeds,book_title,editors
0,2021-11-10 02:55:29,archive,35715,https://doi.org/10.35912/jakman.v2i2.204,129-139,"[{'type': 'http://www.loc.gov/loc.terms/relators/AUT', 'name': {'given': 'Apip', 'honourific': None, 'lineage': None, 'family': 'Alansori'}, 'id': 'apipalansori95@gmail.com'}, {'name': {'given': 'Erna', 'honourific': None, 'lineage': None, 'family': 'Listyaningsih'}, 'type': 'http://www.loc.gov/loc.terms/relators/AUT', 'id': 'erna@malahayati.ac.id'}, {'type': 'http://www.loc.gov/loc.terms/relators/AUT', 'name': {'lineage': None, 'family': 'Yuliansyah', 'honourific': None, 'given': 'Yuliansyah'}, 'id': 'yuliansyah@feb.unila.ac.id'}, {'id': 'iing@malahayati.ac.id', 'type': 'http://www.loc.gov/loc.terms/relators/AUT', 'name': {'honourific': None, 'family': 'Lukman', 'lineage': None, 'given': 'Iing'}}, {'name': {'honourific': None, 'family': 'Sariningsih', 'lineage': None, 'given': 'Eka'}, 'type': 'http://www.loc.gov/loc.terms/relators/AUT', 'id': 'ekasariningsih@yahoo.com'}, {'id': '-', 'name': {'given': '-', 'honourific': None, 'family': '-', 'lineage': None}, 'type': None}, {'id': '-', 'name': {'given': '-', 'family': '-', 'lineage': None, 'honourific': None}, 'type': None}]",608,2.0,https://www.penerbitgoodwood.com/index.php/Jakman,"[{'uri': 'http://repository.lppm.unila.ac.id/id/document/156646', 'pos': 1, 'security': 'validuser', 'formatdesc': 'Jurnal Akuntansi, Keuangan, dan Manajemen', 'placement': 1, 'eprintid': 35715, 'language': 'en', 'rev_number': 6, 'mime_type': 'application/pdf', 'content': 'published', 'main': '204-Full Manuscript-709-3-10-20210217 - JAKMAN.pdf', 'files': [{'filename': '204-Full Manuscript-709-3-10-20210217 - JAKMAN.pdf', 'uri': 'http://repository.lppm.unila.ac.id/id/file/415417', 'objectid': 156646, 'filesize': 381285, 'mtime': '2021-11-10 01:50:11', 'hash_type': 'MD5', 'hash': '2992bec7656a526a8857a69eb506c669', 'mime_type': 'application/pdf', 'fileid': 415417, 'datasetid': 'document'}], 'docid': 156646, 'format': 'other', 'date_embargo': '2021-11-25'}]",TRUE,"Abstract
Purpose: To find out how much influence the managerial performance has in managing MSMEs and how capable it is in implementing Total Quality Management, technology and organizational culture in increasing MSMEs income.


Research methodology: This research is a qualitative research with a case study approach. The data survey method used was research using probability sampling, Partial Least Square (PLS), Average Variance Extracted (AVE, Coefficient of Determination and Path Coefficient Test and Banana Chips MSME on Street Pagar Alam Bandar Lampung.


Results: Total Quality Management, technology, and organizational culture simultaneously have a significant influence on managerial performance.


Limitations: Time and number of research samples.


Contribution: In the MSMEs environment, the natural fence road in Bandar Lampung and local government related to MSMEs


Keywords: Total Quality Management, Technology, Organizational culture, Managerial performance, MSMEs","['Fakultas Ekonomi,Universitas Malahayati Bandar Lampung', 'Fakultas Ekonomi,Universitas Malahayati Bandar Lampung', 'Fakultas Ekonomi dan Bisnis,Universitas Lampung', 'Fakultas Ekonomi,Universitas Malahayati Bandar Lampung', 'Fakultas Ekonomi,Universitas Malahayati Bandar Lampung']",2021-03-25 00:00:00.000000000,"[{'url': 'https://www.penerbitgoodwood.com/index.php/Jakman/article/view/204', 'type': 'pub'}]",Penerbit Goodwood,restricted,2716-0807,pub,show,2021-11-10 02:55:29,"[{'id': 'apipalansori95@gmail.com', 'name': {'given': 'Apip', 'lineage': None, 'family': 'Alansori', 'honourific': None}}, {'name': {'lineage': None, 'family': 'Listyaningsih', 'honourific': None, 'given': 'Erna'}, 'id': 'erna@malahayati.ac.id'}, {'id': 'yuliansyah@feb.unila.ac.id', 'name': {'given': 'Yuliansyah', 'family': 'Yuliansyah', 'lineage': None, 'honourific': None}}, {'name': {'family': 'Lukman', 'lineage': None, 'honourific': None, 'given': 'Iing'}, 'id': 'iing@malahayati.ac.id'}, {'id': 'ekasariningsih@yahoo.com', 'name': {'honourific': None, 'lineage': None, 'family': 'Sariningsih', 'given': 'Eka'}}]",article,"Pengaruh Total Quality Management, teknologi dan budaya organisasi terhadap kinerja manajerial",published,['HF5601'],2,http://repository.lppm.unila.ac.id/id/eprint/35715,"Jurnal Akuntansi, Keuangan, dan Manajemen",disk0/00/03/57/15,['FEB4'],2021-11-10 02:55:29,49,,,,,,,,,,,,,
1,2021-06-24 06:41:17,archive,32826,,781-796,,732,6.0,https://ilkogretim-online.org/index.php/ioo/article/view/416?mno=55393,"[{'docid': 149573, 'main': 'EEO-V20I5-82Y.pdf', 'files': [{'mtime': '2021-06-24 05:32:11', 'hash_type': 'MD5', 'uri': 'http://repository.lppm.unila.ac.id/id/file/388730', 'filename': 'EEO-V20I5-82Y.pdf', 'objectid': 149573, 'filesize': 278260, 'mime_type': 'application/pdf', 'hash': '49dc5d179ecd4f487ac149134269498b', 'fileid': 388730, 'datasetid': 'document'}], 'format': 'text', 'mime_type': 'application/pdf', 'language': 'en', 'rev_number': 1, 'placement': 1, 'eprintid': 32826, 'pos': 1, 'uri': 'http://repository.lppm.unila.ac.id/id/document/149573', 'security': 'public'}]",TRUE,"The strategic performance measurement system (SPMS) is part of the performance measurement system. SPMS is a performance measurement system that combines strategy, business operations, and finance to measure how well a company achieves its targets/vision and mission. The implementation of a successful strategy in a company should be guided by two important things, first an understanding of the company cycle that connects strategy and operations, and second, knowing what strategies are used in each phase of the company. The performance measurement system encourages managers to think strategically about how the company's activities fit into other parts of the company and to assist the company in managing its operational activities. Inadequate management supervision on the performance measurement system puts the company at risk of failure. A suitable performance measurement system can protect the organization from potential losses and increase organizational effectiveness.
Work ethics is interesting to study because it presumed to be greatly affects company performance. The company's values are influenced by the ethics that the company operates. The company's values are influenced by the ethics that the company operates. Islamic Work Ethics comes from the Qur’an and Hadiths. This study aims to examine the effect of SPMS and Islamic work ethics on company performance and to see the moderating effect of Islamic work ethics on the relationship between SPMS and firm performance and to investigate the moderating effect of Islamic work ethics on the relationship between competitive strategy and company performance (Malaysian Islamic banking). The research design is explanatory research with a quantitative approach using a survey method in the Islamic banking industry. The population of this research is Islamic commercial banks, the sampling technique is based on purposive sampling method, the data used are primary. The research data processing using structural equation modeling. The difference between this study and previous research is that this study uses the Islamic work ethic variable and then investigates the effect of the strategic performance measurement system on company performance in Malaysian Islamic banks.
The results show that there is sufficient evidence that Islamic work ethics has positive effects on firm performance. While the effects of strategic performance measurement system on firm performance shows not supported. The role of moderating effects of Islamic work ethics on the strategic performance measurement system variable against firm performance which is moderated by Islamic work ethics shows supported results and a positive slope. This means that when Islamic work ethics is stronger, the effect of the strategic performance measurement system on firm performance is higher.",,1970-01-01 00:00:00.000002021,,Elementary Education Online,public,1305-3515,pub,show,2021-06-24 06:41:17,"[{'name': {'given': 'Dewi', 'lineage': None, 'family': 'Anita Kusuma', 'honourific': None}, 'id': None}, {'name': {'lineage': None, 'family': 'Nurdiono', 'honourific': None, 'given': 'Nurdiono'}, 'id': 'nurdiono_pb@yahoo.com'}, {'name': {'given': 'gustiwaty', 'honourific': None, 'family': 'fajar', 'lineage': None}, 'id': None}, {'id': None, 'name': {'given': 'Komalasari', 'honourific': None, 'family': 'Agrianti', 'lineage': None}}, {'name': {'given': 'Yuliansyah', 'lineage': None, 'family': 'Yuliansyah', 'honourific': None}, 'id': 'yuliansyah@feb.unila.ac.id'}]",article,Effects of Strategic Performance Measurement System and Islamic Work Ethics on Firm Performance: (Evidence from Malaysian Islamic Banks),published,['HG'],20,http://repository.lppm.unila.ac.id/id/eprint/32826,Ilkogretim Online,disk0/00/03/28/26,['FEB4'],2021-06-24 06:41:17,7,,,,,,,,,,,,,
2,2021-11-11 01:09:43,archive,35740,https://doi.org/10.35912/jastaka.v1i1.236,43-54,"[{'type': 'http://www.loc.gov/loc.terms/relators/AUT'}, {'type': 'http://www.loc.gov/loc.terms/relators/AUT'}, {'type': 'http://www.loc.gov/loc.terms/relators/AUT'}]",608,1.0,https://www.penerbitgoodwood.com/index.php/jastaka,"[{'pos': 1, 'uri': 'http://repository.lppm.unila.ac.id/id/document/156678', 'formatdesc': 'Jurnal Studi Pemerintahan dan Akuntabilitas', 'security': 'validuser', 'placement': 1, 'eprintid': 35740, 'language': 'id', 'rev_number': 3, 'mime_type': 'application/pdf', 'content': 'published', 'main': '236-Article Text-1078-1-10-20210426 (1).pdf', 'docid': 156678, 'files': [{'mime_type': 'application/pdf', 'hash': 'd28a2703b8b1725d0011345e0fe419ee', 'fileid': 415611, 'datasetid': 'document', 'mtime': '2021-11-10 03:32:45', 'hash_type': 'MD5', 'filename': '236-Article Text-1078-1-10-20210426 (1).pdf', 'uri': 'http://repository.lppm.unila.ac.id/id/file/415611', 'objectid': 156678, 'filesize': 439232}], 'date_embargo': '2021-11-25', 'format': 'text'}]",TRUE,"Abstrak
Tujuan: Penelitian ini bertujuan untuk memberikan bukti empiris pengaruh akuntabilitas dan budaya organisasi terhadap kinerja organisasi pada rumah sakit swasta di Bandar Lampung.


Metodologi penelitian:   Populasi dalam penelitian ini adalah seluruh pegawai pada kepala rumah sakit swasta di Bandar Lampung, metode kuantitatif, aplikasi SPSS, teknik temu kembali informasi menggunakan kuesioner, dan sampel sebanyak 93 responden. Metode analisis data menggunakan regresi berganda dengan uji-T sebagai uji hipotesis.


Hasil: Penelitian ini menunjukkan bukti empiris bahwa variabel akuntabilitas dan budaya organisasi berpengaruh positif terhadap kinerja organisasi, baik secara parsial maupun simultan.


Keterbatasan: Sampel penelitian ini hanya mencakup sekitar 93 karyawan yang setara dengan manajer tingkat menengah di rumah sakit swasta di Bandar Lampung


Kontribusi: Penelitian ini dapat memberikan informasi penting tentang akuntabilitas dan budaya organisasi terhadap rumah sakit dan organisasi atau institusi terkait.",,2021-11-25 00:00:00.000000000,[{'url': 'https://www.penerbitgoodwood.com/index.php/jastaka/article/view/236'}],Penerbit Goodwood,restricted,2776-7574,pub,show,2021-11-11 01:09:43,"[{'name': {'honourific': None, 'family': 'Azzahra', 'lineage': None, 'given': 'Putri Zaviera'}, 'id': 'zackyiera20@gmail.com'}, {'id': 'yuliansyah@feb.unila.ac.id', 'name': {'given': 'Yuliansyah', 'lineage': None, 'family': 'Yuliansyah', 'honourific': None}}, {'name': {'given': 'Pigo', 'honourific': None, 'lineage': None, 'family': 'Nauli'}, 'id': 'pigonauli@gmail.com'}]",article,Pengaruh akuntabilitas dan budaya organisasi terhadap kinerja organisasi pada rumah sakit swasta kota Bandar Lampung,published,"['HF', 'HF5601']",1,http://repository.lppm.unila.ac.id/id/eprint/35740,Jurnal Studi Pemerintahan dan Akuntabilitas,disk0/00/03/57/40,['FEB4'],2021-11-11 01:09:43,14,,,,,,,,,,,,,
3,2021-11-11 07:37:06,archive,36098,,,,331,,,"[{'security': 'public', 'uri': 'http://repository.lppm.unila.ac.id/id/document/157032', 'pos': 1, 'eprintid': 36098, 'placement': 1, 'language': 'en', 'rev_number': 1, 'mime_type': 'application/pdf', 'format': 'text', 'main': 'Jordan Bimandama_Universitas Lampung_STABEK 5.pdf', 'docid': 157032, 'files': [{'datasetid': 'document', 'fileid': 418192, 'hash': 'b538254cb3f51515c67595ceb2d11d63', 'mime_type': 'application/pdf', 'objectid': 157032, 'filesize': 1034608, 'filename': 'Jordan Bimandama_Universitas Lampung_STABEK 5.pdf', 'uri': 'http://repository.lppm.unila.ac.id/id/file/418192', 'hash_type': 'MD5', 'mtime': '2021-11-11 07:13:21'}]}]",TRUE,"Purpose: The purpose of this research is to examine and analyze the effect of the variable proportion of independent commissioners, managerial ownership structure, growth opportunity, and CEO retirement on accounting conservatism.
Research Methodology: The population in this research are State-Owned Enterprises listed on the Indonesia Stock Exchange (IDX) for the 2016-2019 period. Sampling used the saturated sampling method (census), where all population members were used as samples so that the number of pieces obtained was 20 enterprises. This research uses secondary data obtained from the Indonesia Stock Exchange (IDX) website and the company's official website in the form of annual reports. Data collection techniques are using the documentation method. Data analysis used multiple linear regression analysis with SPSS 20 as an analytical tool.
Results: The results obtained in this research indicate that the variables of the proportion of independent commissioners, managerial ownership structure, and growth opportunity do not affect accounting conservatism. In contrast, the CEO retirement variable has a significant negative effect on accounting conservatism.
Limitations: The limitations of this research are that the research sample used is limited, and the research period is relatively short. In addition, the accounting conservatism variable measurement method only uses accrual measures, and the four independent variables used have limited ability to explain the dependent variable because the Adjusted R Square (R̅2) value is only 11.4%.
Contribution: The results in this research can be used as a reference for further researchers and become one of the considerations for company management, investors, and creditors in making decisions.
Keywords: Accounting conservatism, proportion of independent commissioners, managerial ownership structure, growth opportunity, and CEO retirement.",['University of Lampung'],2021-11-01 00:00:00.000000000,,,public,,pub,show,2021-11-11 07:37:06,"[{'name': {'lineage': None, 'family': 'Bimandama', 'honourific': None, 'given': 'Jordan'}}, {'name': {'given': 'Reni', 'honourific': None, 'family': 'Oktavia', 'lineage': None}}, {'name': {'given': 'Liza', 'honourific': None, 'lineage': None, 'family': 'Alvia'}}, {'name': {'given': 'Fajar Gustiawaty', 'family': 'Dewi', 'lineage': None, 'honourific': None}}]",article,"Pengaruh Proporsi Dewan Komisaris Independen, Struktur Kepemilikan Manajerial, Growth Opportunity, dan Pensiun CEO Terhadap Konservatisme Akuntansi (The Effect of The Proportion of Independent Commissioners, Managerial Ownership Structure, Growth Opportunity, and CEO Retirement on Accounting Conservatism)",,['H1'],,http://repository.lppm.unila.ac.id/id/eprint/36098,Seminar Nasional Stabek 5,disk0/00/03/60/98,['FEB4'],2021-11-11 07:37:06,6,,,,,,,,,,,,,
4,2022-08-22 01:39:06,archive,44155,,59-70,,331,2.0,,"[{'format': 'text', 'main': 'Vrilly dkk-Sinta 4.pdf', 'files': [{'fileid': 480081, 'datasetid': 'document', 'hash': '87aefee8ff814d505195e5f2c5a480a1', 'mime_type': 'application/pdf', 'filesize': 460265, 'objectid': 166200, 'filename': 'Vrilly dkk-Sinta 4.pdf', 'uri': 'http://repository.lppm.unila.ac.id/id/file/480081', 'hash_type': 'MD5', 'mtime': '2022-08-19 12:04:26'}], 'docid': 166200, 'mime_type': 'application/pdf', 'language': 'en', 'rev_number': 1, 'eprintid': 44155, 'placement': 1, 'security': 'public', 'uri': 'http://repository.lppm.unila.ac.id/id/document/166200', 'pos': 1}]",TRUE,"Penelitian ini bertujuan untuk menguji pengaruh modal intelektual (IC), pengungkapan modal intelektual (ICD) terhadap nilai perusahaan dengan profitabilitas sebagai variabel intervening.

Dalam penelitian ini metode pengambilan sampel menggunakan purposive sampling dan diperoleh sebanyak 25 perusahaan LQ-45 yang terdaftar di BEI selama tahun 2016-2018, Data yang ada dianalisis dengan menggunakan The Partial Least Square (SmartPLS) 3.

Hasil penelitian menunjukkan bahwa IC positif signifikan terhadap profitabilitas; ICD berpengaruh positif signifikan terhadap profitabilitas; IC memiliki pengaruh positif tetapi tidak signifikan terhadap nilai perusahaan; ICD negatif nilai perusahaan; profitabilitas berpengaruh positif signifikan terhadap nilai perusahaan; IC berpengaruh positif signifikan terhadap nilai perusahaan yang dimediasi oleh profitabilitas dan ICD positif signifikan terhadap nilai perusahaan yang dimediasi oleh profitabilitas.",['University of Lampung'],2021-07-10 00:00:00.000000000,,UNY,public,2502-5104,pub,show,2022-08-22 01:39:06,"[{'id': None, 'name': {'honourific': None, 'lineage': None, 'family': 'Claudia', 'given': 'Vrilly'}}, {'name': {'given': 'Fajar Gustiawaty', 'honourific': None, 'lineage': None, 'family': 'Dewi'}, 'id': 'fajargd@yahoo.com'}, {'id': None, 'name': {'given': 'Trijoko', 'honourific': None, 'lineage': None, 'family': 'Prasetyo'}}]",article,"PENGARUH INTELLECTUAL CAPITAL, INTELLECTUAL CAPITAL DISCLOSURE (ICD) TERHADAP NILAI PERUSAHAAN DENGAN PROFITABILITAS SEBAGAI VARIABEL INTERVENING",published,['HF5601'],19,http://repository.lppm.unila.ac.id/id/eprint/44155,Jurnal Pendidikan Akuntansi Indonesia,disk0/00/04/41/55,['FEB4'],2022-08-22 01:39:06,6,,,,,,,,,,,,,
5,2022-01-24 01:16:24,archive,38242,9,16-28,"[{'type': 'http://www.loc.gov/loc.terms/relators/AUT'}, {'type': 'http://www.loc.gov/loc.terms/relators/AUT'}, {'type': 'http://www.loc.gov/loc.terms/relators/AUT'}]",611,22.0,https://www.journalajeba.com/index.php/AJEBA/article/view/30521,"[{'format': 'text', 'main': '1. SUDRAJAT-PUBLIKASI PENELITIAN.pdf', 'files': [{'fileid': 433903, 'datasetid': 'document', 'hash': 'd8d7b5f082dedaaa2f44847c050e2053', 'mime_type': 'application/pdf', 'hash_type': 'MD5', 'mtime': '2022-01-23 15:52:33', 'objectid': 159257, 'filesize': 675881, 'filename': '1. SUDRAJAT-PUBLIKASI PENELITIAN.pdf', 'uri': 'http://repository.lppm.unila.ac.id/id/file/433903'}], 'docid': 159257, 'language': 'en', 'mime_type': 'application/pdf', 'rev_number': 1, 'eprintid': 38242, 'placement': 1, 'security': 'public', 'uri': 'http://repository.lppm.unila.ac.id/id/document/159257', 'pos': 1}]",TRUE,"Aims: This research was conducted to find out the development of IT research articles in the public sector published in international journals from 2011 to 2020, to find out the collaboration map between researchers, to be input and direction for further researchers in determining the research study topic. Study Design: This research is a literature study using the bibliometrics analysis method. Place and Duration of Study: The Google Scholar Database, period 2011 to 2020. Methodology: In the initial search, 976 journals were found. The following selection searched for journal articles that specifically discuss IT in the public sector; as many as 140 journals were found. Results: In the initial search, 976 journals were found. The following selection searched for journal articles that specifically discuss IT in the public sector; as many as 140 journals were found. Based on research on the growth of IT research articles in the public sector in 2011-2020, an average of 14% or a total of 14 articles per year. The trend of research tends to decrease, and the authors of these articles come from developed countries, while from developing countries such as Indonesia, there are still few. Conclusion: Based on research on the growth of IT research articles in the public sector in 2011- 2020, an average of 14% or a total of 14 articles per year. The trend of research tends to decrease, and the authors of these articles come from developed countries, while from developing countries such as Indonesia, there are still few. The topic of further research development can be focused on improving public services for developing countries, such as agriculture, e-health, e-democracy, government initiatives and etcetera.",,2021-12-22 00:00:00.000000000,[{'url': 'https://www.journalajeba.com/index.php/AJEBA/article/view/30521'}],"Asian Journal of Economics, Business and Accounting",public,2456-639X,pub,show,2022-01-24 01:16:24,"[{'name': {'lineage': None, 'family': 'Dewi', 'honourific': None, 'given': 'Atria'}, 'id': 'dewiatria@gmail.com'}, {'name': {'lineage': None, 'family': 'Sudrajat', 'honourific': None, 'given': 'Sudrajat'}, 'id': 'drajat239@gmail.com'}, {'name': {'family': 'Saring', 'lineage': None, 'honourific': None, 'given': 'Suhendro'}, 'id': 'suhendro725@gmail.com'}]",article,"IT in the Public Sector: A Road for Development Services, A Bibliographical Study",published,['HF5601'],21,http://repository.lppm.unila.ac.id/id/eprint/38242,"Asian Journal of Economics, Business and Accounting",disk0/00/03/82/42,['FEB4'],2022-01-24 01:16:24,10,drajat239@gmail.com,,,,,,,,,,,,
6,2022-01-31 07:11:03,archive,38797,,,,455,,DOI: 10.9734/AJEBA/2021/v21i2230521,"[{'eprintid': 38797, 'placement': 1, 'security': 'public', 'uri': 'http://repository.lppm.unila.ac.id/id/document/159912', 'pos': 1, 'format': 'text', 'main': 'JURNAL INTERNL- TDK BEREPUTASI IT in the Public Sector_ A Road for Development Services, A Bibliographical Study-1.pdf', 'files': [{'mime_type': 'application/pdf', 'hash': '21011a5908e95df7d11c075b58ca75a1', 'fileid': 438349, 'datasetid': 'document', 'mtime': '2022-01-31 06:20:59', 'hash_type': 'MD5', 'filename': 'JURNAL INTERNL- TDK BEREPUTASI IT in the Public Sector_ A Road for Development Services, A Bibliographical Study-1.pdf', 'uri': 'http://repository.lppm.unila.ac.id/id/file/438349', 'filesize': 2905308, 'objectid': 159912}], 'docid': 159912, 'rev_number': 1, 'language': 'en', 'mime_type': 'application/pdf'}]",,"Aims: This research was conducted to find out the development of IT research articles in the public sector published in international journals from 2011 to 2020, to find out the collaboration map between researchers, to be input and direction for further researchers in determining the research study topic.
Study Design: This research is a literature study using the bibliometrics analysis method.
Place and Duration of Study: The Google Schoolar Database, period 2011 to 2020.
Methodology: In the initial search, 976 journals were found. The following selection searched for
journal articles that specifically discuss IT in the public sector; as many as 140 journals were found. Results: In the initial search, 976 journals were found. The following selection searched for journal articles that specifically discuss IT in the public sector; as many as 140 journals were found. Based on research on the growth of IT research articles in the public sector in 2011-2020, an average of
14% or a total of 14 articles per year. The trend of research tends to decrease, and the authors of these articles come from developed countries, while from developing countries such as Indonesia, there are still few.
Conclusion: Based on research on the growth of IT research articles in the public sector in 2011-
2020, an average of 14% or a total of 14 articles per year. The trend of research tends to decrease, and the authors of these articles come from developed countries, while from developing countries such as Indonesia, there are still few. The topic of further research development can be focused on improving public services for developing countries, such as agriculture, e-health, e-democracy, government initiatives and etcetra.",,1970-01-01 00:00:00.000002021,[{'type': 'pub'}],"Asian Journal of Economics, Business and Accounting",public,,pub,show,2022-01-31 07:11:03,"[{'id': None, 'name': {'given': 'Atria', 'lineage': None, 'family': 'Dewi', 'honourific': None}}, {'name': {'given': 'Sudrajat', 'honourific': None, 'lineage': None, 'family': 'Sudrajat'}, 'id': 'drajat239@gmail.com'}, {'id': 'saring.suhendro@feb.unila.ac.id.', 'name': {'given': 'Saring', 'family': 'Suhendro', 'lineage': None, 'honourific': None}}]",other,"IT in the Public Sector: A Road for Development
Services, A Bibliographical Study",published,"['H1', 'HA']",,http://repository.lppm.unila.ac.id/id/eprint/38797,,disk0/00/03/87/97,['FEB4'],2022-01-31 07:11:03,8,,,,,,,,,,,,,
