,corp_creators,volume,abstract,uri,date,subjects,date_type,status_changed,issn,full_text_status,ispublished,rev_number,publication,publisher,divisions,dir,related_url,number,userid,documents,official_url,lastmod,eprint_status,eprintid,datestamp,metadata_visibility,creators,type,refereed,title,pagerange,event_type,event_title,event_location,pres_type,event_dates
9,"['Lampung University', 'diponegoro university', 'diponegoro university', 'diponegoro university']",4.0,"Heterotrophic aquaculture system is an environmental friendly shrimp culture that has a huge potency to improve yields of Litopenaeus vannamei. Biofloc grown in a heterotrophic aquaculture system that can be used as an alternative feed for shrimp due to its high nutrition. Biofloc contains bacterial protein and polyhydroxybutyrate that are able to enhance growth. Biofloc also contains bacteria that have peptidoglycan and lipopolysaccharide on their cell walls. The aim of the research was to study the effect of heterotrophic aquaculture system on culturing of Litopenaeus vannamei during nursery phase. The experiment was arranged in split plot design in three replicateses. The treatments consisted of two factors namely various densities and different aquaculture systems. The aquaculture systems were autotrophic and heterotrophic aquaculture system, while densities were 1,000, 1,500, and 2,000 PLm-3. The result showed that there was no significant interaction between densities and aquaculture system toward the growth rate, protein efficiency ratio and yield of Litopenaeus vannamei. The heterotrophic aquaculture system was able to increase the yield of Litopenaeus vannamei on nursery phase. However heterotrophic aquaculture system did not significantly affect growth rate and protein efficiency ratio of Litopenaeus vannamei. While, the density significantly affected survival rate and yield of Litopenaeus vannamei",http://repository.lppm.unila.ac.id/id/eprint/19120,1970-01-01 00:00:00.000002014,['SH'],published,2020-04-13 02:07:00,2252-5211,public,pub,8,international journal of waste resources,Omics publishing,['FP3'],disk0/00/01/91/20,,2.0,333,"[{'format': 'text', 'files': [{'mime_type': 'application/pdf', 'hash': 'c769debd83b8b9f892f2254afbc406a1', 'fileid': 160259, 'datasetid': 'document', 'uri': 'http://repository.lppm.unila.ac.id/id/file/160259', 'filename': 'white shrimp litopenaeus vannamei culture using using haterotropdhic syatem.pdf', 'filesize': 1548850, 'objectid': 32362, 'mtime': '2020-04-10 08:29:47', 'hash_type': 'MD5'}], 'main': 'white shrimp litopenaeus vannamei culture using using haterotropdhic syatem.pdf', 'docid': 32362, 'language': 'en', 'mime_type': 'application/pdf', 'rev_number': 1, 'eprintid': 19120, 'placement': 1, 'security': 'public', 'uri': 'http://repository.lppm.unila.ac.id/id/document/32362', 'pos': 1}]",,2020-04-13 02:07:00,archive,19120,2020-04-13 02:07:00,show,"[{'id': 'supono_unila@yahoo.com', 'name': {'family': 'Supono', 'lineage': None, 'honourific': None, 'given': 'Supono'}}, {'name': {'given': 'Johannes', 'lineage': None, 'family': 'Hutabarat', 'honourific': None}, 'id': None}, {'id': None, 'name': {'given': 'Slamet Budi', 'honourific': None, 'lineage': None, 'family': 'Prayitno'}}, {'name': {'given': 'YS', 'honourific': None, 'family': 'darmanto', 'lineage': None}, 'id': None}]",article,TRUE,White Shrimp ( Litopenaeus vannamei) Culture using Heterotrophic Aquaculture System on Nursery Phase.,1-4,,,,,
10,,,Ikan cupang memiliki nilai ekonomis yang cukup tinggi. Individu jantan memiliki morfologi yang lebih menarik dibandingkan dengan individu betina oleh sebab itu harganya juga lebih mahal. Secara normal pada awal pemijahan akan menghasilkan keturunan 50% jantan dan 50% betina. Pemijahan selanjutnya persentase betina akan naik lagi sehingga nilai produksi akan semakin menurun. Untuk mengatasi hal tersebut perlu dilakukan rekayasa agar presentasi individu meningkat. Tujuan pengabdian pada masyarakat ini adalah masyarakat mampu menggunakan teknologi seks reversal dengan baik. DIharapkan dengan teknologi ini akan mampu meningkatkan nilai produksi dan pendapatan petani. hasil kegiatan menunjukkan bahwa aplikasi seks reversal mampu meningkatkan persentase jantan meningkat menjadi 90%. Nilai produksi perbulan meningkat dari Rp 21.000.000 menjadi Rp 28.000.000 per bulan.,http://repository.lppm.unila.ac.id/id/eprint/1937,2014-09-01 00:00:00.000000000,['SH'],published,2017-05-30 01:34:22,,public,pub,8,,,['FP3'],disk0/00/00/19/37,,,274,"[{'pos': 1, 'uri': 'http://repository.lppm.unila.ac.id/id/document/1798', 'security': 'public', 'placement': 1, 'eprintid': 1937, 'mime_type': 'application/pdf', 'language': 'en', 'rev_number': 2, 'docid': 1798, 'main': 'IbM sex Reversal.PDF', 'files': [{'mtime': '2017-05-29 16:09:26', 'hash_type': 'MD5', 'uri': 'http://repository.lppm.unila.ac.id/id/file/13528', 'filename': 'IbM sex Reversal.PDF', 'filesize': 22828804, 'objectid': 1798, 'hash': '4789b71ad32107c8436a87a048815713', 'mime_type': 'application/pdf', 'datasetid': 'document', 'fileid': 13528}], 'format': 'text'}]",,2017-05-30 01:34:22,archive,1937,2017-05-30 01:34:22,show,"[{'name': {'given': 'Tarsim', 'lineage': None, 'family': 'Tarsim', 'honourific': None}, 'id': None}, {'name': {'given': 'Herman', 'lineage': None, 'family': 'Yulianto', 'honourific': None}, 'id': None}, {'id': 'eko.efendi@fp.unila.ac.id', 'name': {'given': 'Eko', 'honourific': None, 'family': 'Efendi', 'lineage': None}}]",conference_item,FALSE,Peningkatan Nilai Produksi Ikan Cupang Melalui aplikasi Teknologi Seks Reversal,,conference,Seminar Nasional Pengabdian kepada Masyarakat Universitas Lampung,"Bandar Lampung, Lampung",paper,10-11 September 2014
11,"['Universitas Lampung', 'Universitas Lampung', 'Universitas Lampung']",3.0,"Lumo (Labiobarbus ocellatus)
is one of consumption fish that available
throughout the year at Tulang Bawang river.The constrains to local fish populations
is reducing fish stocks by fisherman. Information about growth and reproduction of
lumo is necessary to support the management of fish resources. The research was conducted on April until December 2013. The samples were collected from 4 stations and from the fisherman who landed at fish market The parameters that were measured included of the length and weight, the gonade somatic level, the gonade somatic index and fecundity. Fish samples were used for this study is 893 fish. The result showed that lumo spawned from Novemberto Desember and categorized as total spawner. The gonade maturity index variedfrom 2.22 to 7.27%, fecundity ranged from 424 to 24.491 eggs, the sex ratio of lumo is unbalanced.The growth pattern were positive allomatric and condition factor is <1 in which showed lumo in Tulang Bawang river is flat.",http://repository.lppm.unila.ac.id/id/eprint/23887,2014-08-01 00:00:00.000000000,['SH'],published,2020-09-04 01:31:00,2301-816X,public,pub,7,Aquasains,"Jurusan Perikanan dan Kelautan, Fakultas Pertanian, Universitas Lampung",['FP3'],disk0/00/02/38/87,,1.0,142,"[{'language': 'en', 'rev_number': 1, 'mime_type': 'application/pdf', 'main': 'Pola Pertumbuhan dan Reproduksi Ikan Lumo (Labiobarbus ocellatus) di Sungai Tulang Bawang Provinsi Lampung.pdf', 'docid': 37567, 'files': [{'uri': 'http://repository.lppm.unila.ac.id/id/file/217865', 'filename': 'Pola Pertumbuhan dan Reproduksi Ikan Lumo (Labiobarbus ocellatus) di Sungai Tulang Bawang Provinsi Lampung.pdf', 'objectid': 37567, 'filesize': 765102, 'mtime': '2020-09-03 14:44:12', 'hash_type': 'MD5', 'mime_type': 'application/pdf', 'hash': '22c7a16ceaf94d543ae20e4edad68d1a', 'fileid': 217865, 'datasetid': 'document'}], 'format': 'text', 'pos': 1, 'uri': 'http://repository.lppm.unila.ac.id/id/document/37567', 'security': 'public', 'placement': 1, 'eprintid': 23887}]",https://jurnal.fp.unila.ac.id/index.php/JPBP/article/view/456,2020-09-04 01:31:00,archive,23887,2020-09-04 01:31:00,show,"[{'name': {'lineage': None, 'family': 'Tholifin', 'honourific': None, 'given': 'Alwan'}, 'id': None}, {'name': {'given': 'Berta', 'honourific': None, 'family': 'Putri', 'lineage': None}, 'id': None}, {'id': None, 'name': {'given': 'Rara', 'honourific': None, 'lineage': None, 'family': 'Diantari'}}, {'id': 'indra.yudha@fp.unila.ac.id', 'name': {'family': 'Yudha', 'lineage': None, 'honourific': None, 'given': 'Indra Gumay'}}]",article,TRUE,Pola Pertumbuhan dan Reproduksi Ikan Lumo (Labiobarbus 				     ocellatus) di Sungai Tulang Bawang Provinsi Lampung,213-220,,,,,
12,"['Program Studi Budidaya Perairan, Jurusan Perikanan dan Kelautan, Universitas Lampung']",2.0,"Furunculosis dan carp erytrodermatitis merupakan penyakit pada ikan yang disebabkan oleh bakteri Aeromonas salmonicida.  Vaksin inaktif whole cell A. salmonicida saat ini sedang dikembangkan untuk menanggulangi penyakit tersebut. Penelitian ini bertujuan untuk mengetahui imunogenisitas kombinasi vaksin inaktif whole cell A. salmonicida dengan imunostimulan dari jintan hitam (Nigella sativa) pada ikan mas (Cyprinus carpio).  Sebanyak 180 ekor ikan mas dimasukkan kedalam 18 akuarium dengan 6 perlakuan yang berbeda dan diulang sebanyak 3 kali. Perlakuan yang dilakukan terdiri dari kontrol (tanpa vaksin dan jintan hitam), pemberian jintan hitam 5%, pemberian vaksin, vaksin yang ditambah jintan hitam 1%, vaksin yang ditambah jintan hitam 2.5%, vaksin yang ditambah jintam hitam 5%.   Vaksin diberikan dengan cara penyuntikan secara intraperitoneal dengan kepadatan bakteri 107 sel/ikan dan jintan hitam diberikan melalui pakan sebanyak tiga kali dalam sehari. Pengambilan contoh darah ikan untuk diuji titer antibodi,
total leukosit, dan hematokrit ikan dilakukan saat sebelum vaksinasi, 7 hari setelah vaksinasi, dan 7 hari setelah booster. Hasil penelitian menunjukkan kombinasi vaksin inaktif whole cell A.  salmonicida yang ditambah jintan hitam 5% mampu meningkatkan titer antibodi ikan hingga 27  dibandingkan kontrol yang hanya meningkat hingga 25
 dan tanpa jintan hitam yang hanya meningkat hingga 24, kombinasi ini juga mampu meningkatkan jumlah leukosit pada ikan dengan rendahnya nilai hematokrit dan mampu mengembalikan kondisi tubuh dalam keadaan seimbang dalam waktu 7 hari.",http://repository.lppm.unila.ac.id/id/eprint/31941,1970-01-01 00:00:00.000002014,['SH'],published,2021-06-04 01:35:04,2302-3600,public,pub,9,E-JURNAL REKAYASA DAN TEKNOLOGI BUDIDAYA PERAIRAN,"Jurusan Budidaya Perairan, Fakultas Pertanian Universitas Lampung",['FP3'],disk0/00/03/19/41,[{'url': 'http://jurnal.fp.unila.ac.id/index.php/bdpi/article/download/396/377'}],2.0,64,"[{'docid': 144698, 'main': '11. Trilia NAO 2014 Imunogenisitas kombinasi vaksin...pdf', 'files': [{'mtime': '2021-06-03 14:41:06', 'hash_type': 'MD5', 'filename': '11. Trilia NAO 2014 Imunogenisitas kombinasi vaksin...pdf', 'uri': 'http://repository.lppm.unila.ac.id/id/file/378053', 'filesize': 383452, 'objectid': 144698, 'mime_type': 'application/pdf', 'hash': 'fa2fc64b553544f1f1822fcb659c3d43', 'fileid': 378053, 'datasetid': 'document'}], 'format': 'text', 'language': 'en', 'rev_number': 1, 'mime_type': 'application/pdf', 'placement': 1, 'eprintid': 31941, 'uri': 'http://repository.lppm.unila.ac.id/id/document/144698', 'pos': 1, 'security': 'public'}]",,2021-06-04 01:35:04,archive,31941,2021-06-04 01:35:04,show,"[{'name': {'given': 'Nur Ani Okta', 'family': 'Trilia', 'lineage': None, 'honourific': None}, 'id': None}, {'id': 'agus.setyawan@fp.unila.ac.id', 'name': {'given': 'Agus', 'honourific': None, 'lineage': None, 'family': 'Setyawan'}}, {'id': 'yudha.trinoegraha@fp.unila.ac.id', 'name': {'honourific': None, 'family': 'Adiputra', 'lineage': None, 'given': 'Y. T.'}}, {'name': {'lineage': None, 'family': 'Wardiyanto', 'honourific': None, 'given': 'Wardiyanto'}, 'id': None}]",article,TRUE,Imunogenisitas kombinasi Vaksin Inaktif whole cell Aeromonas salmonicida dan jintan hitam (Nigella sativa) Pada Ikan Mas (Cyprinus carpio),,,,,,
13,"['Program Studi Budidaya Perairan, Jurusan Perikanan dan Kelautan, Universitas Lampung']",2.0,"Penelitian ini bertujuan untuk mengidentifikasi parasit yang menginfeksi pada ikan badut (Amphiprion percula) serta korelasinya dengan lokasi budidaya. Penelitian ini dilakukan pada Februari sampai April 2013 di Balai Besar Pengembangan Budidaya Laut (BBPBL) Lampung. Penelitian menggunakan metode eksploratif dengan mengisolasi parasit yang menginfeksi ikan badut (3-5 cm) yang dibudidayakan di tiga lokasi budidaya yaitu indoor, semi outdoor dan outdoor. Parasit yang disolasi diidentifikasi kemudian dibandingkan satu lokasi budidaya dengan lokasi lainnya. Hasil penelitian ditemukan tiga jenis ektoparasit yang
menginfeksi ikan badut golongan nematoda, Trichodina dan trematoda.  Prevalensi parasit dan intensitas parasit tertinggi terdapat pada ketiga lokasi yaitu parasit
Trichodina.",http://repository.lppm.unila.ac.id/id/eprint/31913,1970-01-01 00:00:00.000002014,['SH'],published,2021-06-04 01:34:00,2302-3600,public,pub,6,E-JURNAL REKAYASA DAN TEKNOLOGI BUDIDAYA PERAIRAN,"Jurusan Budidaya Perairan, Fakultas Pertanian Universitas Lampung",['FP3'],disk0/00/03/19/13,[{'url': 'http://jurnal.fp.unila.ac.id/index.php/bdpi/article/download/401/381'}],2.0,64,"[{'language': 'en', 'rev_number': 1, 'mime_type': 'application/pdf', 'files': [{'filesize': 158466, 'objectid': 144539, 'filename': '9. Utami RH 2014 Identifikasi parasit ikan badut.pdf', 'uri': 'http://repository.lppm.unila.ac.id/id/file/377727', 'hash_type': 'MD5', 'mtime': '2021-06-03 10:25:34', 'fileid': 377727, 'datasetid': 'document', 'mime_type': 'application/pdf', 'hash': 'd0da411e8195c6b4d1476f0779575526'}], 'main': '9. Utami RH 2014 Identifikasi parasit ikan badut.pdf', 'docid': 144539, 'format': 'text', 'uri': 'http://repository.lppm.unila.ac.id/id/document/144539', 'pos': 1, 'security': 'public', 'placement': 1, 'eprintid': 31913}]",,2021-06-04 01:34:00,archive,31913,2021-06-04 01:34:00,show,"[{'name': {'given': 'Rina Hesti', 'family': 'Utami', 'lineage': None, 'honourific': None}, 'id': None}, {'name': {'honourific': None, 'lineage': None, 'family': 'Setyawan', 'given': 'Agus'}, 'id': 'agus.setyawan@fp.unila.ac.id'}, {'id': None, 'name': {'family': 'Diantari', 'lineage': None, 'honourific': None, 'given': 'Rara'}}, {'id': 'siti.hudaidah@fp.unila.ac.id', 'name': {'given': 'Siti', 'family': 'Hudaidah', 'lineage': None, 'honourific': None}}]",article,TRUE,Identifikasi parasit pada ikan badut (Amphiprion percula) di Balai Besar Pengembangan Budidaya Laut Lampung,,,,,,
14,,3.0,"Abstract

Ikan badut (Amphiprion ocellaris) adalah ikan hias air laut yang memiliki nilai ekonomis tinggi karena warnanya yang menarik. Peningkatan kualitas warna ikan badut yang bersifat permanen diperlukan untuk mendapatkan harga jual yang terbaik. Metode alternatif yang digunakan untuk meningkatkan warna ikan badut adalah dengan menggunakan astaxanthin. Tujuan dari penelitian ini adalah untuk mengetahui pengaruh astaxanthin pada peningkatan intensitas warna, sintasan dan pertumbuhan ikan badut. Metode yang digunakan adalah Toca Colour Finder Modified (M - TCF). Penelitian dilakukan dengan rancangan acak lengkap (RAL) dengan perlakuan penambahan astaxanthin sebanyak 0, 20, 30, 40 mg/kg pakan. Ikan badut dengan padat tebar 20 ekor dipelihara selama selama 60 hari dalam akuarium berukuran 40 x 40 x 40 cm. Hasil penelitian menunjukkan bahwa penambahan astaxanthin memberikan pengaruh terhadap peningkatan warna dan sintasan tetapi tidak berpengaruh terhadap pertumbuhan. Penambahan astaxanthin sebanyak 30 dan 40 mg/kg pakan memberikan pengaruh terbesar dalam intensitas peningkatan warna ikan badut. Perlu dilakukan perhitungan analisa ekonomi terhadap penggunaan astaxanthin dalam budidaya ikan badut.",http://repository.lppm.unila.ac.id/id/eprint/23235,2014-10-01 00:00:00.000000000,['SH'],published,2020-07-17 07:01:19,2302-3600,public,pub,11,Jurnal Rekayasa dan Teknologi Budidaya Perairan,Jurusan Perikanan dan Kelautan Fakutas Pertanian Universitas Lampung,['FP3'],disk0/00/02/32/35,,1.0,17,"[{'main': 468, 'files': [{'filename': 468, 'uri': 'http://repository.lppm.unila.ac.id/id/file/212731', 'objectid': 36797, 'filesize': 30858, 'mtime': '2020-07-17 05:54:42', 'hash_type': 'MD5', 'mime_type': 'application/xml', 'hash': 'a6c7e35da964e37a947a078dbc0c35d8', 'fileid': 212731, 'datasetid': 'document'}], 'docid': 36797, 'format': 'other', 'mime_type': 'application/xml', 'language': 'en', 'rev_number': 4, 'content': 'published', 'placement': 2, 'eprintid': 23235, 'pos': 2, 'uri': 'http://repository.lppm.unila.ac.id/id/document/36797', 'formatdesc': 'Journal', 'security': 'public'}]",http://jurnal.fp.unila.ac.id/index.php/bdpi/article/view/468,2020-07-17 07:01:19,archive,23235,2020-07-17 07:01:19,show,"[{'id': None, 'name': {'given': 'Erma Sartika', 'honourific': None, 'lineage': None, 'family': 'Yulianti'}}, {'id': 'henni.wijayanti@fp.unila.ac.id', 'name': {'family': 'Maharani,', 'lineage': None, 'honourific': None, 'given': 'Henni Wijayanti'}}, {'name': {'given': 'Rara', 'family': 'Diantari', 'lineage': None, 'honourific': None}, 'id': 'rara.diantari@fp.unila.ac.id'}]",article,TRUE,Efektivitas Pemberian Astaxanthin Pada Peningkatan Kecerahan Warna Ikan Badut (Amphiprion ocellaris),313-318,,,,,
15,,3.0,"Ikan badut (Amphiprion ocellaris) adalah ikan hias air laut yang memiliki nilai ekonomis tinggi karena warnanya yang menarik. Peningkatan kualitas warna ikan badut yang bersifat permanen diperlukan untuk mendapatkan harga jual yang terbaik. Metode alternatif yang digunakan untuk meningkatkan warna ikan badut adalah dengan menggunakan astaxanthin. Tujuan dari penelitian ini adalah untuk mengetahui pengaruh astaxanthin pada peningkatan intensitas warna, sintasan dan pertumbuhan ikan badut. Metode yang digunakan adalah Toca Colour Finder Modified (M - TCF). Penelitian dilakukan dengan rancangan acak lengkap (RAL) dengan perlakuan penambahan astaxanthin sebanyak 0, 20, 30, 40 mg/kg pakan. Ikan badut dengan padat tebar 20 ekor dipelihara selama selama 60 hari dalam akuarium berukuran 40 x 40 x 40 cm. Hasil penelitian menunjukkan bahwa penambahan astaxanthin memberikan pengaruh terhadap peningkatan warna dan sintasan tetapi tidak berpengaruh terhadap pertumbuhan. Penambahan astaxanthin sebanyak 30 dan 40 mg/kg pakan memberikan pengaruh terbesar dalam intensitas peningkatan warna ikan badut. Perlu dilakukan perhitungan analisa ekonomi terhadap penggunaan astaxanthin dalam budidaya ikan badut.",http://repository.lppm.unila.ac.id/id/eprint/23308,1970-01-01 00:00:00.000002014,['SH'],,2020-07-28 06:00:55,2303-3600,public,pub,7,Jurnal Rekayasa dan Teknologi Budidaya Perairan,"Jurusan Perikanan dan Kelautan, Fakultas Pertanian, Universitas Lampung",['FP3'],disk0/00/02/33/08,,1.0,17,"[{'eprintid': 23308, 'placement': 1, 'formatdesc': 'Jurnal', 'security': 'public', 'uri': 'http://repository.lppm.unila.ac.id/id/document/36900', 'pos': 1, 'format': 'other', 'main': 468, 'files': [{'objectid': 36900, 'filesize': 30858, 'uri': 'http://repository.lppm.unila.ac.id/id/file/213267', 'filename': 468, 'hash_type': 'MD5', 'mtime': '2020-07-22 04:52:56', 'datasetid': 'document', 'fileid': 213267, 'mime_type': 'application/xml', 'hash': 'a6c7e35da964e37a947a078dbc0c35d8'}], 'docid': 36900, 'rev_number': 3, 'language': 'en', 'mime_type': 'application/xml'}]",http://jurnal.fp.unila.ac.id/index.php/bdpi,2020-07-28 06:00:55,archive,23308,2020-07-28 06:00:55,show,"[{'id': None, 'name': {'given': 'Erma Sartika', 'family': 'Yulianti', 'lineage': None, 'honourific': None}}, {'name': {'given': 'Henni Wijayanti', 'lineage': None, 'family': 'Maharani,', 'honourific': None}, 'id': 'henni.wijayanti@fp.unila.ac.id'}, {'id': None, 'name': {'honourific': None, 'family': 'Diantari', 'lineage': None, 'given': 'Rara'}}]",article,TRUE,Efektivitas Pemberian Astaxanthin Pada Peningkatan Kecerahan Warna Ikan Badut (Amphiprion ocellaris),313-318,,,,,
16,,,"Budidaya ikan air tawar khususnya ikan hias menjanjikan peluang yang sangat besar bagi perbaikan ekonomi masyarakat. kegiatan penerapan teknologi sistem resirkulasi akuakultur (Recirculation Aquaculture System) dengan teknologi Biofiltrasi diharapkan menjadi solusi dari permasalahan tersebut. Tujuan Kegiatan ini untuk meningkatkan produktivitas budidaya ikan hias melalui sistem budidaya resirkulasi. Kegiatan yang dilakukan dalam pengabdian ini adalah pelatihan tentang sistem resirkulasi yang meliputi jenis sistem resirkulasi, manfaat/keuntungan sistem resirkulasi, penggunaan fiter dalam sistem resirkulasi, dan pemeliharaan sistem resirkulasi. Sistem budidaya dengan sistem resirkulasi menunjukkan nilai laju sintasan atau kelangsungan hidup benih lebih tinggi (83,33%) dibandingkan tanpa resisrkulasi (40,67%). Produksi benih dan nilai ekonomis yang dihasilkan pada sistem resirkulasi selama uji performance menghasilkan benih sebanyak 12500 ekor dengan nilai produksi sebesar Rp 6.250.000 dan pada sistem tanpa resirkulasi sebanyak 8500 ekor dengan nilai produksi sebesar RP 3.050.000. Secara umum nilai rata-rata produksi benih adalah 4166 ekor/minggu, sedangkan pada sistem tanpa resirkulasi adalah 2033 ekor/minggu.",http://repository.lppm.unila.ac.id/id/eprint/1935,2014-09-01 00:00:00.000000000,['SH'],published,2017-05-30 01:34:07,,public,pub,9,,,['FP3'],disk0/00/00/19/35,,,274,"[{'main': 'IbM resirkulasi.PDF', 'files': [{'hash_type': 'MD5', 'mtime': '2017-05-29 15:53:59', 'objectid': 1796, 'filesize': 22273653, 'filename': 'IbM resirkulasi.PDF', 'uri': 'http://repository.lppm.unila.ac.id/id/file/13515', 'fileid': 13515, 'datasetid': 'document', 'hash': '5880fc4b1c9a6998a3ebf562cfdcc03b', 'mime_type': 'application/pdf'}], 'docid': 1796, 'format': 'text', 'mime_type': 'application/pdf', 'language': 'en', 'rev_number': 4, 'placement': 1, 'eprintid': 1935, 'pos': 1, 'uri': 'http://repository.lppm.unila.ac.id/id/document/1796', 'security': 'public'}]",,2017-05-30 01:34:07,archive,1935,2017-05-30 01:34:07,show,"[{'name': {'family': 'Yulianto', 'lineage': None, 'honourific': None, 'given': 'Herman'}, 'id': None}, {'name': {'given': 'Eko', 'lineage': None, 'family': 'Efendi', 'honourific': None}, 'id': 'eko.efendi@fp.unila.ac.id'}, {'name': {'family': 'Hasani', 'lineage': None, 'honourific': None, 'given': 'Qadar'}, 'id': None}]",conference_item,FALSE,Teknologi Budidaya Ikan Hias Dengan Sistem resirkulasi,426-432,conference,Seminar Nasional Pengabdian kepada Masyarakat Universitas Lampung,"Bandar Lampung, Lampung",paper,10-11 September 2014
