,corp_creators,volume,abstract,uri,date,subjects,date_type,status_changed,issn,full_text_status,ispublished,rev_number,publication,publisher,divisions,dir,related_url,number,userid,documents,official_url,lastmod,eprint_status,eprintid,datestamp,metadata_visibility,creators,type,refereed,title,pagerange,event_type,event_title,event_location,pres_type,event_dates
0,"['Program Studi Budidaya Perairan, Jurusan Perikanan dan Kelautan, Universitas Lampung']",3.0,"Buah Rhizophora sp. mengandung berbagai macam senyawa anti bakteri dan berpotensi sebagai antibiotik alami. Penelitian ini dilakukan untuk mempelajari potensi anti bakteri dari ekstrak buah Rhizophora sp. terhadap beberapa bakteri
patogen pada ikan air tawar. Buah Rhizophora sp. diekstraksi dengan menggunakan tiga pelarut yaitu metanol, etil asetat, dan heksana. Ekstrak diuji aktivitas anti
bakterinya terhadap empat spesies bakteri air tawar Aeromonas hydrophila, Edwardsiella tarda, Pseudomonas stutzeri dan Streptococcus iniae dengan beberapa jenis pengujian yaitu sensitifitas, zona penghambatan, MIC (Konsentrasi Penghambatan Minimum), MBC (Konsentrasi Bakterisidal Minimum), toksisitas dan ITC (Inhibition Time Course). Hasil  pengujian menunjukkan bahwa ekstrak
buah Rhizophora sp. yang diekstraksi dengan etil asetat, memiliki kemampuan paling besar untuk menghambat pertumbuhan bakteri S. iniae dengan nilai 500 mg/L dan MBC sebesar 600 mg/L. Pengujian toksisitas dengan BSLT (Brine
Shrimp Lethality Test) ekstrak buah Rhizophora sp. dengan etil asetat bersifat toksik dengan nilai LC50 610,9 mg/L (< 1000 mg/L). Dan pengujian ITC selama 24 jam tidak menghasilkan penghambatan terhadap pertumbuhan S. iniae.",http://repository.lppm.unila.ac.id/id/eprint/31946,1970-01-01 00:00:00.000002014,['SH'],published,2021-06-04 01:35:15,2302-3600,public,pub,6,E-JURNAL REKAYASA DAN TEKNOLOGI BUDIDAYA PERAIRAN,"Jurusan Budidaya Perairan, Fakultas Pertanian Universitas Lampung",['FP3'],disk0/00/03/19/46,[{'url': 'http://jurnal.fp.unila.ac.id/index.php/bdpi/article/download/465/438'}],1.0,64,"[{'format': 'text', 'docid': 144718, 'main': '12. Apriyanto, H Pemanfaatan ekstrak buah Rhizopora...pdf', 'files': [{'fileid': 378098, 'datasetid': 'document', 'mime_type': 'application/pdf', 'hash': 'c1fecec79af0c4903bd52d543e146d7b', 'filesize': 488402, 'objectid': 144718, 'filename': '12. Apriyanto, H Pemanfaatan ekstrak buah Rhizopora...pdf', 'uri': 'http://repository.lppm.unila.ac.id/id/file/378098', 'hash_type': 'MD5', 'mtime': '2021-06-03 15:01:00'}], 'language': 'en', 'rev_number': 1, 'mime_type': 'application/pdf', 'eprintid': 31946, 'placement': 1, 'security': 'public', 'pos': 1, 'uri': 'http://repository.lppm.unila.ac.id/id/document/144718'}]",http://jurnal.fp.unila.ac.id/index.php/bdpi/article/view/465,2021-06-04 01:35:15,archive,31946,2021-06-04 01:35:15,show,"[{'id': None, 'name': {'given': 'Herman', 'honourific': None, 'family': 'Apriyanto', 'lineage': None}}, {'id': 'edypeni@yahoo.com', 'name': {'family': 'Harpeni', 'lineage': None, 'honourific': None, 'given': 'Esti'}}, {'id': 'agus.setyawan@fp.unila.ac.id', 'name': {'family': 'Setyawan', 'lineage': None, 'honourific': None, 'given': 'Agus'}}, {'name': {'lineage': None, 'family': 'Tarsim', 'honourific': None, 'given': 'Tarsim'}, 'id': 'tarsimlampung@gmail.com'}]",article,TRUE,Pemanfaatan ekstrak buah Rhizopora sp. sebagai anti bakteri terhadap bakteri patogen ikan air tawar,,,,,,
1,,,"Penelitian dilakukan dengan tujuan
untuk mengidentiﬁkasi dan membandingkan
keragaman jenis ektoparasit pada
ikan mas (Cyprinus carpio) dan ikan maskoki
(Carassius auratus) yang berasal dari
Lampung dan luar Lampung Metode penelitian
yang digunakan adalah survei langsung
dan pengambilan sampel secara random
ke pedagang ikan yang mendatangkan
ikan dari luar Lampung serta ke lokasi
budidaya ikan yang ada di Lampung. Parameter
yang diamati dalam penelitian ini
adalah prevalensi parasit, intensitas, dominasi,
indeks keragaman, indeks dominasi
dan indeks keseragaman terhadap parasit
yang ditemukan. Metode pemeriksaan secara
langsung di lokasi dengan preparasi
kerokan kulit dan insang dilakukan di laboratorium.
Data yang diperoleh ditabulasi
dan dihitung keragamannya dengan indeks
Shannon-Wiener. Hasil penelitian menunjukkan
bahwa jenis parasit yang ditemukan
menginfeksi ikan uji adalah Trichodina nobilis,
Gyrodactylus sp, Trichodina reticulata,
Dactylogyrus sp. Myxobolus sp. Vorticella
sp. dan Ichthyophthirius sp. Parasit
yang mendominasi ikan maskoki dari luar
Lampung adalah Trichodina nobilis (69,66%)
dan pada ikan maskoki asal Lampung ada-lah Trichodina nobilis (70,05%). Parasit yang
mendominasi ikan mas asal luar Lampung
adalah Trichodina nobilis (65,89%), dan pada
ikan mas asal Lampung adalah Vorticella
sp. (37,86%). Indeks keragaman parasit
(H’) tertinggi pada ikan maskoki asal luar
Lampung sebesar 0,6389, pada ikan maskoki
asal Lampung sebesar 0,3836, pada ikan
mas asal luar Lampung H’ sebesar 0,5766,
dan pada ikan mas asal Lampung H’ tertinggi
sebesar 0,5625.
Keywords ektoparasit, indeks keragaman,
intensitas, prevalensi, asal ikan
hias",http://repository.lppm.unila.ac.id/id/eprint/73,2014-01-27 00:00:00.000000000,['AC'],,2016-06-30 04:41:25,,public,pub,7,AQUASAINS (Jurnal Ilmu Perikanan dan Sumberdaya Perairan),,['FP3'],disk0/00/00/00/73,,,12,"[{'security': 'public', 'uri': 'http://repository.lppm.unila.ac.id/id/document/95', 'pos': 1, 'eprintid': 73, 'placement': 1, 'language': 'en', 'mime_type': 'application/pdf', 'rev_number': 1, 'format': 'text', 'files': [{'mtime': '2016-06-30 04:29:08', 'hash_type': 'MD5', 'uri': 'http://repository.lppm.unila.ac.id/id/file/427', 'filename': 'Publikasi_Jurnal(60).pdf', 'objectid': 95, 'filesize': 629536, 'mime_type': 'application/pdf', 'hash': '92a17c19aa5ca0b6a0b5024eecd01f09', 'fileid': 427, 'datasetid': 'document'}], 'main': 'Publikasi_Jurnal(60).pdf', 'docid': 95}]",,2016-06-30 05:47:27,archive,73,2016-06-30 04:41:25,show,"[{'name': {'given': 'Retna', 'honourific': None, 'lineage': None, 'family': 'Handayani'}, 'id': None}, {'id': 'yudha.trinoegraha@fp.unila.ac.id', 'name': {'given': 'Y. T.', 'family': 'Adiputra', 'lineage': None, 'honourific': None}}, {'id': None, 'name': {'lineage': None, 'family': '.', 'honourific': None, 'given': 'Wardiyanto'}}]",article,TRUE,"IDENTIFIKASI DAN KERAGAMAN PARASIT PADA IKAN MAS KOKI
(Carrasius auratus) DAN IKAN MAS (Cyprinus carpio) YANG BERASAL
DARI LAMPUNG DAN LUAR LAMPUNG",,,,,,
2,"['Universitas Lampung', 'Universitas Lampung', 'Universitas Lampung']",3.0,"Nila merah (Oreochromis niloticus) merupakan salah satu komoditas perikanan di Indonesia yang memiliki nilai ekonomi tinggi. Berkembangnya proses budidaya nila merah juga berpengaruh terhadap peningkatan limbah diperairan.Salah satu
cara untukmembantumengatasi limbah perairan dan dapat dimanfaatkan oleh ikan yaitu dengan sistem bioflok.Teknologi bioflok merupakan salah satu alternatif dalam mengatasi masalah kualitas air dalam akuakultur dan dimanfaatkan sebagai sumber pakan tambahan untuk nila merah.Tujuan penelitian ini adalah untuk menganalisis pertumbuhan dan tingkat kelangsungan hidup nila merah pada sistem bioflok dengan rasio C:N (perbandingan karbon dan nitrogen) yang
berbeda.Rancangan penelitian yang digunakan adalah rancangan acak lengkap
dengan empat perlakuan dan tiga kali ulangan. Perlakuan yang diuji yaitu (A) kontrol, (B) rasio C:N 15, (C) rasio C:N 20, (D) rasio C:N 25. Penelitian dilakukan dengan menggunakan benih nila merah dengan panjang total 3 cm dan berat ratarata 2 ± 0,4 gramyang dipelihara dengan akuarium berukuran40x30x35 cm. Parameter penelitian meliputipertumbuhan mutlak, laju pertumbuhan spesifik,kelangsungan hidup, Feed Convertion Ratio (FCR), Protein Efficiency Ratio (PER), dan kualitas air.Hasil penelitian menunjukan bahwa rasio C:N yang berbeda
pada aplikasi bioflok memberikan pengaruh terhadap pertumbuhan dan kelangsungan hidup nila merah. Kisaran laju pertumbuhan spesifik nila merah sebesar 12,17-16,33% dan tingkat kelangsungan hidup ikan nila 53,33-80%. Hasil
pengukuran kualitas air untuk suhu pada pagi dan sore berkisar 26-27°C, pH relatif stabil pada 6-7 dan kandungan amonia setiap perlakuan terjadi peningkatan di akhir
penelitian. Perlakuan terbaik adalah perlakuan B dengan rasio C:N 15.
Kata kunci: nila merah, bioflok, rasioC : N, pertumbuhan, kelangsungan hidup",http://repository.lppm.unila.ac.id/id/eprint/23889,2014-10-01 00:00:00.000000000,['SH'],published,2020-09-04 01:31:15,2302-3600/2597-5315,public,pub,6,e-Jurnal Rekayasa dan Teknologi Budidaya Perairan,"Jurusan Perikanan dan Ilmu Kelautan, Fakultas Pertanian,   Universitas Lampung",['FP3'],disk0/00/02/38/89,,1.0,142,"[{'eprintid': 23889, 'placement': 1, 'security': 'public', 'pos': 1, 'uri': 'http://repository.lppm.unila.ac.id/id/document/37569', 'format': 'text', 'files': [{'mime_type': 'application/pdf', 'hash': '96ae236c1309fa3061388970febc28f0', 'datasetid': 'document', 'fileid': 217881, 'mtime': '2020-09-03 15:20:45', 'hash_type': 'MD5', 'filename': 'Perbandingan Karbon dan Nitrogen pada Sistem Bioflok terhadap Pertumbuhan Nila Merah (Oreochromis niloticus).pdf', 'uri': 'http://repository.lppm.unila.ac.id/id/file/217881', 'objectid': 37569, 'filesize': 705585}], 'main': 'Perbandingan Karbon dan Nitrogen pada Sistem Bioflok terhadap Pertumbuhan Nila Merah (Oreochromis niloticus).pdf', 'docid': 37569, 'language': 'en', 'rev_number': 1, 'mime_type': 'application/pdf'}]",https://jurnal.fp.unila.ac.id/index.php/bdpi/article/view/472/445,2020-09-04 01:31:15,archive,23889,2020-09-04 01:31:15,show,"[{'id': None, 'name': {'lineage': None, 'family': 'Husein', 'honourific': None, 'given': 'Nasyir'}}, {'name': {'lineage': None, 'family': 'Supono', 'honourific': None, 'given': 'Supono'}, 'id': 'supono_unila@yahoo.com'}, {'id': None, 'name': {'honourific': None, 'lineage': None, 'family': 'Putri', 'given': 'Berta'}}]",article,TRUE,Perbandingan Karbon dan Nitrogen pada Sistem Bioflok terhadap Pertumbuhan Nila Merah (Oreochromis niloticus),343-350,,,,,
3,,2.0,"Metil metsulfuron merupakan senyawa aktif yang umum digunakan oleh para petani untuk membasmi gulma di sawah. Penggunaan yang tidak sesuai pada senyawa aktif tersebut akan menyebabkan resiko pencemaran lingkungan yang berpengaruh terhadap kondisi organisme non target disekitarnya seperti gangguan reproduksi pada Daphnia sp. Penelitian ini bertujuan untuk mengetahui tingkat toksisitas metil metsulfuron dengan menentukan nilai LC50-48 jam terhadap Daphnia sp. serta mengetahui rasio jenis kelamin jantan anakan Daphnia sp. Adapun metode yang digunakan dalam penelitian ini adalah pemberian senyawa aktif metil metsulfuron dengan konsentrasi yang berbeda. Pada uji toksisitas akut menggunakan konsentrasi 0 ppm; 20,89 ppm; 43,64 ppm; 91,17 ppm; 190,48 ppm dan 397,96 ppm. Sedangkan pada uji pengaruh metil metsulfuron terhadap rasio anakan jantan Daphnia sp. yaitu 0 ppm; 20 ppm; 40 ppm dan 80 ppm. Hasil penelitian pada uji toksisitas menunjukkan nilai (LC50)-48 jam sebesar 140,2 ppm sedangkan persentase rasio anakan jantan Daphnia sp. tertinggi terdapat pada perlakuan 80 ppm yaitu mencapai 71%. Hubungan antara konsentrasi metil metsulfuron dengan rasio anakan jantan Daphnia sp. menunjukkan bahwa semakin tinggi konsentrasi metil metsulfuron yang dipaparkan pada Daphnia sp., maka semakin meningkat pula rasio anakan jantan Daphnia sp. yang dihasilkan.",http://repository.lppm.unila.ac.id/id/eprint/23240,1970-01-01 00:00:00.000002014,['SH'],published,2020-07-17 08:46:33,2301-816X,public,pub,7,Aquasains,"Jurusan Perikanan dan Kelautan, Fakultas Pertanian, Universitas Lampung",['FP3'],disk0/00/02/32/40,,2.0,17,"[{'formatdesc': 'jurnal', 'security': 'public', 'pos': 1, 'uri': 'http://repository.lppm.unila.ac.id/id/document/36801', 'eprintid': 23240, 'placement': 1, 'language': 'en', 'mime_type': 'application/xml', 'rev_number': 3, 'format': 'other', 'main': 273, 'files': [{'filename': 273, 'uri': 'http://repository.lppm.unila.ac.id/id/file/212754', 'filesize': 27918, 'objectid': 36801, 'mtime': '2020-07-17 08:13:43', 'hash_type': 'MD5', 'mime_type': 'application/xml', 'hash': 'f2dadeb7294672399391ca0f5e5ffb1d', 'fileid': 212754, 'datasetid': 'document'}], 'docid': 36801}]",http://jurnal.fp.unila.ac.id/index.php/JPBP/,2020-07-17 08:46:33,archive,23240,2020-07-17 08:46:33,show,"[{'name': {'family': 'Muarif', 'lineage': None, 'honourific': None, 'given': 'Muarif'}}, {'name': {'given': 'Qadar', 'family': 'Hasani', 'lineage': None, 'honourific': None}}, {'name': {'given': 'Henni', 'honourific': None, 'family': 'Wijayanti', 'lineage': None}}]",article,TRUE,Toksisitas Metil Metsulfuron Hubungannya Dengan Maskulinitas Copepoda Daphnia SP.,125-130,,,,,
4,"['Program Studi Budidaya Perairan, Jurusan Perikanan dan Kelautan, Universitas Lampung']",3.0,"Black cumin (Nigella sativa) has been used as an immunostimulant in humpback grouper (Cromileptes altivelis) was infected with Viral Nervous Necrosis (VNN). The addition of 7,5% black cumin in ﬁsh feed showed to increase innate immune responsee of humpback grouper. However, then was unknown histopathology eﬀect forward black cumin administration in ﬁsh. This research purpose was to know proﬁle of histopathological humpback grouper stimulated black cumin and infected VNN. Fish was organized in ﬁve tanks based on treatment i.e control, VNN infected ﬁsh, and VNN infected ﬁsh with additional 2,5 %, 5 %, and 7,5 % black cumin in ﬁsh feed. Then was ﬁve organs i.e brain, eyes, kidney, liver, and gills, that observed each ﬁsh sample. Result of this research showed that the addition of black cumin, was not aﬀect histopathology proﬁle in humpback grouper that infected with VNN.",http://repository.lppm.unila.ac.id/id/eprint/31908,1970-01-01 00:00:00.000002014,['SH'],published,2021-06-04 01:33:55,2301-816X,public,pub,6,Aquasains,"Jurusan Perikanan dan Kelautan, Fakultas Pertanian, Universitas Lampung",['FP3'],disk0/00/03/19/08,[{'url': 'https://aquasains.files.wordpress.com/2014/10/04septi_diana_sari_207_212.pdf'}],1.0,64,"[{'uri': 'http://repository.lppm.unila.ac.id/id/document/144516', 'pos': 1, 'security': 'public', 'placement': 1, 'eprintid': 31908, 'language': 'en', 'rev_number': 1, 'mime_type': 'application/pdf', 'main': '7. Sari SD 2014 Profil histologi kerapu....pdf', 'docid': 144516, 'files': [{'filesize': 1217973, 'objectid': 144516, 'filename': '7. Sari SD 2014 Profil histologi kerapu....pdf', 'uri': 'http://repository.lppm.unila.ac.id/id/file/377682', 'hash_type': 'MD5', 'mtime': '2021-06-03 09:43:38', 'datasetid': 'document', 'fileid': 377682, 'mime_type': 'application/pdf', 'hash': '31c2f1f26f6796d1226f6d5fb58cd85d'}], 'format': 'text'}]",,2021-06-04 01:33:55,archive,31908,2021-06-04 01:33:55,show,"[{'name': {'honourific': None, 'lineage': None, 'family': 'Sari', 'given': 'Septi Diana'}, 'id': None}, {'id': None, 'name': {'lineage': None, 'family': 'Wardiyanto', 'honourific': None, 'given': 'Wardiyanto'}}, {'id': 'agus.setyawan@fp.unila.ac.id', 'name': {'family': 'Setyawan', 'lineage': None, 'honourific': None, 'given': 'Agus'}}]",article,TRUE,Profil histopatologi kerapu tikus (Cromileptes altivelis) yang distimulasi jintan hitam (Nigella sativa) dan diinfeksi Viral Nervous Necrosis (VNN),,,,,,
5,,2.0,"Lele dumbo (Clarias gariepinus) merupakan jenis ikan air tawar yang mudah dibudidayakan secara intensif. Limbah dari budidaya lele dumbo dapat berdampak pada penurunan kualitas air tetapi dapat digunakan sebagai sumber media tumbuh organisme yang bermanfaat sebagai pakan alami ikan. Teknologi bioflok merupakan salah satu alternatif dalam efisiensi pakan dan penyangga kualitas air dalam akuakultur yang diadaptasi dari teknik pengolahan limbah domestik secara konvensional. Penelitian ini bertujuan untuk mengkaji penambahan bioflok sebagai pakan alami dari limbah budidaya lele dumbo terhadap pertumbuhan dan kelangsungan hidup  nila  (Oreochromis niloticus). Rancangan penelitian yang digunakan adalah rancangan acak lengkap, dengan empat perlakuan (penambahan bioflok sebanyak 0, 5, 10 dan 15 ml/l) dan tiga kali ulangan. Penelitian dilakukan dengan menggunakan benih nila  berukuran 2-3 cm yang dipelihara dengan akuarium berukuran 40 x 30 x 30 cm. Parameter dalam penelitian meliputi suhu, pH, amonia, laju pertumbuhan harian dan kelangsungan hidup. Hasil penelitian menunjukan penambahan bioflok tidak berpengaruh terhadap pertumbuhan dan tingkat kelangsungan hidup nila.  Kisaran laju pertumbuhan nila 0,21- 0,24 g/hari dan  tingkat kelangsungan hidup nila 57-88%. Hasil pengukuran parameter kualitas air untuk suhu pagi berkisar  26– 27oC sedangkan pada sore hari berkisar 27- 28oC, pH relatif stabil pada kisaran 6, sedangkan kandungan amonia terjadi peningkatan pada akhir penelitian pada setiap perlakuan.",http://repository.lppm.unila.ac.id/id/eprint/23309,1970-01-01 00:00:00.000002014,['SH'],published,2020-07-28 06:23:48,2302-3600,public,pub,13,Jurnal Rekayasa Teknologi dan Budidaya Perairan,"Jurusan Perikanan dan Kelautan, Fakultas Pertanian, Universitas Lampung",['FP3'],disk0/00/02/33/09,,2.0,17,"[{'eprintid': 23309, 'placement': 1, 'formatdesc': 'jurnal', 'security': 'public', 'pos': 1, 'uri': 'http://repository.lppm.unila.ac.id/id/document/36903', 'format': 'other', 'docid': 36903, 'main': 398, 'files': [{'mtime': '2020-07-22 05:08:37', 'hash_type': 'MD5', 'filename': 398, 'uri': 'http://repository.lppm.unila.ac.id/id/file/213281', 'filesize': 30822, 'objectid': 36903, 'mime_type': 'application/xml', 'hash': '9bc621712446e87fbccbeb02b4bf1b2b', 'fileid': 213281, 'datasetid': 'document'}], 'mime_type': 'application/xml', 'language': 'en', 'rev_number': 4}]",http://jurnal.fp.unila.ac.id/index.php/bdpi,2020-07-28 06:23:48,archive,23309,2020-07-28 06:23:48,show,"[{'id': None, 'name': {'honourific': None, 'family': 'Septiani', 'lineage': None, 'given': 'Nani'}}, {'id': 'henni.wijayanti@fp.unila.ac.id', 'name': {'given': 'Henni Wijayanti', 'honourific': None, 'family': 'Maharani,', 'lineage': None}}, {'id': 'supono_unila@yahoo.com', 'name': {'given': 'Supono', 'honourific': None, 'lineage': None, 'family': 'Supono'}}]",article,TRUE,Pemanfaatan Bioflok Dari Limbah Budidaya Lele Dumbo (Clarias gariepinus) Sebagai Pakan Nila (Oreochromis niloticus),267-272,,,,,
6,"['Program Studi Budidaya Perairan, Jurusan Perikanan dan Kelautan, Universitas Lampung', 'Program Studi Ilmu Kelautan, Jurusan Perikanan dan kelautan, Fakultas Pertanian, Universitas Lampung', 'Program Studi Ilmu Kelautan, Jurusan Perikanan dan kelautan, Fakultas Pertanian, Universitas Lampung', 'Program Studi Budidaya Perairan, Jurusan Perikanan dan Kelautan, Universitas Lampung', 'Program Studi Budidaya Perairan, Jurusan Perikanan dan Kelautan, Universitas Lampung']",,"Penelitian ini bertujuan untuk mengkaji potensi biokontrol bakteri strain D.2.2. terhadap bakteri patogen pada ikan dan udang secara in vitro. Tahapan metode dalam penelitian ini meliputi isolasi bakteri dari tambak tradisional di Lampung Timur, skrining bakteri kandidat anti-vibrio, profil pertumbuhan isolat bakteri kandidat biokontrol, ekstraksi senyawa aktif, uji aktivitas senyawa anti-bakteri patogen dan identifikasi bakteri. Sebanyak 293 isolat bakteri berhasil dikoleksi dari tambak tradisional udang windu (Penaues monodon) di Lampung Timur. Uji antagonisme dengan Vibrio harveyi menunjukkan isolat D.2.2 memiliki zona hambat paling luas. Hasil identifikasi secara morfologi dan biokimiawi menunjukkan isolat D.2.2 identik dengan bakteri Alteromonas sp.",http://repository.lppm.unila.ac.id/id/eprint/32305,1970-01-01 00:00:00.000002014,['SH'],published,2021-06-08 16:15:50,,public,pub,10,,,['FP3'],disk0/00/03/23/05,,,64,"[{'eprintid': 32305, 'placement': 1, 'security': 'public', 'pos': 1, 'uri': 'http://repository.lppm.unila.ac.id/id/document/146523', 'format': 'text', 'files': [{'fileid': 382344, 'datasetid': 'document', 'hash': 'cde9244559879f18e817b578cd3bcf9c', 'mime_type': 'application/pdf', 'filesize': 858730, 'objectid': 146523, 'uri': 'http://repository.lppm.unila.ac.id/id/file/382344', 'filename': '23. Prosiding PAKI 2014.pdf', 'hash_type': 'MD5', 'mtime': '2021-06-08 07:47:51'}], 'main': '23. Prosiding PAKI 2014.pdf', 'docid': 146523, 'language': 'en', 'rev_number': 1, 'mime_type': 'application/pdf'}]",,2021-06-08 16:15:50,archive,32305,2021-06-08 16:15:50,show,"[{'id': 'agus.setyawan@fp.unila.ac.id', 'name': {'given': 'Agus', 'honourific': None, 'family': 'Setyawan', 'lineage': None}}, {'id': 'edypeni@yahoo.com', 'name': {'lineage': None, 'family': 'Harpeni', 'honourific': None, 'given': 'Esti'}}, {'id': None, 'name': {'given': 'Mahrus', 'family': 'Ali', 'lineage': None, 'honourific': None}}, {'id': None, 'name': {'given': 'Denis Clara', 'honourific': None, 'lineage': None, 'family': 'Mariska'}}, {'name': {'honourific': None, 'lineage': None, 'family': 'Aji', 'given': 'Mufit Budi'}, 'id': None}]",conference_item,TRUE,Potensi agen bakteri biocontrol indigenous tambak tradisional udang windu (Penaues monodon) di Lampung Timur strain D.2.2 terhadap bakteri patogen pada udang dan ikan,,conference,Pertemuan Ahli Kesehatan Ikan 2014,"Serang, Banten",speech,11-14 Februari 2014
7,,,Hasil review,http://repository.lppm.unila.ac.id/id/eprint/18983,1970-01-01 00:00:00.000002014,['SH'],published,2020-04-06 07:41:31,,public,pub,7,,Omics publishing,['FP3'],disk0/00/01/89/83,,,333,"[{'format': 'text', 'files': [{'fileid': 159280, 'datasetid': 'document', 'mime_type': 'application/pdf', 'hash': 'ae3e637127c957803c73a4fb59c86e47', 'hash_type': 'MD5', 'mtime': '2020-04-06 04:10:37', 'objectid': 32222, 'filesize': 463996, 'filename': 'White Shrimp (Litopebaeus vannamei) Culture Using .pdf', 'uri': 'http://repository.lppm.unila.ac.id/id/file/159280'}], 'main': 'White Shrimp (Litopebaeus vannamei) Culture Using .pdf', 'docid': 32222, 'language': 'en', 'mime_type': 'application/pdf', 'rev_number': 1, 'eprintid': 18983, 'placement': 1, 'security': 'public', 'uri': 'http://repository.lppm.unila.ac.id/id/document/32222', 'pos': 1}]",,2020-04-06 07:41:31,archive,18983,2020-04-06 07:41:31,show,"[{'name': {'honourific': None, 'family': 'Supono', 'lineage': None, 'given': 'Supono'}, 'id': 'supono_unila@yahoo.com'}]",other,,White Shrimp ( Litopenaeus vannamei) Culture using Heterotrophic Aquaculture System on Nursery Phase.,,,,,,
8,,,"Biofloc  technology   has added values  in  aquaculture  management,  both  in  water quality   management and feeding   management. As  an  optional  feed, biofloc  is capable to enhance  growth due to high protein  content.  Bacteria, main component biofloc,  can produce   polyhydroxybutyrate  (PHB)  as  reserve  of  energy  and  growth accelerator for fish. The aim of the research were to study the effect of the different C:N and C:P ratio of media  on  the  content  of  polyhydroxybutyrate  in  biofloc and  to  determine  optimum media to produce high polyhydroxybutyrate content in biofloc. The experiment was arranged  in factorial   with  completely  randomized  design   in   three  rep lications. Treatments were C:N ratio of 15, 20, 25 and C:P ratio of 75, 100, and 125. The result showed that C:N ratio and C:P ratio of media and their interaction affect the content of polyhydroxybutyrate in biofloc. C:N ratio of 20 and C:P ratio of 125 resulted in most polyhydroxybutyrate (292.5±73.76 mg g-1 biofloc dry weight). Ratio of C:N of media gave linier and quadratic responses and C:P ratio of media gave linier  one.  Optimum  polyhydroxybutyrate  production  was  obtained at  C:N  ratio  of 20.9 and C:P ratio of 125 resulting in 296.6 mg g-1 biofloc dry weight (29.7%)
Keyword :Biofloc, Polyhydroxybutyrate, C:N ratio, C:P ratio",http://repository.lppm.unila.ac.id/id/eprint/3653,2014-06-01 00:00:00.000000000,['SH'],published,2017-07-20 09:05:42,978-602-70651-0-9,public,pub,6,PROCEEDING INTERNATIONAL SEMINAR ON MARINE AND FISHERIES 2013,Faculty of Fisheries and Marine Sciences of Pancasakti University,['FP3'],disk0/00/00/36/53,,,333,"[{'eprintid': 3653, 'placement': 1, 'security': 'public', 'pos': 1, 'uri': 'http://repository.lppm.unila.ac.id/id/document/3520', 'format': 'text', 'docid': 3520, 'main': 'Seminar Tegal.pdf', 'files': [{'objectid': 3520, 'filesize': 1518353, 'filename': 'Seminar Tegal.pdf', 'uri': 'http://repository.lppm.unila.ac.id/id/file/25556', 'hash_type': 'MD5', 'mtime': '2017-07-17 02:39:37', 'fileid': 25556, 'datasetid': 'document', 'hash': '20541e99b93173efb5d2da05ecd8d889', 'mime_type': 'application/pdf'}], 'language': 'en', 'rev_number': 1, 'mime_type': 'application/pdf'}]",,2017-07-20 09:05:42,archive,3653,2017-07-20 09:05:42,show,"[{'id': 'supono_unila@yahoo.com', 'name': {'given': 'Supono', 'lineage': None, 'family': 'Supono', 'honourific': None}}, {'id': None, 'name': {'family': 'Hutabarat', 'lineage': None, 'honourific': None, 'given': 'Johannes'}}, {'name': {'honourific': None, 'lineage': None, 'family': 'Prayitno', 'given': 'Slamet Budi'}, 'id': None}]",article,TRUE,"OPTIMIZATION OF THE CONTENT OF POLYHYDROXYBUTYRATE IN
BIOFLOC BY C:N AND C:P RATIO REGIME OF MEDIA",192-199,,,,,
