,creators,type,refereed,title,number,userid,documents,lastmod,official_url,eprintid,eprint_status,datestamp,pagerange,metadata_visibility,status_changed,full_text_status,issn,rev_number,ispublished,publication,publisher,divisions,dir,volume,abstract,uri,date,subjects,date_type,id_number,pres_type,corp_creators,event_title,event_type,event_dates,event_location
0,"[{'name': {'given': 'Siti', 'honourific': None, 'family': 'Hudaidah', 'lineage': None}, 'id': 'siti.hudaidah@fp.unila.ac.id'}, {'name': {'given': 'Supono', 'honourific': None, 'family': 'Supono', 'lineage': None}, 'id': 'supono_unila@yahoo.com'}, {'id': None, 'name': {'given': 'Berta', 'honourific': None, 'family': 'Putri', 'lineage': None}}, {'name': {'given': 'ellen', 'honourific': None, 'lineage': None, 'family': 'larasati'}, 'id': None}]",article,TRUE,First report of Spirulina sp. performance in wastewater of Cromileptes altivelis aquaculture in Indonesia,2.0,333,"[{'files': [{'filename': 'jurnal bioflux.pdf', 'uri': 'http://repository.lppm.unila.ac.id/id/file/461750', 'objectid': 163474, 'filesize': 425946, 'mtime': '2022-05-25 02:23:35', 'hash_type': 'MD5', 'hash': 'a0e479e5bd01b60b439de9b51bec8634', 'mime_type': 'application/pdf', 'datasetid': 'document', 'fileid': 461750}], 'main': 'jurnal bioflux.pdf', 'docid': 163474, 'format': 'text', 'mime_type': 'application/pdf', 'language': 'en', 'rev_number': 1, 'placement': 1, 'eprintid': 41805, 'uri': 'http://repository.lppm.unila.ac.id/id/document/163474', 'pos': 1, 'security': 'public'}]",2022-05-25 03:34:01,http://www.bioflux.com.ro/docs/2022.988-1002.pdf,41805,archive,2022-05-25 03:34:01,988-1002,show,2022-05-25 03:34:01,public,1844-9166,6,pub,AACL Bioflux,Bioflux,['FP3'],disk0/00/04/18/05,15.0,"Indonesia is one of the countries with the most significant grouper production in the world. One of the groupers that are widely cultured in Indonesia is the humpback grouper (Cromileptes altivelis). Unfortunately, humpback grouper aquaculture activities cause waste. The waste can produce hydrogen sulfide, orthophosphate, and ammonia, which is toxic to aquatic animals. One way to treat the waste is by using Spirulina sp., which is utilizing organic material from humpback grouper waste to support its growth. The purpose of this study was to identify its performance in reducing water quality parameters to tolerance level. It was also to examine the growth of Spirulina sp. on laboratory-scale culture in the humpback grouper nursery media with a varying degree of waste. The study design used was a Completely Randomized Design (CRD) with four treatments and three replications, A (100%), B (75%), C (50%), and D (25%) humpback grouper nursery waste as culture media. The parameters calculated include population density, nitrate, orthophosphate, pH, temperature, salinity, and light intensity. The results showed that Spirulina sp. could reduce nitrate and phosphorus in water up to 89.78% and 84.34% of the waste. Spirulina sp. could maintain all water quality to be following the standards for fish farming again. The utilization of humpback grouper nursery waste at a concentration of 25% has a significant effect on the population growth of Spirulina sp. on laboratory scale culture. Key Words: aquaculture, grouper, phytoplankton, waste.",http://repository.lppm.unila.ac.id/id/eprint/41805,2022-04-01 00:00:00.000000000,['SH'],published,,,,,,,
1,"[{'name': {'honourific': None, 'lineage': None, 'family': 'Maharani,', 'given': 'Henni Wijayanti'}, 'id': 'henni.wijayanti@fp.unila.ac.id'}, {'id': None, 'name': {'given': 'Qadar', 'honourific': None, 'lineage': None, 'family': 'Hasani'}}, {'id': None, 'name': {'given': 'Muhammad Ariful', 'honourific': None, 'lineage': None, 'family': 'Aimma'}}, {'id': 'deny.utomo@fp.unila.ac.id', 'name': {'honourific': None, 'lineage': None, 'family': 'Utomo', 'given': 'Deny Sapto Chondro'}}, {'id': 'limin.sentiko@gmail.com', 'name': {'lineage': None, 'family': 'Santoso', 'honourific': None, 'given': 'Limin'}}, {'name': {'honourific': None, 'lineage': None, 'family': 'Kartini', 'given': 'Nidya'}, 'id': 'nidya.kartini@fp.unila.ac.id'}, {'id': None, 'name': {'honourific': None, 'lineage': None, 'family': 'Kausar', 'given': 'Radho Al'}}]",article,TRUE,Growth performance of Tilapia (Oreochromis niloticus) cultivated in water from ex-sand pit lakes by phytoremediation treatments,2.0,1193,"[{'eprintid': 37613, 'placement': 1, 'security': 'public', 'pos': 1, 'uri': 'http://repository.lppm.unila.ac.id/id/document/158542', 'format': 'text', 'files': [{'datasetid': 'document', 'fileid': 429264, 'hash': 'c35c65fdb3d8e7c303c02a1360e18833', 'mime_type': 'application/pdf', 'hash_type': 'MD5', 'mtime': '2022-01-05 01:13:43', 'filesize': 1262981, 'objectid': 158542, 'filename': '1028-2856-1-PB.pdf', 'uri': 'http://repository.lppm.unila.ac.id/id/file/429264'}], 'main': '1028-2856-1-PB.pdf', 'docid': 158542, 'rev_number': 1, 'language': 'en', 'mime_type': 'application/pdf'}]",2022-01-05 01:55:10,https://www.jdmlm.ub.ac.id/index.php/jdmlm/index,37613,archive,2022-01-05 01:55:10,3237-3245,show,2022-01-05 01:55:10,public,"2339-076X (p); 2502-2458 (e),",9,pub,JOURNAL OF DEGRADED AND MINING LANDS MANAGEMENT,International Research Centre for the Management of Degraded and Mining Lands (IRC-MEDMIND),['FP3'],disk0/00/03/76/13,9.0,"Utilization of ex-sand pit lakes for aquaculture is difficult due to low water quality and high concentrations of iron (Fe). Phytoremediation using aquatic plants has been proven to be effective in reducing Fe in waters. This study aims to determine the growth, feed conversion efficiency and survival rate of tilapia (Oreochromis niloticus) cultured with ex-sand mining water media with phytoremediation treatment. Phytoremediation treatment was carried out by Eichhornnia crassipes, Azolla pinnata, and Salvinia molesta. Fish culture experiments were carried out in plastic tarpaulin tanks for 40 days, with ad satiation feeding, three times a day using the commercial feed. The results showed that phytoremediation with aquatic plants had succeeded in reducing Fe to a level suitable for fish culture. Fish culture experiments showed an absolute length growth rate of 0.09-0.18 cm/day and an absolute weight growth rate of 0.11-0.16 g/day. The feed conversion ratio was 1.18-1.40 and the survival rate was 98.04-99.08%. The survival rate of tilapia is high, the feed conversion ratio is medium and growth is low. The high environmental temperature and the decrease in water quality due to the absence of water changes and aeration are suspected of causing the low growth of fish. Therefore, further research with water change and aeration experiments and the use of other species of fish is needed to follow up the results of this study.",http://repository.lppm.unila.ac.id/id/eprint/37613,2022-01-01 00:00:00.000000000,['SH'],published,https://doi.org/10.15243/jdmlm.2022.092.3237,,,,,,
2,"[{'name': {'given': 'Nur Amaliah', 'family': 'Putri', 'lineage': None, 'honourific': None}, 'id': None}, {'id': 'deny.utomo@fp.unila.ac.id', 'name': {'given': 'Deny Sapto Chondro', 'lineage': None, 'family': 'Utomo', 'honourific': None}}, {'id': None, 'name': {'given': 'Evi', 'honourific': None, 'lineage': None, 'family': 'Rahayuni'}}, {'name': {'honourific': None, 'family': 'Setiowibowo', 'lineage': None, 'given': 'Catur'}, 'id': None}]",article,TRUE,APLIKASI HORMON ESTRADIOL UNTUK PENGENDALIAN KANIBALISME PADA BENIH LELE SANGKURIANG (Clarias gariepinus) PADA BUDI DAYA SKALA MASSAL,1.0,1193,"[{'content': 'published', 'rev_number': 3, 'language': 'en', 'mime_type': 'application/pdf', 'format': 'text', 'main': '17310-49115-1-PB.pdf', 'docid': 164691, 'files': [{'objectid': 164691, 'filesize': 572528, 'filename': '17310-49115-1-PB.pdf', 'uri': 'http://repository.lppm.unila.ac.id/id/file/469848', 'hash_type': 'MD5', 'mtime': '2022-07-04 08:23:18', 'datasetid': 'document', 'fileid': 469848, 'mime_type': 'application/pdf', 'hash': 'ea51f87f482df03ce8f9ffc647f35ef4'}], 'security': 'public', 'uri': 'http://repository.lppm.unila.ac.id/id/document/164691', 'pos': 1, 'eprintid': 42904, 'placement': 1}]",2022-07-04 09:09:05,https://ejournal.unsri.ac.id/index.php/jari/article/view/17310,42904,archive,2022-07-04 09:09:05,14-24,show,2022-07-04 09:09:05,public,ISSN : 2303-2960,7,pub,"Jurnal Akuakultur Rawa Indonesia,",Universitas Sriwijaya,['FP3'],disk0/00/04/29/04,10.0,"African catfish (Clarias gariepinus) is a commodity admired by both farmers and consumers. However, one obstacle in nursery process, namely the high mortality of fry due to cannibalism, especially in mass scale nursery system. One alternative that can be done to reduce the potential for cannibalism is through a hormonal approach, namely the application of estradiol-17? hormone. This study aimed to evaluate the effect of estradiol-17? hormone within batch spawning groups on level of cannibalism of african catfish fry. This study used a non factorial randomized block design with three levels of estradiol-17? hormone doses treatment, i.e., estradiol-17? hormone on feed of 0 mg/kg feed, estradiol-17? hormone of 30 mg/kg feed, estradiol-17? hormone of 60 mg/kg feed, on three batch spawning groups. African catfish seeds were reared in concrete tanks with density of 1,194 fish/m2 within two weeks. The results showed that dose of estradiol-17? hormone treat-ment was not able to reduce cannibalism, but in third batch spawning group sup-ported absolute weight of 0.32 g (P<0.05), and in second batch spawning group were reduced cannibalism potential parameter by 0.61%, and a survival rate of 70.04%.",http://repository.lppm.unila.ac.id/id/eprint/42904,2022-06-01 00:00:00.000000000,['SH'],published,https://doi.org/10.36706/jari.v10i1.17310,,,,,,
3,"[{'id': 'm.browijoyo@gmail.com', 'name': {'given': 'Browijoyo', 'honourific': None, 'family': 'Santanumurti', 'lineage': None}}, {'id': None, 'name': {'honourific': None, 'family': 'Khanza', 'lineage': None, 'given': 'Santrika'}}, {'id': None, 'name': {'given': 'Zaenal', 'honourific': None, 'lineage': None, 'family': 'Abidin'}}, {'id': 'berta.putri@fp.unila.ac.id', 'name': {'family': 'Berta', 'lineage': None, 'honourific': None, 'given': 'Putri'}}, {'id': 'siti.hudaidah@fp.unila.ac.id', 'name': {'given': 'Siti', 'honourific': None, 'family': 'Hudaidah', 'lineage': None}}]",article,TRUE,"THE PERFORMANCE OF MICROALGAE (NANNOCHLOROPSIS SP., TETRASELMIS SP. AND DUNALIELLA SP.) ON WHITE SHRIMP (LITOPENAEUS VANNAMEI) WASTEWATER CULTIVATION MEDIA",1.0,614,"[{'language': 'en', 'mime_type': 'application/pdf', 'rev_number': 1, 'format': 'text', 'docid': 158914, 'main': '21345-129186-1-PB.pdf', 'files': [{'uri': 'http://repository.lppm.unila.ac.id/id/file/431889', 'filename': '21345-129186-1-PB.pdf', 'filesize': 317845, 'objectid': 158914, 'mtime': '2022-01-18 03:45:00', 'hash_type': 'MD5', 'mime_type': 'application/pdf', 'hash': '8c95769d1492f2cd9330522df7b71adb', 'datasetid': 'document', 'fileid': 431889}], 'security': 'public', 'pos': 1, 'uri': 'http://repository.lppm.unila.ac.id/id/document/158914', 'eprintid': 37975, 'placement': 1}]",2022-01-18 07:21:11,https://www.e-journal.unair.ac.id/JAFH/article/view/21345,37975,archive,2022-01-18 07:21:11,1-9,show,2022-01-18 07:21:11,public,2301-7309,7,pub,Journal Of Aquaculture and Fish Health (JAFH),Airlangga University,['FP3'],disk0/00/03/79/75,11.0,"ABSTRACT

Microalgae have an important role in supporting the development of aquaculture because it can be used as natural feed. However, its culture requires an expensive cost because of the nutrient media. To reduce the cost, the media can be replaced by using wastewater from white shrimp (Litopenaeus vannamei) culture. This research was aimed to find out the performance of microalgae (Nannochloropsis sp., Tetraselmis sp. and Dunaliella sp.) cultured on white shrimp wastewater. The performance was measured by the growth, density, and ability to reduce nitrate and phosphate. The experimental design used in this study was a Completely Randomized Design with three treatments and three replications. The treatments were A (Nannochloropsis sp. cultured in white shrimp wastewater), B (Tetraselmis sp. cultured in white shrimp wastewater), and C (Dunaliella sp. cultured in white shrimp wastewater). The density population of Nannochloropsis sp., Tetraselmis sp. and Dunaliella sp. were tested by ANOVA. ANOVA was used to assess the density population of Nannochloropsis sp., Tetraselmis sp., and Dunaliella sp., which was then followed by Duncan's test. The results showed that wastewater from white shrimp aquaculture could be used as a medium culture for Nannochloropsis sp., Tetraselmis sp. and Dunaliella sp. It also maintain good water parameter quality in media. Nannochloropsis sp. was the microalgae that produced the highest density of  34.5 x 104 ind/mL when cultured on waste water from white shrimp culture. Nannochloropsis sp. may also reduce nitrate and phosphate content by up to 76 and 61.37 percent, respectively.",http://repository.lppm.unila.ac.id/id/eprint/37975,2022-02-08 00:00:00.000000000,['SH'],published,,,,,,,
4,"[{'id': 'agus.setyawan@fp.unila.ac.id', 'name': {'lineage': None, 'family': 'Setyawan', 'honourific': None, 'given': 'Agus'}}, {'name': {'given': 'Yeni', 'honourific': None, 'family': 'Elisdiana', 'lineage': None}, 'id': 'yeni.elisdiana@fp.unila.ac.id'}, {'id': None, 'name': {'given': 'Titi Khusnul', 'honourific': None, 'lineage': None, 'family': 'khotimah'}}]",conference_item,TRUE,Immobilisasi Bakteri Bioremediasi Dengan Matriks Natrium Alginat Sargassum sp. Untuk Mengurangi Limbah Budidaya Udang Vaname,,64,"[{'uri': 'http://repository.lppm.unila.ac.id/id/document/186686', 'pos': 1, 'security': 'public', 'placement': 1, 'eprintid': 47613, 'rev_number': 1, 'language': 'en', 'mime_type': 'application/pdf', 'main': '26. Semnaskan UGM 2022.pdf', 'docid': 186686, 'files': [{'datasetid': 'document', 'fileid': 521770, 'mime_type': 'application/pdf', 'hash': '75d874c178087aca6839fb9c78aa265e', 'objectid': 186686, 'filesize': 1183788, 'uri': 'http://repository.lppm.unila.ac.id/id/file/521770', 'filename': '26. Semnaskan UGM 2022.pdf', 'hash_type': 'MD5', 'mtime': '2023-01-05 04:52:39'}], 'format': 'text'}]",2023-01-05 07:46:43,,47613,archive,2023-01-05 07:46:43,79-85,show,2023-01-05 07:46:43,public,,10,pub,,,['FP3'],disk0_bak/00/04/76/13,,"Penelitian ini bertujuan untuk menganalisis efektivitas pemanfaatan natrium alginat sebagai matriks imobilisasi untuk meningkatkan viabilitas bakteri Bacillus coagulans dalam mendegradasi kandungan total ammonia nitrogen (TAN). Penelitian dilakukan pada bulan Januari-Maret 2021 di Laboratorium Budidaya Perikanan, Jurusan Perikanan dan Kelautan Fakultas Pertanian, Universitas Lampung. Rancangan percobaan terdiri dari 4 perlakuan yaitu kontrol, pemberian bakteri bioremediasi tanpa immobilisasi, pemberian bakteri bioremediasi terimobilisasi dan probiotik komersial (EM4) dengan 3 ulangan. Parameter yang diamati meliputi rendemen alginat, uji viabilitas bakteri, analisis kandungan (total ammonia nitrogen) TAN. Hasil penelitian menunjukkan   terdapat perbedaan pengaruh konsentrasi TAN pada masing-masing perlakuan (P<0,05) dan tingkat viabilitas bakteri lebih baik pada pemberian Bacillus coagulans terimobilisasi dan tanpa imobilisasi dibandingkan dengan dua perlakuan lainnya. Dengan demikian dapat disimpulkan bahwa imobilisasi bakteri Bacillus coagulans menggunakan natrium alginat Sargassum sp. efektif dalam meningkatkan aktivitas bakteri tersebut dalam mendegradasi TAN.",http://repository.lppm.unila.ac.id/id/eprint/47613,2022-11-01 00:00:00.000000000,['SH'],published,,paper,"['Budidaya Perairan, Unila', 'Budidaya Perairan, Unila', 'Budidaya Perairan, Unila']",Semnaskan UGM XIX,conference,,
5,"[{'name': {'given': 'Agus', 'honourific': None, 'lineage': None, 'family': 'Setyawan'}, 'id': 'agus.setyawan@fp.unila.ac.id'}, {'id': 'supono_unila@yahoo.com', 'name': {'given': 'Supono', 'family': 'Supono', 'lineage': None, 'honourific': None}}, {'id': 'hilma.putri@fp.unila.ac.id', 'name': {'given': 'Hilma Putri', 'honourific': None, 'family': 'Fidyandini', 'lineage': None}}, {'id': 'siti.hudaidah@fp.unila.ac.id', 'name': {'given': 'Siti', 'honourific': None, 'lineage': None, 'family': 'Hudaidah'}}, {'name': {'given': 'heidi', 'family': 'riana', 'lineage': None, 'honourific': None}, 'id': None}]",conference_item,TRUE,Effectiveness of using of brown algae alginate to immobilize the indigenous bioremediation bacteria for reducing waste water from shrimp culture,,333,"[{'mime_type': 'application/pdf', 'language': 'en', 'rev_number': 1, 'files': [{'mime_type': 'application/pdf', 'hash': '4ce10941d91e780958eea868890e20bf', 'datasetid': 'document', 'fileid': 508185, 'mtime': '2022-10-21 08:26:24', 'hash_type': 'MD5', 'uri': 'http://repository.lppm.unila.ac.id/id/file/508185', 'filename': 'IOP Khairun Univ.pdf', 'filesize': 876479, 'objectid': 184684}], 'main': 'IOP Khairun Univ.pdf', 'docid': 184684, 'format': 'text', 'pos': 1, 'uri': 'http://repository.lppm.unila.ac.id/id/document/184684', 'security': 'public', 'placement': 1, 'eprintid': 45874}]",2022-10-24 03:48:40,https://iopscience.iop.org/article/10.1088/1755-1315/890/1/012015,45874,archive,2022-10-24 03:48:40,1-7,show,2022-10-24 03:48:40,public,,8,pub,,,['FP3'],disk0/00/04/58/74,,"Abstract. Bacillus coagulans T1.2, an indigenous bacterium from shrimp ponds in East Lampung, has been found to reduce total ammonia nitrogen (TAN). The purpose of this study was to know the effectivity of immobilization of bacterial by sodium alginate from marine brown algae to reduce wastewater pollution from shrimp culture. The brown algae, Sargassum sp. and Padina sp., were collected from Pesisir Barat and Ketapang beach, Lampung. Alginate was extracted from both Sargassum and Padina by alkali method. The bacterial immobilization beads were made by mixed Bacillus coagulans suspension with alginate (1:3 v/v) and formed beads by 1,5 ml syringe without needle. In the in vitro study, the immobilized bacteria were submerged in artificial wastewater (2 beads ml-1) and incubated for 20 days. The control group includes the same bacteria without immobilization. The TAN was measured and the viability of bacteria was evaluated after the incubation period. The results showed that using alginate from Sargassum sp. and Padina sp. as a matrix of immobilization indigenous bacterial Bacillus coagulans effectively and significantly reduce the content of Total Ammonia Nitrogen (TAN) in wastewater. The viability of bacteria immobilized with the alginate of Sargassum sp. and Padina sp. better than the bacterial treatment without immobilization. 
1",http://repository.lppm.unila.ac.id/id/eprint/45874,1970-01-01 00:00:00.000002022,['SH'],published,,paper,,2nd International Conference on Fisheries and Marine,conference,15 Juli 2021,"Khairun University, Ternate"
6,"[{'id': 'agus.setyawan@fp.unila.ac.id', 'name': {'family': 'Setyawan', 'lineage': None, 'honourific': None, 'given': 'Agus'}}, {'name': {'given': 'Supono', 'family': 'Supono', 'lineage': None, 'honourific': None}, 'id': 'supono_unila@yahoo.com'}, {'id': 'siti.hudaidah@fp.unila.ac.id', 'name': {'given': 'Siti', 'honourific': None, 'family': 'Hudaidah', 'lineage': None}}, {'id': 'hilma.putri@fp.unila.ac.id', 'name': {'given': 'Hilma Putri', 'honourific': None, 'lineage': None, 'family': 'Fidyandini'}}]",conference_item,TRUE,"Non-specific immune response of Pacific white
shrimp
Litopenaeus vannamei by supplementation
of sodium alginate of
Sargassum collected from
Lampung Indonesia",,333,"[{'placement': 1, 'eprintid': 45875, 'uri': 'http://repository.lppm.unila.ac.id/id/document/184685', 'pos': 1, 'security': 'public', 'files': [{'uri': 'http://repository.lppm.unila.ac.id/id/file/508193', 'filename': 'IOP Khairun Univ.pdf', 'filesize': 876479, 'objectid': 184685, 'mtime': '2022-10-21 08:48:27', 'hash_type': 'MD5', 'hash': '4ce10941d91e780958eea868890e20bf', 'mime_type': 'application/pdf', 'fileid': 508193, 'datasetid': 'document'}], 'main': 'IOP Khairun Univ.pdf', 'docid': 184685, 'format': 'text', 'language': 'en', 'rev_number': 1, 'mime_type': 'application/pdf'}]",2022-10-24 03:48:44,https://iopscience.iop.org/article/10.1088/1755-1315/890/1/012015,45875,archive,2022-10-24 03:48:44,1-7,show,2022-10-24 03:48:44,public,,9,pub,,,['FP3'],disk0/00/04/58/75,,"Abstract. This study aims to determine the effectiveness of supplementation of sodium (Na)
alginate Sargassum sp. from Lampung waters to enhance the non-specific immune response
and the resistence of Pacific white shrimp (Litopenaeus vannamei) against white spot disease.
This study used a completely randomized design with 3 treatments, namely feeding without
alginate supplementation (A) or control, dietary Na alginate Sargassum supplementation at a
dose of 2.0 (B), and 4.0 g kg-1 feed (C), each with four replications, for 14 days. Hemolymph
sampling was performed on days 0, 7 and 14 to observe the parameter of shrimp hematology
included total haemocyte count (THC), phagocytocyte activity (PA), phagocytic index (PI),
and total plasma protein (TPP). The hepatopancreas histology profile and water quality were
observed at the end of treatment. Data were analyzed by Anova at 95% of confidence interval
and continued with Duncan test. Result showedthat the supplementation of Na alginat from
Sargassum sp. significantly enhance several shrimp immune response namely THC, PA, and
TPP. Meanwhile, the histology of the hepatopancreas of both shrimp treatment and control
showed not significantly effect on tissue damage. The water quality was still in normal
condition during the treatment. The results of this study indicate that the application of
Sargassum alginate supplementation at a dose of 2gr / kg of feed is the best treatment to
enhance the immune response of Pacific white shrimp",http://repository.lppm.unila.ac.id/id/eprint/45875,1970-01-01 00:00:00.000002022,['SH'],published,,paper,,2nd International Conference on Fisheries and Marine,conference,15 Juli 2021,"Khairun University, Ternate"
7,"[{'name': {'given': 'Agus', 'lineage': None, 'family': 'Setyawan', 'honourific': None}, 'id': 'agus.setyawan@fp.unila.ac.id'}, {'name': {'family': 'Supono', 'lineage': None, 'honourific': None, 'given': 'Supono'}, 'id': 'supono_unila@yahoo.com'}, {'name': {'given': 'Arlin', 'honourific': None, 'family': 'Wijayanti', 'lineage': None}, 'id': None}, {'name': {'given': 'Ussy Tri', 'family': 'Anti', 'lineage': None, 'honourific': None}, 'id': None}]",conference_item,TRUE,Effectiveness of using of brown algae alginate to immobilize the indigenous bioremediation bacteria for reducing waste water from shrimp culture,,333,"[{'main': 'IOP Trepsea 2022.pdf', 'docid': 184681, 'files': [{'fileid': 508165, 'datasetid': 'document', 'mime_type': 'application/pdf', 'hash': 'f7cbe4fd176b1f5517e1be8353d1d00f', 'objectid': 184681, 'filesize': 1389658, 'filename': 'IOP Trepsea 2022.pdf', 'uri': 'http://repository.lppm.unila.ac.id/id/file/508165', 'hash_type': 'MD5', 'mtime': '2022-10-21 07:56:46'}], 'format': 'text', 'mime_type': 'application/pdf', 'language': 'en', 'rev_number': 1, 'placement': 1, 'eprintid': 45870, 'pos': 1, 'uri': 'http://repository.lppm.unila.ac.id/id/document/184681', 'security': 'public'}]",2022-10-24 03:48:38,https://iopscience.iop.org/article/10.1088/1755-1315/1027/1/012010,45870,archive,2022-10-24 03:48:38,1-8,show,2022-10-24 03:48:38,public,,8,pub,,,['FP3'],disk0/00/04/58/70,,"Abstract. Bacillus coagulans T1.2, an indigenous bacterium from shrimp ponds in East Lampung, has been found to reduce total ammonia nitrogen (TAN). The purpose of this study was to know the effectivity of immobilization of bacterial by sodium alginate from marine brown algae to reduce wastewater pollution from shrimp culture. The brown algae, Sargassum sp. and Padina sp., were collected from Pesisir Barat and Ketapang beach, Lampung. Alginate was extracted from both Sargassum and Padina by alkali method. The bacterial immobilization beads were made by mixed Bacillus coagulans suspension with alginate (1:3 v/v) and formed beads by 1,5 ml syringe without needle. In the in vitro study, the immobilized bacteria were submerged in artificial wastewater (2 beads ml-1) and incubated for 20 days. The control group includes the same bacteria without immobilization. The TAN was measured and the viability of bacteria was evaluated after the incubation period. The results showed that using alginate from Sargassum sp. and Padina sp. as a matrix of immobilization indigenous bacterial Bacillus coagulans effectively and significantly reduce the content of Total Ammonia Nitrogen (TAN) in wastewater. The viability of bacteria immobilized with the alginate of Sargassum sp. and Padina sp. better than the bacterial treatment without immobilization. 
1",http://repository.lppm.unila.ac.id/id/eprint/45870,1970-01-01 00:00:00.000002022,['SH'],published,,paper,,TREPSEA-2021,conference,16-18b September2021,Bandar Lampung
