,creators,type,refereed,title,number,userid,documents,lastmod,official_url,eprintid,eprint_status,datestamp,pagerange,metadata_visibility,status_changed,full_text_status,issn,rev_number,ispublished,publication,publisher,divisions,dir,volume,abstract,uri,date,subjects,date_type,id_number,pres_type,corp_creators,event_title,event_type,event_dates,event_location
16,"[{'name': {'honourific': None, 'lineage': None, 'family': 'Supono', 'given': 'Supono'}, 'id': 'supono_unila@yahoo.com'}, {'id': 'munti.sarida@fp.unila.ac.id', 'name': {'given': 'Munti', 'honourific': None, 'lineage': None, 'family': 'Sarida'}}, {'name': {'lineage': None, 'family': 'suari', 'honourific': None, 'given': 'Putri Indah'}, 'id': None}]",article,TRUE,PENGARUH PENAMBAHAN MINERAL KALIUM (K) PADA MEDIA KULTUR SALINITAS RENDAH TERHADAP PERFORMA UDANG VANAME Litopenaeus vannamei,2.0,333,"[{'security': 'public', 'pos': 1, 'uri': 'http://repository.lppm.unila.ac.id/id/document/189374', 'eprintid': 49735, 'placement': 1, 'language': 'en', 'rev_number': 1, 'mime_type': 'application/pdf', 'format': 'text', 'files': [{'hash': 'ad39b0ad69f00fe0948654ca18886dc2', 'mime_type': 'application/pdf', 'datasetid': 'document', 'fileid': 538925, 'mtime': '2023-04-06 02:04:37', 'hash_type': 'MD5', 'filename': 'Jurnal Agroqua.pdf', 'uri': 'http://repository.lppm.unila.ac.id/id/file/538925', 'objectid': 189374, 'filesize': 598389}], 'main': 'Jurnal Agroqua.pdf', 'docid': 189374}]",2023-04-06 02:25:35,https://journals.unihaz.ac.id/index.php/agroqua/article/view/2947/1426,49735,archive,2023-04-06 02:25:35,339-346,show,2023-04-06 02:25:35,public,0216-6585 (Print),6,pub,Agroqua,"University of Prof. Dr. Hazairin, SH",['FP3'],disk0_bak/00/04/97/35,20.0,"Potassium (K)  is one of the important ions in low-salinity shrimp culture, which has functions of maintaining electrolyte balance, conduction of nerve impulses, and releasing energy from protein, fat, and carbohydrate. This research aimed to study and determine the proper concentration of potassium as an additive ion to enhance the growth and survival rate  of vaname shrimp (Litopenaeus vannamei).  Potassium was added to the rearing media with the salinity of  5 ppt in different concentrations (0, 50, 100, and 150 mg/L), with three replicates of treatment. The shrimp in size of post-larvae (PL)10 reared for 40 days in the treatment’s media with the stocking density of 140 shrimp (2000 shrimp/m3). The results of this study showed that potassium administration in low-salinity media has a significant effect on the growth performance and survival rate of shrimp. Potassium administration at a concentration of 100 mg/L resulted in better vaname performance than other treatments (P < 0.05) based on absolute weight, specific growth rate, feed conversion ratio, and survival rate Keywords:  feed coversion ratio, growth, post-larvae, survival rate",http://repository.lppm.unila.ac.id/id/eprint/49735,2022-12-01 00:00:00.000000000,['SH'],published,,,,,,,
17,"[{'id': 'supono_unila@yahoo.com', 'name': {'honourific': None, 'lineage': None, 'family': 'Supono', 'given': 'Supono'}}, {'name': {'given': 'Agus', 'honourific': None, 'lineage': None, 'family': 'Setyawan'}, 'id': 'agus.setyawan@fp.unila.ac.id'}, {'name': {'given': 'Deny Sapto Chondro', 'honourific': None, 'family': 'Utomo', 'lineage': None}, 'id': 'deny.utomo@fp.unila.ac.id'}]",article,TRUE,"PERFORMA UDANG VANAME (Litopenaeus vannamei) YANG IBUDIDAYAKAN
DENGAN SISTEM GREEN WATER DAN BROWN WATER BIOFLOC",2.0,333,"[{'security': 'public', 'pos': 1, 'uri': 'http://repository.lppm.unila.ac.id/id/document/185430', 'eprintid': 46553, 'placement': 1, 'mime_type': 'application/pdf', 'language': 'en', 'rev_number': 1, 'format': 'text', 'docid': 185430, 'main': '260-Article (Barakuda).pdf', 'files': [{'datasetid': 'document', 'fileid': 513286, 'hash': '22e049e024993279e3680146eae1b8bc', 'mime_type': 'application/pdf', 'objectid': 185430, 'filesize': 607522, 'filename': '260-Article (Barakuda).pdf', 'uri': 'http://repository.lppm.unila.ac.id/id/file/513286', 'hash_type': 'MD5', 'mtime': '2022-11-12 13:06:03'}]}]",2022-11-14 03:26:32,https://jurnal.publikasi-untagcirebon.ac.id/index.php/barakuda45/article/view/260,46553,archive,2022-11-14 03:26:32,132-140,show,2022-11-14 03:26:32,public,2656-7474,6,pub,Barakuda 45,Universitas  17 Agustus 1945 Cirebon,['FP3'],disk0/00/04/65/53,4.0,"Vannamei shrimp (Litopenaeus vannamei) is one of the mainstay commodities that can
increase the country's foreign exchange because it has a fairly high selling value in the global
market. Several problems in aquaculture can reduce vaname shrimp production such as
disease, water quality degradation, and high feed conversion values. Biofloc is an alternative
technology that can be applied to overcome the problems in shrimp farming. There are two
types of biofloc technology, namely green water biofloc and brown water biofloc. This study
aimed to study the effect of the application of the two biofloc systems on growth, survival rate,
and feed conversion ratio of vaname shrimp. This study used a completely randomized design
consisting of 3 treatments with 3 replications. The treatments were: (A) control, (B) green
water biofloc, and (C) brown water biofloc. Shrimp rearing was carried out for 30 days,
using a container with a volume of 70 liters of water. Each treatment unit was filled with 70
PL 10 fry, equivalent to 1 PL/liter. The results showed that the type of biofloc system affected
the growth and feed conversion ratio of vaname shrimp, but had no effect on the survival rateof vaname shrimp. Green water biofloc produces better growth and feed conversion than brown water biofloc and control",http://repository.lppm.unila.ac.id/id/eprint/46553,2022-11-01 00:00:00.000000000,['SH'],published,https://doi.org/10.47685/barakuda45.v4i2.260,,,,,,
18,"[{'id': 'supono_unila@yahoo.com', 'name': {'given': 'Supono', 'honourific': None, 'lineage': None, 'family': 'Supono'}}, {'name': {'given': 'Agus', 'lineage': None, 'family': 'Setyawan', 'honourific': None}, 'id': 'agus.setyawan@fp.unila.ac.id'}, {'id': 'deny.utomo@fp.unila.ac.id', 'name': {'family': 'Utomo', 'lineage': None, 'honourific': None, 'given': 'Deny Sapto Chondro'}}, {'name': {'given': 'Mega', 'lineage': None, 'family': 'Cania', 'honourific': None}, 'id': None}]",article,TRUE,"PERFORMA UDANG VANAME (Litopenaeus vannamei) YANG DIBUDIDAYAKAN
DENGAN SISTEM GREEN WATER DAN BROWN WATER BIOFLOC",2.0,333,"[{'files': [{'mime_type': 'application/pdf', 'hash': '22e049e024993279e3680146eae1b8bc', 'datasetid': 'document', 'fileid': 522134, 'uri': 'http://repository.lppm.unila.ac.id/id/file/522134', 'filename': 'Jurnal Barakuda.pdf', 'filesize': 607522, 'objectid': 186745, 'mtime': '2023-01-10 03:13:03', 'hash_type': 'MD5'}], 'main': 'Jurnal Barakuda.pdf', 'docid': 186745, 'format': 'text', 'rev_number': 1, 'language': 'en', 'mime_type': 'application/pdf', 'placement': 1, 'eprintid': 47661, 'uri': 'http://repository.lppm.unila.ac.id/id/document/186745', 'pos': 1, 'security': 'public'}]",2023-01-10 04:02:06,https://jurnal.publikasi-untagcirebon.ac.id/index.php/barakuda45/article/view/260/198,47661,archive,2023-01-10 04:02:06,132-140,show,2023-01-10 04:02:06,public,2656-7474,8,pub,Barakuda 45,Universitas  17 Agustus 1945 Cirebon,['FP3'],disk0_bak/00/04/76/61,4.0,"Udang vaname (Litopenaeus vannamei) merupakan salah satu komoditas andalan yang dapat
meningkatkan devisa negara karena memiliki nilai jual yang cukup tinggi di pasar global.
Beberapa permasalahan dalam budidaya dapat menurunkan produksi udang vaname seperti
penyakit, degradasi kualitas air, dan tingginya nilai konversi pakan. Biofloc merupakan salah
satu alternatif teknologi yang dapat diaplikasikan untuk mengatasi permasalahan dalam
budidaya udang tersebut. Teknologi biofloc ada dua jenis yaitu green water biofloc dan brown
water biofloc. Penelitian ini bertujuan untuk mempelajari pengaruh penerapan kedua sistem
biofloc tersebut terhadap pertumbuhan, tingkat kelangsungan hidup, dan konversi pakan
udang vaname. Penelitian ini menggunakan rancangan acak lengkap yang terdiri dari 3
perlakuan dengan 3 ulangan. Perlakuan tersebut adalah: (A) control, (B) green water biofloc,
dan (C) brown water biofloc. Pemeliharaan udang dilakukan selama 30 hari, menggunakan
wadah dengan volume air 70 liter. Setiap unit perlakuan diisi dengan 70 ekor benur PL 10
setara dengan 1 ekor/liter. Hasil penelitian menunjukkan bahwa tipe sistem biofloc
berpengaruh terhadap pertumbuhan dan konversi pakan udang vaname, namun tidak
berpengaruh terhadap tingkat kelulushidupan udang vaname. Green water biofloc
menghasilkan pertumbuhan dan konversi pakan yang lebih baik dibandingkan brown water
biofloc dan kontrol.
Kata Kunci: pertumbuhan, tingkat kelangsungan hidup, konversi pakan, penyakit, tipe biofloc",http://repository.lppm.unila.ac.id/id/eprint/47661,2022-11-01 00:00:00.000000000,['SH'],published,https://doi.org/10.47685/barakuda45.v4i2.260,,,,,,
