,creators,type,refereed,title,number,userid,documents,lastmod,official_url,eprintid,eprint_status,datestamp,pagerange,metadata_visibility,status_changed,full_text_status,issn,rev_number,ispublished,publication,publisher,divisions,dir,volume,abstract,uri,date,subjects,date_type,id_number,pres_type,corp_creators,event_title,event_type,event_dates,event_location
8,"[{'id': 'supono_unila@yahoo.com', 'name': {'honourific': None, 'family': 'Supono', 'lineage': None, 'given': 'Supono'}}]",other,,Budidaya Udang Salinitas Rendah Solusi Budidaya untuk Lahan Kritis,,333,"[{'eprintid': 42980, 'placement': 1, 'security': 'public', 'uri': 'http://repository.lppm.unila.ac.id/id/document/164793', 'pos': 1, 'format': 'text', 'main': 'HaKI buku.pdf', 'files': [{'datasetid': 'document', 'fileid': 470492, 'hash': 'c271335162643455c6123e8d05eefd7a', 'mime_type': 'application/pdf', 'hash_type': 'MD5', 'mtime': '2022-07-05 11:47:21', 'filesize': 2069684, 'objectid': 164793, 'filename': 'HaKI buku.pdf', 'uri': 'http://repository.lppm.unila.ac.id/id/file/470492'}], 'docid': 164793, 'mime_type': 'application/pdf', 'language': 'en', 'rev_number': 1}]",2022-07-06 01:15:28,,42980,archive,2022-07-06 01:15:28,,show,2022-07-06 01:15:28,public,,8,pub,,Graha Ilmu,['FP3'],disk0/00/04/29/80,,"Salah satu faktor penentu keberhasilan budidaya udang adalah manajemen kualitas air.  Daerah yang mengalami  keterbatasan lahan karena degradasi kualitas air mengalami kesulitan dalam mengembangkan budidaya udang.  Budidaya udang vaname menjadi salah satu solusi untuk mengatasi permasalahan tersebut.  Budidaya udang vaname dengan menggunakan air bersalinitas rendah (inland shrimp culture) sangat memungkinkan karena spesies ini termasuk eurihalin, yaitu toleran terhadap rentang salinitas yang luas. Sistem ini lebih ramah lingkungan karena dilakukan jauh dari pesisir laut sehingga tidak merusak ekosistem pesisir terutama hutan bakau. 
Buku Budidaya Udang  Vaname Salintas Rendah, Solusi untuk Budidaya di Lahan Kritis ini  berisi tentang prinsip budidaya udang, daya dukung lingkungan, biologi vaname, keunggulan udang vaname, budidaya udang vaname salinitas baik skala lab lapang maupun tambak komersial, standard operating procedure (SOP), penyakit udang, penanganan penyakit dengan herbal, serta budidaya udang vaname skala rumah tangga. Buku ini juga dilengkapi dengan analisis ekonomi budidaya udang vaname  dengan salinitas rendah skala semi intensif.     Buku ini dapat dijadikan rujukan  bagi akademisi, mahasiswa,  dan  praktisi budidaya  udang  yang ingin mendalami  tentang budidaya udang vaname terutama budidaya dengan menggunakan salinitas rendah.",http://repository.lppm.unila.ac.id/id/eprint/42980,1970-01-01 00:00:00.000002022,['SH'],published,,,,,,,
9,"[{'id': 'supono_unila@yahoo.com', 'name': {'given': 'Supono', 'honourific': None, 'lineage': None, 'family': 'Supono'}}, {'id': 'yeni.elisdiana@fp.unila.ac.id', 'name': {'given': 'Yeni', 'lineage': None, 'family': 'Elisdiana', 'honourific': None}}, {'name': {'family': 'Mulyaningsih', 'lineage': None, 'honourific': None, 'given': 'siti Ning'}, 'id': None}]",article,TRUE,"EFEKTIVITAS EKSTRAK MANGROVE Rhizophora apiculata (Tomlinson, 1986) DALAM MENGHAMBAT Vibrio parahaemolyticus PENYEBAB PENYAKIT PADA UDANG VANAME Litopenaeus vannamei (Boone, 1931)",2.0,333,"[{'security': 'public', 'pos': 1, 'uri': 'http://repository.lppm.unila.ac.id/id/document/186725', 'eprintid': 47652, 'placement': 1, 'language': 'en', 'rev_number': 1, 'mime_type': 'application/pdf', 'format': 'text', 'main': 'JARI Des 2022.pdf', 'docid': 186725, 'files': [{'datasetid': 'document', 'fileid': 522038, 'mime_type': 'application/pdf', 'hash': '2ea0cedeb07cf0f45971ae97754745d6', 'hash_type': 'MD5', 'mtime': '2023-01-09 03:21:55', 'filesize': 476319, 'objectid': 186725, 'uri': 'http://repository.lppm.unila.ac.id/id/file/522038', 'filename': 'JARI Des 2022.pdf'}]}]",2023-01-09 07:27:26,https://ejournal.unsri.ac.id/index.php/jari/article/view/18678,47652,archive,2023-01-09 07:27:26,199-211,show,2023-01-09 07:27:26,public,ISSN : 2303-2960,6,pub,"Jurnal Akuakultur Rawa Indonesia,",Universitas Sriwijaya,['FP3'],disk0_bak/00/04/76/52,10.0,"Vaname (L. vannamei) shrimp cultivation is currently experiencing problems, one of which is disease caused by Vibrio bacteria, especially Vibrio parahaemolyticus. This type of vibrio is the cause of white feces disease and AHPND in shrimp. Disease control due to Vibrio can be done by utilizing plants that have active compounds as natural antibacterials that are environmentally friendly. Mangrove plants have several active compounds that have great potential as antibacterial. This study aimed to examine some parts of the mangrove plant Rhizophora. apiculata in inhibiting the activity of V. parahaemolyticus. Three parts of the mangrove plant, namely: roots, stems, and leaves were extracted using methanol 96%. The three extracts were tested for their antibacterial activity against V. parahaemolyticus by several tests such as phytochemical, sensitivity, zone of inhibition, best dose, and toxicity tests. The test results showed that R. apiculata mangrove stem extract had the greatest ability to inhibit V. parahaemolyticus with an effectiveness value of 15.85% with the best dose of 200 mg/L. Toxicity testing using vaname shrimp larvae extract showed that mangrove stems were non-toxic with an LC50 value of 2,155.5 mg/L 
 
Keywords: Growth, White feces disease, AHPND, active compounds, extracts, antibacterials",http://repository.lppm.unila.ac.id/id/eprint/47652,2022-12-01 00:00:00.000000000,['SH'],published,10.36706/jari.v10i2.18678,,,,,,
10,"[{'id': 'supono_unila@yahoo.com', 'name': {'lineage': None, 'family': 'Supono', 'honourific': None, 'given': 'Supono'}}, {'name': {'honourific': None, 'family': 'Sarida', 'lineage': None, 'given': 'Munti'}, 'id': 'munti.sarida@fp.unila.ac.id'}, {'id': None, 'name': {'given': 'Rehulina', 'lineage': None, 'family': 'Pinem', 'honourific': None}}]",article,TRUE,The growth performance of the Pacific white shrimp (Litopenaeus vannamei) cultured at various salinity conditions using single step acclimation,2.0,333,"[{'docid': 163455, 'main': 'Vaname Bioflux.pdf', 'files': [{'hash': '4d20787e4264f9b4afc5ad3ceacb3bf7', 'mime_type': 'application/pdf', 'datasetid': 'document', 'fileid': 461624, 'uri': 'http://repository.lppm.unila.ac.id/id/file/461624', 'filename': 'Vaname Bioflux.pdf', 'filesize': 418785, 'objectid': 163455, 'mtime': '2022-05-24 07:40:23', 'hash_type': 'MD5'}], 'format': 'text', 'language': 'en', 'mime_type': 'application/pdf', 'rev_number': 1, 'placement': 1, 'eprintid': 41787, 'pos': 1, 'uri': 'http://repository.lppm.unila.ac.id/id/document/163455', 'security': 'public'}]",2022-05-24 08:59:59,file:///C:/Users/User/Downloads/Documents/2022.1061-1066_2.pdf,41787,archive,2022-05-24 08:59:59,1061-1066,show,2022-05-24 08:59:59,public,1844-9166,6,pub,AACL Bioflux,Bioflux,['FP3'],disk0/00/04/17/87,15.0,"The Pacific white shrimp (Litopenaeus vannamei) is a euryhaline species that can be reared in aquatic environments with a wide range of salinity, from 0.5 to 40 ppt. The ability of Pacific white shrimps to adapt to extreme saline conditions allows the expansion of shrimp farming in inland aquatic environments, away from the coast. Therefore, this study aimed to analyze the specific growth rate (SGR), survival rate (SR), and feed conversion ratio (FCR) of Pacific white shrimp reared at various salinity levels using a single-step acclimation method. The study employed a completely randomized design with five treatments and three replications, namely T1, T2, T3, T4, and T5 at 5 ppt, 10 ppt, 15 ppt, 20 ppt, and 25 ppt, respectively. Each treatment unit was incorporated with Pacific white shrimp postlarvae (PL) 15 at a density of 2000 PL m-3. Subsequently, the shrimps were fed commercial pellets three times daily through a blind feeding program during the 40 days of rearing. The results showed that different salinities of culture media had an effect on SGR, SR, and FCR of Pacific white shrimp. The most desirable SGR and FCR were observed in the 15 ppt culture media at 12.3% and 1.5, respectively, while the best survival rate was observed in the 20 ppt salinity at 79.3%. Generally, Pacific white shrimp performed best in the culture media with a salinity of 15 ppt. Key Words: euryhaline, growth, L. vannamei, survival rate",http://repository.lppm.unila.ac.id/id/eprint/41787,2022-04-01 00:00:00.000000000,['SH'],published,,,,,,,
11,"[{'name': {'given': 'Supono', 'lineage': None, 'family': 'Supono', 'honourific': None}, 'id': 'supono_unila@yahoo.com'}, {'name': {'honourific': None, 'family': 'Sarida', 'lineage': None, 'given': 'Munti'}, 'id': 'munti.sarida@fp.unila.ac.id'}, {'name': {'honourific': None, 'family': 'Pinem', 'lineage': None, 'given': 'Rehulina'}, 'id': None}]",article,TRUE,The growth performance of the Pacific white shrimp (Litopenaeus vannamei) cultured at various salinity conditions using single step acclimation,2.0,333,"[{'security': 'public', 'uri': 'http://repository.lppm.unila.ac.id/id/document/163456', 'pos': 1, 'eprintid': 41788, 'placement': 1, 'mime_type': 'application/pdf', 'language': 'en', 'rev_number': 1, 'format': 'text', 'files': [{'filename': 'Vaname Bioflux.pdf', 'uri': 'http://repository.lppm.unila.ac.id/id/file/461630', 'objectid': 163456, 'filesize': 418785, 'mtime': '2022-05-24 08:05:04', 'hash_type': 'MD5', 'hash': '4d20787e4264f9b4afc5ad3ceacb3bf7', 'mime_type': 'application/pdf', 'datasetid': 'document', 'fileid': 461630}], 'main': 'Vaname Bioflux.pdf', 'docid': 163456}]",2022-05-24 09:00:01,http://www.bioflux.com.ro/docs/2022.1061-1066.pdf,41788,archive,2022-05-24 09:00:01,1061-1066,show,2022-05-24 09:00:01,public,1844-9166,10,pub,AACL Bioflux,Bioflux,['FP3'],disk0/00/04/17/88,15.0,"The Pacific white shrimp (Litopenaeus vannamei) is a euryhaline species that can be reared in aquatic environments with a wide range of salinity, from 0.5 to 40 ppt. The ability of Pacific white shrimps to adapt to extreme saline conditions allows the expansion of shrimp farming in inland aquatic environments, away from the coast. Therefore, this study aimed to analyze the specific growth rate (SGR), survival rate (SR), and feed conversion ratio (FCR) of Pacific white shrimp reared at various salinity levels using a single-step acclimation method. The study employed a completely randomized design with five treatments and three replications, namely T1, T2, T3, T4, and T5 at 5 ppt, 10 ppt, 15 ppt, 20 ppt, and 25 ppt, respectively. Each treatment unit was incorporated with Pacific white shrimp postlarvae (PL) 15 at a density of 2000 PL m-3. Subsequently, the shrimps were fed commercial pellets three times daily through a blind feeding program during the 40 days of rearing. The results showed that different salinities of culture media had an effect on SGR, SR, and FCR of Pacific white shrimp. The most desirable SGR and FCR were observed in the 15 ppt culture media at 12.3% and 1.5, respectively, while the best survival rate was observed in the 20 ppt salinity at 79.3%. Generally, Pacific white shrimp performed best in the culture media with a salinity of 15 ppt. Key Words: euryhaline, growth, L. vannamei, survival rate.",http://repository.lppm.unila.ac.id/id/eprint/41788,2022-04-01 00:00:00.000000000,['SH'],published,,,,,,,
12,"[{'name': {'given': 'Supono', 'lineage': None, 'family': 'Supono', 'honourific': None}, 'id': 'supono_unila@yahoo.com'}, {'name': {'given': 'Munti', 'family': 'Sarida', 'lineage': None, 'honourific': None}, 'id': 'munti.sarida@fp.unila.ac.id'}, {'id': None, 'name': {'given': 'Destriyana', 'honourific': None, 'lineage': None, 'family': 'puspitasari'}}]",article,TRUE,PENGARUH PENAMBAHAN KALSIUM PADA MEDIA KULTUR SALINITAS RENDAH TERHADAP PERFORMA UDANG VANAME Litopenaeus vannamei,2.0,333,"[{'pos': 1, 'uri': 'http://repository.lppm.unila.ac.id/id/document/186728', 'security': 'public', 'placement': 1, 'eprintid': 47655, 'rev_number': 1, 'language': 'en', 'mime_type': 'application/pdf', 'main': 'JTMS.pdf', 'files': [{'mtime': '2023-01-09 05:48:27', 'hash_type': 'MD5', 'filename': 'JTMS.pdf', 'uri': 'http://repository.lppm.unila.ac.id/id/file/522061', 'objectid': 186728, 'filesize': 210906, 'mime_type': 'application/pdf', 'hash': '9e8c6b5e1fd7ef9349c58ccb73875a72', 'datasetid': 'document', 'fileid': 522061}], 'docid': 186728, 'format': 'text'}]",2023-01-09 07:27:31,https://journal.ubb.ac.id/index.php/jtms/article/view/3214,47655,archive,2023-01-09 07:27:31,90-97,show,2023-01-09 07:27:31,public,2623-2235,6,pub,Journal of Tropical Marine Science,"Fakultas Pertanian Perikanan dan Biologi, Universitas Bangka Belitung",['FP3'],disk0_bak/00/04/76/55,5.0,"Kalsium merupakan salah satu makromineral yang berperan penting dalam proses pengerasan kulit udang pasca molting. Pada tambak salinitas rendah, sering mengalami kekurangan kalsium yang dapat berdampak pada kegagalan molting udang bahkan menyebabkan kematian. Penelitian ini bertujuan untuk mengkaji pertumbuhan, tingkat kelangsungan hidup, dan rasio konversi pakan udang vaname (Litopenaeus vannamei) yang dipelihara pada media kultur salinitas rendah dengan penambahan konsentrasi mineral kalsium berbeda. Penelitian ini dilakukan pada media bersalinitas 5 ppt, menggunakan rancangan acak lengkap (RAL) dengan 4 perlakuan dan 3 ulangan. Perlakuan tersebut berupa penambahan makromineral kalsium yang berbeda, yaitu: A (0 mg/L), B (50 mg/L), C (100 mg/L), dan D (150 mg/L). Hasil penelitian menunjukkan bahwa penambahan kalsium yang berbeda pada media salinitas rendah berpengaruh terhadap pertumbuhan, tingkat kelangsungan hidup, dan rasio konversi pakan udang vaname. Pertumbuhan terbaik terjadi pada perlakuan penambahan kalsium 0 mg/L (kontrol) yaitu sebesar 0,56±0,18 g, sementara tingkat kelangsungan hidup dan konversi pakan terbaik terjadi pada perlakuan 50 mg/L yaitu 54,3±0,38% dan 1,4±0,1.",http://repository.lppm.unila.ac.id/id/eprint/47655,2022-10-01 00:00:00.000000000,['SH'],published,https://doi.org/10.33019/jour.trop.mar.sci.v5i2.3214,,,,,,
13,"[{'id': 'supono_unila@yahoo.com', 'name': {'given': 'Supono', 'honourific': None, 'family': 'Supono', 'lineage': None}}, {'name': {'given': 'Munti', 'lineage': None, 'family': 'Sarida', 'honourific': None}, 'id': 'munti.sarida@fp.unila.ac.id'}, {'id': None, 'name': {'given': 'Destriyana', 'family': 'puspitasari', 'lineage': None, 'honourific': None}}]",article,TRUE,Pengaruh Penambahan Kalsium Pada Media Kultur Salinitas Rendah Terhadap Performa Udang Vaname Litopenaeus vannamei,2.0,333,"[{'rev_number': 1, 'language': 'en', 'mime_type': 'application/pdf', 'main': 'JTMS.pdf', 'files': [{'fileid': 510031, 'datasetid': 'document', 'mime_type': 'application/pdf', 'hash': '9e8c6b5e1fd7ef9349c58ccb73875a72', 'hash_type': 'MD5', 'mtime': '2022-10-31 06:55:28', 'objectid': 184942, 'filesize': 210906, 'filename': 'JTMS.pdf', 'uri': 'http://repository.lppm.unila.ac.id/id/file/510031'}], 'docid': 184942, 'format': 'text', 'uri': 'http://repository.lppm.unila.ac.id/id/document/184942', 'pos': 1, 'security': 'public', 'placement': 1, 'eprintid': 46114}]",2022-10-31 07:08:37,file:///C:/Users/User/Downloads/Documents/3214-Article%20Text-10403-1-10-20221027_3.pdf,46114,archive,2022-10-31 07:08:37,90-97,show,2022-10-31 07:08:37,public,2623-2227,7,pub,Journal of  tropical marine Science,Universitas Bangka Belitung,['FP3'],disk0/00/04/61/14,5.0,"Abstrak 
 
Kalsium merupakan salah satu makromineral yang berperan penting dalam proses pengerasan kulit udang pasca molting.  Pada tambak salinitas rendah, sering mengalami kekurangan kalsium yang dapat berdampak pada kegagalan molting udang bahkan menyebabkan kematian.  Penelitian ini bertujuan untuk mengkaji pertumbuhan, tingkat kelangsungan hidup, dan rasio konversi pakan udang vaname (Litopenaeus vannamei) yang dipelihara pada media kultur salinitas rendah dengan penambahan konsentrasi mineral kalsium berbeda.  Penelitian ini dilakukan pada media bersalinitas 5 ppt, menggunakan rancangan acak lengkap (RAL) dengan 4 perlakuan dan 3 ulangan. Perlakuan tersebut berupa penambahan makromineral kalsium yang berbeda, yaitu:  A (0 mg/L), B (50 mg/L), C (100 mg/L), dan D (150 mg/L).  Hasil penelitian menunjukkan bahwa penambahan kalsium yang berbeda pada media salinitas rendah berpengaruh terhadap pertumbuhan, tingkat kelangsungan hidup, dan rasio konversi pakan udang vaname.  Pertumbuhan terbaik terjadi pada perlakuan penambahan kalsium 0 mg/L (kontrol) yaitu sebesar 0,56±0,18 g, sementara tingkat kelangsungan hidup dan konversi pakan terbaik terjadi pada perlakuan 50 mg/L yaitu 54,3±0,38% dan 1,4±0,1. 
 
Kata kunci : makromineral, molting, pertumbuhan, tingkat kelangsungan hidup 
 
Abstract 
 
Calcium is one of the macrominerals that plays an important role in the process of hardening of the shrimp shell after molting. In low salinity ponds, there is often a lack of calcium which can have an impact on shrimp molting failure and even cause death. This study aimed to assess the growth, survival rate, and feed conversion ratio of vaname shrimp (Litopenaeus vannamei) reared in low salinity culture media with the addition of different concentrations of calcium minerals. This study was conducted on 5 ppt salinity media, using a completely randomized design (CRD) with 4 treatments and 3 replications. The treatment was the addition of different calcium macrominerals, namely: A (0 mg/L), B (50 mg/L), C (100 mg/L), and D (150 mg/L).The results showed that the addition of different calcium in low salinity media affected the growth, survival rate, and feed conversion ratio of vaname shrimp. The best growth occurred in the 0 mg/L calcium treatment (control) which was 0.56±0.18 g, while the best survival rate and feed conversion occurred in the 50 mg/L treatment which was 54.3±0.38% and 1.4±0.1. 
 
Keywords : macromineral, molting, growth rate, survival rate",http://repository.lppm.unila.ac.id/id/eprint/46114,2022-10-01 00:00:00.000000000,['SH'],published,doi.org/10.33019/jour.trop.mar.sci.v5i2.3214,,,,,,
14,"[{'name': {'honourific': None, 'lineage': None, 'family': 'Supono', 'given': 'Supono'}, 'id': 'supono_unila@yahoo.com'}, {'name': {'given': 'Munti', 'honourific': None, 'family': 'Sarida', 'lineage': None}, 'id': 'munti.sarida@fp.unila.ac.id'}, {'name': {'honourific': None, 'lineage': None, 'family': 'puspitasari', 'given': 'Destriyana'}, 'id': None}]",article,TRUE,Pengaruh Penambahan Kalsium Pada Media Kultur Salinitas Rendah Terhadap Performa Udang Vaname Litopenaeus vannamei,2.0,333,"[{'format': 'text', 'files': [{'hash_type': 'MD5', 'mtime': '2022-10-31 07:05:51', 'objectid': 184943, 'filesize': 210906, 'uri': 'http://repository.lppm.unila.ac.id/id/file/510038', 'filename': 'JTMS.pdf', 'fileid': 510038, 'datasetid': 'document', 'mime_type': 'application/pdf', 'hash': '9e8c6b5e1fd7ef9349c58ccb73875a72'}], 'main': 'JTMS.pdf', 'docid': 184943, 'rev_number': 1, 'language': 'en', 'mime_type': 'application/pdf', 'eprintid': 46115, 'placement': 1, 'security': 'public', 'pos': 1, 'uri': 'http://repository.lppm.unila.ac.id/id/document/184943'}]",2022-10-31 08:04:14,https://journal.ubb.ac.id/index.php/jtms/article/view/3214,46115,archive,2022-10-31 08:04:14,90-97,show,2022-10-31 08:04:14,public,2623-2235,6,pub,Journal of Tropical Marine Science,"Fakultas Pertanian Perikanan dan Biologi, Universitas Bangka Belitung",['FP3'],disk0/00/04/61/15,5.0,"Abstrak 
 
Kalsium merupakan salah satu makromineral yang berperan penting dalam proses pengerasan kulit udang pasca molting.  Pada tambak salinitas rendah, sering mengalami kekurangan kalsium yang dapat berdampak pada kegagalan molting udang bahkan menyebabkan kematian.  Penelitian ini bertujuan untuk mengkaji pertumbuhan, tingkat kelangsungan hidup, dan rasio konversi pakan udang vaname (Litopenaeus vannamei) yang dipelihara pada media kultur salinitas rendah dengan penambahan konsentrasi mineral kalsium berbeda.  Penelitian ini dilakukan pada media bersalinitas 5 ppt, menggunakan rancangan acak lengkap (RAL) dengan 4 perlakuan dan 3 ulangan. Perlakuan tersebut berupa penambahan makromineral kalsium yang berbeda, yaitu:  A (0 mg/L), B (50 mg/L), C (100 mg/L), dan D (150 mg/L).  Hasil penelitian menunjukkan bahwa penambahan kalsium yang berbeda pada media salinitas rendah berpengaruh terhadap pertumbuhan, tingkat kelangsungan hidup, dan rasio konversi pakan udang vaname.  Pertumbuhan terbaik terjadi pada perlakuan penambahan kalsium 0 mg/L (kontrol) yaitu sebesar 0,56±0,18 g, sementara tingkat kelangsungan hidup dan konversi pakan terbaik terjadi pada perlakuan 50 mg/L yaitu 54,3±0,38% dan 1,4±0,1. 
 
Kata kunci : makromineral, molting, pertumbuhan, tingkat kelangsungan hidup 
 
Abstract 
 
Calcium is one of the macrominerals that plays an important role in the process of hardening of the shrimp shell after molting. In low salinity ponds, there is often a lack of calcium which can have an impact on shrimp molting failure and even cause death. This study aimed to assess the growth, survival rate, and feed conversion ratio of vaname shrimp (Litopenaeus vannamei) reared in low salinity culture media with the addition of different concentrations of calcium minerals. This study was conducted on 5 ppt salinity media, using a completely randomized design (CRD) with 4 treatments and 3 replications. The treatment was the addition of different calcium macrominerals, namely: A (0 mg/L), B (50 mg/L), C (100 mg/L), and D (150 mg/L).The results showed that the addition of different calcium in low salinity media affected the growth, survival rate, and feed conversion ratio of vaname shrimp. The best growth occurred in the 0 mg/L calcium treatment (control) which was 0.56±0.18 g, while the best survival rate and feed conversion occurred in the 50 mg/L treatment which was 54.3±0.38% and 1.4±0.1. 
 
Keywords : macromineral, molting, growth rate, survival rate",http://repository.lppm.unila.ac.id/id/eprint/46115,2022-10-01 00:00:00.000000000,['SH'],published,Pengaruh Penambahan Kalsium Pada Media Kultur Salinitas Rendah Terhadap Performa Udang Vaname Litopenaeus vannamei,,,,,,
15,"[{'name': {'given': 'Supono', 'honourific': None, 'lineage': None, 'family': 'Supono'}, 'id': 'supono_unila@yahoo.com'}, {'id': 'munti.sarida@fp.unila.ac.id', 'name': {'honourific': None, 'lineage': None, 'family': 'Sarida', 'given': 'Munti'}}, {'name': {'honourific': None, 'family': 'suari', 'lineage': None, 'given': 'Putri Indah'}, 'id': None}]",article,TRUE,PENGARUH PENAMBAHAN MINERAL KALIUM (K) PADA MEDIA KULTUR SALINITAS RENDAH TERHADAP PERFORMA UDANG VANAME Litopenaeus vannamei,2.0,333,"[{'eprintid': 47527, 'placement': 1, 'security': 'public', 'pos': 1, 'uri': 'http://repository.lppm.unila.ac.id/id/document/186588', 'format': 'text', 'main': 'jurnal bioflux.pdf', 'docid': 186588, 'files': [{'hash_type': 'MD5', 'mtime': '2022-12-29 03:41:59', 'filesize': 425946, 'objectid': 186588, 'filename': 'jurnal bioflux.pdf', 'uri': 'http://repository.lppm.unila.ac.id/id/file/521039', 'fileid': 521039, 'datasetid': 'document', 'hash': 'a0e479e5bd01b60b439de9b51bec8634', 'mime_type': 'application/pdf'}], 'rev_number': 1, 'language': 'en', 'mime_type': 'application/pdf'}]",2022-12-30 03:55:12,https://journals.unihaz.ac.id/index.php/agroqua/article/view/2947/1426,47527,archive,2022-12-30 03:55:12,339-346,show,2022-12-30 03:55:12,public,2166585,6,pub,Jurnal Agroqua,Universitas Prof. Dr. Hazairin SH,['FP3'],disk0_bak/00/04/75/27,20.0,"Potassium (K)  is one of the important ions in low-salinity shrimp culture, which has functions of maintaining electrolyte balance, conduction of nerve impulses, and releasing energy from protein, fat, and carbohydrate. This research aimed to study and determine the proper concentration of potassium as an additive ion to enhance the growth and survival rate  of vaname shrimp (Litopenaeus vannamei).  Potassium was added to the rearing media with the salinity of  5 ppt in different concentrations (0, 50, 100, and 150 mg/L), with three replicates of treatment. The shrimp in size of post-larvae (PL)10 reared for 40 days in the treatment’s media with the stocking density of 140 shrimp (2000 shrimp/m3). The results of this study showed that potassium administration in low-salinity media has a significant effect on the growth performance and survival rate of shrimp. Potassium administration at a concentration of 100 mg/L resulted in better vaname performance than other treatments (P < 0.05) based on absolute weight, specific growth rate, feed conversion ratio, and survival rate Keywords:  feed coversion ratio, growth, post-larvae, survival rate",http://repository.lppm.unila.ac.id/id/eprint/47527,2022-12-01 00:00:00.000000000,['SH'],published,,,,,,,
