,subjects,abstract,volume,uri,date,publisher,divisions,publication,dir,issn,full_text_status,status_changed,ispublished,rev_number,datestamp,eprint_status,eprintid,metadata_visibility,pagerange,userid,number,lastmod,official_url,creators,type,title,refereed,event_title,event_type,event_location,pres_type,event_dates
0,['S1'],"The objective of this work was to analyze the sensory properties of rusip from traditional market in Sungailiat-Bangka. Purposed sampling was used to collect the samples, and sensory analysis was done by using free choice profiling (FCP) and focus groups method. The Results shows that sensory properties of raw rusip were opaq, thick, and partly mashy.. The colors were grey, brown and very dark brown. The dominant taste were salty, sour, bitter, and the sensation to the tongue was burned and ichy. The aromas formed were fishy, acidic, and rotten. In addition it was also noticed terasi and sardine-like aromas.",12.0,http://repository.lppm.unila.ac.id/id/eprint/2289,2007-09-01,Jurusan Teknologi Hasil Pertanian Unila,['FP19'],Jurnal Teknologi Industri & Hasil Pertanian,disk0/00/00/22/89,ISSN 1410-3044 (print) and ISSN 2304-4399 (online),none,2017-06-02 02:26:54,pub,5,2017-06-02 02:26:54,archive,2289,show,36-39,994,2.0,2017-06-02 02:26:54,http://jurnal.fp.unila.ac.id/index.php/JTHP,"[{'name': {'lineage': None, 'family': 'Koesoemawardani', 'honourific': None, 'given': 'Dyah'}}]",article,ANALISIS SENSORI RUSIP DARI SUNGAILIAT-BANGKA,TRUE,,,,,
1,['S1'],"The objective of this research was to charactise chemical and microbiological properties of the rusip from Bangka. Technique
sampling with purpose sampling. Result of research indicate that there was lacking of product of rusip from Bangka : there
was some value of TVN still high relative, there was total of mould which not ought to there, there was no uniformity of good
rusip way of making and packaging.",,http://repository.lppm.unila.ac.id/id/eprint/2285,2007-09-01,,['FP19'],,disk0/00/00/22/85,,none,2017-07-20 08:51:32,pub,6,2017-07-20 08:51:32,archive,2285,show,304-313,994,,2017-07-20 08:51:32,http://lemlit.unila.ac.id,"[{'name': {'family': 'Koesoemawardani', 'lineage': None, 'honourific': None, 'given': 'Dyah'}}, {'name': {'family': 'Nurainy', 'lineage': None, 'honourific': None, 'given': 'Fibra'}}]",conference_item,Karaktersisasi Rusip Bangka,TRUE,Seminar Hasil Penelitian & Pengabdian Kepada Masyarakat,conference,Universitas Lampung,lecture,
2,['S1'],"The objective of this research was toknow the most appropriate concentration of seaweed to produce soursoup leather with
the best character on physicachemical and organoleptic. The experimental designed used in this research was Completely
Block Randomized Design by employing 5 treatment and 3 replication. The treatment applied were 5 concentration of
adding seaweed : 0% (b/b) (R1), 0,4 % (b/b) (R2),0,8 % (b/b) (R3), 1,6 % (b/b) (R4) dan 3,2 % (b/b) (R5) from 300 g
soursoup weight.
The best result was soursoup leather by adding 0,8 % seaweed. The analysis of physicochemical parameter were moisture
content 18,547 %, adsorbance point of browning nonezymatis 0,515, texture hardness 0,887 kg/12 Ǿ x 10 mm and
organoleptic character were white colour, very plastic texture, sorsoup flavour and like category of overall acceptance.",,http://repository.lppm.unila.ac.id/id/eprint/2287,2007-09-01,,['FP19'],,disk0/00/00/22/87,,none,2017-07-20 08:51:46,pub,6,2017-07-20 08:51:46,archive,2287,show,320-327,994,,2017-07-20 08:51:46,http://lemlit.unila.ac.id,"[{'name': {'given': 'Fibra', 'lineage': None, 'family': 'Nurainy', 'honourific': None}}, {'name': {'given': 'Dyah', 'family': 'Koesoemawardani', 'lineage': None, 'honourific': None}}]",conference_item,"EFEK PENAMBAHAN RUMPUT LAUT TERHADAP
KARAKTERSTIK LEATHER SIRSAK",TRUE,Seminar Hasil Penelitian & Pengabdian Kepada Masyarakat,conference,Universitas Lampung,lecture,September 207
