,ispublished,rev_number,full_text_status,status_changed,divisions,publication,dir,uri,date,abstract,date_type,subjects,title,refereed,creators,type,lastmod,documents,userid,metadata_visibility,pagerange,datestamp,eprintid,eprint_status,output_media,issn,publisher,isbn,contact_email,place_of_pub,referencetext,official_url,pages,book_title,volume,corp_creators,number,id_number,related_url
8,pub,7,public,2022-02-02 07:18:33,['FP15'],,disk0/00/03/88/47,http://repository.lppm.unila.ac.id/id/eprint/38847,2018-06-01,"Sweet potatoes were peeled, washed, sliced and fermented for 7 days by spontaneous, pickled
brine and Lactobacillus plantarum FNCC 0123, dried and milled into flours. These fermented
flours and the composite flours consisting of 60% wheat flour and 40% fermented sweet potato
flour were analyzed for the physicochemical and pasting properties. Non-fermented sweet
potato flour and its composite with wheat flour were also prepared as controls. The composite
flours were used as raw material for white bread making and were tested for sensory properties
and bread loaf specific volume. The results showed that the physicochemical and pasting
properties of sweet potatoes flours were affected by fermentation. In general the fermented
sweet potato flours (both composite and non-composite) had a lower pH, and solubility, but
had higher amylose content, swelling power, water absorption capacity, and whiteness than
those of controls. Fermentation increased peak viscosity, break down, and set back value, but
deacreased the temperature of maximum viscosity of all sweet potatoes flours. The sensory
analysis indicated that the bread from wheat-pickle brine composite flour was the best treatment
with the characteristics of brightest crust color, softest crumb, more uniform pores, and highest
bread loaf specific volume.
Introduction
Increasing demand for wheat flour as the main
ingredient in most carbohydrate-food has led to
various problems, primarily, on economic sectors
because wheat could not be cultivated well in
Indonesia. The national consumption of wheat
in Indonesia is reported in the amount of 18 kg/
capital/year, and this increases about 5-10% every
year (Food Review Indonesia, 2011). The largest
portion of wheat flour uses is for noodle, while the
rest is used for cake, breads, snacks, biscuits, and
fried foods. The demand for bread, especially white
bread has increased significantly and the growth of
bakery bussines has reached 7-10% every year. To
address the needs for wheat, substitution of wheat
with other local flour is needed. Fermented sweet
potato and wheat composite flours could be used as
an alternative.
Sweet potato (SP) is widely grown, however, in
its nature, sweet potatoes processed into flour has
some drawback properties such as slightly dark color
(Trejo-González et al ., 2014 ),and low loaf volume
(Amal, 2015) when applied on bread products. In
this study, lactic acid fermentation could be aimed
to improve SP flour properties. Some studies on the
effects of lactic acid spontaneous fermentation on the
physicoc",published,['S1'],"Peer review karya ilmiah jurnal internasional dengan judul Physico chemical properties of
fermented sweet potato flour in wheat
composite flour and its use in white
bread. International Food Research Journal Vol 25(3): 1051-1059",,"[{'id': 'neti.yuliana@fp.unila.ac.id', 'name': {'family': 'Yuliana', 'lineage': None, 'honourific': None, 'given': 'Neti'}}, {'name': {'given': 'Siti', 'honourific': None, 'lineage': None, 'family': 'Nurdjanah'}, 'id': 'siti.nurdjanah@fp.unila.ac.id'}, {'id': '-', 'name': {'family': 'Dewi', 'lineage': None, 'honourific': None, 'given': 'Yuliza Ratna'}}]",other,2022-02-02 07:18:33,"[{'mime_type': 'application/pdf', 'language': 'en', 'rev_number': 1, 'files': [{'filename': 'Peer review karya ilmiah 4_Physicochemical properties of fermented SP (Koreksi jan 2022).pdf', 'uri': 'http://repository.lppm.unila.ac.id/id/file/438762', 'filesize': 1387645, 'objectid': 159989, 'mtime': '2022-02-02 04:30:20', 'hash_type': 'MD5', 'mime_type': 'application/pdf', 'hash': 'e65adc19a30c896bae9ffc89c2535d34', 'fileid': 438762, 'datasetid': 'document'}], 'main': 'Peer review karya ilmiah 4_Physicochemical properties of fermented SP (Koreksi jan 2022).pdf', 'docid': 159989, 'format': 'text', 'pos': 1, 'uri': 'http://repository.lppm.unila.ac.id/id/document/159989', 'security': 'public', 'placement': 1, 'eprintid': 38847}]",1082,show,,2022-02-02 07:18:33,38847,archive,,,Interational Food Research Journal,,,,,http://www.ifrj.upm.edu.my/volume-25-2018.html,,,,,,,
9,pub,14,public,2018-11-09 03:21:59,['FP15'],International Food Research Journal,disk0/00/00/95/44,http://repository.lppm.unila.ac.id/id/eprint/9544,2018-06-01,"Sweet potatoes were peeled, washed, sliced and fermented for 7 days by spontaneous, pickled
brine and Lactobacillus plantarum FNCC 0123, dried and milled into flours. These fermented
flours and the composite flours consisting of 60% wheat flour and 40% fermented sweet potato
flour were analyzed for the physicochemical and pasting properties. Non-fermented sweet
potato flour and its composite with wheat flour were also prepared as controls. The composite
flours were used as raw material for white bread making and were tested for sensory properties
and bread loaf specific volume. The results showed that the physicochemical and pasting
properties of sweet potatoes flours were affected by fermentation. In general the fermented
sweet potato flours (both composite and non-composite) had a lower pH, and solubility, but
had higher amylose content, swelling power, water absorption capacity, and whiteness than those of controls. Fermentation increased peak viscosity, break down, and set back value, but decreased the temperature of the maximum viscosity of all sweet potatoes flours. The sensory analysis indicated that the bread from wheat-pickle brine composite flour was the best treatment
with the characteristics of brightest crust color, softest crumb, more uniform pores, and highest
bread loaf specific volume.",published,['S1'],"Physicochemical properties of fermented sweet potato flour in wheat
composite flour and its use in white bread",TRUE,"[{'id': 'neti.yuliana@fp.unila.ac.id', 'name': {'honourific': None, 'lineage': None, 'family': 'Yuliana', 'given': 'Neti'}}, {'id': 'siti.nurdjanah@fp.unila.ac.id', 'name': {'given': 'Siti', 'lineage': None, 'family': 'Nurdjanah', 'honourific': None}}, {'id': None, 'name': {'lineage': None, 'family': 'Ratna Dewi', 'honourific': None, 'given': 'Yuliza'}}]",article,2018-11-09 03:21:59,"[{'main': '2018 Neti Yuliana et al IFRJ 25 (3)1051-1059.pdf', 'docid': 22583, 'files': [{'filesize': 344215, 'objectid': 22583, 'uri': 'http://repository.lppm.unila.ac.id/id/file/90879', 'filename': '2018 Neti Yuliana et al IFRJ 25 (3)1051-1059.pdf', 'hash_type': 'MD5', 'mtime': '2018-11-06 04:31:24', 'fileid': 90879, 'datasetid': 'document', 'hash': 'abe5167c909d943ed00ce7b96c5bbfde', 'mime_type': 'application/pdf'}], 'format': 'text', 'mime_type': 'application/pdf', 'language': 'en', 'rev_number': 1, 'placement': 2, 'eprintid': 9544, 'uri': 'http://repository.lppm.unila.ac.id/id/document/22583', 'pos': 2, 'security': 'public'}]",1082,show,1051-1059,2018-11-09 03:21:59,9544,archive,,,Faculty of Food Science and Technology Universiti Putra Malaysia 43400 UPM Serdang Selangor Malaysia,,neti.yuliana@fp.unila.ac.id,,,http://www.ifrj.upm.edu.my,,,25.0,,3.0,,
