,ispublished,rev_number,full_text_status,status_changed,divisions,publication,dir,uri,date,abstract,date_type,subjects,title,refereed,creators,type,lastmod,documents,userid,metadata_visibility,pagerange,datestamp,eprintid,eprint_status,output_media,issn,publisher,isbn,contact_email,place_of_pub,referencetext,official_url,pages,book_title,volume,corp_creators,number,id_number,related_url
0,pub,9,public,2018-11-14 02:47:32,['FP15'],semnas tektan polinela,disk0/00/00/98/41,http://repository.lppm.unila.ac.id/id/eprint/9841,2018-10-11,"ABSTRACT

Fish processed product is a favorite food that contain high protein in Indonesia, such as, otak-otak. The aim of this research was to observe of phatogen bacteria contaminant on fish proccessed product (otak-otak), ex. Salmonella sp., Escherichia coli and Staphylococcus aureus. This research was had done on food processed product, used random sampling technicque, at traditional markets. The result data was arranged with descriptive statistic. The result research showed that contaminant of Escherichia coli was 1.54 x 102 colony/ ml at Tani market; 0.3 x 101 colony/ml at Gudang Lelang market. Fish processed product(otak-otak) was contaminated by Salmonella, too. This research found that Fish processed product at Tamin, Tani and Rajabas was Salmonella contaminant detected. The Fish processed product (otak-otak) that content the highest level of Stahpylococcus aureus were  Gudang Lelang market (1,12 x 102 colony/ml).     

Keyword: ‘otak-otak’, Salmonella sp., Escherichia coli, Staphylococcus aureus",submitted,['S1'],SURVEY CEMARAN BAKTERI PATOGEN  PADA PRODUK OLAHAN IKAN  (OTAK-OTAK),TRUE,"[{'name': {'given': 'Dewi', 'honourific': None, 'family': 'Sartika', 'lineage': None}, 'id': 'dewikincai@yahoo.com'}, {'id': None, 'name': {'given': 'Sri', 'family': 'Hidayati', 'lineage': None, 'honourific': None}}, {'name': {'given': 'fitriani', 'honourific': None, 'lineage': None, 'family': 'hardianti'}, 'id': None}]",article,2018-11-14 02:47:32,"[{'placement': 1, 'eprintid': 9841, 'pos': 1, 'uri': 'http://repository.lppm.unila.ac.id/id/document/22855', 'security': 'public', 'files': [{'mime_type': 'application/vnd.openxmlformats-officedocument.wordprocessingml.document', 'hash': 'dfc9c68fa50667e8b2472e74afcbf10a', 'fileid': 92822, 'datasetid': 'document', 'filename': 'penelitian - dewi sartika-unila-2018.docx', 'uri': 'http://repository.lppm.unila.ac.id/id/file/92822', 'objectid': 22855, 'filesize': 401807, 'mtime': '2018-11-13 06:10:36', 'hash_type': 'MD5'}], 'main': 'penelitian - dewi sartika-unila-2018.docx', 'docid': 22855, 'format': 'text', 'rev_number': 1, 'language': 'en', 'mime_type': 'application/vnd.openxmlformats-officedocument.wordprocessingml.document'}]",306,show,1-10,2018-11-14 02:47:32,9841,archive,,,,,,,,,,,,,,,
1,,13,none,2018-11-16 17:35:47,['FP15'],,disk0/00/01/01/59,http://repository.lppm.unila.ac.id/id/eprint/10159,2018-10-08,"ABSTRAK

	Invensi ini menemukan produk pengawet pangan dari daun singkong karet racun (Manihot glaziovii), dengan Prosedur pembuatan meliputi a) proses ekstraksi, b) eksplorasi komponen bioaktif (GC-MS), 3) penambahan CMC 1,5%. Pengujian invensi sebagai pengawet pangan meliputi pengujian daya hambat dengan metode cakram (uji kualitatif) dan aplikasi penghambatan mikroba (uji kuantitatif). Pengujian kualitatif menunjukkan bahwa invensi produk pengawet pangan ini sangat signifikan menghambat Bakteri Salmonella sp, E.Coli, Staphylococcus aureus dan Vibrio sp.  Hasil Zona hambat bakteri dari Invensi adalah Vibrio sp 15,58 mm, Escherichia coli 13,44 mm, Salmonella sp 12,97 mm, dan pada bakteri Staphylococcus aureus 10,62 mm. Secara kuantitatif, Invensi pengawet pangan dari daun singkong karet racun (Manihot glaziovii) mampu menurunkan  bakteri secara signifikan pada α0,05; dengan uraian besaran penghambatan bakteri sebagai berikut: staphylococcus aureus (6log1 CFU/mL); salmonella sp (6log1 CFU/mL); escherichia coli (6log1 CFU/mL); dan vibrio sp (6log2 CFU/mL). Invensi ini berbeda dengan invensi sebelumnya karena menggunakan: a) bahan baku daun singkong karet racun (Manihot glaziovii) dan b) penambahan penstabil CMC 1,5% pada produk akhir. Dari uraian di atas dapat disimpulkan bahwa invensi daun singkong karet racun (Manihot glaziovii) merupakan alternatif pengawet pangan baru yang murah, aman, dan layak dipatenkan.

Kata kunci: pengawet, singkong karet racun",completed,['S1'],PENGAWET PANGAN DARI DAUN SINGKONG KARET RACUN (Manihot glaziovii),,"[{'name': {'honourific': None, 'family': 'Sartika', 'lineage': None, 'given': 'Dewi'}, 'id': 'dewikincai@yahoo.com'}, {'id': None, 'name': {'given': 'Suharyono', 'lineage': None, 'family': 'Suharyono', 'honourific': None}}, {'name': {'given': 'widya rini', 'honourific': None, 'family': 'hartari', 'lineage': None}, 'id': None}, {'id': None, 'name': {'given': 'None', 'lineage': None, 'family': 'Susilawati', 'honourific': None}}]",artefact,2018-11-16 17:35:47,,306,show,,2018-11-16 17:35:47,10159,archive,anti mikroba alami,,,,,,,,,,,,,,
2,pub,6,public,2018-11-14 02:47:28,['FP15'],semnas tektan polinela,disk0/00/00/98/40,http://repository.lppm.unila.ac.id/id/eprint/9840,2018-10-11,"ABSTRAK

Sentra Industri Rumah Tangga (IRT) Keripik di Jalan Pagar Alam sangat dikenal oleh masyarakat Lampung dan merupakan salah satu sentra wisata kuliner yang cukup digemari. Permasalahan dari IRT keripik ini adalah produk-produk yang dihasilkan sudah jenuh, tidak ada inovasi dan tidak ada pembaharuan. Menurut ketua kelompok usaha keripik, Sucipto Adi, bahwa produk keripik dijual dalam bentuk apa adanya sehingga sulit untuk dipasarkan ke Super Market atau Ekspor ke Luar Negeri. Selain itu kripik yang dihasilkan kebanyakan dalm bentuk curah atau tidak dikemas. Oleh karena itu perlu transfer teknologi tepat guna pengembangan diversifikasi kemasan, rasa, dan bentuk keripik pisang. Tim Pengabdian THP memandang perlu untuk melakukan Program pendampingan diversifikasi kemasan di kawasan sentra industri kripik ini di Kelompok Usaha Bersama Telo Rezeki. Setelah pengabdian ternyata terdapat pengembangan wawasan yang signifikan dari 45% menjadi 90%; dan perubahan prilaku dalam pemilihan kemasan dan penggunaan kemasan dari 55% menjadi 80%; wawasan diversifikasi rasa dari 60% menjadi 85% dan wawasan diversifikasi bentuk meningkat dari 40% menjadi 90%

Kata kunci: pendampingan, diversifikasi, kemasan, bentuk, rasa",published,['S1'],"PENDAMPINGAN DIVERSIFIKASI KEMASAN, RASA,  DAN BENTUK KERIPIK KELOMPOK USAHA BERSAMA TELO REZEKI DI JALAN PAGAR ALAM",TRUE,"[{'id': 'dewikincai@yahoo.com', 'name': {'honourific': None, 'lineage': None, 'family': 'Sartika', 'given': 'Dewi'}}, {'id': 'susilawati.unila@gmail.com', 'name': {'given': 'None', 'honourific': None, 'lineage': None, 'family': 'Susilawati'}}, {'id': 'neti.yuliana@fp.unila.ac.id', 'name': {'lineage': None, 'family': 'Yuliana', 'honourific': None, 'given': 'Neti'}}]",article,2018-11-14 02:47:28,"[{'eprintid': 9840, 'placement': 1, 'security': 'public', 'uri': 'http://repository.lppm.unila.ac.id/id/document/22854', 'pos': 1, 'format': 'text', 'main': 'pengabdian-dewi sartika unila 2018.docx', 'docid': 22854, 'files': [{'mtime': '2018-11-13 06:01:16', 'hash_type': 'MD5', 'uri': 'http://repository.lppm.unila.ac.id/id/file/92816', 'filename': 'pengabdian-dewi sartika unila 2018.docx', 'objectid': 22854, 'filesize': 3933090, 'mime_type': 'application/vnd.openxmlformats-officedocument.wordprocessingml.document', 'hash': 'faa4a4d27efc2756f8a729a4146e14bb', 'datasetid': 'document', 'fileid': 92816}], 'language': 'en', 'rev_number': 1, 'mime_type': 'application/vnd.openxmlformats-officedocument.wordprocessingml.document'}]",306,show,1-10,2018-11-14 02:47:28,9840,archive,,,,,,,,,,,,,,,
3,submitted,5,none,2018-11-14 02:48:16,['FP15'],Seminar Nasional Hasil-Hasil Pengabdian Kepada Masyarakat,disk0/00/00/98/48,http://repository.lppm.unila.ac.id/id/eprint/9848,2018-11-13,"Sentra Industri Rumah Tangga (IRT) Keripik di Jalan Pagar Alam sangat dikenal oleh masyarakat Lampung dan merupakan salah satu sentra wisata kuliner yang cukup digemari. Permasalahan dari IRT keripik ini adalah produk-produk yang dihasilkan sudah jenuh, tidak ada inovasi dan tidak ada pembaharuan. Oleh karena itu perlu pelatihan peningkatan pengetahuan dan ketrampilan masyarakat, dan transfer teknologi tepat guna pengembangan diversifikasi produk keripik berbahan baku kulit (buah dan umbi). Tim Pengabdian THP memandang perlu untuk melakukan ‘Pelatihan Peningkatan kreatifitas wirausaha melalui diversifikasi produk keripik berbahan baku kulit buah (Naga Merah dan putih)  agar dapat meningkatkan daya saing dan inovasi produk di kawasan sentra industri kripik ini. 

Kata kunci: diversifikasi, produk, kulit, keripik",submitted,['S1'],"PENINGKATAN KREATIFITAS WIRAUSAHA MELALUI DIVERSIFIKASI PRODUK KERIPIK BERBAHAN BAKU KULIT BUAH (NAGA MERAH DAN PUTIH)  PADA SENTRA INDUSTRI RUMAH TANGGA (IRT) KERIPIK 
DI BANDAR LAMPUNG",TRUE,"[{'name': {'given': 'Dewi', 'honourific': None, 'lineage': None, 'family': 'Sartika'}, 'id': 'dewikincai@yahoo.com'}, {'name': {'given': 'Susilawati', 'honourific': None, 'lineage': None, 'family': 'Susilawati'}, 'id': 'susilawati.1961@fp.unila.ac.id'}, {'id': 'neti.yuliana@fp.unila.ac.id', 'name': {'honourific': None, 'lineage': None, 'family': 'Yuliana', 'given': 'Neti'}}]",article,2018-11-14 02:48:16,,306,show,1-10,2018-11-14 02:48:16,9848,archive,,978-602-0860-12-1,LPPM Universitas lampung,,,,,,,,,,,,
4,pub,7,public,2019-05-16 07:52:43,['FP15'],,disk0/00/01/29/75,http://repository.lppm.unila.ac.id/id/eprint/12975,2018-12-01,"The ceara rubber skin is one of wastes seldom to use, even though ceara rubber contains
saponin active compound which is potential to be natural anti-microbe. The objective of this research
was to find out the content of ceara rubber skin extract. This research was conducted in 2 stages. The
first stage was extracting ceara rubber skin with ethanol dissolvent. The extraction contained of
maceration and evaporation conducted in Chemistry Laboratory of Faculty of Science in Lampung
University. The second stage was testing the ceara rubber skin content by using GC-MS. This
research was conducted in Integrated Laboratory of Lampung University. The results showed that
ceara rubber skin contained of chemical compounds including Ethanedioic acid, dibutyl ester.,
Octanoic acid, methyl ester., 2,4-dihydroxy-2,5-dimethyl-3(2H)-furan-3-one., Estra-1,3,5 (10-trien-17-
one, 2[(trimethylsilyl) amino] -3-[trimethylsilyl) oxy]., Nonanal dimethyl acetal., 2-Furancarboxaldehyde,
5-(hydroxymethyl)., 1-pentanol, 2-ethyl-4-methyl., Decanoic acid, methyl ester., Benzaldehyde, 3-
hydroxy-4-methoxy., Sucrose., Dodecanoic acid, methyl ester., 1-carbethoxy-3,4-dicarbomethoxygamma-
carboline., Tridecanoic acid, 12-methyl, methyl ester., Pentadecanoic acid, 14-methyl ester.,
Methyl.beta-d-galactopyranoside., 9-Octadecenoic acid (Z), methyl ester., 8-Octadecenoic acid (Z),
and methyl ester. Most of these chemical compounds are antioxidant, such as Octadecenoic Acid,
which inhibit microbe growth.",published,['S1'],"Identifying Chemical Compound in Ceara Rubber Skin Which Is Potential To Be
Natural Anti-Microbe By Using Gas Chromatography-Mass Spectrometry (GCMS)",TRUE,"[{'id': 'dewikincai@yahoo.com', 'name': {'given': 'Dewi', 'lineage': None, 'family': 'Sartika', 'honourific': None}}, {'name': {'family': 'Undadraja', 'lineage': None, 'honourific': None, 'given': 'bigi'}, 'id': None}]",book_section,2019-05-16 07:52:43,"[{'docid': 25957, 'main': 'Proceeding International Conf (1). on Cassava 2017-1_2.pdf', 'files': [{'fileid': 114331, 'datasetid': 'document', 'mime_type': 'application/pdf', 'hash': 'b743256638ad3638cf71ee5428d0b5a6', 'hash_type': 'MD5', 'mtime': '2019-05-16 04:03:00', 'filesize': 17260065, 'objectid': 25957, 'filename': 'Proceeding International Conf (1). on Cassava 2017-1_2.pdf', 'uri': 'http://repository.lppm.unila.ac.id/id/file/114331'}], 'format': 'text', 'mime_type': 'application/pdf', 'language': 'en', 'rev_number': 1, 'placement': 1, 'eprintid': 12975, 'pos': 1, 'uri': 'http://repository.lppm.unila.ac.id/id/document/25957', 'security': 'public'}]",306,show,24-28,2019-05-16 07:52:43,12975,archive,,,LPPM Universitas lampung,978-602-0860-26-8,dewikincai@yahoo.com,Lampung,"Asghar, S., M.I. Rehman, Choudahry, and Rahman. 2011. Gas chromatography mass
spectrometry (GC-MS) analysis of petroleum ether extract (oil) and bioassays of crude
extract of Iris germanica. I. J. of Genetics and Molecular Biology 3(7): 95-100.
Gurning, K. 2015. Identifikasi Komponen Minyak Atsiri dan Potensi Daun Bangun (Coleus
amboinicus Lour). Universitas Negeri Yogyakarta. Yogyakarta.
Gita, A. 2014. Benzaldehida Turunan Benzen. https://www.scribd.com/doc/245777201/
BENZALDEHIDA. Diakses pada 1 November 2017 pukul 20.00 WIB.
Hidayat, C. 2009. Peluang penggunaan kulit singkong sebagai pakan unggas. Seminar
Nasional Teknologi Peternakan dan Veteriner 655-657.
Hilda, R. 2011. Identifikasi Senyawa Bioaktif Dalam Singkong Karet (Manihot glaziovii)
dan Uji Sitotoksik Terhadap Sel Murin Leukimia P388. Program Studi Kimia,
Fakultas Matematika dan Ilmu Pengetahuan Alam, Universitas Pakuan. Bogor. Hal.
6.
Noviyanti, L. 2010. Modifikasi Teknik Kromatografi Kolom untuk Pemisahan Trigliserida
dari Ekstrak Buah Merah (Pandanusconoideus Lamk.). Skripsi. Universitas Sebelas
Maret. Surakarta.
Padmini, E.A., Valarmathi, A., and Rani, M.U. 2010. Comparative analysis of chemical
composition and antibacterial activities of Spicata and Camellia sinennsis. Asian
J.Exp. Biol. Sci 1: 772-781.
Zahro, L. 2013. Uji efektivitas antibakteri ekstrak kasar saponin jamur tiram putih
(Pleurotus ostreatus) terhadap Staphylococcus aureus dan Escherichia coli. Program
Studi Kimia, Fakultas Matematika dan Ilmu Pengetahuan Alam, Universitas Surabaya.
Jurnal Vol. 2 No. 3 September 2013. Surabaya.",http://www.lppm.unila.ac.id,90.0,Conferrence seminar on cassava,,,,,
5,,11,none,2018-11-16 17:35:45,['FP15'],,disk0/00/01/01/61,http://repository.lppm.unila.ac.id/id/eprint/10161,2018-10-10,"ABSTRAK

Bahan baku Invensi ini adalah kulit pisang muli (musa acuminata), tanaman asli Lampung. Invensi ini menjabarkan tentang produk pengawet pangan dari kulit pisang muli yang distabilisasi 0,5%. 
Invensi ini menguraikan cara produksi pengawet pangan melalui ekstraksi kulit pisang yang dilakukan secara maserasi, yaitu serbuk kulit pisang 500g direndam dengan pelarut etanol 75% sebanyak 2 liter dan dipekatkan dengan rotary evaporator pada suhu 50oC optimal menghasilkan ekstrak kulit pisang muli yang bersifat anti mikroba alami lalu ditambahkan CMC 0,5% sebagai penstabil. 
Invensi ini menemukan bahwa produk pengawet pangan ini mengandung komponen bioaktif yang bersifat anti mikroba yaitu Butanoic acid,3-methyl-; Cyclotetra siloxane, octamethyl; 1,4-Dichlorobenzene; Benzene,1,2,3,4-tetra methyl; Cyclopenta siloxane, deca methyl; methyl ester Dodecanoic acid; Pentadecanoic acid, methyl ester (data GC-MS). Berdasarkan uji zona hambat pemakaian 15% invensi produk pengawet pangan ini sudah efektif menurunkan mikroba dengan zona hambat 8.54 ± 0.25 mm (8 log 1 colony/g) untuk E coli dan 9.54 ± 0.25 mm (8 log 2 colony/g) untuk Salmonella, tanpa mengubah bau, warna dan penampilan keseluruhan pangan yang diawetkan. 

Kata kunci: pengawet, pisang,muli, anti, mikroba",completed,['S1'],PENGAWET PANGAN DARI KULIT PISANG MULI (Musa acuminata),,"[{'id': 'dewikincai@yahoo.com', 'name': {'given': 'Dewi', 'lineage': None, 'family': 'Sartika', 'honourific': None}}, {'id': None, 'name': {'given': 'novita', 'honourific': None, 'lineage': None, 'family': 'herdiana'}}, {'id': None, 'name': {'honourific': None, 'family': 'Suci', 'lineage': None, 'given': 'Nata'}}]",artefact,2018-11-16 17:35:45,,306,show,,2018-11-16 17:35:45,10161,archive,anti mikroba alami,,,,,,,,,,,,,,
6,pub,14,public,2018-06-29 08:27:25,['FP15'],,disk0/00/00/82/84,http://repository.lppm.unila.ac.id/id/eprint/8284,2018-03-01,"Belum mampunya mencapai ketahanan pangan di Provinsi Lampung membuat pemerintah melakukan kegiatan diversifikasi pangan yang baerbasis pada sumber daya lokal. Salah satunya adalah pembuatan beras analog. Beras analog adalah makanan fungsional yang berasal dari ubi
kayu yang mengalami pengolahan sehingga berbentuk butiran-butiran seperti beras. Salah satu produsen pembuatan beras analog adalah KWT Toga Sari di Kabupaten Penawartama. Masih adanya kendala pada kegiatan produksi beras analog baik kendala internal maupun eksternal.
Penelitian ini bertujuan untuk megidentifikasi dan menentukan strategi pengembangan yang tepat
dan sesuai untuk diterapkan pada KWT Toga Sari. Kendala internal berupa aspek sumberdaya manusia, sarana dan prasarana, kelembagaan, produksi, ketersedian bahan baku, lokasi usaha serta menejemen dan pendanaan sedangkan kendala eksternal berupa teknologi dan informasi,
kebijakan pemerintah, pesaing, konsumen serta iklim dan cuaca. Hasil penelitian dapat disimpulkan bahwa strategi pengembangan yang tepat dan sesuai yaitu menggunakan kekuatan untuk memanfaatkan peluang jangka panjang. Peningkatan strategi dapat dicapai dengan
meningkatkan jumlah produksi yang diimbangi dengan memperluasnya jaringan pemasaran dan
meningkatkan kualitas dari produk yang dihasilkan serta meningkatkan kerja sama dengan pemerintahan untuk lebih meningkatkan jumlah produksi.",published,"['S1', 'T1']","PENENTUAN STRATEGI PENGEMBANGAN BERAS ANALOG PADA KWT TOGA
SARI KECAMATAN PENAWAR TAMA TULANG BAWANG",TRUE,"[{'name': {'given': 'Rukmini', 'lineage': None, 'family': 'Susilowati', 'honourific': None}, 'id': 'minimakdum44@gmail.com A'}, {'name': {'given': 'tanto Pratondo', 'honourific': None, 'family': 'Utomo', 'lineage': None}, 'id': 'tanto.utomo@fp.unila.ac.id'}, {'name': {'family': 'subeki', 'lineage': None, 'honourific': None, 'given': 'subeki'}, 'id': 'subeki1968@fp.unila.ac.id'}, {'id': 'erdi.suroso@fp.unila.ac.id', 'name': {'honourific': None, 'family': 'Suroso', 'lineage': None, 'given': 'Erdi'}}]",book_section,2018-06-29 08:27:25,"[{'language': 'en', 'mime_type': 'application/pdf', 'rev_number': 2, 'content': 'published', 'files': [{'mime_type': 'application/pdf', 'hash': 'e39a14af314217e52de81b0f86c7e46f', 'datasetid': 'document', 'fileid': 82142, 'uri': 'http://repository.lppm.unila.ac.id/id/file/82142', 'filename': 'Subeki et al, PATPI Buku 3.pdf', 'objectid': 21329, 'filesize': 48931, 'mtime': '2018-06-29 08:03:50', 'hash_type': 'MD5'}], 'main': 'Subeki et al, PATPI Buku 3.pdf', 'docid': 21329, 'format': 'text', 'pos': 1, 'uri': 'http://repository.lppm.unila.ac.id/id/document/21329', 'security': 'public', 'placement': 1, 'eprintid': 8284}, {'format': 'text', 'main': 'Cover dan Daftar isi Buku 3.pdf', 'files': [{'hash_type': 'MD5', 'mtime': '2018-06-29 08:16:14', 'objectid': 21336, 'filesize': 76777, 'uri': 'http://repository.lppm.unila.ac.id/id/file/82158', 'filename': 'Cover dan Daftar isi Buku 3.pdf', 'fileid': 82158, 'datasetid': 'document', 'hash': '848ac7e4e096047ad75289cb69399572', 'mime_type': 'application/pdf'}], 'docid': 21336, 'rev_number': 1, 'language': 'en', 'mime_type': 'application/pdf', 'eprintid': 8284, 'placement': 2, 'security': 'public', 'uri': 'http://repository.lppm.unila.ac.id/id/document/21336', 'pos': 2}]",288,show,1257-1265,2018-06-29 08:27:25,8284,archive,,,"Fakultas Pertanian, Universitas Lampung",976-602-72006-3-0,,Bandar Lampung,,http://thp.fp.unila.ac.id/2018/06/06/prosiding-seminar-nasional-patpi-2017/#more-2276,9.0,P R O S I D I N G SEMINAR NASIONAL PATPI 2017 “PERAN AHLI TEKNOLOGI PANGAN DALAM MEWUJUDKAN KETAHANAN PANGAN NASIONAL”,3.0,"['Universitas Lampung', 'Universitas Lampung', 'Universitas Lampung', 'Universitas Lampung']",,,
7,pub,7,public,2018-05-30 02:39:59,['FP15'],"Rusip is one of typical lactic acid fish fermented food originating from Bangka Belitung.  To develop this product, the data of lactic acid bacteria involved during fermentation is  necessary. This research was aimed at preliminary identifying the lactic",disk0/00/00/69/49,http://repository.lppm.unila.ac.id/id/eprint/6949,2018-03-01,"Rusip is one of typical lactic acid fish fermented food originating from Bangka Belitung. 
To develop this product, the data of lactic acid bacteria involved during fermentation is 
necessary. This research was aimed at preliminary identifying the lactic acid bacteria at 
selected day of “rusip” fermentation. A number of 29 isolates were chosen to be isolated 
and identified. The results showed that the lactic acid bacteria involved at day 1‒15 were Streptococcus
 in the beginning and Lactococcus  in the middle of fermentation, while 
Leuconostoc
 were present along with fermentation.",,['QR'],Lactic acid bacteria during fish fermentation (rusip),TRUE,"[{'id': 'neti.yuliana@fp.unila.ac.id', 'name': {'honourific': None, 'lineage': None, 'family': 'Yuliana', 'given': 'Neti'}}, {'name': {'given': 'Dyah', 'honourific': None, 'family': 'Koesoemawardani', 'lineage': None}, 'id': None}, {'name': {'family': 'Susilawati', 'lineage': None, 'honourific': None, 'given': 'Susilawati'}, 'id': 'susilawati.1961@fp.unila.ac.id'}]",article,2018-05-30 02:39:59,"[{'eprintid': 6949, 'placement': 1, 'security': 'public', 'uri': 'http://repository.lppm.unila.ac.id/id/document/19922', 'pos': 1, 'format': 'text', 'main': 'MOJFPT-06-00167.pdf', 'files': [{'uri': 'http://repository.lppm.unila.ac.id/id/file/63720', 'filename': 'MOJFPT-06-00167.pdf', 'objectid': 19922, 'filesize': 709722, 'mtime': '2018-05-29 01:12:03', 'hash_type': 'MD5', 'hash': '9337340a4d06030d2cd74fad28937bc6', 'mime_type': 'application/pdf', 'datasetid': 'document', 'fileid': 63720}], 'docid': 19922, 'rev_number': 2, 'language': 'en', 'mime_type': 'application/pdf'}]",1082,show,211-216,2018-05-30 02:39:59,6949,archive,,,MedCrave,,,,,http://medcraveonline.com/MOJFPT/volume_issues?issueId=2144&volumeId=551,,,6.0,,2.0,DOI:  10.15406/mojfpt.2018.06.00167,[{'url': 'http://medcraveonline.com/MOJFPT/MOJFPT-06-00167.pdf'}]
