,rev_number,ispublished,status_changed,issn,full_text_status,publication,publisher,dir,divisions,date,uri,volume,abstract,subjects,date_type,refereed,title,creators,type,documents,official_url,lastmod,number,userid,pagerange,metadata_visibility,eprintid,eprint_status,datestamp,related_url
0,6,pub,2023-05-03 06:57:47,2829-2235 (ONLINE),public,Jurnal Pengabdian Fakultas Pertanian Universitas Lampung,Fakultas Pertanian Universitas Lampung,disk0_bak/00/05/09/96,['FP8'],2023-03-01,http://repository.lppm.unila.ac.id/id/eprint/50996,2,"Tujuan kegiatan ini adalah mengenalkan 
komoditas baru yaitu bunga krisan potong kepada 
kelompok tani dan kelompok wanita tani, di Desa 
Sungai Langka, Kec. Gedong Tataan, Kab. Pesawaran 
yang mengelola agrowisata. Bunga krisan potong ini 
diharapkan menjadi komoditas agrowisata baru yang 
dapat diandalkan, mengingat selama ini agrowisata di 
Sungai Langka mengandalkan komoditas tanaman 
tahunan seperti jeruk dan kopi. Metode Kegiatan 
pengabdian ini adalah pembuatan demplot budidaya
bunga krisan potong dalam rumah pelindung 
berukuran 5 m x 8 m yang terbuat dari bambu dengan 
atap plastik UV. Selain itu juga dilakukan ceramah dan 
diskusi tentang teknik budidaya krisan potong. Hasil 
akhir dari kegiatan ini adalah petani mulai mengenal
teknik budidaya krisan potong. Hasil penting lainnya 
yang didapat adalah seluruh peserta (100%) 
menyatakan perlu adanya komoditas baru untuk 
dikembangkan dan dan para peserta juga setuju 100% 
bunga krisan potong dikembangkan sebagai komoditas 
baru di Desa Sungai Langka sebagai komoditas 
pendukung agrowisata.",['S1'],published,TRUE,"PENGENALAN BUNGA KRISAN POTONG DI DESA SUNGAI 
LANGKA KAB. PESAWARAN SEBAGAI KOMODITAS BARU DI 
DESA AGROWISATA","[{'name': {'lineage': None, 'family': 'Agustiansyah', 'honourific': None, 'given': 'Agustiansyah'}, 'id': 'agustiansyah.1972@fp.unila.ac.id'}, {'id': 'rugayah.1961@fp.unila.ac.id', 'name': {'given': 'Rugayah', 'lineage': None, 'family': 'Rugayah', 'honourific': None}}, {'name': {'given': 'Agus', 'lineage': None, 'family': 'Agus Karyanto', 'honourific': None}, 'id': None}, {'id': 'tumiar.katarina@fp.unila.ac.id', 'name': {'family': 'Manik', 'lineage': None, 'honourific': None, 'given': 'Tumiar Katarina'}}]",article,"[{'security': 'public', 'uri': 'http://repository.lppm.unila.ac.id/id/document/190707', 'pos': 1, 'eprintid': 50996, 'placement': 1, 'language': 'en', 'rev_number': 1, 'mime_type': 'application/pdf', 'format': 'text', 'files': [{'mime_type': 'application/pdf', 'hash': 'd0d667fee6cfd11f2fe8cfdbe5bd9d5e', 'fileid': 548602, 'datasetid': 'document', 'uri': 'http://repository.lppm.unila.ac.id/id/file/548602', 'filename': 'Pengembangan Bunga Krisan.pdf', 'filesize': 980901, 'objectid': 190707, 'mtime': '2023-05-03 03:51:04', 'hash_type': 'MD5'}], 'main': 'Pengembangan Bunga Krisan.pdf', 'docid': 190707}]",https://jurnal.fp.unila.ac.id/INDEX.PHP/JPFP,2023-05-03 06:57:47,1,325,60-70,show,50996,archive,2023-05-03 06:57:47,
1,7,pub,2023-07-21 03:57:46,e-ISSN 2356-1424,public,SAINS TANAH – Journal of Soil Science and Agroclimatology,Sebelas Maret University,disk0_bak/00/05/22/80,['FP8'],2023-06-30,http://repository.lppm.unila.ac.id/id/eprint/52280,20,"Lampung Province, Indonesia local government intended to extend shallot cultivation in Mesuji Regency, Lampung (-3.86, 105.43). Mesuji has 21,863.5 ha dry land area, with 
unproductive land of 10,325.6 ha which could be potential for growing shallot. However, horticulture crops such as shallot often face obstacles in dry land since dry land 
characterized with poor soil nutrient and limited water. The objective of this research are to analyze the effects of nitrogen fertilizer and different irrigation volumes on shallot growth and production, investigate shallot suitability to Mesuji agro-climate, and estimate shallot yield potential in Mesuji. The treatments on factorial split block were: without N, 80 kg N ha-1, 160 kg N ha-1, and 240 kg N ha-1 and the irrigation levels: 25, 50, 75 and 100% of ETc; ETc is crops evapotranspiration. The Mesuji agro-climate was evaluated using standardized precipitation index (SPI) and the yield was simulated by Aquacrop model. The results showed that the effort of shallots production with a high fresh weight of bulbs and biomass in the Mesuji area requested water at least 75% ETc and N fertilizer doses of 160 kg N ha-1. The SPI indicated near normal condition was more than 65%, and drought existed in a small percentage in both places (a total of 16.9% for Brebes the centre of shallot production and 19.43% for Mesuji). The AquaCrop simulation gave a good yield estimation (simulated 19.451 ton ha-1 and observed 17.351 ton ha-1). There is a possibility that shallot will grow well in the Mesuji area even though the quality of the shallot should be further tested",['S1'],published,TRUE,"Shallot growth and yield supported by irrigation and nitrogen application in utilizing 
dry land area in Mesuji, Lampung Province, Indonesia","[{'id': 'tumiar.katarina@fp.unila.ac.id', 'name': {'honourific': None, 'lineage': None, 'family': 'Manik', 'given': 'Tumiar Katarina'}}, {'id': 'paul.timotiwu@gmail.com', 'name': {'lineage': None, 'family': 'Timotiwu', 'honourific': None, 'given': 'P.B.'}}]",article,"[{'language': 'en', 'rev_number': 1, 'mime_type': 'application/pdf', 'main': 'Sain Tanah Shallot.pdf', 'docid': 253165, 'files': [{'hash_type': 'MD5', 'mtime': '2023-07-21 02:39:38', 'objectid': 253165, 'filesize': 1728197, 'uri': 'http://repository.lppm.unila.ac.id/id/file/619657', 'filename': 'Sain Tanah Shallot.pdf', 'fileid': 619657, 'datasetid': 'document', 'mime_type': 'application/pdf', 'hash': '8997d31a2ebe904b631a5148707a1433'}], 'format': 'text', 'pos': 1, 'uri': 'http://repository.lppm.unila.ac.id/id/document/253165', 'security': 'public', 'placement': 1, 'eprintid': 52280}]",https://jurnal.uns.ac.id/tanah,2023-07-21 03:57:46,1,325,100-113,show,52280,archive,2023-07-21 03:57:46,[{'url': 'http://dx.doi.org/10.20961/stjssa.v20i1.70711'}]
2,6,pub,2023-07-21 03:57:48,ISSN 2770-2928,public,International Journal of Agriculture and Technology,Scivision Publisher,disk0_bak/00/05/22/81,['FP8'],2023-04-10,http://repository.lppm.unila.ac.id/id/eprint/52281,3,"This field research was conducted from June to August 2022 at the research station of Agriculture Extension, 
Mesuji District, Mesuji Regency, Lampung Province, Indonesia. The study aimed to determine the effect of nitrogen 
fertilization and irrigation on different levels of treatment on shallot growth and yield in dry land. The experiment was a factorial design in a striped plot with three replications. The first factor was nitrogen fertilizer levels, namely 0 kg N/ha (N0), 80 kg N/ha (N80), 160 kg N/ha (N160) and 240 kg (N240); the second factor was irrigation with four levels, namely 25% ETc (W25), 50% ETc (W50), 75% ETc (W75) and 100% ETc (W100). The variables observed were plant height, number of leaves, fresh weight of tubers, diameter of tubers, dry weight of tubers and harvest index. The results showed that the significant effect of treatment was more due to the main effect of nitrogen fertilizer and irrigation factors. Nitrogen fertilizer has a significant effect on plant height, fresh weight of tubers, tuber diameter, dry weight of tubers and harvest index, while the number of leaves and canopy cover have not been significantly affected. The irrigation treatment significantly affected all observed variables, while only the dry weight variables of tubers showed a noticeable interaction effect of nitrogen fertilization and irrigation. The best treatment to support the growth and yield of shallots in dry land results from fertilizing nitrogen (N) 160 kg N/ha and irrigating 75% Etc",['S1'],published,TRUE,"Applied Nitrogen Fertilization and Irrigation on Improving Shallot (Allium 
ascolanicum L.) Growth and Yield on Dry Land in Mesuji, Lampung Province, Indonesia","[{'name': {'honourific': None, 'lineage': None, 'family': 'Timotiwu', 'given': 'P.B.'}, 'id': 'paul.timotiwu@gmail.com'}, {'id': 'tumiar.katarina@fp.unila.ac.id', 'name': {'honourific': None, 'lineage': None, 'family': 'Manik', 'given': 'Tumiar Katarina'}}]",article,"[{'rev_number': 1, 'language': 'en', 'mime_type': 'application/pdf', 'files': [{'mime_type': 'application/pdf', 'hash': '61f3dfb542f6da0a482255aa0d3a6d27', 'fileid': 619669, 'datasetid': 'document', 'uri': 'http://repository.lppm.unila.ac.id/id/file/619669', 'filename': 'applied-nitrogen-fertilization-and-irrigation-on-improving-shallot-allium-ascolanicum-l-growth-and-yield-on-dry-land-in-mesuji-lam-2780.pdf', 'filesize': 432852, 'objectid': 253171, 'mtime': '2023-07-21 03:00:50', 'hash_type': 'MD5'}], 'main': 'applied-nitrogen-fertilization-and-irrigation-on-improving-shallot-allium-ascolanicum-l-growth-and-yield-on-dry-land-in-mesuji-lam-2780.pdf', 'docid': 253171, 'format': 'text', 'pos': 1, 'uri': 'http://repository.lppm.unila.ac.id/id/document/253171', 'security': 'public', 'placement': 1, 'eprintid': 52281}]",https://www.scivisionpub.com/journals/international-journal-of-agriculture-and-technology-home,2023-07-21 03:57:48,1,325,1-7,show,52281,archive,2023-07-21 03:57:48,[{'url': 'DOI: 10.33425/2770-2928.1016'}]
