,subjects,date_type,volume,abstract,date,uri,publisher,dir,publication,divisions,status_changed,issn,full_text_status,rev_number,ispublished,eprintid,id_number,eprint_status,datestamp,pagerange,metadata_visibility,number,userid,documents,official_url,lastmod,creators,type,refereed,title,pages,patent_applicant,place_of_pub,related_url,contributors,pres_type,event_dates,event_location,contact_email,event_title,event_type,department,monograph_type,institution
0,['S1'],published,71.0,"The formacell process produces black liquor that damages the environment. Previous research has shown that black liquor can be used as a cooking solution for pulping. The pulping process using formacell waste on oil palm empty bunches produces a dark color; therefore, it requires a bleaching process. The aim of this study was to determine the effect of the type of cooking solution (fresh pulping solution and leachate residual from pulping) and bleaching time (0.5, 1, 1.5, 2, and 2.5 h) on pulp yield, cellulose content, permanganate number, and score on whiteness degree. The bleaching process used 35% peracetic acid and was conducted at 80°C. The best results were obtained at a bleaching time of 2 h, which resulted in yields of 76.1%-81.2%, cellulose contents of 53%-62.5%, permanganate numbers of 6.3-7.4, and scores of color of 3.78 (yellowish white) to 4.7 (white).",2020-09-01 00:00:00.000000000,http://repository.lppm.unila.ac.id/id/eprint/24704,Revista de Chimie,disk0/00/02/47/04,Revista de Chimie,['FP22'],2020-11-09 09:07:31,2668-8212,public,7,pub,24704,https://doi.org/10.37358/RC.20.9.8334,archive,2020-11-09 09:07:31,242-250,show,9.0,1027,"[{'mime_type': 'application/pdf', 'language': 'en', 'rev_number': 1, 'files': [{'hash': '9c57f1cc3d61b7467107d8e697eca346', 'mime_type': 'application/pdf', 'fileid': 224145, 'datasetid': 'document', 'mtime': '2020-11-09 01:27:52', 'hash_type': 'MD5', 'filename': 'Bleaching_Process_on_Oil_Palm_Empty_Bunches_by_Pul.pdf', 'uri': 'http://repository.lppm.unila.ac.id/id/file/224145', 'filesize': 2552800, 'objectid': 38454}], 'main': 'Bleaching_Process_on_Oil_Palm_Empty_Bunches_by_Pul.pdf', 'docid': 38454, 'format': 'text', 'uri': 'http://repository.lppm.unila.ac.id/id/document/38454', 'pos': 1, 'security': 'public', 'placement': 1, 'eprintid': 24704}]",https://www.revistadechimie.ro/Articles.asp?ID=8334,2020-11-09 09:07:31,"[{'id': 'srihidayati.unila@gmail.com', 'name': {'lineage': None, 'family': 'Hidayati', 'honourific': None, 'given': 'Sri'}}, {'name': {'given': 'R.', 'honourific': None, 'family': 'Sugiharto', 'lineage': None}, 'id': None}, {'name': {'given': 'Sutopo', 'honourific': None, 'lineage': None, 'family': 'Hadi'}, 'id': 'sutopo.hadi@fmipa.unila.ac.id'}]",article,TRUE,Bleaching Process on Oil Palm Empty Bunches by Pulping Using Formacell Liquid Waste,,,,,,,,,,,,,,
1,['S1'],completed,,"Aktivitas S. cerevisiae dalam melakukan perombakan komponenbahan pangan sangat berkaitan dengan enzim yang diproduksi olehnya.Disamping itu, S. cerevisiae dapat menghasilkan beragam metabolit sekunder,penghasil berbagai senyawa kimia, semacam pabrik sel mikroba. S. cerevisiaememiliki status yang GRAS (generally recognized as safe), yang merupakankeuntungan dalam produksi senyawa untuk konsumsi manusia (mis.pembentukan antioksidan dan senyawa aroma selama fermentasi). Sel khamiryang mengalami lisis susunan selnya hancur, terjadi degradasi enzimatikkomponen makromolekul yang dibebaskan ke dalam lingkungan/substratbeserta enzimnya. Saccharomyces cerevisiae merupakan sumber yang kayavitamin B dan kromium, dan telah banyak dipelajari secara ekstensif sebagaibahan obat. Telah dilaporkan penggunaan ragi (Saccharomyces boulardii atauSaccharomyces cerevisiae, khamir roti komersial) sebagai agen biotherapeutic
potensial yang kombinasi dengan antibiotik standar untuk pengobatan diareyang disebabkan oleh Clostridium diffi cile dan kolitis. Sebagai sumber vitaminB, strain Saccharomyces cerevisiae dapat menghilangkan stres, depresi, mudahtersinggung, dan kelelahan dan juga membantu mengurangi beberapa efekpenuaan. Sebagai sumber biotin, Saccharomyces cerevisiae bisa memperkuat
rambut dan kuku, dan mengobati cradle cap dan diabetes neuropati.Sebagai sumber kromium, Saccharomyces cerevisiae dapat menurunkan kadargula darah pada orang dengan diabetes tipe-2, mengurangi risiko kolesterol
tinggi dalam darah, dan membantu dalam pengobatan jerawat kronis danfurunkulosis. Kromium merupakan senyawa yang sulit bagi tubuh untukmenyerap, tetapi lebih mudah diserap bila berada bersama sama denganSaccharomyces cerevisiae. Selain itu, Saccharomyces cerevisiae juga memilikibeberapa mineral termasuk selenium, zinc, fosfor dan magnesium, yangsering digunakan untuk menghilangan nafsu makan. Buku ini menjabarkanPendahuluan beberapa peran S.cerevisiae dalam perombakan komponen kimia bahan
pangan, produk metabolit yang dihasilkan, struktur dan fungsi dindingsel, dan perannya dalam memodifi kasi pangan seperti produk tapiokatermodifi kasi, modifi kasi fermentasi kakao dan kopi, tempe termodifi kasi,serta madu.",2020-02-19 00:00:00.000000000,http://repository.lppm.unila.ac.id/id/eprint/21452,,disk0/00/02/14/52,,['FP22'],2020-06-02 05:02:32,,public,8,pub,21452,"EC00202007015, 19 Februari 2020. No pencatatan 000180041",archive,2020-06-02 05:02:32,,show,,1017,"[{'security': 'public', 'uri': 'http://repository.lppm.unila.ac.id/id/document/34860', 'pos': 1, 'eprintid': 21452, 'placement': 1, 'mime_type': 'application/pdf', 'language': 'en', 'rev_number': 1, 'format': 'text', 'files': [{'filename': '29.sertifikat_Maria Erna Hak Cipta.pdf', 'uri': 'http://repository.lppm.unila.ac.id/id/file/199174', 'filesize': 769769, 'objectid': 34860, 'mtime': '2020-06-02 04:26:48', 'hash_type': 'MD5', 'mime_type': 'application/pdf', 'hash': 'e0abc76860d7facb6e40793864663d60', 'datasetid': 'document', 'fileid': 199174}], 'main': '29.sertifikat_Maria Erna Hak Cipta.pdf', 'docid': 34860}]",,2020-06-02 05:02:32,"[{'id': 'maria.erna@fp.unila.ac.id', 'name': {'lineage': None, 'family': 'Kustyawati', 'honourific': None, 'given': 'Maria Erna'}}]",patent,,"Buku :SACCHARPMYCES CEREVISIAE : Metabolit Dan Agensia
Modifikasi Pangan",176.0,"Dr. Dra. Maria Erna Kustyawati, M.Sc",,,,,,,,,,,,
2,['S1'],published,,"Aktivitas S. cerevisiae dalam melakukan perombakan komponen bahan pangan sangat berkaitan dengan enzim yang diproduksi olehnya.Disamping itu, S. cerevisiae dapat menghasilkan beragam metabolit sekunder,penghasil berbagai senyawa kimia, semacam pabrik sel mikroba. S. cerevisiae memiliki status yang GRAS (generally recognized as safe), yang merupakan keuntungan dalam produksi senyawa untuk konsumsi manusia (mis.pembentukan antioksidan dan senyawa aroma selama fermentasi). Sel khamir yang mengalami lisis susunan selnya hancur, terjadi degradasi enzimatik
komponen makromolekul yang dibebaskan ke dalam lingkungan/substrat beserta enzimnya. Saccharomyces cerevisiae merupakan sumber yang kaya vitamin B dan kromium, dan telah banyak dipelajari secara ekstensif sebagai bahan obat. Telah dilaporkan penggunaan ragi (Saccharomyces boulardii atau Saccharomyces cerevisiae, khamir roti komersial) sebagai agen biotherapeutic
potensial yang kombinasi dengan antibiotik standar untuk pengobatan diare yang disebabkan oleh Clostridium diffi cile dan kolitis. Sebagai sumber vitamin B, strain Saccharomyces cerevisiae dapat menghilangkan stres, depresi, mudah tersinggung, dan kelelahan dan juga membantu mengurangi beberapa efek penuaan. Sebagai sumber biotin, Saccharomyces cerevisiae bisa memperkuat
rambut dan kuku, dan mengobati cradle cap dan diabetes neuropati.Sebagai sumber kromium, Saccharomyces cerevisiae dapat menurunkan kadar gula darah pada orang dengan diabetes tipe-2, mengurangi risiko kolesterol
tinggi dalam darah, dan membantu dalam pengobatan jerawat kronis dan furunkulosis. Kromium merupakan senyawa yang sulit bagi tubuh untuk menyerap, tetapi lebih mudah diserap bila berada bersama sama dengan Saccharomyces cerevisiae. Selain itu, Saccharomyces cerevisiae juga memiliki beberapa mineral termasuk selenium, zinc, fosfor dan magnesium, yang sering digunakan untuk menghilangan nafsu makan. Buku ini beberapa peran S.cerevisiae dalam perombakan komponen kimia bahan pangan, produk metabolit yang dihasilkan, struktur dan fungsi dinding sel, dan perannya dalam memodifi kasi pangan seperti produk tapioka termodifi kasi, modifi kasi fermentasi kakao dan kopi, tempe termodifi kasi,serta madu.",2020-02-19 00:00:00.000000000,http://repository.lppm.unila.ac.id/id/eprint/20776,,disk0/00/02/07/76,,['FP22'],2020-05-28 02:23:01,,public,8,pub,20776,"EC00202007015, 19 Februari 2020. No pencatatan 000180041",archive,2020-05-28 02:23:01,,show,,1017,"[{'mime_type': 'application/pdf', 'language': 'en', 'rev_number': 1, 'format': 'text', 'main': '29.sertifikat_Maria Erna Hak Cipta.pdf', 'docid': 34120, 'files': [{'uri': 'http://repository.lppm.unila.ac.id/id/file/194527', 'filename': '29.sertifikat_Maria Erna Hak Cipta.pdf', 'objectid': 34120, 'filesize': 769769, 'mtime': '2020-05-28 01:22:59', 'hash_type': 'MD5', 'hash': 'e0abc76860d7facb6e40793864663d60', 'mime_type': 'application/pdf', 'fileid': 194527, 'datasetid': 'document'}], 'security': 'public', 'uri': 'http://repository.lppm.unila.ac.id/id/document/34120', 'pos': 1, 'eprintid': 20776, 'placement': 1}]",https://dgip.go.id/,2020-05-28 02:23:01,"[{'id': 'maria.erna@fp.unila.ac.id', 'name': {'lineage': None, 'family': 'Kustyawati', 'honourific': None, 'given': 'Maria Erna'}}]",patent,,"Hak Cipta: SACCHARPMYCES CEREVISIAE : Metabolit Dan Agensia
Modifikasi Pangan",176.0,"Dr. Dra. Maria Erna Kustyawati, M.Sc",,,,,,,,,,,,
3,['S1'],published,,"Tempeh, a fermented soybean-based food originally from Indonesia, is a remarkably nutritious functional food with health benefits. Unfortunately, tempeh is highly perishable, with a shelf life of 24 – 48 hours. The goal of this research was to evaluate the possibility of a sub-supercritical CO2 technique to increase the shelf life of tempeh by measuring the changes in the L* (lightness) value and texture of tempeh via application of a kinetic approach and, based on the observations, to estimate its shelf life. Tempeh was processed with sub-supercritical CO2 at 6.3 MPa for 10 min, then together with unprocessed tempeh (control), stored for 5 days at temperatures of 20, 30 and 40 °C. The Accelerated Self-Life Test (ASLT) with the Arrhenius model was used to measure the shelf life of processed and control tempeh. The calculated shelf life of processed tempeh using the ASLT by the Arrhenius method was 2.43 days at 20 °C, 3.7 days at 30 °C and 1.4 days at 40 °C, and the shelf life of unprocessed tempeh was 3.33 days at 20 °C, 2.90 days at 30 °C and 2.56 days at 40 °C. The conclusion was that the use of sub-supercritical CO2 at 6.3 MPa for 10 min increased the shelf life of tempeh stored at 30 °C.",2020-06-01 00:00:00.000000000,http://repository.lppm.unila.ac.id/id/eprint/23926,"Association HACCP Consulting. Slivkova 12, 951 01 Nitrianske Hrnciarovce, Slovakia, European Union",disk0/00/02/39/26,,['FP22'],2020-09-08 07:03:26,,public,8,pub,23926,1337-0960,archive,2020-09-08 07:03:26,,show,,1017,"[{'format': 'text', 'main': 'SHELF_LIFE_OF_TEMPEH_PROCESSED_WITH_SUB_SUPERCRITI.pdf', 'docid': 37605, 'files': [{'hash_type': 'MD5', 'mtime': '2020-09-08 05:08:02', 'filesize': 2416986, 'objectid': 37605, 'filename': 'SHELF_LIFE_OF_TEMPEH_PROCESSED_WITH_SUB_SUPERCRITI.pdf', 'uri': 'http://repository.lppm.unila.ac.id/id/file/218117', 'datasetid': 'document', 'fileid': 218117, 'mime_type': 'application/pdf', 'hash': '10f25e5db5089a36729fe8905669f279'}], 'mime_type': 'application/pdf', 'language': 'en', 'rev_number': 1, 'eprintid': 23926, 'placement': 1, 'security': 'public', 'uri': 'http://repository.lppm.unila.ac.id/id/document/37605', 'pos': 1}]",https:// www.potravinarstvo.com,2020-09-08 07:03:26,"[{'id': 'maria.erna@fp.unila.ac.id', 'name': {'honourific': None, 'family': 'Kustyawati', 'lineage': None, 'given': 'Maria Erna'}}, {'name': {'given': 'Filli', 'lineage': None, 'family': 'Pratama', 'honourific': None}, 'id': None}, {'id': None, 'name': {'family': 'Saputra', 'lineage': None, 'honourific': None, 'given': 'Daniel'}}, {'name': {'given': 'Agus', 'family': 'Wijaya', 'lineage': None, 'honourific': None}, 'id': None}]",other,,SHELF LIFE OF TEMPEH PROCESSED WITH SUB-SUPERCRITICAL CARBON DIOXIDES,,,"Nitra, Slovakia, European Union",,,,,,,,,,,
4,['S1'],,5.0,"Most studies have found that vitamin B12 in tempeh is produced by contaminating bacteria specifically, Klebsiella sp. and Citrobacter freundii, during fungal fermentation. This study is to evaluate the effect of starter culture on the vitamin B12 and isoflavone aglicone content of soybean fermentation for tempeh production. In this study, soybeans were washed, soaked in water overnight, dehulled and sterilized by boiling at 100 ℃ for 30 min. Three starter cultures (103 CFU g−1) namely Rhizopus oligosporus, Klebsiella sp. and Saccharomyces cerevisiae were then inoculated as follows, soybeans + R. oligosporus + Klebsiella sp. (SRK), soybeans + R. oligosporus + S. cerevisiae (SRSc), soybeans + R. oligosporus + S. cerevisiae + Klebsiella sp. (SRScK), and Soy + R. oligosporus (SR) and soybeans + Klebsiella sp (SK). Inoculated soybeans were then incubated at 30 ± 2 ℃ for 40 hours (tempeh-style). The growth of Klebsiella sp., S. cerevisiae, R. oligosporus and the production of vitamin B12 as well as isoflavone aglicones were observed. The results showed the highest vitamin B12 3.15 mg 100 g−1 was found in tempeh SRSc, followed by 2.88 mg 100 g−1 and 1.64 mg 100 g−1 in tempeh SR and SRScK, respectively. In addition, vitamin B12 in tempeh SRK was the lowest (0.81 mg 100 g−1). All the starter cultures were able to hydrolyze daidzin and genistin, but the amount of daidzein and genistein was tripled and doubled, respectively when Klebsiella sp was inoculated to the soybean fermentation. The study suggested that S. cerevisiae contributes to the production of vitamin B12, while Klebsiella sp contributes to production of daidzein and genistein in soybean fermentation for tempeh production.",2020-06-15 00:00:00.000000000,http://repository.lppm.unila.ac.id/id/eprint/22623,AIMS Press,disk0/00/02/26/23,AIMS Agriculture and Food,['FP22'],2020-06-18 02:37:43,2471-2086,public,6,pub,22623,,archive,2020-06-18 02:37:43,262-271,show,2.0,1017,"[{'pos': 1, 'uri': 'http://repository.lppm.unila.ac.id/id/document/36096', 'security': 'public', 'placement': 1, 'eprintid': 22623, 'language': 'en', 'mime_type': 'application/pdf', 'rev_number': 1, 'main': 'agrfood-05-02-262.pdf', 'docid': 36096, 'files': [{'filesize': 255450, 'objectid': 36096, 'filename': 'agrfood-05-02-262.pdf', 'uri': 'http://repository.lppm.unila.ac.id/id/file/207483', 'hash_type': 'MD5', 'mtime': '2020-06-18 02:19:57', 'fileid': 207483, 'datasetid': 'document', 'mime_type': 'application/pdf', 'hash': 'c04a68ee74b7770facb0cb0b162679a0'}], 'format': 'text'}]",http://www.aimspress.com/journal/agriculture,2020-06-18 02:37:43,"[{'id': 'maria.erna@fp.unila.ac.id', 'name': {'given': 'Maria Erna', 'honourific': None, 'lineage': None, 'family': 'Kustyawati'}}, {'id': 'subeki1968@fp.unila.ac.id', 'name': {'given': 'subeki', 'honourific': None, 'lineage': None, 'family': 'subeki'}}, {'id': 'murhadiburcik@gmail.com', 'name': {'family': 'Murhadi', 'lineage': None, 'honourific': None, 'given': 'Murhadi'}}, {'name': {'given': 'Samsul', 'honourific': None, 'lineage': None, 'family': 'Rizal'}, 'id': 'samsul.rizal@fp.unila.ac.id'}]",article,TRUE,Vitamin B12 production in soybean fermentation for tempeh,,,,,,,,,,,,,,
5,"['S1', 'SB']",published,12.0,"Tepung onggok terfermentasi mengandung pati 46,69%, serat pangan 13,49% dan protein 6,98%, mempunyai potensi untuk substitusi tepung terigu pada pembuatan crackers. Penelitian ini bertujuan untuk mendapatkan substitusi tepung onggok terfermentasi yang menghasilkan sifat sensori crackers yang masih baik sesuai dengan Standar Mutu Biskuit SNI 2973-2011. Tepung onggok terfermentasi disubsitusikan menggantikan tepung terigu sebesar 0% (b/b); 5% (b/b); 10% (b/b); 15% (b/b); 20% (b/b) dan 25% (b/b). Adonan sesuai resep crackers kemudian dicetak dan dioven. Crackers yang dihasilkan diamati tekstur menggunakan uji skoring sedangkan rasa, aroma, warna dan penerimaan keseluruhan menggunakan uji hedonik. Data dianalisis dengan ANARA dan dilanjutkan dengan uji Orthogonal Contrast (OC) taraf 5%. Perlakuan terbaik kemudian dilakukan uji proksimat serta dilakukan uji banding dengan crackers yang menggunakan onggok dari industri tapioka yang difermentasi untuk melihat prospek aplikasinya dalam skala industri. Hasil penelitian menunjukkan bahwa crackers dengan substitusi tepung onggok terfermentasi 5% (b/b) memiliki karakteristik sensori yang masih diterima/disukai yaitu tekstur 3,89 (renyah), rasa 3,59 (suka), warna 3,76 (suka), aroma 3,52 (suka) dan penerimaan keseluruhan 3,66 (suka) serta mengandung kadar air 1,97%, kadar abu 1,98%, kadar protein 7,28%, kadar lemak 15,23%, karbohidrat 73,54 dan total serat pangan 7,30%. Kelebihan dari crackers ini adalah kandungan seratnya yang tinggi. Crackers ini mempunyai peluang tinggi untuk dikembangkan dengan memanfaatkan onggok dari industri tapioka  yang difermentasi karena hasil uji Crcakers yang dihasilkan memiliki karakteristik yang sama dengan yang disubstitusi dari onggok fermentasi yang dibuat skala laboratorium.  Kata kunci: Crackers, sifat sensori, substitusi, Tepung onggok terfermentasi",2020-06-01 00:00:00.000000000,http://repository.lppm.unila.ac.id/id/eprint/25450,"Balai Riset dan Standardisasi Industri Bandar Lampung, Prov. Lampung, Indonesia Post Code 35144 Phone (0721)706353  Email: baristandlampung@gmail.com",disk0/00/02/54/50,Majalah Teknologi Agro Industri (Tegi),['FP22'],2020-11-16 06:05:50,E-ISSN 2656-8411,public,9,pub,25450,,archive,2020-11-16 06:05:50,21-28,show,1.0,4371,"[{'format': 'text', 'main': '5971-23773-1-PB.pdf', 'docid': 39243, 'files': [{'mime_type': 'application/pdf', 'hash': 'ab438c20f4b85b5b74af286efe5f78fb', 'fileid': 229750, 'datasetid': 'document', 'mtime': '2020-11-16 04:26:15', 'hash_type': 'MD5', 'uri': 'http://repository.lppm.unila.ac.id/id/file/229750', 'filename': '5971-23773-1-PB.pdf', 'filesize': 363378, 'objectid': 39243}], 'language': 'en', 'rev_number': 1, 'mime_type': 'application/pdf', 'eprintid': 25450, 'placement': 1, 'security': 'public', 'pos': 1, 'uri': 'http://repository.lppm.unila.ac.id/id/document/39243'}]",http://ejournal.kemenperin.go.id/tegi,2020-11-16 06:05:50,"[{'id': 'otiknawansih@yahoo.com', 'name': {'given': 'Otik', 'honourific': None, 'lineage': None, 'family': 'Nawansih'}}, {'name': {'lineage': None, 'family': 'rangga', 'honourific': None, 'given': 'azhari'}, 'id': 'azhari.rangga@fp.unila.ac.id'}, {'id': 'siti.nurdjanah@fp.unila.ac.id', 'name': {'given': 'Siti', 'lineage': None, 'family': 'Nurdjanah', 'honourific': None}}, {'name': {'family': 'Ernani', 'lineage': None, 'honourific': None, 'given': 'Anggi Putri'}, 'id': None}]",article,TRUE,Substitusi Tepung Onggok Terfermentasi Dalam Pembuatan Crackers,,,,"[{'url': 'http://ejournal.kemenperin.go.id/tegi', 'type': 'pub'}]",,,,,,,,,,
6,['S1'],published,2.0,"Provinsi Lampung adalah wilayah yang potensial untuk mengembangkan
tanaman perkebunan. Salah satu tanaman perkebuan yang sangat terkenal dan
menjadi ciri khas adalah kopi. Kopi merupakan komoditi masyarakat Lampung yang
sangat potensial dan perlu dikembangkan lebih lanjut agar memiliki nilai tambah.
Berdasarkan data dari BPS provinsi Lampung, produksi kopi yang sangat tinggi
menyebabkan ketersediaan bunga kopi yang melimpah. Melimpahnya bunga kopi
inilah yang melatar belakangi penelitian ini, selain itu belum pernah ada yang
melakukan penelitian mengenai teknik ekstraksi dan karakteristik yang terdapat
dalam komponen aromatik bunga kopi. Berdasarkan hasil penelitian diperoleh
rendemen yang paling tinggi dengan dengan metode enflurasi, akan tetapi aroma
yang dihasilkan hanya menyerupai bunga kopi sehingga metode terbaik untuk
ekstraksi bunga kopi adalah dengan metode hydrosol. Aroma yang dihasilkan
dengan metode hydrosol sangat menyerupai bunga kopi.",2020-03-01 00:00:00.000000000,http://repository.lppm.unila.ac.id/id/eprint/24763,Lembaga Penelitian dan Pengabdian pada Masyarakat (LPPM) Universitas Lampung,disk0/00/02/47/63,Journal of Tropical Upland Resources,['FP22'],2020-11-09 11:36:49,E-ISSN 2686-1151,public,6,pub,24763,,archive,2020-11-09 11:36:49,121-131,show,1.0,389,"[{'security': 'public', 'uri': 'http://repository.lppm.unila.ac.id/id/document/38511', 'pos': 1, 'eprintid': 24763, 'placement': 1, 'rev_number': 1, 'language': 'en', 'mime_type': 'application/pdf', 'format': 'text', 'files': [{'mtime': '2020-11-09 09:57:47', 'hash_type': 'MD5', 'uri': 'http://repository.lppm.unila.ac.id/id/file/224638', 'filename': '87-Article Text-168-1-10-20200614.pdf', 'objectid': 38511, 'filesize': 987881, 'mime_type': 'application/pdf', 'hash': '64be7bb1b165e4497520c564c0e29a58', 'datasetid': 'document', 'fileid': 224638}], 'main': '87-Article Text-168-1-10-20200614.pdf', 'docid': 38511}]",https://jtur.lppm.unila.ac.id/jtur,2020-11-09 11:36:49,"[{'name': {'given': 'SC', 'honourific': None, 'lineage': None, 'family': 'Rahmawati'}, 'id': None}, {'name': {'honourific': None, 'lineage': None, 'family': 'Utomo', 'given': 'tanto Pratondo'}, 'id': 'tanto.utomo@fp.unila.ac.id'}, {'id': 'srihidayati.unila@gmail.com', 'name': {'honourific': None, 'family': 'Hidayati', 'lineage': None, 'given': 'Sri'}}, {'name': {'given': 'Erdi', 'lineage': None, 'family': 'Suroso', 'honourific': None}, 'id': 'erdi.suroso@fp.unila.ac.id'}]",article,FALSE,Kajian Ekstraksi Komponen Aromatik Bunga Kopi Robusta (Coffea chanepora),,,,,[{'type': 'http://www.loc.gov/loc.terms/relators/CRP'}],,,,,,,,,
7,['S1'],submitted,,,2020-10-14 00:00:00.000000000,http://repository.lppm.unila.ac.id/id/eprint/44854,FiAC,disk0/00/04/48/54,,['FP22'],2022-09-12 01:13:03,,public,8,pub,44854,,archive,2022-09-12 01:13:03,,show,,306,"[{'main': '20220909_103421.pdf', 'files': [{'filesize': 205730, 'objectid': 166762, 'filename': '20220909_103421.pdf', 'uri': 'http://repository.lppm.unila.ac.id/id/file/484128', 'hash_type': 'MD5', 'mtime': '2022-09-09 03:56:52', 'fileid': 484128, 'datasetid': 'document', 'mime_type': 'application/pdf', 'hash': '30b90393dc97c8d0ae16ccbb3f15dfc9'}], 'docid': 166762, 'format': 'text', 'rev_number': 1, 'language': 'en', 'mime_type': 'application/pdf', 'placement': 1, 'eprintid': 44854, 'uri': 'http://repository.lppm.unila.ac.id/id/document/166762', 'pos': 1, 'security': 'public'}]",,2022-09-12 01:13:03,"[{'id': 'dewikincai@yahoo.com', 'name': {'honourific': None, 'lineage': None, 'family': 'Sartika', 'given': 'Dewi'}}]",other,,Peer review Identification of Food Natural Antimicrobe Compound from Waru Leaves (Hisbicus tillacaeus L.) Extract by GC-MC,,,,,,,,,,,,,,
8,['S1'],submitted,,"Chicken is the most common source of animal protein in Indonesia due to its high protein content and low price. However, because of was not a standardized process, chicken meats sold in the traditional market is mostly contaminated by pathogen bacteria such as Escherichia coli. Previous research indicated of waru (Hibiscus tillaceous L.) inhibited Escherichia coli growth. Therefore in this research, had aim 1) to study whether the antimicrobial activity of extracts of waru/hisbiscus by GCMS, 2) to find out the activity of waru that have antimicrobial activity against Escherichia coli contaminant. The results showed that the antimicrobial activity of waru leave extracts depends on the respective proportion in the blend. Increasing antimicrobial activity was observed when waru leaves extract concentration was an increase in the mixture. The results of the research showed that content of the leaves of waru was dominated by Phytol (38%); methyl ester (22,1%);  Pentadecanoic acid,14-methyl-Squalene (6,58%); Bis (2-Ethylhexyl) phthalate (5,94%); and ester compound, that had as an antimicrobe potency.",2020-10-16 00:00:00.000000000,http://repository.lppm.unila.ac.id/id/eprint/25416,,disk0/00/02/54/16,,['FP22'],2020-11-16 03:06:34,,public,10,submitted,25416,,archive,2020-11-16 03:06:34,,show,,306,"[{'security': 'public', 'pos': 1, 'uri': 'http://repository.lppm.unila.ac.id/id/document/39208', 'eprintid': 25416, 'placement': 1, 'mime_type': 'application/vnd.openxmlformats-officedocument.wordprocessingml.document', 'language': 'en', 'rev_number': 1, 'format': 'text', 'main': 'DEWI SARTIKA_FiAC_2020_full paper proceeding.docx', 'files': [{'filesize': 1137738, 'objectid': 39208, 'uri': 'http://repository.lppm.unila.ac.id/id/file/229503', 'filename': 'DEWI SARTIKA_FiAC_2020_full paper proceeding.docx', 'hash_type': 'MD5', 'mtime': '2020-11-16 02:56:01', 'datasetid': 'document', 'fileid': 229503, 'hash': 'e48b0bdb57d310de69d07ccadda5993c', 'mime_type': 'application/vnd.openxmlformats-officedocument.wordprocessingml.document'}], 'docid': 39208}]",,2020-11-16 03:06:34,"[{'name': {'given': 'Dewi', 'lineage': None, 'family': 'Sartika', 'honourific': None}, 'id': 'dewikincai@yahoo.com'}, {'id': None, 'name': {'lineage': None, 'family': 'Udayana', 'honourific': None, 'given': 'Samsu'}}, {'name': {'lineage': None, 'family': 'Susilawati', 'honourific': None, 'given': 'Susilawati'}, 'id': None}, {'name': {'given': 'Neti', 'honourific': None, 'family': 'Yuliana', 'lineage': None}, 'id': None}, {'name': {'honourific': None, 'lineage': None, 'family': 'wahyudi', 'given': 'wahyudi'}, 'id': None}]",conference_item,TRUE,Identification of Food Natural Antimicrobe Compound From Waru Leaves (Hisbicus Tillacaeus L.) Extract by GC-MC,,,,,,paper,14-16 october,bogor,dewikincai@yahoo.com,"The 6th FiA Conference 2020 “On Food Science, Nutrition and Health”",conference,,,
