,subjects,date_type,volume,abstract,date,uri,publisher,dir,publication,divisions,status_changed,issn,full_text_status,rev_number,ispublished,eprintid,id_number,eprint_status,datestamp,pagerange,metadata_visibility,number,userid,documents,official_url,lastmod,creators,type,refereed,title,pages,patent_applicant,place_of_pub,related_url,contributors,pres_type,event_dates,event_location,contact_email,event_title,event_type,department,monograph_type,institution
9,['S1'],published,1.0,"Laporan keuangan berfungsi sebagai alat untuk menganalisis kinerja keuangan yang dapat memberikan informasi tentang posisi keuangan, kinerja dan arus kas, sehingga dapat dijadikan sebagai dasar membuat keputusan-keputusan ekonomi. Usaha mikro yang berada di Kecamatan Air Hitam Kabupaten Lampung Barat merupakan usaha yang tumbuh secara tradisional dan merupakan usaha keluarga yang turun temurun. Keterbatasan kualitas SDM usaha kecil baik dari segi pendidikan formal maupun pengetahuan dan keterampilannya sangat berpengaruh terhadap manajemen pengelolaan usahanya, sehingga usaha tersebut sulit untuk berkembang dengan optimal. Unit usaha relatif sulit untuk mengadopsi perkembangan teknologi baru untuk meningkatkan daya saing produk, sehingga dengan mengembangkan produk ekonomi kreatif menjadi solusi agar dapat meningkatkan potensi keuntungan yang dapat dihasilkan dari SDA
disekitar. Manfaat yang diharapkan dari pengabdian ini yaitu dapat membantu usaha mikro dalam melaksanakan pembukuan dan membantu pengusaha menyusun laporan keuangan secara lengkap dan baik dengan format yang sederhana, yang dapat digunakan untuk memantau perkembangan progress keuangan dan membuat keputusan dalam mengembangkan usaha, serta untuk meningkatkan keterampilan masyarakat untuk pengembangan potensi produk ekonomi kreatif kopi menjadi Aromatheraphy dan Body Scrub, sehingga dapat meningkatkan pendapatan warga Pekon
Sumber Alam Kecamatan Air Hitam Lampung Barat. Kegiatan ini dilaksanakan selama 5 bulan (JuniNovember 2020) di Pekon Sumber Alam Air Hitam Lampugn Barat. Metode yang dilakukan adalah sosialisasi dan pelatihan workshop produksi aromatherapy dan bodyscrub yang diberikan kepada
ibu-ibu kelompok tani Pekon Sumber Alam. Evaluasi dilakukan disetiap kegiatan. Luaran yang ingin dicapai antara lain peningkatan produksi dan jurnal ilmiah pengabdian.",2020-12-28 00:00:00.000000000,http://repository.lppm.unila.ac.id/id/eprint/30132,LPPM Universitas Lampung,disk0/00/03/01/32,Jurnal Sinergi,['FP22'],2021-05-11 00:49:41,XXXX-XXXX,public,7,pub,30132,,archive,2021-05-11 00:49:41,29-33,show,2.0,5609,"[{'uri': 'http://repository.lppm.unila.ac.id/id/document/135299', 'pos': 1, 'security': 'public', 'placement': 1, 'eprintid': 30132, 'mime_type': 'application/pdf', 'language': 'en', 'rev_number': 2, 'docid': 135299, 'main': '5-Article Text-14-2-10-20201228 (2).pdf', 'files': [{'datasetid': 'document', 'fileid': 357169, 'hash': '5fea3050550d947fa298dea172162fa3', 'mime_type': 'application/pdf', 'filesize': 286565, 'objectid': 135299, 'uri': 'http://repository.lppm.unila.ac.id/id/file/357169', 'filename': '5-Article Text-14-2-10-20201228 (2).pdf', 'hash_type': 'MD5', 'mtime': '2021-05-10 07:30:22'}], 'format': 'text'}]",https://sinergi.lppm.unila.ac.id/index.php/jsi/article/view/5,2021-05-11 00:49:41,"[{'id': 'teguh.setiawan@fp.unila.ac.id', 'name': {'honourific': None, 'family': 'Setiawan', 'lineage': None, 'given': 'Teguh'}}, {'id': 'lathifa.indraningtyas@fp.unila.ac.id', 'name': {'given': 'Lathifa', 'honourific': None, 'family': 'Indraningtyas', 'lineage': None}}, {'id': 'esa.ghanim@fp.unila.ac.id', 'name': {'given': 'Esa Ghanim', 'honourific': None, 'family': 'Fadhallah', 'lineage': None}}]",article,TRUE,Pentingnya Pembukuan Laporan Keuangan pada Usaha Mikro dan Menengah serta Pengembangan Ekonomi Kreatif Potensi Sumber Daya Alam di Pekon Sumber Alam Kecamatan Air Hitam,,,,[{'url': 'https://sinergi.lppm.unila.ac.id/index.php/jsi/article/view/5'}],,,,,,,,,,
10,['S1'],published,,"Jenis ciptaan : Buku

Judul ciptaan : Teknologi Fermentasi Asam Laktat Hasil-Hasil  
                Pertanian

Pemegang hak cipta: Neti Yuliana",2020-02-20 00:00:00.000000000,http://repository.lppm.unila.ac.id/id/eprint/21899,Dirjen Kekayaan Intelektual,disk0/00/02/18/99,,['FP22'],2020-06-04 17:08:25,,public,7,pub,21899,,archive,2020-06-04 17:08:25,,show,,1082,"[{'files': [{'mtime': '2020-06-04 16:26:34', 'hash_type': 'MD5', 'filename': '2020 Sertifikat  Hak Cipta Buku Tek Fermentasi Laktat_Neti Yuliana.pdf', 'uri': 'http://repository.lppm.unila.ac.id/id/file/202303', 'filesize': 769500, 'objectid': 35317, 'hash': 'f29a25e810c33f7090ad29a437c8e792', 'mime_type': 'application/pdf', 'datasetid': 'document', 'fileid': 202303}], 'main': '2020 Sertifikat  Hak Cipta Buku Tek Fermentasi Laktat_Neti Yuliana.pdf', 'docid': 35317, 'format': 'text', 'language': 'en', 'mime_type': 'application/pdf', 'rev_number': 1, 'placement': 1, 'eprintid': 21899, 'uri': 'http://repository.lppm.unila.ac.id/id/document/35317', 'pos': 1, 'security': 'public'}]",,2020-06-04 17:08:25,"[{'name': {'given': 'Neti', 'honourific': None, 'family': 'Yuliana', 'lineage': None}, 'id': 'neti.yuliana@fp.unila.ac.id'}]",other,,"EC00202006133, 20 Februari 2020. Hak cipta buku (Neti Yuliana)",,,,,"[{'name': {'honourific': None, 'family': 'Yuliana', 'lineage': None, 'given': 'Neti'}, 'type': 'http://www.loc.gov/loc.terms/relators/AUT'}]",,,,,,,,,
11,['S1'],published,13.0,"Background and Objective:  The  lactic  acid  fermentation  without  starter  addition  (natural  fermentation)  may  provide  a  standardpreservation technique to produce sweet potatoes pickle that can be adopted at the household level. The objective of this study was toinvestigate the potential use of natural fermentation with variants of salt concentration to produce acceptably pickled of orange-fleshedsweet potatoes. Materials and Methods: The cubes were pickled by lactic fermentation by brine the cut and blanched cubes in fiveconcentration level of common salt (NaCl, 1-6%) solutions and incubated for 12 days. Every 2 days, the sample was withdrawn for thevarious analysis, i.e., total acidity pH, total soluble solid, reducing sugar and total lactic acid bacteria. Meanwhile, the sensory was measuredonly  for  day  12  fermentations. Results:  All  physicochemical  and  sensory  of  pickled  were  affected  by  salt concentration  during fermentation.  Higher  salt  concentration  increased  total  soluble  solid  and  reducing  sugar  of  the  pickle but  decreased  total  acidity and  consequently influenced   the  aroma,  color,  texture  and  overall appearance  of  the  pickle.  About  5%  of  salt  concentration wasfound  to  be organoleptically most  acceptable  (moderately  like).  Conclusion:  The  sweet  potatoes  pickle  prepared  using  5%  of  saltconcentration  could  be  a  good  prospect  for commercialization in small-scale industries and  could  be used  to  fulfill  the growing demands of foods with low sodium content.",2020-04-25 00:00:00.000000000,http://repository.lppm.unila.ac.id/id/eprint/20429,Knowledgia Scientific,disk0/00/02/04/29,Asian Journal of Biological Science,['FP22'],2020-05-24 10:53:50,,public,8,pub,20429,DOI: 10.3923/ajbs.2020.113.118,archive,2020-05-24 10:53:50,113-118,show,1.0,1082,"[{'security': 'public', 'uri': 'http://repository.lppm.unila.ac.id/id/document/33776', 'pos': 1, 'eprintid': 20429, 'placement': 1, 'license': 'cc_by_4', 'content': 'published', 'rev_number': 3, 'language': 'en', 'mime_type': 'application/pdf', 'format': 'text', 'main': '113-118.pdf', 'files': [{'fileid': 192095, 'datasetid': 'document', 'hash': '33245aa65555e890cf99b59c562240ef', 'mime_type': 'application/pdf', 'hash_type': 'MD5', 'mtime': '2020-05-24 08:38:09', 'objectid': 33776, 'filesize': 575869, 'filename': '113-118.pdf', 'uri': 'http://repository.lppm.unila.ac.id/id/file/192095'}], 'docid': 33776}]",https://scialert.net/abstract/?doi=ajbs.2020.113.118,2020-05-24 10:53:50,"[{'id': 'neti.yuliana@fp.unila.ac.id', 'name': {'family': 'Yuliana', 'lineage': None, 'honourific': None, 'given': 'Neti'}}, {'id': None, 'name': {'honourific': None, 'family': 'Sari', 'lineage': None, 'given': 'Maya'}}]",article,TRUE,Natural  Fermentation  of  Orange  Sweet  Potatoes  to  ProduceBrined Pickle under Different Salt Content,,,,,,,,,,,,,,
12,['S1'],published,,"Abstract: Background and Objective: The lactic acid fermentation without starter addition (natural fermentation) may provide a standard preservation technique to produce sweet potatoes pickle that can be adopted at the household level. The objective of this study was to investigate the potential use of natural fermentation with variants of salt concentration to produce acceptably pickled of orange-fleshed sweet potatoes. Materials and Methods: The cubes were pickled by lactic fermentation by brine the cut and blanched cubes in five concentration level of common salt (NaCl, 1-6%) solutions and incubated for 12 days. Every 2 days, the sample was withdrawn for the various analysis, i.e., total acidity pH, total soluble solid, reducing sugar and total lactic acid bacteria. Meanwhile, the sensory was measured only for day 12 fermentations. Results: All physicochemical and sensory of pickled were affected by salt concentration during fermentation. Higher salt concentration increased total soluble solid and reducing sugar of the pickle but decreased total acidity and consequently influenced the aroma, color, texture and overall appearance of the pickle. About 5% of salt concentration was found to be organoleptically most acceptable (moderately like). Conclusion: The sweet potatoes pickle prepared using 5% of salt concentration could be a good prospect for commercialization in small-scale industries and could be used to fulfill the growing demands of foods with low sodium content.",2020-04-25 00:00:00.000000000,http://repository.lppm.unila.ac.id/id/eprint/20428,Knowledgia Scientific,disk0/00/02/04/28,,['FP22'],2020-05-24 10:53:57,,public,9,pub,20428,DOI: 10.3923/ajbs.2020.113.118,archive,2020-05-24 10:53:57,,show,,1082,"[{'format': 'text', 'main': '113-118.pdf', 'docid': 33775, 'files': [{'mime_type': 'application/pdf', 'hash': '33245aa65555e890cf99b59c562240ef', 'fileid': 192087, 'datasetid': 'document', 'uri': 'http://repository.lppm.unila.ac.id/id/file/192087', 'filename': '113-118.pdf', 'filesize': 575869, 'objectid': 33775, 'mtime': '2020-05-24 08:16:10', 'hash_type': 'MD5'}], 'content': 'published', 'language': 'en', 'mime_type': 'application/pdf', 'rev_number': 3, 'eprintid': 20428, 'placement': 1, 'license': 'cc_by', 'security': 'public', 'uri': 'http://repository.lppm.unila.ac.id/id/document/33775', 'pos': 1}]",http://docsdrive.com/pdfs/knowledgia/ajbs/2020/113-118.pdf,2020-05-24 10:53:57,"[{'id': 'neti.yuliana@fp.unila.ac.id', 'name': {'given': 'Neti', 'lineage': None, 'family': 'Yuliana', 'honourific': None}}, {'id': None, 'name': {'given': 'Maya', 'family': 'Sari', 'lineage': None, 'honourific': None}}]",monograph,,Natural Fermentation of Orange Sweet Potatoes to Produce Brined Pickle under Different Salt Content,113.0,,Asian Journal of Biological Science,,"[{'type': 'http://www.loc.gov/loc.terms/relators/AUT', 'name': {'honourific': None, 'lineage': None, 'family': 'Yuliana', 'given': 'Neti'}, 'id': 'neti.yuliana@fp.unila.ac.id'}, {'name': {'given': 'Maya', 'honourific': None, 'family': 'Sari', 'lineage': None}, 'type': 'http://www.loc.gov/loc.terms/relators/AUT', 'id': None}]",,,,,,,Teknologi Industri Pertanian,working_paper,Universitas Lampung
13,['S1'],published,,,1970-01-01 00:00:00.000002020,http://repository.lppm.unila.ac.id/id/eprint/44857,Proceedings of the 6th Food Ingredient Asia Conference,disk0/00/04/48/57,,"['FP19', 'FP22', 'FT9', 'FT13', 'FT14', 'FT12', 'FT3', 'FT2']",2022-09-12 01:13:22,,public,7,pub,44857,,archive,2022-09-12 01:13:22,,show,,306,"[{'main': 'HASIL PENILAIAN SEJAWAT SEBIDANG ATAU PEER REVIEW (1).pdf', 'docid': 166764, 'files': [{'mime_type': 'application/pdf', 'hash': 'a84c843ec947789037ec25e3d50f0a35', 'datasetid': 'document', 'fileid': 484142, 'filename': 'HASIL PENILAIAN SEJAWAT SEBIDANG ATAU PEER REVIEW (1).pdf', 'uri': 'http://repository.lppm.unila.ac.id/id/file/484142', 'filesize': 377791, 'objectid': 166764, 'mtime': '2022-09-09 04:00:00', 'hash_type': 'MD5'}], 'format': 'text', 'rev_number': 1, 'language': 'en', 'mime_type': 'application/pdf', 'placement': 1, 'eprintid': 44857, 'pos': 1, 'uri': 'http://repository.lppm.unila.ac.id/id/document/166764', 'security': 'public'}]",,2022-09-12 01:13:22,"[{'name': {'honourific': None, 'lineage': None, 'family': 'Yuliana', 'given': 'Neti'}, 'id': 'neti.yuliana@fp.unila.ac.id'}, {'id': 'dewikincai@yahoo.com', 'name': {'given': 'Dewi', 'lineage': None, 'family': 'Sartika', 'honourific': None}}, {'id': 'sutiknolampung@yahoo.com', 'name': {'given': 'Sutikno', 'family': 'Sutikno', 'lineage': None, 'honourific': None}}, {'id': None, 'name': {'given': 'Edo', 'family': 'Jatmiko', 'lineage': None, 'honourific': None}}]",other,,Profile of Sweet Potato Fermentation using Leuconostoc Mesenteroides as a Starter,,,,,,,,,,,,,,
14,['S1'],published,,"ABSTRACT
The outbreak of the covid-19 virus made the Indonesian government work hard to find the right formulation to 
prevent this national pandemic. The government is campaigning for a clean and healthy lifestyle by consuming 
foods that can increase immunity. Probiotics are dietary supplements containing lactic acid bacteria which 
function to increase the body's immunity in overcoming the Covid 19 pandemic. Therefore, it is necessary to look 
for materials that can encapsulate probiotic bacteria so that they can be consumed easily. One of them the use of
waxy cassava starch as a probiotic bacteria encapsulant. This study aims to determine the use of waxy cassava 
starch as an encapsulant for the probiotic bacteria Lactobacillus casei in increasing immunity in dextran fed mice. 
The results showed that the number of live L. casei increased significantly 139x104 CFU / mg of feces in dextran 
feed mice after 30 days of oral Lactobacillus encapsulation. The oral administration of Lactobacillus 
encapsulation in dextran fed mice with bovine serum albumin (BSA) showed an increase in the production of 
serum anti-BSA immunoglobulin G 232 titer greater than given BSA alone. These results indicate that giving 
Lactobacillus encapsulation provides immunity activity in dextran fed mice.
Keywords: Dextran, encapsulation, probiotic, starch, waxy cassava",2020-12-10 00:00:00.000000000,http://repository.lppm.unila.ac.id/id/eprint/32033,Poltekes Lampung,disk0/00/03/20/33,icsc proceeding,['FP22'],2021-06-04 07:13:38,2747 - 2086,public,6,pub,32033,,archive,2021-06-04 07:13:38,20-20,show,,306,"[{'placement': 1, 'eprintid': 32033, 'pos': 1, 'uri': 'http://repository.lppm.unila.ac.id/id/document/145158', 'security': 'public', 'files': [{'mtime': '2021-06-04 05:13:10', 'hash_type': 'MD5', 'filename': 'Proceeding dewi beki.pdf', 'uri': 'http://repository.lppm.unila.ac.id/id/file/379121', 'objectid': 145158, 'filesize': 1203251, 'hash': 'f52aafad6345e48daf33ea21657d25d8', 'mime_type': 'application/pdf', 'fileid': 379121, 'datasetid': 'document'}], 'main': 'Proceeding dewi beki.pdf', 'docid': 145158, 'format': 'text', 'mime_type': 'application/pdf', 'language': 'en', 'rev_number': 1}]",,2021-06-04 07:13:38,"[{'id': 'subeki1968@fp.unila.ac.id', 'name': {'honourific': None, 'family': 'subeki', 'lineage': None, 'given': 'subeki'}}, {'id': 'indriyanireni75@gmail.com', 'name': {'honourific': None, 'family': 'Indriyani', 'lineage': None, 'given': 'Reni'}}, {'id': None, 'name': {'given': 'Tanto Pratondo', 'family': 'utomo', 'lineage': None, 'honourific': None}}, {'name': {'honourific': None, 'family': 'Sartika', 'lineage': None, 'given': 'Dewi'}, 'id': 'dewikincai@yahoo.com'}]",article,TRUE,THE USE OF WAXY CASSAVA STARCH AS A PROBIOTIC BACTERIAL ENCAPSULANT TO INCREASE IMMUNITY IN DEXTRAN-FED MICE,,,,,,,,,,,,,,
