,userid,lastmod,documents,datestamp,eprintid,eprint_status,metadata_visibility,pagerange,event_location,type,pres_type,creators,title,refereed,event_dates,abstract,uri,date,date_type,subjects,event_title,full_text_status,status_changed,ispublished,rev_number,divisions,dir,event_type,publisher,publication,issn,volume,id_number,official_url,number,contact_email,funders,corp_creators,projects,related_url,contributors,referencetext,keywords,succeeds,isbn,place_of_pub,pages,editors,series
0,217,2020-09-21 03:27:23,"[{'eprintid': 24113, 'placement': 1, 'security': 'public', 'pos': 1, 'uri': 'http://repository.lppm.unila.ac.id/id/document/37816', 'format': 'text', 'main': '231166-ecoroad-a-sustainable-infrastructure-for-cc8fb699.pdf', 'files': [{'hash_type': 'MD5', 'mtime': '2020-09-20 08:44:43', 'objectid': 37816, 'filesize': 463790, 'filename': '231166-ecoroad-a-sustainable-infrastructure-for-cc8fb699.pdf', 'uri': 'http://repository.lppm.unila.ac.id/id/file/219539', 'fileid': 219539, 'datasetid': 'document', 'mime_type': 'application/pdf', 'hash': 'b3a1d4a1b67aa31d4831ce22cd2cb5c0'}], 'docid': 37816, 'language': 'en', 'mime_type': 'application/pdf', 'rev_number': 1}]",2020-09-21 03:27:23,24113,archive,show,103-109,Malang,conference_item,paper,"[{'id': 'martinus@eng.unila.ac.id', 'name': {'given': 'Martinus', 'family': '.', 'lineage': None, 'honourific': None}}, {'id': 'anshori.dj@gmail.com', 'name': {'given': 'Anshori', 'lineage': None, 'family': 'Djausal', 'honourific': None}}, {'id': 'gita.djausal@fisip.unila.ac.id', 'name': {'given': 'Gita Paramita', 'lineage': None, 'family': 'Djausal', 'honourific': None}}]",ECOROAD: A SUSTAINABLE INFRASTRUCTURE FOR ROAD DEVELOPMENT IN NATIONAL PARK,TRUE,22-23 Agustus 2017,"Road infrastructure is acknowledge as supporting development for mobility in economic activities. Road infrastructure, in some point, will pass through national park. National park is conservations area for plants and animal. Their existence rely on the park itself. The road infrastructure could affect the animals habitat; fragment the habitat and endangered the existence of animals. Case study on 4 national park, based on World Wild Fund (WWF) collaborated work, are showing the urgency of mitigation of road infrastructure. In order to build a sustainable road infrastructure, ecology road (eco-road) is need to be defined to minimize the effect the road development and preserve functionality of national park for conservation. Eco-road development must support human welfare and wildlife livelihood. Indonesia, as the largest tropical rainforest in the world, are developing regulations on road constructions. There are many factors considered in proposing ideas in eco-road. Every factors must address issues in human welfare and wildlife livelihood. A comprehensive approach on enrichment of fragmented habitat is due. Specific issues based on native animals behaviour is observed. Novel concept are proposed to adhere aspect eco-road. And, draft regulations according existing law and eco-road as Sustainability Infrastructure for Supporting Wildlife Livelihood.",http://repository.lppm.unila.ac.id/id/eprint/24113,2017-08-22 00:00:00.000000000,published,"['TA', 'TJ']",International Conference ASEAN Golden Anniversary,public,2020-09-21 03:27:23,pub,8,['FT7'],disk0/00/02/41/13,conference,,,,,,,,,,,,,,,,,,,,,
1,451,2020-10-09 14:07:27,"[{'format': 'text', 'files': [{'objectid': 38000, 'filesize': 2216213, 'uri': 'http://repository.lppm.unila.ac.id/id/file/220990', 'filename': 'Hot-corrosion of AISI 1020 steel in a molten NaClNa2SO4 eutectic at 700°C.pdf', 'hash_type': 'MD5', 'mtime': '2020-10-08 09:21:17', 'fileid': 220990, 'datasetid': 'document', 'mime_type': 'application/pdf', 'hash': '04e653e3b229d928d1d4989860524f0b'}], 'main': 'Hot-corrosion of AISI 1020 steel in a molten NaClNa2SO4 eutectic at 700°C.pdf', 'docid': 38000, 'mime_type': 'application/pdf', 'language': 'en', 'rev_number': 1, 'eprintid': 24281, 'placement': 1, 'security': 'public', 'pos': 1, 'uri': 'http://repository.lppm.unila.ac.id/id/document/38000'}]",2020-10-09 14:07:27,24281,archive,show,1-9,,article,,"[{'name': {'given': 'Mohammad', 'honourific': None, 'lineage': None, 'family': 'Badaruddin'}, 'id': 'mbruddin@eng.unila.ac.id'}, {'name': {'honourific': None, 'lineage': None, 'family': 'Risano', 'given': 'A.Yudi Eka'}, 'id': 'yudi_95@yahoo.com'}, {'name': {'family': 'Wardono', 'lineage': None, 'honourific': None, 'given': 'Herry'}, 'id': 'herryw22@gmail.com'}, {'name': {'honourific': None, 'lineage': None, 'family': 'Asmi', 'given': 'Dwi'}, 'id': 'dwiasmi82@yahoo.com'}]","Hot-Corrosion of AISI 1020 Steel in a Molten NaCl/Na2SO4
Eutectic at 700°C",TRUE,,"Hot-corrosion behavior and morphological development of AISI 1020 steel with 2 mg cm−2 mixtures of various NaCl/Na2SO4 ratios at 700°C were investigated by means of weight gain measurements, Optical Microscope (OM), X-ray diffraction (XRD), scanning electron microscopy (SEM), and energy dispersive X-ray spectroscopy (EDS). The weight gain kinetics of the steel with mixtures of salt deposits display a rapid growth rates, compared with the weight gain kinetics of AISI 1020 steel without salt deposit in dry air oxidation, and follow a steady-state parabolic law for 49h. Chloridation and sulfidation produced by a molten NaCl/Na2SO4 on the steel induced hot-corrosion mechanism attack, and are responsible for the formation of thicker scale. The most severe corrosion takes place with the 70 wt.% NaCl mixtures in Na2SO4. The typical Fe2O3 whisker growth in outer part scale was attributed to the FeCl3 volatilization. The formation of FeS in the innermost scale is more pronounced as the content of Na2SO4 in the mixture is increased.",http://repository.lppm.unila.ac.id/id/eprint/24281,2017-01-03 00:00:00.000000000,published,['TJ'],,public,2020-10-09 14:07:27,pub,6,['FT7'],disk0/00/02/42/81,,AIP,AIP Conference Proceedings,978-0-7354-1452-5,1788,https://doi.org/10.1063/1.4968319,https://aip.scitation.org/toc/apc/1788/1,,,,,,,,,,,,,,,
2,451,2020-03-17 08:50:59,"[{'pos': 1, 'uri': 'http://repository.lppm.unila.ac.id/id/document/31948', 'security': 'public', 'placement': 1, 'eprintid': 18763, 'rev_number': 1, 'language': 'en', 'mime_type': 'application/pdf', 'main': '11-1-23-1-10-20170330_2.pdf', 'docid': 31948, 'files': [{'datasetid': 'document', 'fileid': 157540, 'mime_type': 'application/pdf', 'hash': '18f5deb50e81cf70b492514213ae5b10', 'hash_type': 'MD5', 'mtime': '2020-03-17 04:14:38', 'filesize': 808370, 'objectid': 31948, 'uri': 'http://repository.lppm.unila.ac.id/id/file/157540', 'filename': '11-1-23-1-10-20170330_2.pdf'}], 'format': 'text'}]",2020-03-17 08:50:59,18763,archive,show,1-10,,article,,"[{'name': {'honourific': None, 'lineage': None, 'family': 'Badaruddin', 'given': 'Mohammad'}, 'id': 'mbruddin@eng.unila.ac.id'}, {'name': {'given': 'Ahmad', 'honourific': None, 'lineage': None, 'family': 'Yudi Eka Rosano'}, 'id': 'yudi_95@yahoo.com'}, {'id': 'ahmad.suudi@eng.unila.ac.id', 'name': {'given': 'Ahmad', 'honourific': None, 'family': 'Suudi', 'lineage': None}}]",Peningkatan Efisiensi Termal Tungku Biomasa Untuk Proses Pengeringan Biji Kakao di Desa Wiyono Kabupaten Pesawaran Propinsi Lampung,TRUE,,"The modification stove was designed and constructed for drying cocoa beans using biomassa as fuel. The purpose of the modification stove is to increase production of 0.6 tonnes dry cocoa beans. The thermal efficiency of the stove is determined and compared with a conventional stove using hevea brasiliensis woods as fuel.  The inside wall of stove and oven were built from SK34 fire brick and ceramic paper, respectively. The outer walls were made from red brick and was coated by cement. The results show that the thermal efficiency of the modification stove is increased by 37.34% compared with the conventional stove. The fuel consumption decreases by 25 % (25 kg-product), resulting a fuel cost saving of Rp. 1.8 million/year. In addition, the total cost of the stove can be paid back in a period of 3.5 years with the service lifetime of the stove for 10 years. The moisture contents ratio of cocoa beans with drying time are obtained to predict values of diffusivity (De) over range of drying temperature 50-80 °C. the values of diffusivity obtained ranged from 62.03 × 10−10 to 4.55 × 10−10 m2/s for the temperature used.",http://repository.lppm.unila.ac.id/id/eprint/18763,2017-03-30 00:00:00.000000000,published,['TJ'],,public,2020-03-17 08:50:59,pub,6,['FT7'],disk0/00/01/87/63,,LPPM UNILA,Jurnal Sakai Sambayan,2550-1089,11,,http://jss.lppm.unila.ac.id/index.php/ojs/index,1,,,,,,,,,,,,,,
3,303,2018-06-26 03:41:42,"[{'eprintid': 5955, 'placement': 1, 'security': 'public', 'uri': 'http://repository.lppm.unila.ac.id/id/document/18869', 'pos': 1, 'format': 'text', 'main': 'A.Yudi-SIGER 2017 (EKM).pdf', 'files': [{'hash': '0d5ea2178a61317f5d9e89916fbbbfaf', 'mime_type': 'application/pdf', 'datasetid': 'document', 'fileid': 55228, 'uri': 'http://repository.lppm.unila.ac.id/id/file/55228', 'filename': 'A.Yudi-SIGER 2017 (EKM).pdf', 'objectid': 18869, 'filesize': 222331, 'mtime': '2017-11-18 05:14:37', 'hash_type': 'MD5'}], 'docid': 18869, 'mime_type': 'application/pdf', 'language': 'en', 'rev_number': 1}]",2018-04-25 03:43:27,5955,archive,show,1-5,Universitas Lampung,conference_item,paper,"[{'name': {'given': 'A. Yudi', 'honourific': None, 'family': 'Eka Risano', 'lineage': None}, 'id': 'yudi_95@yahoo.com'}, {'id': None, 'name': {'given': 'Ahmad', 'lineage': None, 'family': ""Su'udi"", 'honourific': None}}, {'name': {'honourific': None, 'family': 'Wahyu Nugraha', 'lineage': None, 'given': 'Jati'}, 'id': None}]","Komputasi Visual Basic Untuk Optimalisasi Dan
Redesain Proses Awal Pengeringan Kopra
Di Usaha Koperasi Bersama Kopra Putih Sonia Kabupaten Pringsewu",FALSE,7-8 November 2017,"Copra is a pulp of a fresh coconut that is dried, known as two kind, that is white and black copra. Copra drying process can be divided into two part, that is initial process which is to dried a coconut pulp with the shell containing water 55% until 35% of water and final process which is to dried a coconut pulp which contain 35% of water to be 7-8% of water. The problem in copra drying process is the uneven drying temperature and duration. Therefore, this research aims to optimize the copra dryers tool, especially at the of the initial process drying.
    Method of this research is by redesign copra drying tools of initial process, calculate thermal process and total heat that needed for drying process by using Microsoft visual basic. 
    Results of the research were obtained for the copra drying process by using pipe 1 inch of diameter and length 39.12 cm, with the dimension of drying tools is 270 cm x 180 cm x 180 cm and material construction is a zinc wall with asbestos layer. And the drying temperature of copra is 74.51 oC with total heat needed is 501,858.1 kJ and drying process takes 3.65 hours.

Keyword: Copra, Redesign, Microsoft Visual Basic, Drying Process",http://repository.lppm.unila.ac.id/id/eprint/5955,2017-11-07 00:00:00.000000000,submitted,['TJ'],Seminar Nasional Energi dan Industri Manufaktur SIGER 2017,public,2018-04-25 03:43:27,submitted,8,['FT7'],disk0/00/00/59/55,conference,,,,,,http://siger.unila.ac.id/,,yudi_95@yahoo.com,,,,,,,,,,,,,
4,303,2017-11-17 04:26:34,"[{'format': 'text', 'main': 'Artikel AYER-Jutnal Turbo.pdf', 'files': [{'fileid': 54603, 'datasetid': 'document', 'mime_type': 'application/pdf', 'hash': '61aea6893c02fbdd3c12f0aed08a8c3c', 'hash_type': 'MD5', 'mtime': '2017-11-17 04:01:09', 'filesize': 1324073, 'objectid': 18782, 'uri': 'http://repository.lppm.unila.ac.id/id/file/54603', 'filename': 'Artikel AYER-Jutnal Turbo.pdf'}], 'docid': 18782, 'language': 'en', 'rev_number': 1, 'mime_type': 'application/pdf', 'eprintid': 5858, 'placement': 1, 'security': 'public', 'pos': 1, 'uri': 'http://repository.lppm.unila.ac.id/id/document/18782'}]",2017-11-17 04:26:34,5858,archive,show,1-7,,article,,"[{'name': {'lineage': None, 'family': 'Eka Risano', 'honourific': None, 'given': 'A. Yudi'}, 'id': 'yudi_95@yahoo.com'}, {'id': 'dyansusila@yahoo.com', 'name': {'given': 'M. Dyan', 'honourific': None, 'lineage': None, 'family': 'Susila E.S.'}}, {'name': {'given': 'Yoga', 'honourific': None, 'lineage': None, 'family': 'Pratama'}, 'id': 'yogapratama123@yahoo.com'}]","APLIKASI MINYAK KELAPA SAWIT PADA PHOTOVOLTAIC 
YANG TERINTEGRASI PADA DINDING BANGUNAN  
SEBAGAI PENDINGIN PASIF UNTUK MENINGKATKAN EFISIENSI 
DAN MENURUNKAN BEBAN PENDINGIN RUANGAN",FALSE,,"Menanggapi isu green building dan penggunaan clean energy yang sangat santer saat ini, pemanfaatan energi terbarukan menjadi meningkat. Penggunaan energi surya menggunakan  photovoltaic (PV) pada sistem Building Intergated Photovoltaics (BIPV) akan menambah pasokan listrik dan mengurangi ketergantungan terhadap pembangkit listrik.
Menurut M. Farid dan Abhat A. Low dalam jurnal MONEV Muhammad Irsyad, Penambahan Minyak Kelapa Sawit pada Photovoltaic yang Terintegrasi pada Dinding Bangunan untuk
Meningkatkan Efisiensi dan Menurunkan Beban Pendingin Ruangan (2012), persoalan tiap kenaikan 1o C temperatur PV yang mengurangi efisiensi PV 0,4 – 0,5% dapat disiasati dengan integrasi Phase Change Material (PCM).  Selain itu dengan sifatnya sebagai pendinginan pasif, masuknya kalor ke dalam ruangan juga akan direduksi. Penelitian ini dilakukan untuk melihat karakteristik efisiensi PV dan perambatan kalor pada ruangan model BIPV yang diintegrasikan dengan PCM CPO. Pengujian dilakukan dengan membandingkan dua model BIPV yang dengan dan tanpa PCM CPO. Variasi dilakukan dengan kemiringan BIPV 45º dan 30º masingmasing orientasi timur dan barat. Setelah dilakukan empat variasi percobaan, BIPV dengan
kemiringan 30º lebih unggul dibanding dengan kemiringan 45º. Perbandingan perpindahan panas dinding dalam menuju ruang BIPV dengan PCM CPO kemiringan 30º orientasi barat
lebih signifikan dan stabil, terutama pada intensitas 850 W/m² perbandingan panas dari dinding dalam menuju ruang yang sebesar 0,4012 W dapat diredam dengan menggunakan CPO hanya
sebesar 0,2596 W. Kemudian pada puncak perpindahan panas tertinggi dari dinding dalam ke ruang model BIPV tanpa CPO dengan intensitas 923 W/m² mencapai 0,43426 W, dengan
penambahan PCM CPO hanya 0,25913 W. Perbedaan efisiensi dengan pemakaian PCM CPO juga lebih unggul hingga menaikkan efisiensi 5,75% saat intensitas 982 W/m² sudut penyinaran
120 º dari timur.

Kata kunci : green building, clean energy, photovoltaic, Bahan Perubah Fasa, Minyak Kelapa 
Sawit, pendingin pasif.",http://repository.lppm.unila.ac.id/id/eprint/5858,2017-06-01 00:00:00.000000000,published,['TJ'],,public,2017-11-17 04:26:34,pub,6,['FT7'],disk0/00/00/58/58,,"Jurusan Teknik Mesin, Fakultas Teknik, Universitas Muhammadiyah Metro",TURBO,"p-ISSN: 2301-6663, e-ISSN: 2477-250X",6,460-798-1-SM,https://ojs.ummetro.ac.id/index.php/turbo/,1,yudi_95@yahoo.com,,,,,,,,,,,,,
5,303,2018-06-26 09:09:41,"[{'docid': 20941, 'main': '602-1175-1-PB (Jurnal Turbo Vol. 6 No.2).pdf', 'files': [{'mime_type': 'application/pdf', 'hash': '3297395151543366725c21ec97001d91', 'fileid': 70594, 'datasetid': 'document', 'filename': '602-1175-1-PB (Jurnal Turbo Vol. 6 No.2).pdf', 'uri': 'http://repository.lppm.unila.ac.id/id/file/70594', 'filesize': 631607, 'objectid': 20941, 'mtime': '2018-06-26 08:26:59', 'hash_type': 'MD5'}], 'format': 'text', 'language': 'en', 'mime_type': 'application/pdf', 'rev_number': 1, 'placement': 1, 'eprintid': 7912, 'pos': 1, 'uri': 'http://repository.lppm.unila.ac.id/id/document/20941', 'security': 'public'}, {'rev_number': 3, 'language': 'id', 'mime_type': 'application/xml', 'content': 'published', 'files': [{'hash': '5fe08ab72237e27fbee5411fca521af2', 'mime_type': 'application/xml', 'datasetid': 'document', 'fileid': 70600, 'uri': 'http://repository.lppm.unila.ac.id/id/file/70600', 'filename': 'pdf', 'filesize': 18935, 'objectid': 20943, 'mtime': '2018-06-26 08:28:32', 'hash_type': 'MD5'}], 'main': 'pdf', 'docid': 20943, 'format': 'text', 'pos': 2, 'uri': 'http://repository.lppm.unila.ac.id/id/document/20943', 'security': 'public', 'placement': 2, 'eprintid': 7912}]",2018-06-26 09:09:41,7912,archive,show,150-158,,article,,"[{'name': {'given': 'A. Yudi', 'honourific': None, 'lineage': None, 'family': 'Eka Risano'}, 'id': 'yudi_95@yahoo.com'}, {'name': {'honourific': None, 'family': 'Tanti', 'lineage': None, 'given': 'Novri'}, 'id': 'rianti_dc@yahoo.com'}, {'id': None, 'name': {'honourific': None, 'lineage': None, 'family': 'Efendi', 'given': 'Maulana'}}]","PERANCANGAN ULANG ALAT PENGERING BIJI KAKAO TIPE
ROTARI SEDERHANA PADA USAHA MANDIRI DI DESA WIYONO 
KABUPATEN PESAWARAN",TRUE,,"Penelitian ini dilakukan pada alat pengering biji kakao untuk proses pengeringan biji kakao milik Usaha Mandiri di Desa Wiyono, Kabupaten Pesawaran. Penelitian ini bertujuan
untuk merancang ulang alat pengering biji kakao tipe rotari sederhana agar proses pengeringan lebih efektif dan didapat kualitas hasil pengeringan biji kakao lebih baik.Perhitungan yang dilakukan meliputi dimensi alat pengering, termal yang terjadi pada alat pengering, dan kebutuhan bahan bakar pada alat pengering biji kakao tipe rotari sederhana,serta dilakukan simulasi pada model alat pengering biji kakao tipe rotari sederhana yang telah dirancang menggunakan Software Autodesk CFD untuk mengetahui sebaran suhu pada model alat pengering yang telah dirancang. Dari hasil penelitian yang telah dilakukan alat pengering biji kakao tipe rotari sederhana ini memiliki dimensi ruang pengering dengan diameter 90 cm, panjang 108 cm, dan tebal 1,2 mm. sebaran suhu pada ruang pengering sebesar 65,06oC,kalor yang dibutuhkan untuk proses pengeringan biji kakao sebesar 1028906,047 KJ, waktu yang dibutuhkan untuk proses pengeringan ± 8 jam 14 menit dan bahan bakar yang dibutuhkan untuk proses pengeringan sebanyak 302,62 kg atau 0,30260 kubik serta sebaran suhu rata-rata hasil simulasi menggunkan Software Autodesk CFD sebesar 63,5116 oC.

Kata Kunci: kakao, pengeringan, Autodesk CFD, suhu.",http://repository.lppm.unila.ac.id/id/eprint/7912,2017-12-01 00:00:00.000000000,published,['TJ'],,public,2018-06-26 09:09:41,pub,10,['FT7'],disk0/00/00/79/12,,"Jurusan Teknik Mesin, Fakultas Teknik, Universitas Muhammadiyah Metro",TURBO,"p-ISSN: 2301-6663, e-ISSN: 2477-250X",6,,http://ojs.ummetro.ac.id/index.php/turbo,2,,,,,,,,,,,,,,
6,772,2017-09-28 02:16:57,"[{'main': 'Production of valuable pyrolytic oils from mixed Municipal Solid.pdf', 'docid': 3816, 'files': [{'hash_type': 'MD5', 'mtime': '2017-09-26 20:12:51', 'filesize': 504945, 'objectid': 3816, 'uri': 'http://repository.lppm.unila.ac.id/id/file/27712', 'filename': 'Production of valuable pyrolytic oils from mixed Municipal Solid.pdf', 'datasetid': 'document', 'fileid': 27712, 'hash': '8cd4f9b63c9efbbb34a93004c4738768', 'mime_type': 'application/pdf'}], 'format': 'text', 'language': 'en', 'rev_number': 1, 'mime_type': 'application/pdf', 'placement': 1, 'eprintid': 3962, 'pos': 1, 'uri': 'http://repository.lppm.unila.ac.id/id/document/3816', 'security': 'public'}]",2017-09-28 02:16:57,3962,archive,show,357-361,,article,,"[{'id': 'indra.mamad@eng.unila.ac.id', 'name': {'given': 'Indra Mamad', 'family': 'Gandidi', 'lineage': None, 'honourific': None}}]",Production of Valuable Pyrolytic Oils from Mixed Municipal Solid Waste (MSW) In Indonesia Using Non-Isothermal and Isothermal Experimental,TRUE,,"Municipal solid waste (MSW), disposed of at open dumping sites, poses health risks, contaminates surface water, and releases greenhouse gasses such as methane. However, pyrolysis
offers the opportunity to convert MSW into Bio-Oil (BO) for clean energy resource. In this paper, an MSW sample consisting of plastic, paper and cardboard, rubber and textiles, and vegetable waste is pyrolysed on a laboratory scale in a fixed-bed vacuum reactor. In the non-isothermal process, the sample was fed into the reactor and then heated. In the isothermal process, the reactor is first heated and then the sample is added. The non-isothermal process created greater BO in both quality and quantity. The BO had a larger amount of gasoline species than diesel-48 fuel, with at 33.44% the BO produced by isothermal pyrolysis and 36.42% in non-isothermal pyrolysis. However the product of isothermal pyrolysis had a higher acid content that reduced its heating value.",http://repository.lppm.unila.ac.id/id/eprint/3962,2017-08-24 00:00:00.000000000,published,['TD'],,public,2017-09-28 02:16:57,pub,7,['FT7'],disk0/00/00/39/62,,Elsevier,Journal of Case Studies in Thermal Engineering,2214-157X,10,,https://www.journals.elsevier.com/case-studies-in-thermal-engineering,,,"['Indonesian Government (Dikti), Unila']","['Dyan Susila', 'Nugroho Agung Pambudi']",['Hibah Unggulan PT'],"[{'url': 'http://www.sciencedirect.com/science/article/pii/S2214157X17301405', 'type': 'pub'}]",,,,,,,,,
7,528,2020-06-10 04:49:57,"[{'docid': 21065, 'main': '02.Gusri Akhyar_11-25.pdf', 'files': [{'hash': '811f3d4b3ed6e93ee35c40e300e40ebc', 'mime_type': 'application/pdf', 'fileid': 71386, 'datasetid': 'document', 'uri': 'http://repository.lppm.unila.ac.id/id/file/71386', 'filename': '02.Gusri Akhyar_11-25.pdf', 'objectid': 21065, 'filesize': 814319, 'mtime': '2018-06-27 10:25:36', 'hash_type': 'MD5'}], 'format': 'text', 'language': 'en', 'rev_number': 1, 'mime_type': 'application/pdf', 'placement': 1, 'eprintid': 8031, 'uri': 'http://repository.lppm.unila.ac.id/id/document/21065', 'pos': 1, 'security': 'public'}]",2018-06-28 01:58:11,8031,archive,show,11-25,,article,,"[{'id': 'gusri.akhyar@eng.unila.ac.id', 'name': {'lineage': None, 'family': 'Gusri', 'honourific': None, 'given': 'Akhyar'}}, {'id': 'arinal.hamni@yahoo.com', 'name': {'honourific': None, 'lineage': None, 'family': 'Arinal', 'given': 'Hamni'}}, {'id': 'lusmelia.afriani@eng.unila.ac.id', 'name': {'given': 'Lusmeilia', 'honourific': None, 'lineage': None, 'family': 'Afriani'}}, {'id': 'mita_rilyanti@yahoo.com', 'name': {'honourific': None, 'family': 'Mita', 'lineage': None, 'given': 'Rilyanti'}}]","PEMBERDAYAAN KARANG TARUNA MELALUI
PENGELOLAAN SAMPAH MENJADI PUPUK KOMPOS  
ORGANIK Di DESA SIDOMULYO",TRUE,,"KKN-PPM diselenggarakan di  Karang Taruna Anak Krajan Desa Sidomulyo, Kecamatan
Sidomulyo Kabupaten Lampung Selatan. Tujuan yang ingin dicapai adalah menghasilkan
wirausaha pupuk Organik (Kompos) sebagai komoditas unggulan melalui pemberdayaan
kelompok pemuda pengangguran. Melalui mahasiswa terbukalah jalan untuk membangun
jaringan kerja sama dalam bentuk kelompok produksi usaha kecil dan membuka akses
pemasaran melalui kemitraan antara perguruan tinggi dan kelompok karang taruna,
mengembangkan pola pemberdayaan kolaboratif melalui pendampingan dalam transfer
keterampilan, modal dan akses pemasaran yang lebih luas. Kerjasama ini berupa pelatihan
keterampilan pengelolaan sampah, pembuatan pupuk organik dan pemasarannya dapat
meningkatkan keterampilan kelompok pemuda pengangguran di karang taruna sebagai sasaran
antara yang strategis dalam membuat produk kompos. Pendekatan yang digunakan adalah
Metode PPKP (Pemahaman Partisipatif Kondisi Pedesaan), merupakan perencanaan
partisipatif bertujuan untuk menggali permasalahan yang ada di masyarakat, penyebab
terjadinya masalah, dan cara mengatasinya dengan menggunakan sumberdaya lokal atas
prinsip pemberdayaan masyarakat. Hasil kegiatan ini adalah berupa pupuk kompos yang
berasalah sampah organik dengan nilai tambah ekonomi yang tinggi dan fungsi pemanfaatan
potensi setempat. Pupuk yang sudah berupa kompos dikemas dan siap dipasarkan bagi petani,
peningkatan pemahaman warga untuk memilah sampah dan memanfaatkan sampah yang
terpilah. Sampah organik untuk kompos sedangkan sekam padi untuk briket, sampah dedak
untuk membuat kompor masak.",http://repository.lppm.unila.ac.id/id/eprint/8031,1970-01-01 00:00:00.000002017,,['TJ'],,public,2018-06-28 01:58:11,pub,8,['FT7'],disk0/00/00/80/31,,"Lembaga Penelitian, Pengembangan Pembelajaran & Pengabdian Kepada Masyarakat,",SEMNAS IIB DARMAJAYA,2598 – 0246,1,,,1,gusri.akhyar@eng.unila.ac.id,,['Universitas Lampung'],,,"[{'type': 'http://www.loc.gov/loc.terms/relators/AUT', 'name': {'lineage': None, 'family': 'Ibrahim', 'honourific': None, 'given': 'G.A'}, 'id': 'gusri.akhyar@eng.unila.ac.id'}, {'id': 'arinal.hamni@yahoo.com', 'type': 'http://www.loc.gov/loc.terms/relators/AUT', 'name': {'honourific': None, 'family': 'Hamni', 'lineage': None, 'given': 'A'}}, {'id': 'lusmelia.afriani@eng.unila.ac.id', 'type': 'http://www.loc.gov/loc.terms/relators/AUT', 'name': {'family': 'Lusmelia', 'lineage': None, 'honourific': None, 'given': 'A'}}, {'id': 'mita_rilyanti@yahoo.com', 'type': 'http://www.loc.gov/loc.terms/relators/AUT', 'name': {'honourific': None, 'family': 'Mita', 'lineage': None, 'given': 'R'}}]",,,,,,,,
