,userid,lastmod,documents,datestamp,eprintid,eprint_status,metadata_visibility,pagerange,event_location,type,pres_type,creators,title,refereed,event_dates,abstract,uri,date,date_type,subjects,event_title,full_text_status,status_changed,ispublished,rev_number,divisions,dir,event_type,publisher,publication,issn,volume,id_number,official_url,number,contact_email,funders,corp_creators,projects,related_url,contributors,referencetext,keywords,succeeds,isbn,place_of_pub,pages,editors,series
21,866,2018-06-26 02:45:49,"[{'placement': 1, 'eprintid': 7789, 'uri': 'http://repository.lppm.unila.ac.id/id/document/20825', 'pos': 1, 'security': 'public', 'docid': 20825, 'main': '4 2017 IOP_Conf._Ser.__Earth_Environ._Sci._60_012028.pdf', 'files': [{'hash_type': 'MD5', 'mtime': '2018-06-26 01:45:32', 'filesize': 839612, 'objectid': 20825, 'uri': 'http://repository.lppm.unila.ac.id/id/file/69693', 'filename': '4 2017 IOP_Conf._Ser.__Earth_Environ._Sci._60_012028.pdf', 'datasetid': 'document', 'fileid': 69693, 'mime_type': 'application/pdf', 'hash': '33e7f853185c78c9dafdc47586ac7fab'}], 'format': 'text', 'language': 'en', 'rev_number': 1, 'mime_type': 'application/pdf'}]",2018-06-26 02:45:49,7789,archive,show,1-6,,article,,"[{'id': 'irsyadmuh@eng.unila.ac.id', 'name': {'given': 'Muhammad', 'honourific': None, 'lineage': None, 'family': 'Irsyad'}}, {'name': {'given': 'Ari Darmawan', 'family': 'Pasek', 'lineage': None, 'honourific': None}, 'id': None}, {'id': None, 'name': {'given': 'Yuli Setyo', 'lineage': None, 'family': 'Indartono', 'honourific': None}}, {'id': None, 'name': {'honourific': None, 'family': 'Pratomo', 'lineage': None, 'given': 'Adi Widya'}}]","Heat transfer characteristics of building walls using phase
change material",TRUE,,"Minimizing energy consumption in air conditioning system can be done with reducing the cooling load in a room. Heat from solar radiation which passes through the wall increases the cooling load. Utilization of phase change material on walls is expected to decrease the heat rate by storing energy when the phase change process takes place. The stored energy is released when the ambient temperature is low. Temperature differences at noon and evening can be utilized as discharging and charging cycles. This study examines the
characteristics of heat transfer in walls using phase change material (PCM) in the form of encapsulation and using the sleeve as well. Heat transfer of bricks containing encapsulated PCM, tested the storage and released the heat on the walls of the building models were evaluated in this study. Experiments of heat transfer on brick consist of time that is needed for heat transfer and thermal conductivity test as well. Experiments were conducted on a wall coated by PCM which was exposed on a day and night cycle to analyze the heat storage and heat release. PCM used in these experiments was coconut oil. The measured parameter is the
temperature at some points in the brick, walls and ambient temperature as well. The results showed that the use of encapsulation on an empty brick can increase the time for thermal heat transfer. Thermal conductivity values of a brick containing encapsulated PCM was lower than hollow bricks, where each value was 1.3 W/m.K and 1.6 W/m.K. While the process of heat absorption takes place from 7:00 am to 06:00 pm, and the release of heat runs from 10:00 pm to 7:00 am. The use of this PCM layer can reduce the surface temperature of the walls of an average of 2°C and slows the heat into the room.",http://repository.lppm.unila.ac.id/id/eprint/7789,1970-01-01 00:00:00.000002017,published,['TJ'],,public,2018-06-26 02:45:49,pub,6,['FT7'],disk0/00/00/77/89,,IOP Publishing,IOP Conf. Series: Earth and Environmental Science,1755-1315,60,DOI: 10.1088/1755-1315/60/1/012028,http://www.iopscience.iop.org/issue/1755-1315/60/1,12028,,,"['Universitas Lampung', 'Institut Teknologi Bandung']",,,,,,,,,,,
22,866,2017-11-07 02:33:02,"[{'rev_number': 1, 'language': 'en', 'mime_type': 'application/pdf', 'files': [{'hash': 'c19a5a318943a8e8502911e5e1eeb8ed', 'mime_type': 'application/pdf', 'fileid': 46523, 'datasetid': 'document', 'uri': 'http://repository.lppm.unila.ac.id/id/file/46523', 'filename': 'STBE lengkap.pdf', 'objectid': 17684, 'filesize': 6129439, 'mtime': '2017-11-06 23:36:00', 'hash_type': 'MD5'}], 'main': 'STBE lengkap.pdf', 'docid': 17684, 'format': 'text', 'uri': 'http://repository.lppm.unila.ac.id/id/document/17684', 'pos': 1, 'security': 'public', 'placement': 1, 'eprintid': 4770}]",2017-11-07 02:33:02,4770,archive,show,1-7,,article,,"[{'name': {'family': 'Irsyad', 'lineage': None, 'honourific': None, 'given': 'Muhammad'}, 'id': 'irsyadmuh@eng.unila.ac.id'}, {'name': {'given': 'Ari Darmawan', 'honourific': None, 'lineage': None, 'family': 'Pasek'}, 'id': None}, {'id': None, 'name': {'lineage': None, 'family': 'Indartono', 'honourific': None, 'given': 'Yuli Setyo'}}, {'name': {'given': 'Aryadi', 'honourific': None, 'family': 'Suwono', 'lineage': None}, 'id': None}, {'id': None, 'name': {'honourific': None, 'lineage': None, 'family': 'Pradipta', 'given': 'Muhammad Akbar'}}]",Phase Change Materials Development from Salt Hydrate for Application as Secondary Refrigerant in Air Conditioning System,TRUE,,"alt hydrate for application as secondary refrigerant in the air conditioning system are selected based on the slurry forming according to the evaporator temperature 5oC - 12oC. Research development of salt hydrate for application is done in three stages namely; the study of the properties, flow and heat transfer characteristics, so applications in air conditioning systems. Study of the properties of the PCM is in the form of latent heat, freezing and melting temperature, thermal stability properties, viscosity, and rate of corrosion. Study of flow and heat transfer characteristics determine the effect of salt hydrates on the pressure drop and heat transfer in a heat exchanger. Studies on the application of the air conditioning system is made to use a type of cooling room air handling units (AHU) and fan coil unit (FCU). The results of the researches for each of two stages are described in the discussion of this paper. The characteristics of salt hydrates from Na2HPO4 and CaCl2 are fitted to be applied as secondary refrigerant. This material has high latent heat value and matched phase change temperature as well as very low corrosion rate. This material also demonstrates excellent heat transfer performance, in which an increase as much as 18.62% for salt hydrate from calcium chloride and 13.9% for salt hydrate from disodium hydrogen phosphate. For its flow characteristics, a less significant increase on pressure drop for Na2HPO4.",http://repository.lppm.unila.ac.id/id/eprint/4770,2017-06-02 00:00:00.000000000,published,['TJ'],,public,2017-11-07 02:33:02,pub,7,['FT7'],disk0/00/00/47/70,,Taylor & Francis bekerjasama dengan ASHRAE,Science and Technology for the Built Environment,2374-4731 (Print) 2374-474X (Online),-,DOI: 10.1080/23744731.2017.1328942,http://www.tandfonline.com/toc/uhvc21/current,-,,,"['Universitas Lampung', 'Institut Teknologi Bandung']",,,,,,,,,,,
23,866,2018-06-26 02:45:47,"[{'security': 'public', 'uri': 'http://repository.lppm.unila.ac.id/id/document/20823', 'pos': 1, 'eprintid': 7785, 'placement': 1, 'rev_number': 1, 'language': 'en', 'mime_type': 'application/pdf', 'format': 'text', 'main': '3 2017 IOP_Conf._Ser.__Earth_Environ._Sci._60_012027.pdf', 'docid': 20823, 'files': [{'hash_type': 'MD5', 'mtime': '2018-06-26 01:17:49', 'objectid': 20823, 'filesize': 805320, 'filename': '3 2017 IOP_Conf._Ser.__Earth_Environ._Sci._60_012027.pdf', 'uri': 'http://repository.lppm.unila.ac.id/id/file/69680', 'datasetid': 'document', 'fileid': 69680, 'mime_type': 'application/pdf', 'hash': '70d027b9fab2eac635995b4e55fdce8d'}]}]",2018-06-26 02:45:47,7785,archive,show,1-6,,article,,"[{'name': {'given': 'Muhammad', 'family': 'Irsyad', 'lineage': None, 'honourific': None}, 'id': 'irsyadmuh@eng.unila.ac.id'}, {'name': {'family': 'harmen', 'lineage': None, 'honourific': None, 'given': 'harmen'}, 'id': 'harmen.1969@eng.unila.ac.id'}]","Heat transfer characteristics of coconut oil as phase change
material to room cooling application",TRUE,,"Thermal comfort in a room is one of human needs in the workplace and dwellings, so that the use of air conditioning system in tropical countries is inevitable. This equipment has an impact on the increase of energy consumption. One method of minimizing the energy use is by using the phase change material (PCM) as thermal energy storage. This material utilizes the temperature difference between day and night for the storage and release of thermal energy. PCM development on application as a material for air cooling inlet, partitioning and interior needs to be supported by the study of heat transfer characteristics when PCM absorbs heat from ambient temperature. This study was conducted to determine the heat transfer characteristics on coconut oil as a phase change material. There are three models of
experiments performed in this research. Firstly, an experiment was conducted to analyze the time that was needed by material to phase change by varying the temperature. The second experiment analyzed the heat transfer characteristics of air to PCM naturally convection. The third experiment analyzed the forced convection heat transfer on the surface of the PCM container by varying the air velocity. The data of experimental showed that, increasing ambient air temperature resulted in shorter time for phase change. At temperatures of 30oC, the time for phase change of PCM with the thickness of 8 cm was 1700 min, and it was stable at temperatures of 27oC. Increasing air temperature accelerated the phase change in the material. While for the forced convection heat transfer, PCM could reduce the air temperature in the range of 30 to 35°C at about 1 to 2°C, with a velocity of 1-3 m/s.",http://repository.lppm.unila.ac.id/id/eprint/7785,1970-01-01 00:00:00.000002017,published,['TJ'],,public,2018-06-26 02:45:47,pub,7,['FT7'],disk0/00/00/77/85,,IOP Publishing,IOP Conf. Series: Earth and Environmental Science,1755-1315,60,DOI: 10.1088/1755-1315/60/1/012027,http://www.iopscience.iop.org/issue/1755-1315/60/1,,,,"['Universitas Lampung', 'Universitas Lampung']",,,,,,,,,,,
24,457,2017-07-20 09:03:41,"[{'uri': 'http://repository.lppm.unila.ac.id/id/document/3493', 'pos': 1, 'security': 'public', 'placement': 1, 'eprintid': 3635, 'language': 'en', 'mime_type': 'application/pdf', 'rev_number': 1, 'docid': 3493, 'main': 'AIP_1855_2017_AL.pdf', 'files': [{'fileid': 25409, 'datasetid': 'document', 'hash': '77e882132404c8107859c9af20eaace3', 'mime_type': 'application/pdf', 'objectid': 3493, 'filesize': 1037970, 'filename': 'AIP_1855_2017_AL.pdf', 'uri': 'http://repository.lppm.unila.ac.id/id/file/25409', 'hash_type': 'MD5', 'mtime': '2017-07-06 01:57:12'}], 'format': 'text'}]",2017-07-20 09:03:41,3635,archive,show,040003-1-040003-8,"Hotel Alila, Solo",conference_item,paper,"[{'id': 'asnawi.lubis@eng.unila.ac.id', 'name': {'given': 'Asnawi', 'honourific': None, 'lineage': None, 'family': 'Lubis'}}, {'id': None, 'name': {'given': 'Ahmad', 'family': ""Su'udi"", 'lineage': None, 'honourific': None}}]",Ring Stability of Underground Toroidal Tanks,TRUE,7 december 2016,"The design of pressure vessels subjected to internal pressure is governed by its strength, while the
design of pressure vessels subjected to external pressure is governed by its stability, which is for circular crosssection
is called the ring stability. This paper presented the results of finite element study of ring stability of
circular toroidal tank without stiffener under external pressure. The tank was placed underground and external
pressure load from soil was simulated as pressure at the top of the vessel along 300 circumferentially. One might
ask the reason for choosing toroidal rather than cylindrical tank. Preliminary finite element studies showed that
toroidal shells can withstand higher external pressure than cylindrical shells. In this study, the volume of the tank
was fixed for 15,000 litters. The buckling external pressure (pL) was calculated for radius ratio (R/r) of 2, 3, and
4. The corresponding cross-section radiuses were 724.3 mm, 632.7 mm, and 574.9 mm, respectively. The
selected element type was SHELL 281 from the ANSYS element library. To obtain the buckling load, the arclength
method was used in the nonlinear analysis. Both material and geometric nonlinearities were activated
during the analysis. The conclusion of this study is that short-radius and thin-walled toroidal shell produces
higher buckling load.",http://repository.lppm.unila.ac.id/id/eprint/3635,2017-06-01 00:00:00.000000000,published,['TJ'],"The 3rd International Conference on Engineering, Technology, and Industrial Application",public,2017-07-20 09:03:41,pub,7,['FT7'],disk0/00/00/36/35,conference,,,,,,http://dx.doi.org/10.1063/1.4985499,,asnawi.lubis@eng.unila.ac.id,,,,,,,"ring stability, toroidal shells",,,,,,
25,457,2017-07-20 09:03:51,"[{'pos': 1, 'uri': 'http://repository.lppm.unila.ac.id/id/document/3495', 'security': 'public', 'placement': 1, 'eprintid': 3636, 'mime_type': 'application/pdf', 'language': 'en', 'rev_number': 1, 'main': 'AIP_1855_2017_AL.pdf', 'docid': 3495, 'files': [{'mtime': '2017-07-06 02:50:01', 'hash_type': 'MD5', 'uri': 'http://repository.lppm.unila.ac.id/id/file/25420', 'filename': 'AIP_1855_2017_AL.pdf', 'filesize': 1037970, 'objectid': 3495, 'mime_type': 'application/pdf', 'hash': '77e882132404c8107859c9af20eaace3', 'datasetid': 'document', 'fileid': 25420}], 'format': 'text'}]",2017-07-20 09:03:51,3636,archive,show,,,book,,"[{'name': {'honourific': None, 'family': 'Lubis', 'lineage': None, 'given': 'Asnawi'}, 'id': 'asnawi.lubis@eng.unila.ac.id'}, {'name': {'family': ""Su'udi"", 'lineage': None, 'honourific': None, 'given': 'Ahmad'}, 'id': None}]",Ring Stability of Underground Toroidal Tanks,TRUE,,"The design of pressure vessels subjected to internal pressure is governed by its strength, while the
design of pressure vessels subjected to external pressure is governed by its stability, which is for circular crosssection
is called the ring stability. This paper presented the results of finite element study of ring stability of
circular toroidal tank without stiffener under external pressure. The tank was placed underground and external
pressure load from soil was simulated as pressure at the top of the vessel along 300 circumferentially. One might
ask the reason for choosing toroidal rather than cylindrical tank. Preliminary finite element studies showed that
toroidal shells can withstand higher external pressure than cylindrical shells. In this study, the volume of the tank
was fixed for 15,000 litters. The buckling external pressure (pL) was calculated for radius ratio (R/r) of 2, 3, and
4. The corresponding cross-section radiuses were 724.3 mm, 632.7 mm, and 574.9 mm, respectively. The
selected element type was SHELL 281 from the ANSYS element library. To obtain the buckling load, the arclength
method was used in the nonlinear analysis. Both material and geometric nonlinearities were activated
during the analysis. The conclusion of this study is that short-radius and thin-walled toroidal shell produces
higher buckling load.",http://repository.lppm.unila.ac.id/id/eprint/3636,2017-06-15 00:00:00.000000000,published,['TJ'],,public,2017-07-20 09:03:51,pub,11,['FT7'],disk0/00/00/36/36,,American Institute of Physics,,,1855,,http://dx.doi.org/10.1063/1.4985499,1,asnawi.lubis@eng.unila.ac.id,,,,[{'url': 'http://aip.scitation.org/toc/apc/1855/1'}],,,"ring stability, toroidal shells",,978-0-7354-1529-4,AIP Conference Proceedings,8.0,"[{'name': {'family': 'Prasetyo', 'lineage': None, 'honourific': None, 'given': 'Hari'}}, {'name': {'given': 'Munajat Tri', 'family': 'Nugroho', 'lineage': None, 'honourific': None}}, {'name': {'given': 'Nurul', 'lineage': None, 'family': 'Hidayati', 'honourific': None}}, {'name': {'given': 'Eko', 'family': 'Setiawan', 'lineage': None, 'honourific': None}}, {'name': {'family': 'Widayatno', 'lineage': None, 'honourific': None, 'given': 'Tri'}}, {'name': {'honourific': None, 'family': 'Setiawan', 'lineage': None, 'given': 'Wisnu'}}, {'name': {'honourific': None, 'family': 'Suryawan', 'lineage': None, 'given': 'Fajar'}}]",
26,27,2017-11-17 04:17:57,"[{'mime_type': 'application/pdf', 'language': 'en', 'rev_number': 1, 'format': 'text', 'main': '2017 The dynamics of the water droplet impacting onto hot solid surfaces at medium Weber number.pdf', 'docid': 18727, 'files': [{'hash': '703b5df86a0918332e8bcead167f78a4', 'mime_type': 'application/pdf', 'datasetid': 'document', 'fileid': 54231, 'filename': '2017 The dynamics of the water droplet impacting onto hot solid surfaces at medium Weber number.pdf', 'uri': 'http://repository.lppm.unila.ac.id/id/file/54231', 'filesize': 3894873, 'objectid': 18727, 'mtime': '2017-11-16 18:23:25', 'hash_type': 'MD5'}], 'security': 'public', 'uri': 'http://repository.lppm.unila.ac.id/id/document/18727', 'pos': 1, 'eprintid': 5792, 'placement': 1}]",2017-11-17 04:17:57,5792,archive,show,3085-3097,,article,,"[{'id': None, 'name': {'given': 'Windy H', 'honourific': None, 'family': 'Mitrakusuma', 'lineage': None}}, {'name': {'lineage': None, 'family': 'Kamal', 'honourific': None, 'given': 'Samsul'}, 'id': None}, {'id': None, 'name': {'given': 'Indarto', 'honourific': None, 'family': 'Indarto', 'lineage': None}}, {'id': 'mdyan.susila@eng.unila.ac.id', 'name': {'honourific': None, 'family': 'Susila', 'lineage': None, 'given': 'M Dyan'}}, {'id': None, 'name': {'given': 'Hermawan', 'honourific': None, 'lineage': None, 'family': 'Hermawan'}}, {'name': {'honourific': None, 'lineage': None, 'family': 'Deendarlianto', 'given': 'Deendarlianto'}, 'id': 'deendarlianto@ugm.ac.id'}]",The dynamics of the water droplet impacting onto hot solid surfaces at medium Weber numbers,TRUE,,"The effects of the wettability of a droplet impacting onto a hot solid surface under medium Weber numbers were studied experimentally. The Weber numbers used in the present experiment were 52.1, 57.6, and 63.1. Three kinds of solid surfaces with different wettability were used. These were normal stainless steel (NSS), TiO2 coated NSS, and TiO2 coated NSS radiated with ultraviolet rays. The surface temperatures were varied from 60 to 200 °C. The image of side the view and 30° from horizontal were taken to explain the spreading and the interfacial behavior of a single droplet during impact the hot solid surfaces. It was found that under medium Weber numbers, the surface wettability plays an important role on the droplet spreading and evaporation time during the impact on the hot solid surfaces. The higher the wettability, the larger the droplet spreading on the hot surface, and the lower the evaporation time.",http://repository.lppm.unila.ac.id/id/eprint/5792,2017-10-01 00:00:00.000000000,published,['TJ'],,public,2017-11-17 04:17:57,pub,8,['FT7'],disk0/00/00/57/92,,Springer-Verlag Berlin Heidelberg,Heat and Mass Transfer,1432-1181,53,,https://link.springer.com/article/10.1007/s00231-017-2053-0,10,,,,,,,,,,,,,,
27,451,2017-06-12 02:02:44,"[{'mime_type': 'application/pdf', 'language': 'en', 'rev_number': 1, 'files': [{'mime_type': 'application/pdf', 'hash': 'e4f9b57c6af8295e43372544ccfbc72e', 'fileid': 24148, 'datasetid': 'document', 'filename': '11-1-23-1-10-20170330_2.pdf', 'uri': 'http://repository.lppm.unila.ac.id/id/file/24148', 'objectid': 3356, 'filesize': 767392, 'mtime': '2017-06-06 12:13:52', 'hash_type': 'MD5'}], 'main': '11-1-23-1-10-20170330_2.pdf', 'docid': 3356, 'format': 'text', 'pos': 1, 'uri': 'http://repository.lppm.unila.ac.id/id/document/3356', 'security': 'public', 'placement': 1, 'eprintid': 3487}]",2017-06-12 02:02:44,3487,archive,show,1-10,,article,,"[{'id': 'mbruddin@eng.unila.ac.id', 'name': {'honourific': None, 'family': 'Mohammad', 'lineage': None, 'given': 'Badaruddin'}}, {'id': 'yudi.eka@eng.unila.ac.id', 'name': {'family': 'Ahmad', 'lineage': None, 'honourific': None, 'given': 'Yudi Eka Risano'}}, {'id': 'ahmad.suudi@eng.unila.ac.id', 'name': {'given': 'Suudi', 'honourific': None, 'family': 'Ahmad', 'lineage': None}}]",Peningkatan Efisiensi Termal Tungku Biomasa untuk Proses Pengeringan Biji Kakao di Desa Wiyono Kabupaten Pesawaran Propinsi Lampung,TRUE,,"The modification stove was designed and constructed for drying cocoa beans using biomassa as fuel.
The purpose of the modification stove is to increase production of 0.6 tonnes dry cocoa beans. The thermal
efficiency of the stove is determined and compared with a conventional stove using hevea brasiliensis woods as
fuel. The inside wall of stove and oven were built from SK34 fire brick and ceramic paper, respectively. The
outer walls were made from red brick and was coated by cement. The results show that the thermal efficiency
of the modification stove is increased by 37.34% compared with the conventional stove. The fuel consumption
decreases by 25 % (25 kg-product), resulting a fuel cost saving of Rp. 1.8 million/year. In addition, the total
cost of the stove can be paid back in a period of 3.5 years with the service lifetime of the stove for 10 years. The
moisture contents ratio of cocoa beans with drying time are obtained to predict values of diffusivity (De) over
range of drying temperature 50-80 C. the values of diffusivity obtained ranged from 62.03 × 10−10 sampai 4.55
× 10−10 m2/s for the temperature used.",http://repository.lppm.unila.ac.id/id/eprint/3487,2017-03-01 00:00:00.000000000,published,"['S1', 'TJ']",,public,2017-06-12 02:02:44,pub,8,['FT7'],disk0/00/00/34/87,,Lembaga Penelitian dan Pengabdian Kepada Masyarakat,SAKAI SAMBAYAN,e-ISSN 2550-1089,1,,http://jss.lppm.unila.ac.id,1,,,,,,,,,,,,,,
28,59,2018-06-21 01:38:09,"[{'rev_number': 1, 'language': 'en', 'mime_type': 'application/pdf', 'format': 'text', 'files': [{'datasetid': 'document', 'fileid': 66677, 'mime_type': 'application/pdf', 'hash': '6701c5159bd2f0c1a863542a39a62b93', 'hash_type': 'MD5', 'mtime': '2018-06-20 09:55:21', 'filesize': 982495, 'objectid': 20436, 'filename': 'Analisis Fasilitas Wudhu Masjid di Bandar Lampung dari Tinjauan Ergonomis sebagai Bagian Peningkatan Kualitas Pelayanan Fasos Kota.pdf', 'uri': 'http://repository.lppm.unila.ac.id/id/file/66677'}], 'main': 'Analisis Fasilitas Wudhu Masjid di Bandar Lampung dari Tinjauan Ergonomis sebagai Bagian Peningkatan Kualitas Pelayanan Fasos Kota.pdf', 'docid': 20436, 'security': 'public', 'pos': 1, 'uri': 'http://repository.lppm.unila.ac.id/id/document/20436', 'eprintid': 7386, 'placement': 1}]",2018-06-21 01:38:09,7386,archive,show,II.21-II.28,Bandar Lampung,article,paper,"[{'id': 'achmad.yahya@eng.unila.ac.id', 'name': {'family': 'Panuju', 'lineage': None, 'honourific': None, 'given': 'Yahya'}}]",Analisis Fasilitas Wudhu Masjid di Bandar Lampung dari Tinjauan Ergonomis sebagai Bagian Peningkatan Kualitas Pelayanan Fasos Kota,TRUE,7 - 8 November 2017,"Wudu is the Islamic procedure for washing parts of the body, that is oftenly done at masjid, as a place to
do worship rituals for Muslims. Because of its frequent events, wudu process should be done in a secure and
comfort way, which must be supported by proper facilities. Facilities as referred in this case were the water faucet and other components around it. Design of these facilities related to ergonomics concepts, was relevant to be discussed in order to improve services for jemaah and to reduce physical accident possibility while doing wudu. More over, in many cases, ergonomics-based design improvements addressed to better productivity and
shorter process time, so it could be estimated that water used in wudu process might also be reduced. All of
these items were claimed as parts of the city’s social facilities services to its cityzen and tourists. This article focuses on analyzing wudu facilities at mosques in Bandar Lampung based on ergonomics concepts. The
dimensions of the facilities were measured and compared to anthropometry databases, wudu processes at each
facility were observed, and users of these facilities were asked about their opinion related to facilities’ comfort aspects by questionnaires. The data were analyzed to rate the facilities’ conformity to ergonomics concepts.As results, each facility was marked with certain level of ergonomics scale and some correction notes were found as inputs for future improvements to each masjid committee.",http://repository.lppm.unila.ac.id/id/eprint/7386,2017-11-01 00:00:00.000000000,published,"['TJ', 'TX']",Seminar Nasional Energi dan Industri Manufaktur (SIGER) 2017,public,2018-06-21 01:38:09,pub,12,['FT7'],disk0/00/00/73/86,conference,Universitas Lampung,Prosiding Seminar Nasional Energi dan Industri Manufaktur 2017,978-602-5085-10-9,,,,,,,,,,,,,,,,,,
