,userid,lastmod,documents,datestamp,eprintid,eprint_status,metadata_visibility,pagerange,event_location,type,pres_type,creators,title,refereed,event_dates,abstract,uri,date,date_type,subjects,event_title,full_text_status,status_changed,ispublished,rev_number,divisions,dir,event_type,publisher,publication,issn,volume,id_number,official_url,number,contact_email,funders,corp_creators,projects,related_url,contributors,referencetext,keywords,succeeds,isbn,place_of_pub,pages,editors,series
29,464,2019-11-04 02:07:04,"[{'format': 'text', 'files': [{'fileid': 123291, 'datasetid': 'document', 'hash': '1c54a9b4dc5ba76250445061232afefc', 'mime_type': 'application/pdf', 'filesize': 165004, 'objectid': 27236, 'uri': 'http://repository.lppm.unila.ac.id/id/file/123291', 'filename': 'jeas_0617_6125.pdf', 'hash_type': 'MD5', 'mtime': '2019-09-12 16:52:59'}], 'main': 'jeas_0617_6125.pdf', 'docid': 27236, 'rev_number': 1, 'language': 'en', 'mime_type': 'application/pdf', 'eprintid': 14193, 'placement': 1, 'security': 'public', 'uri': 'http://repository.lppm.unila.ac.id/id/document/27236', 'pos': 1}]",2019-11-04 02:07:04,14193,archive,show,,,article,,"[{'id': None, 'name': {'honourific': None, 'lineage': None, 'family': 'Ramdan', 'given': 'Mohd.'}}, {'id': 'irza.sukmana@gmail.com', 'name': {'lineage': None, 'family': 'Sukmana', 'honourific': None, 'given': 'Irza'}}]",ADVANCED BIOREACTOR SYSTEM FOR THE IMPLANTABLE BIOMATERIALS TESTING AND TISSUE ENGINEERING APPLICATIONS,FALSE,,"Tissue engineering scientists believe that the next generation of functional tissue and artificial organ replacements truly need the use of advanced bioreactor system. Bioreactor system, in which the culture conditions can be adjusted and studied, will support the development of tissues with optimal mechanical, chemical, and biological stimuli for a given application. Although there have been various types of bioreactors designed and tested for several implantable biomaterials and tissue engineering applications, the development of a complete artificial organ remains a dream. This review addresses recent advances and future challenges in designing and using advanced bioreactor system to support the mass production of vascularized engineering tissues and artificial organ. The potential application of micro-electromechanical system (MEMS) bioreactor technology for future advancement in tissue engineering is also highlighted.",http://repository.lppm.unila.ac.id/id/eprint/14193,2017-05-15 00:00:00.000000000,published,['TJ'],,public,2019-11-04 02:07:04,pub,8,['FT7'],disk0/00/01/41/93,,Asian Research Publishing Network,ARPN Journal of Agricultural and Biological Science,1990-6145,,,,,,['Kemenristekdikti'],['University of Lampung'],['Hibah Penelitan Produk Terapan (PPT)'],,"[{'name': {'given': 'Mohd', 'honourific': None, 'family': 'Ramdan', 'lineage': None}, 'id': None}, {'id': 'irza.sukmana@gmail.com', 'name': {'family': 'Sukmana', 'lineage': None, 'honourific': None, 'given': 'Irza'}}]",,,2707.0,,,,,
30,464,2017-05-31 04:45:02,"[{'security': 'public', 'pos': 1, 'uri': 'http://repository.lppm.unila.ac.id/id/document/2097', 'eprintid': 2205, 'placement': 1, 'language': 'en', 'rev_number': 1, 'mime_type': 'application/pdf', 'format': 'text', 'main': 'jeas_0117_5628_3.pdf', 'files': [{'fileid': 15253, 'datasetid': 'document', 'hash': '79c108673401b0d44658966ef5f54917', 'mime_type': 'application/pdf', 'objectid': 2097, 'filesize': 407601, 'uri': 'http://repository.lppm.unila.ac.id/id/file/15253', 'filename': 'jeas_0117_5628_3.pdf', 'hash_type': 'MD5', 'mtime': '2017-05-30 11:56:46'}], 'docid': 2097}]",2017-05-31 04:45:02,2205,archive,show,371-376,,article,,"[{'id': None, 'name': {'given': 'Mohd.', 'lineage': None, 'family': 'Ramdan', 'honourific': None}}, {'name': {'given': 'Irza', 'family': 'Sukmana', 'lineage': None, 'honourific': None}, 'id': 'irza.sukmana@gmail.com'}, {'name': {'given': 'Nur', 'lineage': None, 'family': 'Syazana', 'honourific': None}, 'id': None}, {'name': {'given': 'Noor', 'honourific': None, 'family': 'Jasmawati', 'lineage': None}, 'id': None}, {'name': {'lineage': None, 'family': 'Rafiq', 'honourific': None, 'given': 'Mohammed'}, 'id': None}, {'id': None, 'name': {'family': 'Syahrom', 'lineage': None, 'honourific': None, 'given': 'Ardiyansyah'}}]","THREE-DIMENSIONAL ADVANCE DYNAMIC CULTURE SYSTEM
PROMOTES MICROVESSEL DEVELOPMENT FROM CULTURED 
ENDOTHELIAL CELLS IN VITRO",TRUE,,"The present study describes a dynamic system that can be used in a three- dimensional (3D) in vitro cell culture environment which promotes new microvessel formation. Human umbilical vein endothelial cells (HUVECs) were used in this study to form the inner lining of the microvessel, guided by the dynamic flow produced by our system within a 3D matrix made from fibrin. A 2D environment was used as a comparison. The dynamic flow was set to produce 5, 10, 15 or 20 dynes/cm2 shear stress to the cells in culture. Cultured HUVECs were observed for the increase in cell numbers and formation of microvessels. Cells cultured after 2 days demonstrated an increase in cell numbers when subjected to 10dynes/cm2 or more. By day 4, cells appeared to have altered morphologies and were oriented towards the direction of fluid flow. From the fluorescence images observed, it became apparent that there were microvascular channels forming in the 3D cultures. Our dynamic flow system appears to influence endothelial cells to promote microvascular formations in a 3D environment.",http://repository.lppm.unila.ac.id/id/eprint/2205,2017-01-20 00:00:00.000000000,published,['TJ'],,public,2017-05-31 04:45:02,pub,7,['FT7'],disk0/00/00/22/05,,Asian Research Publishing Network,ARPN Journal of Engineering and Applied Sciences,1819-6608,12,,http://www.arpnjournals.com/jeas/volume_02_2017.htm,2,,['Kemenristekdikti dan MOHE Malaysia'],"['Universiti Teknologi Malaysia', 'Universitas Lampung']","['Hibah Kompetensi, Ristekdikti Indonesia grant contract No.: 78/UN26/LPPM/2016']",[{'url': 'http://www.arpnjournals.com/jeas/volume_02_2017.htm'}],"[{'id': 'irza.sukmana@gmail.com', 'name': {'honourific': None, 'family': 'Sukmana', 'lineage': None, 'given': 'Irza'}, 'type': 'http://www.loc.gov/loc.terms/relators/AUI'}]",,,,,,,,
31,27,2021-02-01 04:52:06,"[{'format': 'text', 'main': 'APLIKASI MINYAK KELAPA SAWIT PADA PHOTOVOLTAIC.pdf', 'files': [{'fileid': 246122, 'datasetid': 'document', 'mime_type': 'application/pdf', 'hash': 'dc6b9ae597549ab0bc9d1650c0d0396c', 'filesize': 921880, 'objectid': 41555, 'filename': 'APLIKASI MINYAK KELAPA SAWIT PADA PHOTOVOLTAIC.pdf', 'uri': 'http://repository.lppm.unila.ac.id/id/file/246122', 'hash_type': 'MD5', 'mtime': '2021-01-29 06:49:41'}], 'docid': 41555, 'language': 'en', 'rev_number': 1, 'mime_type': 'application/pdf', 'eprintid': 27543, 'placement': 1, 'security': 'public', 'uri': 'http://repository.lppm.unila.ac.id/id/document/41555', 'pos': 1}]",2021-02-01 04:52:06,27543,archive,show,1-7,,article,,"[{'id': 'yudi_95@yahoo.com', 'name': {'given': 'A.Yudi Eka', 'honourific': None, 'family': 'Risano', 'lineage': None}}, {'name': {'lineage': None, 'family': 'Susila', 'honourific': None, 'given': 'M Dyan'}, 'id': 'mdyan.susila@eng.unila.ac.id'}, {'id': 'yogapratama123@yahoo.com', 'name': {'family': 'Pratama', 'lineage': None, 'honourific': None, 'given': 'Yoga'}}]",APLIKASI MINYAK KELAPA SAWIT PADA PHOTOVOLTAIC YANG TERINTEGRASI PADA DINDING BANGUNAN SEBAGAI PENDINGIN PASIF UNTUK MENINGKATKAN EFISIENSI DAN MENURUNKAN BEBAN PENDINGIN RUANGAN,TRUE,,"Menanggapi isu green building dan penggunaan clean energy yang sangat santer saat ini, pemanfaatan energi terbarukan menjadi meningkat. Penggunaan energi surya menggunakan photovoltaic (PV) pada sistem Building Intergated Photovoltaics (BIPV) akan menambah pasokan listrik dan mengurangi ketergantungan terhadap pembangkit listrik. Menurut M. Farid dan Abhat A. Low dalam jurnal MONEV Muhammad Irsyad, Penambahan Minyak Kelapa Sawit pada Photovoltaic yang Terintegrasi pada Dinding Bangunan untuk Meningkatkan Efisiensi dan Menurunkan Beban Pendingin Ruangan (2012), persoalan tiap kenaikan 1oC temperatur PV yang mengurangi efisiensi PV 0,4 – 0,5% dapat disiasati dengan integrasi Phase Change Material (PCM). Selain itu dengan sifatnya sebagai pendinginan pasif, masuknya kalor ke dalam ruangan juga akan direduksi. Penelitian ini dilakukan untuk melihat karakteristik efisiensi PV dan perambatan kalor pada ruangan model BIPV yang diintegrasikan dengan PCM CPO. Pengujian dilakukan dengan membandingkan dua model BIPV yang dengan dan tanpa PCM CPO. Variasi dilakukan dengan kemiringan BIPV 45º dan 30º masing-masing orientasi timur dan barat. Setelah dilakukan empat variasi percobaan, BIPV dengan kemiringan 30º lebih unggul dibanding dengan kemiringan 45º. Perbandingan perpindahan panas dinding dalam menuju ruang BIPV dengan PCM CPO kemiringan 30º orientasi barat lebih signifikan dan stabil, terutama pada intensitas 850 W/m² perbandingan panas dari dinding dalam menuju ruang yang sebesar 0,4012 W dapat diredam dengan menggunakan CPO hanya sebesar 0,2596 W. Kemudian pada puncak perpindahan panas tertinggi dari dinding dalam ke ruang model BIPV tanpa CPO dengan intensitas 923 W/m² mencapai 0,43426 W, dengan penambahan PCM CPO hanya 0,25913 W. Perbedaan efisiensi dengan pemakaian PCM CPO juga lebih unggul hingga menaikkan efisiensi 5,75% saat intensitas 982 W/m² sudut penyinaran 120 º dari timur.",http://repository.lppm.unila.ac.id/id/eprint/27543,2017-06-01 00:00:00.000000000,published,['TJ'],,public,2021-02-01 04:52:06,pub,7,['FT7'],disk0/00/02/75/43,,"Jurusan Teknik Mesin, Fakultas Teknik, Universitas Muhammadiyah Metro",TURBO,"p-ISSN: 2301-6663, e-ISSN: 2477-250X",6,,https://ojs.ummetro.ac.id/index.php/turbo/article/view/460,1,,,,,[{'url': 'https://ojs.ummetro.ac.id/index.php/turbo/issue/view/58'}],,,,,,,,,
32,303,2021-03-26 06:53:54,"[{'format': 'text', 'files': [{'hash_type': 'MD5', 'mtime': '2021-03-26 03:52:32', 'filesize': 1776860, 'objectid': 42650, 'uri': 'http://repository.lppm.unila.ac.id/id/file/253744', 'filename': 'Ithenticate_Report_JTurbo_V6No1_Yudi_2017.pdf', 'fileid': 253744, 'datasetid': 'document', 'hash': '938dcadda39e888e80ef38e0ea49710c', 'mime_type': 'application/pdf'}], 'main': 'Ithenticate_Report_JTurbo_V6No1_Yudi_2017.pdf', 'docid': 42650, 'mime_type': 'application/pdf', 'language': 'en', 'rev_number': 1, 'eprintid': 28591, 'placement': 1, 'security': 'public', 'pos': 1, 'uri': 'http://repository.lppm.unila.ac.id/id/document/42650'}]",2021-03-26 06:53:54,28591,archive,show,,,other,,"[{'id': 'yudi_95@yahoo.com', 'name': {'family': 'Risano', 'lineage': None, 'honourific': None, 'given': 'A.Yudi Eka'}}, {'id': 'mdyan.susila@eng.unila.ac.id', 'name': {'lineage': None, 'family': 'Susila', 'honourific': None, 'given': 'M Dyan'}}, {'name': {'given': 'Yoga', 'honourific': None, 'family': 'Pratama', 'lineage': None}, 'id': None}]",APLIKASI MINYAK KELAPA SAWIT PADA PHOTOVOLTAIC YANG TERINTEGRASI PADA DINDING BANGUNAN SEBAGAI PENDINGIN PASIF UNTUK MENINGKATKAN EFISIENSI DAN MENURUNKAN BEBAN PENDINGIN RUANGAN,,,"Menanggapi isu green building dan penggunaan clean energy yang sangat santer saat ini, pemanfaatan energi terbarukan menjadi meningkat. Penggunaan energi surya menggunakan photovoltaic (PV) pada sistem Building Intergated Photovoltaics (BIPV) akan menambah pasokan listrik dan mengurangi ketergantungan terhadap pembangkit listrik. Menurut M. Farid dan Abhat A. Low dalam jurnal MONEV Muhammad Irsyad, Penambahan Minyak Kelapa Sawit pada Photovoltaic yang Terintegrasi pada Dinding Bangunan untuk Meningkatkan Efisiensi dan Menurunkan Beban Pendingin Ruangan (2012), persoalan tiap kenaikan 1 oC temperatur PV yang mengurangi efisiensi PV 0,4 – 0,5% dapat disiasati dengan integrasi Phase Change Material (PCM). Selain itu dengan sifatnya sebagai pendinginan pasif, masuknya kalor ke dalam ruangan juga akan direduksi. Penelitian ini dilakukan untuk melihat karakteristik efisiensi PV dan perambatan kalor pada ruangan model BIPV yang diintegrasikan dengan PCM CPO. Pengujian dilakukan dengan membandingkan dua model BIPV yang dengan dan tanpa PCM CPO. Variasi dilakukan dengan kemiringan BIPV 45º dan 30º masing�masing orientasi timur dan barat. Setelah dilakukan empat variasi percobaan, BIPV dengan kemiringan 30º lebih unggul dibanding dengan kemiringan 45º. Perbandingan perpindahan panas dinding dalam menuju ruang BIPV dengan PCM CPO kemiringan 30º orientasi barat lebih signifikan dan stabil, terutama pada intensitas 850 W/m² perbandingan panas dari dinding dalam menuju ruang yang sebesar 0,4012 W dapat diredam dengan menggunakan CPO hanya sebesar 0,2596 W. Kemudian pada puncak perpindahan panas tertinggi dari dinding dalam ke ruang model BIPV tanpa CPO dengan intensitas 923 W/m² mencapai 0,43426 W, dengan penambahan PCM CPO hanya 0,25913 W. Perbedaan efisiensi dengan pemakaian PCM CPO juga lebih unggul hingga menaikkan efisiensi 5,75% saat intensitas 982 W/m² sudut penyinaran 120 º dari timur. Kata kunci : green building, clean energy, photovoltaic, Bahan Perubah Fasa, Minyak Kelapa Sawit, pendingin pasif.",http://repository.lppm.unila.ac.id/id/eprint/28591,2017-06-01 00:00:00.000000000,published,['TJ'],,public,2021-03-26 06:53:54,pub,8,['FT7'],disk0/00/02/85/91,,TURBO jurnal program studi teknik mesin SINTA 3,,,,"ISSN 2477-250X Volume 6, Nomor 1, Tahun 2017",https://ojs.ummetro.ac.id/index.php/turbo/article/view/460,,,,,,,,,,,,TURBO,,,
33,984,2018-04-25 06:42:48,"[{'eprintid': 5921, 'placement': 1, 'security': 'public', 'uri': 'http://repository.lppm.unila.ac.id/id/document/18840', 'pos': 1, 'format': 'text', 'docid': 18840, 'main': 'Makalah jorfri-2017.pdf', 'files': [{'mime_type': 'application/pdf', 'hash': '6e0d0e8d2db5af1920b713c8db4f1c30', 'datasetid': 'document', 'fileid': 55005, 'mtime': '2017-11-17 10:13:57', 'hash_type': 'MD5', 'filename': 'Makalah jorfri-2017.pdf', 'uri': 'http://repository.lppm.unila.ac.id/id/file/55005', 'objectid': 18840, 'filesize': 210439}], 'rev_number': 1, 'language': 'en', 'mime_type': 'application/pdf'}]",2018-04-25 06:42:48,5921,archive,show,,,article,,"[{'name': {'honourific': None, 'lineage': None, 'family': 'Sinaga', 'given': 'Jorfri Boike'}, 'id': 'jorfri6@yahoo.com'}, {'name': {'given': '-', 'lineage': None, 'family': 'Azhar', 'honourific': None}, 'id': None}, {'name': {'given': 'Novri', 'honourific': None, 'family': 'Tanti', 'lineage': None}, 'id': None}, {'id': None, 'name': {'given': '-', 'lineage': None, 'family': 'Sugiman', 'honourific': None}}]",Perancangan Model Pembangkit Listrik Dengan Menggunakan Teknologi Pompa Tanpa Motor (Hydraulic Ram Pump),TRUE,,"This paper presents the design of parameters of  hydraulic ram pump and hydraulic turbine to use  the energy of flowing water for water supply to generate electrical power and irrigation. Design of  parameters of hydraulic ram pump with head of water supply of 1,5 m was obtained: 1,25 in. diameter and  8 m length of drive pipe,  200 gr and 4,6 cm of weight  and diameter of impulse valve,  4.200 cm3 of air chamber volume. The testing results of the hydraulic ram pump model shown that water could be pumped as far as the height of 7 m and 8 m, with the volume flow rate of 2,755 lit/men and 1,73 lit/men.  Design of  geometric parameters of cross flow hydraulic turbine with head of water supply of 1,75 m was obtained:  12 cm and 8 cm of external and internal diameter, 25 cm of runner width,  and 18 of runner number.   The testing results of the cross flow hydraulic turbine shown that power could be generated 83,47 W with the volume flow rate of 0,01 lit/s and the efficiency of 71,05 % at 799 rpm. The testing result also shown that with using volume flow rate of 0,003 lit/s, this turbine could be generated 23,39 W with the efficiency of 46,64 %. Technically the technology of hydraulic ram pump can be developped and used to supply of water for irrigation and generating of electrical power.",http://repository.lppm.unila.ac.id/id/eprint/5921,2017-09-01 00:00:00.000000000,submitted,['TJ'],,public,2018-04-25 06:42:48,inpress,6,['FT7'],disk0/00/00/59/21,,Jurusan Teknik Mesin FT– Universitas Lampung.,Jurnal Mechanical,2087-1880,8,,,2,,,,,,,,,,,,,,
34,984,2018-06-25 02:22:25,"[{'security': 'public', 'uri': 'http://repository.lppm.unila.ac.id/id/document/20545', 'pos': 1, 'eprintid': 7508, 'placement': 1, 'language': 'en', 'rev_number': 1, 'mime_type': 'application/pdf', 'format': 'text', 'docid': 20545, 'main': 'Perancangan Model Pembangkit Listrik Dengan Menggunakan Teknologi Pompa Tanpa Motor (Hydraulic Ram Pump).pdf', 'files': [{'fileid': 67739, 'datasetid': 'document', 'mime_type': 'application/pdf', 'hash': '4128614ab0b004cf36eea876cb03d25a', 'hash_type': 'MD5', 'mtime': '2018-06-22 03:52:36', 'objectid': 20545, 'filesize': 370355, 'filename': 'Perancangan Model Pembangkit Listrik Dengan Menggunakan Teknologi Pompa Tanpa Motor (Hydraulic Ram Pump).pdf', 'uri': 'http://repository.lppm.unila.ac.id/id/file/67739'}]}]",2018-06-25 02:22:25,7508,archive,show,57-66,,article,,"[{'name': {'given': 'Jorfri Boike', 'honourific': None, 'lineage': None, 'family': 'Sinaga'}, 'id': 'jorfri6@yahoo.com'}, {'name': {'given': 'Azhar', 'family': 'Azhar', 'lineage': None, 'honourific': None}, 'id': None}, {'name': {'lineage': None, 'family': 'Tanti', 'honourific': None, 'given': 'Novri'}, 'id': 'rianti_dc@yahoo.com'}, {'name': {'given': '-', 'family': 'Sugiman', 'lineage': None, 'honourific': None}, 'id': None}]",Perancangan Model Pembangkit Listrik Dengan Menggunakan Teknologi Pompa Tanpa Motor (Hydraulic Ram Pump),TRUE,,"This paper presents the design of parameters of  hydraulic ram pump and hydraulic turbine to use  the energy of flowing water for water supply to generate electrical power and irrigation. Design of  parameters of hydraulic ram pump with head of water supply of 1,5 m was obtained: 1,25 in. diameter and  8 m length of drive pipe,  200 gr and 4,6 cm of weight  and diameter of impulse valve,  4.200 cm3 of air chamber volume. The testing results of the hydraulic ram pump model shown that water could be pumped as far as the height of 7 m and 8 m, with the volume flow rate of 2,755 lit/men and 1,73 lit/men.  Design of  geometric parameters of cross flow hydraulic turbine with head of water supply of 1,75 m was obtained:  12 cm and 8 cm of external and internal diameter, 25 cm of runner width,  and 18 of runner number.   The testing results of the cross flow hydraulic turbine shown that power could be generated 83,47 W with the volume flow rate of 0,01 lit/s and the efficiency of 71,05 % at 799 rpm. The testing result also shown that with using volume flow rate of 0,003 lit/s, this turbine could be generated 23,39 W with the efficiency of 46,64 %. Technically the technology of hydraulic ram pump can be developped and used to supply of water for irrigation and generating of electrical power.",http://repository.lppm.unila.ac.id/id/eprint/7508,2017-09-01 00:00:00.000000000,published,['TJ'],,public,2018-06-25 02:22:25,pub,6,['FT7'],disk0/00/00/75/08,,Jurusan Teknik Mesin Universitas Lampung,Mechanical Jurnal Ilmiah Teknik Mesin,2460-1888,2,,http://journal.eng.unila.ac.id/index.php/mech/article/view/819,2,,,,,,,,,,,,,,
35,355,2018-04-25 06:50:35,"[{'security': 'public', 'pos': 1, 'uri': 'http://repository.lppm.unila.ac.id/id/document/18881', 'eprintid': 5964, 'placement': 1, 'language': 'en', 'rev_number': 1, 'mime_type': 'application/pdf', 'format': 'text', 'main': 'Mechanical.pdf', 'docid': 18881, 'files': [{'hash_type': 'MD5', 'mtime': '2017-11-18 06:14:31', 'objectid': 18881, 'filesize': 2271316, 'uri': 'http://repository.lppm.unila.ac.id/id/file/55300', 'filename': 'Mechanical.pdf', 'datasetid': 'document', 'fileid': 55300, 'mime_type': 'application/pdf', 'hash': 'c70e886ceb89346584bd76f71c8927d5'}]}]",2018-04-25 06:50:35,5964,archive,show,13-22,,article,,"[{'id': None, 'name': {'given': 'Jorfri Boike', 'honourific': None, 'lineage': None, 'family': 'Sinaga'}}, {'name': {'lineage': None, 'family': 'Azhar', 'honourific': None, 'given': 'Azhar'}, 'id': None}, {'name': {'lineage': None, 'family': 'Tanti', 'honourific': None, 'given': 'Novri'}, 'id': 'rianti_dc@yahoo.com'}, {'name': {'given': 'Sugiman', 'lineage': None, 'family': 'Sugiman', 'honourific': None}, 'id': None}]",Perancangan Model Pembangkit Listrik dengan Menggunakan Teknologi Pompa Tanpa Motor (Hydraulic Ram Pump),TRUE,,Pada makalah ini diberikan perancangan parameter-parameter pompa tanpa motor (Hydraulic Ram Pump)dan turbin air yang akan memanfaatkan energi air untuk membangkitkan energi listrik dan menyuplai air untuk irigasi.,http://repository.lppm.unila.ac.id/id/eprint/5964,2017-09-01 00:00:00.000000000,published,['TJ'],,public,2018-04-25 06:50:35,pub,11,['FT7'],disk0/00/00/59/64,,Jurusan Teknik Mesin Universitas Lampung,Mechanical Jurnal Ilmiah Teknik Mesin,2087-1880,8,,http://journal.eng.unila.ac.id,2,,,['Novri Tanti'],,[{'url': 'http://journal.eng.unila.ac.id'}],"[{'type': 'http://www.loc.gov/loc.terms/relators/AUT', 'name': {'given': 'Novri', 'honourific': None, 'family': 'Tanti', 'lineage': None}}]",,,,,,,,
36,984,2018-06-25 02:22:29,"[{'uri': 'http://repository.lppm.unila.ac.id/id/document/20549', 'pos': 1, 'security': 'public', 'placement': 1, 'eprintid': 7511, 'language': 'en', 'rev_number': 1, 'mime_type': 'application/pdf', 'docid': 20549, 'main': 'Makalah Siger 2017.pdf', 'files': [{'objectid': 20549, 'filesize': 517772, 'filename': 'Makalah Siger 2017.pdf', 'uri': 'http://repository.lppm.unila.ac.id/id/file/67786', 'hash_type': 'MD5', 'mtime': '2018-06-22 04:12:41', 'fileid': 67786, 'datasetid': 'document', 'hash': 'b4ec0ec11ccbf552f47852da45f72545', 'mime_type': 'application/pdf'}], 'format': 'text'}]",2018-06-25 02:22:29,7511,archive,show,III74-III80,,article,,"[{'name': {'given': 'Jorfri Boike', 'family': 'Sinaga', 'lineage': None, 'honourific': None}, 'id': 'jorfri6@yahoo.com'}, {'id': None, 'name': {'lineage': None, 'family': 'Suudi', 'honourific': None, 'given': 'Ahmad'}}, {'id': None, 'name': {'honourific': None, 'family': 'Khonaifi', 'lineage': None, 'given': 'M. Aang'}}, {'name': {'family': 'Rahman', 'lineage': None, 'honourific': None, 'given': 'Milia'}, 'id': None}, {'name': {'honourific': None, 'family': 'Sugiman', 'lineage': None, 'given': '-'}, 'id': None}]",Perancangan Alat Pengujian Model Turbin Air Ultra Low Head  untuk Sistem Pembangkit Listrik Tenaga Mikro Hidro (PLTMH),TRUE,,"Pembangkit Listrik Tenaga Mikrohidro (PLTMH) adalah istilah yang digunakan untuk sistem pembangkit energi listrik yang menggunakan energi air dimana daya yang dihasilkan lebih kecil dari 100 kW. Teknologi PLTMH  ini sudah terbukti handal untuk  memenuhi kebutuhan listrik bagi desa-desa di daerah terpencil. Umumnya sistem PLTMH yang ada memanfaatkan energi aliran air yang memiliki tinggi jatuh, namun  banyak daerah di pedesaan yang tidak memiliki potensi aliran yang memiliki tinggi jatuh air tetapi hanya potensi aliran air yang memiliki energi kinetik. Dengan menggunakan turbin air ultra low head (head sangat rendah), potensi aliran ini dapat dimanfaatkan untuk menggerakkan suatu sistem PLTMH. Namun sebelum potensi energi aliran air suatu aliran air dimanfaatkan maka perlu dilakukan perancangan alat pengujian terhadap model turbin air yang akan digunakan untuk memperkirakan unjuk kerja prototipe turbin air untuk menggerakkan suatu sistem PLTMH. Pada makalah ini disajikan perancangan alat pengujian dan parameter-parameter model turbin helik untuk model sistem PLTMH yang dilakukan di Laboratorium Mekanika Fluida Jurusan Teknik Mesin, Fakultas Teknik, Universitas Lampung.",http://repository.lppm.unila.ac.id/id/eprint/7511,2017-11-07 00:00:00.000000000,completed,['TJ'],,public,2018-06-25 02:22:29,pub,7,['FT7'],disk0/00/00/75/11,,Universitas Lampung,Prosiding Seminar Nasional Energi dan Industri Manufaktur 2017,978-602-5085-10-9,,,https://drive.google.com/file/d/1lNS-Z3ZxR67w33q7N0lKkhzZcv_t32wv/view,,,,,,,,,,,,,,,
