,userid,lastmod,documents,datestamp,eprintid,eprint_status,metadata_visibility,pagerange,event_location,type,pres_type,creators,title,refereed,event_dates,abstract,uri,date,date_type,subjects,event_title,full_text_status,status_changed,ispublished,rev_number,divisions,dir,event_type,publisher,publication,issn,volume,id_number,official_url,number,contact_email,funders,corp_creators,projects,related_url,contributors,referencetext,keywords,succeeds,isbn,place_of_pub,pages,editors,series
14,528,2018-06-26 02:44:03,"[{'rev_number': 1, 'language': 'en', 'mime_type': 'application/pdf', 'main': '709-1595-1-PB, Jurnal Mechanical.pdf', 'docid': 20735, 'files': [{'fileid': 69071, 'datasetid': 'document', 'mime_type': 'application/pdf', 'hash': '2a3637cd65a019a9e9842a34dbe62812', 'objectid': 20735, 'filesize': 173860, 'uri': 'http://repository.lppm.unila.ac.id/id/file/69071', 'filename': '709-1595-1-PB, Jurnal Mechanical.pdf', 'hash_type': 'MD5', 'mtime': '2018-06-25 03:59:30'}], 'format': 'text', 'pos': 1, 'uri': 'http://repository.lppm.unila.ac.id/id/document/20735', 'security': 'public', 'placement': 1, 'eprintid': 7687}]",2018-06-26 02:44:03,7687,archive,show,71-78,,article,,"[{'id': 'gusri.akhyar@eng.unila.ac.id', 'name': {'family': 'Ibrahim', 'lineage': None, 'honourific': None, 'given': 'G.A'}}, {'name': {'given': 'A', 'lineage': None, 'family': 'Hamni', 'honourific': None}, 'id': 'arinal.hamni@yahoo.com'}, {'id': 'joni-iskandar@gmail.com', 'name': {'honourific': None, 'family': 'Iskandar', 'lineage': None, 'given': 'J'}}, {'name': {'honourific': None, 'family': 'Puji Lestari', 'lineage': None, 'given': 'S.M'}, 'id': 'sri_maria@gmail.com'}]",Analisa Keausan Pahat pada Pemesinan Bor Magnesium AZ31 Menggunakan Metode Taguchi,TRUE,,"Pengeboran (drilling) adalah proses pembuatan lubang dengan cara menekan sebuah mata pahat yang berputar pada benda kerja. Selama proses permesinan terjadi interaksi antara mata bor dengan benda kerja dimana benda kerja terpotong sedangkan mata bor mengalami gesekan. Gesekan yang dialami pahat berasal dari permukaan geram yang mengalir dan permukaan benda kerja yang telah terpotong, akibat gesekan ini pahat mengalami aus. Tujuan penelitian ini akan menganalisa umur pakai pahat HSS pada pemesinan bor magnesium AZ31 dan untuk mendukung penelitian tersebut digunakan Metode Taguchi untuk menganalisa pembahsan hasil penelitian. Parameter permesinan bor yang digunakan yaitu; mata bor HSS (hight speed stell) dengan ukuran (10 mm, 12 mm, dan 14 mm), kecepatan putaran (635 Rpm, 970 Rpm, 1420 Rpm) dan menggunakan gerak makan (0,10 mm/rev, 0,18 mm/rev dan 0,24 mm/rev), dengan kedalam potong 50 mm. Pengambilan data keausan pahat dilakukan menggunakan mikroskope digital USB dengan perbesaran 50x. Data keausan pahat dilihat setiap satu kali proses pengeboran dan proses pemesinan akan dihentikan jika mata bor sudah mengalami aus. Umur pahat tertinggi diperoleh pada diameter bor 10 mm dengan kecepatan putaran 635 rpm dan menggunakan gerak makan 0,10 mm/rev yaitu selama 12,74 menit, sedangkan umur pahat terendah diperoleh pada diameter bor 14 mm dengan kecepatan putaran 1420 rpm dan menggunakan gerak makan sebesar 0,18 mm/rev yaitu selama 0,68 menit. Berdasarkan analisys of varian (ANOVA) parameter yang signifikan dalam mempengaruh umur pakai mata bor adalah kecepatan putaran (n). Semakin besar kecepatan putaran (n) maka keausan mata bor akan semakin cepat terjadi, hal tersebut disebabkan karena suhu tinggi yang di hasil dari gesekan antara mata bor dan benda kerja.",http://repository.lppm.unila.ac.id/id/eprint/7687,2017-09-01 00:00:00.000000000,,['TJ'],,public,2018-06-26 02:44:03,pub,8,['FT7'],disk0/00/00/76/87,,Universitas Lampung,Jurnal Mechanical,2460 1888,8,,http://journal.eng.unila.ac.id/index.php/mech/index,2,gusri.akhyar@eng.unila.ac.id,,,,,"[{'id': 'gusri.akhyar@eng.unila.ac.id', 'type': 'http://www.loc.gov/loc.terms/relators/AUT', 'name': {'honourific': None, 'lineage': None, 'family': 'Ibrahim', 'given': 'G.A'}}, {'name': {'lineage': None, 'family': 'Hamni', 'honourific': None, 'given': 'A'}, 'type': 'http://www.loc.gov/loc.terms/relators/AUT', 'id': 'arinal.hamni@yahoo.com'}, {'id': 'joni-iskandar@gmail.com', 'type': 'http://www.loc.gov/loc.terms/relators/AUT', 'name': {'lineage': None, 'family': 'Iskandar', 'honourific': None, 'given': 'J'}}, {'type': 'http://www.loc.gov/loc.terms/relators/AUT', 'name': {'lineage': None, 'family': 'Puji Lestari', 'honourific': None, 'given': 'SM'}, 'id': 'sri_maria@gmail.com'}]",,,,,,,,
15,528,2018-06-28 02:00:35,"[{'mime_type': 'application/pdf', 'language': 'en', 'rev_number': 2, 'format': 'text', 'main': 'Conference  ICSTAR 2017.pdf', 'docid': 21090, 'files': [{'datasetid': 'document', 'fileid': 80541, 'hash': '9cff32cd7e9cfb2674ce1eb0ee316dbc', 'mime_type': 'application/pdf', 'hash_type': 'MD5', 'mtime': '2017-11-05 15:04:29', 'objectid': 21090, 'filesize': 1297615, 'filename': 'Conference  ICSTAR 2017.pdf', 'uri': 'http://repository.lppm.unila.ac.id/id/file/80541'}], 'security': 'public', 'pos': 1, 'uri': 'http://repository.lppm.unila.ac.id/id/document/21090', 'eprintid': 8062, 'placement': 1}]",2018-06-28 02:00:35,8062,archive,show,,Bandar Lampung,conference_item,paper,"[{'name': {'given': 'Gusri', 'lineage': None, 'family': 'Ibrahim', 'honourific': None}, 'id': 'gusri.akhyar@eng.unila.ac.id'}, {'id': 'arinal.hamni@yahoo.com', 'name': {'honourific': None, 'lineage': None, 'family': 'Hamni', 'given': 'Arinal'}}, {'name': {'given': 'Sri Maria', 'honourific': None, 'family': 'Puji', 'lineage': None}, 'id': 'srimaria@gmail.com'}]","Analysis of surface roughness value when drilling 
magnesium AZ31 using Taghuci Method",TRUE,5 Oktober 2017,"Magnesium alloy is one of super alloys material which wide used in manufacturing of automotive, biomedic, sport and electronic components. It was due to very light and resistent to corrosion. Surface roughness value has an important role to estabilish the quality of components. To produce a good surface roughness of machined surface, one of the important thing depends on the friction between the cutting tool and workpiece material when cutting process occurred. The aim of this paper is to analyse the surface roughness values  of machined surface when drilling of magnesium alloy AZ31 using design of experiment of Taguchi Method. The experimental trials took place  at cutting rotation of  635, 970 and 1420 rpm, feed rate of 0.10, 0.18 and 0.24 mm/rev, diameter tool of 10, 12 and 14 mm. The cutting of magnesium alloy was done by using a convensional drilling machine with TCA - 35 Erlo. Analysis of variance on the data of surface roughness value was done to get which factor is the most significant. The result shows that the feed rate is the most significant factor that contributed on the surface rougness value of machined surface. The minimum surface roughness value was attained at cutting rotation of 970 rpm, feed rate of 0.10 mm/rev and diameter of tool of 14 mm. Therefore, it can be stated that selecting the low feed rate factor produced low surface roughness value. Another hand, using high cutting rotation resulted low surface roughness value.",http://repository.lppm.unila.ac.id/id/eprint/8062,1970-01-01 00:00:00.000002017,published,['TJ'],icstar,public,2018-06-28 02:00:35,pub,6,['FT7'],disk0/00/00/80/62,conference,,Analysis of surface roughness value when drilling  magnesium AZ31 using Taghuci Method,,,,,,gusri.akhyar@eng.unila.ac.id,,"['Universitas Lampung', 'Universitas Lampung', 'Universitas Malahayati']",,,"[{'id': 'gusri.akhyar@eng.unila.ac.id', 'name': {'honourific': None, 'family': 'Ibrahim', 'lineage': None, 'given': 'Gusri Akhyar'}, 'type': 'http://www.loc.gov/loc.terms/relators/AUT'}, {'name': {'given': 'Arinal', 'family': 'Hamni', 'lineage': None, 'honourific': None}, 'type': 'http://www.loc.gov/loc.terms/relators/AUT', 'id': 'arinal.hamni@yahoo.com'}, {'type': 'http://www.loc.gov/loc.terms/relators/AUT', 'name': {'honourific': None, 'lineage': None, 'family': 'Puji', 'given': 'Sri Maria'}, 'id': 'srimatia@gmail.com'}]",,,4664.0,,,,,
16,528,2018-06-28 02:04:09,"[{'language': 'en', 'mime_type': 'application/pdf', 'rev_number': 2, 'files': [{'hash_type': 'MD5', 'mtime': '2017-11-05 15:04:29', 'filesize': 1297615, 'objectid': 21092, 'uri': 'http://repository.lppm.unila.ac.id/id/file/80550', 'filename': 'Conference  ICSTAR 2017.pdf', 'datasetid': 'document', 'fileid': 80550, 'hash': '9cff32cd7e9cfb2674ce1eb0ee316dbc', 'mime_type': 'application/pdf'}], 'main': 'Conference  ICSTAR 2017.pdf', 'docid': 21092, 'format': 'text', 'pos': 1, 'uri': 'http://repository.lppm.unila.ac.id/id/document/21092', 'security': 'public', 'placement': 1, 'eprintid': 8064}]",2018-06-28 02:04:09,8064,archive,show,,Bandar Lampung,conference_item,paper,"[{'id': 'gusri.akhyar@eng.unila.ac.id', 'name': {'given': 'Gusri', 'lineage': None, 'family': 'Ibrahim', 'honourific': None}}, {'name': {'honourific': None, 'lineage': None, 'family': 'Hamni', 'given': 'Arinal'}, 'id': 'arinal.hamni@yahoo.com'}, {'name': {'given': 'Sri Maria', 'family': 'Puji', 'lineage': None, 'honourific': None}, 'id': 'srimaria@gmail.com'}]","Analysis of surface roughness value when drilling 
magnesium AZ31 using Taghuci Method",TRUE,5 Oktober 2017,"Magnesium alloy is one of super alloys material which wide used in manufacturing of automotive, biomedic, sport and electronic components. It was due to very light and resistent to corrosion. Surface roughness value has an important role to estabilish the quality of components. To produce a good surface roughness of machined surface, one of the important thing depends on the friction between the cutting tool and workpiece material when cutting process occurred. The aim of this paper is to analyse the surface roughness values  of machined surface when drilling of magnesium alloy AZ31 using design of experiment of Taguchi Method. The experimental trials took place  at cutting rotation of  635, 970 and 1420 rpm, feed rate of 0.10, 0.18 and 0.24 mm/rev, diameter tool of 10, 12 and 14 mm. The cutting of magnesium alloy was done by using a convensional drilling machine with TCA - 35 Erlo. Analysis of variance on the data of surface roughness value was done to get which factor is the most significant. The result shows that the feed rate is the most significant factor that contributed on the surface rougness value of machined surface. The minimum surface roughness value was attained at cutting rotation of 970 rpm, feed rate of 0.10 mm/rev and diameter of tool of 14 mm. Therefore, it can be stated that selecting the low feed rate factor produced low surface roughness value. Another hand, using high cutting rotation resulted low surface roughness value.",http://repository.lppm.unila.ac.id/id/eprint/8064,1970-01-01 00:00:00.000002017,published,['TJ'],ICSTAR,public,2018-06-28 02:04:09,pub,5,['FT7'],disk0/00/00/80/64,conference,,Analysis of surface roughness value when drilling  magnesium AZ31 using Taghuci Method,,,,,,gusri.akhyar@eng.unila.ac.id,,"['Universitas Lampung', 'Universitas Lampung', 'Universitas Malahayati']",,,"[{'type': 'http://www.loc.gov/loc.terms/relators/AUT', 'name': {'given': 'Gusri Akhyar', 'lineage': None, 'family': 'Ibrahim', 'honourific': None}, 'id': 'gusri.akhyar@eng.unila.ac.id'}, {'type': 'http://www.loc.gov/loc.terms/relators/AUT', 'name': {'given': 'Arinal', 'honourific': None, 'lineage': None, 'family': 'Hamni'}, 'id': 'arinal.hamni@yahoo.com'}, {'id': 'srimatia@gmail.com', 'name': {'honourific': None, 'family': 'Puji', 'lineage': None, 'given': 'Sri Maria'}, 'type': 'http://www.loc.gov/loc.terms/relators/AUT'}]",,,4664.0,,,,,
17,528,2018-06-28 02:00:32,"[{'docid': 21095, 'main': 'Conference  ICSTAR 2017.pdf', 'files': [{'hash': '9cff32cd7e9cfb2674ce1eb0ee316dbc', 'mime_type': 'application/pdf', 'fileid': 80561, 'datasetid': 'document', 'uri': 'http://repository.lppm.unila.ac.id/id/file/80561', 'filename': 'Conference  ICSTAR 2017.pdf', 'filesize': 1297615, 'objectid': 21095, 'mtime': '2017-11-05 15:04:29', 'hash_type': 'MD5'}], 'format': 'text', 'language': 'en', 'mime_type': 'application/pdf', 'rev_number': 2, 'placement': 1, 'eprintid': 8067, 'pos': 1, 'uri': 'http://repository.lppm.unila.ac.id/id/document/21095', 'security': 'public'}]",2018-06-28 02:00:32,8067,archive,show,,,conference_item,paper,"[{'id': 'gusri.akhyar@eng.unila.ac.id', 'name': {'honourific': None, 'lineage': None, 'family': 'Ibrahim', 'given': 'Gusri'}}, {'name': {'given': 'Arinal', 'honourific': None, 'family': 'Hamni', 'lineage': None}, 'id': 'arinal.hamni@yahoo.com'}, {'id': 'srimaria@gmail.com', 'name': {'lineage': None, 'family': 'Puji', 'honourific': None, 'given': 'Sri Maria'}}]","Analysis of surface roughness value when drilling 
magnesium AZ31 using Taghuci Method",TRUE,,"Magnesium alloy is one of super alloys material which wide used in manufacturing of automotive, biomedic, sport and electronic components. It was due to very light and resistent to corrosion. Surface roughness value has an important role to estabilish the quality of components. To produce a good surface roughness of machined surface, one of the important thing depends on the friction between the cutting tool and workpiece material when cutting process occurred. The aim of this paper is to analyse the surface roughness values  of machined surface when drilling of magnesium alloy AZ31 using design of experiment of Taguchi Method. The experimental trials took place  at cutting rotation of  635, 970 and 1420 rpm, feed rate of 0.10, 0.18 and 0.24 mm/rev, diameter tool of 10, 12 and 14 mm. The cutting of magnesium alloy was done by using a convensional drilling machine with TCA - 35 Erlo. Analysis of variance on the data of surface roughness value was done to get which factor is the most significant. The result shows that the feed rate is the most significant factor that contributed on the surface rougness value of machined surface. The minimum surface roughness value was attained at cutting rotation of 970 rpm, feed rate of 0.10 mm/rev and diameter of tool of 14 mm. Therefore, it can be stated that selecting the low feed rate factor produced low surface roughness value. Another hand, using high cutting rotation resulted low surface roughness value.",http://repository.lppm.unila.ac.id/id/eprint/8067,1970-01-01 00:00:00.000002017,published,['TJ'],ICSTAR,public,2018-06-28 02:00:32,pub,5,['FT7'],disk0/00/00/80/67,conference,,Analysis of surface roughness value when drilling  magnesium AZ31 using Taghuci Method,,,,,,,,"['Universitas Lampung', 'Universitas Lampung', 'Universitas Malahayati']",,,"[{'name': {'lineage': None, 'family': 'Ibrahim', 'honourific': None, 'given': 'Gusri Akhyar'}, 'type': 'http://www.loc.gov/loc.terms/relators/AUT', 'id': 'gusri.akhyar@eng.unila.ac.id'}, {'type': 'http://www.loc.gov/loc.terms/relators/AUT', 'name': {'given': 'Arinal', 'lineage': None, 'family': 'Hamni', 'honourific': None}, 'id': 'arinal.hamni@yahoo.com'}, {'id': 'srimatia@gmail.com', 'type': 'http://www.loc.gov/loc.terms/relators/AUT', 'name': {'family': 'Puji', 'lineage': None, 'honourific': None, 'given': 'Sri Maria'}}]",,,4664.0,,,,,
18,772,2017-05-18 00:57:54,"[{'placement': 1, 'eprintid': 1612, 'uri': 'http://repository.lppm.unila.ac.id/id/document/1477', 'pos': 1, 'security': 'public', 'main': 'Co-cracking of real MSW into bio-oil over natural kaoline.pdf', 'files': [{'mtime': '2017-05-05 17:30:29', 'hash_type': 'MD5', 'uri': 'http://repository.lppm.unila.ac.id/id/file/11139', 'filename': 'Co-cracking of real MSW into bio-oil over natural kaoline.pdf', 'objectid': 1477, 'filesize': 487757, 'hash': 'ee1f4dc8072f7293be199bc5436a61de', 'mime_type': 'application/pdf', 'datasetid': 'document', 'fileid': 11139}], 'docid': 1477, 'format': 'text', 'language': 'en', 'rev_number': 1, 'mime_type': 'application/pdf'}]",2017-05-18 00:57:50,1612,archive,show,1-8,,article,,"[{'id': 'indra.mamad@eng.unila.ac.id', 'name': {'lineage': None, 'family': 'Indra Mamad', 'honourific': None, 'given': 'Gandidi'}}]","Co-cracking of real MSW into bio-oil over natural
kaolin",TRUE,,"Municipal solid waste (MSW) is a potential material that can be converted into biooil
through thermal degradation process or pyrolysis. The efficiency and productivity of
pyrolysis can be increased with the use of natural catalyst like kaolin. The addition of catalyst
also reduces the overall cost of conversion process. In this study conversion of MSW into Bio
Fuel using Pyrolysis in the presence of of natural kaolin as catalyst has been investigated for 60
min at 400°C temperature. During the process 0.5 w/w catalyst to MSW ratio was maintained.
Gas chromatography-mass spectrometry (GC-MS) was used to analyse the chemical
composition of bio fuel. It is found that bio-oil production increases substantially with the use
of catalyst. It is observed that the production of bio-oil is 23.6 % with the use of catalyst in
process, which was only 15.2 % without the use of catalyst. The hydrocarbon range
distribution of oil produced through pyrolysis reveals that gasoline and diesel fuel (C5-C20) are
its main constituents. The functional group detected in bio-oil by GC-MS analysis is similar to
that of diesel-48 in which paraffin and olefin are major mass species.",http://repository.lppm.unila.ac.id/id/eprint/1612,2017-05-05 00:00:00.000000000,published,['TA'],,public,2017-05-18 00:57:54,pub,8,['FT7'],disk0/00/00/16/12,,IOP Publishing,IOP Conf. Series: Earth and Environmental Science,,60,doi:10.1088/1755-1315/60/1/012019,http://iopscience.iop.org/,,,['Ristek-Dikti'],['University of Lampung'],['Hibah Penerapan Teknologi'],"[{'type': 'pub', 'url': 'http://iopscience.iop.org/issue/1755-1315/60/1'}]","[{'name': {'given': 'Gandidi', 'lineage': None, 'family': 'Indra Mamad', 'honourific': None}, 'type': 'http://www.loc.gov/loc.terms/relators/AUT', 'id': 'indra.mamad@eng.unila.ac.id'}]",,,,,,,,
19,866,2017-11-10 15:25:07,"[{'pos': 1, 'uri': 'http://repository.lppm.unila.ac.id/id/document/17061', 'security': 'public', 'placement': 1, 'eprintid': 4171, 'rev_number': 1, 'language': 'en', 'mime_type': 'application/pdf', 'files': [{'hash': 'eb63457851274b05474687d54899e75d', 'mime_type': 'application/pdf', 'fileid': 42217, 'datasetid': 'document', 'uri': 'http://repository.lppm.unila.ac.id/id/file/42217', 'filename': 'EJ.pdf', 'filesize': 542716, 'objectid': 17061, 'mtime': '2017-10-27 13:59:51', 'hash_type': 'MD5'}], 'main': 'EJ.pdf', 'docid': 17061, 'format': 'text'}]",2017-11-10 15:25:07,4171,archive,show,15-23,,article,,"[{'id': 'irsyadmuh@eng.unila.ac.id', 'name': {'lineage': None, 'family': 'Irsyad', 'honourific': None, 'given': 'Muhammad'}}, {'id': None, 'name': {'honourific': None, 'family': 'Indartono', 'lineage': None, 'given': 'Yuli Setyo'}}, {'name': {'given': 'Ari Darmawan', 'lineage': None, 'family': 'Pasek', 'honourific': None}, 'id': None}, {'id': None, 'name': {'family': 'Adriansyah', 'lineage': None, 'honourific': None, 'given': 'Willy'}}]",Experimental Study on Flow Characters of Salt Hydrate Slurry in Phase Change Temperature Range,TRUE,,"One of the efforts in minimizing energy consumption chiller type air conditioning system is the use of phase changing material in secondary refrigerant. Secondary refrigerant functions to obtain heat from the air to cool a room and to release heat in chiller evaporator. Based on working temperature of secondary refrigerant, the fluid can flow in liquid form, and can also be in fluid solid form or slurry at the temperature of its phase change. This research studies the effect of temperature toward flow characteristics, with the parameter analyzed being the pressure decrease and friction coefficient. Besides that, in order to support data analysis, it was initiated by viscosity testing, density and concentration of solid mass. Data taken were viscosity, density, solid mass concentrate, and pressure difference found in copper pipe. Data were taken for several fluid temperatures, and at pressure decrease was added by variation of flow speed. Hydrate salt tested were CaCl2 and Na2HPO4. Viscosity and density increased with the decrease in temperature. The formation of solid particles within phase change temperature range also gave an impact on the increase in the value of viscosity and density. Pressure drop increased when using hydrate salt fluid. The use of CaCl2 solution resulted in the highest pressure decrease. This salt hydrate has far higher viscosity and density compared to water. This has an effect toward an increase in pressure drop. This increase started to be significant in the phase change temperature area in which solid particle started to form. The same thing happened in the friction coefficient value.

Keywords: Phase change temperature, salt hydrate, pressure drop, viscosity, slurry.",http://repository.lppm.unila.ac.id/id/eprint/4171,2017-09-29 00:00:00.000000000,published,['TJ'],,public,2017-11-10 15:25:07,pub,6,['FT7'],disk0/00/00/41/71,,"Faculty of Engineering, Chulalongkorn University",Engineering Journal,0125-8281,21,DOI:10.4186/ej.2017.21.5.15,http://engj.org/index.php/ej/index,5,,,"['Universitas Lampung', 'Institut Teknologi Bandung']",,,,,,,,,,,
20,866,2017-11-10 15:28:52,"[{'pos': 1, 'uri': 'http://repository.lppm.unila.ac.id/id/document/17156', 'security': 'public', 'placement': 1, 'eprintid': 4258, 'language': 'en', 'rev_number': 1, 'mime_type': 'application/pdf', 'files': [{'datasetid': 'document', 'fileid': 42868, 'hash': 'bfb7ca0be1e56fbf62c1e3c035bf51af', 'mime_type': 'application/pdf', 'filesize': 1626202, 'objectid': 17156, 'filename': 'JEAS lengkap.pdf', 'uri': 'http://repository.lppm.unila.ac.id/id/file/42868', 'hash_type': 'MD5', 'mtime': '2017-11-01 05:44:19'}], 'main': 'JEAS lengkap.pdf', 'docid': 17156, 'format': 'text'}]",2017-11-10 15:28:52,4258,archive,show,2528-2534,,article,,"[{'name': {'honourific': None, 'lineage': None, 'family': 'Irsyad', 'given': 'Muhammad'}, 'id': 'irsyadmuh@eng.unila.ac.id'}, {'id': None, 'name': {'honourific': None, 'lineage': None, 'family': 'Pasek', 'given': 'Ari Darmawan'}}, {'id': None, 'name': {'lineage': None, 'family': 'Indartono', 'honourific': None, 'given': 'Yuli Setyo'}}]","An Investigation of Green Roof Deployment in Bandung City, Indonesia",TRUE,,"Indonesia is located in the tropics with high average temperature at daytime and relative exposure time throughout the year. Solar radiation received by the roof of a building can increase the cooling load. Green roof utilization can be one of the alternative solutions to decrease thermal rate in a building. Extensive green roof is one of green roof types which needs specific construction. Some suitable plants for the tropical zone are Amaranta, Bromelia, Euphorbia and Red Edged Dracaena which need little water. Green roof application with Amaranta and Bromelia in Bandung, using layers which consist of drainage, filter and soil have been able to inhibit heat transfer so the heat is not sent into the room. Stable roof temperature preserves roof construction strength from the effect of cooling and heating cycle. Constructing a garden using synthetic grass is recommended if drainage is available to ease heat transfer through the roof.",http://repository.lppm.unila.ac.id/id/eprint/4258,2017-01-11 00:00:00.000000000,published,['TJ'],,public,2017-11-10 15:28:52,pub,7,['FT7'],disk0/00/00/42/58,,Medwell Publishing,Journal of Engineering and Applied Sciences,1818-7803,11,DOI: 10.3923/jeasci.2016.2528.2534,http://www.medwelljournals.com/home.php,11,,,"['Universitas Lampung', 'Institut Teknologi Bandung']",,,,,,,,,,,
