,datestamp,eprintid,id_number,eprint_status,pagerange,userid,number,official_url,documents,refereed,abstract,corp_creators,date,related_url,publisher,issn,full_text_status,ispublished,metadata_visibility,lastmod,type,creators,title,date_type,subjects,volume,uri,publication,divisions,dir,status_changed,rev_number,contact_email,place_of_pub,projects,funders,succeeds,referencetext,keywords,contributors,event_location,event_dates,pres_type,event_type,event_title,pages,patent_applicant
0,2022-09-15 01:11:07,44947,https://doi.org/10.30630/jtm.15.1.800,archive,7-12,24,1.0,https://ejournal2.pnp.ac.id/index.php/jtm/article/view/800/359,"[{'eprintid': 44947, 'placement': 1, 'security': 'public', 'uri': 'http://repository.lppm.unila.ac.id/id/document/166866', 'pos': 1, 'format': 'text', 'main': 'Set_SINTA5_JTM-PNP_Rancang Bangun Mesin Centrifugal Casting.pdf', 'docid': 166866, 'files': [{'hash_type': 'MD5', 'mtime': '2022-09-14 13:21:01', 'filesize': 1320645, 'objectid': 166866, 'filename': 'Set_SINTA5_JTM-PNP_Rancang Bangun Mesin Centrifugal Casting.pdf', 'uri': 'http://repository.lppm.unila.ac.id/id/file/484818', 'datasetid': 'document', 'fileid': 484818, 'mime_type': 'application/pdf', 'hash': '7f4a8571a9a0e2d1c68d20b37097b8fb'}], 'mime_type': 'application/pdf', 'language': 'en', 'rev_number': 1}]",FALSE,"Dalam bidang rekayasa material telah ditemukan berbagai jenis material maju. Hal ini mestilah diiringi dengan kemajuan proses produksi yang sesuai. Centrifugal casting adalah metode yang sesuai untuk mencetak benda-benda silindris seperti pipa dan bejana tekan. Pada penelitian ini dirancang dan dibuat sebuah mesin cetak centrifugal casting. Proses perancangan dilakukan dengan mengikuti tahapan-tahapan sebagaimana yang diusulkan oleh Pahl and Beitz, yang berawal dari identifikasi kebutuhan, rancangan konsep, layout dan analisis sampai dengan metode fabrikasi. Selanjutnya mesin ini diujicoba untuk mencetak pipa komposit geopolimer. Dari uji coba yang dilakukan dapat dinyatakan bahwa mesin ini berfungsi baik dan dapat mencetak sampel pipa pada variasi kecepatan putar. Selanjutnya sampel pipa dipotong untuk dijadikan spesimen  uji bending three point. Setelah dilakukan pengujian, diperoleh kekuatan bending sampai 50 MPa (putaran tabung 1500 rpm) dan 36 MPa (putaran tabung 1200 rpm). Dengan demikian disimpulkan semakin tinggi putaran tabung, maka pipa yang dihasilkan semakin padat dan semakin kuat.","['Department of Mechanical Engineering, Universitas Lampung, Indonesia']",2022-07-13 00:00:00.000000000,[{'url': 'https://doi.org/10.30630/jtm.15.1.800'}],Politeknik Negeri Padang,2655-5670,public,pub,show,2022-09-15 01:11:07,article,"[{'name': {'honourific': None, 'family': 'Akmal', 'lineage': None, 'given': 'Jamiatul'}, 'id': 'jamiatul.akmal@eng.unila.ac.id'}, {'id': 'sandiari336@gmail.com', 'name': {'given': 'Arisandi', 'honourific': None, 'family': 'Arisandi', 'lineage': None}}, {'name': {'honourific': None, 'family': 'Suudi', 'lineage': None, 'given': 'Ahmad'}, 'id': 'ahmad.suudi@eng.unila.ac.id'}, {'id': 'asnawi.lubis@eng.unila.ac.id', 'name': {'given': 'Asnawi', 'lineage': None, 'family': 'Lubis', 'honourific': None}}, {'id': 'novri.tanti@eng.unila.ac.id', 'name': {'given': 'Novri', 'lineage': None, 'family': 'Tanti', 'honourific': None}}]",Rancang Bangun Mesin Cetak Centrifugal Casting untuk Pembuatan Pipa Komposit Geopolimer,published,['TS'],15.0,http://repository.lppm.unila.ac.id/id/eprint/44947,Rancang Bangun Mesin Cetak Centrifugal Casting untuk Pembuatan Pipa Komposit Geopolimer,['FT7'],disk0/00/04/49/47,2022-09-15 01:11:07,7,,,,,,,,,,,,,,,
1,2022-09-14 09:43:03,44946,https://doi.org/10.14710/kapal.v19i1.44019,archive,1-8,24,1.0,https://ejournal.undip.ac.id/index.php/kapal/article/view/44019,"[{'language': 'en', 'mime_type': 'application/pdf', 'rev_number': 1, 'main': 'Set_SINTA2_KAPAL_Hydrodynamic Forces.pdf', 'files': [{'filesize': 3756433, 'objectid': 166865, 'uri': 'http://repository.lppm.unila.ac.id/id/file/484808', 'filename': 'Set_SINTA2_KAPAL_Hydrodynamic Forces.pdf', 'hash_type': 'MD5', 'mtime': '2022-09-14 08:14:33', 'datasetid': 'document', 'fileid': 484808, 'mime_type': 'application/pdf', 'hash': 'aa817e6df75b5dc493271ce33786ac32'}], 'docid': 166865, 'format': 'text', 'pos': 1, 'uri': 'http://repository.lppm.unila.ac.id/id/document/166865', 'security': 'public', 'placement': 1, 'eprintid': 44946}]",FALSE,"SFTB; wave; curvature radius; depthlevel; hydrodynamic forces
The discussion of hydrodynamic forces becomes an important issue in determining the dynamic behavioroftheSubmerged FloatingTunnelBridge(SFTB)structure.Asstatedin theMorisonEquation, thehydrodynamicforcesareaffectedbythekinematicsofwater particles,butuptothisdate,thereare onlya fewdiscussionsforcurved tubeapplications.This paper discusses theeffectof curvature radius and depth level on hydrodynamic forces to get the correction factor for a straight tube.Tubes with variationsin radius curvature(R/L) and diameter(D)were installed in a wave pool with a depth level (z/d).Thehydrodynamicforcesweredetected bya load cellsensor placedona pedestal at theend of thespecimen.Thedata from theload cellwas processed by thedata acquisitionsystem and displayed onthemonitorscreen,showingthatthez/dratioandtheR/Lratiobothaffectthehydrodynamicforces. A larger z/d ratio (deeper) results in smaller hydrodynamic forces, while a smaller R/L ratio (more curved) results in smaller hydrodynamic forces. A correction factor (C) has been determined to calculate thehydrodynamicforceona curved tubebased ontheMorison equation","['Department of Mechanical Engineering, Universitas Lampung, Indonesia']",2022-02-01 00:00:00.000000000,[{'url': 'https://doi.org/10.14710/kapal.v19i1.44019'}],Universitas Diponegoro,2301-9069,public,pub,show,2022-09-14 09:43:03,article,"[{'name': {'lineage': None, 'family': 'Akmal', 'honourific': None, 'given': 'Jamiatul'}, 'id': 'jamiatul.akmal@eng.unila.ac.id'}, {'id': 'asnawi.lubis@eng.unila.ac.id', 'name': {'given': 'Asnawi', 'honourific': None, 'lineage': None, 'family': 'Lubis'}}, {'id': 'ahmad.suudi@eng.unila.ac.id', 'name': {'honourific': None, 'family': 'Suudi', 'lineage': None, 'given': 'Ahmad'}}, {'id': 'novri.tanti@eng.unila.ac.id', 'name': {'lineage': None, 'family': 'Tanti', 'honourific': None, 'given': 'Novri'}}, {'name': {'lineage': None, 'family': 'Nugraha', 'honourific': None, 'given': 'Nurcahya'}, 'id': 'nurcahyanugraha11@gmail.com'}, {'id': 'zakyabyanf@gmail.com', 'name': {'lineage': None, 'family': 'Fahrain', 'honourific': None, 'given': 'Zaky Abyan'}}, {'id': 'panjibkc@gmail.com', 'name': {'lineage': None, 'family': 'Firmanul Hakim', 'honourific': None, 'given': 'Panji'}}]",Hydrodynamic forces on submerged floating tube: The effect of curvature radius and depth level,published,['TC'],19.0,http://repository.lppm.unila.ac.id/id/eprint/44946,Kapal: Jurnal Ilmu Pengetahuan dan Teknologi Kelautan,['FT7'],disk0/00/04/49/46,2022-09-14 09:43:03,8,,,,,,,,,,,,,,,
2,2022-09-15 01:11:11,44950,https://doi.org/10.33019/jm.v8i1.2928,archive,45-50,24,1.0,https://journal.ubb.ac.id/index.php/machine/article/view/2928,"[{'files': [{'mtime': '2022-09-14 13:40:44', 'hash_type': 'MD5', 'filename': 'Set_SINTA4_UBB_Respon Dinamis TLP.pdf', 'uri': 'http://repository.lppm.unila.ac.id/id/file/484840', 'filesize': 759517, 'objectid': 166869, 'hash': '4cc3d256cd55e2a7f0a2032948fc35c6', 'mime_type': 'application/pdf', 'datasetid': 'document', 'fileid': 484840}], 'main': 'Set_SINTA4_UBB_Respon Dinamis TLP.pdf', 'docid': 166869, 'format': 'text', 'rev_number': 1, 'language': 'en', 'mime_type': 'application/pdf', 'placement': 1, 'eprintid': 44950, 'uri': 'http://repository.lppm.unila.ac.id/id/document/166869', 'pos': 1, 'security': 'public'}]",FALSE,"Tension Leg Platform (TLP) adalah anjungan lepas pantai yang biasanya digunakan untuk kegiatan eksplorasi migas di laut dalam. Salah satu permasalahan yang sering terjadi adalah goncangan TLP sebagai respon terhadap gelombang laut. Pada kondisi tertentu, terutama di laut dalam samudra, goncangan ini dapat mengakibatkan berbagai gangguan, bahkan berpotensi merusak struktur. Pada artikel ini diusulkan penggunaan ponton bertelapak silinder untuk mendapatkan respon dinamis yang lebih stabil, yang selanjutnya dilakukan kaji perbandingan dengan ponton bertelapak bujur sangkar yang biasa dipakai selama ini. Respon dinamik kedua model direkam dengan sensor ultrasonic dan video tracker. Hasil pengukuran ditampilkan dalam bentuk non dimensional, yang biasa dikenal sebagai Response Amplitude Operator (RAO), yaitu rasio antara displacement TLP terhadap panjang gelombang. Dari penelitian ini didapatkan bahwa TLP dengan menggunakan ponton bertelapak silinder memiliki respon dinamik yang relative stabil jika dibandingkan dengan TLP berponton telapak bujur sangkar.","['Department of Mechanical Engineering, Universitas Lampung, Indonesia']",2022-04-01 00:00:00.000000000,[{'url': 'https://doi.org/10.33019/jm.v8i1.2928'}],Universitas Bangka Belitung,2581-0138,public,pub,show,2022-09-15 01:11:11,article,"[{'name': {'given': 'Jamiatul', 'lineage': None, 'family': 'Akmal', 'honourific': None}, 'id': 'jamiatul.akmal@eng.unila.ac.id'}, {'id': 'novri.tanti@eng.unila.ac.id', 'name': {'honourific': None, 'family': 'Tanti', 'lineage': None, 'given': 'Novri'}}, {'name': {'honourific': None, 'lineage': None, 'family': 'Lubis', 'given': 'Asnawi'}, 'id': 'asnawi.lubis@eng.unila.ac.id'}, {'name': {'given': 'Dwi', 'lineage': None, 'family': 'Fajri Kemala Intan', 'honourific': None}, 'id': 'dwifajri51@gmail.com'}]",RESPON DINAMIS TENSION LEG PLATFORM (TLP): STUDI KOMPARASI ANTARA PENGGUNAAN PONTON TELAPAK LINGKARAN DENGAN PONTON TELAPAK BUJUR SANGKAR,published,['TC'],8.0,http://repository.lppm.unila.ac.id/id/eprint/44950,"Machine; Jurnal Teknik Mesin Vol. 5 No. 1, Agustus 2019",['FT7'],disk0/00/04/49/50,2022-09-15 01:11:11,6,,,,,,,,,,,,,,,
3,2022-10-26 01:59:14,45960,https://doi.org/10.23960/jesr.v4i1.100,archive,,464,,http://jesr.eng.unila.ac.id/index.php/ojs/article/view/100,"[{'pos': 1, 'uri': 'http://repository.lppm.unila.ac.id/id/document/184777', 'security': 'public', 'placement': 1, 'eprintid': 45960, 'language': 'en', 'mime_type': 'application/pdf', 'rev_number': 1, 'main': 'JESR_June2022a_Amelia_Irza_Similarity.pdf', 'docid': 184777, 'files': [{'mime_type': 'application/pdf', 'hash': '93f30f1516fc0c651db2166884f21dde', 'datasetid': 'document', 'fileid': 508884, 'mtime': '2022-10-25 06:55:42', 'hash_type': 'MD5', 'filename': 'JESR_June2022a_Amelia_Irza_Similarity.pdf', 'uri': 'http://repository.lppm.unila.ac.id/id/file/508884', 'objectid': 184777, 'filesize': 1067055}], 'format': 'text'}]",,"Lampung Province is one of the palm oil producers, especially in Way Kanan Regency. Way Kanan Regency has two palm oil-producing mills, namely PT. Sawit Indo Mas which is located in Kampung Tanjung Raja Sakti Blambangan Umpu and PT PLP which is located in Kampung Bumi  Agung, Bahuga District. The two factories duce thousands of tons of Crude Palm Oil (CPO) vegetable oil daily produced from palm fruit plants (Elaeis Guineensis Jacq, Arecaceae). From oil management, it is undeniable that it can create a lot of solid waste from the palm shell. Meanwhile, the government has not made much effort to use the waste from the waste. When managing palm fruit, palm shells cannot be processed into oil because they have a hard texture, so the shells are discarded and become waste. Then we use the shell for research material as a filler. Palm shell ash has a silicon dioxide (SiO2) content which is also contained in Portland cement, so this content can allow the acquisition of a good asphalt mixture on the AC-BC layer. This study aims to see the effect of the effectiveness of adding shell ash fillers from palm shell waste in Marshall test tests and value the resulting durability. The addition of fillers with percentages of 20%, 30%, 40%, 50%and 60%. From the results obtained from the test results in the laboratory that the addition of shell ash fillers of 40% gets better performance compared to shell ash with percentages of 20%, 30%, and 60%, with a higher state value of 1225 kg shown. In Marshall testing, using palm shell ash fillers can increase the value of KAO. So that from the Marshall test, the durability value of the sample immersion at the IRS value of 0% was 98.4% greater than the 40%, which was 91.13%. Overall, using palm shell ash fillers meets the minimum requirements of Indonesia Bureau for Construction Bina Marga as an asphalt mixture. The degree of weather change in immersion durability affects the strength level of the Marshall test.",,2022-06-01 00:00:00.000000000,,"Faculty of Engineering, Universitas Lampung",,public,pub,show,2022-12-06 22:34:24,other,"[{'name': {'honourific': None, 'family': 'Amelia', 'lineage': None, 'given': 'Oktavia'}, 'id': None}, {'id': None, 'name': {'family': 'Irza', 'lineage': None, 'honourific': None, 'given': 'Sukmana'}}, {'id': None, 'name': {'given': 'Arif', 'honourific': None, 'lineage': None, 'family': 'Yanuar Zulardiansyah'}}, {'id': 'gigih@eng.unila.ac.id', 'name': {'given': 'Gigih Forda', 'honourific': None, 'lineage': None, 'family': 'Nama'}}]",The Effect of Filler Adding Palm Kernel Shell Ash on Durability and the Marshall Values Properties of Asphalt Concrete Mix,published,['TJ'],,http://repository.lppm.unila.ac.id/id/eprint/45960,,['FT7'],disk0/00/04/59/60,2022-10-26 01:59:14,8,irza.sukmana@gmail.com,Journal of Engineering and Scientific Research (JESR),,,,,,,,,,,,,
4,2022-06-14 01:16:27,42427,,archive,1-8,528,1.0,https://ejournal.polman-babel.ac.id/index.php/manutech/issue/view/18,"[{'language': 'en', 'mime_type': 'application/pdf', 'rev_number': 1, 'format': 'text', 'docid': 164138, 'main': '160-Article Text-912-1-10-20220602_terbit.pdf', 'files': [{'hash': 'aeac46645340441b6485b2eceaafbee2', 'mime_type': 'application/pdf', 'datasetid': 'document', 'fileid': 466395, 'mtime': '2022-06-13 23:18:58', 'hash_type': 'MD5', 'filename': '160-Article Text-912-1-10-20220602_terbit.pdf', 'uri': 'http://repository.lppm.unila.ac.id/id/file/466395', 'objectid': 164138, 'filesize': 528041}], 'security': 'public', 'uri': 'http://repository.lppm.unila.ac.id/id/document/164138', 'pos': 1, 'eprintid': 42427, 'placement': 1}]",TRUE,"Perkembangan teknologi menuntut berbagai macam kamajuan di bidang industri manufaktur, 
termasuk dalam pengembangan teknik pemesinan. Proses pemesinan material super ringan magnesium 
mempunyai sifat dan perilaku pemotongan yang sangat baik dan menguntungkan namun proses ini
memiliki beberapa kekurangan, antarnya adalah sangat mudah terbakar karena mempunyai titik nyala 
yang rendah. Suhu pemotongan yang tinggi memberikan dampak terhadap keausan pahat dan 
berkontribusi lansung pada kepresisian ulir. Kesalahan geometri dan dimensi ulir magnesium pada 
pemesinan bubut ulir dipengaruhi oleh beberapa faktor antaranya adalah diameter benda uji, kedalaman 
potong, dan kecepatan putar benda kerja. Penelitian ini bertujuan untuk menganalisa kesalahan pitch, 
kesalahan tinggi, dan kesalahan sudut ulir pada pada pembuatannya dengan bentuk ulir luar metrik M1,5. 
Proses pemesinan dilakukan menggunakan teknik Minimum Quantity Lubrication (MQL) dengan minyak 
kelapa sebagai pelumas. Diameter ulir yang digunakan adalah sebesar10 dan 14 mm, kedalaman potong 
0.46, 0.23 dan 0.3067 mm, dan kecepatan putar 424, 212, 424 rpm. Hasil kajian menunjukan bahwa 
keadaan optimal didapatkan menggunakan teknik Minimum Quantity Lubrication (MQL), pada faktor 
diameter 10 mm, kedalaman 0.46 mm dan kecepatan spindel 424 rpm, dimana besarnya kesalahan
puncak 0.012 mm, kesalahan tinggi 0.011533 mm. Sementara itu, hasil terbaik kesalahan sudut 
menggunakan teknik Minimum Quantity Lubrication (MQL) diperoleh pada diameter 10 mm, kecepatan 
spindel 212 rpm, dan kedalaman potong 0.23, yang mana diperoleh hasil 0.38660°. Pelumasan 
2
Implementasi Minimum Quantity Lubrication (MQL) Pada Pembuatan Ulir Luar Material Magnesium
(Arinal Hamni)
menggunakan teknik MQL pada pembuatan ulir menggunakan jenis pelumas minyak kelapa, memberikan 
mempengaruhi yang signifikan terhadap kepresisian ulir dan tekstur permukaan yang dimesin, dimana 
permukaan yang dihasilkan lebih halus dibandingkan bila pemotongan dilakukan secara pemesinan 
kering",,2022-06-09 00:00:00.000000000,,Politeknik manufaktur Bangka Belitung,2621-3397,public,pub,show,2022-06-14 01:16:27,article,"[{'name': {'honourific': None, 'family': 'Arinal', 'lineage': None, 'given': 'Hamni'}, 'id': 'arinal.hamni@yahoo.com'}, {'id': 'gusri.akhyar@eng.unila.ac.id', 'name': {'given': 'Akhyar', 'family': 'Gusri', 'lineage': None, 'honourific': None}}]","Implementasi Minimum Quantity Lubrication (MQL) Pada
Pembuatan Ulir Luar Material Magnesium",published,['TS'],14.0,http://repository.lppm.unila.ac.id/id/eprint/42427,Manutech : Jurnal Teknologi Manufaktur,['FT7'],disk0/00/04/24/27,2022-06-14 01:16:27,6,,,,,,,,,,,,,,,
5,2023-05-23 01:13:19,51959,,archive,,569,,,"[{'main': 'Laporan Akhir Penelitian Dipa FT 2022.pdf', 'docid': 251369, 'files': [{'datasetid': 'document', 'fileid': 615691, 'mime_type': 'application/pdf', 'hash': 'd30210bbbcf43098eb4d49e816013efe', 'hash_type': 'MD5', 'mtime': '2023-05-22 07:20:17', 'filesize': 1615107, 'objectid': 251369, 'uri': 'http://repository.lppm.unila.ac.id/id/file/615691', 'filename': 'Laporan Akhir Penelitian Dipa FT 2022.pdf'}], 'format': 'text', 'rev_number': 1, 'language': 'en', 'mime_type': 'application/pdf', 'placement': 1, 'eprintid': 51959, 'pos': 1, 'uri': 'http://repository.lppm.unila.ac.id/id/document/251369', 'security': 'public'}]",,"Banyak lapangan panas bumi di dunia termasuk juga di Indonesia merupakan lapangan panas bumi yang menghasilkan fluida hasil pengeboran berupa fluida 2-fase yang terdiri dari air, uap air, dan berbagai gas lainnya. Aliran 2-fase ini juga sering disebut dengan fluida multi-fase. Pada lapangan panas bumi fluida multi�fase dialirkan dari sumur produksi menuju separator untuk memisahkan antara air 
dan uap/gas sebelum digunakan untuk memutar turbin pada sistem pembangkit listrik tenaga panas bumi. Jarak antara sumur-sumur produksi dengan separator cukup berjauhan dan dengan topografi yang mendaki dan menurun. Kondisi ini 
sangat mempengaruhi performansi dalam pengoperasiannya. Beberapa permasalahan aliran timbul selama pengoperasi dan setelah jangka waktu pengoperasian. 
Kendala yang sering ditemukan selama operasi antara lain, water hammer, pembentukkan scalling, pengikisan/erosi pipa, peningkatan/penurunan tekanan, dan penurunan laju aliran akibat adanya penyempitan dalam pipa. Hal ini akan dapat mengakibatkan kegagalan dalam sistem perpipaan fluida panas bumi diatas tanah (SAGS/steam Above Groud System) dan perubahan kualitas uap yang dihasilkan serta sekaligus akan mempengaruhi produksi listrik dari PLTP. Kajian simulasi ini dilakukan dengan tujuan untuk mengetahui performansi SAGS dan karakteristik aliran multi-fase dari fluida panas bumi yang sangat sulit dilakukan secara eksperimen atau pengukuran langsung dilapangan. Hasil dari simulasi ini 
akan dapat digunakan untuk memprediksi kondisi SAGS dan perencanaan pemeliharaannya. 
Data-data yang digunakan dalam simulasi berasal dari data primer dan sekunder dari lapangan panas bumi Ulubelu kabupaten Tanggamus provinsi Lampung yang dioperasikan oleh PT. Pertamina Geothermal Energy (PGE). Data berupa dimensi 
dan spesifikasi pipa yang digunakan, data kondisi aliran (temperatur, tekanan, laju aliran, dan lain-lain), dan data kondisi sistem perpipaan. Simulasi dilakukan menggunakan perangkat lunak komersil berbasis CFD. Simulasi aliran multi-fase diterapkan untuk aliran fluida dalam pipa pada kondisi menerun dan mendaki untuk berbagai sudut kemiringan yang disesuaikan dengan kondisi lapangan yang ada. 
Parameter aliran yang diamati meliputi kecepatan aliran, temperatur fluida, tekanan fluida, tipe aliran multi-fase yang terjadi. Parameter ini akan mempengaruhi produksi steam dan brine yang dihasilkan oleh lapangan panas bumi. 
Dari tiga cluster yang diamati didapatkan total produksi fluida 2 fase adalah sebesar 859,4 kg/s dan produksi steam dan brine masing-masing adalah sebesar 155,9 kg/s dan 717,1 kg/s. Dalam penelitian ini juga dilakukan pemanfaatan 80% brine sebagai sumber panas dari sistem pembangkit ORC yang mampu menghasilkan 15,12 MW energi listrik sebagai tambahan daya PLTP unit 1 & 2 atau tambahan daya sebesar 16,19% dari daya listrik yang dihasilkan PLTP.",,1970-01-01 00:00:00.000002022,,LPPM Universitas Lampung,,public,unpub,show,2023-05-23 01:13:19,other,"[{'id': 'harmen.1969@eng.unila.ac.id', 'name': {'given': 'Harmen', 'family': 'Harmen', 'lineage': None, 'honourific': None}}, {'id': 'amrizal@eng.unila.ac.id', 'name': {'given': 'Amrizal', 'honourific': None, 'family': 'Amrizal', 'lineage': None}}, {'id': 'ahmad.yonanda@yahoo.com', 'name': {'given': 'Ahmad', 'honourific': None, 'lineage': None, 'family': 'Yonanda'}}]",Simulasi CFD Aliran Dua Fase Campuran Air-Uap Panas Bumi pada Kondisi Pipa Menurun dan Mendaki pada Berbagai Sudut Kemiringan,,['TJ'],,http://repository.lppm.unila.ac.id/id/eprint/51959,,['FT7'],disk0_bak/00/05/19/59,2023-05-23 01:13:19,9,,,['Penelitian DIPA FT 2022'],['DIPA FT 2022'],,,,,,,,,,,
6,2022-12-02 03:47:56,47119,,archive,39-47,59,3.0,https://www.aps.or.id/journal/index.php/ijes/index,"[{'language': 'en', 'mime_type': 'application/pdf', 'rev_number': 1, 'format': 'text', 'files': [{'filename': '75-Article Text-410-1-10-20221125.pdf', 'uri': 'http://repository.lppm.unila.ac.id/id/file/517621', 'filesize': 383541, 'objectid': 186061, 'mtime': '2022-12-02 02:43:26', 'hash_type': 'MD5', 'hash': '7deb3196dfa479e930435700dbf9bb75', 'mime_type': 'application/pdf', 'datasetid': 'document', 'fileid': 517621}], 'main': '75-Article Text-410-1-10-20221125.pdf', 'docid': 186061, 'security': 'public', 'uri': 'http://repository.lppm.unila.ac.id/id/document/186061', 'pos': 1, 'eprintid': 47119, 'placement': 1}]",TRUE,"Processing chocolate from dried cocoa beans to become a ready-to-eat
chocolate paste involves a long process, including separating the cocoa oil from the flour. The
separation process is mechanized using a press machine with high pressure at a certain
temperature level. However, a press machine deals with obstacles prone to failure and
damage. This study aims to analyze the causes of the chocolate pressing machine's failure
using hydraulic pressure and find alternative repair solutions. The cylinder of the machine
press is made of stainless steel material and has a cylindrical geometry with a diameter of 23
mm and a tube length of 30 cm. Failure analysis is carried out by observing the machine's
operating conditions, the procedure for its use, and the load imposed on the machine,
including, in this case, the service life to date. Observations were also made on the form of
failure, the type of damage, and each component's function. Thus, based on the data obtained
and relates to the theoretical theory, the conditions that should occur are obtained. The study
results showed that the damages occurred, such as press tube damage, deformed fins, clogged gaps between fins, worn support rods, corroded threads, worn and stiff seals, and bearing damage to rupture. More damage was caused by the tilted position of the machine so that it didn't move the flashlight anymore. The part of the machine must be repaired flat based on standard procedures operation and carry out periodic checks on machine components.",,2022-11-01 00:00:00.000000000,,Asosiasi Peneliti Sriwijaya,2774-373X,public,pub,show,2022-12-02 03:47:56,article,"[{'id': 'gusri.akhyar@eng.unila.ac.id', 'name': {'given': 'Gusri', 'honourific': None, 'lineage': None, 'family': 'Ibrahim'}}, {'name': {'given': 'Arinal', 'honourific': None, 'lineage': None, 'family': 'Hamni'}, 'id': 'arinal.hamni@yahoo.com'}, {'id': 'yanuar.burhanuddin@eng.unila.ac.id', 'name': {'honourific': None, 'lineage': None, 'family': 'Burhanuddin', 'given': 'Yanuar'}}, {'name': {'given': 'Yahya', 'honourific': None, 'lineage': None, 'family': 'Panuju'}, 'id': 'achmad.yahya@eng.unila.ac.id'}, {'name': {'honourific': None, 'lineage': None, 'family': 'Ar Rafi', 'given': 'Sahid'}, 'id': None}, {'name': {'family': 'Ramadhan', 'lineage': None, 'honourific': None, 'given': 'Rizki'}, 'id': None}]",Failure Analysis of The Flour Press Machine and Alternative Solutions at PT Aneka Usaha Laba Jaya Utama Pesawaran,published,['TJ'],3.0,http://repository.lppm.unila.ac.id/id/eprint/47119,Indonesian Journal of Engineering and Science,['FT7'],disk0/00/04/71/19,2022-12-02 03:47:56,7,,,,,,,,,,,,,,,
