,datestamp,eprintid,id_number,eprint_status,pagerange,userid,number,official_url,documents,refereed,abstract,corp_creators,date,related_url,publisher,issn,full_text_status,ispublished,metadata_visibility,lastmod,type,creators,title,date_type,subjects,volume,uri,publication,divisions,dir,status_changed,rev_number,contact_email,place_of_pub,projects,funders,succeeds,referencetext,keywords,contributors,event_location,event_dates,pres_type,event_type,event_title,pages,patent_applicant
16,2022-10-25 06:52:26,45953,"10.35970/infotekmesin.v13i1.1039, pp.131-137",archive,,464,,https://ejournal.pnc.ac.id/index.php/infotekmesin/article/view/1039,"[{'mime_type': 'application/pdf', 'language': 'en', 'rev_number': 1, 'format': 'text', 'docid': 184770, 'main': 'Infotekmesin_Jan2022_Similarity_Irza.pdf', 'files': [{'datasetid': 'document', 'fileid': 508823, 'mime_type': 'application/pdf', 'hash': '27b89b710900df95b0eed3c0ac9125ad', 'objectid': 184770, 'filesize': 822431, 'filename': 'Infotekmesin_Jan2022_Similarity_Irza.pdf', 'uri': 'http://repository.lppm.unila.ac.id/id/file/508823', 'hash_type': 'MD5', 'mtime': '2022-10-25 04:43:54'}], 'security': 'public', 'uri': 'http://repository.lppm.unila.ac.id/id/document/184770', 'pos': 1, 'eprintid': 45953, 'placement': 1}]",,"Plat tulang berbahan logam merupakan implan ortopedi yang sangat sering digunakan karena sifat mekaniknya yang kuat. Penelitian ini bertujuan untuk melakukan analisis elemen hingga (FEM) berbasis data uji tekuk tiga titik sesuai standar ASTM F382-99. Dimensi plat yang digunakan adalah 120 mm x 14 mm x 5 mm (panjang x lebar x tebal) dan memiliki 6 dan 10 lubang baut. Beban yang diberikan pada analisis plat sebesar 986,89 N serta ukuran elemen 0,55 mm. Elemen hexahedron memiliki jumlah total elemen 62.179 untuk 6 lubang dan 62.960 elemen untuk 10 lubang. Selanjutnya, jumlah total elemen tetrahedron adalah 63.609 elemen untuk 6 lubang dan 64.822 elemen untuk 10 lubang. Perhitungan FEM untuk plat dengan 6 lubang dan 10 lubang menggunakan elemen hexahedron masing-masing menghasilan total deformasi 6,1963 mm dan 6,7852 mm. Selanjutnya, elemen tetrahedron untuk plat dengan 6 lubang dan 10 lubang menghasilkan total deformasi masing-masing sebesar 6,1762 mm dan 6,7651 mm. Berdasarkan data di atas, dapat disimpulkan bahwa perhitungan FEM untuk sampel plat tulang menggunakan elemen hexahedron lebih akurat dibanding tetrahedron.",,2022-01-01 00:00:00.000000000,,Pusat Penelitian dan Pengabdian Masyarakat (P3M) Politeknik Negeri Cilacap,,public,pub,show,2022-10-25 06:52:26,other,"[{'name': {'given': 'Wicaksono', 'honourific': None, 'lineage': None, 'family': 'Mahruri Arif'}}, {'name': {'lineage': None, 'family': 'Irza', 'honourific': None, 'given': 'Sukmana'}}]",Study Analisis Elemen Tetrahedron dan Hexahedron Plat Tulang Material Magnesium AZ31B dengan Finite Element Method (FEM),published,['TJ'],,http://repository.lppm.unila.ac.id/id/eprint/45953,,['FT7'],disk0/00/04/59/53,2022-10-25 06:52:26,7,irza.sukmana@gmail.com,Infotekmesin,,,,,,,,,,,,,
17,2022-08-24 01:57:45,44203,,archive,113-121,1179,2.0,http://journal.eng.unila.ac.id/index.php/jitet/article/view/2446,"[{'eprintid': 44203, 'placement': 1, 'security': 'public', 'pos': 1, 'uri': 'http://repository.lppm.unila.ac.id/id/document/166281', 'format': 'text', 'main': 'Pengembangan Sistem Sortasi Buah Duku (Lansium Domesticum) Berdasar Warna Menggunakan Mikrokontroler Arduino dan Sensor Warna AS7262.pdf', 'docid': 166281, 'files': [{'filename': 'Pengembangan Sistem Sortasi Buah Duku (Lansium Domesticum) Berdasar Warna Menggunakan Mikrokontroler Arduino dan Sensor Warna AS7262.pdf', 'uri': 'http://repository.lppm.unila.ac.id/id/file/480474', 'filesize': 712756, 'objectid': 166281, 'mtime': '2022-08-23 21:49:30', 'hash_type': 'MD5', 'hash': 'baaaf8c6a7d7179df50a8831845cff56', 'mime_type': 'application/pdf', 'fileid': 480474, 'datasetid': 'document'}], 'mime_type': 'application/pdf', 'language': 'en', 'rev_number': 1}]",TRUE,"Produk perkebunan merupakan salah satu komoditas yang sangat penting Indonesia. Duku adalah salas satu produk perkebunan musiman yang menjadi salah satu sumber pendapatan ketika panen. Namun, umur simpan duku sangat pendek, batas 
penyimpanan buah duku tidak lebih dari satu minggu. Buah duku akan mengalami perubahan pada warna buah, buah segar akan mengalami kecoklatan pada umur 3 sampai 5 hari pasca panen. Berubahnya warna buah duku menjadi kecoklatan tersebut tentunya dapat menurunkan kualitas dan harga dari buah duku tersebut. Pendeknya umur penyimpanan buah duku tersebut merupakan salah satu sulitnya penjualan duku. 
Penelitian ini melakukan pengklasifikasian duku sesuai warna dengan mengembangkan konveyor sabuk sebagai alat untuk melakukan sortasi duku berdasar warna dengan mikrokontroler. Sistem sortasi menjadi penting dalam mengelompokkan duku dalam umur yang sama sehingga dapat dipilih duku untuk pasar lokal yang sudah matang, duku untuk pasar luar yang belum matang dan akan matang dalam perjalanan serta duku yang 
cacat. Adapun tujuan dari riset ini adalah membuat sistem sortasi warna buah duku berbasis mikrokontroler dan mengembangkan sistem yang dapat memisahkan tiga kelompok kelas duku, duku kelas super, duku kelas a dan duku kelas b berdasar warna dengan sensor AS7262.",,1970-01-01 00:00:00.000002022,,,,public,pub,show,2022-08-24 01:57:45,article,"[{'id': 'martinus@eng.unila.ac.id', 'name': {'given': 'Martinus', 'lineage': None, 'family': 'Martinus', 'honourific': None}}, {'id': 'irza.sukmana@gmail.com', 'name': {'given': 'Irza', 'honourific': None, 'family': 'Sukmana', 'lineage': None}}, {'name': {'given': 'Herry', 'lineage': None, 'family': 'Wardono', 'honourific': None}, 'id': 'herryw22@gmail.com'}, {'id': 'riszal.eng@gmail.com', 'name': {'given': 'Akhmad', 'honourific': None, 'lineage': None, 'family': 'Riszal'}}, {'id': 'mareli.telaumbanua@fp.unila.ac.id', 'name': {'honourific': None, 'family': 'Telaumbanua', 'lineage': None, 'given': 'Mareli'}}, {'name': {'given': 'Ahmad', 'honourific': None, 'lineage': None, 'family': 'Suudi'}, 'id': 'ahmad.suudi@eng.unila.ac.id'}, {'name': {'family': 'Muhammad', 'lineage': None, 'honourific': None, 'given': 'Meizano Ardhi'}, 'id': 'meizano@eng.unila.ac.id'}, {'id': 'gigih@eng.unila.ac.id', 'name': {'given': 'Gigih Forda', 'lineage': None, 'family': 'Nama', 'honourific': None}}, {'name': {'honourific': None, 'lineage': None, 'family': 'Putra', 'given': 'Eko Yuliansyah'}, 'id': None}, {'id': 'zulmiftah.huda@eng.unila.ac.id', 'name': {'given': 'Zulmiftah', 'lineage': None, 'family': 'Huda', 'honourific': None}}, {'name': {'lineage': None, 'family': 'Septiana', 'honourific': None, 'given': 'Trisya'}, 'id': 'trisya.septiana@eng.unila.ac.id'}, {'name': {'given': 'PANJI', 'lineage': None, 'family': 'KURNIAWAN', 'honourific': None}, 'id': 'panji.kurniawan@eng.unila.ac.id'}]",Pengembangan Sistem Sortasi Buah Duku (Lansium Domesticum) Berdasar Warna Menggunakan Mikrokontroler Arduino dan Sensor Warna AS7262,,['T1'],10.0,http://repository.lppm.unila.ac.id/id/eprint/44203,Jurnal Informatika dan Teknik Elektro Terapan,['FT7'],disk0/00/04/42/03,2022-08-24 01:57:45,11,,,,,,,,,,,,,,,
18,2022-09-14 09:43:00,44944,https://doi.org/10.51662/jiae.v2i1.35,archive,19-32,24,1.0,https://asasijournal.id/index.php/jiae/article/view/35,"[{'format': 'text', 'files': [{'mime_type': 'application/pdf', 'hash': '56f8f8175ed656491a70d5aa1b9b445b', 'datasetid': 'document', 'fileid': 484801, 'mtime': '2022-09-14 07:50:32', 'hash_type': 'MD5', 'uri': 'http://repository.lppm.unila.ac.id/id/file/484801', 'filename': 'Set-Submerged Floating Tunnel Bridge.pdf', 'filesize': 991522, 'objectid': 166864}], 'main': 'Set-Submerged Floating Tunnel Bridge.pdf', 'docid': 166864, 'mime_type': 'application/pdf', 'language': 'en', 'rev_number': 1, 'eprintid': 44944, 'placement': 2, 'security': 'public', 'pos': 2, 'uri': 'http://repository.lppm.unila.ac.id/id/document/166864'}]",FALSE,"One of the problems in archipelagic countries is the land transportation system that has not been integrated between islands. In a relatively wide strait and with a high level of depth, it is impossible to build a bridge. In this case, a submerged floating tunnel bridge/SFTB would be an effective choice. SFTB is an underwater tunnel transport route submerged between the seabed and the surface. Known as the ""Archimedes Bridge"", the basic principle is balancing buoyancy and tension in the mooring cables. Previous studies on SFTB are still in the form of theoretical concepts and ideas. Further research is needed in all relevant sub-topics to actualize the SFTB. This article reviews previous studies, which are grouped into three subtopics : (1) materials and construction, (2) dynamic analysis, and (3) feasibility/sustainability studies. At the end of this article, a list of research topics that need further study is presented","['Department of Mechanical Engineering, Universitas Lampung, Indonesia', 'Department of Mechanical Engineering, Universitas Lampung, Indonesia', 'Department of Mechanical Engineering, Universitas Lampung, Indonesia']",2022-03-01 00:00:00.000000000,[{'url': 'https://doi.org/10.51662/jiae.v2i1.35'}],Asosiasi Staf Akademik Perguruan Tinggi Seluruh Indonesia (ASASI),2774-6038,public,pub,show,2022-09-14 09:43:00,article,"[{'name': {'honourific': None, 'lineage': None, 'family': 'Nugraha', 'given': 'Nurcahya'}, 'id': 'nurcahyanugraha11@gmail.com'}, {'id': 'jamiatul.akmal@eng.unila.ac.id', 'name': {'given': 'Jamiatul', 'honourific': None, 'lineage': None, 'family': 'Akmal'}}, {'id': 'asnawi.lubis@eng.unila.ac.id', 'name': {'given': 'Asnawi', 'honourific': None, 'lineage': None, 'family': 'Lubis'}}]",Submerged Floating Tunnel Bridge (SFTB): A Status Report and Evaluation of Technology Readiness Level (TRL),published,['TG'],2.0,http://repository.lppm.unila.ac.id/id/eprint/44944,Submerged Floating Tunnel Bridge (SFTB): A Status Report and Evaluation of Technology Readiness Level (TRL),['FT7'],disk0/00/04/49/44,2022-09-14 09:43:00,9,,,,,,,,,,,,,,,
19,2023-03-31 00:48:56,49459,https://doi.org/10.20965/ijat.2022.p0814,archive,814-823,217,6.0,https://www.fujipress.jp/ijat/au/,"[{'language': 'en', 'mime_type': 'application/pdf', 'rev_number': 2, 'main': 'martinus-jurnal-2022-Sustainable_Design_Implementation.pdf', 'files': [{'datasetid': 'document', 'fileid': 536582, 'mime_type': 'application/pdf', 'hash': '3060596ecd99c9e1eebe9d4923d0c187', 'filesize': 944761, 'objectid': 189020, 'uri': 'http://repository.lppm.unila.ac.id/id/file/536582', 'filename': 'martinus-jurnal-2022-Sustainable_Design_Implementation.pdf', 'hash_type': 'MD5', 'mtime': '2023-03-30 16:30:55'}], 'docid': 189020, 'format': 'text', 'pos': 1, 'uri': 'http://repository.lppm.unila.ac.id/id/document/189020', 'security': 'public', 'formatdesc': 'artikel', 'placement': 1, 'eprintid': 49459}, {'docid': 189021, 'main': 'martinus-similiarity-Sustainable Design Implementation.png', 'files': [{'mime_type': 'image/png', 'hash': 'd062af7f2ea2292e8f9134babe3a2648', 'datasetid': 'document', 'fileid': 536584, 'mtime': '2023-03-30 16:31:00', 'hash_type': 'MD5', 'filename': 'martinus-similiarity-Sustainable Design Implementation.png', 'uri': 'http://repository.lppm.unila.ac.id/id/file/536584', 'objectid': 189021, 'filesize': 116184}], 'format': 'text', 'rev_number': 2, 'language': 'en', 'mime_type': 'image/png', 'placement': 2, 'eprintid': 49459, 'uri': 'http://repository.lppm.unila.ac.id/id/document/189021', 'pos': 2, 'security': 'public', 'formatdesc': 'similiarity'}, {'security': 'public', 'formatdesc': 'Korespondensi', 'uri': 'http://repository.lppm.unila.ac.id/id/document/189022', 'pos': 3, 'eprintid': 49459, 'placement': 3, 'language': 'en', 'mime_type': 'application/pdf', 'rev_number': 2, 'format': 'text', 'main': 'martinus-korespondensi-Sustainable Design Implementation.pdf', 'files': [{'hash_type': 'MD5', 'mtime': '2023-03-30 16:31:09', 'objectid': 189022, 'filesize': 87957, 'uri': 'http://repository.lppm.unila.ac.id/id/file/536586', 'filename': 'martinus-korespondensi-Sustainable Design Implementation.pdf', 'fileid': 536586, 'datasetid': 'document', 'mime_type': 'application/pdf', 'hash': '629db876fe38c614441a9c3696ae0050'}], 'docid': 189022}]",TRUE,"Sustainable design in product development has multiple roles in addressing an increased level of sustainability. This includes reducing resource consumption and modifying user behaviors to become more eco-friendly. However, these functions are typically assessed separately, despite a proposed mutual correlation. This paper proposes a framework for defining this correlation. By using the correlated functions in parallel, one can enhance the product development process, and this will strengthen the use of sustainable design as a powerful design tool for future products. A practical approach for implementation is needed, which should show the benefit of the design both from the environmental aspect and a change in the responsibility of users. The primary goal of this manuscript is to propose an approach to fill this gap, using experiments to explore the effect of a washing machine modification project in Indonesia. Resource consumption while doing the laundry is measured as a representation of the environmental impact, while the users’ predisposition for environmental responsibility inclination is analyzed by scaling the responsibility. The results show that the sustainable design strategy is effective in reducing the environmental impact while simultaneously increasing the environmental responsibility of users. Further study is required to define the correlation between the measured factors to formulate a well-developed theory related to this correlation.",,2022-11-05 00:00:00.000000000,,Fuji Technology Press Ltd,1883-8022,public,pub,show,2023-03-31 00:48:56,article,"[{'id': 'achmad.yahya@eng.unila.ac.id', 'name': {'given': 'Yahya', 'honourific': None, 'lineage': None, 'family': 'Panuju'}}, {'name': {'given': 'Martinus', 'lineage': None, 'family': '.', 'honourific': None}, 'id': 'martinus@eng.unila.ac.id'}, {'id': 'riszal.eng@gmail.com', 'name': {'given': 'Akhmad', 'lineage': None, 'family': 'Riszal', 'honourific': None}}, {'id': 'kobayashi@mech.eng.osaka-u.ac.jp', 'name': {'given': 'Hideki', 'family': 'Kobayashi', 'lineage': None, 'honourific': None}}]",Sustainable Design Implementation – Measuring Environmental Impact and User Responsibility,published,"['T1', 'TA', 'TD', 'TJ']",16.0,http://repository.lppm.unila.ac.id/id/eprint/49459,International Journal of Automation Technology,['FT7'],disk0_bak/00/04/94/59,2023-03-31 00:48:56,15,,,,,,,,,,,,,,,
20,2022-11-07 01:38:13,46294,doi: 10.20965/ijat.2022.p0814,archive,814-823,59,6.0,https://www.fujipress.jp/ijat/au/,"[{'security': 'public', 'uri': 'http://repository.lppm.unila.ac.id/id/document/185178', 'pos': 1, 'eprintid': 46294, 'placement': 1, 'mime_type': 'application/pdf', 'language': 'en', 'rev_number': 1, 'format': 'text', 'docid': 185178, 'main': 'Fujipress_IJAT-16-6-14.pdf', 'files': [{'objectid': 185178, 'filesize': 944761, 'filename': 'Fujipress_IJAT-16-6-14.pdf', 'uri': 'http://repository.lppm.unila.ac.id/id/file/511384', 'hash_type': 'MD5', 'mtime': '2022-11-05 01:48:43', 'fileid': 511384, 'datasetid': 'document', 'mime_type': 'application/pdf', 'hash': '3060596ecd99c9e1eebe9d4923d0c187'}]}]",TRUE,"Sustainable design in product development has multiple roles in addressing an increased level of sustainability. This includes reducing resource consumption and modifying user behaviors to become more eco-friendly. However, these functions are typically assessed separately, despite a proposed mutual correlation. This paper proposes a framework for defining this correlation. By using the correlated functions in parallel, one can enhance the product development process, and this will strengthen the use of sustainable design as a powerful design tool for future products. A practical approach for implementation is needed, which should show the benefit of the design both from the environmental aspect and a change in the responsibility of users. The primary goal of this manuscript is to propose an approach to fill this gap, using experiments to explore the effect of a washing machine modification project in Indonesia. Resource consumption while doing the laundry is measured as a representation of the environmental impact, while the users’ predisposition for environmental responsibility inclination is analyzed by scaling the responsibility. The results show that the sustainable design strategy is effective in reducing the environmental impact, while simultaneously increasing the environmental responsibility of users. Further study is required to define the correlation between the measured factors to formulate a well-developed theory related to this correlation.",,2022-11-05 00:00:00.000000000,[{'url': 'https://www.fujipress.jp/ijat/au/ijate001600060814/'}],Fuji Technology Press Ltd,1883-8022,public,pub,show,2022-11-07 01:38:13,article,"[{'id': 'achmad.yahya@eng.unila.ac.id', 'name': {'given': 'Yahya', 'lineage': None, 'family': 'Panuju', 'honourific': None}}, {'name': {'lineage': None, 'family': 'Martinus', 'honourific': None, 'given': 'Martinus'}, 'id': 'martinus@eng.unila.ac.id'}, {'name': {'given': 'Riszal', 'lineage': None, 'family': 'Akhmad Riszal', 'honourific': None}, 'id': 'riszal.eng@gmail.com'}]",Sustainable Design Implementation – Measuring Environmental Impact and User Responsibility,published,"['T1', 'TA', 'TD', 'TJ']",16.0,http://repository.lppm.unila.ac.id/id/eprint/46294,International Journal of Automation Technology,['FT7'],disk0/00/04/62/94,2022-11-07 01:38:13,9,,,,['BLU Unila'],,,,,,,,,,,
21,2023-07-10 01:55:34,52036,,archive,1-7,59,2.0,https://journal.eng.unila.ac.id/index.php/mech/article/view/3040,"[{'placement': 1, 'eprintid': 52036, 'uri': 'http://repository.lppm.unila.ac.id/id/document/251757', 'pos': 1, 'security': 'public', 'main': 'Mech_Aplikasi_Panuju2023.pdf', 'docid': 251757, 'files': [{'datasetid': 'document', 'fileid': 616522, 'mime_type': 'application/pdf', 'hash': 'f605a33a044ca45ca161c0ca69271ae2', 'objectid': 251757, 'filesize': 254025, 'filename': 'Mech_Aplikasi_Panuju2023.pdf', 'uri': 'http://repository.lppm.unila.ac.id/id/file/616522', 'hash_type': 'MD5', 'mtime': '2023-05-27 23:55:58'}], 'format': 'text', 'mime_type': 'application/pdf', 'language': 'en', 'rev_number': 1}]",TRUE,"Kegiatan konsumsi rumah tangga di perkotaan menjadi salah satu aspek yang berkontribusi tinggi pada permasalahan lingkungan, yang meliputi pemakaian sumber daya, produksi emisi dan limbah rumah tangga baik berupa gas, padat maupun cair. Salah satu alternatif cara untuk menekan kerusakan yang disebabkan oleh aktivitas konsumsi rumah tangga ini adalah melalui penggunaan produk-produk yang bersifat lebih ramah lingkungan, walaupun efektivitas dari strategi ini masih banyak diperdebatkan. Artikel ini memaparkan strategi desain ramah lingkungan pada produk rumah tangga, melalui penelusuran penelitian-penelitian yang telah dilakukan sebelumnya. Dari sekian strategi yang dipaparkan maka dipilih salah satu strategi untuk diterapkan yaitu ‘eco-information’ ke dalam produk mesin cuci 2 tabung, yang saat ini banyak digunakan oleh masyarakat Indonesia. Aplikasi strategi dilakukan dengan memberikan modifikasi desain kepada mesin cuci, di mana pengguna dapat melihat penggunaan air dan listrik secara langsung pada saat proses pencucian sehingga dapat meningkatkan kesadaran / awareness pengguna akan sumber daya yang dipakai. Efektivitas strategi ini diuji melalui eksperimen yang melibatkan responden, di mana konsumsi air sebelum dan sesudah penerapan strategi dicatat dan dianalisis lebih lanjut, dan didapatkan bahwa penerapan strategi memberikan efek yang signifikan pada perilaku pengguna mesin cuci terkait konsumsi air.",,2022-09-01 00:00:00.000000000,[{'url': 'https://journal.eng.unila.ac.id/index.php/mech/article/view/3040'}],Jurusan Teknik Mesin Universitas Lampung,2087-1880,public,pub,show,2023-07-10 01:55:34,article,"[{'id': 'achmad.yahya@eng.unila.ac.id', 'name': {'given': 'Yahya', 'honourific': None, 'family': 'Panuju', 'lineage': None}}, {'id': 'martinus@eng.unila.ac.id', 'name': {'family': 'Martinus', 'lineage': None, 'honourific': None, 'given': 'Martinus'}}, {'id': 'arinal.hamni@yahoo.com', 'name': {'given': 'Arinal', 'honourific': None, 'family': 'Hamni', 'lineage': None}}, {'id': 'tarkono_irfan@yahoo.com', 'name': {'given': 'Tarkono', 'honourific': None, 'lineage': None, 'family': 'Tarkono'}}]",Aplikasi Strategi Desain Ramah Lingkungan pada Produk Rumah Tangga: Modifikasi Produk Mesin Cuci 2 Tabung,published,"['T1', 'TA', 'TJ']",13.0,http://repository.lppm.unila.ac.id/id/eprint/52036,Mechanical Jurnal Ilmiah Teknik Mesin,['FT7'],disk0_bak/00/05/20/36,2023-07-10 01:55:34,8,,,,['DIPA FT Unila'],,,,"[{'type': 'http://www.loc.gov/loc.terms/relators/AUT'}, {'type': 'http://www.loc.gov/loc.terms/relators/AUT'}]",,,,,,,
22,2023-03-31 00:48:51,49458,,archive,,217,,https://doi.org/10.1063/5.0111077,"[{'placement': 1, 'eprintid': 49458, 'uri': 'http://repository.lppm.unila.ac.id/id/document/189017', 'pos': 1, 'formatdesc': 'Artikel', 'security': 'public', 'docid': 189017, 'main': 'martinus-prosiding-2022-Electric car design and aerodynamics.pdf', 'files': [{'datasetid': 'document', 'fileid': 536566, 'mime_type': 'application/pdf', 'hash': '4b814afb74e39c58aab7cbae9131827d', 'objectid': 189017, 'filesize': 1048657, 'filename': 'martinus-prosiding-2022-Electric car design and aerodynamics.pdf', 'uri': 'http://repository.lppm.unila.ac.id/id/file/536566', 'hash_type': 'MD5', 'mtime': '2023-03-30 16:13:16'}], 'format': 'text', 'mime_type': 'application/pdf', 'language': 'en', 'rev_number': 3, 'content': 'published'}, {'files': [{'mime_type': 'application/pdf', 'hash': '16fabd9ac0fbf8e31d16f95eacce2fde', 'fileid': 536568, 'datasetid': 'document', 'mtime': '2023-03-30 16:13:34', 'hash_type': 'MD5', 'uri': 'http://repository.lppm.unila.ac.id/id/file/536568', 'filename': 'martinus-prosiding-2022-Electric car design and aerodynamics.pdf.pdf', 'objectid': 189018, 'filesize': 1080431}], 'main': 'martinus-prosiding-2022-Electric car design and aerodynamics.pdf.pdf', 'docid': 189018, 'format': 'text', 'rev_number': 2, 'language': 'en', 'mime_type': 'application/pdf', 'content': 'other', 'placement': 2, 'eprintid': 49458, 'pos': 2, 'uri': 'http://repository.lppm.unila.ac.id/id/document/189018', 'formatdesc': 'Cek Similiarity', 'security': 'public'}]",TRUE,The use of fossil energy is very influential on environmental sustainability. The impact we have felt is global warming with an uncertain season. So we must have a commitment to reduce the consumption of fossil fuels in order to maintain a sustainable environment. This is in line with the commitment of the University of Lampung (UNILA) in making the Unila campus a Green Campus. One of the technologies that can encourage the realization of a green campus is electric vehicles around campus. The purpose of this analysis is to determine the design of the shape or geometry of the vehicle and the aerodynamic analysis of the vehicle with speed variations of 10 and 20 m/s. This research uses the Research and Development (R&D) type of research and is carried out to make an optimal vehicle design with aerodynamic studies. This study uses the Software Ansys Workbench with CFD solver and using m etode k-epsilon turbulence realizable standard wall function.,,2022-10-31 00:00:00.000000000,,,,public,pub,show,2023-03-31 00:48:51,conference_item,"[{'name': {'family': 'Riszal', 'lineage': None, 'honourific': None, 'given': 'Akhmad'}, 'id': 'riszal.eng@gmail.com'}, {'id': 'martinus@eng.unila.ac.id', 'name': {'honourific': None, 'family': '.', 'lineage': None, 'given': 'Martinus'}}, {'id': 'ahmad.yonanda@yahoo.com', 'name': {'given': 'Ahmad', 'family': 'Yonanda', 'lineage': None, 'honourific': None}}]",Electric Car Design and Aerodynamics Analysis for Green Campus Unila E-Car,published,"['T1', 'TJ', 'TL']",,http://repository.lppm.unila.ac.id/id/eprint/49458,,['FT7'],disk0_bak/00/04/94/58,2023-03-31 00:48:51,13,,,,,,,,,"Bandar Lampung, Indonesia",27–28 August 2021,paper,conference,"THE 2ND UNIVERSITAS LAMPUNG INTERNATIONAL CONFERENCE ON SCIENCE, TECHNOLOGY, AND ENVIRONMENT (ULICoSTE) 2021",,
