,datestamp,eprintid,id_number,eprint_status,pagerange,userid,number,official_url,documents,refereed,abstract,corp_creators,date,related_url,publisher,issn,full_text_status,ispublished,metadata_visibility,lastmod,type,creators,title,date_type,subjects,volume,uri,publication,divisions,dir,status_changed,rev_number,contact_email,place_of_pub,projects,funders,succeeds,referencetext,keywords,contributors,event_location,event_dates,pres_type,event_type,event_title,pages,patent_applicant
7,2023-04-17 00:46:49,50592,,archive,,464,,,"[{'placement': 1, 'eprintid': 50592, 'pos': 1, 'uri': 'http://repository.lppm.unila.ac.id/id/document/190295', 'security': 'public', 'main': 'FME_Corr1_merged.pdf', 'docid': 190295, 'files': [{'hash': '47e46d54d667bb2a3958655856eec9e7', 'mime_type': 'application/pdf', 'fileid': 545482, 'datasetid': 'document', 'uri': 'http://repository.lppm.unila.ac.id/id/file/545482', 'filename': 'FME_Corr1_merged.pdf', 'objectid': 190295, 'filesize': 788288, 'mtime': '2023-01-27 08:16:38', 'hash_type': 'MD5'}], 'format': 'text', 'language': 'en', 'mime_type': 'application/pdf', 'rev_number': 2}, {'main': 'FME Transaction corresponding author lengkap.pdf', 'files': [{'hash_type': 'MD5', 'mtime': '2023-04-16 15:55:49', 'filesize': 3602581, 'objectid': 190296, 'uri': 'http://repository.lppm.unila.ac.id/id/file/545483', 'filename': 'FME Transaction corresponding author lengkap.pdf', 'datasetid': 'document', 'fileid': 545483, 'mime_type': 'application/pdf', 'hash': 'f07b9c76be2965eb4c59af1b817a46dc'}], 'docid': 190296, 'format': 'text', 'language': 'en', 'rev_number': 1, 'mime_type': 'application/pdf', 'placement': 2, 'eprintid': 50592, 'pos': 2, 'uri': 'http://repository.lppm.unila.ac.id/id/document/190296', 'security': 'public'}]",,Bukti Korespondensi artikel jurnal internasional bereputasi,,2022-10-01 00:00:00.000000000,,University of Belgrade,,public,pub,show,2023-04-17 00:46:49,other,"[{'name': {'honourific': None, 'family': 'Irza', 'lineage': None, 'given': 'Sukmana'}, 'id': 'irza.sukmana@eng.unila.ac.id'}]",FME Transactions Corresponding Author,,['TJ'],,http://repository.lppm.unila.ac.id/id/eprint/50592,,['FT7'],disk0_bak/00/05/05/92,2023-04-17 00:46:49,4,,,,,48099.0,,,,,,,,,,
8,2023-01-27 08:23:14,48098,,archive,,464,,,"[{'language': 'en', 'mime_type': 'application/pdf', 'rev_number': 1, 'format': 'text', 'docid': 187295, 'main': 'IJTech1_merged.pdf', 'files': [{'hash': 'a33c870a882e111bd759ed5cbe6dc6cc', 'mime_type': 'application/pdf', 'datasetid': 'document', 'fileid': 525850, 'uri': 'http://repository.lppm.unila.ac.id/id/file/525850', 'filename': 'IJTech1_merged.pdf', 'filesize': 2513939, 'objectid': 187295, 'mtime': '2023-01-27 08:09:16', 'hash_type': 'MD5'}], 'security': 'public', 'uri': 'http://repository.lppm.unila.ac.id/id/document/187295', 'pos': 1, 'eprintid': 48098, 'placement': 1}]",,Data bukti korespondensi artikel sebagai penulis korespondensi karya ilmiah,,2022-10-07 00:00:00.000000000,,FT Universitas Indonesia,,public,pub,show,2023-01-27 08:23:14,other,"[{'id': 'irza.sukmana@eng.unila.ac.id', 'name': {'lineage': None, 'family': 'Irza', 'honourific': None, 'given': 'Sukmana'}}]",IJTech Corresponding Author,,['TJ'],,http://repository.lppm.unila.ac.id/id/eprint/48098,,['FT7'],disk0_bak/00/04/80/98,2023-01-27 08:23:14,8,,,,,,,,,,,,,,,
9,2022-10-25 06:52:31,45955,https://doi.org/10.47355/aset.v1i2.18,archive,,464,,https://journal.ic-star.org/index.php/jaset/article/view/18,"[{'placement': 1, 'eprintid': 45955, 'uri': 'http://repository.lppm.unila.ac.id/id/document/184772', 'pos': 1, 'security': 'public', 'files': [{'hash_type': 'MD5', 'mtime': '2022-10-25 05:05:38', 'filesize': 625849, 'objectid': 184772, 'uri': 'http://repository.lppm.unila.ac.id/id/file/508837', 'filename': 'JASET_Dec2021_Similarity_Irza.pdf', 'datasetid': 'document', 'fileid': 508837, 'mime_type': 'application/pdf', 'hash': 'e54045ce316f1b3550cc390f8da06d79'}], 'main': 'JASET_Dec2021_Similarity_Irza.pdf', 'docid': 184772, 'format': 'text', 'rev_number': 1, 'language': 'en', 'mime_type': 'application/pdf'}]",,"Cardiovascular disease is the leading cause of death worldwide. Arterial stenting as a transluminal angioplasty procedure allows re-opening of narrowed vessels and restoring normal blood flow with stent placement. The development of stents ed at the end of 19 century with bare-metal stents (BMS). Now, it has been based on the application of biodegradable or natural decomposed and coated stents. The coated stent has been found to improve BMS properties in terms of biocompatibility, cytotoxicity, and better mechanical and biophysical properties. Also, a biodegradable stent may support the blood micro-vessel during the estimated period of time before downgraded constituents. The biodegradable stent also allows a reinsertion for several months to improve the vessel wall's quality. This paper describes the possible materials for stents and their properties such as design criteria, degradation behavior, disadvantages, and advantages with clinical and preclinical trials to date. Stent degradation allows reinsertion of the stent after several months and improves the vessel wall quality. This paper focuses on developing materials for stents, which describe the possible materials for stents and their properties. Furthermore, the current clinical trial of the new proposed stent will also be highlighted",,2022-12-01 00:00:00.000000000,,INSTEP Network Publishing,,public,pub,show,2022-10-25 06:52:31,other,"[{'name': {'honourific': None, 'family': 'Irza', 'lineage': None, 'given': 'Sukmana'}}, {'name': {'lineage': None, 'family': 'Arifo Gunawan', 'honourific': None, 'given': 'Chyanegoro'}}, {'name': {'given': 'Sugiri', 'honourific': None, 'lineage': None, 'family': 'Agus'}}]",Biomedical Material for Stent Application: Current Status and Future Challenges,published,['TJ'],,http://repository.lppm.unila.ac.id/id/eprint/45955,,['FT7'],disk0/00/04/59/55,2022-10-25 06:52:31,7,irza.sukmana@gmail.com,"Journal of Applied Science, Engineering and Technology",,,,,,,,,,,,,
10,2022-10-26 01:59:33,45965,https://doi.org/10.37373/jttm.v3i2.312,archive,,464,,https://www.jurnal.sttmcileungsi.ac.id/index.php/jttm/article/view/312,"[{'language': 'en', 'rev_number': 1, 'mime_type': 'application/pdf', 'docid': 184782, 'main': 'JTTM_Oct2022_Similarity_Irza.pdf', 'files': [{'filesize': 367190, 'objectid': 184782, 'uri': 'http://repository.lppm.unila.ac.id/id/file/508920', 'filename': 'JTTM_Oct2022_Similarity_Irza.pdf', 'hash_type': 'MD5', 'mtime': '2022-10-25 07:28:16', 'fileid': 508920, 'datasetid': 'document', 'hash': '31873b6dd0acfc785f7dcaa7ab1b1a82', 'mime_type': 'application/pdf'}], 'format': 'text', 'pos': 1, 'uri': 'http://repository.lppm.unila.ac.id/id/document/184782', 'security': 'public', 'placement': 1, 'eprintid': 45965}]",,"Welding is a method of joining metals by utilizing local heat to form a metallurgical bond between the metals. The most common welding is electric welding, including the Shielded Metal Arch Welding (SMAW). This type of welding uses a filler wire or electrode. To reduce weld cracks and cooling rates in the weld metal and heat affected zone (HAZ) area, it is necessary to carry out a pre-heating process. Pre-heating is the application of heat to the material to be welded using oxyacetylene welding or a gas torch. This study aims to determine the appropriate pre-heating distance for the welding process of AISI 1045 steel, classified as a type of medium carbon steel widely used in shafts, gears, and piston connecting rods in motor vehicles. The parameters used in this study were the pre-heating distances of 1.5cm, 3cm, and 4.5cm that were preheated at a temperature of 150°C, using LB-52U type electrodes with a diameter of 2mm",,2022-10-01 00:00:00.000000000,,LPPMPK - Sekolah Tinggi Teknologi Muhammadiyah Cileungsi,,public,pub,show,2022-10-26 01:59:33,other,"[{'name': {'given': 'Sukmana', 'honourific': None, 'family': 'Irza', 'lineage': None}}, {'name': {'family': 'Egi', 'lineage': None, 'honourific': None, 'given': 'Andika'}}, {'name': {'honourific': None, 'family': 'Joy Rizki Pangestu', 'lineage': None, 'given': 'Djuansjah'}}, {'name': {'given': 'Tarkono', 'lineage': None, 'family': 'Tarkono', 'honourific': None}}]",The effect of pre-heating distance of shielded metal arc welding on the mechanical properties of AISI 1045 steel,published,['TJ'],,http://repository.lppm.unila.ac.id/id/eprint/45965,,['FT7'],disk0/00/04/59/65,2022-10-26 01:59:33,7,irza.sukmana@gmail.com,JTTM: Jurnal Terapan Teknik Mesin,,,,,,,,,,,,,
11,2022-10-25 06:52:02,45949,doi:105937/fme2203422S,archive,,464,,https://www.mas.bg.ac.rs/_media/istrazivanje/fme/vol50/3/4_i_sukmana_et_al.pdf,"[{'mime_type': 'application/pdf', 'language': 'en', 'rev_number': 1, 'docid': 184766, 'main': 'FME_Transactions_SJR_Q2_Sept2022_Similarity_Irza.pdf', 'files': [{'fileid': 508788, 'datasetid': 'document', 'hash': '99e1d832ee96c3210d733cafc78cc0ab', 'mime_type': 'application/pdf', 'filesize': 2518924, 'objectid': 184766, 'filename': 'FME_Transactions_SJR_Q2_Sept2022_Similarity_Irza.pdf', 'uri': 'http://repository.lppm.unila.ac.id/id/file/508788', 'hash_type': 'MD5', 'mtime': '2022-10-25 04:11:05'}], 'format': 'text', 'uri': 'http://repository.lppm.unila.ac.id/id/document/184766', 'pos': 1, 'security': 'public', 'placement': 1, 'eprintid': 45949}]",,"The low cycle fatigue behavior of magnesium (Mg) AZ31B was observed at room temperature, in which its extrusion process led to differences in tensile and compressive stresses, with an increase in the grain structure and mechanical properties. The extrusion process results showed changes in the microstructure due to cyclic load-deformation at the longitudinal section with grain direction and shape. Furthermore, Mg AZ31B also showed transitional behavior from cyclic softening to hardening when the strain amplitude was increased. At a strain amplitude of 0.006 – 0.01 mm/mm, the Bauschinger phenomenon was observed. The effect factor was calculated by the yield stress and strain at compression stress. Furthermore, precipitation or local failure of the second phase was the main factor that caused the Bauschinger phenomenon. The fatigue fracture characteristics based on deformation due to cyclic loading include precipitation, fatigue striation, dimples, micro-cracks, and beach mark fatigue. Therefore, the correlation of the total failure cycle with plastic and the elastic strain was obtained as an equation to predict the lifespan of Mg AZ31B.",,2022-10-01 00:00:00.000000000,,"Faculty of Mechanical Engineering, Univ. of Belgrade",,public,pub,show,2022-10-25 06:52:02,other,"[{'name': {'given': 'Sukmana', 'honourific': None, 'family': 'Irza', 'lineage': None}}, {'name': {'honourific': None, 'lineage': None, 'family': 'Fauzi', 'given': 'Ibrahim'}}, {'name': {'honourific': None, 'lineage': None, 'family': 'Mohammad', 'given': 'Badaruddin'}}, {'name': {'honourific': None, 'family': 'Hadi', 'lineage': None, 'given': 'Nur'}}]",Low Cycle Fatigue Properties of Extruded Magnesium AZ31B,published,['TJ'],,http://repository.lppm.unila.ac.id/id/eprint/45949,,['FT7'],disk0/00/04/59/49,2022-10-25 06:52:02,9,irza.sukmana@gmail.com,FME Transactions,,,,,,,,,,,,,
12,2022-10-26 01:59:19,45961,http://doi.org/10.23960/jesr.v4i1.109,archive,,464,,https://jesr.eng.unila.ac.id/index.php/ojs/article/download/109/79,"[{'format': 'text', 'main': 'JESR_June2022b_Irza_dkk_Similarity.pdf', 'docid': 184778, 'files': [{'datasetid': 'document', 'fileid': 508891, 'hash': '5e521aa1db8733257ee4708d4fb953a7', 'mime_type': 'application/pdf', 'hash_type': 'MD5', 'mtime': '2022-10-25 07:01:46', 'objectid': 184778, 'filesize': 1338831, 'uri': 'http://repository.lppm.unila.ac.id/id/file/508891', 'filename': 'JESR_June2022b_Irza_dkk_Similarity.pdf'}], 'language': 'en', 'rev_number': 1, 'mime_type': 'application/pdf', 'eprintid': 45961, 'placement': 1, 'security': 'public', 'pos': 1, 'uri': 'http://repository.lppm.unila.ac.id/id/document/184778'}]",,"Aluminum is a material that is soft, lightweight, resistant to corrosion, and has good electrical and thermal conductivity. Aluminum has a specific gravity of about 2.65-2.8 kg/dm³, a melting point of 658ºC, and tensile strength of 90 MPa. Aluminum 1100 series is an aluminum alloy mixed with other materials, such as copper, iron, chrome, manganese, and zinc, with an aluminum content of 99,0%. Welding is the joining of two metals in a liquid state with or without filler. FSW (friction stir welding) is friction welding; the process does not require filler material. The heat used to melt the metal is obtained from the friction between the indenter and the workpiece. In the research, the shape of the indenter pin used is, oval shape, cone shape, and changing spiral form with a tool rotation of 2000 rpm and a welding rate of 16 mm/minute. The tests carried out are Rockwell hardness testing and tensile tests. From the results of research conducted, it was found that the shape of the indenter pin greatly affects the quality of the weld. The indenter pin changing spiral form results in better weld quality compared to the other two pin shapes.",,2022-06-01 00:00:00.000000000,,"Faculty of Engineering, Universitas Lampung",,public,pub,show,2022-10-26 01:59:19,other,"[{'name': {'honourific': None, 'lineage': None, 'family': 'Irza', 'given': 'Sukmana'}}, {'name': {'given': 'Nur', 'honourific': None, 'lineage': None, 'family': 'Mad'}}, {'name': {'lineage': None, 'family': 'Agus', 'honourific': None, 'given': 'Sugiri'}}, {'name': {'honourific': None, 'family': 'Sugiyanto', 'lineage': None, 'given': 'Sugiyanto'}}, {'name': {'family': 'Irfan', 'lineage': None, 'honourific': None, 'given': 'Hilmy'}}]",he Effect of Pin Shape on the Friction Stir Welding Quality of Aluminum AA1100 Series,published,['TJ'],,http://repository.lppm.unila.ac.id/id/eprint/45961,,['FT7'],disk0/00/04/59/61,2022-10-26 01:59:19,8,irza.sukmana@gmail.com,Journal of Engineering and Scientific Research (JESR),,,,,,,,,,,,,
13,2022-10-25 06:52:24,45952,https://doi.org/10.14716/ijtech.v13i4.4958,archive,,464,,https://ijtech.eng.ui.ac.id/article/view/4958#article,"[{'uri': 'http://repository.lppm.unila.ac.id/id/document/184769', 'pos': 1, 'security': 'public', 'placement': 1, 'eprintid': 45952, 'rev_number': 1, 'language': 'en', 'mime_type': 'application/pdf', 'main': 'IJTech_SJR_Q2_Oct2022_Similarity_Irza.pdf', 'files': [{'datasetid': 'document', 'fileid': 508815, 'mime_type': 'application/pdf', 'hash': '64970b798c3719b89aaefd021f58fd15', 'hash_type': 'MD5', 'mtime': '2022-10-25 04:36:15', 'objectid': 184769, 'filesize': 539923, 'uri': 'http://repository.lppm.unila.ac.id/id/file/508815', 'filename': 'IJTech_SJR_Q2_Oct2022_Similarity_Irza.pdf'}], 'docid': 184769, 'format': 'text'}]",,"Glass-ceramics were fine-grained polycrystalline materials produced by controlled crystallization in the glass phase to have outstanding characteristics. The establishment of basalt from Sukadana - Lampung Province into glass-ceramic begins with the process of reduced size and milled under 200 mesh using an ASTM sieve. The initiated glass-ceramics formation was created by melting the basalt powder at a temperature of 1,250 o C for 2hrs to obtain the glass phase. Glass parent crystallization begins with the stage of nucleation growth. The nucleation process occurs at a temperature 600 o C for 1hr. The crystallization temperature at variations of 850, 950, or 1,050 o C for 3 and 8hrs. The mechanical hardness test result was 637.28 HV1N of the sample with 1,050 o C heating for 3hrs. The highest hardness value is at 837.33 HV1N for a sample of 1,050 o C heating for 8hrs. The hardness value was decreased at samples for 3hrs heating, while it increased for 8hrs of a heating process. All of the heating treatments formed olivine and Anorthite phase but a pyroxene phase was initiated from 950 o C heating process for 3hrs. The use of glass ceramic as an engineering material and biomaterials are promising. It is necessary to continue the development studies on the production process of local basalt resources.",,2022-10-01 00:00:00.000000000,,"Faculty Engineering, University of Indonesia",,public,pub,show,2022-10-25 06:52:24,other,"[{'name': {'family': 'Irza', 'lineage': None, 'honourific': None, 'given': 'Sukmana'}}, {'name': {'honourific': None, 'family': 'Yusuf', 'lineage': None, 'given': 'Hendronursito'}}, {'name': {'given': 'Savetlana', 'honourific': None, 'lineage': None, 'family': 'Shirley'}}, {'name': {'family': 'K.', 'lineage': None, 'honourific': None, 'given': 'Isnugroho'}}, {'name': {'given': 'Amin', 'family': 'M', 'lineage': None, 'honourific': None}}, {'name': {'honourific': None, 'family': 'David C.', 'lineage': None, 'given': 'Birawidha'}}]",Characterization and Potential Production of Glass-Ceramics Biomaterial from Basalt Rock of Local Lampung Province,published,['TJ'],,http://repository.lppm.unila.ac.id/id/eprint/45952,,['FT7'],disk0/00/04/59/52,2022-10-25 06:52:24,8,irza.sukmana@gmail.com,International Journal of Technology,,,,,,,,,,,,,
14,2023-04-03 00:56:54,49553,,archive,,457,,http://ojs3.bkstm.org/index.php/jtmi/article/view/295/143,"[{'mime_type': 'application/pdf', 'language': 'en', 'rev_number': 1, 'format': 'text', 'files': [{'uri': 'http://repository.lppm.unila.ac.id/id/file/537404', 'filename': 'Bukti_Korespondensi_JTMI_April-2022.pdf', 'objectid': 189186, 'filesize': 405639, 'mtime': '2023-04-01 23:06:51', 'hash_type': 'MD5', 'hash': 'df869ce56817cb4dd949371e6c7c2132', 'mime_type': 'application/pdf', 'datasetid': 'document', 'fileid': 537404}], 'main': 'Bukti_Korespondensi_JTMI_April-2022.pdf', 'docid': 189186, 'security': 'public', 'uri': 'http://repository.lppm.unila.ac.id/id/document/189186', 'pos': 1, 'eprintid': 49553, 'placement': 1}]",,"Struktur silinder (tabung) dapat digunakan untuk sistem transportasi antar pulau, dibangun sebagai
terowongan terapung terendam (SFT). Struktur utama SFT adalah tabung berlapis yang digabung dan tali
tambat untuk menahan gaya apung. Kajian ini menyajikan hasil stress assessment pada tabung silinder berlapis
dengan beban tekanan eksternal dari air laut. Pemodelan dan analisis dilakukan dengan metode elemen hingga
menggunakan ANSYS. Tabung terdiri dari tiga lapisan: lapisan terdalam adalah baja setebal 30 mm, lapisan
tengah adalah beton setebal 450 mm dan lapisan terluar adalah aluminium setebal 150 mm. Diameter dalam
dan luar tabung masing-masing adalah 5 m dan 6,26 m. Beban yang diberikan adalah tekanan internal sebesar
101 kPa (1 atm) dan tekanan eksternal hidrostatis pada kedalaman 500 m sebesar 5,35 MPa. Hasil kajian
menunjukkan bahwa hoop stress terbesar terjadi pada lapisan baja, diikuti oleh lapisan aluminium dan lapisan
beton. Untuk radial stress yang merupakan tegangan tekan, nilai terbesar terdapat pada lapisan aluminium dan
nilai yang lebih kecil terdapat pada lapisan terdalam (baja). Untuk tegangan geser, tegangan pada lapisan baja
dan beton jauh lebih kecil dibandingkan dengan tegangan pada lapisan aluminium.",,2022-04-01 00:00:00.000000000,,BKSTM,,public,pub,show,2023-04-03 00:56:54,other,"[{'id': 'asnawi.lubis@eng.unila.ac.id', 'name': {'given': 'Asnawi', 'honourific': None, 'lineage': None, 'family': 'Lubis'}}, {'id': None, 'name': {'honourific': None, 'lineage': None, 'family': 'Rahardian Putra', 'given': 'Muhammad'}}, {'id': 'jamiatul.akmal@eng.unila.ac.id', 'name': {'given': 'Jamiatul', 'family': 'Akmal', 'lineage': None, 'honourific': None}}, {'id': 'novri.tanti@eng.unila.ac.id', 'name': {'given': 'Novri', 'family': 'Tanti', 'lineage': None, 'honourific': None}}, {'name': {'given': 'Ahmad', 'family': 'Suudi', 'lineage': None, 'honourific': None}, 'id': 'ahmad.suudi@eng.unila.ac.id'}]",Stress assessment pada bonding tube dengan beban tekanan eksternal,published,['TJ'],,http://repository.lppm.unila.ac.id/id/eprint/49553,,['FT7'],disk0_bak/00/04/95/53,2023-04-03 00:56:54,8,asnawi.lubis@eng.unila.ac.id,Jurnal Teknik Mesin Indonesia,,,,"[1] E. Budiman, 2017, Construction challenge of 
submerged floating tunnel in Indonesiae. Jurnal
Teknik Sipil Vol 1(2), (pp.1-7). 
[2] H. Østlid, 2010, When is SFT competitive?
Procedia Engineering, 4, 3–11. 
[3] B. Faggiano, R. Landolfo, F. Mazzolani, 2005,
The SFT: an innovative solution for waterway
strait crossing. IABSE Symposium Report,
90(10), 36-42. 
[4] J. Saveur, 1997, Structural Design of
Immersed Tunnels, Tunneling and Underground. Space Technology, vol.12,
93–109.  
[5] F.M. Mazzolani, R. Landolfo, B. Faggiano, M.
Esposto, F. Perotti, & G. Barbella, 2008,
Structural analysis of submerged floating tunnel
prototype in Qiandau Lake (PR of Chine).
Advances in Structural Engineering, 11(4),
(pp.439-454). 
[6] S.P. Timoshenko, and S. Woinowsky-Krieger,
1959, Theory of Plates and Shells. Singapore:
McGraw-Hill Book Co.","struktur silindris, SFT, hoop stress, gaya radial, gaya geser.",,,,,,,,
15,2022-10-26 01:59:55,45969,http://dx.doi.org/10.30811/jpl.v20i2.2961,archive,,464,,http://e-jurnal.pnl.ac.id/polimesin/article/view/2961,"[{'placement': 1, 'eprintid': 45969, 'uri': 'http://repository.lppm.unila.ac.id/id/document/184786', 'pos': 1, 'security': 'public', 'docid': 184786, 'main': 'Polimesin_Aug2022_Arif_Irza_Similarity.pdf', 'files': [{'hash': '076449ae33a7203bd54422ba9c1ea1e1', 'mime_type': 'application/pdf', 'datasetid': 'document', 'fileid': 508948, 'filename': 'Polimesin_Aug2022_Arif_Irza_Similarity.pdf', 'uri': 'http://repository.lppm.unila.ac.id/id/file/508948', 'objectid': 184786, 'filesize': 1110433, 'mtime': '2022-10-25 07:48:57', 'hash_type': 'MD5'}], 'format': 'text', 'language': 'en', 'rev_number': 1, 'mime_type': 'application/pdf'}]",,"The bone implant functions for the load bearing and aims to support the integration of fractured bone. It may increase the strength of the broken bones and also at the same time support bone regeneration and integration. Bone screws are usually attached to the implant plate and bonded to the surface of the fractured bone by screwing the bone screws through the bone structure. In its implementation, a non-degradable implant needs a second operation for the patient to take out the implant. Currently, biomedical researchers are trying to produce bone implants that are degradable or bioresorbable materials. Magnesium (Mg) alloy is a potential biomaterial for bone implants, as Mg is a degradable material. Mg is one of the elements needed and harmless to the human body. This study focuses on finite element analysis (FEA) for the bone screw design of Magnesium alloy that has been well known as a potential candidate for biodegradable bone screw and plate application. The three dimensions (3D) design was done by using Solidworks software, and finite element analysis was performed using ANSYS by calculating the moment, pullout, and force bending received by bone screws. The validatation results of the design carried out with several analytical tests before the production of bone screws is proposed. Th e FEA simulation of bone screws pullout has a total deformation of 0.028 mm and a von Mises stress of 134.25 MPa for a pullout load of 1100 N. The bone screws torsion with a torque of 883 N.mm, the total deformation is 0.988 mm and for bone screws bending with a total deformation of 5,4352 mm has a von Mises stress of 25.706 MPa. AZ31B bone screws, based on the design, are safe and capable of handling the maximum load and deformation during the implantation. In vitro biocompatibility and in vivo studies is needed for further assessment of the design.",,2022-08-01 00:00:00.000000000,,"Department Of Mechanical Engineering, Lhokseumawe State Polytecnic",,public,pub,show,2022-10-26 01:59:55,other,"[{'name': {'family': 'Mahruri Arif', 'lineage': None, 'honourific': None, 'given': 'Wicaksono'}}, {'name': {'lineage': None, 'family': 'Irza', 'honourific': None, 'given': 'Sukmana'}}]",Finite Element Analysis of Magnesium AZ31B Materials for Biodegradable Bone Screw Application,published,['TJ'],,http://repository.lppm.unila.ac.id/id/eprint/45969,,['FT7'],disk0/00/04/59/69,2022-10-26 01:59:55,7,irza.sukmana@gmail.com,Jurnal Polimesin,,,,,,,,,,,,,
