,datestamp,eprintid,id_number,eprint_status,pagerange,userid,number,official_url,documents,refereed,abstract,corp_creators,date,related_url,publisher,issn,full_text_status,ispublished,metadata_visibility,lastmod,type,creators,title,date_type,subjects,volume,uri,publication,divisions,dir,status_changed,rev_number,contact_email,place_of_pub,projects,funders,succeeds,referencetext,keywords,contributors,event_location,event_dates,pres_type,event_type,event_title,pages,patent_applicant
23,2022-11-09 04:30:48,46379,,archive,8-13,418,6.0,http://doi.org/10.23960/jesr.v4i1.102,"[{'main': 'ARTIKEL KOMPOSIT.pdf', 'files': [{'fileid': 512015, 'datasetid': 'document', 'mime_type': 'application/pdf', 'hash': 'b10d28fc4395be00bd197f133411e1b2', 'objectid': 185260, 'filesize': 1453505, 'filename': 'ARTIKEL KOMPOSIT.pdf', 'uri': 'http://repository.lppm.unila.ac.id/id/file/512015', 'hash_type': 'MD5', 'mtime': '2022-11-09 02:25:35'}], 'docid': 185260, 'format': 'text', 'language': 'en', 'mime_type': 'application/pdf', 'rev_number': 1, 'placement': 1, 'eprintid': 46379, 'uri': 'http://repository.lppm.unila.ac.id/id/document/185260', 'pos': 1, 'security': 'public'}]",TRUE,"Annually,  million  tons  of  fly-ash  and  bottom  fly-ash  is  a  waste  of  coal  power plant. Fly ash contains Iron-oxide, alumina and silica. Those hard particle makes fly-ash can be used as a reinforcement in polymer composite. This composite is a wear  resistance  material  and  can  be  used  as  material  for  brake  lining application. Fly ash reinforced phenolic composite has a low specific abrasion. The composite  for brake lining material  consisted of the reinforcement, friction modifier,  solid  lubricant  and  filler.  Graphite  is  used  as  solid  lubricant  while barite is used as filler. Many research were carried out research on the particle size  effect  on  the  composite  mechanical  properties.  However  the  size  different between the constituent in composite has not investigated. Also the optimal barite weight fraction has not being observed. The composite was made by mixing all of the  constituent,  pressing  in  the  mold  and  curing.  The  result  show  that  the graphite particle size ≤ 150 m has the lowest specific abrasion. The observation using  scanning  electron  microscope  shows  that  the  composite  contained  small particle  of  ≤ 56  m  tends  to  agglomerate  than  the  composite  contained  larger particle of ≤ 150 m. the composite contained 15% barite has the lowest specific abrasion.  The  micrograph  of  scanning  electron  microscope  shows  the  mixed  of phenolic and barite evenly covered the graphite and fly-ash particles.  Keywords: barite, graphite, fly-ash, composite polymer, brake lining.",,2022-06-01 00:00:00.000000000,,Faculty of Enginerring University of Lampung,pISSN268-0338 ; eISSN 268-1695,public,pub,show,2022-11-09 04:30:48,article,"[{'id': 'shirley.savetlana@eng.unila.ac.id', 'name': {'given': 'Shirley', 'lineage': None, 'family': 'Savetlana', 'honourific': None}}, {'id': 'zulhanif1973@gmail.cim', 'name': {'given': 'zulhanif', 'honourific': None, 'family': 'Zulhanif', 'lineage': None}}, {'name': {'given': 'Harnowo', 'honourific': None, 'family': 'Supriadi', 'lineage': None}, 'id': 'harnowo1969@gmail.com'}]",The effect of barite addition and graphite particle size on the specific abrasion of fly-ash/phenolic composite for brake lining application,published,['TJ'],4.0,http://repository.lppm.unila.ac.id/id/eprint/46379,Journal of Engineering and Scientific Research (JESR),['FT7'],disk0/00/04/63/79,2022-11-09 04:30:48,6,,,,,,,,,,,,,,,
24,2022-06-12 11:41:30,42326,,archive,,984,1.0,http://nemuinyimah.eng.unila.ac.id/index.php/nemuinyimah/article/view/38,"[{'security': 'public', 'uri': 'http://repository.lppm.unila.ac.id/id/document/164032', 'pos': 1, 'eprintid': 42326, 'placement': 1, 'rev_number': 1, 'language': 'en', 'mime_type': 'application/pdf', 'format': 'text', 'main': 'Sosialisasi Teknologi Hydram Pump di SMK N 1 Gading Rejo.pdf', 'files': [{'datasetid': 'document', 'fileid': 465668, 'hash': '2858cbf4cbcafc48336df44f752be591', 'mime_type': 'application/pdf', 'filesize': 856029, 'objectid': 164032, 'uri': 'http://repository.lppm.unila.ac.id/id/file/465668', 'filename': 'Sosialisasi Teknologi Hydram Pump di SMK N 1 Gading Rejo.pdf', 'hash_type': 'MD5', 'mtime': '2022-06-11 04:00:51'}], 'docid': 164032}]",TRUE,"Pada makalah ini diberikan kegiatan sosialisasi teknologi pompa tanpa motor (hydraulic ram pump) kepada siswa-siswa SMK N 1 Gading Rejo. Materi kegitan yang diberikan secara teori tentang prinsip kerja pompa tanpa motor, pemilihan bahan dan pembuatan komponen-komponen pompa tanpa motor dan praktik yaitu tentang pemasangan dan pengoperasian pompa di lapangan, dan perawatan pompa ini. Berdasarkan kegiatan pelatihan yang dilakukan, dapat dlihat bahwa antusias siswa-siswa dan guru-guru SMK N 1 Gading Rejo mengikuti kegiatan ini sangat baik untuk memperoleh pemahaman pembuatan pompa tanpa motor (hydraulic ram pump). Hal ini terbukti dengan sikap peserta yang serius dan banyak mengajukan pertanyaan saat pelaksanaan pemberian materi teori dan praktek saat kegiatan ini dilaksanakan. Hasil kegiatan ini juga meningkatkan keinginan antusias siswa-siswa dan guru-guru SMK N 1 Gading Rejo untuk mengaplikasikan penggunaan pompa ini untuk membantu irigasi pertanian mereka dengan tetap meminta bantuan bimbingan dari tim pelaksana dari Jurusan Teknik Mesin, Fakultas Teknik, Universitas Lampung. dan juga akan menyebar luaskan informasi teknologi penggunaan pompa tanpa motor ini bagi masyarakat di sekitar tempat tinggal mereka",,2022-04-28 00:00:00.000000000,[{'url': 'http://nemuinyimah.eng.unila.ac.id/index.php/nemuinyimah/article/view/38'}],FT Universitas Lampung,2808-0904,public,pub,show,2022-06-12 11:41:30,article,"[{'name': {'lineage': None, 'family': 'Sinaga', 'honourific': None, 'given': 'Jorfri Boike'}, 'id': 'jorfri6@yahoo.com'}, {'name': {'given': 'muhammad', 'honourific': None, 'lineage': None, 'family': 'irsyad'}, 'id': 'muhammad.irsyad@eng.unila.ac.id'}, {'id': 'mdyan.susila@eng.unila.ac.id', 'name': {'honourific': None, 'family': 'Susila', 'lineage': None, 'given': 'M Dyan'}}, {'id': None, 'name': {'family': 'Sugiman', 'lineage': None, 'honourific': None, 'given': 'Sugiman'}}, {'id': 'randaadmiral@gmail.com', 'name': {'honourific': None, 'family': 'Admiral', 'lineage': None, 'given': 'Randa'}}]",SOSIALISASI TEKNOLOGI POMPA TANPA MOTOR (HYDRAULIC RAM PUMP) UNTUK IRIGASI PERTANIAN BAGI SISWA-SISWA SMK NEGERI 1 GADING REJO,published,['TJ'],2.0,http://repository.lppm.unila.ac.id/id/eprint/42326,Nemui Nyimah: Jurnal Pengabdian kepada Masyarakat,['FT7'],disk0/00/04/23/26,2022-06-12 11:41:30,10,,,,,,,,,,,,,,,
25,2022-10-26 02:00:06,45971,10.26554/sti.2022.7.3.263-268,archive,,464,,https://sciencetechindonesia.com/index.php/jsti/article/view/494/245,"[{'eprintid': 45971, 'placement': 1, 'security': 'public', 'pos': 1, 'uri': 'http://repository.lppm.unila.ac.id/id/document/184788', 'format': 'text', 'docid': 184788, 'main': 'STI_Juli2022_Similarity_Irza.pdf', 'files': [{'fileid': 508962, 'datasetid': 'document', 'mime_type': 'application/pdf', 'hash': '961184b3e4b81b3eee089f7f83ace265', 'objectid': 184788, 'filesize': 1117794, 'filename': 'STI_Juli2022_Similarity_Irza.pdf', 'uri': 'http://repository.lppm.unila.ac.id/id/file/508962', 'hash_type': 'MD5', 'mtime': '2022-10-25 07:59:09'}], 'language': 'en', 'rev_number': 1, 'mime_type': 'application/pdf'}]",,"In medicinal field, delivery agent is a very important substance to improve the efficiency of drug used by improving the stability and preventing the degradation of drug during the medical treatment. Due to these important roles of the drug delivery agent, the search of effective agent is continuously in progress. In this respect, this current research was carried out to synthesize cellulose–polylactic acid (cellulose-PLA), as a potential delivery agent of rifampicin for the curing of tuberculosis. Cellulose was isolated from cassava bagasse, while PLA was obtained from commercial supplier. The two raw materials were used to synthesize cellulose–PLA in 3.5% HCl as solvent under magnetic stirring. The product obtained was then characterized by Fourier-Transform Infrared spectroscopy (FTIR), Particle-Size Analysis (PSA), and Scanning Electron Microscopy (SEM). The FT-IR result showed the presence of hydroxy (3446 to 3429 cm 1 1 7 1 ) and carbonyl (1757 to 1759 cm 1 ), confirming the formation new bond between cellulose and PLA. The PSA characterization displays a particle-sizes of PLA are in the range of 960–92780 nm, while cellulose–PLA are in the range of 100–17730 nm demonstrating that cellulose-PLA combined to form more compact structures. The results of SEM analysis indicate the distinct feature of cellulose-PLA, and combination of the features in the cellulose and PLA image. The results of the dissolution test carried out two different concentrations of rifampicin revealed that the optimum dissolution (8.42%) was achieved with cellulose–PLA of 0.3%, dissolution time of 12 h, and pH of 7.4",,2022-07-01 00:00:00.000000000,,FMIPA Universitas Sriwijaya,,public,pub,show,2022-10-26 02:00:06,other,"[{'name': {'given': 'Yuwono', 'lineage': None, 'family': 'Suripto Dwi', 'honourific': None}}, {'name': {'given': 'Nahrowi', 'family': 'Ridho', 'lineage': None, 'honourific': None}}, {'name': {'honourific': None, 'lineage': None, 'family': 'Andi', 'given': 'Setiawan'}}, {'name': {'given': 'Juliasih', 'honourific': None, 'family': 'Ni Luh Gede Ratna', 'lineage': None}}, {'name': {'lineage': None, 'family': 'Irza', 'honourific': None, 'given': 'Sukmana'}}, {'name': {'honourific': None, 'lineage': None, 'family': 'Wasinton', 'given': 'Simajuntak'}}, {'name': {'lineage': None, 'family': 'Sutopo', 'honourific': None, 'given': 'Hadi'}}]",Synthesis of Cellulose–Polylactic Acid Microcapsule as a Delivery Agent of Rifampicin of Local Lampung Province,published,['TJ'],,http://repository.lppm.unila.ac.id/id/eprint/45971,,['FT7'],disk0/00/04/59/71,2022-10-26 02:00:06,9,irza.sukmana@gmail.com,Science and Technology Indonesia,,,,,,,,,,,,,
26,2023-04-10 00:56:55,49951,EC00202 201389,archive,,869,,https://pdki-indonesia.dgip.go.id/detail/EC00202201389?type=copyright&keyword,"[{'placement': 1, 'eprintid': 49951, 'pos': 1, 'uri': 'http://repository.lppm.unila.ac.id/id/document/189646', 'security': 'public', 'main': 'Buku dan sertifikat hak ciptanya.pdf', 'docid': 189646, 'files': [{'datasetid': 'document', 'fileid': 540719, 'hash': 'f2c39ddbef297936e29bcca876e8e524', 'mime_type': 'application/pdf', 'hash_type': 'MD5', 'mtime': '2023-04-09 06:07:37', 'filesize': 7419198, 'objectid': 189646, 'uri': 'http://repository.lppm.unila.ac.id/id/file/540719', 'filename': 'Buku dan sertifikat hak ciptanya.pdf'}], 'format': 'text', 'language': 'en', 'rev_number': 1, 'mime_type': 'application/pdf'}]",,"Materi yang disajikan dalam buku ini secara umum berkaitan dengan proses produksi. Proses produksi yang diuraikan terkait dengan proses produksi bahan bahan selain logam. Namun sebalumnya disampaikan materi tentang keselamatan dan kesehatan kerja dalam bidang manufaktur. Materi tentang manufaktur bahan non logam mencakup materi materi tentang manufaktur keramik, manufaktur tentang polimer dan komposit. Mengingat komposit menrupakan senyawa antara matrik dan penguat maka pada buku ini akan lebih banyak dibahas masalah penguat yang berhubungan dengan kearifan lokal. Penguat yang sangat melimpah di negara Indonesia adalah serat tandan kosong kelapa sawit (TKKS).","['Jurusan Teknik Mesin Fakultas Teknik Universitas Lampung', 'Jurusan Teknik Sipil Fakultas Teknik Universits Lampung']",2022-01-06 00:00:00.000000000,,,,public,pub,show,2023-04-10 00:56:55,patent,"[{'id': 'tarkono.1970@eng.unila.ac.id', 'name': {'given': 'Tarkono', 'lineage': None, 'family': 'Tarkono', 'honourific': None}}, {'id': 'nandang.1957@eng.unila.ac.id', 'name': {'honourific': None, 'lineage': None, 'family': 'Nandang', 'given': 'Nandang'}}]",Buku Manufaktur Bahan Non Logam,published,['TJ'],,http://repository.lppm.unila.ac.id/id/eprint/49951,,['FT7'],disk0_bak/00/04/99/51,2023-04-10 00:56:55,23,,,,,,,,,,,,,,94.0,Tarkono ; Nandang
27,2022-10-25 02:42:56,45912,EC00202203335,archive,,464,,https://pdki-indonesia.dgip.go.id/detail/EC00202203335?type=copyright&keyword=Cetakan+Manual+Genteng+Beton+Berserat+Tandan+Kosong+Kelapa+Sawit+%28TKKS%29,"[{'security': 'public', 'pos': 1, 'uri': 'http://repository.lppm.unila.ac.id/id/document/184723', 'eprintid': 45912, 'placement': 1, 'rev_number': 1, 'language': 'en', 'mime_type': 'application/pdf', 'format': 'text', 'main': 'Haki_Cetakan_Manual_Genteng_Beton_TKKS_Rarkono_Irza.pdf', 'files': [{'hash_type': 'MD5', 'mtime': '2022-10-24 07:10:33', 'objectid': 184723, 'filesize': 798974, 'filename': 'Haki_Cetakan_Manual_Genteng_Beton_TKKS_Rarkono_Irza.pdf', 'uri': 'http://repository.lppm.unila.ac.id/id/file/508486', 'fileid': 508486, 'datasetid': 'document', 'hash': 'f2f39a488ec5b79d63425b036aa8a7a4', 'mime_type': 'application/pdf'}], 'docid': 184723}]",,"Cetakan manual genteng beton berserat tandan kosong kelapa sawit (TKKS) terdiri dari dua bagian, yaitu cetakan bagian atas  dan cetakan bagian bawah.  Kedua bagian cetakan tersebut    terbuat dari besi cor dengan ukuran 30 cm x 42cm, dengan rongga 1,2 cm, sehingga dapat menghasilkan genteng beton berserat TKKS setebal 1,2 cm. Cetakan dirakit  diatas kerangka yang terbuat dari baja profil U8, dengan ketinggian dari atas lantai 60 cm. Kerangka disambung menggunakan las dan perakitan cetakan dengan rangka menggunakan baut. Mekanisme gerakan cetakan bagian atas untuk  membuka ke atas dan menutup ke bawah menggunakan engsel, sementara cetakan bagian bawah relative tetap (diam berada ditempatnya).   Demikian juga untuk mengeluarkan genteng dari cetakan bagian bawah menggunakan mekanisme engsel dengan bukaan ke kiri dan mengembalikan cetakan bagian bawah untuk siap digunakan lagi. Keunikan cetakan tersebut ada tulisan nama pembuat cetakan genteng yang dimaksud.   Cetakan hanya dapat dioperasikan secara manual.",['FT Unila'],2022-01-14 00:00:00.000000000,,,,public,pub,show,2022-10-25 02:42:56,patent,"[{'name': {'family': 'Tarkono', 'lineage': None, 'honourific': None, 'given': 'Tarkono'}, 'id': 'tarkono_irfan@yahoo.com'}, {'id': 'irza.sukmana@gmail.com', 'name': {'family': 'Sukmana', 'lineage': None, 'honourific': None, 'given': 'Irza'}}]",Cetakan Manual Genteng Beton Berserat Tandan Kosong Kelapa Sawit (TKKS),published,['TS'],,http://repository.lppm.unila.ac.id/id/eprint/45912,,['FT7'],disk0/00/04/59/12,2022-10-25 02:42:56,7,,,,,,,,,,,,,,,Tarkono; Irza Sukmana; dan Nandang
28,2023-01-26 01:38:36,48026,,archive,152-155,423,3.0,http://jss.lppm.unila.ac.id/index.php/ojs/article/view/378/251,"[{'eprintid': 48026, 'placement': 1, 'security': 'public', 'uri': 'http://repository.lppm.unila.ac.id/id/document/187189', 'pos': 1, 'format': 'text', 'main': '378-1-904-1-10-20221208.pdf', 'files': [{'hash': '5d539c6009cacf5d538bb475babb0c28', 'mime_type': 'application/pdf', 'datasetid': 'document', 'fileid': 525181, 'uri': 'http://repository.lppm.unila.ac.id/id/file/525181', 'filename': '378-1-904-1-10-20221208.pdf', 'objectid': 187189, 'filesize': 171799, 'mtime': '2023-01-26 00:01:01', 'hash_type': 'MD5'}], 'docid': 187189, 'language': 'en', 'mime_type': 'application/pdf', 'rev_number': 1}]",FALSE,"Kelompok UMKM Swakarya yang berlokasi di Desa Rulung Sari, Lampung Selatan merupakan suatu industri rumah tangga yang memproduksi berbagai olahan keripik. Kelompok Swakarya ini adalah salah satu UMKM yang dirintis mulai tahun 2020. Saat itu, awal terjadinya kelesuan perekonomian, dikarenakan terjadinya pandemi Covid 19, sehingga timbul ide untuk berjualan produk olahan yaitu keripik pisang dan keripik singkong. Permasalahan yang ada di mitra UMKM Swakarya ini adalah produk keripik berubah menjadi tidak keras seperti keripik pada umumnya karena produk tidak ditiriskan minyaknya secara sempurna dengan alat peniris, sehingga produk tidak tahan disimpan lebih lama. Tim Unila memberikan solusi dengan menerapkan alat teknologi tepat guna alat peniris minyak. Dalam pembuatan produk keripik ini, setelah digoreng, maka untuk meniriskan minyak digunakan alat spinner agar produk keripik memiliki kandungan minyak sedikit dan siap untuk dikemas serta dipasarkan. Dengan pemberian bantuan alat spinner, alat untuk peniris minyak, diharapkan meningkatkan kapasitas produksi keripik dan kualitas keripik yang dihasilkan oleh mitra menjadi lebih baik.
         
Kata kunci: teknologi tepat guna; alat peniris minyak; keripik","['Jurusan Teknik Mesin, Fakultas Teknik, Universitas Lampung', 'Jurusan Teknik Kimia, Fakultas Teknik, Universitas Lampung', 'Jurusan Teknik Kimia, Fakultas Teknik, Universitas Lampung']",2022-11-30 00:00:00.000000000,,LPPM UNILA,2550-1089,public,pub,show,2023-01-26 01:38:36,article,"[{'name': {'lineage': None, 'family': 'Wardono', 'honourific': None, 'given': 'Herry'}, 'id': 'herryw22@gmail.com'}, {'id': 'simparmin@gmail.com', 'name': {'lineage': None, 'family': 'Ginting', 'honourific': None, 'given': 'Simparmin'}}, {'id': 'herti.utami@eng.unila.ac.id', 'name': {'honourific': None, 'lineage': None, 'family': 'Utami', 'given': 'Herti'}}]","Penerapan Teknologi Alat Spinner pada Produk Olahan Keripik UMKM Swakarya di Desa Rulung Sari, Lampung Selatan",published,['TJ'],6.0,http://repository.lppm.unila.ac.id/id/eprint/48026,Jurnal Sakai Sambayan,['FT7'],disk0_bak/00/04/80/26,2023-01-26 01:38:36,6,,,,,,,,,,,,,,,
29,2022-09-05 01:26:22,44677,,archive,,121,,,,,"Jalan merupakan infrastruktur yang penting dalam menunjang kemajuan suatu wilayah. Survey kondisi jalan merupakan salah satu aspek kegiatan dalampemeliharaan jalan tujuannya agar jalan dapat terpelihara dan terawasi. Kegiatan survey kondisi jalan dapat memanfaatkan teknologi fotogrametri menggunakan wahana tanpa awak dengan kamera non metrik karena dapat menyediakan data detail/situasi jalan dan cukup efektif dalam menunjang pekerjaan survey kondisi jalan. Detail/situasi jalan dapat diidentifikasi berdasarkan orthophoto yang dihasilkan melalui pengolahan data foto dari kegiatan pemotretan udara. Penelitian ini bertujuan untuk mengetahui ketelitian geometri orthophoto. Data yang digunakan dalam pengujian menggunakan hasil pengolahan foto udara berupa orthophoto. Metode yang digunakan dalam menguji akurasi geometrik orthophoto merujuk pada Peraturan Kepala Badan Informasi Geospasial No 8 tahun 2018. Hasil uji akurasi geometri horizontal (CE90) sebesar 0,018 (RMSE 0,012) dan vertikal (LE90) sebesar 0,026m (RMSE 0,016). Sehingga dinyatakan orthophoto ini memiliki ketelitian horizontal sebesar 0,018meter dan ketelitian vertikal sebesar 0,026m. Kelas ketelitian horizontal orthophoto adalah kelas 1 dan kelas ketelitian vertikal orthophoto ini adalah kelas 1",,2022-03-07 00:00:00.000000000,,Syintax Literate Jurnal Ilmiah Indonesia,,none,pub,show,2022-09-05 01:26:22,other,"[{'name': {'lineage': None, 'family': 'dewi', 'honourific': None, 'given': 'citra'}}, {'name': {'given': 'rahma', 'honourific': None, 'lineage': None, 'family': 'anisa'}}, {'name': {'given': 'romi', 'family': 'fadly', 'lineage': None, 'honourific': None}}, {'name': {'family': 'artini', 'lineage': None, 'honourific': None, 'given': 'sri rezki'}}]",KAJIAN AKURASI GEOMETRI ORTHOPHOTO DARI AKUISISI DATA PESAWAT TANPA AWAK.,published,"['T1', 'TE']",,http://repository.lppm.unila.ac.id/id/eprint/44677,,['FT7'],disk0/00/04/46/77,2022-09-05 01:26:22,8,,,,,,,,,,,,,,,
