,documents,official_url,lastmod,userid,pagerange,metadata_visibility,eprintid,eprint_status,datestamp,event_location,refereed,event_dates,title,creators,pres_type,type,date,uri,abstract,subjects,event_title,rev_number,ispublished,status_changed,full_text_status,event_type,divisions,dir,number,volume,date_type,issn,publication,publisher,contact_email,contributors,corp_creators,succeeds,funders
0,"[{'main': 'Ari Nurweni Prosiding Lamas 2011.docx', 'files': [{'fileid': 23374, 'datasetid': 'document', 'mime_type': 'application/vnd.openxmlformats-officedocument.wordprocessingml.document', 'hash': 'f4331cd116121d21251bbad4fe329fc7', 'objectid': 3244, 'filesize': 16558148, 'filename': 'Ari Nurweni Prosiding Lamas 2011.docx', 'uri': 'http://repository.lppm.unila.ac.id/id/file/23374', 'hash_type': 'MD5', 'mtime': '2017-06-05 03:22:36'}], 'docid': 3244, 'format': 'text', 'language': 'en', 'mime_type': 'application/vnd.openxmlformats-officedocument.wordprocessingml.document', 'rev_number': 1, 'placement': 1, 'eprintid': 3362, 'pos': 1, 'uri': 'http://repository.lppm.unila.ac.id/id/document/3244', 'security': 'public'}]","http://www.mli.undip.ac.id/library/ebook/2/International Proceeding July, 2011/",2017-06-12 02:29:47,717,113-117,show,3362,archive,2017-06-12 02:29:47,"Master's Program in Linguistics, Diponegoro University",TRUE,"July 2, 2011",THE SHRINKAGE OF JAVANESE VOCABULARY,"[{'name': {'given': 'Ari', 'honourific': None, 'lineage': None, 'family': 'Nurweni'}, 'id': 'nurweniari@gmail.com'}]",poster,conference_item,1970-01-01 00:00:00.000002011,http://repository.lppm.unila.ac.id/id/eprint/3362,"Previous studies show that Javanese shrinks in terms of its form, function, and accuracy due to Indonesian and the attitude of the Javanese speakers towards Indonesian and Javanese (Poedjosoedarmo, 1991; Gunarwan, 2006). In regard to the causes of the shrinkage of Javanese, there is at least one more thing that leads to the shrinkage. This paper presents the results of an observation to the Javanese vocabulary items used in the daily life of Javanese speakers. The study aims at describing some Javanese words which are likely to fade away due to a technological advance, and explaining the impact to the existence of the local virtues. The description is based on the observation toward the things around the Javanese people in an area of Jawa Tengah to fulfill their daily needs and the words to express them at present, and then compared them with those noticed in 1970s and recalled by the writer. The results showed that though the vocabulary items of Javanese language were enriched by the vocabulary items of other languages, at the same time some Javanese words commonly used in the daily life are likely to disappear from the daily use. The disappearance of the Japanese words also means the vanishing of the things associated with the words and the related local virtues.",['PL'],International Seminar Language Maintenance and Shift,7,pub,2017-06-12 02:29:47,public,other,['FKIP1'],disk0/00/00/33/62,,,,,,,,,,,
1,"[{'rev_number': 1, 'language': 'en', 'mime_type': 'application/pdf', 'format': 'text', 'files': [{'fileid': 112507, 'datasetid': 'document', 'hash': 'dd15ba789ca46cbffa7b72c61b949c6e', 'mime_type': 'application/pdf', 'hash_type': 'MD5', 'mtime': '2019-05-10 21:57:13', 'filesize': 1875659, 'objectid': 25704, 'uri': 'http://repository.lppm.unila.ac.id/id/file/112507', 'filename': 'Jurnal Cadence.pdf'}], 'main': 'Jurnal Cadence.pdf', 'docid': 25704, 'security': 'public', 'pos': 1, 'uri': 'http://repository.lppm.unila.ac.id/id/document/25704', 'eprintid': 5617, 'placement': 1}]",,2019-05-14 02:00:42,459,91-105,show,5617,archive,2019-05-14 02:00:42,,TRUE,,Teknik Permainan Kata dan Kalimat dalam Pembelajaran Structure Grammaticale bagi Peserta Kursus Bahasa Perancis di UPT Balai Bahasa Universitas Lampung,"[{'id': 'ndianarosita@ymail.com', 'name': {'family': 'Rosita', 'lineage': None, 'honourific': None, 'given': 'Diana'}}]",,article,2011-10-15 00:00:00.000000000,http://repository.lppm.unila.ac.id/id/eprint/5617,"This research aim to (1) describe the ability of structure grammaticale from course student before and after study by using word and sentence’s game technique; ( 2) know the use of word and sentence’s game technique to make course student easier in mastering grammaticale structure of French; (3) know the effectiveness of this technique to improve mastering grammaticale structure. Method used is sham experiment method (quasi experiment) using only one group. Population is Débutant class, academic year 2010/2011, while the sample are 16 course students taken randomly. The result were: 1) means of pretest was 14,31 and means of post test was 18,75, (2) by using t-test between the scores of the pretest and post test, the t-ratio achieved was 7,77 with the significant level 99,9%. With the db value 15, the t-tabel achieved was 3,73. The t-ratio was higher than the tabel (7,77>3,73). Therefore, there was a significant increase between students’achievement in the pretest and post test.   
Key Words : Game of Word and Sentences Technique, Structure,Grammaticale, Course Student",['LC5201'],,6,pub,2019-05-14 02:00:42,public,,['FKIP1'],disk0/00/00/56/17,2.0,1.0,published,2087-9849,Jurnal Ilmu Pendidikan,FKIP Universitas Lampung,,,,,
2,"[{'security': 'public', 'pos': 1, 'uri': 'http://repository.lppm.unila.ac.id/id/document/42744', 'eprintid': 28689, 'placement': 1, 'mime_type': 'application/pdf', 'language': 'en', 'rev_number': 1, 'format': 'text', 'main': 'The Implementation of Iteman to Improve The Quality of English Test Items as a Foreign Language (an assesment analysis).pdf', 'docid': 42744, 'files': [{'hash_type': 'MD5', 'mtime': '2021-03-29 08:32:25', 'objectid': 42744, 'filesize': 3633099, 'filename': 'The Implementation of Iteman to Improve The Quality of English Test Items as a Foreign Language (an assesment analysis).pdf', 'uri': 'http://repository.lppm.unila.ac.id/id/file/254540', 'fileid': 254540, 'datasetid': 'document', 'mime_type': 'application/pdf', 'hash': '974c09e9771b1501d256c4ea86a19b53'}]}]",,2021-03-30 04:13:33,783,85-96,show,28689,archive,2021-03-30 04:13:33,,TRUE,,The Implementation of Iteman to Improve The Quality of English Test Items as a Foreign Language (an assesment analysis),"[{'name': {'given': 'Ujang', 'honourific': None, 'family': 'Suparman', 'lineage': None}, 'id': 'ujang.suparman@fkip.unila.ac.id'}]",paper,article,2011-04-01 00:00:00.000000000,http://repository.lppm.unila.ac.id/id/eprint/28689,,['L1'],,9,pub,2021-03-30 04:13:33,public,,['FKIP1'],disk0/00/02/86/89,1.0,12.0,published,1411-20151,AKSARA,Jurusan Pendidikan Bahasa dan Seni FKIP Universitas Lampung,ujang.suparman@fkip.unila.ac.id,,,,
3,"[{'eprintid': 30022, 'placement': 1, 'security': 'public', 'uri': 'http://repository.lppm.unila.ac.id/id/document/134769', 'pos': 1, 'format': 'text', 'main': 'UJANG S - STUDI KOMPARATIF KEMAMPUAN MEMBACA.pdf', 'docid': 134769, 'files': [{'mime_type': 'application/pdf', 'hash': '26f366a0f776e8af4b7434d5926236ba', 'fileid': 355901, 'datasetid': 'document', 'uri': 'http://repository.lppm.unila.ac.id/id/file/355901', 'filename': 'UJANG S - STUDI KOMPARATIF KEMAMPUAN MEMBACA.pdf', 'filesize': 2133321, 'objectid': 134769, 'mtime': '2021-05-06 03:24:25', 'hash_type': 'MD5'}], 'language': 'en', 'rev_number': 1, 'mime_type': 'application/pdf'}]",,2021-05-06 06:47:35,783,490-501,show,30022,archive,2021-05-06 06:47:35,"Bandar Lampung, Indonesia",TRUE,29-30 Januari 2011,STUDI KOMPARATIF TENTANG KEMAMPUAN MEMBACA MAHAS'SWA PS. BAHASA INGGRIS ANTARA MEREKA YANG BELAJAR DENGAN MENGGUNAKAN ALFHE DAN YANG TIDAK MENGGUNAKAN ALFHE,"[{'id': 'ujang.suparman@fkip.unila.ac.id', 'name': {'given': 'Ujang', 'honourific': None, 'family': 'Suparman', 'lineage': None}}]",paper,conference_item,2011-01-01 00:00:00.000000000,http://repository.lppm.unila.ac.id/id/eprint/30022,"The Of for higher and contextual teaching and learning (CTL) in teaching reading comprehension. ALFHE in this research was used BS B reading technique in which the readers were asked to learn collaboratively in small groups Of five. Meanwhle, another technique (CTL) was focused on understanding the ideas conveyed in a text b'sed on a certain context where participants learned individually. The problems of the research ""'em, Is there any significant d,'Verence Of students' reading comprehension achievement between those who were tauØt through active learning for higher education (ALFHE) and those taught through CTL technique? • and •Is teaching reading comprehension through acffve 'earning for higher education (ALFHE) technique more effective than through CTL technique’.  The objectives of the regggrch wore to find out Mlether thoro was significant difference Of students reading comprehension achievement between the students Who taught through active learning for higher education (ALFHE) and those teught through CTL technique and to determine Which one of the two techniques was more effective applied in teaching reading comprehension at the English Department, Lampung Un,Versity. Based on the data analysis, the result in experimental class showed that there was a meaningful increase Of students' mading comprehension achievement by p Meanwhile, the result in control class showed that there was no significant increase 01 students' reading comprehension achievement p>0.28B). It indicated that effective learning for higher education (ALFHE) technique could be used to Increase students' reading compmhension. The students' average sc.ore who taught through ALFHE technique were higher than those taught through CTL technique. So teaching reading comprehension through ALFHE technique 'VBS more effective than through conventional technique.",['LB2300'],Seminar Nasional Pendidikan Tahun 2011,7,pub,2021-05-06 06:47:35,public,conference,['FKIP1'],disk0/00/03/00/22,,,published,,,,,[{'type': 'http://www.loc.gov/loc.terms/relators/AUT'}],['Prodi S1 Pendidikan Bahasa Inggris'],,
4,"[{'security': 'public', 'pos': 1, 'uri': 'http://repository.lppm.unila.ac.id/id/document/138845', 'eprintid': 30774, 'placement': 1, 'language': 'en', 'rev_number': 2, 'mime_type': 'application/pdf', 'format': 'text', 'main': 'studi komparatif tentang kemampuan membaca mahasiswa program studi bahasa Inggris antara mereka yang belajar dengan menggunakan alphe dan yang tidak menggunakan alphe.pdf', 'files': [{'filename': 'studi komparatif tentang kemampuan membaca mahasiswa program studi bahasa Inggris antara mereka yang belajar dengan menggunakan alphe dan yang tidak menggunakan alphe.pdf', 'uri': 'http://repository.lppm.unila.ac.id/id/file/364999', 'filesize': 9383378, 'objectid': 138845, 'mtime': '2021-03-29 08:29:49', 'hash_type': 'MD5', 'mime_type': 'application/pdf', 'hash': '4d6f5e3284e8c0f57063fd0516153ecf', 'fileid': 364999, 'datasetid': 'document'}], 'docid': 138845}, {'placement': 6, 'eprintid': 30774, 'uri': 'http://repository.lppm.unila.ac.id/id/document/138850', 'pos': 6, 'formatdesc': 'Reviewer', 'security': 'public', 'main': '11.pdf', 'files': [{'mtime': '2021-05-25 08:31:11', 'hash_type': 'MD5', 'uri': 'http://repository.lppm.unila.ac.id/id/file/365005', 'filename': '11.pdf', 'objectid': 138850, 'filesize': 1146154, 'mime_type': 'application/pdf', 'hash': '9ba9f348da96063ed920eb01fa8fa0b9', 'datasetid': 'document', 'fileid': 365005}], 'docid': 138850, 'format': 'text', 'language': 'en', 'rev_number': 2, 'mime_type': 'application/pdf'}]",,2021-05-27 02:32:35,783,490-501,show,30774,archive,2021-05-27 02:32:35,FKIP Universitas Lampung dan HEPI,TRUE,29 Januari 2011,studi komparatif tentang kemampuan membaca mahasiswa program studi bahasa Inggris antara mereka yang belajar dengan menggunakan alphe dan yang tidak menggunakan alphe,"[{'name': {'given': 'Ujang', 'honourific': None, 'lineage': None, 'family': 'Suparman'}, 'id': 'ujang.suparman@fkip.unila.ac.id'}]",paper,conference_item,2011-01-29 00:00:00.000000000,http://repository.lppm.unila.ac.id/id/eprint/30774,,['L1'],Seminar Nasional Pendidikan 2011,6,pub,2021-05-27 02:32:35,public,conference,['FKIP1'],disk0/00/03/07/74,,,published,,,,,,,28688.0,
5,"[{'uri': 'http://repository.lppm.unila.ac.id/id/document/41851', 'pos': 1, 'security': 'public', 'placement': 1, 'eprintid': 27874, 'language': 'en', 'rev_number': 1, 'mime_type': 'application/vnd.openxmlformats-officedocument.wordprocessingml.document', 'files': [{'mime_type': 'application/vnd.openxmlformats-officedocument.wordprocessingml.document', 'hash': 'b91548f67afdcf1fd99effa4c0dc5625', 'fileid': 248395, 'datasetid': 'document', 'mtime': '2021-02-14 15:10:35', 'hash_type': 'MD5', 'uri': 'http://repository.lppm.unila.ac.id/id/file/248395', 'filename': 'The Vocabulary of Elishconomics and Academics Eng.docx', 'objectid': 41851, 'filesize': 47201}], 'main': 'The Vocabulary of Elishconomics and Academics Eng.docx', 'docid': 41851, 'format': 'text'}]",,2021-02-15 01:19:33,1049,50-58,show,27874,archive,2021-02-15 01:19:33,,TRUE,,THE VOCABULARY OF ECONOMICS AND ACADEMIC ENGLISH,"[{'name': {'honourific': None, 'lineage': None, 'family': 'Sutarsyah', 'given': 'Cucu'}}]",,article,2011-12-03 00:00:00.000000000,http://repository.lppm.unila.ac.id/id/eprint/27874,"Identifying the features of the text is useful in order to determine the most important aspects to teach especially for English for specific purposes. One possible way of doing this is by looking at the vocabulary needed by learners when reading a text. This research especially examines the vocabulary used in an economics text for the first year university students and compares it with another corpus of similar length. These two corpora have different features. The economics text is by one writer and is one general topic – Economics, and was written so that it forms a coherent continuous text. The general academic English corpus was made up 160 two-thousand-words texts by many different writers on diverse topics, across a wide range of academic disciplines. 
	The most striking difference between the two texts was the number of word-forms and word families each contained. The economics text consisted of 9,469 different words forming 5,438 word families. The academic English corpus, although roughly the same length as the economics corpus, consisted of over twice as many as word-forms and word families, namely 21,399 different word-forms and 12,744 word families.
	In the economics text a few content words were extremely frequent. In the most frequent 100 words, there were 34 words like price, cost, demand, firm, supply, etc., which occurred with at least seven times the frequency of their occurrence in general academic English. The total difference in their frequency of occurrence accounted for 32,214 tokens which equaled 10.91% of the tokens in the economics text. This 10.91% coverage easily accounted for the coverage of the extra word types and families in the general academic corpus.
	It was also found that 60.9% of the 5,438 word families in the economics text occurred in the general academic corpus. The remaining 2,124 words did not occur in the general academic English corpus. Only 5.4% of the non-overlapping words were technical words occurring in a dictionary of economics. It was possible to use frequency and range of occurrence as a statistical means of isolating technical words, but there were still problems with such an approach, particularly for low-frequency technical words.
	It is apparent that continuous economics text was better for reading and vocabulary learning than the general academic corpus because the economics text had a smaller vocabulary and less very-low-frequency words.

Key words: vocabulary. Economics corpus, academic English corpus, frequency of occurrences",['L1'],,6,pub,2021-02-15 01:19:33,public,,['FKIP1'],disk0/00/02/78/74,2.0,1.0,published,978-60219105-1-1,Atma Jaya Conference on Corpus study,Graduate School Atma Jaya Cattholic UNIVERSITY,pkbb@atmajaya.ac.id,,,,['UNIVERSITAS KATOLIK ATMA JAYA']
6,"[{'language': 'en', 'mime_type': 'application/pdf', 'rev_number': 1, 'format': 'text', 'main': '04-Desain Kurikulum (paper).pdf', 'files': [{'filename': '04-Desain Kurikulum (paper).pdf', 'uri': 'http://repository.lppm.unila.ac.id/id/file/417781', 'filesize': 2058296, 'objectid': 156984, 'mtime': '2021-11-11 05:43:38', 'hash_type': 'MD5', 'mime_type': 'application/pdf', 'hash': 'ebaa3c34bf76e3f453dbd9c9101041c7', 'fileid': 417781, 'datasetid': 'document'}], 'docid': 156984, 'security': 'public', 'uri': 'http://repository.lppm.unila.ac.id/id/document/156984', 'pos': 1, 'eprintid': 36042, 'placement': 1}]",http://jurnal.fkip.unila.ac.id/index.php/jpp/article/view/22289/pdf,2021-11-11 06:55:04,783,94-100,show,36042,archive,2021-11-11 06:55:04,,TRUE,,Desain Kurikuluim dan Silabus bahasa Inggris untuk RSNBI di Provinsi Lampung,"[{'name': {'given': 'Suparman', 'honourific': None, 'family': 'Ujang', 'lineage': None}, 'id': 'ujang.suparman@fkip.unila.ac.id'}]",,article,1970-01-01 00:00:00.000002011,http://repository.lppm.unila.ac.id/id/eprint/36042,"Penelitian ini mengkaji komponcn-komponen penting tentang RSNBI yang mencerminkan pelaksanaan program pemerinlah. Penelitian ini difokuskan pada kajian desain kurikulum dan silabus Bahasa Inggris di tingkat SMP di Provinsi Lampung. Penelitian ini bersifat kualitatif. Hasil penelitian menunjukkan bahwa kurikulum yang diterapkan di RSNBI Lampung masih perlu dikembangkan. Secara umum, kurikulum tersebut masih sulit untuk diterapkan karena faktor sumberdaya manusianya belum siap, Mayoritas guru (75%) masih sangat lemah dalam penguasaan Bahasa Inggris yang merupakan bahasa pengantarnya. Hanya satu dari empat orang guru yang memiliki nilal TOEFL yang tinggi direkomendasikan bahwa pemerintah hendaknya mengembangkan kualitas SDM-nya, dalam pengnsaan Bahasa Inggris para guru.",['PE'],,6,pub,2021-11-11 06:55:04,public,,['FKIP1'],disk0/00/03/60/42,1.0,1.0,published,2087-9849,Jurnal Pendidikan Progresif,Unit Database dan Publikasi Ilmiah FKIP kerjasama dengan ISPI,,[{'type': 'http://www.loc.gov/loc.terms/relators/AUT'}],['Program Studi S1 Pendidikan Bahasa Inggris'],,
7,"[{'main': 'linguitika-SM.pdf', 'files': [{'uri': 'http://repository.lppm.unila.ac.id/id/file/59968', 'filename': 'linguitika-SM.pdf', 'objectid': 19419, 'filesize': 542356, 'mtime': '2018-02-14 03:22:00', 'hash_type': 'MD5', 'hash': 'faf5a0dcb9e1046e7ef65455fc319763', 'mime_type': 'application/pdf', 'datasetid': 'document', 'fileid': 59968}], 'docid': 19419, 'format': 'text', 'language': 'en', 'mime_type': 'application/pdf', 'rev_number': 1, 'placement': 1, 'eprintid': 6477, 'pos': 1, 'uri': 'http://repository.lppm.unila.ac.id/id/document/19419', 'security': 'public'}]",http://www.ubl.ac.id/perpustakaan/118-jurnal/1382-linguistika.html,2018-02-28 08:02:38,915,,show,6477,archive,2018-02-28 08:02:38,,TRUE,,Analysis Of Classroom Interaction In Speaking Class At A Senior High School In Bandar Lampung,"[{'id': 'heryyufrizal@gmail.com', 'name': {'given': 'Hery', 'honourific': None, 'family': 'Yufrizal', 'lineage': None}}, {'name': {'given': 'nanda', 'honourific': None, 'lineage': None, 'family': 'Riyanti'}, 'id': 'nandariyanti@yahoo.com'}]",,article,2011-05-01 00:00:00.000000000,http://repository.lppm.unila.ac.id/id/eprint/6477,"his study compares patterns of interactions among teachers and students in all 
English speaking class by using three different newspaper topics: political, economy and 
entertainment. The subject of the research was 31 students of a senior high school in 
Bandar Lampung. The result shows that three were differences in the patterns of interaction 
when learners were given three different newspaper article topics. The differences were 
found in terms of the patterns of interactions among teacher-students, and students-students 
as well at kinds of interactional contribution categories. This suggests that using various 
topics from various sources of materials provided good stimulus for learners to practice their 
English in the classroom. The closer the topic to the learners daily interest the more they will 
likely to actively involve in the interactions.",['L1'],,6,pub,2018-02-28 08:02:38,public,,['FKIP1'],disk0/00/00/64/77,1.0,2.0,published,2087-2097,LINGUISTIKA,Program Studi Pendidikan bahasa Inggris Fakultas Keguruan dan Ilmu Pendidikan Universitas Bandar Lampung,,"[{'id': 'heryyufrizal@gmail.com', 'name': {'given': 'Hery', 'honourific': None, 'lineage': None, 'family': 'Yufrizal'}, 'type': 'http://www.loc.gov/loc.terms/relators/AUT'}, {'type': None, 'name': {'family': 'Riyanti', 'lineage': None, 'honourific': None, 'given': 'Nanda'}, 'id': 'nandariyanti@yahoo.com'}]","['Universitas Lampung', 'Universitas Lampung']",,
