,metadata_visibility,datestamp,eprint_status,eprintid,official_url,lastmod,documents,contributors,userid,number,title,refereed,creators,type,subjects,uri,date,abstract,volume,related_url,publisher,publication,divisions,dir,ispublished,rev_number,full_text_status,status_changed,issn,succeeds,date_type,id_number,pagerange,corp_creators,referencetext,note,pages,isbn,contact_email,keywords,event_dates,pres_type,event_location,event_title,funders,event_type,editors
24,show,2022-02-04 07:50:49,archive,39007,http://www.ojs.unito.it/index.php/kervan/article/view/3318,2022-02-04 07:50:49,"[{'pos': 1, 'uri': 'http://repository.lppm.unila.ac.id/id/document/160274', 'formatdesc': 'Artikel', 'security': 'public', 'placement': 1, 'eprintid': 39007, 'language': 'en', 'mime_type': 'application/pdf', 'rev_number': 4, 'files': [{'hash': 'd247132c07099e292a5b6e389388b2ca', 'mime_type': 'application/pdf', 'fileid': 440135, 'datasetid': 'document', 'mtime': '2019-11-07 15:27:14', 'hash_type': 'MD5', 'filename': '2_A Study on EFL Learners’ Belief about Translation_Kervan 23(1).pdf', 'uri': 'http://repository.lppm.unila.ac.id/id/file/440135', 'objectid': 160274, 'filesize': 203864}], 'main': '2_A Study on EFL Learners’ Belief about Translation_Kervan 23(1).pdf', 'docid': 160274, 'format': 'text'}, {'formatdesc': 'Reviewer', 'security': 'public', 'uri': 'http://repository.lppm.unila.ac.id/id/document/160280', 'pos': 7, 'eprintid': 39007, 'placement': 7, 'language': 'en', 'mime_type': 'application/pdf', 'rev_number': 3, 'format': 'text', 'files': [{'hash': '3e02c6b9c48f3c16c17dda9d2f3c1b96', 'mime_type': 'application/pdf', 'fileid': 440141, 'datasetid': 'document', 'mtime': '2022-01-21 07:40:14', 'hash_type': 'MD5', 'filename': 'A Study on EFL Learners Belief About Translation as a Learning Strategy in Indonesia.pdf', 'uri': 'http://repository.lppm.unila.ac.id/id/file/440141', 'objectid': 160280, 'filesize': 1099349}], 'main': 'A Study on EFL Learners Belief About Translation as a Learning Strategy in Indonesia.pdf', 'docid': 160280}, {'pos': 8, 'uri': 'http://repository.lppm.unila.ac.id/id/document/160283', 'formatdesc': 'Similaritas', 'security': 'public', 'placement': 8, 'eprintid': 39007, 'mime_type': 'application/pdf', 'language': 'en', 'rev_number': 2, 'files': [{'datasetid': 'document', 'fileid': 440150, 'hash': '853b8d60f2ba6038fa7e31aa6f504eb4', 'mime_type': 'application/pdf', 'hash_type': 'MD5', 'mtime': '2022-02-04 03:06:43', 'filesize': 2676205, 'objectid': 160283, 'filename': '7 A Study on EFL Learners’ Belief about Translation as a Learning Strategy in Indonesia (1) (1).pdf', 'uri': 'http://repository.lppm.unila.ac.id/id/file/440150'}], 'main': '7 A Study on EFL Learners’ Belief about Translation as a Learning Strategy in Indonesia (1) (1).pdf', 'docid': 160283, 'format': 'text'}]",,1177,1.0,A Study on EFL Learners’ Belief about Translation as a Learning Strategy in Indonesia,TRUE,"[{'id': 'gputrawan08@gmail.com', 'name': {'lineage': None, 'family': 'PUTRAWAN', 'honourific': None, 'given': 'GEDE EKA'}}, {'id': None, 'name': {'family': 'Mustika', 'lineage': None, 'honourific': None, 'given': 'I Wayan'}}, {'name': {'lineage': None, 'family': 'Riadi', 'honourific': None, 'given': 'Bambang'}, 'id': 'bambangriadi.br@gmail.com'}]",article,"['H1', 'L1', 'LB1501', 'LC5201', 'P1']",http://repository.lppm.unila.ac.id/id/eprint/39007,2019-05-31 00:00:00.000000000,"Although it sounds controversial, the practice of foreign language learning tends to consist of the use of translation. Therefore, the main aims of this study
are to investigate EFL learners’ belief about translation, the use of translation as their EFL learning strategy, and to find out the correlation between their belief about translation and the use of translation as their EFL learning strategy. This study was conducted through a quantitative approach in which the data were
collected by using two kinds of questionnaires. Based on the findings, Indonesian EFL learners believe that translation helps them acquire English skills and other English language aspects. They use translation as their language learning strategy for learning EFL skills and aspects such as speaking, reading, writing, listening, vocabulary, grammar, and idioms and phrases. This study
also reveals that there is a correlation between EFL learners’ belief about translation and their use of translation as an EFL learning strategy.",23,"[{'url': 'http://www.ojs.unito.it/index.php/kervan/index', 'type': 'pub'}]","Universita degli Studi di Torino, Facolta di Lingue e Letterature Straniere",Kervan -  International Journal of Afro-Asiatic Studies,['FKIP1'],disk0/00/03/90/07,pub,6,public,2022-02-04 07:50:49,1825-263X,38204.0,published,,235-249,,,,,,,,,,,,,,
25,show,2019-11-15 02:39:35,archive,16491,http://icon-eltl.unila.ac.id/,2019-11-15 02:39:35,"[{'placement': 1, 'eprintid': 16491, 'uri': 'http://repository.lppm.unila.ac.id/id/document/29574', 'pos': 1, 'security': 'public', 'files': [{'hash': 'e4cfac5cfce307ede751ea00a031a863', 'mime_type': 'application/vnd.openxmlformats-officedocument.wordprocessingml.document', 'fileid': 140816, 'datasetid': 'document', 'mtime': '2019-11-14 22:31:45', 'hash_type': 'MD5', 'uri': 'http://repository.lppm.unila.ac.id/id/file/140816', 'filename': 'anggi.docx', 'filesize': 38906, 'objectid': 29574}], 'main': 'anggi.docx', 'docid': 29574, 'format': 'text', 'language': 'en', 'mime_type': 'application/vnd.openxmlformats-officedocument.wordprocessingml.document', 'rev_number': 1}]",,1088,,Developing a Teaching Model through Students-selected Topics and Implicit Corrective Feedback in Teaching Writing,TRUE,"[{'name': {'honourific': None, 'lineage': None, 'family': 'Pratidina', 'given': 'Anggi'}, 'id': 'anggitrypratidina@gmail.com'}, {'id': 'bambang_setiyadi76@yahoo.co.id', 'name': {'given': 'Ag. Bambang', 'family': 'Setiyadi', 'lineage': None, 'honourific': None}}]",conference_item,['LB'],http://repository.lppm.unila.ac.id/id/eprint/16491,2019-11-16 00:00:00.000000000,"Many studies on students-selected topic have been conducted to investigate the effect of selected topics on students’ writing performance. However, in its implementation, students-selected topics still have some weaknesses in improving students’ writing performance. Students still have difficulties in choosing their topics and also the quality of students’ performance is still low due to no feedbacks given to students’ writing works. The current study investigated how students-selected topics and implicit corrective feedbacks affected performance in writing aspects. This study was conducted with 68 first grade senior high school students: 34 students were assigned as the control group and 34 students as the experimental group. The findings revealed that all writing aspects improved after the implementation of students-selected topics and implicit corrective feedbacks, except in the area of content. The empirical evidence suggests that students-selected topics help students in choosing their own topics and expressing their ideas; while implicit corrective feedbacks help students in recognizing their mistakes in writing process and in revising the mistakes. Suggestions for further research are also discussed.",,"[{'type': 'org', 'url': 'http://icon-eltl.unila.ac.id/'}]",,,['FKIP1'],disk0/00/01/64/91,pub,15,public,2019-11-15 02:39:35,,,,,1-8,,"References
Afrin, S. (2016). Writing Problems of Non-English Major Undergraduate Students  in 	Bangladesh: An Observation. Open Journal of Social Sciences, 104-115.
Aryanika, S. (2016). The Correlation Between the Students’ Writing Motivation and the Writing 	Ability. English Education: Jurnal Tadris Bahasa Inggris: Vol 9 (1), 2016, 215 	232Elbow.
Ariyanti. (2016). The Teaching of EFL Writing in Indonesia.  Dinamika Ilmu, Volume 16 (2), 	2016.
Burstein, J., Chodorow, M., & Leacock, C. (2004). Automated essay evaluation: 	The Criterion 	Online writing service. AI Magazine, 25(3), 27-36.
Clements, S. et al. (2010). Writing Conferences in Kindergarten: Using Feedback to Enhance 	Student Writing. Walden University. 34040564.
Elashri, I. I. E. A. F. (2013). The Impact of the Direct Teacher Feedback Strategy on the EFL 	Secondary Stage Students' Writing Performance. ERIC Online Submission.
Grogan, M. and Lucas, M. (2013). Do participant-selected topics influence L2 writing fluency? 	A replication study. 桃山学院大学人間科学, 44, 219-244.
Jacobs, H. L., Zinkraf, S. A., Wormuth, D. R., Hartfiel, V. F., & Hughey, J. B. (1981). Testing 	ESL composition: A practical approach. Rowley, MA: Newbury House.
Liu, Y. (2008). The Effect of Error Feedback in Second Language Writing.” Arizona Working 	Papers in SLA &Teaching. Vol. 15. PP: 65-79. 
Noroozizadeh, S. (2009). Indirect Feedback: A Plausible Suggestion for Overcoming Error 	Occurrence in L2 Writing. The Journal of Asia TEFL, Vol. 6, No. 4, pp. 245-262, Winter 	2009.
Pardiyono. (2006). Writing Clues for Better Writing Competence. Yogyakarta: Andi press.
Srichanyachon, N. (2011). A Comparative Study of Three Revision Methods in EFL Writing 	[Electronic Version]. Journal of College Teaching and Learning. 8, 2011, pp. 1-8.
Sujannah, W.D. and Cahyono, B.Y. (2017). The Effect of Self-Selected Topic and 	Checklist-based Peer Feedback on Indonesian EFL Students’ Writing 	Ability. 	International Journal of English Language Teaching Vol. 4, No. 2; 2017.
Takinami, W. (2018). Influences of Topic Selection Methods on L2 Learners’ Writing Fluency: 	Replication Study. Education Center, Tottori University.",-,,,arweni@gmail.com,-,"November 16, 2019",paper,Lampung University,THE 2nd INTERNATIONAL CONFERENCE ON ENGLISH LANGUAGE TEACHING AND LEARNING (2nd ICON-ELTL 2019),['Prodi bahasa Inggris FKIP Unila'],conference,
26,show,2020-06-05 11:12:26,archive,22002,,2020-06-05 11:12:26,"[{'pos': 1, 'uri': 'http://repository.lppm.unila.ac.id/id/document/35419', 'security': 'public', 'placement': 1, 'eprintid': 22002, 'rev_number': 1, 'language': 'en', 'mime_type': 'application/pdf', 'files': [{'uri': 'http://repository.lppm.unila.ac.id/id/file/203055', 'filename': '20278-47144-1-PB.pdf', 'filesize': 568706, 'objectid': 35419, 'mtime': '2020-06-05 10:08:58', 'hash_type': 'MD5', 'hash': 'c528831f96f49ba57688c6305ff6fae1', 'mime_type': 'application/pdf', 'datasetid': 'document', 'fileid': 203055}], 'main': '20278-47144-1-PB.pdf', 'docid': 35419, 'format': 'text'}]","[{'type': 'http://www.loc.gov/loc.terms/relators/AUT'}, {'type': 'http://www.loc.gov/loc.terms/relators/REV'}, {'type': 'http://www.loc.gov/loc.terms/relators/REV'}]",76,4.0,Increasing Students' Vocabulary Achievement by Using Silent Way Method at the First Grade of SMP N 3 Way Prngubuan,TRUE,"[{'name': {'honourific': None, 'family': 'Raghil', 'lineage': None, 'given': 'Anisa Arbhia'}, 'id': None}, {'name': {'family': 'Munifatullah', 'lineage': None, 'honourific': None, 'given': 'Feni'}, 'id': 'feni.munifatullah@fkip.unila.ac.id'}, {'name': {'given': 'GEDE EKA', 'family': 'PUTRAWAN', 'lineage': None, 'honourific': None}, 'id': 'gputrawan08@gmail.com'}]",article,['LB1603'],http://repository.lppm.unila.ac.id/id/eprint/22002,1970-01-01 00:00:00.000002019,This study was aimed at finding out whether there was an improvement in students’ vocabulary achievement by using Silent Way method. This research was quantitative. The subject of this research was class VII A of SMP N 3 Way Pengubuan. A vocabulary test was administered as the instrument of this research. The result showed that there was an improvement in students’ vocabulary achievement by using Silent Way method. This suggests that Silent Way method facilitates the students to master the vocabulary easily.,8,[{'url': 'http://jurnal.fkip.unila.ac.id/index.php/123/article/view/20197'}],,UNILA JOURNAL OF LANGUAGE TEACHING,['FKIP1'],disk0/00/02/20/02,pub,6,public,2020-06-05 11:12:26,,,published,,,,,,,,,,,,,,,,
27,show,2019-05-08 07:07:55,archive,11815,http://Jurnal.fkip.unila.ac.id/index.php/123/article/view/17899,2019-05-08 07:07:55,"[{'eprintid': 11815, 'placement': 1, 'security': 'public', 'uri': 'http://repository.lppm.unila.ac.id/id/document/24804', 'pos': 1, 'format': 'text', 'docid': 24804, 'main': '17899-40601-1-PB Resty April 2019.pdf', 'files': [{'mtime': '2019-05-06 14:16:14', 'hash_type': 'MD5', 'filename': '17899-40601-1-PB Resty April 2019.pdf', 'uri': 'http://repository.lppm.unila.ac.id/id/file/106348', 'objectid': 24804, 'filesize': 466817, 'mime_type': 'application/pdf', 'hash': '0e4bfd045d05cca939a402cc8cc2f8b6', 'fileid': 106348, 'datasetid': 'document'}], 'language': 'en', 'rev_number': 1, 'mime_type': 'application/pdf'}]",,717,1.0,"The Evaluation of English Textbook Entitled: ""When English Rings A Bell"" Used by The Eighth Graders of Junior High School",TRUE,"[{'id': 'rahmawantiresty@gmai.com', 'name': {'given': 'Resty', 'honourific': None, 'family': 'Rahmawanti', 'lineage': None}}, {'name': {'honourific': None, 'family': 'Sutarsyah', 'lineage': None, 'given': 'Cucu'}, 'id': 'cucusutarsyah@gmail.com'}, {'name': {'given': 'Ari', 'family': 'Nurweni', 'lineage': None, 'honourific': None}, 'id': 'nurweniari@gmail.com'}]",article,"['L1', 'PE']",http://repository.lppm.unila.ac.id/id/eprint/11815,2019-04-01 00:00:00.000000000,"Abstract
Penelitian ini bertujuan untuk mengevaluasi kualitas buku ""When English Rings A Bell"", mengevaluasi kualitas buku berdasarkan perspektif guru, mengidentifikasi materi buku dengan kurikulum 2013, dan memberikan rekomendasi dari evaluasi buku .Penelitian ini menggunakan tiga instrumen: daftar periksa kualitatif yang diadaptasi dari Cunningsworth pada enam kriteria, wawancara mendalam pada guru, dan silabus kurikulum 2013. Hasil penelitian mengungkapkan bahwa buku sesuai dengan kriteria berdasarkan teori dalam hal tujuan dan pendekatan, keterampilan bahasa, dan topik. Namun, tidak sesuai dengan desain dan organisasi, dan konten bahasa. Hal ini mengungkapkan para guru menganggap buku kredibel untuk digunakan siswa walaupun ada yang berasumsi perlu beberapa revisi. Terakhir, dengan menggunakan (KD 3-4) silabus, persentase diperoleh 98% (sangat baik) yang menunjukkan hampir semua materi buku konsisten dengan KD 3-4.
This research were aimed to evaluate the quality of English textbook ”When English Rings A Bell”, to evaluate the quality of the textbook based on  teachers’ perspective, to identify textbook materials with 2013 curriculum and to give recommendation from textbook evaluation. This research used three instruments: qualitative checklist adapted from Cunningsworth (1995), in-depth interview, and 2013 curriculum syllabus. The result revealed that the textbook fits the good criteria in terms of aims and approaches, language skills, and topics. However, it does not fit design and organization, and language content. It revealed that the teachers considered the textbook as credible to be used by the learners although one assumed that it needs some revisions. Lastly, by using (KD 3-4) of the syllabus the percentage obtained is 98% (very good). It is discovered that almost all materials in the textbook are consistent with the KD 3-4.
Keywords: Textbook Evaluation, English Textbook, Cunningsworth’s checklist, (KD 3-4).",8,,,U-Jet,['FKIP1'],disk0/00/01/18/15,pub,8,public,2019-05-08 07:07:55,,,,,,,,,,,,,,,,,,,
28,show,2019-11-19 05:16:30,archive,17071,,2019-11-19 05:16:30,"[{'eprintid': 17071, 'placement': 1, 'security': 'public', 'pos': 1, 'uri': 'http://repository.lppm.unila.ac.id/id/document/30160', 'format': 'text', 'main': 'full paper YSSSEE 2019 (Patuan Raja, et al) Fix.docx', 'docid': 30160, 'files': [{'uri': 'http://repository.lppm.unila.ac.id/id/file/144866', 'filename': 'full paper YSSSEE 2019 (Patuan Raja, et al) Fix.docx', 'filesize': 308802, 'objectid': 30160, 'mtime': '2019-11-18 12:28:04', 'hash_type': 'MD5', 'hash': 'c81e328f3b1c5baba3d223761d5eeb14', 'mime_type': 'application/vnd.openxmlformats-officedocument.wordprocessingml.document', 'datasetid': 'document', 'fileid': 144866}], 'language': 'en', 'rev_number': 1, 'mime_type': 'application/vnd.openxmlformats-officedocument.wordprocessingml.document'}, {'pos': 2, 'uri': 'http://repository.lppm.unila.ac.id/id/document/30161', 'security': 'public', 'placement': 2, 'eprintid': 17071, 'language': 'en', 'mime_type': 'application/pdf', 'rev_number': 1, 'main': '75 LOA ABDURRAHMAN.pdf', 'docid': 30161, 'files': [{'filename': '75 LOA ABDURRAHMAN.pdf', 'uri': 'http://repository.lppm.unila.ac.id/id/file/144868', 'objectid': 30161, 'filesize': 143523, 'mtime': '2019-11-18 12:28:10', 'hash_type': 'MD5', 'hash': '1a254e5db9a0d18636ac7743f9d56835', 'mime_type': 'application/pdf', 'fileid': 144868, 'datasetid': 'document'}], 'format': 'text'}]",,435,,Exploring Teacher's PCK Improvement: The Opportunity and Challenging of Integrated STEM Learning Approach for Non-STEM Majors,TRUE,"[{'name': {'given': 'Patuan', 'family': 'Raja', 'lineage': None, 'honourific': None}, 'id': 'raja_pid@yahoo.com'}, {'id': 'abdurrahman.1968@fkip.unila.ac.id', 'name': {'honourific': None, 'family': 'Abdurrahman', 'lineage': None, 'given': 'Abdurrahman'}}, {'name': {'given': 'Bambang', 'honourific': None, 'family': 'setiadi', 'lineage': None}, 'id': None}]",article,['L1'],http://repository.lppm.unila.ac.id/id/eprint/17071,1970-01-01 00:00:00.000002019,"The urgency of developing pedagogical content knowledge (PCK) had been investigated in many studies. This was in line with the emerging trend of STEM learning approaches recently. However, only a few studies have reported perceptions of non-STEM teacher’s perception towards their PCK that were associated with the implementation of an integrated STEM-based approach. This study was aimed to explore non STEM teacher’s PCK improvement that was related to the integrated STEM learning approach. We used explanatory mixed method design to collect the data, then the data were analyzed using qualitative descriptive technique. Results indicated that teachers’ PCK improvement reached the satisfying expectation. Their PCK were increased in STEM dimension even though they were actually from non-STEM majors. However, this study only revealed that teachers' beliefs about PCK were related to the STEM approach. Further research should have reached the form of PCK actualization that can be shown by the teacher.",,,IOP Publishing,Journal of Physics: Conference Series,['FKIP1'],disk0/00/01/70/71,submitted,7,public,2019-11-19 05:16:30,Print : 1742-6588 Online : 1742-6596,,submitted,,,,,,,,,,,,,,,,
29,show,2020-05-22 01:48:30,archive,18748,http://icon-eltl.unila.ac.id/proceedings/,2020-05-22 01:48:30,"[{'eprintid': 18748, 'placement': 1, 'security': 'public', 'pos': 1, 'uri': 'http://repository.lppm.unila.ac.id/id/document/31934', 'format': 'text', 'docid': 31934, 'main': 'Proceedings_2nd_ICON_ELTL_2019_CETAK_OK_Rev5c.pdf', 'files': [{'filename': 'Proceedings_2nd_ICON_ELTL_2019_CETAK_OK_Rev5c.pdf', 'uri': 'http://repository.lppm.unila.ac.id/id/file/157414', 'objectid': 31934, 'filesize': 6037511, 'mtime': '2020-03-16 09:25:11', 'hash_type': 'MD5', 'mime_type': 'application/pdf', 'hash': '6e1ef7d20d1fa89b51dd4b8f32003772', 'datasetid': 'document', 'fileid': 157414}], 'content': 'published', 'language': 'en', 'rev_number': 2, 'mime_type': 'application/pdf'}]",,3309,,Facilitating Meaning Recognition of English Vocabulary through Audio-visual Input: a study of Indonesian learners,TRUE,"[{'id': 'fajar.riyantika@fkip.unila.ac.id', 'name': {'given': 'Fajar', 'honourific': None, 'family': 'Riyantika', 'lineage': None}}]",article,"['LB', 'LB2300']",http://repository.lppm.unila.ac.id/id/eprint/18748,2019-11-16 00:00:00.000000000,"Abstract. Vocabulary is considered one of the most important aspects in ELT. Without vocabulary, there will be nothing to be conveyed in the sense of form and meaning. Despite its importance, in some EFL countries like Indonesia, the teaching and learning of vocabulary depends mostly on prescribed text books which are less authentic and provide only a few of examples of contextual language use. This study analyses the impact of using English movies to facilitate vocabulary meaning recognition of Indonesian EFL learners. The participants of this study were 26 students of English Department in Universitas Bandar Lampung, Lampung, Indonesia. The participants were given vocabulary pre-test to see their prior vocabulary knowledge. After the pre-test, the participants took part in four-session movie class where they watch ‘The Social Network’, a movie about the invention of Facebook, to acquire and understand the targeted vocabulary items. After three weeks, the participants did another test to assess their understanding towards the vocabulary items. The results of both pre-test and post-test were compared. The findings show that watching English movies help EFL learners to retain vocabulary meaning. 

Keywords: Vocabulary, Meaning Recognition, EFL Learners, Audio-visual, The Social Network.",,"[{'type': 'org', 'url': 'http://icon-eltl.unila.ac.id/proceedings/'}]",institute for research and community univeristy of lampung,"2nd International Conference on English Language Teaching and Learning ""EFL Teaching and Learning for The Millennial Generation""",['FKIP1'],disk0/00/01/87/48,pub,8,public,2020-05-22 01:48:30,978-602-0860-36-7,,published,,87-96,,,,,,,,,,,,,,
30,show,2020-05-22 01:49:30,archive,20201,http://icon-eltl.unila.ac.id/proceedings/,2020-05-22 01:49:30,"[{'format': 'text', 'files': [{'mime_type': 'application/pdf', 'hash': '6e1ef7d20d1fa89b51dd4b8f32003772', 'datasetid': 'document', 'fileid': 190527, 'uri': 'http://repository.lppm.unila.ac.id/id/file/190527', 'filename': 'Proceedings_2nd_ICON_ELTL_2019_CETAK_OK_Rev5c.pdf', 'filesize': 6037511, 'objectid': 33543, 'mtime': '2020-03-11 00:20:17', 'hash_type': 'MD5'}], 'main': 'Proceedings_2nd_ICON_ELTL_2019_CETAK_OK_Rev5c.pdf', 'docid': 33543, 'content': 'published', 'rev_number': 3, 'language': 'en', 'mime_type': 'application/pdf', 'eprintid': 20201, 'placement': 1, 'security': 'public', 'uri': 'http://repository.lppm.unila.ac.id/id/document/33543', 'pos': 1}]",,3302,,Teaching Procedure Text Using Islamic Tutorial Video,TRUE,"[{'name': {'given': 'Dian', 'lineage': None, 'family': 'Shafwati', 'honourific': None}, 'id': 'dianshafwati@fkip.unila.ac.id'}]",article,"['L1', 'PE', 'T1']",http://repository.lppm.unila.ac.id/id/eprint/20201,2019-11-16 00:00:00.000000000,"English  language  general  subject usually is  considered  by  the  students  at  Islamic  university  of Lampung as the unattractive and boring subject since it is not very much related to their major. Lecturers in the millennial era must seek a way to make this general subject into a fun way and at the same time must engage this subject to the Islamic major. Then, lecturer needs a media which can support the teaching English language general subject in fun and purposeful ways. One of the examples  of  using  media  in English  language  general  subject  is  teaching  procedure  text  using tutorial  video.  In  this  paper,  this  study  is  aimed  to  discuss  some  related  literatures  about  the implementation of tutorial video in teaching procedure text as beneficial tools. The discussion of those literatures is also supported by the researcher’s experience in teaching procedure text using Islamic tutorial video in English language general subject class in Islamic university of Lampung. After the learning process was done, it is found that the English language subject can be engaged in Islamic practice in fun and attractive ways. Students also can make their own procedure text in the form of tutorial video which is related to the practice of Islam. This paper ends its conclusion by recommending the English language general subject lecturer to use Islamic tutorial video to teach procedure text but they must selectively give to the students. 

Keywords:tutorial video, procedure text, islamic university",,"[{'url': 'http://icon-eltl.unila.ac.id/proceedings/', 'type': 'org'}]",institute for research and community univeristy of lampung,"2nd International Conference on English Language Teaching and Learning ""EFL Teaching and Learning for The Millennial Generation""",['FKIP1'],disk0/00/02/02/01,pub,4,public,2020-05-22 01:49:30,978-602-0860-36-7,18588.0,published,,250-259,,,,,,,,,,,,,,"[{'id': 'gputrawan08@gmail.com', 'name': {'honourific': None, 'lineage': None, 'family': 'PUTRAWAN', 'given': 'GEDE EKA'}}, {'id': 'rafista.deviyanti@gmail.com', 'name': {'lineage': None, 'family': 'Deviyanti', 'honourific': None, 'given': 'Rafista'}}]"
