,metadata_visibility,datestamp,eprint_status,eprintid,official_url,lastmod,documents,contributors,userid,number,title,refereed,creators,type,subjects,uri,date,abstract,volume,related_url,publisher,publication,divisions,dir,ispublished,rev_number,full_text_status,status_changed,issn,succeeds,date_type,id_number,pagerange,corp_creators,referencetext,note,pages,isbn,contact_email,keywords,event_dates,pres_type,event_location,event_title,funders,event_type,editors
8,show,2020-05-04 01:49:59,archive,19389,http://www.ijllnet.com/,2020-05-04 01:49:59,"[{'eprintid': 19389, 'placement': 1, 'security': 'public', 'pos': 1, 'uri': 'http://repository.lppm.unila.ac.id/id/document/32616', 'format': 'text', 'main': 'ILL PUBLISHING.pdf', 'docid': 32616, 'files': [{'hash': '55dfebbaebf45572a23428afec16bab0', 'mime_type': 'application/pdf', 'datasetid': 'document', 'fileid': 162164, 'mtime': '2020-05-01 13:40:14', 'hash_type': 'MD5', 'filename': 'ILL PUBLISHING.pdf', 'uri': 'http://repository.lppm.unila.ac.id/id/file/162164', 'objectid': 32616, 'filesize': 305812}], 'mime_type': 'application/pdf', 'language': 'en', 'rev_number': 1}]",,848,4.0,Integrating Mind Mapping (MM) and Three-Step-Interview (TSI) in Enhancing Students’ Writing Process in Foreign Language Setting,TRUE,"[{'name': {'given': 'Flora', 'honourific': None, 'family': 'Flora', 'lineage': None}}]",article,"['L1', 'PE']",http://repository.lppm.unila.ac.id/id/eprint/19389,2019-12-01 00:00:00.000000000,"There had been many studies conducted to investigate the benefits of Mind Mapping (MM) in the writing process and Three-Step-Interview (TSI ) in the speaking process, this study set out to investigate the effectiveness of an integrated technique which was the combination of MM and TSI in teaching writing. This technique was intended to facilitate the students with individual and group brainstorming practice and to help create another teaching procedure which could effectively solve the students’ writing problem, especially in generating and organizing ideas in the pre-writing process. The subject of this study was 29 students who took Intermediate Writing subject at English Department Faculty of Education, Lampung University-Indonesia . The pretest and posttest were administered before and after the treatment. The data was analyzed by means of the paired sample t-test. The result shows that the students' writing ability significantly improved subsequent to the treatment. It also reveals that the most significant improvements were those of the writing content and organization aspects. The results are discussed in relation to relevant previous research findings.",6,[{'url': 'http://www.ijllnet.com/journal/index/2569'}],Center for Promoting Ideas (CPI),International Journal of Language & Linguistics,['FKIP1'],disk0/00/01/93/89,pub,7,public,2020-05-04 01:49:59,2374-8869,,published,doi:10.30845/ijll.v6n4p18,145-150,,"Akbar, RS and Hanan A. Taqi, HA (2017). Does mind mapping enhance learning? International Journal of English Language Teaching. Vol.5, No.8, pp.65-77, November 2017. 
Aristy, I, Hadiansyah, R, and Apsari, Y. (2019). Using three step – interview to improve students’ speaking 
ability.PROJECT. Volume 2, No. 2, March 2019 pp 74-79 
Ary, Donald et al. (2010). Introduction to research in education. USA: Wadsworth Cenggage Learning. 
Astrina, Marzeliaet.al. (2014). The use of clustering technique to improve students’ skill in writing hortatory exposition text. e-Journal of English Language Teaching Society (ELTS): Vol. 2 No. 2,  2014. 
Bailey, Stephen. (2006). Academic writing : A handbook for international student. New York: Routledge. 
Brown, H. Douglas. (2001). Teaching by principles an interactive approach to language pedagogy. The United States of New York: Longman. 
Bukhari, Syeda Saima Ferheen (2016). Mind mapping techniques to enhance efl writing skill. International Journal of Linguistics and Communication: June 2016, Vol. 4, No. 1, pp. 58-77. 
Candraloka, Olyvia Revalita. (2016).  Implementing three step interview in teaching speaking. Jurnal Edulingua: Vol 3. No. 1 Januari-Juni 2016. 
Ernidawati and Sutopo, D. (2017). Mind mapping and brainstorming strategies in students’ writing with high and low interest. English Educational Journal. EEJ 7 (2) (2017) 164-168. 
Fadillah, R. (2019). Students’ perception on the use of mind mapping application software in learningwriting. ELTIC: A Journal of Culture, English 
Language Teaching, Literature & Linguistics. ISSN: 2356-0401, E-ISSN:  2621-9158, VOL. 6, NO. 1, June 2019. 
Fussalam, YE and and Renda Lestari, R. (2018). Improving speaking skill of the students of STKIP-MBthroughthe use 
of three-step interviewe technique. Getsempena English Education Journal (GEEJ) Vol.5 No.2 November 2018 
Harmer, J. (2010).The practice of english language teaching. Pearson Longman. 
Honsa, S.Jr. (2013). Self-assessment inefl writing: A study of intermediate efl students at a thai university. Voices in Asia Journal 2013,Vol.1Issue1. http://www.viajournal.org/admin/file_upload_name/pp._34-57.pdf.[Retrieved on  January 29, 2016] 
Irawati, Rika. (2013).The effectiveness of three-step interview technique to teach speaking viewed from the students’ language anxiety. Jurnal Eksos:November 2013, Th. IX, No. 3. 
Jacobs, H.J. et al. (1981). Testing ESL composition: a practical approach. Rowley, MA: Newbury House. Chapter 2. 
Kagan, Spencer. 2009. Kagan Cooperative Learning. San Clemente: Kagan Publishing. Chapter  1. 
Kamimura, T. (2006). Effects of peer feedback on efl student writers at different levels of English proficiency: A japanese context tesl. Canada Journal, 23(2), 12-39. https://doi. org/10.18806/tesl.v23i2.53. [Retrieved online: February 2, 2019] 
Luzzatto, Edda and Giordano DiMarco. (2010). Collaborative learning. methodology, types of interactions and techniques. New York: Nova Science Publishers, Inc. Chapter 5. 
Manktelow, James C.E.O. (2011). Brainstorming toolkit. London: Mind Tools. 
Marashi, Hamid and Homayra Khatami. (2017). Using cooperative learning to boost creativity and motivation in language learning. Journal of Language and Translation: Volume 7, Number 1(13) 43-58. 
Orrange, Marry Beth. (1993). Promoting excellent teaching. The Annual International Conference for Community College 
Chairs, Deans, and Other Instructional Leaders: Phoenix, AZ,February 17-20. 
Richards,  Jack C. and Willy A. Renandya. (2002). Methodology in language teaching-An anthology of current practice. New York: Cambridge University Press. 
Riswanto and Putra, Pebri Prandika. (2012).The use of mind mapping strategy in the teaching of writing at SMAN 3 Bengkulu, Indonesia. International Journal of Humanities and Social Science: Vol. 2 No. 21, November 2012. 
Riswanto.  (2016). Improving the students’ ability in writing report genre through mind mapping at junior high schools in south sumatera, Indonesia. International Journal of Social Sciences: Volume 2 Issue 1, 2016. 
Saputro AR, Basori, and Budiyanto, CW.  (2017.) The application of mind mapping learning model to improve the students’ learning outcomes and liveliness. Advances in Social Science, Education and Humanities Research (ASSEHR), volume 158International Conference on Teacher Training and Education 2017 (ICTTE 2017. 
Sharma, L, H. (2018). TPS (Think-pair-share): An effective cooperative learning strategy for unleashing discussion in classroom interaction. USA:  International Journal of Research in Social Sciences. Vol. 8 Issue 5(1). 
Sultana, A. (2009). Peer correction in ESL classroom. BRAC University Journal, 6(1), 11-19. [Retrieved online on February 2, 2019] 
Suyanto, A. (2015). The effectiveness of mind mapping in improving students’ writing skill viewed from Their IQ. IJEE (Indonesian Journal of English Education), 2 (2), 2015, 101-119 
Swain, M. (1985). Communicative competence: some Roles of Comprehensible input and Comprehensible Output in its 
Development. In Susan M. Gass and Carolyn G Madden, eds. Input in Second Langauge Acquisition, 235-253. 
Rowley, MA: Newbury House. 
Swain, M. and S. Lapkin. (1995). Problems in output and the cognitive processes they generate: A step towards second language learning.' Applied Linguistics 16:371-391. 
Triza, Retno et.al. (2016). The effect of clustering technique towards students’ writing skill of narrative text in high school 5 Pariaman, West Sumatera. Research Journal of Social Sciences: 9(2), March 2016. 
Wulandari, Silvia and Don Narius. (2017). Using three steps interview technique to improve speaking ability of senior high school students. Journal of English Language Teaching: Volume 6 No. 1 Serie A, March 2017. 
Yuliasri, I. (2013). Applicability of cooperative learning techniques in different classroom contexts. Arab World English Journal.  AWEJ June 2013. ELTL Indonesia Conference Proceedings 2012 
Yunus, Melor  and Chan Hua Chien. (2016).The use of mind mapping strategy in Malaysian university english test (MUET) writing. Creative Education: 7,  April 2016, 619-626. 
Zeng, Y. (2006). Peer feedback in college slw classroom. Sino-us English Teaching, 3(3), 23-35.[Retrieved online on February 2, 2006",,,,,,,,,,,,
9,show,2019-05-21 02:58:05,archive,13020,,2019-05-21 02:58:05,"[{'content': 'published', 'language': 'id', 'mime_type': 'application/xml', 'rev_number': 3, 'format': 'archive', 'main': 17400, 'files': [{'mime_type': 'application/xml', 'hash': '03334d92d0f8b3ee77e79265c043f707', 'fileid': 114693, 'datasetid': 'document', 'mtime': '2019-05-17 03:32:29', 'hash_type': 'MD5', 'filename': 17400, 'uri': 'http://repository.lppm.unila.ac.id/id/file/114693', 'filesize': 22167, 'objectid': 26024}], 'docid': 26024, 'security': 'public', 'uri': 'http://repository.lppm.unila.ac.id/id/document/26024', 'pos': 1, 'eprintid': 13020, 'placement': 1}]",,383,1.0,Nilai Moral dalam Dongeng Bertrand Solet dan Michel Cosem dan Implikasinya terhadap Pembelajaran,TRUE,"[{'id': 'trihandayani.th2@gmail.com', 'name': {'honourific': None, 'lineage': None, 'family': 'Handayani', 'given': 'Tri'}}, {'name': {'lineage': None, 'family': 'Sumarti', 'honourific': None, 'given': 'Sumarti'}, 'id': 'gragemarti@yahoo.co.id'}, {'name': {'given': 'Nani', 'honourific': None, 'family': 'Kusrini', 'lineage': None}, 'id': 'nani.kusrini7@gmail.com'}]",article,"['L1', 'PC']",http://repository.lppm.unila.ac.id/id/eprint/13020,1970-01-01 00:00:00.000002019,"Penelitian ini bertujuan untuk mendeskripsikan nilai-nilai moral dalam dongeng karya Bertrand Solet dan Michel Cosem dan implikasinya terhadap pembelajaran bahasa Prancis di SMA. Penelitian menggunakan metode deskriptif kualitatif. Sumber data penelitiannya kumpulan dongeng karya Bertrand Solet dan Michel Cosem. Hasil penelitian menunjukkan bahwa nilai moral hubungan manusia dan Tuhan, meliputi taat beribadah dan berdoa kepada Tuhan; nilai moral hubungan manusia dan diri sendiri, meliputi tidak mudah putus asa, rela berkorban, kesabaran, teguh pendirian, pemberani, kejujuran, rasa dendam, penyesalan, dan rasa takut; nilai moral hubungan manusia dan manusia lain dalam lingkup sosial dan alam, meliputi tolong menolong, kasih sayang orang tua kepada anak, kasih sayang anak kepada orang tua, kasih sayang sesama teman, gotong royong, saling menghargai, saling percaya, dan kasih sayang suami kepada istri. Bentuk penyampaian nilai moral, meliputi langsung dan tidak langsung. Hasil penelitian ini dapat diimplikasikan terhadap pembelajaran bahasa Prancis di SMA kelas XII pada KD 3.8 : mencirikan  cerita fabel (fable) Prancis yang sederhana dengan memperhatikan fungsi sosial, struktur teks, dan unsur kebahasaan yang benar dan sesuai konteks.

Kata kunci: bentuk penyampaian nilai moral, dongeng, nilai moral",2,,Pendidikan Bahasa Prancis Unila,Pranala,['FKIP1'],disk0/00/01/30/20,pub,12,public,2019-05-21 02:58:05,,,published,,,,,,,,,,,,,,,,
10,show,2019-11-15 02:50:51,archive,16484,,2019-11-15 02:50:51,"[{'rev_number': 3, 'language': 'en', 'mime_type': 'application/xml', 'content': 'published', 'files': [{'uri': 'http://repository.lppm.unila.ac.id/id/file/140766', 'filename': 'pdf_1', 'objectid': 29569, 'filesize': 20114, 'mtime': '2019-11-14 20:28:44', 'hash_type': 'MD5', 'mime_type': 'application/xml', 'hash': '0f0dd064b4e026fb6956ae9c5d885755', 'datasetid': 'document', 'fileid': 140766}], 'main': 'pdf_1', 'docid': 29569, 'format': 'archive', 'uri': 'http://repository.lppm.unila.ac.id/id/document/29569', 'pos': 1, 'security': 'public', 'placement': 1, 'eprintid': 16484}]",,717,3.0,The Implementation of Project-Based Learning in Teaching Writing of Factual Report Texts,TRUE,"[{'name': {'family': 'Hardianto', 'lineage': None, 'honourific': None, 'given': 'Hardianto'}, 'id': None}, {'name': {'given': 'Ari', 'lineage': None, 'family': 'Nurweni', 'honourific': None}, 'id': 'nurweniari@gmail.com'}, {'name': {'given': 'Mahpul', 'lineage': None, 'family': 'Mahpul', 'honourific': None}, 'id': 'mahpul_mahpul@yahoo.com'}]",article,"['LB1603', 'PE']",http://repository.lppm.unila.ac.id/id/eprint/16484,1970-01-01 00:00:00.000002019,"The current research was aimed to explore the effects of Project-Based Learning (PjBL) implementation on students’ responses and writing achievement. The participants of the research were 28 students of year 9. The data took the form of qualitative and quantitative.  The data of the students” responses were collected through interview and they were video-taped, while data of students’ writing scores were gained by administering writing test. The research instruments used among them were writing test, smart phones as audio-visual gadget to record the proccess, and an interview protocol.The findings show that students responded positively to the all stages of PjBL implementation and there was a significant increase of students’ writing improvement in the aspects of content, organization, grammar, vocabulary, mechanics, and length of writing.

Keywords: Project-based learning, factual report text, writing aspects, interview protocol.",8,,,U-Jet,['FKIP1'],disk0/00/01/64/84,pub,9,public,2019-11-15 02:50:51,,,,,,,,,,,,,,,,,,,
11,show,2020-03-11 03:53:31,archive,18565,,2020-03-11 03:57:43,"[{'language': 'en', 'rev_number': 1, 'mime_type': 'application/pdf', 'format': 'text', 'files': [{'mime_type': 'application/pdf', 'hash': '89ffbab93fc2fa11e2fe56a1aeef6bb6', 'fileid': 156179, 'datasetid': 'document', 'filename': '48.53.pdf', 'uri': 'http://repository.lppm.unila.ac.id/id/file/156179', 'filesize': 749379, 'objectid': 31760, 'mtime': '2020-03-11 03:57:43', 'hash_type': 'MD5'}], 'main': '48.53.pdf', 'docid': 31760, 'security': 'public', 'uri': 'http://repository.lppm.unila.ac.id/id/document/31760', 'pos': 1, 'eprintid': 18565, 'placement': 1}]",,350,,"Enhancing Critical Thinking Through
CALLA In Developing Writing Ability Of
EFL Students",,"[{'name': {'given': 'huzairin', 'family': 'Huzairin', 'lineage': None, 'honourific': None}, 'id': 'huzairin1958@gmail.com'}]",other,['AC'],http://repository.lppm.unila.ac.id/id/eprint/18565,1970-01-01 00:00:00.000002019,Peer Review,,,Advances in Social Sciences Research Journal,,['FKIP1'],disk0/00/01/85/65,pub,8,public,2020-03-11 03:53:31,,,published,,,,,,,,,,,,,,,,
12,show,2020-02-11 09:02:19,archive,17267,,2020-02-11 09:02:19,,"[{'name': {'given': 'huzairin', 'lineage': None, 'family': 'huzairin', 'honourific': None}, 'type': 'http://www.loc.gov/loc.terms/relators/AUT', 'id': 'huzairin@gmail.com'}, {'type': 'http://www.loc.gov/loc.terms/relators/AUT', 'name': {'family': 'yufrizal', 'lineage': None, 'honourific': None, 'given': 'hery'}, 'id': 'heryyufrizal@gmail.com'}]",915,11.0,Enhancing Critical Thinking Through CALLA In Developing	Writing	Ability	Of EFL Students,TRUE,"[{'name': {'given': 'huzairin', 'family': 'Huzairin', 'lineage': None, 'honourific': None}, 'id': 'huzairin1958@gmail.com'}, {'name': {'given': 'Hery', 'honourific': None, 'lineage': None, 'family': 'Yufrizal'}, 'id': 'heryyufrizal@gmail.com'}]",article,['L1'],http://repository.lppm.unila.ac.id/id/eprint/17267,2019-11-01 00:00:00.000000000,"The objectives	of this	research are firstly to	investigate the application	of Cognitive Academic Language Learnin Approach in improving students’	English	writing	ability	and secondly to answer what	factors	influence the students’writing performance.The subjects of the research were the students of senior high schools in Indonesia consisting of a	group of students as experimental group	and as control group. The results	showed	that	studentsimproved their writing	after	they	were	involved	in Cognitive Academic	Language	Learning Actvitities.	Furthermore,	the	study	also showed that	levels	of	students’	critical thinkingdidnot	any	significant	effects	toward	their	writing	achievement",6,,Advances in Social Science Research Journal,Advances in Social Sciences Research Journal,['FKIP1'],disk0/00/01/72/67,pub,7,none,2020-02-11 09:02:19,2055-0286,,published,,302-313,"['Univeritas Lampung', 'Universitas Lampung']",,,,,,,,,,,,,
13,show,2020-12-14 00:57:54,archive,24791,https://doi.org/10.14738/assrj.611.7345,2020-12-14 00:57:54,,"[{'id': 'huzairin@gmail.com', 'type': 'http://www.loc.gov/loc.terms/relators/AUT', 'name': {'lineage': None, 'family': 'huzairin', 'honourific': None, 'given': 'huzairin'}}, {'id': 'heryyufrizal@gmail.com', 'type': 'http://www.loc.gov/loc.terms/relators/AUT', 'name': {'honourific': None, 'family': 'yufrizal', 'lineage': None, 'given': 'hery'}}]",915,11.0,Enhancing Critical Thinking Through Calla In Developing Writing Ability Of EFL Students,TRUE,"[{'name': {'honourific': None, 'family': 'Huzairin', 'lineage': None, 'given': 'huzairin'}, 'id': 'huzairin1958@gmail.com'}, {'name': {'given': 'Hery', 'lineage': None, 'family': 'Yufrizal', 'honourific': None}, 'id': 'heryyufrizal@gmail.com'}]",article,['L1'],http://repository.lppm.unila.ac.id/id/eprint/24791,2019-11-22 00:00:00.000000000,"The objectives of this research are firstly to investigate the application of Cognitive Academic Language Learning Approach in improving students’ English writing ability andsecondly to answer what factors influence the students’ writing performance. The subjects of the research were the students of senior high schools in Indonesia consisting of a group of students as experimental group and as control group. The results showed that students improved their writing after they were involved in Cognitive Academic Language Learning Actvitities. Furthermore, the study also showed that levels of students’ critical thinking did not any significant effects toward their writing achievement",6,,Advances in Social Science Research Journal,Advances in Social Sciences Research Journal,['FKIP1'],disk0/00/02/47/91,pub,5,none,2020-12-14 00:57:54,2055-0286,,published,,302 -313,"['Univeritas Lampung', 'Universitas Lampung']",,,,,,,,,,,,,
14,show,2019-12-06 04:15:36,archive,17266,http:// dx.urg.10.14738 assrj 510.5265,2019-12-06 04:15:36,"[{'format': 'text', 'docid': 30369, 'main': '7345-Article Text-18803-1-10-20191203.pdf', 'files': [{'filename': '7345-Article Text-18803-1-10-20191203.pdf', 'uri': 'http://repository.lppm.unila.ac.id/id/file/146233', 'objectid': 30369, 'filesize': 385306, 'mtime': '2019-12-05 04:41:14', 'hash_type': 'MD5', 'mime_type': 'application/pdf', 'hash': '72f698b3f6d13a0427e8af1b6545867e', 'datasetid': 'document', 'fileid': 146233}], 'rev_number': 1, 'language': 'en', 'mime_type': 'application/pdf', 'eprintid': 17266, 'placement': 1, 'security': 'public', 'pos': 1, 'uri': 'http://repository.lppm.unila.ac.id/id/document/30369'}]","[{'name': {'lineage': None, 'family': 'huzairin', 'honourific': None, 'given': 'huzairin'}, 'type': 'http://www.loc.gov/loc.terms/relators/AUT', 'id': 'huzairin1958@gmail.com'}, {'id': 'heryyufrizal@gmai.com', 'type': 'http://www.loc.gov/loc.terms/relators/AUT', 'name': {'given': 'hery', 'family': 'yufrizal', 'lineage': None, 'honourific': None}}]",350,11.0,Enhancing Critical Thinking through CALLA in Developing Writing Ability Of EFL,TRUE,"[{'name': {'family': 'Huzairin', 'lineage': None, 'honourific': None, 'given': 'huzairin'}, 'id': 'huzairin1958@gmail.com'}, {'name': {'honourific': None, 'lineage': None, 'family': 'Yufrizal', 'given': 'Hery'}, 'id': 'heryyufrizal@gmail.com'}]",article,['L1'],http://repository.lppm.unila.ac.id/id/eprint/17266,2019-11-25 00:00:00.000000000,"The objectives of this research are firstly to investigate the Application Cognitive Academic Language Learning Approach in improving students' English writing ability, and secondly to answer what factors influence students' writing Performance.The Subject of the research were the students of senior high school in Indonesia consisting of a group of students as experimental group and control group. The results showed that their writing after they were involved in Cognitive Academic Language Learning Approach. further more, the study also showed that level of students' critical thinking did nit have any significant effect towards their writing achievement.",6,,Advances in Social Science Research Journal,Enhancing Critical Thinking Trhough CALLA in Developing Students' Writing Ability of EFL Students,['FKIP1'],disk0/00/01/72/66,pub,9,public,2019-12-06 04:15:36,2255-0285,,published,,1-12,,,,,,,,,,,,,,
15,show,2019-05-21 02:57:55,archive,13007,http://jurnal.fkip.unila.ac.id/index.php/jpp/,2019-05-21 02:57:55,"[{'placement': 1, 'eprintid': 13007, 'pos': 1, 'uri': 'http://repository.lppm.unila.ac.id/id/document/26011', 'security': 'public', 'docid': 26011, 'main': 'jpp', 'files': [{'hash_type': 'MD5', 'mtime': '2019-05-17 01:25:49', 'filesize': 50432, 'objectid': 26011, 'uri': 'http://repository.lppm.unila.ac.id/id/file/114594', 'filename': 'jpp', 'fileid': 114594, 'datasetid': 'document', 'mime_type': 'text/html', 'hash': 'ae5a39541ffc1c20d1bb9a8b01e28496'}], 'format': 'archive', 'language': 'en', 'rev_number': 3, 'mime_type': 'text/html', 'content': 'published'}]",,383,22.0,Learning Abbreviation Style of French Language  Conversation on Twitter,TRUE,"[{'name': {'honourific': None, 'lineage': None, 'family': 'Kusrini', 'given': 'Nani'}, 'id': 'nani.kusrini@fkip.unila.ac.id'}]",article,"['L1', 'PC']",http://repository.lppm.unila.ac.id/id/eprint/13007,2019-04-30 00:00:00.000000000,"Learning Abbreviation Style of French  Language  Conversation on Twitter. Objectives: This study aims to identify the process of formation of abbreviation, the causes of its use and its implication in French  instruction. Method: This study used qualitative descriptive method, by taking utterances containing forms of abbreviation in French conversations conducted by several native speakers on Twitter from June to October 2018 as data sources. Findings: No elliptical data  was found. The form of troncation  which is divided into several  forms  of beheading, namely the beheading of one or two syllables at the end of a word, decapitation of one or two syllables at the beginning of the word, combined between troncasi  and condensation and the most is decapitation  by consonant or vowel disappearance.  Results: The results of the study showed that the abbreviation  is mainly formed by troncation,  sigle, and shortening by using
letters having the same sound as the real  word(s).

Kata kunci:  Abbreviation, french  language  conversation, troncation.",9,,FKIP Unila,Jurnal Pendidikan Progresif,['FKIP1'],disk0/00/01/30/07,pub,9,public,2019-05-21 02:57:55,2550-1313,,published,,81-88,,,,,,,,,,,,,,
16,show,2020-04-20 01:27:30,archive,19227,http://jurnal.fkip.unila.ac.id/index.php/jpp/index,2020-04-20 01:27:30,"[{'format': 'text', 'docid': 32460, 'main': 972, 'files': [{'mime_type': 'text/html', 'hash': 'e5c6ee8982305b63285ff540ff6d5511', 'fileid': 161105, 'datasetid': 'document', 'mtime': '2020-04-17 12:42:35', 'hash_type': 'MD5', 'filename': 972, 'uri': 'http://repository.lppm.unila.ac.id/id/file/161105', 'objectid': 32460, 'filesize': 33352}], 'content': 'published', 'language': 'en', 'rev_number': 3, 'mime_type': 'text/html', 'eprintid': 19227, 'placement': 1, 'security': 'public', 'pos': 1, 'uri': 'http://repository.lppm.unila.ac.id/id/document/32460'}]",,383,1.0,Learning Abbreviation Style of French Language Conversation on Twitter,TRUE,"[{'name': {'honourific': None, 'lineage': None, 'family': 'Kusrini', 'given': 'Nani'}, 'id': 'nani.kusrini@fkip.unila.ac.id'}]",article,['PC'],http://repository.lppm.unila.ac.id/id/eprint/19227,2019-04-01 00:00:00.000000000,"Abstract: Learning Abbreviation Style of French Language Conversation on Twitter. Objectives: This study aims to identify the process of formation of abbreviation, the causes of its use and its implication in French instruction. Method: This study used qualitative descriptive method, by taking utterances containing forms of abbreviation in French conversations conducted by several native speakers on Twitter from June to October 2018 as data sources. Findings: No elliptical data was found. The form of troncation which is divided into several forms of beheading, namely the beheading of one or two syllables at the end of a word, decapitation of one or two syllables at the beginning of the word, combined between troncasi and condensation and the most is decapitation by consonant or vowel disappearance. Conclusions: The results of the study showed that the abbreviation is mainly formed by troncation, sigle, and shortening by using letters having the same sound as the real word(s). 

Keywords: Abbreviation, french language conversation, troncation .",Vol 9,[{'url': 'http://jurnal.fkip.unila.ac.id/index.php/jpp/issue/view/972'}],FKIP Unila,Jurnal Pendidikan Progresif,['FKIP1'],disk0/00/01/92/27,pub,13,public,2020-04-20 01:27:30,2087-9849,,published,,81-88,,,,,,,,,,,,,,
