,metadata_visibility,datestamp,eprint_status,eprintid,official_url,lastmod,documents,contributors,userid,number,title,refereed,creators,type,subjects,uri,date,abstract,volume,related_url,publisher,publication,divisions,dir,ispublished,rev_number,full_text_status,status_changed,issn,succeeds,date_type,id_number,pagerange,corp_creators,referencetext,note,pages,isbn,contact_email,keywords,event_dates,pres_type,event_location,event_title,funders,event_type,editors
0,show,2020-06-09 01:00:52,archive,21982,http://jurnal.fkip.unila.ac.id/index.php/123/index,2020-06-09 01:00:52,"[{'format': 'text', 'main': '20160-46628-1-PB.pdf', 'docid': 35500, 'files': [{'objectid': 35500, 'filesize': 156969, 'filename': '20160-46628-1-PB.pdf', 'uri': 'http://repository.lppm.unila.ac.id/id/file/203602', 'hash_type': 'MD5', 'mtime': '2020-06-08 11:43:21', 'fileid': 203602, 'datasetid': 'document', 'mime_type': 'application/pdf', 'hash': '4873f66671119fad1c509e447a59a91d'}], 'mime_type': 'application/pdf', 'language': 'en', 'rev_number': 1, 'eprintid': 21982, 'placement': 1, 'security': 'public', 'pos': 1, 'uri': 'http://repository.lppm.unila.ac.id/id/document/35500'}]","[{'type': 'http://www.loc.gov/loc.terms/relators/AUT'}, {'type': 'http://www.loc.gov/loc.terms/relators/AUT'}, {'type': 'http://www.loc.gov/loc.terms/relators/AUT'}]",76,4.0,A COMPARATIVE STUDY OF STUDENTS’ READING COMPREHENSION IN NARRATIVE TEXT THROUGH MIND MAPPING TECHNIQUE AND DIRECTED READING THINKING ACTIVITY (DRTA) TECHNIQUE AT THE SECOND GRADE OF SMP NEGERI 25 BANDAR LAMPUNG,TRUE,"[{'name': {'given': 'Ulfah Shadrina', 'family': 'Adani', 'lineage': None, 'honourific': None}, 'id': None}, {'id': 'heryyufrizal@gmail.com', 'name': {'lineage': None, 'family': 'Yufrizal', 'honourific': None, 'given': 'Hery'}}, {'id': 'feni.munifatullah@fkip.unila.ac.id', 'name': {'given': 'Feni', 'lineage': None, 'family': 'Munifatullah', 'honourific': None}}]",article,['LB1603'],http://repository.lppm.unila.ac.id/id/eprint/21982,1970-01-01 00:00:00.000002019,"This research was aimed at examining: (i) the significant difference on students’ reading comprehension after being taught through Mind Mapping technique and Directed Reading Thinking Activity (DRTA) technique in narrative text and (ii) the aspects of reading skills that the highest increase. The subjects of this research were VIII B and VIII E which consisted of 28 students of SMP Negeri 25 Bandar Lampung. The data were collected by using the objective reading test in the form of multiple choices and analysed by using Independent Sample T-Test in SPSS version 16.0. The result of this research showed that there was significant difference of students’ reading comprehension after being taught through Mind Mapping technique and Directed Reading Thinking Activity (DRTA) technique since the t-value greater than t-table (3.648 > 1.674) at the significant level of 0.01. Then, main idea, vocabulary and reference were the aspects that improved better.  
Keywords: Reading Comprehension, Aspects of Reading, Mind Mapping Technique, Conventional Technique, DRTA Technique",8,"[{'type': 'pub', 'url': 'http://jurnal.fkip.unila.ac.id/index.php/123/issue/view/1066'}]",FKIP Unila,UNILA Journal of Language Teaching,['FKIP1'],disk0/00/02/19/82,pub,6,public,2020-06-09 01:00:52,,,,,,,,,,,,,,,,,,,
1,show,2020-11-22 11:41:23,archive,26614,http://www.sajournalofeducation.co.za/index.php/saje,2020-11-22 11:41:23,"[{'eprintid': 26614, 'placement': 3, 'security': 'public', 'uri': 'http://repository.lppm.unila.ac.id/id/document/40581', 'pos': 3, 'format': 'text', 'files': [{'mime_type': 'application/pdf', 'hash': '9b05a892674121a804142428284524b8', 'fileid': 239248, 'datasetid': 'document', 'mtime': '2020-11-22 08:18:42', 'hash_type': 'MD5', 'filename': '5. article -Exploring motivational orientations of English as foreign language (EFL) learners.pdf', 'uri': 'http://repository.lppm.unila.ac.id/id/file/239248', 'filesize': 274341, 'objectid': 40581}], 'main': '5. article -Exploring motivational orientations of English as foreign language (EFL) learners.pdf', 'docid': 40581, 'mime_type': 'application/pdf', 'language': 'en', 'rev_number': 1}, {'rev_number': 1, 'language': 'en', 'mime_type': 'application/pdf', 'main': '5. Review- Exploring motivational orientations of English as foreign language learners.pdf', 'docid': 40582, 'files': [{'mime_type': 'application/pdf', 'hash': '6e083bedaa5ce457da5f62effa277026', 'fileid': 239252, 'datasetid': 'document', 'mtime': '2020-11-22 08:19:02', 'hash_type': 'MD5', 'uri': 'http://repository.lppm.unila.ac.id/id/file/239252', 'filename': '5. Review- Exploring motivational orientations of English as foreign language learners.pdf', 'objectid': 40582, 'filesize': 880655}], 'format': 'text', 'uri': 'http://repository.lppm.unila.ac.id/id/document/40582', 'pos': 4, 'security': 'public', 'placement': 4, 'eprintid': 26614}, {'mime_type': 'application/pdf', 'language': 'en', 'rev_number': 1, 'format': 'text', 'main': '5. similarity index-Exploring motivational orientations of English as foreign language learners.pdf', 'files': [{'hash_type': 'MD5', 'mtime': '2020-11-22 08:19:22', 'objectid': 40583, 'filesize': 5867474, 'filename': '5. similarity index-Exploring motivational orientations of English as foreign language learners.pdf', 'uri': 'http://repository.lppm.unila.ac.id/id/file/239254', 'datasetid': 'document', 'fileid': 239254, 'hash': 'b233defe056b7e6263959b54aad20fb1', 'mime_type': 'application/pdf'}], 'docid': 40583, 'security': 'public', 'pos': 5, 'uri': 'http://repository.lppm.unila.ac.id/id/document/40583', 'eprintid': 26614, 'placement': 5}]",,1088,1.0,Exploring motivational orientations of English as foreign language (EFL) learners: A case study in Indonesia,TRUE,"[{'id': 'bambang_setiyadi76@yahoo.co.id', 'name': {'given': 'Bambang', 'family': 'Ag Bambang Setiyadi', 'lineage': None, 'honourific': None}}, {'name': {'given': 'Mahpul', 'family': 'Mahpul', 'lineage': None, 'honourific': None}, 'id': None}, {'id': None, 'name': {'given': 'Anggit', 'family': 'B. Anggit Wicaksono', 'lineage': None, 'honourific': None}}]",article,"['L1', 'PE']",http://repository.lppm.unila.ac.id/id/eprint/26614,2019-02-01 00:00:00.000000000,"Motivation, which refers to students’ reasons for acting, has been well explored in language learning. However, studies on motivation in language learning in many countries have been predominantly inspired by theories of motivation in learning English developed in western countries. The current study serves to: i) identify the motivational orientations of EFL university students in Indonesia; and ii) to investigate whether the west-inspired theories of motivation are still relevant to the Indonesian EFL students. The subjects of the current study were 886 university students. With alphas .70, .53, and .77 for three motivational orientations, the data were then analysed by running Exploratory Factor Analysis with the varimax rotation. The results showed the existence of three reasonable motivational orientations of the EFL students in Indonesia and they are labelled as extrinsic, international and intrinsic orientation.",39,,the University of Pretoria,South African Journal of Education,['FKIP1'],disk0/00/02/66/14,pub,8,public,2020-11-22 11:41:23,"ISSN 0256-0100 (Print), ISSN 2076-3433 (Online)",23289.0,published,https://doi.org/10.15700/saje.v39n1a1500,1-12,,,,,,,,,,,,,,
2,show,2019-11-15 02:51:01,archive,16488,,2019-11-15 02:51:01,"[{'docid': 29572, 'main': 18650, 'files': [{'hash': 'ec0dc599739ddb97eb77f90d09dc457a', 'mime_type': 'application/xml', 'fileid': 140796, 'datasetid': 'document', 'mtime': '2019-11-14 21:09:58', 'hash_type': 'MD5', 'uri': 'http://repository.lppm.unila.ac.id/id/file/140796', 'filename': 18650, 'objectid': 29572, 'filesize': 21691}], 'format': 'text', 'language': 'en', 'mime_type': 'application/xml', 'rev_number': 3, 'content': 'published', 'placement': 1, 'eprintid': 16488, 'pos': 1, 'uri': 'http://repository.lppm.unila.ac.id/id/document/29572', 'security': 'public'}]",,717,2.0,A Modified Student Teams Achievement Divisions (MSTAD) to Enhance Students’ Vocabulary Achievement,TRUE,"[{'name': {'given': 'Windy', 'family': 'Besthia', 'lineage': None, 'honourific': None}, 'id': None}, {'id': 'heryyufrizal@gmail.com', 'name': {'given': 'Hery', 'lineage': None, 'family': 'Yufrizal', 'honourific': None}}, {'id': 'nurweniari@gmail.com', 'name': {'given': 'Ari', 'family': 'Nurweni', 'lineage': None, 'honourific': None}}]",article,"['LB1603', 'PE']",http://repository.lppm.unila.ac.id/id/eprint/16488,1970-01-01 00:00:00.000002019,"The research was implemented to find out i) the significant difference in vocabulary achievement between students who are taught with the STAD technique and the MSTAD technique and ii) to investigate the students’ perceptions towards MSTAD technique. This study applied the true experimental design. There were 32 experimental students and 30 control students as the sample chosen randomly at SMAN 3 Bandar Lampung. The instruments used were the vocabulary test, questionnaire and interview. The result showed that there was a statistically significant difference in vocabulary achievement between students who were taught with the STAD technique and MSTAD technique. It indicates that the vocabulary teaching technique is one of the factors which affects the students’ vocabulary achievement. Furthermore, the use of MSTAD technique in teaching vocabulary is regarded as being more effective to enhance the students’ vocabulary achievement.

Keywords: MSTAD, STAD, vocabulary achievement.",8,"[{'url': 'http://jurnal.fkip.unila.ac.id/index.php/123/article/view/18650', 'type': 'pub'}]",,U-Jet,['FKIP1'],disk0/00/01/64/88,pub,9,public,2019-11-15 02:51:01,,,,,,,,,,,,,,,,,,,
3,show,2019-05-08 07:26:37,archive,11820,http://http://jurnal.fkip.unila.ac.id/index.php/123/article/view/17893/pdf,2019-05-08 07:26:37,"[{'placement': 1, 'eprintid': 11820, 'pos': 1, 'uri': 'http://repository.lppm.unila.ac.id/id/document/24811', 'security': 'public', 'files': [{'mtime': '2019-05-06 18:58:15', 'hash_type': 'MD5', 'uri': 'http://repository.lppm.unila.ac.id/id/file/106388', 'filename': '17893-40584-1-PB Luthfi Rani April 2019.pdf', 'filesize': 528523, 'objectid': 24811, 'mime_type': 'application/pdf', 'hash': 'b73925b366f5d1285da366d4b82de6a5', 'fileid': 106388, 'datasetid': 'document'}], 'main': '17893-40584-1-PB Luthfi Rani April 2019.pdf', 'docid': 24811, 'format': 'text', 'mime_type': 'application/pdf', 'language': 'en', 'rev_number': 1}]",,717,1.0,"MODIFIED DICTOGLOSS TECHNIQUE TO IMPROVE STUDENTS’
WRITING SKILL AT SMA AL-KAUTSAR BANDAR LAMPUNG",TRUE,"[{'id': 'lutfirdewi@gmail.com', 'name': {'given': 'Lutfi Ratni', 'family': 'Dewi', 'lineage': None, 'honourific': None}}, {'id': None, 'name': {'given': 'Flora', 'lineage': None, 'family': 'Flora', 'honourific': None}}, {'id': 'nurweniari@gmail.com', 'name': {'family': 'Nurweni', 'lineage': None, 'honourific': None, 'given': 'Ari'}}]",article,"['L1', 'PE']",http://repository.lppm.unila.ac.id/id/eprint/11820,2019-04-01 00:00:00.000000000,"Abstrak. Penelitian ini bertujuan untuk mengetahui apakah ada peningkatan signifikan pada kemampuan menulis siswa setelah siswa diajar dengan menggunakan modified dictogloss technique, dan aspek apa yang mendapat nilai paling tinggi setelah siswa diajar menggunakan modified dictogloss technique. Penelitian ini menggunakan one group pretest and posttest design adalah desain yang digunakan dalam penelitian ini. Subjek penelitian adalah X MIA 3 SMA Al-Kautsar Bandar Lampung. Hasil penelitian menunjukan bahwa ada peningkatan yang signifikan pada kemampuan menulis siswa setelah diajar menggunakan modified dictogloss technique dilihat dari significant level lebih kecil dari 0.05 (0.00 < 0.05). Dari masing-masing aspek menulis, konten mendapat nilai paling tinggi (16.07 to 21.27) yang artinya ada peningkatan nilai berjumlah 5.19 atau 34%. Hal ini menandakan bahwa teknik modified dictogloss dapat diterapkan untuk meningkatkan keterampilan menulis siswa khususnya dalam aspek konten.

Abstract. This research was aimed to find out whether there was a significant improvement on the students’ writing skill, and what aspect got the highest score after the students were taught by using modified dictogloss technique. This research used one group pretest and posttest design. The subject was X MIA 3 of SMA Al-Kautsar Bandar Lampung. The result showed that there was a significant improvement of thestudents’ writing after being taught through modified dictogloss technique since the significant level is lower than 0.05 ( 0.00 < 0.05 ). From each aspect of writing, contentgot the highest score (16.07 to 21.27) which meant the score improved 5.19 or 34%.This suggests that modified dictogloss technique facilitates the students to improve their ability in writing skill especially in the term of content aspect.
Keywords: writing, writing ability, modified dictogloss technique",8,,,U-JET,['FKIP1'],disk0/00/01/18/20,pub,9,public,2019-05-08 07:26:37,,,,,,,,,,,,,,,,,,,
4,show,2020-05-18 02:10:58,archive,19768,,2020-05-18 02:10:58,"[{'pos': 1, 'uri': 'http://repository.lppm.unila.ac.id/id/document/33044', 'security': 'public', 'placement': 1, 'eprintid': 19768, 'language': 'en', 'mime_type': 'text/html', 'rev_number': 3, 'content': 'published', 'docid': 33044, 'main': 8297, 'files': [{'mime_type': 'text/html', 'hash': '555f2eff6bef27ed90320fd2c3fb0fe8', 'fileid': 187273, 'datasetid': 'document', 'uri': 'http://repository.lppm.unila.ac.id/id/file/187273', 'filename': 8297, 'filesize': 28027, 'objectid': 33044, 'mtime': '2020-05-16 05:33:19', 'hash_type': 'MD5'}], 'format': 'text'}]",,717,2.0,EFL Students' Needs of Digital Literacy to Meet the Demands of 21st Century Skills,TRUE,"[{'name': {'given': 'E', 'family': 'ERYANSYAH', 'lineage': None, 'honourific': None}}, {'name': {'given': 'E', 'family': 'ERLINA', 'lineage': None, 'honourific': None}}, {'name': {'honourific': None, 'family': 'FIFTINOVA', 'lineage': None, 'given': 'F'}}, {'name': {'given': 'Ari', 'family': 'NURWENI', 'lineage': None, 'honourific': None}}]",article,"['L1', 'PE']",http://repository.lppm.unila.ac.id/id/eprint/19768,2019-12-01 00:00:00.000000000,"This study was a survey study which was aimed at looking at EFL students’ current knowledge and skills of ICT. The research questions of this study were(1) What levels of digital literacy are the EFL students?, (2) What are the factors affecting EFL students in using ICT in language learning?, and (3) What are the students' needs to improve their digital literacy skills to meet the demands of the 21st century skills?  Two groups of EFL students from two state-owned universities in the southern part of Sumatra were involved in this study. A set of questionnaires adapted from Ravitz (2014) was used. The findings showed that EFL students’ current level of digital literacy was categorized low. Factors affecting them from using ICT in language learning properly were limited use of ICT applications as a tool for language learning and limited access to computers and internet applications on campus. What the EFL students needed to improve their digital literacy skills was the availability of computers with internet applications to be used anytime on campus, ICT training for both teachers and students, and continuous integration of ICT in language learning. 
 
Keywords Digital technology, ICT, digital native, digitally literate",3,[{'url': 'https://online-journal.unja.ac.id/irje/article/view/8297'}],"Prodi Pendidikan Bahasa Inggris, Universitas Jambi",IRJE,['FKIP1'],disk0/00/01/97/68,pub,9,public,2020-05-18 02:10:58,2580-5711,,published,,442-460,"['UNSRI', 'UNSRI', 'UNSRI', 'UNILA']",,,,,,,,,,,,,
5,show,2020-02-25 04:07:12,archive,18201,https://www.jardcs.org/index.php,2020-02-25 04:07:12,"[{'files': [{'hash': '1fb2e977dc06dcf5f50981083cec290f', 'mime_type': 'application/pdf', 'fileid': 153224, 'datasetid': 'document', 'uri': 'http://repository.lppm.unila.ac.id/id/file/153224', 'filename': 'article-2-9.pdf', 'objectid': 31339, 'filesize': 2703263, 'mtime': '2020-02-25 02:57:55', 'hash_type': 'MD5'}], 'main': 'article-2-9.pdf', 'docid': 31339, 'format': 'text', 'rev_number': 1, 'language': 'en', 'mime_type': 'application/pdf', 'placement': 1, 'eprintid': 18201, 'uri': 'http://repository.lppm.unila.ac.id/id/document/31339', 'pos': 1, 'security': 'public'}]",,915,7.0,Designing a Course Book of English for University Students (Experts’ Judgments),TRUE,"[{'name': {'family': 'Effendi', 'lineage': None, 'honourific': None, 'given': 'Linda Septarina'}, 'id': None}, {'name': {'honourific': None, 'lineage': None, 'family': 'Saleh', 'given': 'Sushanty'}, 'id': None}, {'name': {'honourific': None, 'lineage': None, 'family': 'Yufrizal', 'given': 'Hery'}, 'id': 'heryyufrizal@gmail.com'}]",article,"['L1', 'LB2300']",http://repository.lppm.unila.ac.id/id/eprint/18201,2019-09-01 00:00:00.000000000,"This study was conducted in order to cater for the needs to equip English lecturers at higher education level in Indonesia. English is a compulsory subject at tertiary education level in Indonesian higher level education the study applied experts’ judgment on the use of course book for English at tertiary level of education. The experts were asked to make a judgment on the use of course book frame four points of judgment: the Contents of Course Book, evaluations on for language skills, Course Book Appearance, and Practical Consideration of the course book. The results showed that more positive responses were given by the respondents on each aspect of book evaluation.",11,"[{'type': 'pub', 'url': 'https://www.jardcs.org/abstract.php?id=1897'}]",Institute of Advanced Scientific Research,Journal of Advanced Research in Dynamical & Control Systems,['FKIP1'],disk0/00/01/82/01,pub,7,public,2020-02-25 04:07:12,1943-023X,,published,,1092-1099,,,,,,,,,,,,,,
6,show,2019-05-21 02:58:03,archive,13019,,2019-05-21 02:58:03,"[{'format': 'archive', 'main': 17401, 'files': [{'objectid': 26023, 'filesize': 22365, 'uri': 'http://repository.lppm.unila.ac.id/id/file/114684', 'filename': 17401, 'hash_type': 'MD5', 'mtime': '2019-05-17 03:24:49', 'datasetid': 'document', 'fileid': 114684, 'hash': 'afc4863e9838df0260733e753a23d47e', 'mime_type': 'application/xml'}], 'docid': 26023, 'content': 'published', 'language': 'id', 'rev_number': 3, 'mime_type': 'application/xml', 'eprintid': 13019, 'placement': 1, 'security': 'public', 'uri': 'http://repository.lppm.unila.ac.id/id/document/26023', 'pos': 1}]",,383,1.0,Pembelajaran Menulis Teks Deskripsi Bahasa Prancis Siswa Kelas XI IPS 3 SMA Negeri 9 Bandarlampung Tahun Pelajaran 2017/2018,TRUE,"[{'name': {'given': 'Fina', 'honourific': None, 'lineage': None, 'family': 'Fitria'}, 'id': 'finafitt95@gmail.com'}, {'name': {'family': 'Sumarti', 'lineage': None, 'honourific': None, 'given': 'Sumarti'}, 'id': 'gragemarti@yahoo.co.id'}, {'name': {'honourific': None, 'lineage': None, 'family': 'Kusrini', 'given': 'Nani'}, 'id': 'nani.kusrini7@gmail.com'}]",article,"['L1', 'PC']",http://repository.lppm.unila.ac.id/id/eprint/13019,2019-01-01 00:00:00.000000000,"Tujuan penelitian ini adalah untuk mendeskripsikan pembelajaran menulis teks deskripsi bahasa Prancis pada siswa kelas XI IPS 3 SMA Negeri 9 Bandarlampung Tahun Pelajaran 2017/2018. Metode penelitian yang digunakan adalah deksriptif kualitatif. Sumber data pada penelitian ini ialah kegiatan pembelajaran menulis teks deskripsi bahasa Prancis. Teknik pengumpulan data pada penelitian ini dilakukan dengan caraobservasi, dokumentasi, dan wawancara. Hasil penelitian menunjukkan guru melakukan tiga tahap kegiatan dalam pembelajaran. Ketiga kegiatan tersebut mencakup (1)  perencanaan, yaitu guru membuat RPP sesuai dengan Permendikbud, (2) pelaksanaan, yang melibatkan keaktifan siswa dan guru, (3) penilaian pembelajaran, guru menggunakan teknik tes dengan bentuk soal essai. Pada perencanaan guru telah menyusun RPP dengan lengkap berdasarkan KD dan indikator. Pelaksanaan pembelajaran yang dilakukan guru meliputikegiatan pendahuluan, inti, dan penutup  yang melibatkan kegiatan guru dan siswa sesuai dengan APKG. Untuk penilaian pembelajaran menulis teks deskripsi, guru menggunakan jenis tes tertulis dalam bentuk tes uraian/essai.

Kata kunci: menulis, pembelajaran bahasa Prancis, teks deskripsi",1,,Pendidikan Bahasa Prancis Unila,Pranala,['FKIP1'],disk0/00/01/30/19,pub,9,public,2019-05-21 02:58:03,,,published,,,,,,,,,,,,,,,,
7,show,2020-05-04 01:49:21,archive,19387,http://www.ijllnet.com/journal/index/2569,2020-05-04 01:49:21,"[{'format': 'text', 'main': 'ILL PUBLISHING.pdf', 'docid': 32614, 'files': [{'objectid': 32614, 'filesize': 305812, 'filename': 'ILL PUBLISHING.pdf', 'uri': 'http://repository.lppm.unila.ac.id/id/file/162150', 'hash_type': 'MD5', 'mtime': '2020-05-01 13:12:16', 'fileid': 162150, 'datasetid': 'document', 'hash': '55dfebbaebf45572a23428afec16bab0', 'mime_type': 'application/pdf'}], 'language': 'en', 'rev_number': 1, 'mime_type': 'application/pdf', 'eprintid': 19387, 'placement': 2, 'security': 'public', 'uri': 'http://repository.lppm.unila.ac.id/id/document/32614', 'pos': 2}]",,848,4.0,Integrating Mind Mapping (MM) and Three-Step-Interview (TSI) in Enhancing Students’ Writing Process in Foreign Language Setting,TRUE,"[{'name': {'lineage': None, 'family': 'Flora', 'honourific': None, 'given': 'Flora'}}]",article,"['LB', 'PR']",http://repository.lppm.unila.ac.id/id/eprint/19387,2019-12-01 00:00:00.000000000,"There had been many studies conducted to investigate the benefits of Mind Mapping (MM) in the writing process and Three-Step-Interview (TSI ) in the speaking process, this study set out to investigate the effectiveness of an integrated technique which was the combination of MM and TSI in teaching writing. This technique was intended to facilitate the students with individual and group brainstorming practice and to help create another teaching procedure which could effectively solve the students’ writing problem, especially in generating and organizing ideas in the pre-writing process. The subject of this study was 29 students who took Intermediate Writing subject at English Department Faculty of Education, Lampung University-Indonesia . The pretest and posttest were administered before and after the treatment. The data was analyzed by means of the paired sample t-test. The result shows that the students' writing ability significantly improved subsequent to the treatment. It also reveals that the most significant improvements were those of the writing content and organization aspects. The results are discussed in relation to relevant previous research findings.",6,"[{'type': 'pub', 'url': 'http://www.ijllnet.com/journal/index/2569'}]",International Journal of Language & Linguistics,International Journal of Language and Linguistics,['FKIP1'],disk0/00/01/93/87,pub,9,public,2020-05-04 01:49:21,2374-8850,,published,,145-150,,,,,,,,,,,,,,
