,uri,date,abstract,corp_creators,volume,date_type,subjects,rev_number,ispublished,issn,full_text_status,status_changed,publisher,publication,dir,divisions,official_url,lastmod,documents,userid,number,metadata_visibility,pagerange,datestamp,eprintid,eprint_status,title,refereed,type,creators,referencetext,contributors,keywords,contact_email,funders,id_number,related_url
0,http://repository.lppm.unila.ac.id/id/eprint/783,1999-01-01 00:00:00.000000000,"This study was carried out to clarify the properties of Arbuscular Mycorrhizal Fungi (AMF) from different types of land used at Sunbarjaya in Southern Sumatra, Indonesia.
The soil samples were collected from primary forest (P. F.: Hopea mengarawan, H. sangal, and Dryobalanops spp.), secondary forest (S. F.: Daemonorops oblongata, H. ficus and H. calamus), coffee field (C. F.: Coffea robusta) and native grassland (N. G.: Imperata cylindrica) where were about 1, 200, 100, 800 and 800m above sea level, respectively. Sampling sites for C. F. were selected from three locations along the hillslope.
There were four genera and ten species of AM fungal spores identified from the P. F., S. F., C. F., and bush soils of the Sunbarjaya areas. Glomus etunicatum, G. constrictum and G. aggregatum were found in all land uses. The total spore numbers of G. constrictum and G. aggregatum were much greater in the C. F. soils compared to other soils. But, the number of genera and species in the C. F. soils was low compared to the P. F. and S. F. soils. G. constrictum predominated in all soils and G. aggregatum only predominated in the C. F. soils.",['University of Lampung'],14.0,published,['S1'],8,pub,1342-6311,public,2016-10-13 15:41:32,J-Stage,Microbes and Environment,disk0/00/00/07/83,['FP23'],https://www.jstage.jst.go.jp/browse/jsme2,2016-10-13 15:41:32,"[{'mime_type': 'application/pdf', 'language': 'en', 'rev_number': 1, 'main': 'Ainin - Mic&Envir  1999.pdf', 'docid': 676, 'files': [{'mime_type': 'application/pdf', 'hash': '7d685aecf2ba9b5937bac21b34e0fd7a', 'datasetid': 'document', 'fileid': 4560, 'mtime': '2016-10-12 09:42:44', 'hash_type': 'MD5', 'filename': 'Ainin - Mic&Envir  1999.pdf', 'uri': 'http://repository.lppm.unila.ac.id/id/file/4560', 'filesize': 2609133, 'objectid': 676}], 'format': 'text', 'uri': 'http://repository.lppm.unila.ac.id/id/document/676', 'pos': 1, 'security': 'public', 'placement': 1, 'eprintid': 783}]",1055,1.0,show,9-17,2016-10-13 15:41:32,783,archive,"Population of Arbuscular Mycorrhizal Fungi (AMF) by Different Land Use in Sumatra, Indonesia",TRUE,article,"[{'id': 'abimasyarif@gmail.com', 'name': {'family': 'Arif', 'lineage': None, 'honourific': None, 'given': 'Mas Achmad Syamsul'}}, {'id': 'sri.yusnaini@fp.unila.ac.id', 'name': {'family': 'Yusnaini', 'lineage': None, 'honourific': None, 'given': 'Sri'}}, {'id': 'ainin.niswati@fp.unila.ac.id', 'name': {'given': 'Ainin', 'honourific': None, 'family': 'Niswati', 'lineage': None}}, {'name': {'given': 'Agus', 'honourific': None, 'lineage': None, 'family': 'Setiawan'}, 'id': None}, {'name': {'given': 'Koichi', 'lineage': None, 'family': 'Tuchida', 'honourific': None}, 'id': None}, {'id': None, 'name': {'given': 'Tuyoshi', 'honourific': None, 'lineage': None, 'family': 'Katou'}}, {'id': None, 'name': {'family': 'Touji', 'lineage': None, 'honourific': None, 'given': 'Yuka'}}, {'id': None, 'name': {'given': 'Masanori', 'honourific': None, 'lineage': None, 'family': 'Nonaka'}}]",,,,,,,
1,http://repository.lppm.unila.ac.id/id/eprint/1253,1999-12-01 00:00:00.000000000,"The experiment aimed to study the change in phosphorus absorption by corn driven by lime, vesicular arbuscular mycorrhiza (VAM), and natural rock phosphate in ultisol Taman BogoCentral Lampung. A factorial experiment (2x2x2) aranged in a completely randomized block design with three replicates was conducted.  The first factor was lime (CaCO3): without and with lime 4 t-1 ha. The second factor was VAM inoculation: without and with VAM inoculation. The third factor was BFA application: 0, 500, 1000, and 1,500 kg ha-1. The results showed that application of lime in Ultisol Taman Bogo sigrificantly increased P absorption by corn, pH, dry-matter yield of corn, and percent VAM infection. VAM inoculation very significantly affected percent VAM infection, but did not sigrrificantly affect phosphorus absorption, pH, and dry-matter yield of corn.  However, without lime applicatioru VAM inoculation sigLihcantly increased P absorption by com by I1,06%. On lime application without VAM inoculation treatment, application of BFA significantly increased P absorption by corn, pH, and dry matter of corn yields.",['University of Lampung'],5.0,published,['S1'],8,pub,0852-257X,public,2016-11-23 09:38:48,University of Lampung,Journal of Tropical Soils,disk0/00/00/12/53,['FP23'],,2016-11-23 09:38:48,"[{'placement': 2, 'eprintid': 1253, 'uri': 'http://repository.lppm.unila.ac.id/id/document/1131', 'pos': 2, 'security': 'public', 'files': [{'filename': 'Dermiyati JTT 1999.pdf', 'uri': 'http://repository.lppm.unila.ac.id/id/file/8401', 'objectid': 1131, 'filesize': 17173677, 'mtime': '2016-11-23 06:56:08', 'hash_type': 'MD5', 'mime_type': 'application/pdf', 'hash': 'ffc43d73f9f54cf9aaff7da05ac5be9f', 'datasetid': 'document', 'fileid': 8401}], 'main': 'Dermiyati JTT 1999.pdf', 'docid': 1131, 'format': 'text', 'rev_number': 2, 'language': 'en', 'mime_type': 'application/pdf', 'content': 'published'}]",1045,2.0,show,89-94,2016-11-23 09:38:48,1253,archive,"Change in Phosphorus Absorption by Corn Driven by Lime, Vesicular Arbuscular Mycorrhizae, and Natural Rock Phosphate in Entisol Taman Bogo Central Lampung",TRUE,article,"[{'name': {'given': '-', 'honourific': None, 'family': 'Dermiyati', 'lineage': None}, 'id': 'dermiyati.1963@fp.unila.ac.id'}]",,,,,,,
2,http://repository.lppm.unila.ac.id/id/eprint/6472,1970-01-01 00:00:00.000001999,"Forest conversion is suggested to change some physical and chemical properties of soils including the availabilities of heavy metal micronutrients.  This research was to study the changes in heavy metal micronutrient availabilities caused by land use conversion from forest to plantation and cultivated lands.  Soil samples were taken from 3 locations (Bukit Ringgis, Sekincau, and Tri Mulya) in West Lampung, each of which comprised four land-uses, i.e. primary forest, secondary forest, coffee plantation, and intensive cultivated land.  Availabilities of Cu, Zn, and Fe were in general higher in the primary forest and/or secondary forest than those in coffee plantation and cultivated land.  This phenomenon indicates that land-use conversion from forest to other land-uses lowered the availabilities of heavy metal micronutrients.  The availability of Mn in Tri Mulya was higher in forest than those in coffee plantation and cultivated land, but lower in forest than those in coffee plantation and cultivated land in Bukit Ringgis and Sekincau.  This phenomenon indicates that Mn released through soil weathering in coffee plantation and cultivated lands in Bukit Ringgis and Sekincau was adsorbed by soil labile fractions while those on Tri Mulya was leached out, precipitated, or strongly adsorbed by soil solids. With a few exceptions, the changes in available heavy metal micronutrients were correlated with the changes in soil CEC, organic C, and total N.",['University of Lampung'],19.0,published,['S1'],6,pub,0216-2717,public,2018-04-26 03:58:59,PSL Indonesia,Lingkungan dan Pembangnan,disk0/00/00/64/72,['FP23'],,2018-04-26 03:58:59,"[{'docid': 19415, 'main': '52-UHMLambar.pdf', 'files': [{'mime_type': 'application/pdf', 'hash': 'ec7cfa4256b3b427b5b9df77ecccd4ef', 'datasetid': 'document', 'fileid': 59924, 'uri': 'http://repository.lppm.unila.ac.id/id/file/59924', 'filename': '52-UHMLambar.pdf', 'filesize': 4898205, 'objectid': 19415, 'mtime': '2018-02-12 07:56:14', 'hash_type': 'MD5'}], 'format': 'text', 'language': 'en', 'mime_type': 'application/pdf', 'rev_number': 1, 'placement': 1, 'eprintid': 6472, 'uri': 'http://repository.lppm.unila.ac.id/id/document/19415', 'pos': 1, 'security': 'public'}]",1056,3.0,show,176-183,2018-04-26 03:58:59,6472,archive,Perubahan Ketersediaan Unsur Hara Mikro Kelompok Logam Berat Akibat Alih Fungsi Lahan di Lampung  Barat,TRUE,article,"[{'id': 'abdul.kadir@fp.unila.ac.id', 'name': {'given': 'Abdul Kadir', 'lineage': None, 'family': 'Salam', 'honourific': None}}]","Alloway, B.J.  1990.  Soil processes and the behavior of metals. Hlm.7-28.  Dalam B.J. Alloway (ed.).  Heavy Metals in Soils. Blackie,  London.
Baker, D.E. & M.C. Amacher.  1982. Nickel, copper, zinc, and cadmium.  Dalam A.L. Page, R.H. Miller, & D.R. Keeney (ed). Methods of Soil Analysis Part 2 Chemical and Microbiological Properties.  Ed. ke-2. SSSA Inc., Madison:323-36.
Gimeno-Garcia, E., V. Andreu, & R. Boluda.  1996.  Heavy metals incidence in the application of inorganic fertilizers and pesticides to rice farming. Environ. Pollut. 92:19-25.
He, Q.B. & B.R. Singh.  1994.  Crop uptake of cadmium from phosphorus fertilizers: II. Relationship with extractable soil cadmium.  Water Air Soil Pollut., 74:26-28.
Herreno, T.C. & L.F.L. Martin.  1993.  Evaluation of cadmium levels in fertilized  soils.   Bull.  Environ.  Contam. Toxicol., 50:61-68.
Klein, T.M. & J.S. Koths.  1980.  Urease, protease, and acid phosphatase in soil continuously cropped to corn by conventional or no-tillage methods.  Soil Biol.  Biochem., 12:293-294.
McGrath, S.P., J.R. Sanders, & M.H. Shalaby  1988.  The effets of soil organic matter levels on solution concentration and extractabilities of manganese, zinc, and copper.  Geoderma,  42:177-188.
Mclaughlin, M.J., K.G. Tiller, R. Naidu, & D.P.  Stevens.  1996.  Review: The behavior and environmental impact of contaminant in fertilizers.  Aust. J. Soil Res, 34:1-54.
Parfitt, R.L., D.J. Giltrap, & J..S. Whitton.  1995.  Contribution of organic matter and clay mineral to the cation exchange capacity of soil.  Commun. Soil Sci.  Plant Anal., 26:1343-1355.
Rodella, A., K.R. Fisher; & J.C. Alcarde.  1995.  Cation exchange capacity of an acid soil as influenced by different sources of organic matter..  Commun. Soil Sci. Plant Anal., 26: 2961-2967.
Salam, A.K.  1996.  Aktivitas enzirn fosfatase pada lahan kopi berlereng dengan beberapa tcknik pengendalian  gulma. Pros.Konf. HIGI XIII:77-84.
Salam, A.K., A. Katayama, dan M. Kimura.  1998. The activities of some soil enzymes in different land-use systems after deforestation in hilly areas of West Lampung, South Sumatra,  Indonesia.  Soil Sci. Plant Nutr., 44: 93- 103.","[{'name': {'honourific': None, 'lineage': None, 'family': 'Salam', 'given': 'Abdul Kadir'}, 'type': 'http://www.loc.gov/loc.terms/relators/AUT', 'id': 'axauam@gmail.com'}]","Forest, Heavy Metals, Land-Use Conversion, Micronutrients",axauam@gmail.com,['JSPS'],,
3,http://repository.lppm.unila.ac.id/id/eprint/6534,1999-04-01 00:00:00.000000000,"Heavy metals are potentially toxic to soil microorganisms and are suggested to decrease soil enzymatic activities.  Changes in activity of acid phosphatase in root-zones of some tropical plants treated with a lead-containing industrial waste were studied in a glasshouse experiment.  Tropical soil sample  (from Gedongmeneng and Banjaragung, Lampung) thoroughly treated with an electronics industrial waste at O to 40 ton ha-1and lime at O or 5 ton CaC03 ha-1 were cultured with corn (Zea mays L.), amaranth (Amaranthus tricolor L), and green kyllinga (Cyperus kyllingia). Changes in acid phosphatase activity, soil Pb concentration, and soil pH were measured after a 4 week growing period.  Soil analysis showed that the activity of acid phosphatase was higher in Banjaragung soil than that in Gedongmeneng soil except in those cultured with green kyllinga.  The activity of acid phosphatase was in general higher in the root-zone of corn than those in the root-zone of amaranth and green kyllinga.  The activity of acid phosphatase in both soils decreased with waste addition regardless of plant grown.  This was in good correlation with the increase in soil available Pb as waste was added.  However, the decrease in activity of acid phosphate as the soil pH increased by lime or waste addition suggested that the decrease in the phosphatase activity with waste addition was driven by the  increase in soil pH rather than by the increase in soil available Pb with waste addition.",['University of Lampung'],2.0,published,['S1'],6,pub,1410-7333,public,2018-04-26 04:05:49,Jurusan Tanah IPB,Jurnal Ilmu Tanah dan Lingkungan,disk0/00/00/65/34,['FP23'],,2018-04-26 04:05:49,"[{'placement': 1, 'eprintid': 6534, 'pos': 1, 'uri': 'http://repository.lppm.unila.ac.id/id/document/19486', 'security': 'public', 'files': [{'mime_type': 'application/pdf', 'hash': 'fb5691e2e4c13b45a9bee57ce8f70996', 'fileid': 60424, 'datasetid': 'document', 'mtime': '2018-02-23 09:36:59', 'hash_type': 'MD5', 'filename': '48-FosfataseVivin.pdf', 'uri': 'http://repository.lppm.unila.ac.id/id/file/60424', 'filesize': 4161007, 'objectid': 19486}], 'main': '48-FosfataseVivin.pdf', 'docid': 19486, 'format': 'text', 'language': 'en', 'rev_number': 1, 'mime_type': 'application/pdf'}]",1056,1.0,show,1-6,2018-04-26 04:05:49,6534,archive,Penurunan Aktivitas Fosfatase Asam di Daerah Perakaran Beberapa Jenis Tanaman Akibat Perlakuan Kapur dan Limbah Industri Bertimah Hitam,TRUE,article,"[{'id': 'abdul.kadir@fp.unila.ac.id', 'name': {'family': 'Salam', 'lineage': None, 'honourific': None, 'given': 'Abdul Kadir'}}, {'name': {'given': 'Vivin', 'family': 'Arisanti', 'lineage': None, 'honourific': None}, 'id': None}, {'name': {'given': 'Sri', 'honourific': None, 'family': 'Yusnaini', 'lineage': None}, 'id': 'sri.yusnaini@fp.unila.ac.id'}]","Arisanti. V.  1998.  Aktivitas fosfatase asam di daerah perakaran tanaman jagung (Zea mays L.), Bayam (Amaranthus tricolor L.), dan Gulma Teki (Cyperus kyllingia  Endl.) yang diperlakukan dengan limbah industri elektronika dan kapur pada tanah Oxisol dan Alfisol. Skripsi Sarjana. Fakultas Pertanian Universitas  Lampung, Bandar Lampung.

Baath, E.  1989.  Effects of heavy metals in soil on microbial processes and populations (a review).  Water Air Soil Pollut., 47:335-379 .

Baker, D.E. and M.C. Amacher.  1982.  Nickel, copper, zinc, and cadmium. p.323-336. In A.L. Page, R.H. Miller, and D.R. Keeney (Eds.). Methods of Soil Analysis Part 2: Chemical and Microbiological Properties. 2nd ed. SSSA Inc., Madison.
Fliebach, A., R. Martens, and H.H. Reber.  1994. Soil microbial biomass and microbial activity in soils treated with heavy metal-contaminated sewage sludge. Soil Biol. Biochem., 26:1201-1205.
Frankenberger Jr., W.T. and J.B. Johanson.  1982.  Effect of pH on enzyme stability in soils. Soil Biol. Biochem., 14:433-437.
Huysman, F., W. Verstraete, and P.C. Brookes.  1994. Effect of manuring practices and increased copper concentrations on soil microbial populations.  Soil Biol. Biochem .. 26:103-110
Juma, N. G. and M.A.  Tabatabai.  1977.  Effects of trace elements on phosphatase activity in soils. Soil Sci. Soc. Am. J., 41:343-346.
Mathur, S.P., J.I. MacDougall, and M. McGrath.  1980.  Levels of activities of some carbohydrase, protease, lipase, and phosphatase in organic soils of differing copper content. Soil Sci., 129:376-385.
Park, S.C,, T.J. Smith, and M.S. Bisesi.  1992.  Activities of phosphomonoesterase and phosphodiesterase from Lumbriscus terrestris.  Soil Biol. Biochem., 24:873-876.
Reddy, G.B., A. Faza, and R. Bennet, Jr.  1987.  Activity of enzymes in rhizosphere and non-rhizosphere soils amended with sludge.  Soil Biol. Biochem., 19:203-205.
Reddy, G.B. and A. Faza.  1989.  Dehydrogenase activity in sludge amended soil.  Soil Biol. Biochem., 21:327.
Salam. A.K., S. Djuniwati, J.T. Harahap dan Suwarto.  1996.  Imobilisasi logam berat asal limbah industri di dalam tanah tropika: 1. Sifat kimia limbah industri.  J. Ilmiah Il.. Pert., 4(1):61-67.
Salam, A.K., A. Katayama, and M. Kimura. 1997a.  The activity of soil acid-phosphatase at elevated concentrations  of heavy metals.  J. Teknik Lingk.,  3(1).7-12.
Salam. A.K., S. Djuniwati, dan Sarno.  1997b.  Lowering heavy metal solubilities in tropical soils by lime and cassava-leaf compost additions.  Proc. Environ. Technol. Manag Sem. (dalam pencetakan).
Salam, A.K., A. Katayama, and M. Kimura.  1998.  Activities of some soil enzymes in different land use systems after deforestation in hilly areas of West Lampung, South Sumatra, Indonesia.  Soil Sci. Plant Nutr., 44:93-103.
Stott, D.E., W.A. Dick, and M.A. Tabatabai.  1985.  Inhibition of pyrophosphatase activity in soils by trace elements.  Soil Sci., 139:112-117.
Tabatabai, M.A.  1982.  Soil enzymes.  p. 903-947. In A.L. Page, R.H. Miller, and D.R. Keeney (Eds). Methods of Soil Analysis Part 2: Chemical and Microbiological Properties. 2nd ed. Soil Sci. Soc. Am., Inc., Madison.
Tate III, R.L.  1987.  Soil Organic Matter Biological and Ecological Effects.  John Wiley & Sons, New York.","[{'name': {'given': 'Abdul Kadir', 'lineage': None, 'family': 'Salam', 'honourific': None}, 'type': 'http://www.loc.gov/loc.terms/relators/AUT', 'id': 'axauam@gmail.com'}]","Industrial Waste, Lead, Lime, Phosphatase, Tropical Plants, Tropical Soils",axauam@gmail.com,['JSPS'],,
4,http://repository.lppm.unila.ac.id/id/eprint/6468,1999-09-01 00:00:00.000000000,"Activities of soil enzymes in rooting zones of young cassava plants were evaluated in a cassava plantation in Gunung Batin area, Lampung, Indonesia.  Soil samples were collected in triplicates at distances of 0, 10, 20, and 30 cm from the cassava plants main stems 2 to 5.5 months after planting.  The activity of acid phosphatase in general decreased with the age of cassava plants until 4.5 months while that of alkaline phosphatase showed no significant changes, and as that of acid phosphatase, alkaline phosphatase activity significantly increased at 5.5 month observation.  The activity of -glucosidase and arylsulfatase at 2 or 2.5 month observations generally lower than those at later observations.  Distances from the main stems showed no effect on the activities of acid and alkaline phosphatases.  However, the activity of -glucosidase at 3.5-5.5 month observations decreased and that of arylsulfatase slightly increased with distances from the cassava plants main stems.",['University of Lampung'],,published,['S1'],6,pub,979-8287-24-X,public,2018-04-26 03:59:07,University of Lampung,International Seminar Towards Sustainable Agriculture in Humid Tropics Facing 21st Century,disk0/00/00/64/68,['FP23'],,2018-04-26 03:59:07,"[{'rev_number': 1, 'language': 'en', 'mime_type': 'application/pdf', 'files': [{'datasetid': 'document', 'fileid': 59894, 'hash': 'e40a672e218880365d09e2409c74c444', 'mime_type': 'application/pdf', 'filesize': 4699109, 'objectid': 19410, 'filename': '54-EnzymesHSB.pdf', 'uri': 'http://repository.lppm.unila.ac.id/id/file/59894', 'hash_type': 'MD5', 'mtime': '2018-02-10 03:52:06'}], 'main': '54-EnzymesHSB.pdf', 'docid': 19410, 'format': 'text', 'uri': 'http://repository.lppm.unila.ac.id/id/document/19410', 'pos': 1, 'security': 'public', 'placement': 1, 'eprintid': 6468}]",1056,,show,73-79,2018-04-26 03:59:07,6468,archive,"Soil Enzymatic Activities in Young Cassava Plant Rooting Zones in Lampung, South Sumatra, Indonesia",TRUE,article,"[{'name': {'family': 'Salam', 'lineage': None, 'honourific': None, 'given': 'Abdul Kadir'}, 'id': 'abdul.kadir@fp.unila.ac.id'}, {'id': None, 'name': {'honourific': None, 'family': 'Bahri', 'lineage': None, 'given': 'Herry Syaiful'}}, {'id': 'sri.yusnaini@fp.unila.ac.id', 'name': {'honourific': None, 'family': 'Yusnaini', 'lineage': None, 'given': 'Sri'}}, {'id': None, 'name': {'family': 'Kimura', 'lineage': None, 'honourific': None, 'given': 'Makoto'}}]","Bremner, J.M.and Mulvaney, C.S.  1982.  Nitrogen total.  pp.595-624 In Page, A.L., Miller, R.H. and Keeney, D.R. (eds.).  Methods of Soil Analysis, Part 2, Chemical and Microbiological Properties.  2nd ed.  Soil Science Society of America, Inc., Madison.
Duxbury, J.M. and Tate III, R.L.  1981.  The effect of soil depth and crop cover on enzymatic activities in Pahokee muck.  Soil Sci. Soc. Am. J., 45:322-328.
Fox, T.R. and Comerford, N.B.  1992.  Rhizosphere phosphatase activity and phosphatase hydrolyzable organic phosphorous in two forested Spodosols.  Soil Biol. Biochem., 24:579-583.
Joner, E.J. and Jakobsen, I.  1995.  Growth and extracellular phosphatase activity of arbuscular mycorrhizal hyphae as influenced by soil organic matter.  Soil Biol. Biochem., 27:1153-1159.
Nelson, D.W. and Somners, L.E.  1982.  Total carbon, organic carbon, and organic matter. pp.539-579.  In Page, A.L., Miller, R.H. and Keeney, D.R. (eds.).  Methods of Soil Analysis, Part 2, Chemical and Microbiological Properties. 2nd ed.  Soil Science Society of America, Inc., Madison.
Sakai, H. and Tadano, T.  1993.  Characteristics of response of acid phosphatase secreted by roots of several crops to various conditions in the growth media.  Soil Sci. Plant Nutr., 39:437-587.
Salam, A.K., Katayama, A. and Kimura, M.  1998.  Activities of some soil enzymes in different land use systems after deforestation in hilly areas of West Lampung, South Sumatra, Indonesia.  Soil Sci. Plant Nutr., 44:93-103.
Salam, A.K., Desvia, Y., Sutanto, E., Syam, T., Nugroho, S.G. and Kimura, M.  1999a.  Activities of soil enzymes in different land-use systems in middle terrace areas of Lampung Province, South Sumatra, Indonesia.  Soil Sci. Plant Nutr., 45(1):89-99.
Salam, A.K., Sutanto, E., Desvia, Y., Niswati, A., Dermiyati, and Kimura, M.  1999b.  Activities of enzymes in soils continuously cultured to cassava, pineapple and sugarcane in Lampung Province, South Sumatra, Indonesia.  Soil Sci. Plant Nutr., 45 (In Press).
Salam, A.K., Afandi, Sriyani, N., and Kimura, M.  1999c.  Changes in soil enzymatic activities in hilly coffee plantation in Lampung Province, South Sumatra, Indonesia, managed by different soil conservation techniques.  Soil Sci. Plant Nutr., (Submitted for publication).
Reddy, G.B., Faza, A. and Bennet, R., Jr.  1987.  Activity of enzymes in rhizosphere and non-rhizosphere soils amended with sludge.  Soil Biol. Biochem., 19:203-205.","[{'type': 'http://www.loc.gov/loc.terms/relators/AUT', 'name': {'family': 'Salam', 'lineage': None, 'honourific': None, 'given': 'Abdul Kadir'}, 'id': 'axauam@gmail.com'}]","Arylsulfatase, -Glucosidase, Cassava, Phosphatases, Soil Enzymes",axauam@gmail.com,['University of Lampung'],,
5,http://repository.lppm.unila.ac.id/id/eprint/1046,1999-02-01 00:00:00.000000000,"Changes in the activities of several soil enzymes due to land-use conversion from forests to cultivated lands in the middle terrace areas in Lampung Province, South Sumatra, Indonesia, were monitored. Soil samples were collected from 5 locations in the northern and northeastern regions of Lampung, each comprising several land-use systems (secondary forests, cacao plantations, pineapple plantations, rubber plantations, mixed gardens, cassava fields, corn fields, a rice field, etc.) depending on the distribution of the respective land-use systems at each location. Enzyme assays showed that, with a few exceptions, the activities of acid and alkaline phosphatases, beta-glucosidase, and arylsulfatase in the topsoils (0 to 20cm depth) were higher than, and well correlated with, those in the subsoils (20 to 40 cm depth). Activities of soil enzymes were in general well correlated with the content of total soil nitrogen. No distinct differences in enzymatic activities in soils were observed among the land-use systems. Among the soil enzymes studied, acid phosphatase activity showed a significant relationship only with alkaline phosphatase activity in the topsoils. In contrast, alkaline phosphatase activity showed a significant relation with the other enzymatic activities tested in the topsoils and with arylsulfatase and beta-glucosidase activities in the subsoils. Arylsulfatase activity also showed a high correlation with beta-glucosidase activity in both topsoils and subsoils",['University of Lampung'],45.0,published,['S1'],8,pub,0038-0768,public,2016-11-03 04:37:12,Taylor & Francis,Soil Science and Plant Nutrition,disk0/00/00/10/46,['FP23'],http://www.tandfonline.com/doi/pdf/10.1080/00380768.1999.10409326,2016-11-03 04:37:12,"[{'files': [{'objectid': 936, 'filesize': 788434, 'filename': 'Ak Salam SSPN 1999.pdf', 'uri': 'http://repository.lppm.unila.ac.id/id/file/6774', 'hash_type': 'MD5', 'mtime': '2016-11-03 02:37:23', 'fileid': 6774, 'datasetid': 'document', 'hash': 'b300b4a73ef40be3a2f3cd765efa052b', 'mime_type': 'application/pdf'}], 'main': 'Ak Salam SSPN 1999.pdf', 'docid': 936, 'format': 'text', 'language': 'en', 'rev_number': 2, 'mime_type': 'application/pdf', 'content': 'published', 'placement': 1, 'eprintid': 1046, 'uri': 'http://repository.lppm.unila.ac.id/id/document/936', 'pos': 1, 'security': 'public'}]",1056,1.0,show,89-99,2016-11-03 04:37:12,1046,archive,"Activities of soil enzymes in different land-use
systems in middle terrace areas of Lampung
province, South Sumatra, Indonesia",TRUE,article,"[{'name': {'given': 'Abdul Kadir', 'lineage': None, 'family': 'Salam', 'honourific': None}, 'id': 'ak.salam@ymail.com'}, {'id': None, 'name': {'family': 'Desvia', 'lineage': None, 'honourific': None, 'given': 'Yessy'}}, {'name': {'given': 'Eddy', 'honourific': None, 'family': 'Sutanto', 'lineage': None}, 'id': None}, {'name': {'family': 'Syam', 'lineage': None, 'honourific': None, 'given': 'Tamaluddin'}, 'id': 'tamaluddin.syam@fp.unila.ac.id'}, {'id': None, 'name': {'given': 'Ghani Sutopo', 'family': 'Nugroho', 'lineage': None, 'honourific': None}}, {'name': {'honourific': None, 'family': 'Kimura', 'lineage': None, 'given': 'Makoto'}, 'id': 'kimuram@nagoya-u.ac.jp'}]",,[{'type': 'http://www.loc.gov/loc.terms/relators/AUT'}],,,,10.1080/00380768.1999.10409326,
