,uri,date,abstract,corp_creators,volume,date_type,subjects,rev_number,ispublished,issn,full_text_status,status_changed,publisher,publication,dir,divisions,official_url,lastmod,documents,userid,number,metadata_visibility,pagerange,datestamp,eprintid,eprint_status,title,refereed,type,creators,referencetext,contributors,keywords,contact_email,funders,id_number,related_url
6,http://repository.lppm.unila.ac.id/id/eprint/6535,1999-06-01 00:00:00.000000000,"The roles of lime and cassava-leaf compost in reducing heavy metal solubility in soils demonstrate the probable use of these materials for decreasing the solubility of Cu from industrial waste in  soils.  Th.is research was to evaluate effects of lime and/or cassava-leaf compost on the solubility of Cu from industrial waste in tropical soils.  Three soil orders (Oxisol, Alfisol, and Vertisol) from Lampung and West Java were used as model systems.  Lime was given at  0, 2.5, and 5 ton CaCO3 ha-1; cassava-leaf compost at 0, 5, and 10 ton-1; and industrial waste (of metal-spoon industry) at 0, 10, 20, and 40 ton ha-1.  Mixture system was incubated at 40% moisture content (room temperature) for 4 weeks, after which soil pH and Cu solubility were determined.  The results showed that lime and/or waste apparently increased all soils pH. Cassava-leaf compost slightly increased the soil pH of Oxisol and Alfisol, but the pH of Vertisol was lower in lime-and-waste treated soils at 10 ton compost ha-1 addition.  Waste addition significantly increased the soluble Cu.  As expected, lime addition significantly lowered the Cu solubility in Oxisol and Alfisol and slightly decreased the soluble Cu in Vertisol.  Al.fisol and Vertisol adsorbed more Cu than did Oxisol.  Different from previous report with Cu standard solution addition, cassava-leaf compost showed no effect on soluble Cu.",['University of Lampung'],4.0,published,['S1'],6,pub,0852-257X,public,2018-04-25 08:31:42,University of Lampung,Journal of Tropical Soils,disk0/00/00/65/35,['FP23'],,2018-04-25 08:31:42,"[{'language': 'en', 'mime_type': 'application/pdf', 'rev_number': 1, 'format': 'text', 'docid': 19487, 'main': '49-CuSriWidodo.pdf', 'files': [{'fileid': 60430, 'datasetid': 'document', 'hash': 'feacdf7808dc527688210a89270174b6', 'mime_type': 'application/pdf', 'hash_type': 'MD5', 'mtime': '2018-02-23 09:44:26', 'filesize': 4269657, 'objectid': 19487, 'filename': '49-CuSriWidodo.pdf', 'uri': 'http://repository.lppm.unila.ac.id/id/file/60430'}], 'security': 'public', 'uri': 'http://repository.lppm.unila.ac.id/id/document/19487', 'pos': 1, 'eprintid': 6535, 'placement': 1}]",1056,2.0,show,153-160,2018-04-25 08:31:42,6535,archive,Penurunan Kelarutan Tembaga Asal Limbah Industri di dalam Tanah Tropika Akibat Perlakuan Kapur dan Kompos Daun Singkong,TRUE,article,"[{'name': {'given': 'Abdul Kadir', 'honourific': None, 'lineage': None, 'family': 'Salam'}, 'id': 'abdul.kadir@fp.unila.ac.id'}, {'id': None, 'name': {'honourific': None, 'family': 'Djuniwati', 'lineage': None, 'given': 'Sri'}}, {'name': {'given': 'Sri', 'family': 'Widodo', 'lineage': None, 'honourific': None}, 'id': None}, {'name': {'given': 'Joni T.', 'lineage': None, 'family': 'Harahap', 'honourific': None}, 'id': None}]","Akhter, M.S. dan I.M. Madany.  1992.  Heavy metals in street and house dust in Bahrain.  Water Air Soil Pollut., 66:111-119.
Alloway, B.J. (ed.).  1990a.  Heavy Metals in Soils.  Blackie, London.
Alloway, B.J.  1990b.  Soil processes and the behavior of metals. Hlm.7-28. Dalam B.J. Alloway (ed.).  Heavy Metals in Soils.  Blackie, London.
Alloway, B.J.  1990c.  Cadmium. Hlm.100-124. Dalam  B.J. Alloway (ed.).  Heavy Metals in Soils.  Blackie, London.
Baker, D.E. dan M.C. Amacher.  1982.  Nickel, copper, zinc, and cadmium.  Hlm.323-336. Dalam A.L. Page, R.H. Miller, dan D.R. Keeney-(ed.).  Methods of Soil Analysis Part 2 Chemical and Microbiological Properties. Ed. ke-2.  SSSA Inc., Madison.
Baker, D. E.  1990.  Copper. Hlm.151-176. Dalam B.J. Alloway (ed.).  Heavy Metals in Soils.  Blackie, London.
Brummer, G., K.G. Tiller, U. Herms, dan P.M. Clayton.  1983.  Adsorption-desorption and/or precipitation-dissolution processes of Zn in soils.  Geoderma, 31:337-354.
Davies, B.E.  1990.  Lead. Hlm.177-196. Dalam B.J.Alloway (ed.).  Heavy Metals in Soils. Blackie, London.
Direktorat Penyelidikan Masalah Air.  1983.  Pengendalian pencemaran logam berat Daerah Jabotabek dan Teluk Jakarta.  Direktorat Jenderal Pengairan, Departemen Pekerjaan Umum, Jakarta.
Helling. C.S., C. Chesters, dan R.B. Corey.  1964.  Contribution of organic matter and clay to soil cation-exchange capacity as affected by the pH of the saturating solution.  Soil Sci.  Soc. Amer. Proc., 28:517-520.
Kabata-Pendias, A. dan H. Pendias.   1992.   Trace Elements in Soils and Plants. Ed. ke-2.  CRC Press, London.
Kardos, LT., C.E. Scarsbrook, dan V.V. Volk.  1986.  Recycling elements in wastes through soil-plant systems.  Hlm.300-324. Dalam L.F. Elliott dan F.J. Stevenson (ed.).  Soils for Management of Organic Wastes and Waste Waters.  SSSA Inc., Madison.
Keeney, D.R. dan R.E. Wildung.  1986.  Chemical properties of soils.  Hlm. 74-97. Dalam L.F. Elliott dan F.J. Stevenson (ed.).  Soils for Management of Organic Wastes and Waste Waters.  SSSA Inc., Madison.
Lagerwerff, J.V.  1982.  Lead, mercury, and cadmium as environmental contaminants. Hlm.593-636. Dalam J.J. Mortvedt, P.M. Giordano, dan W.L. Lindsay (ed.).  Micronutrients in Agriculture.  SSSA Inc., Madison.
Leung, H. W.  1988.  Environmental sampling of lead near a battery reprocessing factory.  Bull. Environ. Contam. Toxicol., 41 :427-433
Lindsay, W.L.  1979.  Chemical quilibria in Soils.  John Wiley & Sons, Inc., New York.
Markus, J.A. dan A.B. McBratney.  1996.  An urban soil study: heavy metals in glebe, Australia.  Aust. J. Soil Res., 34:453-465.
McCalla, T.M., J.R. Peterson, dan C. Lue-Hing.  1986.  Properties of agricultural and municipal wastes. Hlm. l0-43. Dalam L.F. Elliott dan F.J. Stevenson (ed.).  Soils for Management of Organic Wastes and Waste Waters.  SSSA Inc., Madison.
Pratt, P.F., M.D. Thorne, dan F. Wiersma. 1986.  Future direction in waste utilization. Hlm.620-634.  Da/am L.F. Elliott dan F.J. Stevenson (ed.). Soils for Management of Organic Wastes and Waste Waters.  SSSA Inc., Madison.
Rodella, A.A., K.R. Fischer, dan J.C. Alcarde.  1995.  Cation exchange capacity of an acid soil as influenced by different sources of organic matter.  Commun. Soil Sci. Plant Anal., 26:2961-2967. 
Salam, A.K.  1995.  Imobilisasi logam berat di dalam tanah selama 15 tahun.  J. Ilmiah Ilmu Pert., 3(1):20-27.
Salam, A.K., S. Djuniwati, J.T. Harahap, dan Suwarto.  1996.  Imobilisasi logam berat asal limbah industri di dalam tanah tropika: I.  Sifat kimia limbah industri.  J. Ilmiah Ilmu Pert., 4(1):61-67.
Salam, A.K., S. Djuniwati, Samo, N. Sriyani, dan H. Novpriansyah.  1997a  Manipulasi sifat kimia tanah untuk mengurangi dampak negatif logam berat asal limbah industri terhadap t.anah. air. dan tanaman.  Laporan Penelitian HB IV/2  Fakultas Pertanian Univ. Lampung. Bandar Lampung.
Salam, A.K., S. Djuniwati, Samo. N.  Sriyani, H. Novpriansyah, A. Septiana, dan H.D. Putera.  1997b.  The DTPA-extractable heavy metals in tropical soils treated with lime materials.  Indon. J. Trop. Agric. 8(1):6-12.
Singh, B. dan G.S. Sekhon.  1977.  Adsorption, desorption, and solubility rela1ionships of lead and cadmium in some alkaline soils.  J. Soil Sci., 28:271-75.
Steinnes, E.  1990.  Mercury.  Hlm.222-236. Dalam B. J. Alloway (ed.).  Heavy Metals in Soils.  Blackie, London.
Tisdale, S.L, W.L Nelson, dan J.D. Beaton.  1985.  Soil Fertility and Fertilizers.  Ed. ke-4.  Macmillan Publ. Co., New York.
Udo, E.J., H.L Bohn, dan  T.C. Tucker.  1970.  Zinc adsorption by calcareous soils.  Soil Sci. Soc. Arner. Proc., 34:405-407.
Vile, M.A., MJ.V. Novak, E.    Brizova, R.K.. Wieder, dan  W.R. Schell.  1995.  Historical rates of atmospheric Pb deposition u.sing 210Pb dated peat cores: corroboration, computation, and interpretation.  Water Air Soil Pollut., 70:89-106.","[{'id': 'axauam@gmail.com', 'type': 'http://www.loc.gov/loc.terms/relators/AUT', 'name': {'given': 'Abdul Kadir', 'lineage': None, 'family': 'Salam', 'honourific': None}}]","Cassava-Leaf Compost, Copper, Industrial Waste, Lime, Tropical Soils",axauam@gmail.com,['Directorate General of Higher Education'],,
7,http://repository.lppm.unila.ac.id/id/eprint/6533,1999-04-01 00:00:00.000000000,"Heavy metal accumulation is known to be detrimental to animal and human health.  This research was to investigate role of lime and/or cassava-leaf compost in lowering Cu and Zn absorption by crop plants.  Soil sample (Alfisol) was thoroughly treated with Cu and Zn standard solution at 0, 10, and 40  mg kg-1 or metal-spoon industrial waste  at 20 and 8O ton ha-1 and factorially treated with lime at 0-5 ton CaCO3 ha-1 and cassava-leaf compost at 20 and 8O ton ha-1.  After a 1 week incubation at 40% moisture content, soil mixtures were cultured to amaranth or corn for 4 weeks in a glasshouse, after which Cu and Zn accumulation in plant roots and shoots was analyzed by graphite furnace AAS.  Copper concentration of standard solution or industrial waste origin in amaranth was higher than that in corn shoots and decreased with liming and/or cassava-leaf compost addition.  Liming and/or cassava-leaf compost also decreased the Zn concentration in amaranth shoots at high level standard Zn addition but increased the Zn concentration at low level standard Zn addition.  Conversely, liming increased and cassava-leaf' compost decreased the Zn concentration in amaranth shoot cultured in waste treated soil.  Effect of lime and cassava-leaf-compost on Cu and Zn concentrations in corn shoots showed no clear pattern.",['University of Lampung'],2.0,published,['S1'],6,pub,1410-7368,public,2018-04-26 04:05:41,Lembaga Penelitian Universitas Sriwijaya,Jurnal Tanaman Tropika,disk0/00/00/65/33,['FP23'],,2018-04-26 04:05:41,"[{'uri': 'http://repository.lppm.unila.ac.id/id/document/19485', 'pos': 1, 'security': 'public', 'placement': 1, 'eprintid': 6533, 'language': 'en', 'rev_number': 1, 'mime_type': 'application/pdf', 'main': '47-SerapanCuZnEkaSet.pdf', 'files': [{'mime_type': 'application/pdf', 'hash': 'b7f1a172fd0185dc47a3fab914e017f7', 'fileid': 60418, 'datasetid': 'document', 'mtime': '2018-02-23 09:20:14', 'hash_type': 'MD5', 'filename': '47-SerapanCuZnEkaSet.pdf', 'uri': 'http://repository.lppm.unila.ac.id/id/file/60418', 'filesize': 4732753, 'objectid': 19485}], 'docid': 19485, 'format': 'text'}]",1056,1.0,show,41-51,2018-04-26 04:05:41,6533,archive,Studi Penyerapan  Cu dan Zn oleh  tanaman bayam (Amaranthus tricolor L.) dan jagung (Zea mays L.) dari tanah Alfisol Banjar Agung Lampung yang diperlakukan dengan limbah  industri berlogam berat,TRUE,article,"[{'name': {'family': 'Salam', 'lineage': None, 'honourific': None, 'given': 'Abdul Kadir'}, 'id': 'abdul.kadir@fp.unila.ac.id'}, {'name': {'family': 'Sarno', 'lineage': None, 'honourific': None, 'given': '-'}, 'id': 'sarno.1957@fp.unila.ac.id'}, {'name': {'given': 'Nayu', 'family': 'Kulsum', 'lineage': None, 'honourific': None}, 'id': None}, {'name': {'lineage': None, 'family': 'Setyaningsih', 'honourific': None, 'given': 'Eka'}, 'id': None}]","Alloway, B.J.  1990.  Soil processes and the behavior of metals. Hlm.7-28. Dalam B.J. Alloway (ed.).  Heavy Metals in Soils.  Blackie, London
Direktorat Penyelidikan Masalah Air.  1983.  Pengendalian pencemaran logam berat Daerah Jabotabek dan Teluk Jakarta.  Direktorat Jenderal Pengairan, Departemen Pekerjaan Umum, Jakarta.
Helling, C.S., C. Chester, dan R.B. Corey.  1964.  Contribution of organic matter and clay to  soil cation exchange capacity as affected by the soil saturating solution.  Soil Sci. Soc. Am. Proc., 28:517-520.
Kabata-Pendias, A. dan H. Pendias.  1992.  Trace Elements in Soils and Plants. Ed. ke-2. CRC Press, London.
Kiekens, L.  1990.  Zinc.  Hlm.261-279. Dalam B.J.Alloway (ed.).  Heavy Metals in Soils.  Blackie, London.
Ma, Q.Y., S.J. Trama, dan T.J. Logan.  1993. In situ lead immobilization by apatite.  Environ. Sci. Technol., 27:1803-1810.
Ma, Q.Y., S.J. Traina, T.J. Logan, dan J.A. Ryan.  1994.  Effects of aqueous Al, Cd, Cu, Fe(III), Ni, and Zn on Pb immobilization by hydroxyapatite.  Environ. Sci. Technol., 28:1219-1228.
Ma, Q.Y., T.J. Logan, dan S.J. Traina.  1995  Lead immobilization from aqueous solution and contaminated soils using phosphate rocks.  Environ. Sci. Technol., 29:1118-1126.
McCalla, T.M., J.R. Petterson, dan C. Lue Hing. 1986. Properties of agricultural and municipal wastes. Hlm.11-43. Dalam L.F. Elliott dan F.J. Stevenson (ed.). Soils for Management of Organic Wastes and Waste Waters.  SSSA Inc., Madison.
McGrath, S.P., J.R. Sanders, dan M.H. Shalaby.  1988.  The effects of soil organic matter levels on soil solution concentrations and extractabilities of manganese, zinc, and copper.  Geoderma, 42:177-188.
Parfitt, R.L., D.J. Giltrap, dan J.S. Whitton.  1995.  Contribution of organic matter and clay minerals to the cation exchange capacity of soils.  Commun. Soil. Sci. Plant Anal., 26:1343-1355.
Rabinowitz, M.B.  1993.  Modifying soil lead bioavailabiity by phosphate addition.  Bull. Environ. Contam. Toxicol., 51:438-444.
Rodella., A.A., K.R. Fischer, dan J.C. Alcarde.  1995.  Cation exchange capacity of an acid soil as influenced by different sources of organic matter.  Commun. Soil Sci. Plant Anal., 26:2961-2967.
Ruby, M.V., A Davis, dan A. Nicholson.  1994.  In situ formation of lead phosphates in soils as a method to immobilize lead.  Environ. Sci. Technol., 28·646-654
Salam, A.K., S. Djuniwati, J .T. Harahap, dan Suwarto.  1996.  Imobilisasi logam berat asal limbah indusiri di dalam tanah tropika: 1. Sifat kimia limhah industri.  J. llmiah llmu Pert. 4(1):61-67.
Salam, A.K., C. Marintias, Rusdianto., Sunarto, S. Djuniwati, H. Novpriansyah, dan J.T. Harahap.  1997.  Perubahan fraksi labil ternbaga asal limbah industri dalam beberapa jenis tanah tropika akibat perlakuan kapur dan kompos daun singkong.   J. Tanah Trop., 5:11-20.
Salam, A.K., C. Marintias, S. Djuniwari, dan J.T. Harahap.  1997. Perubahan fraksi labil seng asal lirnbah industri dalam beberapa jenis tanah tropika akibat perlakuan kapur dan kompos daun singkong.  J. Tanah Trop., 6:51-58.
Salam, A.K., S. Djuniwati, Sarno, N. Sriyani,  dan H. Novpriansyah.  1999.  Manipulasi Beberapa Sifat Kimia Tanah untuk Mengurangi Dampak Negatif Logam Berat Asal Limbah lndustri terhadap Tanah, Air, dan Tanaman.  Laporan Penelitian Hibah Bersaing IV/4.  Fakultas Pertanian Universitas Lampung, Bandar Larnpung.
Wang, J.D., C.S. Jang, Y.H. Hwang, dan Z.S. Chen.  1982.  Lead contamination around a kindergarten near a battery recycling plant.  Bull. Environ. Contam. Toxicol., 49:23-30.
Yeh, C.-Y.., H.-Y. Chiou, R.-Y. Chen, K-H. Yeh, W-L. Jeng, dan B.-C Han.  1996.  Monitoring lead pollution near a storage battery recycling plant in Taiwan Republic of China.  Arch. Environ. Contarn. Toxicol., 30:227-234.","[{'id': 'axauam@gmail.com', 'name': {'honourific': None, 'family': 'Salam', 'lineage': None, 'given': 'Abdul Kadir'}, 'type': 'http://www.loc.gov/loc.terms/relators/AUT'}]","Coper, Zinc, Amaranth, Corn, Industrial Waste",axauam@gmail.com,['Directorate General of Higher Education'],,
8,http://repository.lppm.unila.ac.id/id/eprint/6537,1999-06-01 00:00:00.000000000,"Growth of crop plants is suggested to be inhibited by elevated concentrations of heavy metals in soils.  This research was to evaluate the effects of heavy-metal-containing industrial waste on growth of amaranth in two tropical soils treated with lime and/or cassava-leaf compost.  Soils with low and high adsorption capacities to heavy metals were used.  Soil samples were factorially treated with wastes (Control, Model Waste 1 i.e. a mixture ofstandard solution to increase the concentrations ofCu, Zn, and Pb 10mg.kg-1, respectively. and Cd 5 mg.kg-1 and MW 2, i.e. 4 times MW 1,. and industrial waste ofmetal-spoon  industry at 20 and 80 ton ha-1), lime (at 0, 2.5 and 5 ton.ha-1), and cassava-leaf compost (at 0, 5,, and 1O ton ha-1).  Soil mixtures were then cultured toamaranth for four weeks in a greenhouse experiment.  The growth of amaranth in both soils was inhibited by the model waste.  Unlike in Gedongmeneng soil, the negative effect of the model waste in Banjaragung (high adsorption capacity) was alleviated by lime and/or cassava-leaf compost additions.  Conversely, industrial waste addition tended to increase the growth of amaranth in Banjaragung soil even though this effect tended to decrease with lime addition.  This effect was not observed in Gedongmeneng soil.",['University of Lampung'],4.0,published,['S1'],6,pub,0216-7662,public,2018-04-25 08:34:17,Jurnal Agrotropika,Jurnal Agrotropika,disk0/00/00/65/37,['FP23'],,2018-04-25 08:34:17,"[{'security': 'public', 'uri': 'http://repository.lppm.unila.ac.id/id/document/19489', 'pos': 1, 'eprintid': 6537, 'placement': 1, 'mime_type': 'application/pdf', 'language': 'en', 'rev_number': 1, 'format': 'text', 'main': '51-AmaranthLB.pdf', 'docid': 19489, 'files': [{'hash_type': 'MD5', 'mtime': '2018-02-23 09:56:24', 'objectid': 19489, 'filesize': 4504606, 'filename': '51-AmaranthLB.pdf', 'uri': 'http://repository.lppm.unila.ac.id/id/file/60442', 'fileid': 60442, 'datasetid': 'document', 'mime_type': 'application/pdf', 'hash': '0f6c9d8152eb9407c42e95becab7ecba'}]}]",1056,1.0,show,30-36,2018-04-25 08:34:17,6537,archive,Greenhouse Growth of Amaranth (Amaranthus Tricolor L.) in Soils Polluted with Heavy Metals,TRUE,article,"[{'name': {'given': 'Abdul Kadir', 'honourific': None, 'family': 'Salam', 'lineage': None}, 'id': 'abdul.kadir@fp.unila.ac.id'}, {'id': 'sarno.1957@fp.unila.ac.id', 'name': {'lineage': None, 'family': 'Sarno', 'honourific': None, 'given': '-'}}, {'name': {'honourific': None, 'family': 'Sriyani', 'lineage': None, 'given': 'Nanik'}, 'id': 'nanik.sriyani@fp.unila.ac.id'}]","Alloway, B.J.  1990.  Soil processes and the behavior of metals. pp.7-28. In B.J. Alloway ed.).  Heavy Metals in Soils.  Blackie, London.
Brummer, G., K.G. Tiller, U. Herms, and P.M. Clayton.  1983.  Adsorption-desorption and/or precipitation-dissolution processes of Zn in soils.  Geoderma, 31:337-354.
Helling, C.S., C. Chesters, and R.B. Corey.  1964.  Contribution of organic matter and clay to soil cation exchange capacity as affected by the pH of the saturating solution.  Soil Sci. Soc. Amer. Proc., 28:517-520.
McGrath, S.P., J.R. Sanders, and M.H. Shalaby.  1988.  The effects of soil organic matter levels on soil solution concentrations and extractabilities of manganese, zinc, and copper.  Geoderma, 42:177-188.
Parfitt, R.L., D.J. Giltrap, and J.S. Whitton.  1995.  Contribution of organic matter and clay minerals to the cation exchange capacity of soils.  Commun. Soil Sci. Plant Anal., 26:1343-1355.
Rodella, A.A., K.R. Fischer, and J.C. Alcarde.  1995.  Cation exchange capacity of an acid soil as influenced by different sources of organic matter.  Commun. Soil Sci. Plant Anal., 26:2961-2967.
Salam, A.K., C. Marintias, Rusdianto, Sunarto, S. Djuniwati, H. Novpriansyah, and J.T. Harahap.  1997a.  Perubahan fraksi Jabil tembaga asal limbah industri dalam beberapa jenis tanah tropika akibat perlakuan kapur dan kompos daun singkong.  J. Tanah Trop., 5:11-20. (In Indonesian).
Salam, A.K., S. Djuniwati, and Samo.  1997b.  Lowering heavy metal solubilities in tropical soils by lime and cassava-leaf compost additions. Proc. Environ. Tech. Manag. Sem. 1997:D2-11.
Salam, A.K. and P.A. Helmke.  1998.  The pH dependence of free ionic activities and total dissolved concentrations of copper and cadmium in soil solution.  Geoderma, 83:281-291.
Salam, A.,K., S. Djuniwati, Samo, N. Sriyani, and H. Novpriansyah.  1998b.  Manipulasi sifat kimia tanah untuk mengurangi dampak negatif logam berat asal limbah industri terhadap tanah, air, dan tanaman.  Res. Report of Hibah Bersaing IV/3 FY 1997/1998. Fakultas  Pertanian Universitas Lampung.  Bandar Lampung.  (In Indonesian).
Singh, B. and G.S. Sekhon.  1977.  Adsorption, desorption, and solubility relationships of lead desorption, and solubility relationships of lead and cadmium in some alkaline soils J. Soil Sci., 28:271-275.","[{'id': 'axauam@gmail.com', 'type': 'http://www.loc.gov/loc.terms/relators/AUT', 'name': {'given': 'Abdul Kadir', 'honourific': None, 'lineage': None, 'family': 'Salam'}}]","Amaranth, Cassava-Leaf Compost, Heavy Metals, Industrial Waste, Lime",axauam@gmail.com,['Directorate General of Higher Education'],,
