,uri,date,abstract,corp_creators,volume,date_type,subjects,rev_number,ispublished,issn,full_text_status,status_changed,publisher,publication,dir,divisions,official_url,lastmod,documents,userid,number,metadata_visibility,pagerange,datestamp,eprintid,eprint_status,title,refereed,type,creators,referencetext,contributors,keywords,contact_email,funders,id_number,related_url
9,http://repository.lppm.unila.ac.id/id/eprint/6467,1999-10-01 00:00:00.000000000,"The growth of amaranth under field conditions in soils polluted with Cu- and Zn-containing industrial waste was evaluated in 1998 in Sidosari, Natar; South Lampung, and in Sri Bawono, Central Lampung.  Soils were factorially treated to 0-to-l5-cm depth with lime (at O and 5 ton CaCO3 ha-1) and cassava-leaf compost (at O and 5 ton ha-1).  A metal-spoon industrial waste containing Cu and Zn (at 0, 15, and 60 ton ha-1) was also given to the same depth in the subsequent week.  One week after waste treatment, soils were cultured to amaranth for 5 weeks.  The available Cu and Zn in soils significantly increased with waste levels, but only at 15 ton. waste ha-1lime and/or cassava-leaf compost decreased the available Cu and Zn.  The changes in the available Cu and Zn by lime and/or compost additions in general showed no correlation with the growth of amaranth.  However, the growth of amaranth in Sidosari was depressed by the increasing waste addition, indicating the negative effect of heavy metal inputs from waste.  The growth of amaranth in Sri Bawono was also depressed, but, different from that in Sidosari, lime and cassava-leaf compost significantly alleviated this negative effect.",['University of Lampung'],1.0,published,['S1'],6,pub,1411-2337,public,2018-04-26 04:01:31,Lembaga Penelitian Universitas Lampung,Jurnal Manajemen dan Kualitas Lingkungan,disk0/00/00/64/67,['FP23'],,2018-04-26 04:01:31,"[{'docid': 19409, 'main': '53-LBbayam.pdf', 'files': [{'datasetid': 'document', 'fileid': 59888, 'hash': '60fe54479896fd66ea520093296ae63c', 'mime_type': 'application/pdf', 'hash_type': 'MD5', 'mtime': '2018-02-10 03:42:50', 'filesize': 4116686, 'objectid': 19409, 'filename': '53-LBbayam.pdf', 'uri': 'http://repository.lppm.unila.ac.id/id/file/59888'}], 'format': 'text', 'rev_number': 1, 'language': 'en', 'mime_type': 'application/pdf', 'placement': 1, 'eprintid': 6467, 'uri': 'http://repository.lppm.unila.ac.id/id/document/19409', 'pos': 1, 'security': 'public'}]",1056,1.0,show,49-56,2018-04-26 04:01:31,6467,archive,The Field Growth of Amaranth (Amaranthus Tricolor L.) in Soils polluted with Heavy Metals from Industrial Waste,TRUE,article,"[{'id': 'abdul.kadir@fp.unila.ac.id', 'name': {'given': 'Abdul Kadir', 'lineage': None, 'family': 'Salam', 'honourific': None}}, {'name': {'given': 'Nanik', 'honourific': None, 'family': 'Sriyani', 'lineage': None}, 'id': 'nanik.sriyani@fp.unila.ac.id'}, {'name': {'given': 'Sri', 'lineage': None, 'family': 'Djuniwati', 'honourific': None}, 'id': None}, {'id': 'dewerahman@yahoo.com', 'name': {'given': 'Didin', 'lineage': None, 'family': 'Wiharso', 'honourific': None}}]","Alloway, B.J..  1990.  Cadmium. Hlm.100-124. Dalam BJ. Alloway (ed.).  Heavy Metals in Soils.  Blackie, London.
Baker, D.E. dan M.C. Amacher.  1982.  Nickel, copper, zinc, and cadmium.  Hlm. 323-338. Dalam A.L. Page, R.H. Miller, dan D.R 
Keeney (ed.).  Methods of Soil Analysis Part 2 Chemical and Microbiological Properties. Ed. ke-2. SSSA Inc., Madison.
Baker, D.E.  1990. Copper. Hlm.151-176. Dalam B.J. Alloway (ed.). Heavy Metals in Soils. Blackie, London.
Djuangsih, N.  1992.  Pencemaran logam di lingkungan.  Makalah Penataran Ekologi Pencemaran di Univ. Lampung,  Bandar Larnpung, 3 Des. 1992.
He, Q.B. dan B.R. Singh.  1994.  Crop uptake of cadmium from phosphorus fertilizers: II. Relationship with extractable soil cadmium.  Water Air Soil Pollut., 74:267-280.
Kabata-Pendias. A dan H. Pendias.  1992.  Trace Elements in Soils and Plants.  Ed ke-2.  CRC Press, London.
Parfitt, R.L., D.J. Giltrap, dan J.S. Whitton.  1995.  Contribution of organic matter and clay minerals to the cation exchange capacity of soils.  Commun, Soil Sci. Plant Anal., 26:1343-1355.
Rodella, A.A., K.R. Fischer, dan J.C. Alcarde. 1995.  Cation exchange capacity of an acid soil as influenced by different sources of organic matter.  Commun. Soil Sci. Plant Anal., 26:2961-2967.
Salam, A.K., S. Djuniwati, dan Sarno.  1997a.  Lowering heavy metal solubilities in tropical soils by lime and cassava-leaf compost additions.  Pros Sem. Int. Environ. Manag. Technol.1997. D2-11.
Salam, A.K., C. Marintias, Rusdianto, Sunarto, S. Djuniwati, H. Novpriansyah, dan J.T. Harahap.  1997b.  Perubahan fraksi labil tembaga asal limbah industri dalam beberapa jenis tanah tropika akibat perlakuan kapur dan kompos daun singkong.  J. Tanah Trop ., 3(6):11-20.
Salam, A.K., C. Marintias, S. Djuniwati, dan J.T. Harahap.  1998.  Perubahan fraksi labil seng asal limbah industri dalam beberapa jenis tanah tropika akibat perlakuan kapur dan kompos daun singkong.  J. Tanah Trop., 4(7):51-57.
Salam, A.K. dan P.A. Helmke.  1998.   The pH dependent of free ionic activities and total dissolved concentrations of copper and cadmium in soil solution Geoderma, 83:281-291.
Salam, A.K., Sarno, dan N. Sriyani.  1999a.  Greenhouse growth of amaranth (Amaranthus tricolor L.) in soils polluted with heavy metals.  J. Agrotrop, 4(1) (Dalam Pencetakan).
Salam, A.K., N. Sriyani, dan Sarno.  1999b.  Pertumbuhan tanaman jagung (Zea mays L.) di tanah terpolusi limbah industri berlogarn berat.  J. Tanah Trop., (4)8:161-167.
Salam, A.K., Sarno, N. Kulsum, dan E. Setyaningsih.  1999c.  Studi penyerapan Cu dan Zn oleh tanaman bayam (Amaranthus tricolor L.) dan jagung (Z.ea mays L.) dari tanah Alfisol Banjar Agung Lampung yang diperlakukan dengan limbah industri berlogam berat.  J. Tanaman Trop., 2(1):4 l-51.
Salam, A.K., S. Djuniwati, Sarno, N. Sriyani, dan H. Novpriansyah.  1999c.  Manipulasi sifat kimia tanah untuk mengurangi dampak negatif logam berat asal limbah industri terhadap tanah, air, dan tanaman.  Laporan Penelitian Hibah Bersaing IV/l-4 Tahun Anggaran 1995/1996-1998/1999. Fakultas Pertanian. Universitas Lampung, Bandar Lampung.
Steinnes, E.  1990.  Mercury.  Hlm.222-236. Dalam B.J. Alloway (ed.). Heavy Metals in Soils.  Blackie, London.","[{'id': 'axauam@gmail.com', 'type': 'http://www.loc.gov/loc.terms/relators/AUT', 'name': {'given': 'Abdul Kadir', 'family': 'Salam', 'lineage': None, 'honourific': None}}]","Amaranth, Copper, Heavy Metals, Industrial Waste, Tropical Soils, Zinc",axauam@gmail.com,['Directorate General of Higher Education'],,
10,http://repository.lppm.unila.ac.id/id/eprint/6536,1999-06-01 00:00:00.000000000,"Heavy metals are suggested to influence the growth of crop plants.  This research was intended to evaluate glasshouse growth of corn in potted soils treated with industrial waste containing heavy metals.  Soil samples (from Banjaragung and Gcdongmeneng Lampung) were thoroughly mixed with a metal-spoon industrial waste containing high amounts of Cu and Zn at 0, 20, and 80 ton ha-1or a model waste to increase soil  heavy metals (Cu, Zn. Cd. and Pb) 10 and 40 mg kg-1.  All treatments were also factorially treated with lime at 0, 2.5, and 5 ton CaCO3 and/or cassava-leaf compost at 0, 5, and 10 ton ha-1 and cultured to corn  for 4 weeks.  The growth
of corn plant was significantly inhibited by heavy metals of high level model waste. The negative effect of high level model waste in Banjaragung and Gedongmeneng soil was alleviated by addition of lime and/or cassava-leaf compost.  On the contrary, similar to that of the low level model waste, the industrial waste addition stimulated the growth of com in Banjaragung soil.  This positive effect in general lessened with lime addition, most probably due to the increase in Zn solubility with increasing soil pH.  These phenomena were not observed in Gedongmeneng soil.",['University of Lampung'],4.0,published,['S1'],6,pub,0852-257X,public,2018-04-26 04:05:53,University of Lampung,Journal of Tropical Soils,disk0/00/00/65/36,['FP23'],,2018-04-26 04:05:53,"[{'format': 'text', 'docid': 19488, 'main': '50-JagungLB.pdf', 'files': [{'hash_type': 'MD5', 'mtime': '2018-02-23 09:50:16', 'objectid': 19488, 'filesize': 3150719, 'uri': 'http://repository.lppm.unila.ac.id/id/file/60436', 'filename': '50-JagungLB.pdf', 'datasetid': 'document', 'fileid': 60436, 'mime_type': 'application/pdf', 'hash': 'd58e25b7b0f6494a2e94aa2a590f9fa0'}], 'mime_type': 'application/pdf', 'language': 'en', 'rev_number': 1, 'eprintid': 6536, 'placement': 1, 'security': 'public', 'pos': 1, 'uri': 'http://repository.lppm.unila.ac.id/id/document/19488'}]",1056,2.0,show,161-168,2018-04-26 04:05:53,6536,archive,Pertumbuhan Tanaman Jagung (Zea mays L.) di Tanah Terpolusi Limbah Industri Berlogam Berat,TRUE,article,"[{'id': 'abdul.kadir@fp.unila.ac.id', 'name': {'family': 'Salam', 'lineage': None, 'honourific': None, 'given': 'Abdul Kadir'}}, {'name': {'given': 'Nanik', 'lineage': None, 'family': 'Sriyani', 'honourific': None}, 'id': 'nanik.sriyani@fp.unila.ac.id'}, {'name': {'given': '-', 'honourific': None, 'family': 'Sarno', 'lineage': None}, 'id': 'sarno.1957@fp.unila.ac.id'}]","Alloway, B.J.  1990a.  Cadmium. Hlm.100-124. Dalam BJ. Alloway (ed.).  Heavy Metals in Soils.  Blackie, London.
Alloway, BJ.  1990b.  Soil processes and  the behavior of metals. Hlm.7-28. Dalam BJ. Alloway (ed.).  Heavy Metals in Soils. Blackie, London.
Baker, D.E.  1990.  Copper. Hlm.151-176. Dalam B.J. Alloway (ed.).  Heavy Metals in Soils. Blackie, London.
Bohn, H.L., B.L. McNeal, dan  G.A.O'Connor.  1985.  Soil Chemistry. Ed. ke-2.  John Wiley & Sons, New York.
Helling, C.S., C. Chesters, dan  R.B. Corey.  1964.  Contribution of organic matter and clay to soil cation-exchange capacity as affected by the pH of the saturating solution.  Soil Sci. Soc. Amer. Proc., 28:517-520.
Kiekens, L.  1990.  Zinc. Hlm.261-279. Dalam B.J. Alloway (ed.).  Heavy Metals in Soils.  Blackie, London.
Lagerwerff, J.V.  1982.  Lead, mercury, and cadmium as environmental contaminants. Hlm.593-636. Dalam J.J. Mortvedt, P.M. Giordano, dan W.L. Lindsay (ed.). Micronutrients in Agriculture. SSSA Inc., Madison.
Ma, Q.Y., S.J. Traina, dan T.J. Logan.  1993.  In situ lead immobilization by apatite.  Environ. Sci. Technol., 27:1803-1810.
Ma, Q.Y., SJ. Traina, T.J. Logan, dan J.A Ryan.  1994.  Effects of aqueous Al, Cd, Cu, Fe(II), Ni, and Zn on Pb immobilization by hydroxyapatite.  Environ. Sci. Technol., 28:1219-1228.
Ma, Q.Y., T.J. Logan, dan SJ. Traina.  1995.  Lead immobilization from aqueous solutions and contaminated soils using phosphate rocks.  Environ. Sci. Technol., 29:1118-1126.
McGrath, S.P., J.R. Sanders, dan M.H. Shalaby.  1988.  The effects of soil organic matter levels on soil solution concentrations and extractabilities of manganese, zinc, and copper.  Geoderma, 42:177-188.
Parfitt, R.L., D.J. Giltrap, dan J.S. Whitton.  1995.  Contribution of organic matter and clay minerals to the cation exchange capacity of soils.  Commun. Soil Sci. Plant Anal., 26:1343-1355.
Rabinowitz, M.B.  1993.  Modifying soil lead bioavailability by phosphate addition.  Bull. Environ. Contam. Toxicol., 51:438-444.
Rodella, A.A, K.R. Fischer, dan J.C. Alcarde.  1995.  Cation exchange capacity of an acid soil as influenced by different sources of organic matter.  Commun. Soil Sci. Plant Anal., 26:2961-2967.
Ruby, M.V., A. Davis, dan A Nicholson.  1994. In situ formation of lead phosphates in soils as a method to immobilize lead.  Environ. Sci. Technol., 28:646-654.
Salam, A.K., C. Marintias, Rusdianto, Sunarto, S. Djuniwati, H. Novpriansyah, dan J.T. Harahap.  1997.  Perubahan fraksi labil tembaga asal limbah industri dalam beberapa jenis tanah tropika akibat perlakuan kapur dan kompos daun singkong.  J. Tanah Trop., 5:11-20.
Salam, A.K., S. Djuniwati, dan Samo.  1998a.  Lowering heavy metal solubilities in tropical soils by lime and cassava-leaf compost additions.  Proc. Environ. Technol. Manag. Seminar 1997, D2-11.
Salam, A,K.., C. Marintias, S. Djuniwati, dan J.T. Harahap.  1999b.  Perubahan fraksi labil seng asal limbah industri dalam beberapa. jenis tanah tropika akibat perlakuan kapur dan kompos daun singkong.  J. Tanah Trop., 7:5l·57.
Salam, A.K., Sarno, dan N. Sriyani.  1999a.  Greenhouse growth of amaranth  (Amaranthus tricolor L.) in soils polluted with heavy metals.  J. Agrotrop. 4(2) (Dalam pencetakan).
Salam, A.K., Sarno, N. Kulsum, dan E. Setyaningsih.  1999b.  Studi penyerapan Cu dan Zn oleh tanaman bayam (Amaranthus tricolor L.) dan jagung (Zea mays L.) dari tanah Alfisol Banjaragung Lampung yang diperlakukan dengan limbah industri berlogam be.rat.  J. Tanaman Trop., (Dalam Pencetakan).
Steinnes, E.  1990.  Mercury.  Hlm.222-236. Dalam B.J.  Alloway (ed.).  Heavy Metals in Soils. Blackie, London.","[{'type': 'http://www.loc.gov/loc.terms/relators/AUT', 'name': {'given': 'Abdul Kadir', 'honourific': None, 'lineage': None, 'family': 'Salam'}, 'id': 'axauam@gmail.com'}]","Copper, Corn, Industrial Wastes, Tropical Soils, Zinc",axauam@gmail.com,['Directorate General of Higher Education'],,
11,http://repository.lppm.unila.ac.id/id/eprint/781,1999-08-01 00:00:00.000000000,"Changes in the activities of soil enzymes (acid and alkaline phosphatases, .a-glucosidase, and arylsulfatase) associated with continuous cultivation of cassava, sugarcane, and pineapple were studied in middle terrace areas of Lampung Province, South Sumatra, Indonesia. Soil samples were collected from fields continuously cultivated with cassava for the period ranging from 0
to 10 y, with sugarcane from 0 to 20 y, and with pineapple from 0 to 10 y. Continuous cultivation did not show conspicuous effects on soil pH, and con­tents of total N, organic C, and available P as well as soil enzymatic activities. However, the changes in the activities of the soil enzymes generally showed a significant relationship with the contents of soil organic C and total N.",['University of Lampung'],45.0,published,['S1'],13,pub,0038-0768,public,2016-10-13 15:41:07,Taylor & Francis,Soil Science and Plant Nutrition,disk0/00/00/07/81,['FP23'],http://www.tandfonline.com/loi/tssp20,2016-11-04 03:18:31,"[{'format': 'text', 'main': 'Ainin SSPN enzim.pdf', 'files': [{'hash_type': 'MD5', 'mtime': '2016-10-12 09:23:37', 'filesize': 507415, 'objectid': 674, 'filename': 'Ainin SSPN enzim.pdf', 'uri': 'http://repository.lppm.unila.ac.id/id/file/4544', 'datasetid': 'document', 'fileid': 4544, 'hash': 'ea68cafaadf5e83d57d34ff99d77b8d3', 'mime_type': 'application/pdf'}], 'docid': 674, 'content': 'published', 'mime_type': 'application/pdf', 'language': 'en', 'rev_number': 2, 'eprintid': 781, 'placement': 1, 'security': 'public', 'pos': 1, 'uri': 'http://repository.lppm.unila.ac.id/id/document/674'}]",1055,4.0,show,803-809,2016-10-13 15:41:07,781,archive,"Activities of Soil Enzymes in Fields Continuously
Cultivated with Cassava, Sugarcane, and Pineapple in Middle Terrace Areas of Lampung Province, South Sumatra, Indonesia",TRUE,article,"[{'name': {'given': 'Abdul Kadir', 'honourific': None, 'lineage': None, 'family': 'Salam'}, 'id': None}, {'name': {'given': 'Edi', 'honourific': None, 'family': 'Sutanto', 'lineage': None}, 'id': None}, {'id': None, 'name': {'given': 'Yessy', 'honourific': None, 'family': 'Desvia', 'lineage': None}}, {'id': 'ainin.niswati@fp.unila.ac.id', 'name': {'family': 'Niswati', 'lineage': None, 'honourific': None, 'given': 'Ainin'}}, {'id': 'dermiyati.1963@fp.unila.ac.id', 'name': {'lineage': None, 'family': 'Dermiyati', 'honourific': None, 'given': '-'}}, {'id': 'kimuram@nagoya-u.ac.jp', 'name': {'family': 'Kimura', 'lineage': None, 'honourific': None, 'given': 'Makoto'}}]",,,,,,http://dx.doi.org/10.1080/00380768.1999.10414329,"[{'url': 'http:/www.tandfonline.com/page/terms-and-conditions', 'type': 'pub'}]"
