,event_location,title,refereed,event_dates,creators,pres_type,type,lastmod,official_url,documents,userid,metadata_visibility,pagerange,datestamp,eprintid,eprint_status,rev_number,ispublished,full_text_status,status_changed,event_type,divisions,dir,uri,date,abstract,date_type,event_title,subjects,related_url,corp_creators,issn,publisher,publication,volume,contributors,number,id_number,patent_applicant,isbn,keywords,referencetext,contact_email
22,Bandar Lampung,"Corn Yield and Soil Properties under longterm conservation tillage in clayey soil tropical upland of Lampung, Indonesia",TRUE,03-04 Dec 2018,"[{'name': {'family': 'Rohmah', 'lineage': None, 'honourific': None, 'given': 'Siti Nur'}, 'id': None}, {'id': 'muhajir.utomo@fp.unila.ac.id', 'name': {'honourific': None, 'family': 'Utomo', 'lineage': None, 'given': 'Muhajir'}}, {'name': {'honourific': None, 'family': 'Afandi', 'lineage': None, 'given': '.'}, 'id': 'afandi.1964@fp.unila.ac.id'}, {'name': {'given': 'Irwan Sukri', 'lineage': None, 'family': 'Banuwa', 'honourific': None}, 'id': 'irwanbanuwa@yahoo.com'}]",paper,conference_item,2019-05-09 03:05:12,,"[{'placement': 1, 'eprintid': 11519, 'pos': 1, 'uri': 'http://repository.lppm.unila.ac.id/id/document/24518', 'security': 'public', 'main': 'Afandi Prociding International.pdf', 'docid': 24518, 'files': [{'datasetid': 'document', 'fileid': 104602, 'mime_type': 'application/pdf', 'hash': 'b13944230f0fe0a2f71068fa72bf3f5b', 'objectid': 24518, 'filesize': 3115048, 'filename': 'Afandi Prociding International.pdf', 'uri': 'http://repository.lppm.unila.ac.id/id/file/104602', 'hash_type': 'MD5', 'mtime': '2019-05-02 08:22:14'}], 'format': 'text', 'language': 'en', 'mime_type': 'application/pdf', 'rev_number': 1}]",718,show,,2019-05-09 03:05:12,11519,archive,8,pub,public,2019-05-09 03:05:12,conference,['FP23'],disk0/00/01/15/19,http://repository.lppm.unila.ac.id/id/eprint/11519,2018-12-03,"he conservation tillage system which includes minimum and non-tillage tillage becomes an alternative land preparation that can maintain high productivity.  One thing that determines the success of conservation tillage is to restore plant residues after harvest as a source of organic material in the form of mulch to maintain the physical properties of the soil. This study aims to determine the effect of tillage and nitrogen fertilization systems on the soil prorerties and corn yeild. The study was conducted using a Randomized Block Design (RBD) which was arranged factorially with 4 replications. The first factor is a long-term tillage system (T1 = Intensive tillage, T2 = Minimum tillage, T3 = No tillage) and the second factor was long-term nitrogen fertilization (N0 = 0 kg N ha).  The data obtained will be tested for homogeneity by the Bartlet test and the additivity of the data was tested by the Tukey Test.  The results showed that long-term tillage and fertilization systems did not affect the physical properties of the soil, namely bulk density, soil
porosity, soil texture, and soil structure.  The highest soil organic carbon was obtained when the treatment of the minimum soil combined with of 200 kg N ha
-1 and N1 = 200 kg N ha-1 treatment was 1.56%.  The highest corn yield was obtained from the treatment of the minimum tillage and no tillage combined with nitrogen fertilization of 200 kg N ha-1.",published,6TH INTERNATIONAL WORKSHOP ON CROP PRODUCTION AND PRODUCTIVITY UNDER GLOBAL CLIMATE CHANGE,['S1'],,,,,,,,,,,,,,
23,,Tropical Soil Labile Fractions of Copper in Experimental Plots ±Ten Years after Application of Copper-Containing-Waste,TRUE,,"[{'name': {'lineage': None, 'family': 'Salam', 'honourific': None, 'given': 'Abdul Kadir'}, 'id': 'abdul.kadir@fp.unila.ac.id'}]",,article,2021-05-10 01:23:33,,"[{'format': 'text', 'files': [{'hash_type': 'MD5', 'mtime': '2021-05-08 03:48:45', 'filesize': 270649, 'objectid': 134953, 'uri': 'http://repository.lppm.unila.ac.id/id/file/356377', 'filename': '2018 J Trop Soils.pdf', 'fileid': 356377, 'datasetid': 'document', 'mime_type': 'application/pdf', 'hash': '1948ee83733850e0fef2d073c19148b6'}], 'main': '2018 J Trop Soils.pdf', 'docid': 134953, 'language': 'en', 'rev_number': 1, 'mime_type': 'application/pdf', 'eprintid': 30062, 'placement': 1, 'security': 'public', 'pos': 1, 'uri': 'http://repository.lppm.unila.ac.id/id/document/134953'}]",1056,show,11-18,2021-05-10 01:23:33,30062,archive,8,pub,public,2021-05-10 01:23:33,,['FP23'],disk0/00/03/00/62,http://repository.lppm.unila.ac.id/id/eprint/30062,2018-01-01,"Copper is reported to be retained in soils for a quite long time particularly in soil treated with some amendments.  This research was intended to evaluate the soil labile fractions of Cu ±10 years after application of Cu-containing industrial waste, lime, and cassava-leaf compost.  Soil samples were taken from topsoils and subsoils of ±10 years old experimental plots set in 1998 and factorially treated with a metal-spoon industrial waste at 0, 15, and 60 ton ha-1, lime at 0 and 5 ton ha-1, and cassava-leaf compost at 0 and 5 ton ha-1.  The measured Cu labile fractions were compared to those in soils sampled at ±1.5 years and ±3 years after treatments. The results showed that the soil Cu labile fractions in waste treated soils were higher than those in the control treatments even though their concentrations decreased with the years of sampling.  Lime showed a decreasing effect on soil labile Cu fractions, but the effect decreased with the years of sampling.  The effect of cassava-leaf compost application on soil labile Cu fraction was in general not evidenced ±10 years after treatment.",published,,['S1'],,['Kiat Ginanjar'],0852-257X,University of Lampung,Journal of Tropical Soils,23.0,"[{'name': {'given': 'Abdul K', 'honourific': None, 'family': 'Salam', 'lineage': None}, 'type': 'http://www.loc.gov/loc.terms/relators/AUT', 'id': 'aabdul.kadir@fp.unila.ac.id'}, {'name': {'given': 'Kiat', 'honourific': None, 'family': 'Ginanjar', 'lineage': None}, 'type': 'http://www.loc.gov/loc.terms/relators/AUT', 'id': None}]",1.0,,,,"Cassava-Leaf Compost, Copper, Heavy Metals, Industrial Waste, Lime",,abdul.kadir@fp.unila.ac.id
24,,Tropical Soil Labile Fractions of Copper in the Experimental Plots  ±Ten Years after Application of Copper-Containing-Waste,TRUE,,"[{'id': 'abdul.kadir@fp.unila.ac.id', 'name': {'given': 'Abdul Kadir', 'family': 'Salam', 'lineage': None, 'honourific': None}}, {'name': {'given': 'K.', 'honourific': None, 'lineage': None, 'family': 'Ginanjar'}, 'id': None}]",,article,2019-05-10 02:35:12,http://journal.unila.ac.id/index.php/tropicalsoil,"[{'uri': 'http://repository.lppm.unila.ac.id/id/document/25402', 'pos': 1, 'security': 'public', 'placement': 1, 'eprintid': 12422, 'mime_type': 'application/pdf', 'language': 'en', 'rev_number': 1, 'files': [{'fileid': 110484, 'datasetid': 'document', 'mime_type': 'application/pdf', 'hash': '10d228b099448bc9c506cfd0805cc4b2', 'objectid': 25402, 'filesize': 270134, 'uri': 'http://repository.lppm.unila.ac.id/id/file/110484', 'filename': '2. AKS OK.pdf', 'hash_type': 'MD5', 'mtime': '2019-05-10 02:20:27'}], 'main': '2. AKS OK.pdf', 'docid': 25402, 'format': 'text'}]",1056,show,11-18,2019-05-10 02:35:12,12422,archive,6,pub,public,2019-05-10 02:35:12,,['FP23'],disk0/00/01/24/22,http://repository.lppm.unila.ac.id/id/eprint/12422,2018-01-02,"Copper is reported to be retained in soils for a quite long time particularly in soil treated with some amendments.  This research was intended to evaluate the soil labile fractions of Cu ±10 years after application of Cu-containing industrial waste, lime, and cassava-leaf compost.  Soil samples were taken from topsoils and subsoils of ±10 years old experimental plots set up in 1998 and factorially treated with a metal-spoon industrial waste at 0, 15, and 60 Mg ha-1, lime at 0 and 5 Mg ha-1, and cassava-leaf compost at 0 and 5 Mg ha-1.  The measured Cu labile fractions were compared to those in soils sampled at ±1.5 years and ±3 years after treatments. The results showed that the soil Cu labile fractions in waste treated soils were higher than those in the control treatments eventhough their concentrations decreased with the years of sampling.  Lime showed a decreasing effect on soil labile Cu fractions, but the effect decreased with the years of sampling. The effect of cassava-leaf compost application on soil Cu labile fraction was in general not evidenced ±10 years after treatment.",published,,['S1'],,,0852-257X,University of Lampung,Journal of Tropical Soils,23.0,[{'type': 'http://www.loc.gov/loc.terms/relators/AUT'}],1.0,,,,,,
25,,Ekstraksi dan Pengukuran Selenium pada Beberapa Sampel Tanah Tropika,,,"[{'id': 'supriatin.1979@fp.unila.ac.id', 'name': {'given': 'Supriatin', 'family': 'Supriatin', 'lineage': None, 'honourific': None}}, {'id': 'abdul.kadir@fp.unila.ac.id', 'name': {'given': 'Abdul Kadir', 'honourific': None, 'family': 'Salam', 'lineage': None}}, {'id': 'jamalam.lumbanraja@fp.unila.ac.id', 'name': {'lineage': None, 'family': 'Lumbanraja', 'honourific': None, 'given': 'Jamalam'}}, {'id': 'hery.novpriansyah@fp.unila.ac.id', 'name': {'given': 'Hery', 'honourific': None, 'lineage': None, 'family': 'Novpriansyah'}}]",,other,2019-05-09 01:54:20,,"[{'language': 'en', 'mime_type': 'application/pdf', 'rev_number': 1, 'main': 'Laporan Ekstraksi dan Pengukuran Se.pdf', 'docid': 24862, 'files': [{'mime_type': 'application/pdf', 'hash': 'd365c534464762896d9566302875b425', 'fileid': 106709, 'datasetid': 'document', 'uri': 'http://repository.lppm.unila.ac.id/id/file/106709', 'filename': 'Laporan Ekstraksi dan Pengukuran Se.pdf', 'filesize': 1108641, 'objectid': 24862, 'mtime': '2019-05-07 03:45:20', 'hash_type': 'MD5'}], 'format': 'text', 'pos': 1, 'uri': 'http://repository.lppm.unila.ac.id/id/document/24862', 'security': 'public', 'placement': 1, 'eprintid': 11875}]",5,show,,2019-05-09 01:54:20,11875,archive,7,unpub,public,2019-05-09 01:54:20,,['FP23'],disk0/00/01/18/75,http://repository.lppm.unila.ac.id/id/eprint/11875,2018-11-01,"Selenium (Se) merupakan unsur hara esensial bagi hewan (ternak) dan manusia. Besarnya asupan Se pada hewan (ternak) dan manusia sangat ditentukan oleh kandungan Se di dalam tanaman pangan dan pakan yang dikonsumsi melalui rantai makanan, dan kandungan Se di dalam tanaman sangat ditentukan oleh ketersediaan Se di dalam tanah. Oleh karena itu, studi tentang kandungan dan ketersediaan Se di dalam tanah saat ini menjadi penting karena berkaitan dengan kualitas nutrisi pangan atau pakan, yang pada akhirnya akan menentukan nutrisi manusia dan hewan (ternak). Hingga saat ini studi tentang kandungan dan ketersediaan Se pada tanah-tanah pertanian tropika khususnya di Indonesia belum dilakukan secara intensif. Penelitian ini bertujuan untuk menetapkan metode ekstraksi dan pengukuran kandungan total Se dan Se-tersedia pada sampel tanah tropika. Kandungan total Se pada  sampel tanah asal Propinsi Lampung ditentukan dengan metode 200.7 Revisi 5.0 dari United States Environmental Protection Agency (U.S. EPA) menggunakan HNO3 dan HCl sebagai pengekstrak. Pengukuran Se pada masing-masing ekstrak tanah dilakukan dengan menggunakan Inductively Coupled Plasma Optical Emission Spectroscopy (ICP-OES). Hasil penelitian menunjukkan bahwa kandungan total Se di dalam sampel tanah Andosol asal Gisting yang diekstrak menggunakan HNO3 + HCl sangat tinggi, yaitu pada kisaran 11,63 – 36,35 mg/kg. Kandungan total Se tersebut melebihi kisaran total Se yang terkandung pada tanah-tanah di dunia, yaitu 0,03 – 2,0 mg/kg. Selain itu, kandungan total Se tersebut juga berada pada kisaran total Se untuk tanah-tanah dengan kandungan Se tinggi (seleniferous soils), yaitu 1 – 100 mg/kg. Hasil pengukuran total Se pada sampel tanah dalam penelitian ini tidak reliabel dikarenakan tingginya nilai standar deviasi dan keragaman dari pengukuran ulangan terhadap konsentrasi Se tersebut menggunakan ICP-OES. Selain itu, limit deteksi Se (87,63 µg/L atau 4,38 mg/kg) dan limit determinasi Se (292,10 µg/L atau 14,60 mg/kg) pada ekstrak tanah tersebut juga sangat tinggi. Tingginya keragaman, standar deviasi, limit deteksi dan limit determinasi pada ekstrak tanah tersebut kemungkinan disebabkan oleh adanya kontaminasi Se selama eksperimen berlangsung. Hal ini ditunjukkan oleh berlebihnya konsentrasi Se di dalam sampel tanah yang di-spike Se dibandingkan dengan konsentrasi yang seharusnya. Selanjutnya, pengukuran konsentrasi Se menggunakan ICP-OES tidak direkomendasikan karena kurang sensitifnya ICP-OES untuk mengukur elemen dengan konsentrasi < 100 µg/L.",,,['S1'],,['Universitas Lampung'],,-,,,,,,,,,,
26,"Kuching, Sarawak, Malaysia",Soil Parameters Influencing Selenium Uptake in Grass Grown Under Field Conditions,TRUE,12-14 October 2018,"[{'name': {'given': 'Supriatin', 'lineage': None, 'family': 'Supriatin', 'honourific': None}, 'id': 'supriatin.1979@fp.unila.ac.id'}, {'id': None, 'name': {'honourific': None, 'lineage': None, 'family': 'Weng', 'given': 'Liping'}}, {'id': None, 'name': {'lineage': None, 'family': 'Bussink', 'honourific': None, 'given': 'Wim'}}, {'id': None, 'name': {'given': 'Rob', 'honourific': None, 'lineage': None, 'family': 'Comans'}}]",speech,conference_item,2018-11-26 07:45:52,,"[{'main': 'Abstract Supriatin Supriatin.pdf', 'docid': 22651, 'files': [{'fileid': 91374, 'datasetid': 'document', 'mime_type': 'application/pdf', 'hash': '3dbd1b90253254f3ce25dc0dbc93a5d1', 'objectid': 22651, 'filesize': 20307, 'filename': 'Abstract Supriatin Supriatin.pdf', 'uri': 'http://repository.lppm.unila.ac.id/id/file/91374', 'hash_type': 'MD5', 'mtime': '2018-11-08 07:47:03'}], 'format': 'other', 'rev_number': 4, 'language': 'en', 'mime_type': 'application/pdf', 'content': 'presentation', 'placement': 1, 'eprintid': 9629, 'pos': 1, 'uri': 'http://repository.lppm.unila.ac.id/id/document/22651', 'security': 'public', 'formatdesc': 'Abstract for oral presentation in ISSAAS International Congress 2018'}]",5,show,,2018-11-09 03:25:41,9629,archive,11,unpub,public,2018-11-09 03:25:41,conference,['FP23'],disk0/00/00/96/29,http://repository.lppm.unila.ac.id/id/eprint/9629,2018-10-13,"This study was aimed to identify the major soil factors controlling Se bioavailability under field conditions for low Se grassland soils with predominantly organic Se, and to evaluate the effect of NPK fertilization on Se plant uptake in these soils. Field experiments without and with NPK applications were conducted in the Netherlands on 21 and 15 grasslands, respectively. Soil parameters including C:N ratio; selenite content; total Se, S and P in various soil extractions (0.01 M CaCl2, 0.43 M HNO3, hot water, ammonium oxalate, aqua regia) and DOC in hot water and 0.01M CaCl2 soil extraction, were analysed on soil samples taken from the field without NPK application before the growing season. Selenium content in grass was analysed after harvest. Regression analysis was performed to identify soil parameters determining Se content in grass. Among all the soil parameters measured, Se in hot water extraction correlates most strongly with Se content in grass, which explains about 41% of the Se variability in grass grown under field conditions. This finding indicates that >50% of the Se variability in grass cannot be described by the soil parameters considered in the current study. Selenium in hot water extraction is mostly in organic form, representing the labile organic Se in soils. The content of amorphous Fe-(hydr)oxide and clay in soils has a positive effect on both the amount of Se in hot water extraction and Se in grass, suggesting that adsorption and desorption processes on soil mineral surfaces control the bioavailability of labile organic Se in the soils. Generally, application of NPK fertilizers decreased Se content in grass, especially on organic rich soils. This effect becomes stronger with increasing soil organic matter content, suggesting that interaction between NPK fertilizer and soil organic matter results in a synergetic effect in reducing Se bioavailability in soils. A possible explanation is that NPK application increases soil microbial activity, which reduces Se into a lower valence state that is subsequently immobilized into soil organic matter.",,ISSAAS International Congress 2018,['S1'],,"['University of Lampung, Indonesia', 'Wageningen University, the Netherlands', 'Nutrient Management Institute, the Netherlands', 'Wageningen University, the Netherlands']",,,,,,,,,,,,
27,,"PENGARUH SISTEM OLAH TANAH DAN APLIKASI HERBISIDA
TERHADAP BIOMASSA KARBON MIKROORGANISME TANAH (C-MIK)
PADA PERTANAMAN UBI KAYU (Manihot esculenta Crantz) TAHUN KE-2 DI TANAH ULTISOL GEDUNG MENENG BANDAR LAMPUNG",TRUE,,"[{'id': None, 'name': {'given': '.', 'honourific': None, 'family': 'Tobroni', 'lineage': None}}, {'name': {'given': 'Sri', 'honourific': None, 'family': 'Yusnaini', 'lineage': None}, 'id': 'sri.yusnaini@fp.unila.ac.id'}, {'name': {'given': 'Ainin', 'family': 'Niswati', 'lineage': None, 'honourific': None}, 'id': 'ainin.niswati@fp.unila.ac.id'}, {'id': 'muhajir.utomo@fp.unila.ac.id', 'name': {'given': 'Muhajir', 'honourific': None, 'lineage': None, 'family': 'Utomo'}}]",,article,2018-06-25 02:24:52,http://jurnal.fp.unila.ac.id/index.php/JA/,"[{'placement': 1, 'eprintid': 7607, 'pos': 1, 'uri': 'http://repository.lppm.unila.ac.id/id/document/20657', 'security': 'public', 'main': 'Tobroni - Ainin JAT 6-2 2018.pdf', 'docid': 20657, 'files': [{'filename': 'Tobroni - Ainin JAT 6-2 2018.pdf', 'uri': 'http://repository.lppm.unila.ac.id/id/file/68434', 'objectid': 20657, 'filesize': 592103, 'mtime': '2018-06-23 15:38:04', 'hash_type': 'MD5', 'hash': '1a6e1a910beb8e3d307539fe44652e46', 'mime_type': 'application/pdf', 'datasetid': 'document', 'fileid': 68434}], 'format': 'text', 'language': 'en', 'rev_number': 2, 'mime_type': 'application/pdf', 'content': 'published'}]",1055,show,127-132,2018-06-25 02:24:52,7607,archive,7,pub,public,2018-06-25 02:24:52,,['FP23'],disk0/00/00/76/07,http://repository.lppm.unila.ac.id/id/eprint/7607,2018-05-01,"Pengolahan tanah merupakan salah satu kegiatan yang umumnya dianggap wajib dalam berbudidaya tanaman yang dapat dilakukan secara olah tanah minimum (OTM), olah tanah intensif (OTI) maupun tanpa olah tanah (TOT). Sementara itu, aplikasi herbisida umumnya dilakukan guna meminimalisir pertumbuhan gulma yang merupakan pesaing tanaman dalam memanfaatkan ruang, cahaya, air dan unsur hara. Penelitian ini bertujuan untuk mengetahui pengaruh sistem olah tanah terhadap biomassa karbon mikroorganisme (C-mik) pada tanah yang ditanami ubi kayu, mengetahui pengaruh aplikasi herbisida terhadap biomassa karbon mikroorganisme (C-mik) pada tanah yang ditanami ubi kayu, dan mengetahui pengaruh antara interaksi sistem olah tanah dan pengaplikasian herbisida terhadap biomassa karbon mikroorganisme (C-mik) pada tanah yang
ditanami ubi kayu. Penelitian ini dilaksanakan di Laboratorium Lapang Terpadu Fakultas Pertanian Universitas Lampung dengan menggunakan petak pertanaman ubi kayu di tanah ultisols sejak September 2014-Mei 2015 (musim tanam tahun kedua) dengan menggunakan Rancangan Acak Kelompok (RAK), terdiri atas empat ulangan dengan empat satuan percobaan untuk tiap ulangannya.Perlakuan yang diterapkan terdiri atas 2 faktor, faktor pertama adalah sistem olah tanah secara minimum (T0)dan intensif (T1), sedangkan faktor kedua adalah aplikasi herbisida yaitu tanpa penggunaan herbisida (H0) dan dengan
penggunaan herbisida (H1) yang disemprotkan 3 bulan setelah tanam dan 6 bulan setelah tanam. Pengolahan tanah baik secara intensif maupun minimum tidak memberikan pengaruh yang signifikan terhadap biomassa karbon mikroorganisme tanah (C- mik) pada petak pertanaman ubi kayu musim kedua.Begitu pula dengan pengaplikasian herbisida yang juga tidak memberikan pengaruh yang signifikan terhadap biomassa karbon mikroorganisme tanah (C-mik), sehingga tidak terdapat interaksi antara sistem olah tanah dan aplikasi herbisida yang diterapkan pada petak pertanaman ubi kayu musim kedua terhadap karbon mikroorganisme tanah (C-mik).",published,,['S1'],,['University of Lampung'],2337-4993,Jurnal Agrotek Tropika,Jurnal Agrotek Tropika,6.0,,2.0,,,,,,
28,Bandar Lampung,The effect of long-term cassava cultivation on organic carbon content and soil physical properties in Central Lampung,TRUE,03-04 Dec 2018,"[{'id': 'dewerahman@yahoo.com', 'name': {'given': 'Didin', 'lineage': None, 'family': 'Wiharso', 'honourific': None}}, {'id': 'afandi.1964@fp.unila.ac.id', 'name': {'family': 'Afandi', 'lineage': None, 'honourific': None, 'given': '.'}}, {'id': 'irwanbanuwa@yahoo.com', 'name': {'lineage': None, 'family': 'Banuwa', 'honourific': None, 'given': 'Irwan Sukri'}}, {'id': None, 'name': {'given': 'Dina', 'honourific': None, 'family': 'Fanti', 'lineage': None}}]",paper,conference_item,2019-05-09 03:11:19,,"[{'language': 'en', 'mime_type': 'application/pdf', 'rev_number': 1, 'main': 'Prociding International Pak didin.pdf', 'docid': 25046, 'files': [{'datasetid': 'document', 'fileid': 108027, 'hash': 'e1163e30e14474e93f469802cf2c8fc3', 'mime_type': 'application/pdf', 'hash_type': 'MD5', 'mtime': '2019-05-08 07:44:23', 'filesize': 1163633, 'objectid': 25046, 'uri': 'http://repository.lppm.unila.ac.id/id/file/108027', 'filename': 'Prociding International Pak didin.pdf'}], 'format': 'text', 'uri': 'http://repository.lppm.unila.ac.id/id/document/25046', 'pos': 1, 'security': 'public', 'placement': 1, 'eprintid': 12060}]",755,show,44-46,2019-05-09 03:11:19,12060,archive,7,pub,public,2019-05-09 03:11:19,conference,['FP23'],disk0/00/01/20/60,http://repository.lppm.unila.ac.id/id/eprint/12060,2018-12-03,"The effect of long-term cassava cultivation on organic carbon content and soil physical properties in Central Lampung has been investigated. A plot of land that had been cultivated for Cassava plants and another plot for mixed garden for more than 30 years were studied in order to know how the effect of of long-term cassava cultivation on organic carbon content and soil physical properties. The results show that long-term cultivation of cassava had reduced the thickness of the surface layer and organic carbon content, changed soil color become lighter and changed the shape of soil structure in the soil surface layer from crumbs become angular blocky.  There was a tendency that the  bulk density and the soil strength in cassava cultivation were lower in the surface layer and higher in the bottom layer.",published,6TH INTERNATIONAL WORKSHOP ON CROP PRODUCTION AND PRODUCTIVITY UNDER GLOBAL CLIMATE CHANGE,['S1'],,,,,,,,,,,,,,
29,Bandar Lampung,The Effect of long-term cassava cultivation on organic carbon content and soil physical properties in Central Lampung,TRUE,03-04 Dec 2018,"[{'name': {'given': 'Didin', 'family': 'Wiharso', 'lineage': None, 'honourific': None}, 'id': 'dewerahman@yahoo.com'}, {'name': {'honourific': None, 'lineage': None, 'family': 'Afandi', 'given': '.'}, 'id': 'afandi.1964@fp.unila.ac.id'}, {'name': {'lineage': None, 'family': 'Fanti', 'honourific': None, 'given': 'Dina'}, 'id': None}]",paper,conference_item,2019-05-09 03:05:11,,"[{'format': 'text', 'files': [{'filename': 'Afandi Prociding International.pdf', 'uri': 'http://repository.lppm.unila.ac.id/id/file/104589', 'filesize': 3112765, 'objectid': 24516, 'mtime': '2019-05-02 08:01:22', 'hash_type': 'MD5', 'hash': 'a3ccfac39a8bcdc2b6cfb6f966c0f9be', 'mime_type': 'application/pdf', 'fileid': 104589, 'datasetid': 'document'}], 'main': 'Afandi Prociding International.pdf', 'docid': 24516, 'language': 'en', 'mime_type': 'application/pdf', 'rev_number': 1, 'eprintid': 11518, 'placement': 1, 'security': 'public', 'pos': 1, 'uri': 'http://repository.lppm.unila.ac.id/id/document/24516'}, {'eprintid': 11518, 'placement': 2, 'security': 'public', 'pos': 2, 'uri': 'http://repository.lppm.unila.ac.id/id/document/24517', 'format': 'text', 'files': [{'fileid': 104593, 'datasetid': 'document', 'mime_type': 'application/pdf', 'hash': 'b13944230f0fe0a2f71068fa72bf3f5b', 'objectid': 24517, 'filesize': 3115048, 'filename': 'Afandi Prociding International.pdf', 'uri': 'http://repository.lppm.unila.ac.id/id/file/104593', 'hash_type': 'MD5', 'mtime': '2019-05-02 08:12:04'}], 'main': 'Afandi Prociding International.pdf', 'docid': 24517, 'language': 'en', 'mime_type': 'application/pdf', 'rev_number': 1}]",718,show,,2019-05-09 03:05:11,11518,archive,8,pub,public,2019-05-09 03:05:11,conference,['FP23'],disk0/00/01/15/18,http://repository.lppm.unila.ac.id/id/eprint/11518,2018-12-03,"The effect of long-term cassava cultivation on organic carbon content and soil physical properties in Central Lampung has been investigated. A plot of land that had been cultivated for Cassava plants and another plot for mixed garden for more than 30 years were studied in order to know how the effect of of long-term cassava cultivation on organic carbon content and soil physical properties. The results show that long-term cultivation of cassava had reduced the thickness of the surface layer and organic carbon content, changed soil color become lighter and changed the shape of soil structure in the soil surface layer from crumbs become angular blocky. There was a tendency that the bulk density and the soil
strength in cassava cultivation were lower in the surface layer and higher in the bottom layer.",published,6TH INTERNATIONAL WORKSHOP ON CROP PRODUCTION AND PRODUCTIVITY UNDER GLOBAL CLIMATE CHANGE,['S1'],,,,,,,,,,,,,,
