,event_location,title,refereed,event_dates,creators,pres_type,type,lastmod,official_url,documents,userid,metadata_visibility,pagerange,datestamp,eprintid,eprint_status,rev_number,ispublished,full_text_status,status_changed,event_type,divisions,dir,uri,date,abstract,date_type,event_title,subjects,related_url,corp_creators,issn,publisher,publication,volume,contributors,number,id_number,patent_applicant,isbn,keywords,referencetext,contact_email
0,Bandar Lampung,"Tracking the fate of organic matter residue using soil dispersion ratio under intensive farming in red acid soil of Lampung, Indonesia",FALSE,03-04 Dec 2018,"[{'id': 'afandi.1964@fp.unila.ac.id', 'name': {'given': '.', 'honourific': None, 'lineage': None, 'family': 'Afandi'}}, {'id': None, 'name': {'given': 'Siti', 'honourific': None, 'family': 'Chairani', 'lineage': None}}, {'id': None, 'name': {'given': 'Sherly', 'honourific': None, 'family': 'Megawati', 'lineage': None}}, {'id': 'hery.novpriansyah@fp.unila.ac.id', 'name': {'honourific': None, 'family': 'Novpriansyah', 'lineage': None, 'given': 'Hery'}}, {'id': 'irwanbanuwa@yahoo.com', 'name': {'given': 'Irwan Sukri', 'honourific': None, 'lineage': None, 'family': 'Banuwa'}}, {'name': {'honourific': None, 'lineage': None, 'family': 'Zuldadan', 'given': '.'}, 'id': None}, {'name': {'given': 'Henrie', 'honourific': None, 'lineage': None, 'family': 'Buchari'}, 'id': None}]",paper,conference_item,2019-04-09 02:29:08,http://www.ugsas.gifu-u.ac.jp/eng/news/symposium/,"[{'language': 'en', 'rev_number': 1, 'mime_type': 'application/pdf', 'format': 'text', 'main': '19.Proceeding Crop Production Unila.pdf', 'files': [{'datasetid': 'document', 'fileid': 101497, 'hash': '898907a72c602cdb9e635b4db866df58', 'mime_type': 'application/pdf', 'hash_type': 'MD5', 'mtime': '2019-04-09 01:44:46', 'objectid': 24108, 'filesize': 5721883, 'uri': 'http://repository.lppm.unila.ac.id/id/file/101497', 'filename': '19.Proceeding Crop Production Unila.pdf'}], 'docid': 24108, 'security': 'public', 'pos': 1, 'uri': 'http://repository.lppm.unila.ac.id/id/document/24108', 'eprintid': 11108, 'placement': 1}]",718,show,26-28,2019-04-09 02:29:08,11108,archive,10,pub,public,2019-04-09 02:29:08,workshop,['FP23'],disk0/00/01/11/08,http://repository.lppm.unila.ac.id/id/eprint/11108,2018-12-03,"Organic matter or compost which applied to the soil can improve soil physical properties, such as forming microaggregates and increasing soil water holding capacity. However, the effect and the sustainability in the soil depended on the type of organic matter origin and its composition as well as its environment. This study aims to determine the fate of organic material , which is mainly its composition from cowdung using simple tools, soil dispersion ratio (DR). A soil survey was done to the area with different land use and organic matter (compost) application . The area with no compost application (0 t ha-1) including in cassava, oil palm, and pineapple (3 locations), while area with banana and guava applied with compost around 50 t ha-1 - 100 t ha-1 and pineapple with 180 t ha-1 . The experiment showed that the soils were generally categorized as moderately to extremely dispersive, except cassava was little dispersive. Clay particles were mostly  binded by organic material by the mechanism of cation brigde, and contributied >50% of clay aggregate form, and the highest one was in cassava .",published,6TH INTERNATIONAL WORKSHOP ON CROP PRODUCTION AND PRODUCTIVITY UNDER GLOBAL CLIMATE CHANGE,['S1'],,,,,,,,,,,,,,
1,Banda Aceh,EFFECT OF SOIL TILLAGE AND HERBICIDE APPLICATION ON POPULATION AND BIOMASS OF EARTHWORM IN CASSAVA CULTIVATION AT THE 4th GROWING SEASON,TRUE,2-3 Oktober 2018,"[{'name': {'given': 'Nur Afni', 'honourific': None, 'lineage': None, 'family': 'Afrianti'}, 'id': 'nur.afni@fp.unila.ac.id'}, {'name': {'given': 'Sri', 'lineage': None, 'family': 'Yusnaini', 'honourific': None}, 'id': 'sri.yusnaini@fp.unila.ac.id'}, {'id': 'ainin.niswati@fp.unila.ac.id', 'name': {'honourific': None, 'lineage': None, 'family': 'Niswati', 'given': 'Ainin'}}, {'id': 'nur.afni@fp.unila.ac.id', 'name': {'given': 'Dodi', 'honourific': None, 'family': 'Maulana', 'lineage': None}}]",lecture,conference_item,2019-05-02 04:20:40,http://fkptpi.unsyiah.ac.id/images/PDF%20PROSIDING/PDF/PDF%20AGROTEKNOLOGI/144-152.pdf,"[{'placement': 1, 'eprintid': 11397, 'uri': 'http://repository.lppm.unila.ac.id/id/document/24406', 'pos': 1, 'security': 'public', 'files': [{'hash': '9e158d67d53e026bcc201143238a222e', 'mime_type': 'application/pdf', 'fileid': 103617, 'datasetid': 'document', 'mtime': '2019-04-29 08:02:13', 'hash_type': 'MD5', 'uri': 'http://repository.lppm.unila.ac.id/id/file/103617', 'filename': '144-152-Afni FKPTPI.pdf', 'filesize': 700077, 'objectid': 24406}], 'main': '144-152-Afni FKPTPI.pdf', 'docid': 24406, 'format': 'text', 'rev_number': 2, 'language': 'en', 'mime_type': 'application/pdf', 'content': 'published'}]",1055,show,144-152,2019-05-02 04:20:40,11397,archive,12,pub,public,2019-05-02 04:20:40,conference,['FP23'],disk0/00/01/13/97,http://repository.lppm.unila.ac.id/id/eprint/11397,2018-10-03,"Kegiatan budidaya tanaman tidak bisa terlepas dari pengolahan tanah dan pengendalian gulma. Hal ini dikarenakan kegiatan tersebut akan mempengaruhi kualitas tanah serta pertumbuhan dan hasil tanaman budidaya. Penilaian kualitas tanah akibat pengolahan olah tanah dan aplikasi herbisida dapat diketahui dengan mengunakan cacing tanah sebagai indikator alternatif mengenai kesuburan tanah secara biologis. Penelitian ini bertujuan untuk mengetahui pengaruh sistem olah tanah dan aplikasi herbisida serta interaksinya terhadap populasi dan biomassa cacing tanah pada pertanaman ubi kayu (Manihot esculenta Crantz) musim tanam keempat di Gedung Meneng. Penelitian menggunakan rancangan acak kelompok (RAK) dengan dua faktor dan empat ulangan. Faktor pertama adalah sistem olah tanah (T0 = olah tanah minimum dan T1 = olah tanah intensif). Faktor yang kedua adalah aplikasi herbisida (H0 = tanpa herbisida dan H1 = aplikasi herbisida). Data yang diperoleh diuji homogenitasnya dengan uji Bartlett dan adifitasnya diuji dengan uji Tukey setelah asumsi terpenuhi data diolah dengan analisis ragam dan dilanjutkan dengan uji beda nyata terkecil (BNT) pada taraf 5%. Hubungan antara populasi dan biomassa cacing tanah dengan C-organik tanah, pH tanah, suhu tanah, dan kelembaban tanah dilakukan dengan uji korelasi.Hasil penelitian menunjukkan bahwapopulasi dan biomassa cacing tanah lebih tinggi pada perlakuan sistem olah tanah minimum dibandingkan perlakuan sistem olah tanah intensif di kedalaman 0-10 cm pada pengamatan 3 bulan setelah tanam (BST). Pada perlakuan tanpa herbisida populasi cacing tanah lebih tinggi dibandingkan perlakuan aplikasi herbisida di kedalaman 10-20 cm pada pengamatan 3 BST, tidak terdapat interaksi antara sistem olah tanah dan aplikasi herbisida terhadap populasi dan biomassa cacing.",published,Seminar dan Lokakarya Nasional Forum Komunikasi Perguruan Tinggi Pertanian Indonesia 2018,['S1'],[{'url': 'http://fkptpi.unsyiah.ac.id/index.php/id/prosiding/daftar-isi'}],['Universitas  Lampung'],,,,,,,,,,,,
2,,"Pengaruh Sistem Olah Tanah dan Pemupukan Nitrogen Jangka Panjang terhadap Populasi dan Biomassa Cacing Tanah pada Pertanaman Jagung (Zea Mays L.) di Lahan Polinela Bandar Lampung, Lampung",TRUE,,"[{'id': None, 'name': {'honourific': None, 'family': 'Al Afgani', 'lineage': None, 'given': 'Jamaluddin'}}, {'id': 'ainin.niswati@fp.unila.ac.id', 'name': {'given': 'Ainin', 'honourific': None, 'family': 'Niswati', 'lineage': None}}, {'id': 'muhajir.utomo@fp.unila.ac.id', 'name': {'honourific': None, 'family': 'Utomo', 'lineage': None, 'given': 'Muhajir'}}, {'name': {'lineage': None, 'family': 'Yusnaini', 'honourific': None, 'given': 'Sri'}, 'id': 'sri.yusnaini@fp.unila.ac.id'}]",,article,2018-06-21 02:09:16,http://jurnal.fp.unila.ac.id/index.php/JA/article/view/2533,"[{'eprintid': 7032, 'placement': 1, 'security': 'public', 'pos': 1, 'uri': 'http://repository.lppm.unila.ac.id/id/document/20004', 'format': 'text', 'docid': 20004, 'main': '6(1)- 50-55.pdf', 'files': [{'mtime': '2018-06-06 05:19:54', 'hash_type': 'MD5', 'filename': '6(1)- 50-55.pdf', 'uri': 'http://repository.lppm.unila.ac.id/id/file/64340', 'filesize': 80776, 'objectid': 20004, 'hash': '3be8566eed3f3adbb9f1c9be0dd339f3', 'mime_type': 'application/pdf', 'fileid': 64340, 'datasetid': 'document'}], 'content': 'published', 'language': 'en', 'rev_number': 2, 'mime_type': 'application/pdf'}]",1098,show,50-55,2018-06-21 02:09:16,7032,archive,7,pub,public,2018-06-21 02:09:16,,['FP23'],disk0/00/00/70/32,http://repository.lppm.unila.ac.id/id/eprint/7032,2018-01-01,"Di dalam budidaya terdapat dua faktor penting yaitu olah tanah dan pemupukan. Secara umum olah tanah dapat dibedakan atas olah tanah intensif (OTI) dan olah tanah konservasi (OTK), olah tanah intensif adalah.olah tanah dimana gulma dan sisa- sisa tanaman sebelumnya dibersihkan, lalu tanah diolah dengan cara dicangkul minimal dua kali sedalam 0-20 cm, lalu permukaan tanah diratakan, sementara olah tanah konservasi adalah dengan mengembalikan sisa-sisa tanaman setelah panen sebagai sumber bahan organik dalam bentuk mulsa yang mampu menjaga sifat fisik tanah. Pengolahan tanah yang intensif akan menghilangkan sisa tanaman yang dapat berperan sebagai mulsa organik dan sumber bahan organik yang menjadi tempat tumbuh dan berkembangnya biota tanah seperti cacing tanah. Oleh karena itu, pengolahan tanah sebaiknya dilakukan seminimum mungkin. Penelitian ini bertujuan untuk mempelajari pengaruh olah tanah dan pemupukan nitrogen serta interaksinya terhadap populasi dan biomassa cacing tanah. Penelitian dilakukan dengan menggunakan Rancangan Acak Kelompok (RAK) yang disusun secara faktorial 3 x 2 dengan 4 ulangan. Faktor pertama adalah sistem olah tanah jangka panjang yaitu T1 = Olah Tanah Intensif (OTI), T2 = Olah Tanah Minimum (OTM), T3 = Tanpa Olah Tanah (TOT), dan faktor kedua adalah pemupukan nitrogen jangka panjang yaitu No = 0 kg N ha -1 , dan N1 = 100 kg N ha -1 . Data yang diperoleh diuji homogenitasnya dengan uji Bartlett dan adifitasnya dengan uji Tukey setelah asumsi terpenuhi data diolah dengan analisis ragam dan dilanjutkan dengan uji Beda Nyata Terkecil (BNT) pada taraf 5%. Untuk mengetahui hubungan antara beberapa sifat kimia dan fisik tanah dengan
populasi dan biomassa cacing tanah dilakukan uji korelasi. Hasil penelitian menunjukkan bahwa populasi cacing tanah pada pengambilan sampel 0-10 cm berbeda nyata, sementara populasi cacing pada kedalaman 10-20 cm memiliki nilai yang sama dengan biomassa pada kedalaman 0-10 cm dan 10-20 cm. Tidak terdapat interaksi antara sistem pengolahan tanah dan pemupukan N terhadap populasi dan biomassa cacing tanah.",published,,['S1'],,['Universitas Lampung'],2337-4993,Fakultas Pertanian Universitas Lampung,Agrotek Tropika,6.0,[{'type': 'http://www.loc.gov/loc.terms/relators/AUT'}],1.0,,,,,,
3,,"Effects of aluminum stress on shoot growth, root growth and nutrient uptake of   three pineapple smooth cayenne clone [Ananas comosus (L.) Merr.]",TRUE,,"[{'id': None, 'name': {'given': 'Dudy', 'honourific': None, 'lineage': None, 'family': 'Arflan'}}, {'id': 'paul.timotiwu@gmail.com', 'name': {'lineage': None, 'family': 'Timotiwu', 'honourific': None, 'given': 'P.B.'}}, {'name': {'honourific': None, 'family': 'Salam', 'lineage': None, 'given': 'Abdul Kadir'}, 'id': 'abdul.kadir@fp.unila.ac.id'}, {'name': {'lineage': None, 'family': 'Afandi', 'honourific': None, 'given': '.'}, 'id': 'afandi.1964@fp.unila.ac.id'}]",paper,conference_item,2019-05-02 04:22:27,,"[{'files': [{'mime_type': 'application/pdf', 'hash': '45b1daf18999d29f996ab8bbc9a7db90', 'datasetid': 'document', 'fileid': 103930, 'filename': '1. Dudy dan AKS Prociding International.pdf', 'uri': 'http://repository.lppm.unila.ac.id/id/file/103930', 'objectid': 24438, 'filesize': 1220805, 'mtime': '2019-04-30 08:51:47', 'hash_type': 'MD5'}], 'main': '1. Dudy dan AKS Prociding International.pdf', 'docid': 24438, 'format': 'text', 'language': 'en', 'rev_number': 1, 'mime_type': 'application/pdf', 'placement': 1, 'eprintid': 11434, 'pos': 1, 'uri': 'http://repository.lppm.unila.ac.id/id/document/24438', 'security': 'public'}]",1056,show,40-43,2019-05-02 04:22:27,11434,archive,7,pub,public,2019-05-02 04:22:27,conference,['FP23'],disk0/00/01/14/34,http://repository.lppm.unila.ac.id/id/eprint/11434,2018-12-03,"Aluminum (Al) is a biotoxic metal to most of plants which inhibits root growth, led to a series of    influence metabolic abnornal  and  becomes  the  main  limiting  factor  productivity  in acid  soils.    In this experiment,  effect  of    Al  strees  on plant growth, root growth, macronutrient uptake (N, P, K, Ca, Mg) and Al uptake in root and plant were studied.    Three pineapple crown of smooth cayenne clones (GP1, GP3 and F180) was cultured from 0 to16 weeks in aquadest culture medium that contain 6 level of Al concentration treatment 0, 100, 200, 300, 400 and 500 μM AlCl3. Experiments using a factorial  randomized  block  design  with  5  replications  in  a  greenhouse  growing  environment.  Results  of  this experiment  showed  that  the  three  clones  have  a  different  response  of  tolerance  to  Al  stress.  GP3  clone  showed  the highest growth in the number of leaves, number of seminal roots, production of roots sugar, P leaf uptake and the lowest roots uptake of Al compared to other clones. GP1 clone produce the highest root length, percent of weight vertical root, and K leaf uptake. While F180 clone produces the highest water volume uptake of roots, weight of fresh roots, weight of plant, leaf uptake of  N, Ca and Mg, and the lowest Al toxicity morphology than other clones. For the optimal balance proportion of plant and root growth, we can be said that F180 and GP3 clones have high levels to Al toxicity tolerance for that can growth well for acidic soils that have low pH.",published,6 Th International Workshop On Crop Production And Productivity Under Global Climate Change,['S1'],,,,,,,,,,,,,,
4,,"PENGARUH APLIKASI IRIGASI AWAL TERHADAP HASIL PRODUKSI
DUA VARIETAS KEDELAI (Glycine max)PADA TANAH ULTISOL
DI KEBUN PERCOBAAN BPTP LAMPUNG SELATAN",TRUE,,"[{'name': {'given': 'Pri Angga Tri', 'family': 'Atmaja', 'lineage': None, 'honourific': None}, 'id': 'priangga307@gmail.com'}, {'name': {'family': 'Afandi', 'lineage': None, 'honourific': None, 'given': '.'}, 'id': 'afandi.1964@fp.unila.ac.id'}, {'name': {'family': 'Afrianti', 'lineage': None, 'honourific': None, 'given': 'Nur Afni'}, 'id': 'nur_afnii@yahoo.com'}, {'id': 'dewerahman@yahoo.com', 'name': {'given': 'Didin', 'honourific': None, 'lineage': None, 'family': 'Wiharso'}}]",,article,2019-05-09 05:12:02,http://jurnal.fp.unila.ac.id/index.php/JA/article/view/2926/2371,"[{'security': 'public', 'uri': 'http://repository.lppm.unila.ac.id/id/document/25162', 'pos': 1, 'eprintid': 12178, 'placement': 1, 'mime_type': 'application/pdf', 'language': 'en', 'rev_number': 1, 'format': 'text', 'main': 'JAT Vol 6 No 3 hal 175-180 tahun 2018.pdf', 'docid': 25162, 'files': [{'filesize': 66552, 'objectid': 25162, 'filename': 'JAT Vol 6 No 3 hal 175-180 tahun 2018.pdf', 'uri': 'http://repository.lppm.unila.ac.id/id/file/108925', 'hash_type': 'MD5', 'mtime': '2019-05-09 04:10:47', 'datasetid': 'document', 'fileid': 108925, 'hash': '59051d2692a2916d3aadd4e0175ee1b3', 'mime_type': 'application/pdf'}]}]",1098,show,175-180,2019-05-09 05:12:02,12178,archive,6,pub,public,2019-05-09 05:12:02,,['FP23'],disk0/00/01/21/78,http://repository.lppm.unila.ac.id/id/eprint/12178,2018-09-01,"Tanaman kedelai memegang peranan penting dalam sektor pertanian, terutama di sektor pangan dan industri.Ketahanan
varietas yang dibudidayakan terhadap kekeringan dan terhadap organisme pengganggu tanaman juga sangat berpengaruh terhadap produksi tanaman kedelai. Penelitian ini bertujuan untuk : (1) untuk mengetahui pengaruh aplikasi irigasi dengan volume yang berbeda dalam mengoptimalkan pertumbuhan dan produksi tanaman kedelai, (2) untuk mengetahui varietas yang lebih unggul saat dilakukan penanaman pada musim kemarau dengan perlakuan irigasi yang berbeda, dan (3) untuk mengetahui interaksi yang terjadi antara irigasi dengan penggunaan varietas kedelai yang berbeda terhadap produktivitas tanaman. Penelitian ini dilaksanakan di Kebun Percobaan BPTP,Kec. Tegineneng,Kab. Lampung Selatan, Provinsi Lampung
dari 19 September 2014 hingga 21 Januari 2015 dengan menggunakan Rancangan Acak Kelompok (RAK)dengan 2 faktor
perlakuan, faktor pertama yaitu 2 perbedaanlama waktu irigasi; 3 hari sekali (I1) dan 6 hari sekali (I2) dengan jumlah pemberian air 40 liter per plot dan faktor kedua yaitu 2 varietas kedelai; Tanggamus (V1) dan Anjasmoro (V2). Setiap perlakuan diulang sebanyak 3 kali, sehingga terdapat total 12 plot percobaan dengan luasan wilayah per plot 2 x 2 m. Sistem irigasi 3 hari sekali dapat meningkatkan tinggi tanaman, total jumlah polong, dan bobot 100 butir kedelai, sedangkan sistem irigasi 6 hari sekali
dapat meningkatkan jumlah cabang reproduktif dan mempercepat umur panen kedelai. Penggunaan varietas Tanggamus dapat meningkatkan tinggi tanaman, jumlah cabang reproduktif, total jumlah polong, bobot 100 butir dan mempercepat umur panen kedelai jika dibandingkan dengan penggunaan varietas Anjasmoro.Sistem irigasi3 hari sekali dengan varietas Tanggamus dapat meningkatkan tinggi tanaman, total jumlah polong, dan bobot 100 butir kedelai, sedangkan sistem irigasi 6 hari sekali dengan varietas Tanggamus dapat meningkatkan jumlah cabang reproduktif dan mempercepat umur panen kedelai.",published,,['S1'],,,2337-4993,Jurnal Agrotek Tropika,Jurnal Agrotek Tropika,6.0,,3.0,,,,,,
5,,PENGARUH SISTEM OLAH TANAH  DAN PEMBERIAN HERBISIDA TERHADAP ALIRAN PERMUKAAN  DAN EROSI PADA  PERTANAMAN JAGUNG (Zea mays L.) MUSIM TANAM KE-3,TRUE,,"[{'name': {'lineage': None, 'family': 'Banuwa', 'honourific': None, 'given': 'Irwan Sukri'}, 'id': 'irwanbanuwa@yahoo.com'}, {'id': 'afandi.1964@fp.unila.ac.id', 'name': {'given': '.', 'honourific': None, 'lineage': None, 'family': 'Afandi'}}, {'name': {'lineage': None, 'family': 'Utomo', 'honourific': None, 'given': 'Muhajir'}, 'id': 'muhajir.utomo@fp.unila.ac.id'}]",,article,2019-05-14 02:23:56,,"[{'placement': 1, 'eprintid': 12465, 'uri': 'http://repository.lppm.unila.ac.id/id/document/25439', 'pos': 1, 'security': 'public', 'docid': 25439, 'main': 'JAT ISB, AF, MU.pdf', 'files': [{'mtime': '2019-05-10 03:51:10', 'hash_type': 'MD5', 'filename': 'JAT ISB, AF, MU.pdf', 'uri': 'http://repository.lppm.unila.ac.id/id/file/110783', 'objectid': 25439, 'filesize': 516339, 'mime_type': 'application/pdf', 'hash': '4d3b957a2b17e1c21f53a9ca169ed81e', 'datasetid': 'document', 'fileid': 110783}], 'format': 'text', 'language': 'en', 'rev_number': 1, 'mime_type': 'application/pdf'}]",718,show,195-202,2019-05-14 02:23:56,12465,archive,6,pub,public,2019-05-14 02:23:56,,['FP23'],disk0/00/01/24/65,http://repository.lppm.unila.ac.id/id/eprint/12465,2018-09-05,"Penelitian bertujuan untuk mengetahui pengaruh (1) sistem olah tanah terhadap aliran permukaan dan erosi yang terjadi di lahan pertanaman jagung; (2) pemberian herbisida terhadap aliran permukaan dan erosi yang terjadi di lahan pertanaman jagung; (3) interaksi antara sistem olah tanah dan pemberian herbisida terhadap aliran permukaan dan erosi yang terjadi di lahan pertanaman jagung.  Penelitian dilaksanakan pada bulan  Oktober 2016 sampai bulan Februari 2017 di Laboratorium Lapang Terpadu dan Laboratorium Ilmu Tanah, Fakultas Pertanian, Universitas Lampung.  Rancangan yang digunakan yaitu rancangan faktorial  dalam Rancangan Acak Kelompok Lengkap (RAKL) dengan dua faktor perlakuan.  Faktor yang pertama adalah sistem olah tanah dan faktor kedua adalah pemberian herbisida, perlakuan diulang sebanyak empat kali.  Hasil penelitian menunjukkan bahwa (1) aliran permukaan, erosi, tinggi tanaman, bobot basah gulma, bobot basah brangkasan tanaman dan produksi tanaman jagung pada olah tanah minimum tidak berbeda dibandingkan dengan olah tanah penuh; (2) aliran permukaan dan erosi pada perlakuan pemberian herbisida tidak berbeda dibandingkan dengan tanpa pemberian herbisida, tetapi pemberian herbisida  nyata  lebih  baik  pada  komponen  tinggi  tanaman,  bobot  basah  gulma,  bobot  basah  brangkasan  dan  produksi tanaman jagung; (3) Tidak ada interaksi yang terjadi antara perlakuan sistem olah tanah dan herbisida terhadap aliran permukan dan erosi, tinggi tanaman, bobot basah gulma, bobot basah brangkasan tanaman dan produksi tanaman jagung.",published,,['S1'],,,2337-4993,Jurnal Agrotek Tropika,Jurnal Agrotek Tropika,6.0,,3.0,,,,,,
6,,"Metode pemupukan N,P dan K pada padi Sawah",,,"[{'id': 'irwanbanuwa@yahoo.com', 'name': {'family': 'Banuwa', 'lineage': None, 'honourific': None, 'given': 'Irwan Sukri'}}, {'id': None, 'name': {'given': 'Abdullah Aman', 'lineage': None, 'family': 'Damai', 'honourific': None}}, {'name': {'honourific': None, 'family': 'Hidayat', 'lineage': None, 'given': 'Kuswanta Futas'}, 'id': 'kfhidayat@gmail.com'}, {'name': {'given': 'Purba', 'family': 'Sanjaya', 'lineage': None, 'honourific': None}, 'id': None}, {'id': None, 'name': {'given': 'Adhi', 'honourific': None, 'lineage': None, 'family': 'Nugroho'}}]",,patent,2019-05-14 03:16:08,,"[{'files': [{'mime_type': 'application/pdf', 'hash': 'a384982046c0b642bc0036e772857ee8', 'fileid': 112231, 'datasetid': 'document', 'mtime': '2019-05-10 11:57:43', 'hash_type': 'MD5', 'filename': '1.irwan sukri.pdf', 'uri': 'http://repository.lppm.unila.ac.id/id/file/112231', 'objectid': 25663, 'filesize': 7424036}], 'main': '1.irwan sukri.pdf', 'docid': 25663, 'format': 'text', 'language': 'en', 'rev_number': 1, 'mime_type': 'application/pdf', 'placement': 1, 'eprintid': 12682, 'uri': 'http://repository.lppm.unila.ac.id/id/document/25663', 'pos': 1, 'security': 'public'}]",910,show,,2019-05-14 03:16:08,12682,archive,8,pub,public,2019-05-14 03:16:08,,['FP23'],disk0/00/01/26/82,http://repository.lppm.unila.ac.id/id/eprint/12682,2018-09-10,,published,,['S1'],,,,,,,,,IDS000002173B,"LPPM Unila, Fakultas Pertanian Unila",,,,
7,Bandar Lampung,"Effects of Waterlogging on Pineapple Growth and Soil Properties on Red Acid Soils of Lampung, Indonesia",TRUE,03-04 Dec 2018,"[{'name': {'honourific': None, 'family': 'Cahyono', 'lineage': None, 'given': 'Priyo'}, 'id': None}, {'name': {'given': '-', 'honourific': None, 'lineage': None, 'family': 'Purwito'}, 'id': None}, {'id': 'afandi.1964@fp.unila.ac.id', 'name': {'given': '.', 'family': 'Afandi', 'lineage': None, 'honourific': None}}]",paper,conference_item,2019-05-09 03:05:07,,"[{'eprintid': 11512, 'placement': 1, 'security': 'public', 'pos': 1, 'uri': 'http://repository.lppm.unila.ac.id/id/document/24509', 'format': 'text', 'files': [{'uri': 'http://repository.lppm.unila.ac.id/id/file/104552', 'filename': 'Afandi Prociding International.pdf', 'filesize': 3112765, 'objectid': 24509, 'mtime': '2019-05-02 07:27:04', 'hash_type': 'MD5', 'hash': 'a3ccfac39a8bcdc2b6cfb6f966c0f9be', 'mime_type': 'application/pdf', 'datasetid': 'document', 'fileid': 104552}], 'main': 'Afandi Prociding International.pdf', 'docid': 24509, 'rev_number': 1, 'language': 'en', 'mime_type': 'application/pdf'}]",718,show,33-36,2019-05-09 03:05:07,11512,archive,8,pub,public,2019-05-09 03:05:07,conference,['FP23'],disk0/00/01/15/12,http://repository.lppm.unila.ac.id/id/eprint/11512,2018-12-03,"Red acid soils in humid tropic generally have high rainfall in this area. Including acid soils in Indonesia, the average annual rainfall more than 2000 mm which occurred in the rainy season for six months. Mismanagement of excess water will adversely affect the
growth of plant. Waterlogging occurs when the amount of rainfall exceeded the infiltration of water in the soil.  This is the main problem especially for pineapple plant because this plant cannot survive long in conditions of waterlogging for a long period. This research want to know the effect of waterlogging on soil chemical properties and the second, to know the pineapple resistance to waterlogging, and its effect on the growth of pineapple root. This experiment was conducted at the location of Research and Development (R&D) PT Great Giant Pineapple (PT GGP),  Lampung, Indonesia along 2 months, from August to October 2016. The experiment design was arranged in completely randomized design with  three replication.  Waterlogging treatment is treatment by adding water into the polybag until saturated and let the water flooded  up to 2 cms from soil surface. There are 6
treatments: W0: no waterlogging (maintain soil humidity in field capacity) (control), W24: waterlogging 1x24 hours, W48: waterlogging 2x24 hours, W72: waterlogging 3x24 hours, W96: waterlogging 4x24 hours, W120: waterlogging 5x24 hours.  The research showed that waterlogging 1x24 hours can increased soil pH and decreased exchangable aluminium in the soil significantly
different, the second, waterlogging can increased iron in the soil and significantly different on 5x24 hours and the third, waterlogging star 2x24 hours can inhibit root growth of pineapple",published,6TH INTERNATIONAL WORKSHOP ON CROP PRODUCTION AND PRODUCTIVITY UNDER GLOBAL CLIMATE CHANGE,['S1'],,,,,,,,,,,,,,
