,title,refereed,type,creators,metadata_visibility,pagerange,datestamp,eprint_status,eprintid,lastmod,documents,userid,number,publication,publisher,dir,divisions,rev_number,ispublished,issn,full_text_status,status_changed,date_type,subjects,uri,date,abstract,volume,corp_creators,official_url,institution,department,thesis_type,thesis_name
0,"EFEKTIVITAS KEPEMIMPINAN KETUA KELOMPOK TANI DALAM
DIFUSI INOVASI PENGELOLAAN TANAMAN TERPADU PADI
DI KABUPATEN LAMPUNG SELATAN",TRUE,article,"[{'id': None, 'name': {'given': 'Furry Tiara', 'family': 'Anggunanda', 'lineage': None, 'honourific': None}}, {'id': 'tb_sijati@yahoo.com', 'name': {'given': 'Tubagus', 'honourific': None, 'lineage': None, 'family': 'Hasanuddin'}}, {'name': {'lineage': None, 'family': 'Nurmayasari', 'honourific': None, 'given': 'Indah'}, 'id': 'indah.nurmayasari.unila.ac.id'}]",show,423-429,2023-02-27 01:01:36,archive,48559,2023-02-27 01:01:36,"[{'files': [{'uri': 'http://repository.lppm.unila.ac.id/id/file/529580', 'filename': 'Efektivitas Kepemimpinan Ketua Kelompok Tani Dalam Difusi Inovasi Pengelolaan Tanaman Terpadu Padi di Kabupaten Lampung Selatan.pdf', 'objectid': 187872, 'filesize': 124378, 'mtime': '2023-02-25 07:44:09', 'hash_type': 'MD5', 'hash': '05e5b0d1c67d4cf517490912b31001da', 'mime_type': 'application/pdf', 'fileid': 529580, 'datasetid': 'document'}], 'main': 'Efektivitas Kepemimpinan Ketua Kelompok Tani Dalam Difusi Inovasi Pengelolaan Tanaman Terpadu Padi di Kabupaten Lampung Selatan.pdf', 'docid': 187872, 'format': 'text', 'rev_number': 1, 'language': 'en', 'mime_type': 'application/pdf', 'placement': 1, 'eprintid': 48559, 'pos': 1, 'uri': 'http://repository.lppm.unila.ac.id/id/document/187872', 'security': 'public'}]",930,4.0,JIIA (Jurnal Ilmu-Ilmu Agribisnis),Universitas Lampung,disk0_bak/00/04/85/59,['FP26'],6,pub,2337-7070,public,2023-02-27 01:01:36,published,['S1'],http://repository.lppm.unila.ac.id/id/eprint/48559,2016-10-01 00:00:00.000000000,"This study aims to determine: the leadership effectiveness of farmer groups leader, factors related to the 
leadership effectiveness of farmer groups leader, diffusion of innovation rate of integrated paddy crop 
cultivation, and related between the leadership effectiveness and the speed of diffusion of innovation 
integrated paddy crop cultivation. This research was conducted in the Palas Jaya Village and Pulau Tengah 
Village Palas District of South Lampung regency. The research samples were drawn by purposive sampling 
in whiich the total sample were 64 farmers, 16 leadership of farmer groups and 48 members of farmer 
groups. The study was conducted from January to February 2016 by survey method. The relationship 
between variables was tested by Spearman Rank correlation test. The results showed that the leadership 
effectiveness of farmer groups leader at Palas Jaya Village and Pulau Tengah Village was effective, factors 
related to the leadership effectiveness of farmer groups leader were motivation of farmer groups leader, 
enthusiastic of farmer groups leader, and the responsibilities of farmer groups leader, the rate of diffusion of 
integrated paddy crop cultivation in the Palas Jaya Village and Pulau Tengah Village included in the 
category of fast enough, there wasn’t relation between the leadership effectiveness of farmer groups leader 
and the speed of diffusion of integrated paddy crop cultivation in the Palas Jaya Village and Pulau Tengah 
Village.
Key words: diffusion of innovation, integrated paddy crop cultivation, leadership.",4.0,"['universitas lampung', 'universitas lampung', 'universitas lampung']",,,,,
1,Effektivitas Kepemimpinan Ketua Kelompok Tani dalam Difusi Inovasi Pengelolaan Tanaman Terpadu Padi di Kabupaten Lampung Selatan,TRUE,article,"[{'name': {'family': 'Anggunanda', 'lineage': None, 'honourific': None, 'given': 'Furry Tiara'}, 'id': None}, {'name': {'lineage': None, 'family': 'Hasanuddin', 'honourific': None, 'given': 'Tubagus'}, 'id': 'tb_sijati@yahoo.com'}, {'name': {'lineage': None, 'family': 'Nurmayasari', 'honourific': None, 'given': 'Indah'}, 'id': None}]",show,423-429,2021-03-15 01:42:01,archive,28353,2021-03-15 01:42:01,"[{'eprintid': 28353, 'placement': 1, 'security': 'public', 'uri': 'http://repository.lppm.unila.ac.id/id/document/42392', 'pos': 1, 'format': 'text', 'main': '(4) HASIL PENILAIAN KARYA ILMIAH EFEKTIVITAS KETUA KEL TANI DALAM DIFUSI INOVASI.pdf', 'files': [{'fileid': 252040, 'datasetid': 'document', 'hash': '9ddaac252b3ba94260b5ea90cc2739a4', 'mime_type': 'application/pdf', 'hash_type': 'MD5', 'mtime': '2021-03-14 07:08:15', 'objectid': 42392, 'filesize': 2207486, 'uri': 'http://repository.lppm.unila.ac.id/id/file/252040', 'filename': '(4) HASIL PENILAIAN KARYA ILMIAH EFEKTIVITAS KETUA KEL TANI DALAM DIFUSI INOVASI.pdf'}], 'docid': 42392, 'mime_type': 'application/pdf', 'language': 'en', 'rev_number': 1}]",930,4.0,Jurnal Ilmu-Ilmu Agribisnis,Juruan Agribisnis Fakultas Pertanian Universitas Lampung,disk0/00/02/83/53,['FP26'],6,pub,2337 7070,public,2021-03-15 01:42:01,published,['S1'],http://repository.lppm.unila.ac.id/id/eprint/28353,2016-11-01 00:00:00.000000000,"This study aims to determine: the leadership effectiveness of farmer groups leader, factors related to the leadership effectiveness of farmer groups leader, diffusion of innovation rate of integrated paddy crop cultivation, and related between the leadership effectiveness and the speed of diffusion of innovation integrated paddy crop cultivation. This research was conducted in the Palas Jaya Village and Pulau Tengah Village Palas District of South Lampung regency. The research samples were drawn by purposive sampling in whiich the total sample were 64 farmers, 16 leadership of farmer groups and 48 members of farmer groups. The study was conducted from January to February 2016 by survey method.  The relationship between variables was tested by Spearman Rank correlation test.  The results showed that the leadership effectiveness of farmer groups leader at Palas Jaya Village and Pulau Tengah Village was effective,  factors related to the leadership effectiveness of farmer groups leader were motivation of farmer groups leader, enthusiastic of farmer groups leader, and the responsibilities of farmer groups leader, the rate of diffusion of integrated paddy crop cultivation in the Palas Jaya Village and Pulau Tengah Village included in the category of fast enough,  there wasn’t relation between the leadership effectiveness of farmer groups leader and the speed of diffusion of integrated paddy crop cultivation in the Palas Jaya Village and Pulau Tengah Village.
Key words: diffusion of innovation, integrated paddy crop cultivation, leadership",4.0,"['Universitas Lampung', 'Universitas Lampung', 'Universitas Lampung']",,,,,
2,The Development of Corn Farmers’ Entrepreneurial Competencies in Indonesia,TRUE,article,"[{'id': 'yuniarafiati@yahoo.com', 'name': {'family': 'Syarief', 'lineage': None, 'honourific': None, 'given': 'Yuniar Aviati'}}]",show,78-83,2017-10-30 05:14:55,archive,4007,2017-10-30 05:14:55,"[{'eprintid': 4007, 'placement': 1, 'security': 'public', 'pos': 1, 'uri': 'http://repository.lppm.unila.ac.id/id/document/3866', 'format': 'text', 'main': 'isi jurnalceser.pdf', 'files': [{'hash_type': 'MD5', 'mtime': '2017-10-02 09:07:48', 'objectid': 3866, 'filesize': 108558, 'filename': 'isi jurnalceser.pdf', 'uri': 'http://repository.lppm.unila.ac.id/id/file/28052', 'datasetid': 'document', 'fileid': 28052, 'hash': '5f0f829a388aaeb7255610f51f92405c', 'mime_type': 'application/pdf'}], 'docid': 3866, 'language': 'en', 'rev_number': 1, 'mime_type': 'application/pdf'}]",442,4.0,International Journal of Ecology and Development,Ceser publication,disk0/00/00/40/07,['FP26'],6,pub,0972-9984 (Print); 0973-7308 (Online),public,2017-10-30 05:14:55,published,['S1'],http://repository.lppm.unila.ac.id/id/eprint/4007,1970-01-01 00:00:00.000002016,"Entrepreneurial competence is an important and relevant aspect of business development, facing a high level of competition because of an undertaking or business depending on the ability of entrepreneurs or business owners. This research improved the basics of working competencies by considering the factors affecting working competencies. On the other hand, the field of agricultural economics reviewing the farming from entrepreneurship perspective has not been popular yet. The results of study found that the entrepreneurial competencies are influenced by factors: farmers’ formal education, farmers’ participation in community institution, access to information, farming environment and learning process in education. The development of farmers’ competence could be done through agricultural extension models based on entrepreneurial competence.",31.0,"['Ravik Karsidi', 'Drajat Tri Kartono', 'Sapja Anantanyu']",http://www.ceser.in/ceserp/index.php/ijed/article/view/4652,,,,
3,KAJIAN FAKTOR-FAKTOR YANG BERPENGARUH TERHADAP KOMPETENSI KEWIRAUSAHAAN  PETANI JAGUNG DI PROVINSI LAMPUNG,,thesis,"[{'name': {'family': 'Syarief', 'lineage': None, 'honourific': None, 'given': 'Yuniar Aviati'}, 'id': 'yuniarafiati@yahoo.com'}]",show,,2017-11-16 08:08:27,archive,4836,2017-11-16 08:08:27,"[{'format': 'text', 'main': 'repository.pdf', 'docid': 17757, 'files': [{'fileid': 47031, 'datasetid': 'document', 'hash': '9cc031a0997a5ceb2aaff0918f35a11e', 'mime_type': 'application/pdf', 'hash_type': 'MD5', 'mtime': '2017-11-07 23:52:05', 'objectid': 17757, 'filesize': 478489, 'filename': 'repository.pdf', 'uri': 'http://repository.lppm.unila.ac.id/id/file/47031'}], 'mime_type': 'application/pdf', 'language': 'en', 'rev_number': 1, 'eprintid': 4836, 'placement': 1, 'security': 'public', 'pos': 1, 'uri': 'http://repository.lppm.unila.ac.id/id/document/17757'}]",442,,,,disk0/00/00/48/36,['FP26'],7,unpub,,public,2017-11-16 08:08:27,submitted,['S1'],http://repository.lppm.unila.ac.id/id/eprint/4836,2016-09-20 00:00:00.000000000,"Yuniar Aviati Syarief, 2016.  Kajian Faktor-Faktor Yang Berpengaruh Terhadap Kompetensi Kewirausahaan  Petani Jagung Di Provinsi Lampung.  Disertasi.Pembimbing I:  Prof. Dr. Ravik Karsidi, M.S.; Pembimbing II: Dr. Drajat Tri Kartono, M.S.; Pembimbing III:  Dr. Sapja Anantanyu, SP., M.Si.,Program Studi Penyuluhan Pembangunan/Pember-dayaan Masyarakat Pasca Sarjana Universitas Sebelas Maret Surakarta.
Budidaya jagung memerlukan sumberdaya manusia (SDM) petani yang memiliki kompetensi kewirausahaan yaitu petani selain menguasai pengetahuan dan wawasan tentang teknik budidaya dan manajerial juga memiliki kompetensi sebagai seorang petani handal.  Petani yang memiliki kompetensi positif menjadikannya sebagai seorang petani yang kreatifdan inovatif sebagai seorang wirausahawan di bidang pertanian. Penelitian ini bertujuan: (1) Mengkaji kondisi kompetensi kewirausahaan petani jagung di Provinsi Lampung; (2) Mengkaji faktor-faktor yang berpengaruh terhadap proses pembelajaran dalam penyuluhan di Provinsi Lampung; (3) Mengkaji faktor-faktor yang berpengaruh terhadap proses pembelajaran dalam penyuluhan kepada kompetensi kewirausahaan petani jagung di Provinsi Lampung; (4) Menemukan model penyuluhan yang dapat meningkatkan kompetensi kewirausahaan petani jagung berdasarkan faktor-faktor yang diteliti di Provinsi Lampung. Penelitian ini dilakukan pada bulan Juni 2014 sampai dengan bulan Agustus 2014 di wilayah Provinsi Lampung. Untuk menjawab tujuan pertama digunakan analisis desktiptif, sedangkan untuk menjawab tujuan kedua, ketiga dan keempat digunakan model analisis jalur (path analysis).
Hasil penelitian menunjukkan bahwa: (1) Kondisi kompetensi kewirausahaan petani jagung di Provinsi Lampung terbagi menjadi empat tipe kompetensi kewirausahaan yaitu tipe teknikal, tipe manajerial, tipe inovatif dan tipe universal (2) Faktor pendidikan formal, pengalaman usahatani, motivasi kerja, partisipasi petani dalam kelembagaan di masyarakat, akses informasi, lingkungan usahatani dan kebijakan pemerintah berpengaruh terhadap proses pembelajaran dalam penyuluhan.  (3) Faktor pendidikan formal petani, motivasi kerja, partisipasi petani dalam kelembagaan di masyarakat, akses informasi, lingkungan usahatani berpengaruh secara langsung dan tidak langsung melalui proses pembelajaran dalam penyuluhan terhadap kompetensi kewirausahaan petani jagung di Provinsi Lampung. (4) Model penyuluhan petani jagung berbasis peningkatan kompetensi kewirausahaan dilakukan dengan memperhatikan faktor-faktor yang berpengaruh dan tipe-tipe kompetensi kewirausahaan petani jagung.

Kata Kunci:  Penyuluhan Pertanian, Kompetensi Kewirausahaan, Petani",,,,"Universitas Sebelas Maret, Surakarta",Program Doktor Penyuluhan Pembangunan/Pemberdayaan Masyarakat,doctoral,other
