,publisher,dir,publication,divisions,related_url,status_changed,issn,full_text_status,ispublished,rev_number,subjects,volume,abstract,date,uri,type,creators,refereed,title,eprintid,eprint_status,datestamp,pagerange,metadata_visibility,number,userid,documents,lastmod,official_url,place_of_pub,id_number,date_type,corp_creators,succeeds
9,IQSRjournals.org,disk0/00/01/69/26,Journal of Research and Method in Education (IQSR-JRME),['FKIP11'],[{'url': 'http://www.iqsrjournals.org'}],2019-11-18 07:04:44,2320-1959 (e). 2320-1940 (p),public,pub,8,['L1'],9,"The objectives of this research were: 1) describe the condition and potential the of teaching by applying audio visual based contextual. 2) product audio visual based contextual as teaching material. 3) evaluate the effective and attractiveness of result learning after using the product been done. The research methodology used was research and development (R&D) Borg and Gall by definition, planning, and development. The data were collected by observation test, and document from the field . Based on observation in this research, the N-Gain has average score 0.71 and it was very high.",2019-05-01 00:00:00.000000000,http://repository.lppm.unila.ac.id/id/eprint/16926,article,"[{'id': None, 'name': {'honourific': None, 'family': 'Sidartha Adi Gautama', 'lineage': None, 'given': 'Sidartha'}}, {'name': {'given': 'Dwi', 'family': 'Dwi Yulianti', 'lineage': None, 'honourific': None}, 'id': 'safira_shodiq@yahoo.com'}, {'name': {'given': 'Taridi', 'honourific': None, 'family': 'Taridi', 'lineage': None}, 'id': None}]",TRUE,The Development of Audio Visual Based Contextual to Improve Learning Result of Buddhism Education,16926,archive,2019-11-18 07:04:44,16-22,show,3,559,"[{'rev_number': 1, 'language': 'en', 'mime_type': 'application/pdf', 'format': 'text', 'main': 'jurnal sidarta., Dwi Y., Taridi.pdf', 'files': [{'hash_type': 'MD5', 'mtime': '2019-11-18 05:46:37', 'objectid': 30010, 'filesize': 2314861, 'filename': 'jurnal sidarta., Dwi Y., Taridi.pdf', 'uri': 'http://repository.lppm.unila.ac.id/id/file/143660', 'datasetid': 'document', 'fileid': 143660, 'mime_type': 'application/pdf', 'hash': '1d45cc7828029d75db78d1f5f75f245a'}], 'docid': 30010, 'security': 'public', 'pos': 1, 'uri': 'http://repository.lppm.unila.ac.id/id/document/30010', 'eprintid': 16926, 'placement': 1}]",2019-11-18 07:04:44,http://www.iqsrjournals.org,,DOI: 10.9790/1959-0903041622,published,,
10,Eurasian Society of Educational Research,disk0/00/01/47/36,European Journal of Educational Research,['FKIP11'],[{'url': 'https://www.eu-jer.com/evaluation-of-national-examination-un-and-national-based-school-examination-usbn-in-indonesia'}],2019-11-04 03:33:42,2165-8714,public,pub,7,['L1'],8,"Abstract: This study was conducted to analyze (a) the suitability of National Examination (UN) and national-based school examination (USBN) implementation, which has been running   on the current guidelines and efforts to improve students’ achievements, (b) the final examination system that is  relevant in measuring student competency achievement based  on graduatecompetence standard. It employed descriptive quantitative evaluation by using CIPP (context, input, process of implementation and product) evaluation model. Participants included the head of the Education and Culture Department, Ministry of Religion, Principals / Madrasas, teachers, and students. To collect the data, questionnaires, interviews, focus group discussions, and documentaries were undertaken. Additionally, the data analysis technique used  quantitative and qualitative descriptive statistics. The  findings indicate that (1) implementation of the UN and USBN, which has been ongoing, is in accordance with the standard operating procedure (SOP) that has been established by the board of national education standard (BNSP), (2) implementation of UN and USBN can be used  to improve performance (3) the final examination system thatis able  to  measure achievement of graduates' competency on certain subjects nationally by referring to the Graduate Competency  Standard is computer-based national examination (UNBK). The concluding remarks are an attempt to contribute to the growth of future research in the field of UN and USBN implementation in Indonesia.",1970-01-01 00:00:00.000002019,http://repository.lppm.unila.ac.id/id/eprint/14736,article,"[{'id': 'undangros@yahoo.com', 'name': {'lineage': None, 'family': 'Undang Rosidin', 'honourific': None, 'given': 'UR'}}, {'id': 'herpratiwi.1964@fkip.unila.ac.id', 'name': {'given': 'Herpratiwi', 'lineage': None, 'family': 'Herpratiwi', 'honourific': None}}, {'id': 'wsuane@gmail.com', 'name': {'honourific': None, 'lineage': None, 'family': 'Suana', 'given': 'Wayan'}}, {'id': None, 'name': {'family': 'Firdaos', 'lineage': None, 'honourific': None, 'given': 'Rijal'}}]",TRUE,Evaluation of National Examination (UN) and National-Based School Examination (USBN) in Indonesia,14736,archive,2019-11-04 03:33:42,827-837,show,3,863,"[{'format': 'text', 'docid': 27847, 'main': 'EU-JER_8_3_827.pdf', 'files': [{'hash': 'd5aeeececd6974c36ac538dea71304d1', 'mime_type': 'application/pdf', 'fileid': 127528, 'datasetid': 'document', 'mtime': '2019-10-29 16:00:58', 'hash_type': 'MD5', 'filename': 'EU-JER_8_3_827.pdf', 'uri': 'http://repository.lppm.unila.ac.id/id/file/127528', 'filesize': 1023107, 'objectid': 27847}], 'rev_number': 2, 'language': 'en', 'mime_type': 'application/pdf', 'eprintid': 14736, 'placement': 1, 'security': 'public', 'uri': 'http://repository.lppm.unila.ac.id/id/document/27847', 'pos': 1}]",2019-11-04 03:33:42,https://www.eu-jer.com/evaluation-of-national-examination-un-and-national-based-school-examination-usbn-in-indonesia,,https://doi.org/10.12973/eu-jer.8.3.827,completed,,
11,European Journal of Educational Research,disk0/00/02/27/65,,['FKIP11'],,2020-06-26 13:36:38,,public,pub,9,"['L1', 'LB1501', 'LC5201']",,"This study was conducted to analyze (a) the suitability of National Examination (UN) and national-based school examination (USBN) implementation, which has been running on the current guidelines and efforts to improve students’ achievements, (b) the final examination system that is relevant in measuring student competency achievement based on graduate competence standard. It employed descriptive quantitative evaluation by using CIPP (context, input, process of implementation and
product) evaluation model. Participants included the head of the Education and Culture Department, Ministry of Religion, Principals/ Madrasas, teachers, and students. To collect the data, questionnaires, interviews, focus group discussions, and documentaries were undertaken. Additionally, the data analysis technique used quantitative and qualitative descriptive statistics. The findings indicate that (1) implementation of the UN and USBN, which has been ongoing, is in accordance with the standard operating procedure (SOP)
that has been established by the board of national education standard (BNSP), (2) implementation of UN and USBN can be used to improve performance (3) the final examination system that is able to measure achievement of graduates' competency on certain
subjects nationally by referring to the Graduate Competency Standard is computer-based national examination (UNBK). The
concluding remarks are an attempt to contribute to the growth of future research in the field of UN and USBN implementation in Indonesia.",2019-07-05 00:00:00.000000000,http://repository.lppm.unila.ac.id/id/eprint/22765,other,"[{'name': {'lineage': None, 'family': 'Undang Rosidin', 'honourific': None, 'given': 'UR'}, 'id': 'undangros@yahoo.com'}, {'name': {'given': 'Herpratiwi', 'family': 'Herpratiwi', 'lineage': None, 'honourific': None}, 'id': 'herpratiwi.1964@fkip.unila.ac.id'}, {'id': None, 'name': {'honourific': None, 'family': 'wayan', 'lineage': None, 'given': 'suana'}}, {'id': None, 'name': {'given': 'Firdaos', 'honourific': None, 'family': 'Rijal', 'lineage': None}}]",,"Evaluation of National Examination (UN) and National-Based School
Examination (USBN) in Indonesia",22765,archive,2020-06-26 13:36:38,,show,,863,"[{'pos': 1, 'uri': 'http://repository.lppm.unila.ac.id/id/document/36269', 'security': 'public', 'placement': 1, 'eprintid': 22765, 'language': 'en', 'mime_type': 'application/pdf', 'rev_number': 1, 'files': [{'filename': '6. Evaluasi_of_National__UN__and_National_Baswed_Scho.pdf', 'uri': 'http://repository.lppm.unila.ac.id/id/file/208916', 'objectid': 36269, 'filesize': 3173408, 'mtime': '2020-06-26 02:55:34', 'hash_type': 'MD5', 'mime_type': 'application/pdf', 'hash': '907f6d5e1ae3b881771c6c1291527a3c', 'fileid': 208916, 'datasetid': 'document'}], 'main': '6. Evaluasi_of_National__UN__and_National_Baswed_Scho.pdf', 'docid': 36269, 'format': 'text'}]",2020-06-26 13:36:38,,,,published,"['Faculty of Teacher Training and Education, University of Lampung']",
12,IOSR Journal of Research & Method in Education (IOSR-JRME),disk0/00/02/27/66,,['FKIP11'],,2020-06-26 13:36:44,,public,pub,9,"['L1', 'LB1501', 'LC5201']",,"The aim of this research is to develop the library model at states senior high schools at Bandar Lampung. The number of school library visitors at SMAN 14 Bandar Lampung, with a total of 1052 students in 30 study groups 2018/2019 academic year. It can be seen that the number of library visitors is not more than 500 students per month, the number of books borrowing does not reach 500 copies per month.This study uses an interpretive / constructivist paradigm, through this paradigm the researcher analyzes the need for developing a hypothetical model of library management as a learning resource center.Based on the potential and condition of 17 libraries in Bandar Lampung High School there are still libraries that do not meet the SNP standards, namely 11 school libraries that have manual management without following the library management system.At
the stage of developing the hypothetical model, the researcher examines a problem that is developed to obtain responses that tend to be positive to teachers, library principals and school principals, marked by a positive category average of 80.15% while negative category responses are only 20.85%.",2019-12-26 00:00:00.000000000,http://repository.lppm.unila.ac.id/id/eprint/22766,other,"[{'name': {'given': 'Edi Purwanto', 'honourific': None, 'family': 'Yohanes', 'lineage': None}, 'id': None}, {'id': 'herpratiwi.1964@fkip.unila.ac.id', 'name': {'honourific': None, 'lineage': None, 'family': 'Herpratiwi', 'given': 'Herpratiwi'}}, {'name': {'honourific': None, 'family': 'Riswandi', 'lineage': None, 'given': 'riswandi'}, 'id': 'riswandi.unila@gmail.com'}]",,Development Of The Hypothetic Model Of Library Management As A Center For Learning Sources At The State Senior High School Of Bandar Lampung,22766,archive,2020-06-26 13:36:44,,show,,863,"[{'placement': 1, 'eprintid': 22766, 'pos': 1, 'uri': 'http://repository.lppm.unila.ac.id/id/document/36270', 'security': 'public', 'docid': 36270, 'main': '7. Development_Of_The_Hypothetic_Model_Of_Library_Man.pdf', 'files': [{'mtime': '2020-06-26 02:59:41', 'hash_type': 'MD5', 'filename': '7. Development_Of_The_Hypothetic_Model_Of_Library_Man.pdf', 'uri': 'http://repository.lppm.unila.ac.id/id/file/208925', 'objectid': 36270, 'filesize': 1515607, 'mime_type': 'application/pdf', 'hash': '57fdbf80cafcf205dfc895739f22b71f', 'datasetid': 'document', 'fileid': 208925}], 'format': 'text', 'mime_type': 'application/pdf', 'language': 'en', 'rev_number': 1}]",2020-06-26 13:36:44,,,,published,"['Faculty of Teacher Training and Education, University of Lampung']",
13,IOSR Journal of Research & Method in Education (IOSR-JRME),disk0/00/03/32/54,,['FKIP11'],,2021-07-25 13:19:36,,public,unpub,11,"['L1', 'LB1501', 'LC5201']",,,2019-12-01 00:00:00.000000000,http://repository.lppm.unila.ac.id/id/eprint/33254,other,"[{'id': None, 'name': {'family': 'yohanes edi purwanto', 'lineage': None, 'honourific': None, 'given': 'yohanes'}}, {'name': {'given': 'Herpratiwi', 'lineage': None, 'family': 'Herpratiwi', 'honourific': None}, 'id': 'herpratiwi.1964@fkip.unila.ac.id'}, {'id': 'riswandi.1976@fkip.unila.ac.id', 'name': {'honourific': None, 'lineage': None, 'family': 'Riswandi', 'given': 'Riswandi'}}]",,"Development Of The Hypothetic Model Of Library Management
As A Center For Learning Sources At The State Senior High
School Of Bandar Lampung",33254,archive,2021-07-25 13:19:36,,show,,407,"[{'docid': 151955, 'main': 'Reviewer No. 5.pdf', 'files': [{'hash': 'fc6841756424c45b32b961cce7d2a216', 'mime_type': 'application/pdf', 'datasetid': 'document', 'fileid': 394040, 'mtime': '2021-07-23 09:21:59', 'hash_type': 'MD5', 'uri': 'http://repository.lppm.unila.ac.id/id/file/394040', 'filename': 'Reviewer No. 5.pdf', 'filesize': 824414, 'objectid': 151955}], 'format': 'text', 'mime_type': 'application/pdf', 'language': 'en', 'rev_number': 2, 'placement': 1, 'eprintid': 33254, 'uri': 'http://repository.lppm.unila.ac.id/id/document/151955', 'pos': 1, 'formatdesc': 'Reviewer', 'security': 'public'}, {'placement': 2, 'eprintid': 33254, 'pos': 2, 'uri': 'http://repository.lppm.unila.ac.id/id/document/151956', 'formatdesc': 'Similaritas', 'security': 'public', 'main': 'Similaritas No. 5.pdf', 'files': [{'mtime': '2021-07-23 09:22:25', 'hash_type': 'MD5', 'filename': 'Similaritas No. 5.pdf', 'uri': 'http://repository.lppm.unila.ac.id/id/file/394042', 'objectid': 151956, 'filesize': 1419833, 'hash': '61fba701f0c42191bd197c8179367539', 'mime_type': 'application/pdf', 'datasetid': 'document', 'fileid': 394042}], 'docid': 151956, 'format': 'text', 'mime_type': 'application/pdf', 'language': 'en', 'rev_number': 2}]",2021-07-25 13:19:36,,,,,,
