,id_number,eprintid,eprint_status,datestamp,metadata_visibility,number,userid,documents,official_url,lastmod,creators,type,refereed,title,subjects,date_type,volume,abstract,uri,date,publisher,divisions,publication,dir,status_changed,full_text_status,issn,ispublished,rev_number,pagerange,related_url,contact_email
8,,44530,archive,2022-08-29 03:07:28,show,3,941,"[{'language': 'en', 'rev_number': 1, 'mime_type': 'application/pdf', 'format': 'text', 'docid': 166401, 'main': 'Muhammad Fuad - JSRR_Development of Student Worksheets Write Project Based Learning-based.pdf', 'files': [{'objectid': 166401, 'filesize': 1786237, 'filename': 'Muhammad Fuad - JSRR_Development of Student Worksheets Write Project Based Learning-based.pdf', 'uri': 'http://repository.lppm.unila.ac.id/id/file/481630', 'hash_type': 'MD5', 'mtime': '2022-08-29 02:43:19', 'datasetid': 'document', 'fileid': 481630, 'mime_type': 'application/pdf', 'hash': '128471052ce34e1e748c05936e3ad107'}], 'security': 'public', 'pos': 1, 'uri': 'http://repository.lppm.unila.ac.id/id/document/166401', 'eprintid': 44530, 'placement': 1}]",https://journaljsrr.com/index.php/JSRR/article/view/30509/57251,2022-08-29 03:07:28,"[{'id': None, 'name': {'given': 'Miftakhul', 'honourific': None, 'family': 'Hidayati', 'lineage': None}}, {'name': {'honourific': None, 'family': 'Rusminto', 'lineage': None, 'given': 'N E'}, 'id': 'nurlaksana.eko@fkip.unila.ac.id'}, {'id': 'abuazisah59@yahoo.co.id', 'name': {'given': 'Muhammad', 'honourific': None, 'family': 'Fuad', 'lineage': None}}]",article,TRUE,Development of Student Worksheets Write Project Based Learning-based Explanatory Text for Class XI Senior High School,['L1'],published,28,,http://repository.lppm.unila.ac.id/id/eprint/44530,2022-04-21 00:00:00.000000000,,['FKIP8'],Journal of Scientific Research & Reports,disk0/00/04/45/30,2022-08-29 03:07:28,public,2320-0227,pub,6,58-66,,abuazisah59@yahoo.co.id
9,,44529,archive,2022-08-29 03:04:48,show,1,941,"[{'uri': 'http://repository.lppm.unila.ac.id/id/document/166400', 'pos': 1, 'security': 'public', 'placement': 1, 'eprintid': 44529, 'language': 'en', 'rev_number': 1, 'mime_type': 'application/pdf', 'files': [{'hash_type': 'MD5', 'mtime': '2022-08-29 02:36:49', 'objectid': 166400, 'filesize': 1478690, 'filename': 'Muhammad Fuad - IOSR-JRME_Development Student Worksheet (Lkpd) Write Review.pdf', 'uri': 'http://repository.lppm.unila.ac.id/id/file/481624', 'fileid': 481624, 'datasetid': 'document', 'mime_type': 'application/pdf', 'hash': 'e965ccfba7691d8b2015ee19f18f30f2'}], 'main': 'Muhammad Fuad - IOSR-JRME_Development Student Worksheet (Lkpd) Write Review.pdf', 'docid': 166400, 'format': 'text'}]",https://www.iosrjournals.org/iosr-jrme/papers/Vol-12%20Issue-1/Ser-2/A1201020106.pdf,2022-08-29 03:04:48,"[{'id': None, 'name': {'honourific': None, 'family': 'Irmasari', 'lineage': None, 'given': 'Hesti'}}, {'id': 'abuazisah59@yahoo.co.id', 'name': {'given': 'muhammad', 'lineage': None, 'family': 'fuad', 'honourific': None}}, {'id': 'gragemarti@yahoo.co.id', 'name': {'given': 'Sumarti', 'lineage': None, 'family': 'Sumarti', 'honourific': None}}]",article,TRUE,Development Student Worksheet (Lkpd) Write Review For Senior High School Basic Stronger Character Education,['L1'],published,12,,http://repository.lppm.unila.ac.id/id/eprint/44529,2022-01-14 00:00:00.000000000,,['FKIP8'],IOSR Journal of Research & Method in Education (IOSR-JRME),disk0/00/04/45/29,2022-08-29 03:04:48,public,"e-ISSN: 2320–7388, p- ISSN: 2320-737x",pub,6,1-6,,abuazisah59@yahoo.co.id
10,https://doi.org/10.33258/birci.v5i3.6660,47622,archive,2023-01-06 01:51:55,show,3,709,"[{'mime_type': 'application/pdf', 'language': 'en', 'rev_number': 2, 'content': 'published', 'main': '(S-3) Code Switching and Mixing Codes on Yowis Ben Movie.pdf', 'files': [{'mtime': '2023-01-05 14:56:16', 'hash_type': 'MD5', 'uri': 'http://repository.lppm.unila.ac.id/id/file/521810', 'filename': '(S-3) Code Switching and Mixing Codes on Yowis Ben Movie.pdf', 'objectid': 186688, 'filesize': 857229, 'hash': '44bff2550d769643c137b967d9f08273', 'mime_type': 'application/pdf', 'datasetid': 'document', 'fileid': 521810}], 'docid': 186688, 'format': 'text', 'pos': 1, 'uri': 'http://repository.lppm.unila.ac.id/id/document/186688', 'security': 'public', 'formatdesc': 'Artikel', 'placement': 1, 'eprintid': 47622}, {'language': 'en', 'rev_number': 2, 'mime_type': 'application/pdf', 'format': 'text', 'main': ""Uji Turnitin_Code Switching and Mixing Codes on Yowis Ben Movie Dialogues Bayu Skak's Work_  A Sociolinguistic Study.pdf"", 'docid': 186689, 'files': [{'hash_type': 'MD5', 'mtime': '2023-01-05 14:56:41', 'filesize': 2988572, 'objectid': 186689, 'filename': ""Uji Turnitin_Code Switching and Mixing Codes on Yowis Ben Movie Dialogues Bayu Skak's Work_  A Sociolinguistic Study.pdf"", 'uri': 'http://repository.lppm.unila.ac.id/id/file/521812', 'fileid': 521812, 'datasetid': 'document', 'hash': '5f36b2c6d46f018a2b0aa0f9c780d80a', 'mime_type': 'application/pdf'}], 'formatdesc': 'Uji Turnitin', 'security': 'public', 'uri': 'http://repository.lppm.unila.ac.id/id/document/186689', 'pos': 2, 'eprintid': 47622, 'placement': 2}]",https://bircu-journal.com/index.php/birci/issue/view/52,2023-01-06 01:51:55,"[{'id': None, 'name': {'given': 'Kiki', 'honourific': None, 'family': 'Kiki Nurjana', 'lineage': None}}, {'id': 'siti_samhati@yahoo.com', 'name': {'given': 'Siti Samhati', 'honourific': None, 'lineage': None, 'family': 'Siti Samhati'}}, {'id': None, 'name': {'given': 'Nurlaksana eko', 'honourific': None, 'lineage': None, 'family': 'Nurlaksana eko'}}]",article,FALSE,Code Switching and Mixing Codes on Yowis Ben Movie Dialogues Bayu Skak's Work:  A Sociolinguistic Study,['L1'],published,5,"This study aims to describe the forms of code switching and code mixing in the YOWIS BEN film and several factors that influence the occurrence of code switching and code mixing. This research focuses on problems related to thephenomenon of code switching and code mixing along with the factors that influence the phenomenon. The research data was obtained by the technique of listening to record. The research data were analyzed using descriptive analysis techniques. The validity of data analysis is carried out by data reduction, data presentation, and data verification. The results showed that: 1. The form of code switching in the YOWIS BEN film includes code switching of relationships between languages, found Indonesian – bahasa Javanese, Javanese language – Indonesian. 2. The form of code mixing in the film YOWIS BEN seen in terms of syntax is found to
be a mixed form of code including the insertion of elements in the form of words, the insertion of elements in the form of phrases, the insertion of elements in the form of clauses. Factors of code switching and code mixing include (a) the relationship of the speaker with the speech partner, (b) the presence of a third party, (c) familiarity, (d) humorous elements.",http://repository.lppm.unila.ac.id/id/eprint/47622,2022-08-01 00:00:00.000000000,Budapest International Research and Critics University-Journal (BIRCU-Publisher),['FKIP8'],Budapest International Research and Critics Institute-Journal,disk0_bak/00/04/76/22,2023-01-06 01:51:55,public,2615-3076,pub,8,26149-26161,"[{'type': 'pub', 'url': 'https://bircu-journal.com/index.php/birci/issue/view/52'}]",
11,,47218,archive,2022-12-15 08:00:25,show,5,77,"[{'files': [{'mime_type': 'application/pdf', 'hash': '3349b2224aa9fbc1ddbb0fb29d387453', 'datasetid': 'document', 'fileid': 518430, 'mtime': '2022-12-14 09:28:12', 'hash_type': 'MD5', 'filename': '5502.pdf', 'uri': 'http://repository.lppm.unila.ac.id/id/file/518430', 'objectid': 186192, 'filesize': 534843}], 'main': '5502.pdf', 'docid': 186192, 'format': 'text', 'language': 'en', 'rev_number': 1, 'mime_type': 'application/pdf', 'placement': 1, 'eprintid': 47218, 'pos': 1, 'uri': 'http://repository.lppm.unila.ac.id/id/document/186192', 'security': 'public'}]",HTTPS://www.iosrjournals.org,2022-12-15 08:00:25,"[{'id': 'lilis.suryani@gmail.com', 'name': {'lineage': None, 'family': 'Lilis', 'honourific': None, 'given': 'Suryani'}}, {'name': {'honourific': None, 'lineage': None, 'family': 'Munaris', 'given': 'Munaris'}, 'id': 'munaris.1965@fkip.unila.ac.id'}, {'id': 'mulyanto.widodo@fkip.unila.ac.id', 'name': {'given': 'widodo', 'family': 'Mulyanto', 'lineage': None, 'honourific': None}}]",article,TRUE,The Development of Student Worksheets in Writing Short Stories Based on Project Based Learning (Pjbl)for Class XI Students,['L1'],published,11,"One of the language skills is writing skills. Writing skills including skills that important to learn  even compared with the three other skills (Iskandar Wassid, 2011: 291). This is because the level of proficiency  in writing requires proficiency in other skills. In fact, this activity must always be faced, especially by academics  such as writing short stories, writing essays, writing articles, and others. The problem that is often raised in  teaching coral-writing is the inability of students or students to use good and correct Indonesian grammar. This  can be seen from the choice of words that are not appropriate, sentences that are less effective, it is difficult to  express ideas because of the difficulty in choosing words or making sentences, even the lack of ability to develop  ideas regularly and systematically, and spelling errors are often encountered.  
Based on the results of a preliminary study conducted by the author through a questionnaire, it is known that  most students find it difficult to express and find ideas to be written. Students do not know how to start and  organize ideas that will be poured in their writings. Even 50% of students are not interested in writing short  stories, because writing is difficult. As many as 30% of students find it difficult to express ideas. As many as  20% of students write short stories because of assignments from the teacher. In addition, based on the results of  the interview, the students felt that learning to write short stories was still difficult. This is supported by the  results of daily tests related to short story writing material obtained by students, where there are still many  students who get scores below the minimum completion criteria.  
Materials and Methods: This research produced products in form of student worksheets in writing short stories  based on the Project Based Learning (PjBL) model and describe its feasibility. This study used Research and  Development (R & D). The research was through observation, interview, and questionnaire to three schools  SMAN 1 Bangun Rejo, MA Almakhtuziyah Kalidadi, and SMAN 1 Kalirejo of academic year 2019/2020.  
Results: The result showed that the developed student worksheetswas very feasible. It gained 92% from material  expert test, 85% from mediaexpert, 89% from practitioner expert. Value feasibility test by Indonesian teacher  class in SMAN 1 Bangun Rejo is 91%, MA Almakhtuziyah Kalidadi is 86%, and SMAN 1 Kalirejo is 88% in the  categorized as very feasible. The value trial on a small scalewas 83% categorized as very feasible meanwhile to  the largescale was 84% categorized as very feasible.  
Conclusion:The feasibility of teaching materials in the form of student worksheetsWriting short stories based on  the Project Based Learning model that has been developed meets the ""very feasible"" criteria. The assessment  was based on the assessment of one material expert, one media expert, one practitioner, three Indonesian  language teachers, and class XI high school students from each school who were the object of the experiment.  The following is the percentage of product eligibility.",http://repository.lppm.unila.ac.id/id/eprint/47218,1970-01-01 00:00:00.000002022,International Organization of Scientific Research (IOSR),['FKIP8'],IOSR Journal of Research & Method in Education (IOSR-JRME),disk0/00/04/72/18,2022-12-15 08:00:25,public,2320–7388,pub,6,14-26,[{'url': 'HTTPS://www.iosrjournals.org'}],
12,,47219,archive,2022-12-15 08:00:28,show,1,77,"[{'security': 'public', 'uri': 'http://repository.lppm.unila.ac.id/id/document/186193', 'pos': 1, 'eprintid': 47219, 'placement': 1, 'language': 'en', 'mime_type': 'application/pdf', 'rev_number': 1, 'format': 'text', 'docid': 186193, 'main': '5505.pdf', 'files': [{'objectid': 186193, 'filesize': 224808, 'filename': '5505.pdf', 'uri': 'http://repository.lppm.unila.ac.id/id/file/518436', 'hash_type': 'MD5', 'mtime': '2022-12-14 09:43:49', 'datasetid': 'document', 'fileid': 518436, 'mime_type': 'application/pdf', 'hash': '81c3e85a9b9da7d455a6be7f79ace5cd'}]}]",https://journal.unismuh.ac.id/index.php/konfiks,2022-12-15 08:00:28,"[{'name': {'honourific': None, 'lineage': None, 'family': 'Moulia', 'given': 'Mahyu'}, 'id': 'Moulia.mahyu@gmail.com'}, {'name': {'given': 'Nurlaksana eko', 'family': 'Nurlaksana eko', 'lineage': None, 'honourific': None}, 'id': 'nurlaksana.eko@fkip.unila.ac.id'}, {'name': {'lineage': None, 'family': 'Munaris', 'honourific': None, 'given': 'Munaris'}, 'id': 'munaris.1965@fkip.unila.ac.id'}]",article,TRUE,DISORGANISASI KELUARGA DALAM NOVEL SUARA HATI KARYA MELA SUKMAWATI: SEMIOTIKA PIERCE,['L1'],published,9,"Penelitian ini bertujuan untuk mengetahui makna ikon, indeks, dan simbol berdasarkan pendekatan semiotika  Pierce yang terdapat dalam novel Suara Hati karya Mela Sukmawati. Pendekatan yang digunakan dalam penelitian  ini ialah pendekatan deskriptif kualitatif. Penelitian ini menggunakan data berupa kutipan dalam novel dan sumber  data berupa novel Suara Hati karya Mela Sukmawati. Penelitian ini menggunakan teknik pengumpulan data  dokumentasi. Penelitian ini menggunakan tiga tahap teknik analisis data antara lain (1) mereduksi data; (2)  menyajikan data; (3) penarikan simpulan dan verifikasi data. Penelitian ini menghasilkan: (1) Ikon menunjukkan  hubungan yang bersifat mirip yang ditunjukkan oleh restoran sebagai representamen dari tempat, ikon bulan  sebagai representamen dari latar waktu malam hari, dan ikon kampus sebagai representamen dari tempat; (2)  Indeks menunjukkan hubungan sebab-akibat yang terjadi antara keluarga Zi dan keluarga Bi Aini; (3) Simbol  menunjukkan kesepakatan (konvensi) dalam permasalahan keluarga Zi dan keluarga Bi Aini yang menyimbolkan  bahwa perjodohan sebagai penanda menjodohkan, simbol bill sebagai penanda tagihan, simbol map biru sebagai  penanda berkas laporan ayahnya Zi, simbol saksi bisu sebagai penanda saksi suatu kejadian atau peristiwa, simbol  map merah sebagai penanda surat warisan nenek Arta, simbol sahabat-sahabat kecilnya sebagai penanda benda langit, dan simbol mentari pagi sebagai penanda matahari.",http://repository.lppm.unila.ac.id/id/eprint/47219,1970-01-01 00:00:00.000002022,Universitas Muhammadiyah Makasar,['FKIP8'],"KONFIKS: Jurnal Bahasa, Sastra, dan Pengajarannya",disk0/00/04/72/19,2022-12-15 08:00:28,public,2746-1866,pub,6,36-45,[{'url': 'https://journal.unismuh.ac.id/index.php/konfiks'}],
13,http://dx.doi.org/10.1 8415/ijmmu.v9i8.3904,47173,archive,2022-12-09 02:19:55,show,8,709,"[{'security': 'public', 'pos': 1, 'uri': 'http://repository.lppm.unila.ac.id/id/document/186139', 'eprintid': 47173, 'placement': 1, 'content': 'published', 'mime_type': 'application/pdf', 'language': 'en', 'rev_number': 2, 'format': 'text', 'main': '3904-12083-1-PB.pdf', 'docid': 186139, 'files': [{'mime_type': 'application/pdf', 'hash': 'b10ca9c15dec2301566dc38f7bfe39f3', 'fileid': 518055, 'datasetid': 'document', 'filename': '3904-12083-1-PB.pdf', 'uri': 'http://repository.lppm.unila.ac.id/id/file/518055', 'objectid': 186139, 'filesize': 874523, 'mtime': '2022-12-08 14:47:25', 'hash_type': 'MD5'}]}, {'pos': 2, 'uri': 'http://repository.lppm.unila.ac.id/id/document/186140', 'security': 'public', 'placement': 2, 'eprintid': 47173, 'language': 'en', 'rev_number': 2, 'mime_type': 'image/png', 'content': 'coverimage', 'main': 'Cover.png', 'files': [{'uri': 'http://repository.lppm.unila.ac.id/id/file/518057', 'filename': 'Cover.png', 'filesize': 98746, 'objectid': 186140, 'mtime': '2022-12-08 14:47:43', 'hash_type': 'MD5', 'mime_type': 'image/png', 'hash': '87c7fc0bdb61a4352e5705bb5d2aa056', 'datasetid': 'document', 'fileid': 518057}], 'docid': 186140, 'format': 'image'}, {'eprintid': 47173, 'placement': 3, 'security': 'public', 'uri': 'http://repository.lppm.unila.ac.id/id/document/186141', 'pos': 3, 'format': 'text', 'docid': 186141, 'main': 'Uji Turnitin_Linguistic Politeness in Indonesia_ Refusal Strategies among School-Aged Children in the Indonesian Context.pdf', 'files': [{'filesize': 1793014, 'objectid': 186141, 'uri': 'http://repository.lppm.unila.ac.id/id/file/518059', 'filename': 'Uji Turnitin_Linguistic Politeness in Indonesia_ Refusal Strategies among School-Aged Children in the Indonesian Context.pdf', 'hash_type': 'MD5', 'mtime': '2022-12-08 14:48:03', 'fileid': 518059, 'datasetid': 'document', 'mime_type': 'application/pdf', 'hash': '163e6de759457c3590d0786cf36cd82f'}], 'content': 'other', 'rev_number': 2, 'language': 'en', 'mime_type': 'application/pdf'}]",https://ijmmu.com/index.php/ijmmu/ article/view/3904/3428,2022-12-09 02:19:55,"[{'id': None, 'name': {'given': 'Nurlaksana eko', 'honourific': None, 'lineage': None, 'family': 'Nurlaksana eko'}}, {'name': {'given': 'Farida', 'lineage': None, 'family': 'Farida Ariyani', 'honourific': None}, 'id': 'farida.ariyani@fkip.unila.ac.id'}]",article,FALSE,Linguistic Politeness in Indonesia: Refusal Strategies among School-Aged Children in the Indonesian Context,['L1'],published,9,"Literature asserts that when children attempt to master a language, they display characteristics that are distinct from those of adults. They develop structures, patterns, and rules of their own language in this way. Moreover, a number of experts have proposed that in speech acts, speakers do not always intend to achieve personal objectives, i.e. to obtain something, but also attempt to maintain good relations with their speech partner and ensure interactions run smoothly. According to our knowledge, this topic among
schoolchildren has received less attention recently. In order to gain a deeper understanding of the politeness strategies employed by school-aged children when conveying specific refusals to their speech partners, it was necessary to conduct this current study on this phenomenon. This study adopted a qualitative methodology. Forty children between the ages of six and ten provided speech samples. Observation and field notes were utilized to collect the data. The collected data were subsequently analyzed using an interactive analysis model that included data collection, data presentation, data reduction, and conclusion drawing. The findings indicate that children use politeness strategies to avoid offending their speech partner, to avoid losing face, and to keep the conversation going. The current
findings also indicate that there are eight distinct categories of refusal strategies: (1) refusing by
questioning; (2) refusing by delaying; (3) refusing by requesting an apology; (4) refusing by offering an alternative task; (5) refusing by involving a third party (6) refusing by suggesting a replacement; (7)
refusing by stating conditional sentences; and (8) refusing by returning the command to the interlocutor. Also provided are implications and limitations for future research.",http://repository.lppm.unila.ac.id/id/eprint/47173,2022-06-01 00:00:00.000000000,International Journal of Multicultural and Multireligious Understanding,['FKIP8'],International Journal of Multicultural and Multireligious Understanding,disk0/00/04/71/73,2022-12-09 02:19:55,public,2364-5369,pub,9,38-46,"[{'type': 'pub', 'url': 'https://ijmmu.com/index.php/ijmmu/ article/view/3904/3428'}]",
14,http://dx.doi.org/10.23960/aksara/v23i2.pp251-260,48753,archive,2023-03-06 01:56:48,show,2,500,"[{'security': 'public', 'formatdesc': 'Article', 'uri': 'http://repository.lppm.unila.ac.id/id/document/188129', 'pos': 1, 'eprintid': 48753, 'placement': 1, 'content': 'published', 'language': 'id', 'rev_number': 2, 'mime_type': 'application/pdf', 'format': 'text', 'main': '24479-65799-1-PB.pdf', 'docid': 188129, 'files': [{'mime_type': 'application/pdf', 'hash': '0c248dbd88f9959a748c4d15c9215995', 'fileid': 531100, 'datasetid': 'document', 'filename': '24479-65799-1-PB.pdf', 'uri': 'http://repository.lppm.unila.ac.id/id/file/531100', 'filesize': 533693, 'objectid': 188129, 'mtime': '2023-03-05 05:20:36', 'hash_type': 'MD5'}]}, {'content': 'other', 'language': 'id', 'rev_number': 2, 'mime_type': 'application/pdf', 'format': 'text', 'docid': 188130, 'main': 'Campur kode pada bahasa lisan pedagang pasar tradisional di Bandarlampung.pdf', 'files': [{'datasetid': 'document', 'fileid': 531102, 'mime_type': 'application/pdf', 'hash': '2bf1f5bcb54aa38c04dbdcc875e8c8d0', 'hash_type': 'MD5', 'mtime': '2023-03-05 05:27:32', 'filesize': 1985543, 'objectid': 188130, 'filename': 'Campur kode pada bahasa lisan pedagang pasar tradisional di Bandarlampung.pdf', 'uri': 'http://repository.lppm.unila.ac.id/id/file/531102'}], 'formatdesc': 'Similarity Report', 'security': 'public', 'uri': 'http://repository.lppm.unila.ac.id/id/document/188130', 'pos': 2, 'eprintid': 48753, 'placement': 2}]",http://jurnal.fkip.unila.ac.id/index.php/aksara/article/view/24479,2023-03-06 01:56:48,"[{'id': 'yulinadarwin@gmail.com', 'name': {'honourific': None, 'lineage': None, 'family': 'Rahma', 'given': 'Yulina Winda'}}, {'id': 'doktor_edy@yahoo.com', 'name': {'honourific': None, 'family': 'Suyanto', 'lineage': None, 'given': 'Edi'}}, {'id': 'farida.ariyani@fkip.unila.ac.id', 'name': {'family': 'Ariyani', 'lineage': None, 'honourific': None, 'given': 'Farida'}}]",article,FALSE,Campur kode pada bahasa lisan pedagang pasar tradisional di Bandarlampung,['P1'],published,23,"Tiga jenis pilihan bahasa dalam Sosiolinguistik, yakni alih kode, campur kode, dan variasi dalam bahasa yang sama. Satu di antaranya akan dibahas dalam penelitian ini, yakni campur kode. Campur kode (code mixing) ialah peristiwa penutur yang menyisipkan unsur-unsur bahasa lain berupa serpihan-serpihan (pieces) dari bahasa yang satu ke bahasa lain. Bandarlampung sebagai ibu kota Provinsi Lampung memiliki masyarakat tutur heterogen dengan berbagai keragaman bahasa daerah yang dibawanya. Hal ini dipengaruhi oleh letak Provinsi Lampung yang sangat strategis sebagai jalur keluar-masuk pulau Sumatra. Masyarakat tutur yang heterogen tersebut dapat menimbulkan berbagai macam pilihan bahasa pada saat berinteraksi dengan lawan tuturnya, seperti campur kode. Hasil penelitian ini sebagai berikut. Campur kode terjadi pada bahasa lisan pedagang pasar tradisional Bandarlampung akibat kemampuan berbahasa dan berkomunikasi penuturnya. Hal itu terjadi karena penutur telah terbiasa berbahasa campur guna memudahkan komunikasi penutur. Terdapat data campur kode berupa campur kode Bahasa Indonesia yang kedaerahan dan bahasa daerah yang keindonesiaan.",http://repository.lppm.unila.ac.id/id/eprint/48753,1970-01-01 00:00:00.000002022,"Fakultas Keguruan dan Ilmu Pendidikan, Universitas Lampung",['FKIP8'],AKSARA: Jurnal Bahasa dan Sastra,disk0_bak/00/04/87/53,2023-03-06 01:56:48,public,P-ISSN: 1411-2051 / E-ISSN: 2620-3928,pub,8,251-260,,
