,id_number,eprintid,eprint_status,datestamp,metadata_visibility,number,userid,documents,official_url,lastmod,creators,type,refereed,title,subjects,date_type,volume,abstract,uri,date,publisher,divisions,publication,dir,status_changed,full_text_status,issn,ispublished,rev_number,pagerange,related_url,contact_email
15,http://dx.doi.org/10.18415/ijmmu.v9i7.3841,48757,archive,2023-03-06 01:56:54,show,7,500,"[{'eprintid': 48757, 'placement': 1, 'formatdesc': 'Article', 'security': 'public', 'uri': 'http://repository.lppm.unila.ac.id/id/document/188137', 'pos': 1, 'format': 'text', 'files': [{'uri': 'http://repository.lppm.unila.ac.id/id/file/531145', 'filename': '3841-11866-1-PB.pdf', 'filesize': 632568, 'objectid': 188137, 'mtime': '2023-03-05 10:12:28', 'hash_type': 'MD5', 'hash': '0386609153ee7ee09f8faeabbfb99adc', 'mime_type': 'application/pdf', 'datasetid': 'document', 'fileid': 531145}], 'main': '3841-11866-1-PB.pdf', 'docid': 188137, 'content': 'published', 'mime_type': 'application/pdf', 'language': 'en', 'rev_number': 2}, {'security': 'public', 'formatdesc': 'Similarity Report', 'pos': 2, 'uri': 'http://repository.lppm.unila.ac.id/id/document/188139', 'eprintid': 48757, 'placement': 2, 'language': 'en', 'mime_type': 'application/pdf', 'rev_number': 2, 'format': 'text', 'docid': 188139, 'main': 'Social Conflict and Moral Values of Novel Si Anak Badai by Tere Liye The Study of Literature Sociology.pdf', 'files': [{'datasetid': 'document', 'fileid': 531150, 'mime_type': 'application/pdf', 'hash': '3294236305937df750fb4493f0ff9893', 'hash_type': 'MD5', 'mtime': '2023-03-05 10:12:57', 'objectid': 188139, 'filesize': 1295653, 'filename': 'Social Conflict and Moral Values of Novel Si Anak Badai by Tere Liye The Study of Literature Sociology.pdf', 'uri': 'http://repository.lppm.unila.ac.id/id/file/531150'}]}]",https://ijmmu.com/index.php/ijmmu/article/view/3841/3381,2023-03-06 01:56:54,"[{'id': None, 'name': {'given': 'Lela', 'family': 'Suri', 'lineage': None, 'honourific': None}}, {'name': {'family': 'Suyanto', 'lineage': None, 'honourific': None, 'given': 'Edi'}, 'id': None}, {'id': 'farida.ariyani@fkip.unila.ac.id', 'name': {'family': 'Ariyani', 'lineage': None, 'honourific': None, 'given': 'Farida'}}]",article,FALSE,Social Conflict and Moral Values of Novel Si Anak Badai by Tere Liye the Study of Literature Sociology,['PN'],published,9,"The purpose of this study is to describe the social conflicts and moral values contained in the Novel Si Anak Badai by Tere Liye. This research is a qualitative research using a sociology of literature approach. This research is to describe the social conflict and moral values in the Novel Si Anak Badai by Tere Liye. The results of the discussion in this study are obtained facts related to social conflicts, namely coercion, data lies, and slander. While the moral values contained in the Novel Si Anak Badai by Tere Liye include: filial piety to parents, responsibility, forgiveness, mutual cooperation, the importance of education, friendship, honesty, self- confidence, facing strength with gentleness and others.",http://repository.lppm.unila.ac.id/id/eprint/48757,2022-07-01 00:00:00.000000000,IJMMU,['FKIP8'],International Journal of Multicultural and Multireligious Understanding (IJMMU),disk0_bak/00/04/87/57,2023-03-06 01:56:54,public,2364-5369,pub,10,33-38,,
16,,48825,archive,2023-03-07 02:26:20,show,8,727,"[{'content': 'published', 'mime_type': 'application/pdf', 'language': 'en', 'rev_number': 2, 'format': 'text', 'main': 'document.pdf', 'files': [{'mime_type': 'application/pdf', 'hash': '2ed41d1e248058e29efc85668c3ca825', 'datasetid': 'document', 'fileid': 531685, 'mtime': '2023-03-07 01:54:00', 'hash_type': 'MD5', 'uri': 'http://repository.lppm.unila.ac.id/id/file/531685', 'filename': 'document.pdf', 'filesize': 436113, 'objectid': 188251}], 'docid': 188251, 'security': 'public', 'formatdesc': 'Article', 'uri': 'http://repository.lppm.unila.ac.id/id/document/188251', 'pos': 1, 'eprintid': 48825, 'placement': 1}, {'language': 'en', 'mime_type': 'application/pdf', 'rev_number': 2, 'format': 'text', 'main': 'Scrutinizing Vocabulary Input In The Basic Class Of Indonesian Language For Foreign Learners_ A Corpus Study.pdf', 'files': [{'hash_type': 'MD5', 'mtime': '2023-03-07 01:54:07', 'filesize': 2380768, 'objectid': 188252, 'filename': 'Scrutinizing Vocabulary Input In The Basic Class Of Indonesian Language For Foreign Learners_ A Corpus Study.pdf', 'uri': 'http://repository.lppm.unila.ac.id/id/file/531687', 'fileid': 531687, 'datasetid': 'document', 'hash': '74c1c927ce6a4fafbcf14444bed989c1', 'mime_type': 'application/pdf'}], 'docid': 188252, 'security': 'public', 'formatdesc': 'Similarity Report', 'uri': 'http://repository.lppm.unila.ac.id/id/document/188252', 'pos': 2, 'eprintid': 48825, 'placement': 2}]",https://journalppw.com/index.php/jpsp/article/view/10101,2023-03-07 02:26:20,"[{'id': 'mulyanto.widodo@gmail.com', 'name': {'family': 'Widodo', 'lineage': None, 'honourific': None, 'given': 'Mulyanto'}}, {'name': {'given': 'Destiani', 'lineage': None, 'family': 'Destiani', 'honourific': None}, 'id': None}, {'id': None, 'name': {'honourific': None, 'lineage': None, 'family': 'Rudy', 'given': 'Muhammad'}}]",article,FALSE,Scrutinizing Vocabulary Input In The Basic Class Of Indonesian Language For Foreign Learners: A Corpus Study,['P1'],published,6,"This research study aims to determine the vocabulary input of foreign students in the basic level BIPA (Indonesian for Foreign Speakers) class. Many experts state that the frequent repetition of a word will make it easier for foreign students to memorize and rephrase it, both orally and in writing. This study uses a qualitative descriptive with a corpus study. AntConc software is very helpful in the process of collecting research data. There are three things that can be obtained from this research. First, the types of words in the BIPA Book 1 are 1,559 words with 9,456 tokens and 1,264 words in the BIPA 2 Book with 7,073 tokens. Second, the percentage of word types is divided into low frequency words with 70.88% in BIPA Book 1 and 69.78% in BIPA Book 2. Medium frequency words with 12.77% in BIPA Book 1 and 13.93% in BIPA 2 Book High frequency words with 16.36% in BIPA Book 1 and 16.30% in BIPA Book 2. Third, the types of words that enter into low frequency words have a high percentage. This makes it difficult for students to remember a word for a long time due to the lack of repetition of words.",http://repository.lppm.unila.ac.id/id/eprint/48825,1970-01-01 00:00:00.000002022,Society of Psychology and Education,['FKIP8'],Journal of Positive School Psychology,disk0_bak/00/04/88/25,2023-03-07 02:26:20,public,2717-7564,pub,8,1993-2001,,
17,https://doi.org/10.53402/ijesss.v2i3.106,48824,archive,2023-03-07 02:26:16,show,3,727,"[{'pos': 1, 'uri': 'http://repository.lppm.unila.ac.id/id/document/188249', 'formatdesc': 'Article', 'security': 'public', 'placement': 1, 'eprintid': 48824, 'language': 'en', 'mime_type': 'application/pdf', 'rev_number': 2, 'content': 'published', 'main': '106-Article Text-895-748-10-20220828.pdf', 'docid': 188249, 'files': [{'datasetid': 'document', 'fileid': 531678, 'mime_type': 'application/pdf', 'hash': '6774453d117b8655450729271dfa4235', 'objectid': 188249, 'filesize': 252961, 'uri': 'http://repository.lppm.unila.ac.id/id/file/531678', 'filename': '106-Article Text-895-748-10-20220828.pdf', 'hash_type': 'MD5', 'mtime': '2023-03-07 01:50:32'}], 'format': 'text'}, {'security': 'public', 'formatdesc': 'Similarity Report', 'pos': 2, 'uri': 'http://repository.lppm.unila.ac.id/id/document/188250', 'eprintid': 48824, 'placement': 2, 'rev_number': 2, 'language': 'en', 'mime_type': 'application/pdf', 'format': 'text', 'main': 'Speech acts among young children_ How does a young child use direct and indirect speech_.pdf', 'docid': 188250, 'files': [{'datasetid': 'document', 'fileid': 531680, 'hash': '23af36679c11183b5e915bf05df1cdbb', 'mime_type': 'application/pdf', 'hash_type': 'MD5', 'mtime': '2023-03-07 01:50:48', 'objectid': 188250, 'filesize': 949328, 'filename': 'Speech acts among young children_ How does a young child use direct and indirect speech_.pdf', 'uri': 'http://repository.lppm.unila.ac.id/id/file/531680'}]}]",https://lighthouse-pub.com/ijesss/article/view/106,2023-03-07 02:26:16,"[{'name': {'honourific': None, 'lineage': None, 'family': 'Widodo', 'given': 'Mulyanto'}, 'id': 'mulyantowidodo@gmail.com'}, {'name': {'honourific': None, 'lineage': None, 'family': 'MSK', 'given': 'Aji Marhaban Bidzikrillah'}, 'id': None}]",article,FALSE,Speech acts among young children: How does a young child use direct and indirect speech?,['P1'],published,2,"This study aimed to compare direct and indirect speech acts among young toddlers using various speech situations. This study's main subject was a conversational interaction made by a four-year-old child. The data for this qualitative study were collected through non-participant observations and a recording device to record what the participant said. The findings indicate that the participant's speech acts, whether direct or indirect, were converted into direct speech that was justified and straightforward speech that was on point, whereas indirect speech was gained through praise, sarcasm, and complaints. Future research directions are also highlighted.",http://repository.lppm.unila.ac.id/id/eprint/48824,1970-01-01 00:00:00.000002022,Lighthouse Publishing,['FKIP8'],International Journal of Educational Studies in Social Sciences,disk0_bak/00/04/88/24,2023-03-07 02:26:16,public,2797-636X,pub,13,166-170,,
18,https://doi.org/10.25134/fon.v18i2.5720,47524,archive,2022-12-29 02:29:06,show,2,709,"[{'files': [{'datasetid': 'document', 'fileid': 521011, 'hash': '505c5548bc2d3ee9b02816644b7741ae', 'mime_type': 'application/pdf', 'hash_type': 'MD5', 'mtime': '2022-12-29 01:52:21', 'objectid': 186583, 'filesize': 332514, 'uri': 'http://repository.lppm.unila.ac.id/id/file/521011', 'filename': '(S-3) PRINSIP KERJA SAMA DALAM WACANA KOMUNIKASI.pdf'}], 'main': '(S-3) PRINSIP KERJA SAMA DALAM WACANA KOMUNIKASI.pdf', 'docid': 186583, 'format': 'text', 'language': 'id', 'rev_number': 2, 'mime_type': 'application/pdf', 'content': 'published', 'placement': 1, 'eprintid': 47524, 'pos': 1, 'uri': 'http://repository.lppm.unila.ac.id/id/document/186583', 'security': 'public', 'formatdesc': 'Artikel'}, {'eprintid': 47524, 'placement': 2, 'security': 'public', 'formatdesc': 'Uji Turnitin', 'pos': 2, 'uri': 'http://repository.lppm.unila.ac.id/id/document/186584', 'format': 'text', 'files': [{'filename': 'Uji Turnitin_PRINSIP KERJA SAMA DALAM WACANA KOMUNIKASI KELUARGA JAWA DI KELURAHAN KEDIRI.pdf', 'uri': 'http://repository.lppm.unila.ac.id/id/file/521013', 'filesize': 2759528, 'objectid': 186584, 'mtime': '2022-12-29 01:52:59', 'hash_type': 'MD5', 'hash': 'bd3263522dd3be278b7857c075dc8d3d', 'mime_type': 'application/pdf', 'fileid': 521013, 'datasetid': 'document'}], 'main': 'Uji Turnitin_PRINSIP KERJA SAMA DALAM WACANA KOMUNIKASI KELUARGA JAWA DI KELURAHAN KEDIRI.pdf', 'docid': 186584, 'language': 'id', 'rev_number': 2, 'mime_type': 'application/pdf'}]",https://journal.uniku.ac.id/index.php/FON/article/view/5720/pdf,2022-12-29 02:29:06,"[{'name': {'honourific': None, 'lineage': None, 'family': 'Yerli Agilia Putri', 'given': 'Yerli'}, 'id': None}, {'id': None, 'name': {'given': 'Nurlaksana eko', 'lineage': None, 'family': 'Nurlaksana eko', 'honourific': None}}, {'id': 'gragemarti@yahoo.co.id', 'name': {'given': 'Sumarti', 'lineage': None, 'family': 'Sumarti', 'honourific': None}}, {'id': 'siti_samhati@yahoo.com', 'name': {'lineage': None, 'family': 'Siti Samhati', 'honourific': None, 'given': 'Siti Samhati'}}]",article,FALSE,PRINSIP KERJA SAMA DALAM WACANA KOMUNIKASI KELUARGA JAWA DI KELURAHAN KEDIRI,['L1'],published,18,"Bahasa sebagai alat komunikasi selalu digunakan manusia dalam setiap aktivitas sosialnya. Dalam proses berkomunikasi tersebut, seseorang cenderung akan menghadapi kendala-kendala yang menyebabkan komunikasi tidak berjalan sesuai dengan yang diharapkan Untuk menghilangkan kendala dalam komunikasi tersebut, penutur dan mitra tutur dituntut untuk menyadari bahwa ada kaidah-kaidah kebahasaan yang harus ditaatinya. Penelitian ini bertujuan mendeskripsikan pematuhan dan pelanggaran prinsip kerja sama dalam wacana komunikasi keluarga Jawa di Kelurahan Kediri. Metode yang
digunakan dalam penelitian ini adalah metode kualitatif yang bersifat deskriptif. Data penelitian berwujud tuturan percakapan di lingkungan keluarga Jawa. Data penelitian dikumpulkan melalui teknik simakrekam-catat. Data yang terkumpul selanjutnya dianalisis secara deskriptif menggunakan teknik interaktif. Hasil penelitian menunjukkan bahwa dalam wacana komunikasi keluarga umumnya selalu mematuhi prinsip kerja sama. Pelanggaran terhadap prinsip kerja sama juga ditemukan dalam wacana komunikasi keluarga tapi tidak mendominasi. Pelanggaran terhadap prinsip kerja sama adakalanya dilakukan secara sengaja untuk mencapai tujuan-tujuan lain dalam konteks yang lebih luas.",http://repository.lppm.unila.ac.id/id/eprint/47524,2022-10-30 00:00:00.000000000,Program Studi Pendidikan Bahasa dan Sastra Indonesia Universitas Kuningan,['FKIP8'],Fon: Jurnal Pendidikan Bahasa dan Sastra Indonesia,disk0_bak/00/04/75/24,2022-12-29 02:29:06,public,2086-0609,pub,8,284-293,"[{'url': 'https://journal.uniku.ac.id/index.php/FON/article/view/5720/pdf', 'type': 'pub'}]",
