,status_changed,succeeds,rev_number,dir,publication,divisions,funders,volume,uri,date_type,subjects,creators,type,title,lastmod,metadata_visibility,full_text_status,issn,ispublished,related_url,publisher,abstract,date,refereed,userid,number,official_url,documents,datestamp,eprint_status,id_number,eprintid,pagerange,pres_type,event_title,event_type,patent_applicant,event_dates,event_location,corp_creators,referencetext,contributors,contact_email
7,2021-10-04 01:21:18,31829.0,9,disk0/00/03/42/26,Tawit Pustaka Jurnal Perpustakaan dan Informasi Ilmiah,['FT8'],,4.0,http://repository.lppm.unila.ac.id/id/eprint/34226,published,['T1'],"[{'name': {'honourific': None, 'family': '.', 'lineage': None, 'given': 'Mardiana'}, 'id': 'mardiana@eng.unila.ac.id'}, {'id': 'meizano@eng.unila.ac.id', 'name': {'given': 'Meizano Ardhi', 'honourific': None, 'family': 'Muhammad', 'lineage': None}}, {'name': {'lineage': None, 'family': 'Sulistiono', 'honourific': None, 'given': 'Wahyu Eko'}, 'id': 'eko@eng.unila.ac.id'}, {'name': {'family': 'Windah', 'lineage': None, 'honourific': None, 'given': 'Andi'}, 'id': 'andiwindah@gmail.com'}]",article,ARLIB (AUGMENTED REALITY FOR LIBRARY) SEBAGAI MEDIA INTERAKTIF UNTUK PENGENALAN DAN PROMOSI PERPUSTAKAAN,2022-12-05 04:16:57,show,public,25989464,pub,,Dinas Perpustakaan dan Kearsipan Provinsi Lampung,"Perkembangan Teknologi Informasi dan Komunikasi (TIK) yang semakin pesat, seharusnya dapat mendorong pemanfaatan teknologi tersebut untuk pelayanan yang prima sekaligus sebagai kekuatan instansi/lembaga untuk bersaing secara global. Demikian juga dalam bidang Perpustakaan, organisasi kerjasama Perpustakaan antar Perguruan Tinggi (PT) yaitu Forum Perpustakaan Perguruan Tinggi Indonesia (FPPTI), di Provinsi Lampung disebut FPPTI Lampung memiliki anggotanya 22 Perpustakaan PTN/PTS yang bergabung aktif sejak tahun 2016. FPPTI Lampung menjadi Mitra bagi tim Pengabdian Kepada Masyarakat (PKM) Unila ini. 
Permasalahan yang dimiliki Mitra, adalah masih minimnya TIK yang diterapkan untuk mempromosikan layanan dan fasilitas. Salah satu teknologi terkini yang dapat digunakan adalah teknologi Augmented Reality (AR). Aplikasi AR untuk navigasi Perpustakaan merupakan hasil penelitian tim PKM Unila, telah memperoleh sertifikat Hak Cipta dan sedang dalam pengajuan Paten Sederhana. Usulan penerapan aplikasi AR ini difokuskan kepada fitur-fitur umum untuk tujuan promosi Perpustakaan, disebut dengan aplikasi ARLib (Augmented Reality for Library). ARLib digunakan pada ponsel cerdas pengguna, yang melalui pemindaian kamera ponsel akan memvisualisasikan marker yang ada ke dalam bentuk tiga dimensi (3D). Unsur interaksi pengguna dibuat dengan menggunakan audio dan video. Tampilan  promosi Perpustakaan akan lebih lengkap, menarik dan interaktif  jika dibandingkan dengan poster ataupun brosur biasa. 
Metoda  yang  digunakan  dalam  pengembangan aplikasi dan penerapan ARLib ini menggunakan metode Rapid Application  Development (RAD). Tahapan RAD adalah identifikasi masalah dan motivasi, menetapkan objek solusi, penerapan solusi dan pelatihan serta pelaporan hasil dan publikasi. Untuk peningkatan kompetensi Mitra dalam hal teknologi dan promosi, Tim PKM telah memberikan pelatihan dan praktek, mulai dari persiapan konten promosi hingga penerapan aplikasi ARLib pada Perpustakaan Mitra. Berdasarkan indikator pemahaman dan capaian target luaran secara rata-rata tercapai pemahaman peserta sebesar 80% dan penerapan yang dilakukan sebesar 40%. Sehingga dapat dikatakan bahwa tujuan PKM ini tercapai dengan baik yaitu berupa tersedianya perangkat teknologi informasi dalam bentuk aplikasi ARLib (Augmented Reality for Library)  yang dapat digunakan Mitra sebagai sarana promosi serta diperolehnya peningkatan pengetahuan dan wawasan Mitra pada TIK yang diterapkan di Perpustakaan tersebut.

Kata Kunci : Perpustakaan, FPPTI Lampung, Augmented Reality, ARLib, Promosi",2020-11-01 00:00:00.000000000,FALSE,517,2.0,,"[{'files': [{'hash_type': 'MD5', 'mtime': '2021-09-30 11:49:05', 'filesize': 545095, 'objectid': 154734, 'filename': 'ARLIB (AUGMENTED REALITY FOR LIBRARY) SEBAGAI MEDIA INTERAKTIF UNTUK PENGENALAN DAN PROMOSI PERPUSTAKAAN.pdf', 'uri': 'http://repository.lppm.unila.ac.id/id/file/403583', 'datasetid': 'document', 'fileid': 403583, 'mime_type': 'application/pdf', 'hash': '863eb6f1f61ba6926a3d6fb3001e8f1f'}], 'main': 'ARLIB (AUGMENTED REALITY FOR LIBRARY) SEBAGAI MEDIA INTERAKTIF UNTUK PENGENALAN DAN PROMOSI PERPUSTAKAAN.pdf', 'docid': 154734, 'format': 'text', 'language': 'en', 'rev_number': 1, 'mime_type': 'application/pdf', 'placement': 6, 'eprintid': 34226, 'pos': 6, 'uri': 'http://repository.lppm.unila.ac.id/id/document/154734', 'security': 'public'}]",2021-10-04 01:21:18,archive,,34226,9-20,,,,,,,,,,
8,2021-03-03 02:05:28,,7,disk0/00/02/81/53,Jurnal Sinergi,['FT8'],,1.0,http://repository.lppm.unila.ac.id/id/eprint/28153,,['T1'],"[{'name': {'given': 'Mardiana', 'lineage': None, 'family': '.', 'honourific': None}, 'id': 'mardiana@eng.unila.ac.id'}, {'name': {'honourific': None, 'family': 'Muhammad', 'lineage': None, 'given': 'Meizano Ardhi'}, 'id': 'meizano@eng.unila.ac.id'}, {'id': 'syafarudin.1972@fisip.unila.ac.id', 'name': {'lineage': None, 'family': 'Syafarudin', 'honourific': None, 'given': 'Syafarudin'}}]",article,IDM DashboardSebagai Alat Bantu Untuk Pengukuran Status Kemandirian Desa Hanakau Jaya Kabupaten Lampung Utara,2021-03-03 02:05:28,show,public,,pub,,LPPM Universitas Lampung,"Index  Membangun  Desa  (IDM)  adalah  pengukuran  indeks  yang  dilakukan  pemerintah Indonesia untuk mengetahui tingkatan sebuah desa terhadap parameter yang telah ditentukan. IDM ditetapkan  melalui  peraturan  Permendesa  No  2  Tahun  2016.  Namun  sampaidengan  saat  ini, implementasi  IDM  yang  berupa  aktivitas  pengumpulan  data  dan  penyajian  informasi,  masih dilakukan  secara  manual  oleh  desa.  Proses  data  dari  desa  kemudian  dikumpulkan  pada  tingkat kecamatan,  yang  kemudian  diserahkan  secara  bertingkat  sampaitingkat  kementerian.  Sehingga adanya sistem elektronik yang menjadikan informasi desa dapat dengan cepat diinput, diolah dan ditampilkan  secara  otomatis  dengan  menggunakan  ponsel  cerdas,  akan  sangat  membantu perangkat  desa  terkait.  Permasalahan  yang  dimiliki  perangkat  Desa  Hanakau  Jaya  Kabupaten Lampung Utara sebagai Mitra desa binaan, adalah tidak adanya sistem elektronik berupa aplikasi IDM Dashboardyang  dapat  digunakan  untuk  tujuan  tersebut.  Sehingga  pengumpulan  data  dan penyajian  informasi  Desa  Hanakau  Jaya  memerlukan  waktu yang  lama  dan  tidak  akurat.Metodeyangdigunakan dalam penerapan aplikasi ini menggunakanmetodeRapidApplicationDevelopment(RAD).   Tahapan  RAD   adalah   identifikasi   masalah   dan  motivasi,  menetapkan   objek   solusi, penerapan solusi dan pelatihan serta pelaporan hasil dan publikasi. Untuk peningkatan kompetensi Mitra dalam hal teknologi informasi,Tim PKM telah memberikan pelatihan dan praktek penggunaan aplikasi IDM Dashboardhingga penerapan dengan data hasil survey yang sebenarnya. Hasilnya, perangkat  teknologi  informasi  dalam  bentuk  aplikasi  IDM Dashboardtelah  dapat  digunakan Mitra sebagai alat bantu penginputan dan pengukuran status kemandirian desa Hanakau Jaya. Mitra telah dapat membuat  kuisioner,  menginput data  dan menggunakan  fitur-fitur terkait  pengukuran  status, serta telah melakukan uji coba aplikasi secara keseluruhan. Hasil pengamatan dan post-testyang dilakukan  pada  saat  pelatihan,  menunjukkan  pemahaman  peserta  terhadap  cara  pembuatan kuisioner   sebesar   75%,   dan   cara   penginputan   data   sebesar   80%   dan   pengukuran   status kemandirian desa sebesar 85%. Hasil pada tahap monitoring dan evaluasi pada perangkat desa, diperoleh bahwa aplikasi telah diterapkan untuk survey pada 40 peserta yang menjadi responden. Penggunaan  aplikasi  menunjukkan  pemahaman 40  peserta  tersebut  rata-rata  sebesar  85%  pada cara-cara penggunaan aplikasi IDM Dashboard.

Kata kunci: IDM, sistem elektronik, IDM Dashboard , desa, survei.",1970-01-01 00:00:00.000002020,FALSE,517,9.0,https://sinergi.lppm.unila.ac.id/,"[{'format': 'text', 'docid': 42205, 'main': 'IDM Dashboard Sebagai Alat Bantu Untuk.pdf', 'files': [{'hash': 'de7080ed9fb64a83ce2ff315cde52ef4', 'mime_type': 'application/pdf', 'datasetid': 'document', 'fileid': 250517, 'uri': 'http://repository.lppm.unila.ac.id/id/file/250517', 'filename': 'IDM Dashboard Sebagai Alat Bantu Untuk.pdf', 'objectid': 42205, 'filesize': 510251, 'mtime': '2021-03-02 00:38:19', 'hash_type': 'MD5'}], 'language': 'en', 'rev_number': 1, 'mime_type': 'application/pdf', 'eprintid': 28153, 'placement': 1, 'security': 'public', 'uri': 'http://repository.lppm.unila.ac.id/id/document/42205', 'pos': 1}]",2021-03-03 02:05:28,archive,,28153,55-64,,,,,,,,,,
9,2020-11-20 01:22:42,,9,disk0/00/02/63/64,,['FT8'],['Lembaga Penelitian dan Pengabdian Kepada Masyarakat Universitas Lampung'],,http://repository.lppm.unila.ac.id/id/eprint/26364,published,"['T1', 'T201']","[{'name': {'given': 'Mardiana', 'honourific': None, 'lineage': None, 'family': '.'}, 'id': 'mardiana@eng.unila.ac.id'}, {'id': 'meizano@eng.unila.ac.id', 'name': {'given': 'Meizano Ardhi', 'family': 'Muhammad', 'lineage': None, 'honourific': None}}, {'id': 'syafarudin.1972@fisip.unila.ac.id', 'name': {'honourific': None, 'lineage': None, 'family': 'Syafarudin', 'given': 'Syafarudin'}}, {'id': 'rizki.alandani@gmail.com', 'name': {'family': 'Alandani', 'lineage': None, 'honourific': None, 'given': 'Rizki'}}, {'id': None, 'name': {'lineage': None, 'family': 'Setiawan', 'honourific': None, 'given': 'Joni'}}]",patent,Program Komputer IDM Dashboard,2020-11-20 01:22:42,show,public,,pub,,,"Sistem Elektronik Indeks Desa Membangun (IDM) Dashboard dengan penyajian informasi berdasarkan laporan IDM tahunan Kemendesa yang dapat disajikan mulai dari tingkat desa, kecamatan, kabupaten, provinsi hingga nasional. Sistem Elektronik IDM Dashboard dapat dijalankan pada perangkat bergerak.",2020-11-02 00:00:00.000000000,,1199,,,"[{'rev_number': 1, 'language': 'en', 'mime_type': 'application/pdf', 'format': 'text', 'main': 'sertifikat_EC00202045770.pdf', 'files': [{'fileid': 237483, 'datasetid': 'document', 'hash': '27502501d3084f7165a43afc7843e8e7', 'mime_type': 'application/pdf', 'objectid': 40259, 'filesize': 767757, 'filename': 'sertifikat_EC00202045770.pdf', 'uri': 'http://repository.lppm.unila.ac.id/id/file/237483', 'hash_type': 'MD5', 'mtime': '2020-11-19 19:42:48'}], 'docid': 40259, 'security': 'public', 'pos': 1, 'uri': 'http://repository.lppm.unila.ac.id/id/document/40259', 'eprintid': 26364, 'placement': 1}]",2020-11-20 01:22:42,archive,EC00202045770,26364,,,,,Lembaga Penelitian dan Pengabdian kepada Masyarakat Universitas Lampung,,,,,,
10,2020-06-04 00:08:32,,10,disk0/00/02/17/10,,['FT8'],,,http://repository.lppm.unila.ac.id/id/eprint/21710,,['T1'],"[{'id': None, 'name': {'family': 'Al Assad', 'lineage': None, 'honourific': None, 'given': 'M. Aziz'}}, {'name': {'family': '.', 'lineage': None, 'honourific': None, 'given': 'Mardiana'}, 'id': 'mardiana@eng.unila.ac.id'}, {'name': {'given': 'Meizano Ardhi', 'family': 'Muhammad', 'lineage': None, 'honourific': None}, 'id': 'meizano@eng.unila.ac.id'}]",conference_item,Peta Tiga Dimensi sebagai Alat Bantu Indoor Navigation pada UPT Perpustakaan Universitas Lampung,2020-06-04 00:08:32,show,public,,pub,,,"Penelitian ini merupakan bagian dari penelitian yang bertujuan mengembangkan sistem navigasi bagi pemustaka UPT Perpustakaan Universitas Lampung. Paparan pada makalah ini mengenai aplikasi pemodelan 3 dimensi (3D) sebagai pathfinding untuk menemukan ruangan yang dicari. Model 3D digambarkan dalam bentuk desain layout ruang pada tiga lantai gedung UPT Perpustakaan Universitas Lampung. Dibuat 2 tipe tampilan gedung UPT Perpustakaan Universitas Lampung pada penelitian ini, yaitu Top-down View dan Isometric View. Dibuat avatar pada penelitian ini sebagai penunjuk navigasi yang dilakukan. Avatar akan menunjukkan navigasi menuju arah ruangan yang dicari oleh pemustaka. Metode yang digunakan dalam penelitian ini adalah metode Kanban. Hasil penelitian berupa aplikasi desktop yang juga dapat digunakan pada kioska layar sentuh. Dari hasil pengujian, aplikasi dapat membuat avatar menunjukkan navigasi menuju arah ruangan yang dicari oleh pemustaka sesuai lokasi ruangan tersebut.
Kata kunci : Perpustakaan, Model 3D, Unity 3D, Navigasi, Metode Kanban",2020-02-01 00:00:00.000000000,FALSE,517,,http://sniper.library.unila.ac.id/2020/05/29/e-prosding-2019/,"[{'format': 'archive', 'files': [{'objectid': 35104, 'filesize': 30908, 'filename': 'index.html', 'uri': 'http://repository.lppm.unila.ac.id/id/file/200911', 'hash_type': 'MD5', 'mtime': '2020-06-03 22:54:45', 'datasetid': 'document', 'fileid': 200911, 'mime_type': 'text/html', 'hash': '218c21f9c88a5e21b0732ddf59513e30'}], 'main': 'index.html', 'docid': 35104, 'content': 'published', 'language': 'id', 'mime_type': 'text/html', 'rev_number': 3, 'eprintid': 21710, 'placement': 1, 'security': 'public', 'pos': 1, 'uri': 'http://repository.lppm.unila.ac.id/id/document/35104'}]",2020-06-04 00:08:32,archive,,21710,,paper,SEMINAR NASIONAL INOVASI PERPUSTAKAAN (SNIPer) 2019,conference,,Oktober 2019,Bandar Lampung,,,,
11,2023-04-10 00:56:16,,14,disk0/00/02/64/63,SENDIMAS,['FT8'],,5.0,http://repository.lppm.unila.ac.id/id/eprint/26463,submitted,"['L1', 'LB2300', 'N1', 'Q1', 'T1']","[{'name': {'lineage': None, 'family': 'Deny Budiyanto', 'honourific': None, 'given': 'Deny Budiyanto'}, 'id': 'deny.budianto@eng.unila.ac.id'}, {'name': {'honourific': None, 'family': 'Resty', 'lineage': None, 'given': 'Annisa'}, 'id': 'resty.annisa@eng.unila.ac.id'}, {'name': {'lineage': None, 'family': 'Mulyani', 'honourific': None, 'given': 'Yessi'}, 'id': 'yessi.mulyani@eng.unila.ac.id'}]",article,"Peningkatan Profesionalitas Guru Dengan Pelatihan
Pembuatan Konten Video Pembelajaran",2023-04-10 00:56:16,show,public,2541-3805,inpress,"[{'url': 'https://lppm.uajy.ac.id/sendimas2020/', 'type': 'pub'}]",Universitas Atma Jaya Yogyakarta,"-Seiring kemajuan teknologi dimana saat ini telah
memasuki era 4.0, semua informasi bisa diakses dengan
menggunakan perangkat teknologi, Informasi apapun
hendaknya bisa diakses dimanapun dan kapanpun. Insan
Pembelajar dapat belajar dimana saja, kapan saja, dengan
siapa saja. Inilah dimana kita berada pada abad teknologi
canggih yang memiliki ciri pembelajaran pada abad ini yang
dikenal berbasis digital/daring.   
Dalam Pengabdian ini memiliki tujuan untuk menerapkan
hasil penelitian yang telah dilakukan oleh sivitas akademika,
selain itu sejak kebijakan dari kementerian pendidikan dan
kebudayaan mengamanatkan pembelajaran secara daring
karena wabah Covid-19, dewasa ini para guru di SMA Al
Husna membutuhkan keterampilan dalam menggunakan
media konten video sebagai media pembelajaran di sekolah
mereka, karena belum cukupnya Kemampuan SDM untuk
mengelola dan membuat konten berbasis video pembelajaran.
Oleh sebab itu dibuatnya pelatihan membuat konten video
pada guru diharapkan mampu memanfaatkan teknologi untuk
peningkatan kemampuan dalam mengelola media 
pembelajaran khususnya dalam membuat sebuah konten
video. 
Berdasarkan hasil laporan pengabdian yang telah
dilakukan, Sasaran pengabdian adalah guru-guru di SMA Al
Husna dalam bentuk kegiatan pelatihan telah diajarkan materi
beserta praktek perancangan konten, pembuatan konten
video, pengelolaan konten video pembelajaran, Permasalahan
diselesaikan dalam tiga tahapan kegiatan yaitu persiapan,
pelaksanaan, dan evaluasi. Hasil kegiatan pelatihan
menunjukkan tingkat keberhasilan dengan indikasi adanya
kesesuaian materi dengan kebutuhan guru, adanya respon
yang positif dari peserta, dan sebagian besar (75%) peserta
telah memahami konsep pengelolaan dan pembuatan video
pembelajaran. Target dan Luaran dari pengabdian
masyarakat ini adalah memberikan dampak positif pada
pembangunan masyarakat khususnya para guru dan peserta
didik agar memberikan wawasan pengetahuan tentang karya
pengembangan profesi pada guru di SMA Al Husna, Bandar
Lampung khususnya mampu menggunakan perangkat
teknologi sebagai media pembelajaran daring menggunakan
video. 
Kata Kunci—Pelatihan, Daring, Guru, Pembelajaran, Video",2020-09-17 00:00:00.000000000,TRUE,2822,1.0,https://lppm.uajy.ac.id/sendimas2020/,"[{'main': 'Resty Annisa_Publikasi PKM_Sendimas.pdf', 'files': [{'mime_type': 'application/pdf', 'hash': 'ada643ea26fcd1c1d6f8d3808de72558', 'datasetid': 'document', 'fileid': 238149, 'mtime': '2020-11-20 06:08:53', 'hash_type': 'MD5', 'filename': 'Resty Annisa_Publikasi PKM_Sendimas.pdf', 'uri': 'http://repository.lppm.unila.ac.id/id/file/238149', 'objectid': 40352, 'filesize': 1064440}], 'docid': 40352, 'format': 'text', 'language': 'en', 'mime_type': 'application/pdf', 'rev_number': 1, 'placement': 1, 'eprintid': 26463, 'pos': 1, 'uri': 'http://repository.lppm.unila.ac.id/id/document/40352', 'security': 'public'}]",2023-04-10 00:56:16,archive,,26463,346-350,,,,,,,,,,
12,2020-07-20 04:34:04,22983.0,14,disk0/00/02/32/53,KLIK: Kumpulan jurnaL Ilmu Komputer,['FT8'],,7.0,http://repository.lppm.unila.ac.id/id/eprint/23253,completed,"['Q1', 'T1']","[{'name': {'honourific': None, 'family': 'Deny Budiyanto', 'lineage': None, 'given': 'Deny Budiyanto'}, 'id': 'deny.budianto@eng.unila.ac.id'}, {'id': 'trisya.septiana@eng.unila.ac.id', 'name': {'given': 'Trisya Septiana', 'honourific': None, 'family': 'Trisya Septiana', 'lineage': None}}, {'name': {'honourific': None, 'family': 'Mona Arif Muda', 'lineage': None, 'given': 'Mona Arif Muda'}, 'id': 'mona.batubara@eng.unila.ac.id'}]",article,"PEMANFAATAN ANALISIS SPASIAL UNTUK PEMETAAN RISIKO BENCANA ALAM TSUNAMI MENGGUNAKAN PENGOLAHAN DATA SPASIAL SISTEM INFORMASI GEOGRAFIS (STUDI KASUS : DI PESISIR LAMPUNG SELATAN, PROVINSI LAMPUNG)",2020-07-20 04:34:04,show,public,2406-7857 (Print); 2443-406X (Online),pub,,Universitas Lambung Mangkurat,"Provinsi Lampung yang terletak diwilayah paling selatan pulau Sumatera juga  merupakan daerah yang rentan bencana, seperti kejadian tsunami dan erupsi gunung anak Krakatau yang terjadi pada 2018 yang mengakibatkan korban jiwa dan kerugian harta benda, Karena Provinsi Lampung adalah wilayah dengan jumlah penduduk yang padat. Salah satu bencana yang mengancam provinsi lampung adalah Tsunami. Ancaman terjadi karena Provinsi Lampung terletak di wilayah yang berbatasan dengan Selat Sunda, dan Samudra Hindia sehingga ada potensi bencana di wilayah ini. Tujuan dari penelitian ini adalah melakukan bagian mitigasi bencana yaitu analisis resiko bencana dengan menggunakan Sistem Informasi Geografis (SIG). Pemetaan tingkat resiko tsunami ini dibuat dalam bentuk zona-zona rawan bencana tsunami serta jalur evakuasi, dan pemetaan ini telah dilakukan pada daerah pesisir Lampung Selatan, Provinsi Lampung

Kata kunci: Sistem Informasi, SIG, Sumatera, Lampung Selatan",2020-06-29 00:00:00.000000000,TRUE,3232,2.0,http://klik.ulm.ac.id/index.php/klik,"[{'language': 'id', 'mime_type': 'application/pdf', 'rev_number': 3, 'content': 'published', 'main': '324-737-1-PB.pdf', 'docid': 36817, 'files': [{'hash_type': 'MD5', 'mtime': '2020-07-02 04:42:06', 'objectid': 36817, 'filesize': 601022, 'filename': '324-737-1-PB.pdf', 'uri': 'http://repository.lppm.unila.ac.id/id/file/212875', 'fileid': 212875, 'datasetid': 'document', 'mime_type': 'application/pdf', 'hash': '85e0c4c58183b3e01d67f0f73f01bd98'}], 'format': 'text', 'pos': 1, 'uri': 'http://repository.lppm.unila.ac.id/id/document/36817', 'security': 'public', 'placement': 1, 'eprintid': 23253}]",2020-07-20 04:34:04,archive,,23253,210-218,,,,,,,"['Universitas Lampung', 'Universitas Lampung', 'Universitas Lampung']","https://en.wikipedia.org/wiki/Lampung| Lampung is a province of Indonesia. Diakses 18-Juni-2020

Dewi C. dkk. (2014). Analisis Pembuatan Peta Zona Rawan Bencana Tsunami Pada Daerah Pesisir ( Studi Lokasi : Pesisir Kota Bandar Lampung). Prosiding Seminar Bisnis dan Teknologi. Bandar Lampung.

Diposapto, S, dan Budiman.2006. Tsunami. Buku Ilmiah Populer, Jakarta.

http://geospasial.bnpb.go.id/2011/10/03/peta-kawasan-rawan-bencana-krb-gunung-anak-krakatau/ | Peta Kawasan Rawan Bencana (KRB) Gunung Anak Krakatau PVMBG (Pusat Vulkanologi dan Mitigasi Bencana Geologi, Diakses 18-Juni-2020

Lillesand.M.T dan R.W. Kieffer, (1990), Pengindraan Jauh dan Interpretasi Citra, Gadjah Mada University Press, Yogyakarta.",,
13,2021-06-04 01:33:44,,14,disk0/00/03/19/04,,['FT8'],,,http://repository.lppm.unila.ac.id/id/eprint/31904,published,['TK'],"[{'name': {'given': 'Yessi', 'honourific': None, 'family': 'Mulyani', 'lineage': None}, 'id': 'yessi.mulyani@eng.unila.ac.id'}, {'name': {'given': 'Muhamad', 'lineage': None, 'family': 'Komarudin', 'honourific': None}, 'id': 'komar@eng.unila.ac.id'}, {'id': 'hery@eng.unila.ac.id', 'name': {'given': 'Septama', 'honourific': None, 'family': 'Hery Dian', 'lineage': None}}]",conference_item,Sistem pakar diagnosis hama dan penyakit pada tanaman lada menggunakan metode backward chaining berbasis android,2021-06-04 01:33:44,show,public,,pub,,,"Lada (Piper nigrum L.) adalah salah satu jenis tanaman rempah yang banyak ditemui di Indonesia. Lada merupakan komoditas ekspor andalan Indonesia. Salah satu daerah utama penghasil lada di Indonesia adalah daerah Lampung. Produksi lada di Lampung dari tahun 2013 hingga tahun 2017 berturut-turut adalah 91.039, 87.448, 81.501, 82.167, 82.964 ton. Naik turunnya produksi lada dipengaruhi oleh beberapa faktor, salah satu faktor penyebabnya adalah hama dan penyakit pada tanaman lada. Bagi orang awam mengidentifikasi hama dan penyakit tanaman merupakan hal yang sulit. Untuk mengidentifikasi penyakit dan hama pada tanaman lada dibutuhkan kepakaran yang dapat membantu mendiagnosis penyakit dan hama sehingga hama dan penyakit dapat teridentifikasi dengan benar. Oleh karena itu dibangun aplikasi sistem pakar diagnosis hama dan penyakit tanaman lada yang diharapkan dapat memberikan informatika tentang hama dan penyakit pada tanaman lada, serta mebantu dalam proses identifikasi secara cepat dan tepat. Sistem pakar yang dikembangkan menggunakan metode ESDLC (Expert System Development Life Cycle) dan teknik inferensi backward chaining untuk mendiagnosa hama dan penyakit tanaman lada berdasarkan gejala-gejala yang ditimbulkan. Pengetahuan (knowledge) pada teknik inferensi backward chaining didesain menggunakan pohon keputusan. Sistem pakar yang dikembangkan dapat mengidentifikasi 15 penyakit dengan 45 gejala dan 7 hama dengan 25 gejala. Pengujian pada aplikasi sistem pakar ini terdiri dari pengujian internal dan pegujian eksternal. Pengujian internal menggunakan metode black-box testing dengan hasil pengujian seluruh fitur sistem dapat berjalan sesuai dengan fungsinya. Pengujian eksternal dilakukan dengan cara mengumpulkan kuisioner yang diisi oleh 30 respoden dengan presentase penilaian rata-rata yang diperoleh sebesar 88,33%.",1970-01-01 00:00:00.000002020,TRUE,159,,http://sinta.eng.unila.ac.id/prosiding/index.php/ojs/article/view/27,"[{'placement': 1, 'eprintid': 31904, 'pos': 1, 'uri': 'http://repository.lppm.unila.ac.id/id/document/144488', 'security': 'public', 'main': 'Publikasi di  Prosiding SINTA 2020.pdf', 'files': [{'uri': 'http://repository.lppm.unila.ac.id/id/file/377634', 'filename': 'Publikasi di  Prosiding SINTA 2020.pdf', 'objectid': 144488, 'filesize': 433395, 'mtime': '2021-06-03 09:25:38', 'hash_type': 'MD5', 'mime_type': 'application/pdf', 'hash': '0d0297ed530a445d5ea419874db2e85f', 'datasetid': 'document', 'fileid': 377634}], 'docid': 144488, 'format': 'text', 'rev_number': 2, 'language': 'en', 'mime_type': 'application/pdf', 'content': 'published'}, {'main': 'Publikasi di  Prosiding SINTA 2020.pdf', 'files': [{'fileid': 377639, 'datasetid': 'document', 'mime_type': 'application/pdf', 'hash': '0d0297ed530a445d5ea419874db2e85f', 'hash_type': 'MD5', 'mtime': '2021-06-03 09:29:21', 'filesize': 433395, 'objectid': 144489, 'filename': 'Publikasi di  Prosiding SINTA 2020.pdf', 'uri': 'http://repository.lppm.unila.ac.id/id/file/377639'}], 'docid': 144489, 'format': 'text', 'mime_type': 'application/pdf', 'language': 'en', 'rev_number': 1, 'placement': 2, 'eprintid': 31904, 'pos': 2, 'uri': 'http://repository.lppm.unila.ac.id/id/document/144489', 'security': 'public'}]",2021-06-04 01:33:44,archive,,31904,,paper,SINTA FT,conference,,,Bandar Lampung,,,,
