,status_changed,succeeds,rev_number,dir,publication,divisions,funders,volume,uri,date_type,subjects,creators,type,title,lastmod,metadata_visibility,full_text_status,issn,ispublished,related_url,publisher,abstract,date,refereed,userid,number,official_url,documents,datestamp,eprint_status,id_number,eprintid,pagerange,pres_type,event_title,event_type,patent_applicant,event_dates,event_location,corp_creators,referencetext,contributors,contact_email
0,2023-03-31 00:49:20,26173.0,8,disk0_bak/00/04/94/64,TEPIAN,['FT8'],['Lembaga Penelitian dan Pengabdian Kepada Masyarakat'],1.0,http://repository.lppm.unila.ac.id/id/eprint/49464,published,"['T1', 'T201']","[{'name': {'given': 'Mardiana', 'lineage': None, 'family': '.', 'honourific': None}, 'id': 'mardiana@eng.unila.ac.id'}, {'name': {'given': 'Fahreza Apriyoga', 'honourific': None, 'family': 'Arizal', 'lineage': None}, 'id': 'fahrezapaw@gmail.com'}, {'id': 'meizano@eng.unila.ac.id', 'name': {'given': 'Meizano Ardhi', 'lineage': None, 'family': 'Muhammad', 'honourific': None}}, {'name': {'given': 'Martinus', 'honourific': None, 'family': '.', 'lineage': None}, 'id': 'martinus@eng.unila.ac.id'}, {'name': {'lineage': None, 'family': 'Djausal', 'honourific': None, 'given': 'Gita Paramita'}, 'id': 'gita.djausal@fisip.unila.ac.id'}]",article,Word Per Minute (WPM) Lampung Script Keyboard,2023-03-31 00:49:20,show,public,2721-5350,pub,"[{'url': 'http://e-journal.politanisamarinda.ac.id/index.php/tepian/index', 'type': 'pub'}]",Politeknik Pertanian Negeri Samarinda,"Users of Font Lampung in previous studies have difficulty in typing because the layout of the Lampung script is complicated to understand. Re-designing the Lampung alphabet keyboard layout allows users to be able to type text in characters more easily. The purpose of this research is to create a Lampung alphabet keyboard layout for more effective typing of the Lampung alphabet. The methods used are UX (User Experience) that are, requirements gathering, alternative design, prototype, evaluation, and result report generation. The layout design is created by eliminating the use of the SHIFT key and regrouping parent letters, the child letters in a more effective composition. The layout design of the Lampung alphabet was printed using the Laser Engraver tool on the keyboard. Through the test, the typing speed increased to 208% of the average value of 62 seconds to 32 seconds. In addition to the results of WPM (Word Per Minute) on keyboard layouts with 8.7 WPM which is faster than previous WPM research but still slower than QWERTY keyboard WPM. Testing of character quality, readability, and difficulty level to know the flaws in the Lampung RaTaYa keyboard layout with good results. This research concludes that the keyboard layout of Lampung RaTaYa is more effective than using the font Lampung script.",2020-09-28 00:00:00.000000000,TRUE,1199,3.0,http://e-journal.politanisamarinda.ac.id/index.php/tepian/article/view/147,"[{'format': 'text', 'files': [{'fileid': 536680, 'datasetid': 'document', 'hash': '18eda8139129ceb1959cc333377c1778', 'mime_type': 'application/pdf', 'hash_type': 'MD5', 'mtime': '2020-11-19 02:48:02', 'objectid': 189043, 'filesize': 316652, 'filename': '147-Article Text-408-1-10-20200928.pdf', 'uri': 'http://repository.lppm.unila.ac.id/id/file/536680'}], 'main': '147-Article Text-408-1-10-20200928.pdf', 'docid': 189043, 'content': 'published', 'rev_number': 3, 'language': 'en', 'mime_type': 'application/pdf', 'eprintid': 49464, 'placement': 1, 'security': 'public', 'formatdesc': 'Artikel', 'uri': 'http://repository.lppm.unila.ac.id/id/document/189043', 'pos': 1}, {'eprintid': 49464, 'placement': 7, 'formatdesc': 'Similiarity', 'security': 'public', 'pos': 7, 'uri': 'http://repository.lppm.unila.ac.id/id/document/189049', 'format': 'text', 'files': [{'hash_type': 'MD5', 'mtime': '2023-03-30 18:01:26', 'objectid': 189049, 'filesize': 348299, 'filename': 'meizano+martinus-2020-jurnal-WPM_Keyboard_Lampung.pdf.pdf', 'uri': 'http://repository.lppm.unila.ac.id/id/file/536687', 'fileid': 536687, 'datasetid': 'document', 'hash': '6ef93714351d72a40ca5512a98360c63', 'mime_type': 'application/pdf'}], 'main': 'meizano+martinus-2020-jurnal-WPM_Keyboard_Lampung.pdf.pdf', 'docid': 189049, 'content': 'other', 'mime_type': 'application/pdf', 'language': 'en', 'rev_number': 2}, {'placement': 8, 'eprintid': 49464, 'pos': 8, 'uri': 'http://repository.lppm.unila.ac.id/id/document/189050', 'security': 'public', 'formatdesc': 'Korespondensi M2', 'main': 'meizano-korespondensi-(Word Per Minute) WPM Keyboard Aksara Lampung.pdf', 'docid': 189050, 'files': [{'hash_type': 'MD5', 'mtime': '2023-03-30 18:01:35', 'objectid': 189050, 'filesize': 287409, 'uri': 'http://repository.lppm.unila.ac.id/id/file/536689', 'filename': 'meizano-korespondensi-(Word Per Minute) WPM Keyboard Aksara Lampung.pdf', 'fileid': 536689, 'datasetid': 'document', 'mime_type': 'application/pdf', 'hash': '936772aaa8f1f5b14219316ee64308e3'}], 'format': 'text', 'language': 'en', 'rev_number': 2, 'mime_type': 'application/pdf', 'content': 'other'}, {'placement': 9, 'eprintid': 49464, 'uri': 'http://repository.lppm.unila.ac.id/id/document/189051', 'pos': 9, 'formatdesc': 'Korespondensi M1', 'security': 'public', 'docid': 189051, 'main': 'martinus-korespondensi-(Word Per Minute) WPM Keyboard Aksara Lampung.pdf', 'files': [{'filesize': 218245, 'objectid': 189051, 'uri': 'http://repository.lppm.unila.ac.id/id/file/536691', 'filename': 'martinus-korespondensi-(Word Per Minute) WPM Keyboard Aksara Lampung.pdf', 'hash_type': 'MD5', 'mtime': '2023-03-30 18:01:42', 'fileid': 536691, 'datasetid': 'document', 'mime_type': 'application/pdf', 'hash': 'dbbb47cebeb5fa7bf3e214a480000c19'}], 'format': 'text', 'mime_type': 'application/pdf', 'language': 'en', 'rev_number': 2, 'content': 'other'}]",2023-03-31 00:49:20,archive,147,49464,79-83,,,,,,,,,,
1,2022-04-06 06:08:52,,7,disk0/00/04/11/19,TEPIAN,['FT8'],,1.0,http://repository.lppm.unila.ac.id/id/eprint/41119,published,['T1'],"[{'name': {'honourific': None, 'family': '.', 'lineage': None, 'given': 'Mardiana'}, 'id': 'mardiana@eng.unila.ac.id'}, {'name': {'honourific': None, 'lineage': None, 'family': 'Arizal', 'given': 'Fahreza Apriyoga'}, 'id': 'fahrezapaw@gmail.com'}, {'id': 'meizano@eng.unila.ac.id', 'name': {'lineage': None, 'family': 'Muhammad', 'honourific': None, 'given': 'Meizano Ardhi'}}, {'id': 'martinus@eng.unila.ac.id', 'name': {'family': '.', 'lineage': None, 'honourific': None, 'given': 'Martinus'}}, {'id': 'gita.djausal@fisip.unila.ac.id', 'name': {'given': 'Gita Paramita', 'lineage': None, 'family': 'Djausal', 'honourific': None}}]",article,Word Per Minute (WPM) Lampung Script Keyboard - Full Cover,2022-04-06 06:08:52,show,public,2721-5350,pub,,Politeknik Pertanian Negeri Samarinda,"Users of Font Lampung in previous studies have difficulty in typing because the layout of the Lampung script is complicated to understand. Re-designing the Lampung alphabet keyboard layout allows users to be able to type text in characters more easily. The purpose of this research is to create a Lampung alphabet keyboard layout for more effective typing of the Lampung alphabet. The methods used are UX (User Experience) that are, requirements gathering, alternative design, prototype, evaluation, and result report generation. The layout design is created by eliminating the use of the SHIFT key and regrouping parent letters, the child letters in a more effective composition. The layout design of the Lampung alphabet was printed using the Laser Engraver tool on the keyboard. Through the test, the typing speed increased to 208% of the average value of 62 seconds to 32 seconds. In addition to the results of WPM (Word Per Minute) on keyboard layouts with 8.7 WPM which is faster than previous WPM research but still slower than QWERTY keyboard WPM. Testing of character quality, readability, and difficulty level to know the flaws in the Lampung RaTaYa keyboard layout with good results. This research concludes that the keyboard layout of Lampung RaTaYa is more effective than using the font Lampung script.",1970-01-01 00:00:00.000002020,FALSE,517,3.0,http://e-journal.politanisamarinda.ac.id/index.php/tepian/article/view/147/109,"[{'format': 'text', 'main': 'Word Per Minute (WPM) Lampung Script Keyboard.pdf', 'docid': 162547, 'files': [{'uri': 'http://repository.lppm.unila.ac.id/id/file/456486', 'filename': 'Word Per Minute (WPM) Lampung Script Keyboard.pdf', 'objectid': 162547, 'filesize': 600804, 'mtime': '2022-04-06 04:46:17', 'hash_type': 'MD5', 'hash': '70310fd080c0a931f26affb0caae9e90', 'mime_type': 'application/pdf', 'datasetid': 'document', 'fileid': 456486}], 'language': 'en', 'mime_type': 'application/pdf', 'rev_number': 1, 'eprintid': 41119, 'placement': 1, 'security': 'public', 'uri': 'http://repository.lppm.unila.ac.id/id/document/162547', 'pos': 1}]",2022-04-06 06:08:52,archive,,41119,79-83,,,,,,,,,,
2,2022-04-06 06:45:43,,7,disk0/00/04/11/38,,['FT8'],,,http://repository.lppm.unila.ac.id/id/eprint/41138,published,['T1'],"[{'name': {'honourific': None, 'lineage': None, 'family': '.', 'given': 'Mardiana'}, 'id': 'mardiana@eng.unila.ac.id'}, {'name': {'given': 'Meizano Ardhi', 'lineage': None, 'family': 'Muhammad', 'honourific': None}, 'id': 'meizano@eng.unila.ac.id'}, {'id': 'yessi.mulyani@eng.unila.ac.id', 'name': {'honourific': None, 'family': 'Mulyani', 'lineage': None, 'given': 'Yessi'}}]",conference_item,Library Attendance System using YOLOv5 Faces Recognition - Full Cover,2022-04-06 06:45:43,show,public,,pub,,,"Recognizing a large number of faces at the same time is an algorithmic and computational challenge. The integration of a facial recognition system with an existing automation system in a library is also a big challenge because of the many sub-systems that operate in it. The aim is to develop a prototype of a library attendance system to assist library management related to facial recognition of users who visit the library. This study uses image processing focuses on object detection using the YOLOv5 algorithm. The library attendance system integrates 3 sub-systems: API service, face recognition using YOLOv5, and visitor identification system. The results obtained are that the library attendance system can function properly, can read the API service, and display information on the results of face detection therefore the system can be used by the existing library automation system.",1970-01-01 00:00:00.000002020,TRUE,517,,https://ieeexplore.ieee.org/document/9650628,"[{'mime_type': 'application/pdf', 'language': 'en', 'rev_number': 1, 'format': 'text', 'docid': 162596, 'main': 'Library Attendance System using YOLOv5 Faces Recognition.pdf', 'files': [{'objectid': 162596, 'filesize': 1448245, 'filename': 'Library Attendance System using YOLOv5 Faces Recognition.pdf', 'uri': 'http://repository.lppm.unila.ac.id/id/file/456674', 'hash_type': 'MD5', 'mtime': '2022-04-06 06:29:01', 'datasetid': 'document', 'fileid': 456674, 'mime_type': 'application/pdf', 'hash': 'dfc4f9e494693ef719fcab9c1c767049'}], 'security': 'public', 'pos': 1, 'uri': 'http://repository.lppm.unila.ac.id/id/document/162596', 'eprintid': 41138, 'placement': 1}]",2022-04-06 06:45:43,archive,,41138,,paper,International Conference on Converging Technology in Electrical and Information Engineering (ICCTEIE),conference,,,,,,,
3,2020-05-28 11:49:16,,16,disk0/00/02/08/84,Jurnal Teknologi Informasi dan Ilmu Komputer (JTIIK),['FT8'],,7.0,http://repository.lppm.unila.ac.id/id/eprint/20884,published,['T1'],"[{'name': {'lineage': None, 'family': '.', 'honourific': None, 'given': 'Mardiana'}, 'id': 'mardiana@eng.unila.ac.id'}, {'id': 'meizano@eng.unila.ac.id', 'name': {'given': 'Meizano Ardhi', 'family': 'Muhammad', 'lineage': None, 'honourific': None}}, {'name': {'given': 'Wahyu Eko', 'honourific': None, 'family': 'Sulistiono', 'lineage': None}, 'id': 'eko@eng.unila.ac.id'}, {'id': 'gitadjausal@gmail.com', 'name': {'given': 'Gita Paramita', 'family': 'Djausal', 'lineage': None, 'honourific': None}}]",article,AUGMENTED REALITY PELACAK LOKASI PUSTAKA DENGAN AR MARKER,2022-12-05 04:17:43,show,public,2528-6579,pub,[{'url': 'http://dx.doi.org/10.25126/jtiik.202071'}],"Fakultas Ilmu Komputer (FILKOM), Universitas Brawijaya (UB)","Teknologi AugmentedReality(AR)  saat  ini  banyak  digunakan  untuk  penyebaran  informasi  dan  bahkan  untuk transaksi pada pelayanan yang bersifat publik.Teknologi ini sudah cukup dikenal oleh masyarakat luas, bersamaan dengan dikenalnya teknologi Virtual Reality(VR) yang banyak digunakan pada permainan (game).Pengunjung Perpustakaan,  terutama  di  Universitas,  sebagian  besar  merupakan  masyarakat  dengan  kategori  generasi digital native.Untuk  menemukan  lokasi  buku,  waktu  yang  dibutuhkan  oleh  pengunjung  perpustakaan  biasanya  relatif lama  dan  sangat  tergantung  dari  pengalaman  kunjungan  atau  frekuensi  pencarian  yang  dilakukan.Pengunjung perpustakaan  memerlukan  aplikasi  yang  memudahkan  mereka  melacak  dan  menemukan  lokasi  koleksi  pustaka yang  dicari, dengan  menggunakan  ponsel  cerdas  mereka.Sistem  otomasi  perpustakaan  yang  ada  membantu menyediakan  informasi  lokasi  pustaka  yang  harus  direlasikan  sendiri  oleh  pengunjung  perpustakaan  terhadap tempat  di  gedung  perpustakaan.  AR  memungkinkan  informasi  tersebut  disematkan  di  dunia  nyata,  sehingga memudahkan  pencarian  pustaka.  Penelitian  ini  bertujuan  untuk  mengembangkan perangkat  lunak  layanan perpustakaan  yang  dapat  membantu  pengunjung  menemukan  lokasi  buku  dengan  memanfaatkan  teknologi  AR dan  berbasis AR  Marker.Ruang  lingkup  pengembangan  aplikasi ini  menggunakan metoderekayasa  perangkat lunak RAD. Aplikasi dikembangkan menggunakan metodetemplatematchingdan algoritma A* untuk pathfinding. Skema layanan data pada alikasi terdiri dari empat bagian, yaitu OPAC (Online Public Access Catalog), deteksi lokasi, pathfindingdan navigasi. Lokasi yang dipetakan adalah gedung Perpustakaan Universitas Lampung yang terdiri  dari  3  lantai.Hasil  dari  penelitian  ini  berupa  realisasi  perangkat  lunak  menggunakan  teknologi  AR  yang dapat memvisualisasikan arah menuju lokasi pustaka. Pengujian aplikasi dilakukan dengan skenario (a) pencarian Pustaka  dengan  OPAC,  (b)  mendeteksi  lokasi  (AR),  (c)  komputasi  Pathfinding,  (d)  menampilkan  marker,  dan seluruhnya  memperoleh  hasil  yang  sesuai  dengan requirement.Waktu  komputasipada  perangkat  AR  diukur terhadap  proses  algoritma  A*,  generasi  marker,  dan  total  keseluruhan.  Total  waktu  komputasi  yang  diperlukan adalah  rata-rata  37,379  ms,  modus  44  ms,  dan  median  38  ms.  Secara  keseluruhan  waktu  komputasi  berada  di bawah nilai batas TTI 50 ms.Hasil survei menunjukkan lebih dari 70% pengunjung perpustakaan memiliki User Experience(UX) yang Baik dan Sangat Baik.Kata Kunci: AugmentedReality, Pelacak Lokasi,Navigasi, Perpustakaan, AR Marker, TemplateMatching",2020-02-04 00:00:00.000000000,TRUE,517,1.0,http://jtiik.ub.ac.id/,"[{'content': 'published', 'rev_number': 3, 'language': 'en', 'mime_type': 'application/xml', 'format': 'archive', 'docid': 34268, 'main': 1343, 'files': [{'hash_type': 'MD5', 'mtime': '2020-05-28 10:07:26', 'objectid': 34268, 'filesize': 53593, 'uri': 'http://repository.lppm.unila.ac.id/id/file/195275', 'filename': 1343, 'fileid': 195275, 'datasetid': 'document', 'hash': '37ec48f6c8887493e3108cd7579d2a13', 'mime_type': 'application/xml'}], 'security': 'public', 'pos': 2, 'uri': 'http://repository.lppm.unila.ac.id/id/document/34268', 'eprintid': 20884, 'placement': 2}]",2020-05-28 11:49:16,archive,,20884,77-86,,,,,,,,,,
4,2022-04-06 04:20:05,,7,disk0/00/04/11/03,Jurnal Teknologi Informasi dan Ilmu Komputer (JTIIK),['FT8'],,7.0,http://repository.lppm.unila.ac.id/id/eprint/41103,published,['T1'],"[{'id': 'mardiana@eng.unila.ac.id', 'name': {'given': 'Mardiana', 'honourific': None, 'family': '.', 'lineage': None}}, {'id': 'meizano@eng.unila.ac.id', 'name': {'honourific': None, 'lineage': None, 'family': 'Muhammad', 'given': 'Meizano Ardhi'}}, {'name': {'honourific': None, 'family': 'Sulistiono', 'lineage': None, 'given': 'Wahyu Eko'}, 'id': 'eko@eng.unila.ac.id'}, {'id': 'gita.djausal@fisip.unila.ac.id', 'name': {'lineage': None, 'family': 'Djausal', 'honourific': None, 'given': 'Gita Paramita'}}]",article,AUGMENTED REALITY PELACAK LOKASI PUSTAKA DENGAN AR MARKER - Full Cover,2022-12-05 04:18:28,show,public,2528-6579,pub,,"Fakultas Ilmu Komputer (FILKOM), Universitas Brawijaya (UB)","Teknologi AugmentedReality(AR) saat ini banyak digunakan untuk penyebaran informasi dan bahkan untuk transaksi pada pelayanan yang bersifat publik.Teknologi ini sudah cukup dikenal oleh masyarakat luas, bersamaan dengan dikenalnya teknologi Virtual Reality(VR) yang banyak digunakan pada permainan (game).Pengunjung Perpustakaan, terutama di Universitas, sebagian besar merupakan masyarakat dengan kategori generasi digital native.Untuk menemukan lokasi buku, waktu yang dibutuhkan oleh pengunjung perpustakaan biasanya relatif lama dan sangat tergantung dari pengalaman kunjungan atau frekuensi pencarian yang dilakukan.Pengunjung perpustakaan memerlukan aplikasi yang memudahkan mereka melacak dan menemukan lokasi koleksi pustaka yang dicari, dengan menggunakan ponsel cerdas mereka.Sistem otomasi perpustakaan yang ada membantu menyediakan informasi lokasi pustaka yang harus direlasikan sendiri oleh pengunjung perpustakaan terhadap tempat di gedung perpustakaan. AR memungkinkan informasi tersebut disematkan di dunia nyata, sehingga memudahkan pencarian pustaka. Penelitian ini bertujuan untuk mengembangkan perangkat lunak layanan perpustakaan yang dapat membantu pengunjung menemukan lokasi buku dengan memanfaatkan teknologi AR dan berbasis AR Marker.Ruang lingkup pengembangan aplikasi ini menggunakan metoderekayasa perangkat lunak RAD. Aplikasi dikembangkan menggunakan metodetemplatematchingdan algoritma A* untuk pathfinding. Skema layanan data pada alikasi terdiri dari empat bagian, yaitu OPAC (Online Public Access Catalog), deteksi lokasi, pathfindingdan navigasi. Lokasi yang dipetakan adalah gedung Perpustakaan Universitas Lampung yang terdiri dari 3 lantai.Hasil dari penelitian ini berupa realisasi perangkat lunak menggunakan teknologi AR yang dapat memvisualisasikan arah menuju lokasi pustaka. Pengujian aplikasi dilakukan dengan skenario (a) pencarian Pustaka dengan OPAC, (b) mendeteksi lokasi (AR), (c) komputasi Pathfinding, (d) menampilkan marker, dan seluruhnya memperoleh hasil yang sesuai dengan requirement.Waktu komputasipada perangkat AR diukur terhadap proses algoritma A*, generasi marker, dan total keseluruhan. Total waktu komputasi yang diperlukan adalah rata-rata 37,379 ms, modus 44 ms, dan median 38 ms. Secara keseluruhan waktu komputasi berada di bawah nilai batas TTI 50 ms.Hasil survei menunjukkan lebih dari 70% pengunjung perpustakaan memiliki User Experience(UX) yang Baik dan Sangat Baik.Kata Kunci: AugmentedReality, Pelacak Lokasi,Navigasi, Perpustakaan, AR Marker, TemplateMatching",1970-01-01 00:00:00.000002020,TRUE,517,1.0,http://jtiik.ub.ac.id/index.php/jtiik/article/view/1343/pdf,"[{'language': 'en', 'rev_number': 1, 'mime_type': 'application/pdf', 'docid': 162523, 'main': 'AUGMENTED REALITY PELACAK LOKASI PUSTAKA DENGAN AR.pdf', 'files': [{'fileid': 456345, 'datasetid': 'document', 'hash': '20666f9c7412e2daa92794c5a84c0077', 'mime_type': 'application/pdf', 'hash_type': 'MD5', 'mtime': '2022-04-06 03:48:35', 'filesize': 943092, 'objectid': 162523, 'filename': 'AUGMENTED REALITY PELACAK LOKASI PUSTAKA DENGAN AR.pdf', 'uri': 'http://repository.lppm.unila.ac.id/id/file/456345'}], 'format': 'text', 'uri': 'http://repository.lppm.unila.ac.id/id/document/162523', 'pos': 1, 'security': 'public', 'placement': 1, 'eprintid': 41103}]",2022-04-06 04:20:05,archive,http://dx.doi.org/10.25126/jtiik.202071,41103,77-86,,,,,,,,,,
5,2020-09-21 03:29:01,,11,disk0/00/02/41/04,,['FT8'],['Universitas Lampung'],,http://repository.lppm.unila.ac.id/id/eprint/24104,published,"['T1', 'T201', 'Z665', 'Z719']","[{'id': 'mardiana@eng.unila.ac.id', 'name': {'lineage': None, 'family': '.', 'honourific': None, 'given': 'Mardiana'}}, {'id': 'meizano@eng.unila.ac.id', 'name': {'given': 'Meizano Ardhi', 'honourific': None, 'family': 'Muhammad', 'lineage': None}}, {'name': {'lineage': None, 'family': 'Sulistiono', 'honourific': None, 'given': 'Wahyu Eko'}, 'id': 'eko@eng.unila.ac.id'}, {'id': 'gita.djausal@fisip.unila.ac.id', 'name': {'given': 'Gita Paramita', 'family': 'Djausal', 'lineage': None, 'honourific': None}}]",patent,SISTEM NAVIGASI PADA PERPUSTAKAAN MENGGUNAKAN AR (AUGMENTED REALITY) UNTUK MENDETEKSI LOKASI BUKU BERADA,2020-09-21 03:29:01,show,public,,pub,,,"Invensi ini merupakan penerapan teknologi navigasi menggunakan augmented reality dan sistem otomasi perpustakaan yang bertujuan untuk membantu navigasi dalam pencarian buku berada oleh pemustaka pada Perpustakaan. Sistem Navigasi Pada Perpustakaan Menggunakan AR Untuk Mendeteksi Lokasi Buku Berada dimana sistem otomasi perpustakaan melakukan pencarian pustaka yang menghasilkan nomor katalog, sistem otomasi perpustakaan mengirim nomor katalog ke sistem pathfinding, sistem pathfinding melakukan komputasi jalur (path) yang harus dilalui dan mengirimkan daftar jalur yang dilewati ke sistem navigasi AR, sistem navigasi AR melakukan Komputasi jalur (path) yang harus dilalui, mengirimkan daftar jalur yang dilewati ke sistem navigasi AR.",2020-02-28 00:00:00.000000000,,1199,,https://pdki-indonesia.dgip.go.id/index.php/paten/d3U3YXg4ZWRycFZUKzg5bS8rSDVTUT09,"[{'rev_number': 2, 'language': 'en', 'mime_type': 'application/pdf', 'content': 'published', 'docid': 37807, 'main': 'SID201810089-IDS000002929-Mardiana-Meizano-Wahyu_Eko-Gita.pdf', 'files': [{'fileid': 219472, 'datasetid': 'document', 'mime_type': 'application/pdf', 'hash': '435e4847813d53f8fe01a8e0d322c262', 'hash_type': 'MD5', 'mtime': '2020-09-20 05:25:58', 'filesize': 6325412, 'objectid': 37807, 'filename': 'SID201810089-IDS000002929-Mardiana-Meizano-Wahyu_Eko-Gita.pdf', 'uri': 'http://repository.lppm.unila.ac.id/id/file/219472'}], 'format': 'text', 'uri': 'http://repository.lppm.unila.ac.id/id/document/37807', 'pos': 1, 'security': 'public', 'placement': 1, 'eprintid': 24104}]",2020-09-21 03:29:01,archive,IDS000002929,24104,,,,,Lembaga Penelitian dan Pengabdian kepada Masyarakat Universitas Lampung,,,,,,
6,2022-04-05 08:49:57,,8,disk0/00/04/10/81,,['FT8'],,,http://repository.lppm.unila.ac.id/id/eprint/41081,published,['T1'],"[{'id': 'mardiana@eng.unila.ac.id', 'name': {'honourific': None, 'family': '.', 'lineage': None, 'given': 'Mardiana'}}, {'id': 'meizano@eng.unila.ac.id', 'name': {'given': 'Meizano Ardhi', 'honourific': None, 'family': 'Muhammad', 'lineage': None}}, {'name': {'given': 'Wahyu Eko', 'family': 'Sulistiono', 'lineage': None, 'honourific': None}, 'id': 'eko@eng.unila.ac.id'}, {'name': {'given': 'Gita Paramita', 'family': 'Djausal', 'lineage': None, 'honourific': None}, 'id': 'gita.djausal@fisip.unila.ac.id'}]",patent,SISTEM NAVIGASI PADA PERPUSTAKAAN MENGGUNAKAN AR (AUGMENTED REALITY) UNTUK MENDETEKSI LOKASI BUKU BERADA - FULL,2022-12-05 04:24:44,show,public,,pub,,,"Invensi ini merupakan penerapan teknologi navigasi menggunakan augmented reality dan sistem otomasi perpustakaan yang bertujuan untuk membantu navigasi dalam pencarian buku berada oleh pemustaka pada Perpustakaan. Sistem Navigasi Pada Perpustakaan Menggunakan AR Untuk Mendeteksi Lokasi Buku Berada dimana sistem otomasi perpustakaan melakukan pencarian pustaka yang menghasilkan nomor katalog, sistem otomasi perpustakaan mengirim nomor katalog ke sistem pathfinding, sistem pathfinding melakukan komputasi jalur (path) yang harus dilalui dan mengirimkan daftar jalur yang dilewati ke sistem navigasi AR, sistem navigasi AR melakukan Komputasi jalur (path) yang harus dilalui, mengirimkan daftar jalur yang dilewati ke sistem navigasi AR.",1970-01-01 00:00:00.000002020,,517,,,"[{'security': 'public', 'pos': 1, 'uri': 'http://repository.lppm.unila.ac.id/id/document/162504', 'eprintid': 41081, 'placement': 1, 'language': 'en', 'rev_number': 1, 'mime_type': 'application/pdf', 'format': 'text', 'main': 'SID201810089-IDS000002929-Paten (1).pdf', 'files': [{'fileid': 456196, 'datasetid': 'document', 'mime_type': 'application/pdf', 'hash': 'cc28812356588aa0038071ed8f54e38d', 'hash_type': 'MD5', 'mtime': '2022-04-05 08:35:34', 'objectid': 162504, 'filesize': 896909, 'uri': 'http://repository.lppm.unila.ac.id/id/file/456196', 'filename': 'SID201810089-IDS000002929-Paten (1).pdf'}], 'docid': 162504}]",2022-04-05 08:49:57,archive,IDS000002929,41081,,,,,LPPM Unila,,,,,,
