,status_changed,succeeds,rev_number,dir,publication,divisions,funders,volume,uri,date_type,subjects,creators,type,title,lastmod,metadata_visibility,full_text_status,issn,ispublished,related_url,publisher,abstract,date,refereed,userid,number,official_url,documents,datestamp,eprint_status,id_number,eprintid,pagerange,pres_type,event_title,event_type,patent_applicant,event_dates,event_location,corp_creators,referencetext,contributors,contact_email
22,2020-07-02 02:13:13,,7,disk0/00/02/29/49,Jurnal TIPS : Teknologi Informasi dan Komputer Politeknik Sekayu,['FT8'],,10.0,http://repository.lppm.unila.ac.id/id/eprint/22949,completed,['QA75'],"[{'name': {'given': 'Ariestia Pradipta', 'family': 'Rio', 'lineage': None, 'honourific': None}, 'id': 'rio.ariestia@eng.unila.ac.id'}, {'name': {'given': 'Annisa', 'lineage': None, 'family': 'Resty', 'honourific': None}, 'id': 'resty.annisa@eng.unila.ac.id'}, {'id': None, 'name': {'given': 'Afriansyah', 'honourific': None, 'lineage': None, 'family': 'Aidil'}}, {'id': None, 'name': {'given': 'Hamdani', 'family': 'Dani', 'lineage': None, 'honourific': None}}]",article,Perancangan Sistem Monitoring Jaringan Internet Menggunakan Transparent Proxy Pada PT Indonesia Comnet Plus,2020-07-02 02:13:13,show,public,2407-2192,pub,"[{'type': 'author', 'url': 'https://jurnal.polsky.ac.id/index.php/tips/article/view/224'}]",Program Studi Teknik Informatika Politeknik Sekayu,Sebagai salah satu penyedia jasa layanan internet PT Indonesia Comnets Plus (ICON+) mempunyai kewajiban untuk memberikan pelayanan yang baik bagi seluruh pelanggan yang menggunakan layanannya. Untuk menyediakan kehandalan yang prima pada jaringan maka dibutuhkan sebuah sistem yang berjalan untuk memantau aktifitas pada layanan yang tersedia. Sistem monitoring jaringan internet menyajikan informasi mengenai kondisi jaringan dan pengunaan utilisasi pada jaringan yang berjalan. Sistem monitoring ini akan membantu operasional jaringan telekomunikasi yang dimiliki oleh PT ICON+ sehingga memberikan kenyamanan dan kehandalan pada layanan jaringan internet. Penggunaan transparent web proxy akan memberikan fungsi tambahan yang sangat berguna dan dibutuhkan oleh system monitoring jaringan. Cara kerjanya adalah dengan merekam seluruh pesan berupa log dari trafik yang melewati jaringan perusahaan.Sehingga aktifitas pengguna dapat disimpan dan diketahui sehingga efektifitas pada penggunaan layanan internet dapat dicapai. Hasil yang didapatkan dari log yang tersimpan dapat digunakan sebagai salah satu sumber informasi referensi yang dapat digunakan untuk melakukan optimalisasi layanan jaringan internet perusahaan.,2020-06-30 00:00:00.000000000,TRUE,3233,1.0,https://jurnal.polsky.ac.id/index.php/tips/index,"[{'eprintid': 22949, 'placement': 1, 'license': 'cc_by_nc_4', 'formatdesc': 'Journal Article', 'security': 'public', 'uri': 'http://repository.lppm.unila.ac.id/id/document/36492', 'pos': 1, 'format': 'text', 'main': 'document (1).pdf', 'files': [{'hash': 'aeb651cf926f64a8206d4887f92ff882', 'mime_type': 'application/pdf', 'datasetid': 'document', 'fileid': 210472, 'filename': 'document (1).pdf', 'uri': 'http://repository.lppm.unila.ac.id/id/file/210472', 'filesize': 338468, 'objectid': 36492, 'mtime': '2020-07-01 15:09:38', 'hash_type': 'MD5'}], 'docid': 36492, 'content': 'published', 'mime_type': 'application/pdf', 'language': 'id', 'rev_number': 2}]",2020-07-02 02:13:13,archive,,22949,37-44,,,,,,,,,[{'type': 'http://www.loc.gov/loc.terms/relators/AUT'}],
23,2022-07-13 06:29:07,,8,disk0/00/04/32/66,,['FT8'],,,http://repository.lppm.unila.ac.id/id/eprint/43266,published,"['Q1', 'QE']","[{'id': 'catur3712@gmail.com', 'name': {'given': 'Rahmat Catur', 'honourific': None, 'family': 'Wibowo', 'lineage': None}}, {'id': None, 'name': {'given': 'Suci', 'family': 'Ariska', 'lineage': None, 'honourific': None}}, {'name': {'given': 'Ordas', 'family': 'Dewanto', 'lineage': None, 'honourific': None}, 'id': 'ordas.dewanto@eng.unila.ac.id'}]",other,Inversi Geostatistik Menggunakan Analisa Multi-atribut Stepwise Regression untuk Karakterisasi Reservoir,2022-07-13 06:29:07,show,public,,pub,,Pusat Penelitian Geoteknologi LIPI,"Eksplorasi  dan  produksi  pada reservoir  tight  sand  sampai  saat  ini  masih memiliki tantangan tersendiri karena karakterisitik porositas  dan  permeabilitas  yang  rendah. Penelitian  ini  dilakukan  untuk  menganalisis karakteristik reservoir tight sand berdasarkan peta persebaran  properti  log  menggunakan  inversi impedansi akustik (IA) dan analisis multi-atribut. Analisis multi-atribut stepwise regression adalah suatu  metode  yang  menggunakan  atribut-atribut yang  paling  baik  untuk  memprediksi  log  target dengan melalui proses trial and error. Pemilihan atribut  seismik  yang  tepat  dapat  memberikan penggambaran  zona  target  yang  lebih  baik. Penelitian  ini  dilakukan  untuk  memperoleh  peta struktur  geologi  bawah  permukaan,  volume impedansi  akustik.  Kemudian  dilakukan  analisis multi-atribut untuk mendapatkan prediksi volume property log yang mencakup pseudo gamma-ray, densitas,  dan  porositas  dengan  menggunakan metode stepwise regression. Hasil inversi seismik IA dan analisis multi-atribut stepwise regression menunjukkan reservoir dengan fluida berupa gas, serta  litologi  tight  sand  yang  memiliki  rentang nilai  IA  sebesar  22.000  ((ft/s)*(g/cc))  sampai dengan  45.000  ((ft/s)*(g/cc)),  densitas  2,25  g/cc sampai dengan 2,6 g/cc, dan porositas 5% sampai 12%.  Peta  densitas  dan  porositas  yang  diperoleh dari  analisa  multi-atribut  menunjang  tahap eksplorasi  dan  produksi  jangka  panjang.  Hal tersebut  terkait  upaya  untuk  meningkatkan primary  recovery  dan  tertiary  recovery, pemahaman  tentang  perangkap  stratigrafi,  dan kemenerusan lapisan reservoir.",2020-12-16 00:00:00.000000000,,946,,https://jrisetgeotam.lipi.go.id/index.php/jrisgeotam/article/view/1088,"[{'placement': 1, 'eprintid': 43266, 'uri': 'http://repository.lppm.unila.ac.id/id/document/165130', 'pos': 1, 'security': 'public', 'main': '5. Plagiarism Checker X, Jurnal RISET Geologi dan Pertambangan.pdf', 'files': [{'mime_type': 'application/pdf', 'hash': '752cbbe58b3ce9a67e719bf316d5d3e9', 'datasetid': 'document', 'fileid': 472799, 'mtime': '2022-07-13 04:46:16', 'hash_type': 'MD5', 'uri': 'http://repository.lppm.unila.ac.id/id/file/472799', 'filename': '5. Plagiarism Checker X, Jurnal RISET Geologi dan Pertambangan.pdf', 'objectid': 165130, 'filesize': 191056}], 'docid': 165130, 'format': 'text', 'language': 'en', 'mime_type': 'application/pdf', 'rev_number': 1}]",2022-07-13 06:29:07,archive,,43266,,,,,,,,,,,
24,2020-11-22 11:37:02,,12,disk0/00/02/65/69,SAKAI SAMBAYAN — Jurnal Pengabdian kepada Masyarakat,['FT8'],['Lembaga Penelitian dan Pengabdian Universitas Lampung'],4.0,http://repository.lppm.unila.ac.id/id/eprint/26569,published,['TK'],"[{'id': 'titin.yulianti@eng.unila.ac.id', 'name': {'family': 'Yulianti', 'lineage': None, 'honourific': None, 'given': 'Titin'}}, {'id': 'fx.arinto@eng.unila.ac.id', 'name': {'lineage': None, 'family': 'Setyawan', 'honourific': None, 'given': 'FX. Arinto'}}, {'name': {'lineage': None, 'family': 'Septama', 'honourific': None, 'given': 'Hery Dian'}, 'id': 'hery@eng.unila.ac.id'}, {'id': 'afri.yudamson@eng.unila.ac.id', 'name': {'lineage': None, 'family': 'Yudamson', 'honourific': None, 'given': 'Afri'}}, {'id': 'komar@eng.unila.ac.id', 'name': {'honourific': None, 'lineage': None, 'family': 'Komarudin', 'given': 'Muhamad'}}]",article,PEMBUATAN RUNNING TEXT BERBASIS ARDUINO DENGAN KONEKASI BLUETOOTH UNTUK MENINGKATKAN IPTEKS KARANG TARUNA DESA PADANG CERMIN,2020-11-22 11:37:02,show,public,ISSN 2550-1089,pub,"[{'type': 'pub', 'url': 'http://jss.lppm.unila.ac.id/index.php/ojs/article/view/225'}]",Lembaga Penelitian dan Pengabdian Universitas Lampung,"Karang taruna merupakan wadah pembinaan dan pengembangan potensi sumber daya manusia bagi generasi muda di suatu  desa/kelurahan.  Demikian  halnya  dengan  karang  taruna  desa  Padang  Cermin  kecamatan  Padang  Cermin Kabupaten  Pesawaran.  Belum  adanya  pusat  pelatihan  bidang  elektronika  dan  teknologi  di  Desa  tersebut  menjadi persoalan  bagi  pemuda  untuk  meningkatkan  softskill.  Padahal,  softskill  merupakan  hal  yang  dibutuhkan  baik  dalam dunia kerja maupun usaha mandiri. Oleh karena itu, untuk meningkatkan softskill pemuda desa Padang Cermin, melalui kegiatan  pengabdian  kepada  masyarakat  ini  diberikan  pelatihan  secara  langsung  proses  pembuatan  Running  text berbasis arduino yang terkoneksi dengan smartphone melalui media bluetooth. Keunggulan Running text yang dibuat yaitu  pengaturan  tampilan  teks  dapat  dilakukan  melalui  smartphone  yang  terkoneksi  bluetooth.  Kegiatan  pengabdian kepada  masyarakat  ini  bermanfaat  untuk  menambah  pengetahuan  dan  keterampilan  peserta  yaitu  pemuda  Karang Taruna desa Padang Cermin dalam rangka peningkatan sumber daya manusia di bidang IPTEKS. Dengan kegiatan ini juga dapat meningkatkan kreatifitas peserta dalam memanfaatkan teknologi untuk menciptakan alat yang inovatif. Hal ini  tentunya  menambah  softskill  sehingga  dapat  berkompetisi  di  dunia  kerja,  serta  membuka  peluang  untuk  membuat usaha pemesanan pembuatan running text dari pihak luar. Dengan demikian, peningkatan IPTEKS ini bermanfaat untuk peningkatan ekonomi masyarakat khususnya pemuda Karang Taruna. Antusiasme peserta dalam kegiatan ini tercermin dari hasil kuisioner. Para peserta berharap untuk diadakan kegiatan lanjutan terkait penerapan teknologi.",2020-07-01 00:00:00.000000000,TRUE,197,2.0,http://jss.lppm.unila.ac.id/index.php/ojs/issue/view/11,"[{'rev_number': 1, 'language': 'en', 'mime_type': 'application/pdf', 'main': 'JSS Vol 4 No 2.pdf', 'files': [{'fileid': 238887, 'datasetid': 'document', 'mime_type': 'application/pdf', 'hash': 'c8f4d92c5a4e8aa51715da251a813cfc', 'objectid': 40467, 'filesize': 807163, 'filename': 'JSS Vol 4 No 2.pdf', 'uri': 'http://repository.lppm.unila.ac.id/id/file/238887', 'hash_type': 'MD5', 'mtime': '2020-11-22 02:10:50'}], 'docid': 40467, 'format': 'text', 'pos': 2, 'uri': 'http://repository.lppm.unila.ac.id/id/document/40467', 'security': 'public', 'placement': 2, 'eprintid': 26569}]",2020-11-22 11:37:02,archive,http://dx.doi.org/10.23960/jss.v4i2.225,26569,121-126,,,,,,,['Universitas Lampung'],,"[{'type': 'http://www.loc.gov/loc.terms/relators/AUT'}, {'type': 'http://www.loc.gov/loc.terms/relators/AUT'}, {'type': 'http://www.loc.gov/loc.terms/relators/AUT'}, {'type': 'http://www.loc.gov/loc.terms/relators/AUT'}, {'type': 'http://www.loc.gov/loc.terms/relators/AUT'}]",
25,2020-11-19 03:04:20,,7,disk0/00/02/59/76,PEMANFAATAN ANALISIS SPASIAL UNTUK PEMETAAN RISIKO BENCANA ALAM TSUNAMI MENGGUNAKAN PENGOLAHAN DATA SPASIAL SISTEM INFORMASI GEOGRAFIS,['FT8'],,7.0,http://repository.lppm.unila.ac.id/id/eprint/25976,published,['T1'],"[{'id': 'deny.budiyanto@eng.unila.ac.id', 'name': {'given': 'deny', 'honourific': None, 'family': 'budiyanto', 'lineage': None}}, {'name': {'given': 'Trisya', 'honourific': None, 'lineage': None, 'family': 'Septiana'}, 'id': 'trisya.septiana@eng.unila.ac.id'}, {'name': {'given': 'mona arif', 'honourific': None, 'lineage': None, 'family': 'batubara'}, 'id': 'mona.batubara@eng.unila.ac.id'}]",article,PEMANFAATAN ANALISIS SPASIAL UNTUK PEMETAAN RISIKO BENCANA ALAM TSUNAMI MENGGUNAKAN PENGOLAHAN DATA SPASIAL SISTEM INFORMASI GEOGRAFIS,2020-11-19 03:04:20,show,public,ISSN: 2406-7857,pub,,Kumpulan jurnaL Ilmu Komputer (KLIK),"Provinsi   Lampung   yang   terletak   diwilayah   paling   selatan   pulau   Sumatera   juga  merupakan daerah yang rentan bencana, seperti kejadian tsunami dan erupsi gunung anak Krakatau yang  terjadi  pada  2018  yang  mengakibatkan  korban  jiwa  dan  kerugian  harta benda,  Karena  Provinsi  Lampung  adalah  wilayah  dengan  jumlah  penduduk  yang  padat. Salah  satu  bencana  yang  mengancam  provinsi  lampung  adalah  Tsunami.  Ancaman  terjadi karena  Provinsi  Lampung  terletak  di  wilayah  yang  berbatasan  dengan  Selat  Sunda,  dan Samudra  Hindia  sehingga  ada  potensi  bencana  di  wilayah  ini.  Tujuan  dari  penelitian  ini adalah   melakukan   bagian   mitigasi   bencana   yaitu   analisis   resiko   bencana   dengan menggunakan Sistem Informasi Geografis (SIG). Pemetaan tingkat resiko tsunami ini dibuat dalam  bentuk  zona-zona  rawan  bencana  tsunami  serta  jalur  evakuasi,  dan  pemetaan  ini telah dilakukan pada daerah pesisir Lampung Selatan, Provinsi Lampung.",2020-06-02 00:00:00.000000000,TRUE,2818,2.0,http://klik.ulm.ac.id/index.php/klik/issue/view/18,"[{'main': 'document (1).pdf', 'docid': 39802, 'files': [{'hash_type': 'MD5', 'mtime': '2020-11-18 02:23:04', 'objectid': 39802, 'filesize': 601022, 'uri': 'http://repository.lppm.unila.ac.id/id/file/234473', 'filename': 'document (1).pdf', 'fileid': 234473, 'datasetid': 'document', 'hash': '85e0c4c58183b3e01d67f0f73f01bd98', 'mime_type': 'application/pdf'}], 'format': 'text', 'language': 'en', 'mime_type': 'application/pdf', 'rev_number': 1, 'placement': 1, 'eprintid': 25976, 'pos': 1, 'uri': 'http://repository.lppm.unila.ac.id/id/document/39802', 'security': 'public'}]",2020-11-19 03:04:20,archive,,25976,210-218,,,,,,,,"[1]  https://en.wikipedia.org/wiki/Lampung| Lampung is a province of Indonesia.
Diakses 18-Juni-2020
[2] Dewi C. dkk. (2014). Analisis Pembuatan Peta Zona Rawan Bencana Tsunami
Pada Daerah Pesisir ( Studi Lokasi : Pesisir Kota Bandar Lampung). Prosiding
Seminar Bisnis dan Teknologi. Bandar Lampung.
[3] Diposapto, S, dan Budiman.2006. Tsunami. Buku Ilmiah Populer, Jakarta.
[4] http://geospasial.bnpb.go.id/2011/10/03/peta-kawasan-rawan-bencana-krb- gunung-anak-krakatau/ | Peta Kawasan Rawan Bencana (KRB) Gunung Anak
Krakatau PVMBG (Pusat Vulkanologi dan Mitigasi Bencana Geologi, Diakses 18- Juni-2020
[5] Lillesand.M.T dan R.W. Kieffer, (1990), Pengindraan Jauh dan Interpretasi Citra, Gadjah Mada University Press, Yogyakarta.","[{'type': 'http://www.loc.gov/loc.terms/relators/AUT', 'name': {'lineage': None, 'family': 'budiyanto', 'honourific': None, 'given': 'deny'}, 'id': 'deny.budiyanto@eng.unila.ac.id'}, {'id': 'trisya.septiana@eng.unila.ac.id', 'type': 'http://www.loc.gov/loc.terms/relators/AUT', 'name': {'honourific': None, 'family': 'Septiana', 'lineage': None, 'given': 'Trisya'}}, {'id': 'mona.batubara@eng.unila.ac.id', 'name': {'honourific': None, 'lineage': None, 'family': 'batubara', 'given': 'mona arif'}, 'type': 'http://www.loc.gov/loc.terms/relators/AUT'}]",
