,status_changed,succeeds,rev_number,dir,publication,divisions,funders,volume,uri,date_type,subjects,creators,type,title,lastmod,metadata_visibility,full_text_status,issn,ispublished,related_url,publisher,abstract,date,refereed,userid,number,official_url,documents,datestamp,eprint_status,id_number,eprintid,pagerange,pres_type,event_title,event_type,patent_applicant,event_dates,event_location,corp_creators,referencetext,contributors,contact_email
14,2020-11-17 01:00:49,,7,disk0/00/02/56/41,BAROMETER,['FT8'],,5.0,http://repository.lppm.unila.ac.id/id/eprint/25641,published,"['T201', 'ZA4050']","[{'name': {'given': 'Yessi', 'honourific': None, 'lineage': None, 'family': 'Mulyani'}, 'id': 'yessi.mulyani@eng.unila.ac.id'}, {'id': 'hery@eng.unila.ac.id', 'name': {'family': 'Septama', 'lineage': None, 'honourific': None, 'given': 'Hery Dian'}}, {'name': {'family': 'Pratama', 'lineage': None, 'honourific': None, 'given': 'Mahendra'}, 'id': 'mahendra.pratama15@eng.unila.ac.id'}, {'id': None, 'name': {'honourific': None, 'family': 'Ardike', 'lineage': None, 'given': 'Nyoman Herman'}}]",article,PENGEMBANGAN SISTEM INFORMASI PENDAFTARAN SEMINAR AKADEMIK DI JURUSAN TEKNIK ELEKTRO FAKULTAS TEKNIK UNIVERSITAS LAMPUNG MENGGUNAKAN METODE RAPID APPLICATION DEVELOPMENT (RAD),2020-11-17 01:00:49,show,public,1979-889X,pub,,Universitas Singaperbangsa Karawang,"Jurusan Teknik Elektro Universitas Lampung memiliki sistem pendaftaran seminar akademik dengan proses administratif manual, terdapat kekurangan dari alur pendaftaran yang sudah ada seperti minimnya informasi yang tersaji dengan cepat dengan pengolahan data tidak terpusat di satu database menyulitkan informasi status pendaftaran, sistem seminar akademik dapat memudahkan proses administratif agar dapat diakses oleh pengguna secara bersamaan melalui browser dengan jaringan internet. Tujuan dari penelitian ini adalah untuk mengembangkan sistem informasi pendaftaran seminar akademik di Jurusan Teknik Elektro Universitas Lampung yang dapat memasukkan, mengelola, serta menampilkan data dengan baik agar menghasilkan informasi yang akurat dan tersaji dengan cepat. Metode RAD (Rapid Application Development) digunakan sebagai panduan untuk membangun sistem informasi pendaftaran seminar akademik. Pengujian dilakukan di setiap fungsi use case pada sistem, kemudian menguji sistem menggunakan metode UEQ, kepada 4 admin TU Jurusan Teknik Elektro, 22 mahasiswa Jurusan Teknik Elektro, 4 Staff IT UPT TIK Universitas Lampung, hasil pengujian sistem pendaftaran seminar akademik memenuhi fungsi yang dibutuhkan 4 aktor, dari 6 kategori menggunakan metode UEQ, benchmark yang didapat adalah 5 point mendapat nilai sangat baik dan 1 point mendapatkan nilai baik.",1970-01-01 00:00:00.000002020,TRUE,3235,1.0,https://journal.unsika.ac.id/index.php/barometer,"[{'main': '2252-Article Text-9593-1-10-20200913.pdf', 'docid': 39446, 'files': [{'fileid': 231054, 'datasetid': 'document', 'mime_type': 'application/pdf', 'hash': '5ae3e7369b34c66bbff385537285a7bc', 'hash_type': 'MD5', 'mtime': '2020-11-16 17:17:19', 'filesize': 776719, 'objectid': 39446, 'filename': '2252-Article Text-9593-1-10-20200913.pdf', 'uri': 'http://repository.lppm.unila.ac.id/id/file/231054'}], 'format': 'text', 'language': 'en', 'rev_number': 1, 'mime_type': 'application/pdf', 'placement': 1, 'eprintid': 25641, 'uri': 'http://repository.lppm.unila.ac.id/id/document/39446', 'pos': 1, 'security': 'public'}]",2020-11-17 01:00:49,archive,,25641,239-244,,,,,,,,,,
15,2022-11-23 08:45:43,,7,disk0/00/04/68/09,Gema Teknologi,['FT8'],,21.0,http://repository.lppm.unila.ac.id/id/eprint/46809,published,['AC'],"[{'id': 'gigih@eng.unila.ac.id', 'name': {'lineage': None, 'family': 'Nama', 'honourific': None, 'given': 'Gigih Forda'}}]",article,PROTOTYPE SISTEM PINTAR PENGELOLAAN TAMAN BUNGA BERBASIS TEKNOLOGI INTERNET OF THINGS(STUDI KASUS TAMAN KUPU-KUPU GITA PERSADA),2022-11-23 08:46:11,show,public,p-ISSN:0852-0232 e-ISSN: 2656-582X,pub,,Universitas Diponegoro,"Usually the process ofwatering and monitoring of plants in the Gita Persada Butterfly Park in Lampung Province is carriedout using conventional methods, this condition create many problems.The research aimsisto create a prototype of flower garden application based on Internet of Things(IoT)technology. An application that can help relieve watering activities and monitoring with automated system developed byprotoypingmethod,that consist  of;communication  stage,  quick plan  and  modelling  quick  design,  construction  of  prototype,  and deployment  delivery  and  feedback.  This  application  use  microcontroller  Arduino  Uno as the main  controller, temperature  sensor,  air  humidity  (DHT11),  soil  humidity,  ultrasonic  sensors    (HC-SR04)  and  application  on smartphones android for monitoring. Data delivery between arduino devices, smartphones and databases using website service.There  is a  firebase  library  on  website  Service  to  connect  to  firebase.  Data  transmitted  by  the device arduino through the protocol http with the command get, send, and push, then received by website Service and forward to be saved on firebase. Based on the data obtained at the air temperature and humidity monitoring around the smart garden for 31 days from April 8 to May 8 , the lowest air temperature is 25°Cat 08.00 WIB, 26 April and the highest air temperature 30 °C at 12.00 WIB, 19 April. The average air humidity value is at 95%.",1970-01-01 00:00:00.000002020,TRUE,1,1.0,,"[{'eprintid': 46809, 'placement': 1, 'security': 'public', 'uri': 'http://repository.lppm.unila.ac.id/id/document/185735', 'pos': 1, 'format': 'text', 'main': 'document (7).pdf', 'docid': 185735, 'files': [{'fileid': 515276, 'datasetid': 'document', 'hash': '54c165a35ef35afb4976d27413ba4469', 'mime_type': 'application/pdf', 'filesize': 688536, 'objectid': 185735, 'filename': 'document (7).pdf', 'uri': 'http://repository.lppm.unila.ac.id/id/file/515276', 'hash_type': 'MD5', 'mtime': '2022-11-23 08:44:12'}], 'rev_number': 1, 'language': 'en', 'mime_type': 'application/pdf'}]",2022-11-23 08:45:43,archive,,46809,,,,,,,,,,,
16,2022-12-06 22:28:16,,7,disk0/00/04/71/49,,['FT8'],,,http://repository.lppm.unila.ac.id/id/eprint/47149,published,['AC'],"[{'id': 'gigih@eng.unila.ac.id', 'name': {'honourific': None, 'family': 'Nama', 'lineage': None, 'given': 'Gigih Forda'}}]",patent,Paten Sederhana Sistem Dashboard IoT Kuantitas Besaran Listrik Tiga Fasa,2022-12-06 22:28:16,show,public,,pub,,,,1970-01-01 00:00:00.000002020,,1,,,"[{'docid': 186110, 'main': 'SID201810090-IDS000002930-Dikrpide_Despa-Meizano-Gigih.pdf', 'files': [{'hash_type': 'MD5', 'mtime': '2022-12-06 22:25:22', 'objectid': 186110, 'filesize': 10721244, 'uri': 'http://repository.lppm.unila.ac.id/id/file/517858', 'filename': 'SID201810090-IDS000002930-Dikrpide_Despa-Meizano-Gigih.pdf', 'datasetid': 'document', 'fileid': 517858, 'hash': '5da6fbac2f0b3558ed100eb0e4e75e9d', 'mime_type': 'application/pdf'}], 'format': 'text', 'language': 'en', 'rev_number': 1, 'mime_type': 'application/pdf', 'placement': 1, 'eprintid': 47149, 'pos': 1, 'uri': 'http://repository.lppm.unila.ac.id/id/document/186110', 'security': 'public'}]",2022-12-06 22:28:16,archive,IDS000002930,47149,,,,,Gigih Forda Nama,,,,,,
17,2020-12-03 00:29:12,,6,disk0/00/02/69/73,Gema Teknologi,['FT8'],,21.0,http://repository.lppm.unila.ac.id/id/eprint/26973,published,['AC'],"[{'id': 'gigih@eng.unila.ac.id', 'name': {'given': 'Gigih Forda', 'honourific': None, 'lineage': None, 'family': 'Nama'}}, {'name': {'honourific': None, 'lineage': None, 'family': 'Komarudin', 'given': 'Muhamad'}, 'id': 'komar@eng.unila.ac.id'}, {'name': {'honourific': None, 'lineage': None, 'family': 'Muhammad', 'given': 'Meizano Ardhi'}, 'id': 'meizano@eng.unila.ac.id'}]",article,PROTOTYPE SISTEM PINTAR PENGELOLAAN TAMAN BUNGA BERBASIS TEKNOLOGI INTERNET OF THINGS (STUDI KASUS TAMAN KUPU-KUPU GITA PERSADA),2020-12-03 00:29:12,show,public,p-ISSN:0852-0232 e-ISSN: 2656-582X,pub,,Universitas Diponegoro,"Usually the process of watering and monitoring of plants in the Gita Persada Butterfly Park in Lampung Province is carried out using conventional methods, this condition create many problems. The research aims is to create a prototype of flower garden application based on Internet of Things (IoT) technology. An application that can help relieve watering activities and monitoring with automated system developed by protoyping method, that consist of; communication stage, quick plan and modelling quick design, construction of prototype, and deployment delivery and feedback. This application use microcontroller Arduino Uno as the main controller, temperature sensor, air humidity (DHT11), soil humidity, ultrasonic sensors  (HC-SR04) and application on smartphones android for monitoring. Data delivery between arduino devices, smartphones and databases using website service. There is a firebase library on website Service to connect to firebase. Data transmitted by the device arduino through the protocol http with the command get, send, and push, then received by website Service and forward to be saved on firebase. Based on the data obtained at the air temperature and humidity monitoring around the smart garden for 31 days from April 8 to May 8 , the lowest air temperature is 25°C at 08.00 WIB, 26 April and the highest air temperature 30 °C at 12.00 WIB, 19 April. The average air humidity value is at 95%.

Keywords: Arduino uno; sensor DHT11; sensor HC-SR04",2020-10-01 00:00:00.000000000,TRUE,3,1.0,http://ejournal.undip.ac.id/index.php/gema_teknologi,"[{'uri': 'http://repository.lppm.unila.ac.id/id/document/40986', 'pos': 1, 'security': 'public', 'placement': 1, 'eprintid': 26973, 'language': 'en', 'rev_number': 1, 'mime_type': 'application/pdf', 'main': '32912-101627-1-PB.pdf', 'docid': 40986, 'files': [{'fileid': 241973, 'datasetid': 'document', 'hash': '54c165a35ef35afb4976d27413ba4469', 'mime_type': 'application/pdf', 'hash_type': 'MD5', 'mtime': '2020-12-03 00:23:21', 'filesize': 688536, 'objectid': 40986, 'filename': '32912-101627-1-PB.pdf', 'uri': 'http://repository.lppm.unila.ac.id/id/file/241973'}], 'format': 'text'}]",2020-12-03 00:29:12,archive,,26973,,,,,,,,,,,
18,2020-11-19 11:37:39,,10,disk0/00/02/61/17,,['FT8'],,,http://repository.lppm.unila.ac.id/id/eprint/26117,submitted,"['QA75', 'QA76']","[{'id': 'rio.ariestia@eng.unila.ac.id', 'name': {'given': 'Rio Ariestia', 'lineage': None, 'family': 'Pradipta', 'honourific': None}}, {'id': None, 'name': {'given': 'Mahendra', 'honourific': None, 'family': 'Pratama', 'lineage': None}}, {'name': {'lineage': None, 'family': 'Muhammad', 'honourific': None, 'given': 'Meizano Ardhi'}, 'id': None}, {'id': None, 'name': {'given': 'Mona Arif Muda', 'honourific': None, 'lineage': None, 'family': 'Batubara'}}]",conference_item,Perancangan sistem portal program studi dengan menggunakan framework laravel dan database postgresql,2020-11-19 11:37:39,show,restricted,,submitted,,,"Program studi Teknik Informatika Universitas Lampung memiliki beberapa sistem informasi untuk menunjang kegiatan administrasi yang mempermudah aktifiitas yang dilakukan oleh mahasiswa, dosen dan juga bagian administrasi. Keseluruhan sistem tersebut berfungsi untuk mempermudah kegiatan administrasi, dokumentasi serta untuk pengembangan aktifitas strategis yang direncanakan dan akan dilaksanakan oleh program studi  pada masa yang akan datang. Untuk mempermudah terjadinya integrasi pada seluruh sistem informasi yang terdapat di program studi maka diperlukan sebuah sistem yang berfungsi sebagai wadah untuk mengintegrasikan keseluruhan sistem yang ada. Tujuan dari penelitian ini adalah memberikan solusi pada program studi Teknik Informatika dalam melakukan integrasi informasi dari beberapa sistem informasi yang berjalan ke dalam sebuah sistem portal berbasiskan web. Penelitian ini dilakukan dengan menggunakan metode pengembangan sistem secara local dimana pengembangan software dilakukan dengan alur Rapid Application Development yang termasuk di dalamnya perancangan sistem menggunakan usecase diagram, class diagram dan struktur navigasi portal. Bahasa pemrograman dalam pengembangan sistem adalah PHP dengan framework Laravel dan menggunakan database PostgreSQL. Metode blackbox digunakan dalam melakukan pengetesan dari sistem portal yang telah dirancang untuk mengetahui kesesuaian antara rancangan dengan sistem portal terbangun. Hasil yang didapatkan adalah kesesuaian antara rancangan dengan portal yang siap untuk diimplementasikan sebagai sebuah sistem informasi.",2020-11-11 00:00:00.000000000,TRUE,3233,,,"[{'placement': 1, 'security': 'staffonly', 'uri': 'http://repository.lppm.unila.ac.id/id/document/39959', 'pos': 1, 'format': 'text', 'docid': 39959, 'main': 'Rio Ariestia Pradipta - Seminar SINTA 2020.pdf', 'files': [{'filesize': 579654, 'objectid': 39959, 'filename': 'Rio Ariestia Pradipta - Seminar SINTA 2020.pdf', 'uri': 'http://repository.lppm.unila.ac.id/id/file/235534', 'hash_type': 'MD5', 'mtime': '2020-11-18 15:49:58', 'datasetid': 'document', 'fileid': 235534, 'mime_type': 'application/pdf', 'hash': '96b1e2f98390a175e43921efd03b9107'}], 'language': 'en', 'rev_number': 4, 'eprintid': 26117, 'license': 'cc_by_nc_sa_4', 'formatdesc': 'Artike Seminar', 'date_embargo': '2020-12-01', 'content': 'presentation', 'mime_type': 'application/pdf'}]",2020-11-19 11:37:39,archive,,26117,,speech,Seminar Nasional Ilmu Teknik dan Aplikasi Industri (SINTA) 2020,conference,,14 Oktober 2020,Bandar Lampung,,,"[{'id': 'rio.ariestia@eng.unila.ac.id', 'name': {'given': 'Rio Ariestia', 'lineage': None, 'family': 'Pradipta', 'honourific': None}, 'type': 'http://www.loc.gov/loc.terms/relators/AUT'}, {'name': {'family': 'Pratama', 'lineage': None, 'honourific': None, 'given': 'Mahendra'}, 'type': None, 'id': None}, {'id': None, 'name': {'given': 'Meizano Ardhi', 'honourific': None, 'family': 'Muhammad', 'lineage': None}, 'type': None}, {'name': {'given': 'Mona Arif Muda', 'family': 'Batubara', 'lineage': None, 'honourific': None}, 'type': None, 'id': None}]",rio.ariestia@eng.unila.ac.id
19,2020-06-04 00:08:41,,9,disk0/00/02/17/16,,['FT8'],,,http://repository.lppm.unila.ac.id/id/eprint/21716,published,['T1'],"[{'id': None, 'name': {'lineage': None, 'family': 'Pramudita Putri', 'honourific': None, 'given': 'Leady'}}, {'name': {'given': 'Meizano Ardhi', 'honourific': None, 'family': 'Muhammad', 'lineage': None}, 'id': 'meizano@eng.unila.ac.id'}, {'id': 'mardiana@eng.unila.ac.id', 'name': {'given': 'Mardiana', 'honourific': None, 'lineage': None, 'family': '.'}}]",conference_item,Rancang Bangun Tiga Dimensi (3D) Interactive Walkthrough sebagai Media Pengenalan Gedung,2020-06-04 00:08:41,show,public,,pub,,,"Dalam pemberitahuan informasi gedung, masih banyak perusahaan atau instansi yang menggunakan maket. Maket adalah salah satu bentuk untuk memperlihatkan penyerupaan gedung dari sisi luar, namun maket tidak dapat melihat seluruh isi gedung dan kurang interaktif. Dengan berkembangnya teknologi, maket dapat digantikan dengan piranti lunak dan teknologi terkini seperti virtual tour. Dari latar belakang diatas yang diangkat maka akan dilakukan penelitian dan membuat suatu sistem yang dapat digunakan dalam menemukan informasi pada Gedung menggunakan virtual tour yang berbasis 3D Interactive Walkthroug. Sistem virtual tour yang berbasis 3D Interactive Walkthrough ini menampilkan informasi-informasi dari setiap bagian-bagian Gedung UPT Perpustakaan Universitas Lampung dalam bentuk 3D Interactive Walkthrough merupakan visualisasi gedung secara 3 dimensi dengan tambahan, pengguna aplikasi dapat berjalan menyusuri seluruh gedung secara visual dan membuat sistem informasi ini lebih interaktif dengan menambahkan teknologi Fisrt Person Control (FPC) yang menggunakan pandangan orang ketiga di mana pemain seolah-olah menjadi karakter utama sehingga membuat user seperti berada di ruangan tersebut. Sistem virtual tour yang berbasis 3D Interactive Walkthrough diharapkan berguna sebagai media informasi yang menggabungkan antara teknologi fotografi dengan teknologi informasi yang memiliki tujuan memberitahukan informasi ruang secara menyeluruh secara interaktif dan inovatif.
Kata kunci : perpustakaan, virtual reality, metode kanban, interactive walkthrough, unity3D",2020-02-01 00:00:00.000000000,FALSE,517,,http://sniper.library.unila.ac.id/2020/05/29/e-prosding-2019/,"[{'uri': 'http://repository.lppm.unila.ac.id/id/document/35109', 'pos': 1, 'security': 'public', 'placement': 1, 'eprintid': 21716, 'language': 'id', 'rev_number': 3, 'mime_type': 'text/html', 'content': 'published', 'docid': 35109, 'main': 'index.html', 'files': [{'uri': 'http://repository.lppm.unila.ac.id/id/file/200941', 'filename': 'index.html', 'objectid': 35109, 'filesize': 30908, 'mtime': '2020-06-03 23:05:43', 'hash_type': 'MD5', 'mime_type': 'text/html', 'hash': '218c21f9c88a5e21b0732ddf59513e30', 'datasetid': 'document', 'fileid': 200941}], 'format': 'archive'}]",2020-06-04 00:08:41,archive,,21716,,paper,SEMINAR NASIONAL INOVASI PERPUSTAKAAN (SNIPer) 2019,conference,,Oktober 2019,Bandar Lampung,,,,
20,2020-07-02 08:13:02,,10,disk0/00/02/29/82,Kumpulan Jurnal Ilmu Komputer (KLIK),['FT8'],,7.0,http://repository.lppm.unila.ac.id/id/eprint/22982,published,['TA'],"[{'id': 'budi.wintoro@eng.unila.ac.id', 'name': {'given': 'Wintoro', 'honourific': None, 'lineage': None, 'family': 'Puput Budi Wintoro'}}, {'id': 'irwanirmawan1996@gmail.com', 'name': {'given': 'Irmawan', 'honourific': None, 'lineage': None, 'family': 'Irwan Irmawan'}}, {'id': 'deny.budianto@eng.unila.ac.id', 'name': {'honourific': None, 'lineage': None, 'family': 'Deny Budiyanto', 'given': 'Budiyanto'}}, {'name': {'given': 'Pradipta', 'honourific': None, 'family': 'Rio Ariestia Pradipta', 'lineage': None}, 'id': 'rio.ariestia@eng.unila.ac.id'}]",article,Virtual Tour 3D Situs Purbakala Pugung Raharjo Lampung Timur,2020-07-02 08:13:02,show,public,2406-7857,pub,"[{'url': 'http://klik.ulm.ac.id/index.php/klik/issue/view/18', 'type': 'pub'}]",Prodi Ilmu Komputer Universitas Lambung Mangkurat,"Situs Purbakala Pugung Raharjo merupakan destinasi wisata sejarah yang berada di Kabupaten Lampung Timur. Situs ini tersimpan jejak peradaban hindu budha yang sekarang berstatus cagar budaya. Perkembangan zaman yang sangat pesat pada saat ini, telah banyak penggunaan teknologi digital sebagai media promosi wisata. Untuk mempromosikan situs purbakala Pugung Raharjo Lampung Timur kepada masyarakat dalam bentuk digital maka dibuatlah sebuah media promosi dengan teknologi virtual tour berbasis android. Aplikasi virtual tour Situs Purbakala Pugung Raharjo ini digunakan untuk memudahkan masyarakat mengetahui dan mengenal lokasi serta benda-benda bersejarah yang ada di situs purbakala Pugung Raharjo secara virtual 3 dimensi. Pada Penelitian ini menggunakan metode MDLC (Multimedia Development Life Cycle). Metode MDLC ini dimulai dengan mengumpulkan bahan, kemudian membuat sebuah desain dan membuat sebuah aplikasi berdasarkan desain yang telah dibuat sebelumnya. Proses terakhir pembuatan aplikasi ini yaitu distribusi kepada masyarakat melalui playstore yang dapat diunduh secara gratis. Hasil penelitian menunjukkan bahwa aplikasi virtual tour ini dapat digunakan sebagai pedoman masyarakat untuk mengetahui serta mengenal situs purbakala Pugung Raharjo.",2020-06-26 00:00:00.000000000,TRUE,3234,2.0,,"[{'security': 'public', 'uri': 'http://repository.lppm.unila.ac.id/id/document/36536', 'pos': 1, 'eprintid': 22982, 'placement': 1, 'content': 'published', 'rev_number': 3, 'language': 'is', 'mime_type': 'application/xml', 'format': 'text', 'main': 318, 'docid': 36536, 'files': [{'hash_type': 'MD5', 'mtime': '2020-07-02 04:14:37', 'objectid': 36536, 'filesize': 23788, 'uri': 'http://repository.lppm.unila.ac.id/id/file/210728', 'filename': 318, 'fileid': 210728, 'datasetid': 'document', 'hash': 'aa830b006854a840049e42ad04e00bb6', 'mime_type': 'application/xml'}]}, {'placement': 2, 'eprintid': 22982, 'uri': 'http://repository.lppm.unila.ac.id/id/document/36537', 'pos': 2, 'security': 'public', 'files': [{'mime_type': 'application/pdf', 'hash': '74a457841b30a9e1e70b21d9e80bfcf6', 'fileid': 210730, 'datasetid': 'document', 'mtime': '2020-07-02 04:23:05', 'hash_type': 'MD5', 'uri': 'http://repository.lppm.unila.ac.id/id/file/210730', 'filename': '318-730-1-PB.pdf', 'objectid': 36537, 'filesize': 408447}], 'main': '318-730-1-PB.pdf', 'docid': 36537, 'format': 'text', 'mime_type': 'application/pdf', 'language': 'en', 'rev_number': 1}]",2020-07-02 08:13:02,archive,,22982,145-153,,,,,,,,,,
21,2023-04-10 07:10:47,,12,disk0/00/02/56/38,,['FT8'],,,http://repository.lppm.unila.ac.id/id/eprint/25638,published,"['L1', 'LB2300', 'T1']","[{'name': {'honourific': None, 'lineage': None, 'family': 'Resty', 'given': 'Annisa'}, 'id': 'resty.annisa@eng.unila.ac.id'}, {'name': {'given': 'Ariestia Pradipta', 'honourific': None, 'family': 'Rio', 'lineage': None}, 'id': 'rio.ariestia@eng.unila.ac.id'}, {'name': {'lineage': None, 'family': 'Mona Arif Muda', 'honourific': None, 'given': 'Mona Arif Muda'}, 'id': 'mona.batubara@eng.unila.ac.id'}, {'name': {'family': 'Mardiana', 'lineage': None, 'honourific': None, 'given': 'Mardiana'}, 'id': None}]",conference_item,"LEARNING MANAGEMENT SYSTEM GOOGLE CLASSROOM: SOLUSI PEMBELAJARAN DARING PADA MASA PANDEMI COVID-19
DI SMA AL HUSNA",2023-04-10 07:10:47,show,public,,pub,"[{'url': 'http://senapati.eng.unila.ac.id/prosiding-2019/', 'type': 'pub'}]",,"Pandemi Covid-19 secara signifikan mengubah dunia pendidikan, termasuk di SMA Al Husna. Adanya wabah virus corona ini mengubah kegiatan pembelajaran secara tatap muka (luring) menjadi pembelajaran secara daring. Penggunaan Learning Management System (LMS) Google Classroom sebagai solusi pengelolaan pembelajaran daring. Kendala yang dihadapi guru adalah kurangnya pengetahuan dan keterampilan dalam mengolah pembelajaran daring menggunakan Learning Management System Google Classroom. Hal ini diatasi dengan pemberian pelatihan pengelolahan pembelajaran daring dari tim Pengabdian Masyarakat Unila. Digunakan Google Classroom sebagai media pembelajaran dikarenakan memberikan fitur pengelolaan materi pelajaran, kelas, quiz, penilaian, forum diskusi dan pelaporan hasil berajar. Selain itu, diberikan juga fasilitas video conference mendukung interaksi virtual saat pembelajaran daring. Berdasarkan hasil pre-test, pengetahuan dan keterampilan guru tentang pengolahan LMS tergolong kurang dengan nilai rata-rata 55. Namun, pada final test, didapatkan hasil yang baik dengan nilai rata-rata 78. Solusi yang diberikan tepat ditujukkan dengan meningkatnya pengetahuan dan keterampilan dari awalnya kurang menjadi baik. Tujuan dari pengabdian masyarakat ini berhasil dicapai dengan menghasilkan guru-guru yang memiliki kemampuan menyiapkan materi ajar text dan video, membuat soal, sistem pemeriksaan latihan dan laporan secara otomatis, serta meningkatkan kemampuan komunikasi inerpersonal.

Kata kunci: Covid-19, Pembelajaran Daring, Learning Management System, Google Classroom, video conference",2020-09-23 00:00:00.000000000,TRUE,2822,,http://senapati.eng.unila.ac.id/prosiding-2019/,"[{'rev_number': 1, 'language': 'en', 'mime_type': 'application/pdf', 'format': 'text', 'main': 'Prosiding 4_SENAPATI 20_FULL.pdf', 'docid': 189783, 'files': [{'filename': 'Prosiding 4_SENAPATI 20_FULL.pdf', 'uri': 'http://repository.lppm.unila.ac.id/id/file/541684', 'filesize': 11478321, 'objectid': 189783, 'mtime': '2023-04-10 07:08:56', 'hash_type': 'MD5', 'mime_type': 'application/pdf', 'hash': '29308946f587ad9b455169e571f7269d', 'datasetid': 'document', 'fileid': 541684}], 'security': 'public', 'pos': 1, 'uri': 'http://repository.lppm.unila.ac.id/id/document/189783', 'eprintid': 25638, 'placement': 1}]",2023-04-10 07:10:47,archive,,25638,37-40,paper,Seminar Nasional Pengabdian Masyarakat Teknologi dan Inovasi (SENAPATI) 2020,conference,,22 - 23 September 2020,Online,,,,
