,datestamp,eprintid,eprint_status,metadata_visibility,pagerange,userid,number,official_url,lastmod,documents,type,creators,title,refereed,date_type,subjects,abstract,volume,date,uri,publisher,dir,publication,divisions,issn,full_text_status,succeeds,status_changed,ispublished,rev_number,contact_email,pres_type
0,2022-01-24 01:16:01,38229,archive,show,161-171,1020,2.0,http://journal2.um.ac.id/index.php/sd/article/view/1358/718,2022-01-24 01:16:01,"[{'docid': 159243, 'main': '1358-3124-1-SM.pdf', 'files': [{'objectid': 159243, 'filesize': 364239, 'filename': '1358-3124-1-SM.pdf', 'uri': 'http://repository.lppm.unila.ac.id/id/file/433829', 'hash_type': 'MD5', 'mtime': '2021-11-03 06:17:36', 'datasetid': 'document', 'fileid': 433829, 'mime_type': 'application/pdf', 'hash': '8a5bb0f0b0f697047d0576883aeec185'}], 'format': 'text', 'language': 'en', 'rev_number': 3, 'mime_type': 'application/pdf', 'placement': 1, 'eprintid': 38229, 'uri': 'http://repository.lppm.unila.ac.id/id/document/159243', 'pos': 1, 'formatdesc': 'Artikel', 'security': 'public'}, {'pos': 2, 'uri': 'http://repository.lppm.unila.ac.id/id/document/159244', 'security': 'public', 'formatdesc': 'Reviewer', 'placement': 2, 'eprintid': 38229, 'rev_number': 2, 'language': 'en', 'mime_type': 'application/pdf', 'main': 'Analisis Kebuttuhan Profesionalisme Guru Sekolah Dasar Pasca Sertifikasi.pdf', 'docid': 159244, 'files': [{'objectid': 159244, 'filesize': 2395333, 'uri': 'http://repository.lppm.unila.ac.id/id/file/433831', 'filename': 'Analisis Kebuttuhan Profesionalisme Guru Sekolah Dasar Pasca Sertifikasi.pdf', 'hash_type': 'MD5', 'mtime': '2022-01-22 14:48:55', 'fileid': 433831, 'datasetid': 'document', 'mime_type': 'application/pdf', 'hash': '91366143d9829ddbfef01573a8fcd8ff'}], 'format': 'text'}]",article,"[{'name': {'lineage': None, 'family': 'Haenilah', 'honourific': None, 'given': 'Een Yayah'}, 'id': 'eenhaenilah@gmail.com'}]",Analisis Kebutuhan Profesionalisme Guru Sekolah Dasar Pasca Sertifikasi,TRUE,published,"['L1', 'LB1501', 'LC5201']","Penelitian ex post facto ini bertujuan untuk mengetahui nilai variabel mandiri, yang berhubungan dengan (a) kompetensi profesional (pengembangan profesi, pemahaman wawasan, penguasaan bahan kajian); (b) kompetensi pedagogik (penyusunan rencana pembelajaran, pelaksanaan pembelajaran, penilaian); dan kompetensi sosial (interaksi dengan peserta didik, sesama guru, orangtua, dan masyarakat sekitar). Sampel diambil 5% dari populasi 2500 guru SDN yang sudah lulus ertifikasi di Kota Bandar Lampung. Hasil penelitian menunjukkan penguasaan kompetensi profesional, pedagogik, dan kompetensi sosial belum sepenuhnya diupayakan oleh para guru",24.0,2015-11-01,http://repository.lppm.unila.ac.id/id/eprint/38229,Department of Kependidikan Sekolah Dasar dan Prasekolah FIP UM Malang,disk0/00/03/82/29,Jurnal Sekolah Dasar Kajian Teori dan Praktik Pendidikan,['FKIP23'],"ISSN 0854-8285, E ISSN 2581-1983",public,34919.0,2022-01-24 01:16:01,pub,9,,
1,2021-12-22 08:44:20,37389,archive,show,,1020,,https://ejournal.upi.edu/index.php/JER/article/view/1280/894,2021-12-22 08:44:20,"[{'language': 'en', 'rev_number': 3, 'mime_type': 'application/pdf', 'format': 'text', 'main': '9Studi Evaluatif Peningkatan Profesionalisme Guru PAUD melalui Model Pendidikan dan Latihan Profesi Guru (PLPG) Tahun 2013.pdf', 'files': [{'mime_type': 'application/pdf', 'hash': '08afd82f3d0b88848f5e627223ad5671', 'datasetid': 'document', 'fileid': 427521, 'mtime': '2021-11-02 12:48:19', 'hash_type': 'MD5', 'filename': '9Studi Evaluatif Peningkatan Profesionalisme Guru PAUD melalui Model Pendidikan dan Latihan Profesi Guru (PLPG) Tahun 2013.pdf', 'uri': 'http://repository.lppm.unila.ac.id/id/file/427521', 'filesize': 3908382, 'objectid': 158302}], 'docid': 158302, 'formatdesc': 'Reviewer', 'security': 'public', 'pos': 1, 'uri': 'http://repository.lppm.unila.ac.id/id/document/158302', 'eprintid': 37389, 'placement': 1}, {'format': 'text', 'main': 'Studi Evaluatif Peningkatan Profesionalisme Guru PAUD Melalui Model Pendidikan dan Latihan Profesi Guru (PLPG) Tahun 2013..pdf', 'docid': 158303, 'files': [{'datasetid': 'document', 'fileid': 427523, 'hash': 'c502affb79e052bea1d328b5a008cb6e', 'mime_type': 'application/pdf', 'objectid': 158303, 'filesize': 403362, 'filename': 'Studi Evaluatif Peningkatan Profesionalisme Guru PAUD Melalui Model Pendidikan dan Latihan Profesi Guru (PLPG) Tahun 2013..pdf', 'uri': 'http://repository.lppm.unila.ac.id/id/file/427523', 'hash_type': 'MD5', 'mtime': '2021-12-22 05:31:31'}], 'rev_number': 2, 'language': 'en', 'mime_type': 'application/pdf', 'eprintid': 37389, 'placement': 2, 'security': 'public', 'formatdesc': 'Artikel', 'pos': 2, 'uri': 'http://repository.lppm.unila.ac.id/id/document/158303'}]",article,"[{'id': 'eenhaenilah@gmail.com', 'name': {'given': 'Een Yayah', 'family': 'Haenilah', 'lineage': None, 'honourific': None}}]",Studi Evaluatif Peningkatan Profesionalisme Guru PAUD melalui Model Pendidikan dan Latihan Profesi Guru (PLPG) Tahun 2013 (Peer Reviewer),TRUE,published,"['L1', 'LB1501', 'LC5201']","Penelitian ini dilatarbelakangi oleh kondisi keberagaman kemampuan guru Pendidikan Anak Usi Dini (PAUD) sebagai peserta Pendidikan dan Latihan Profesi Guru (PLPG). Dalam waktu yang sama mereka dihadapkan pada target yang sama, yaitu harus lulus uji kompetensi untuk mendapatkan legalitas sertifikasi sebagai pendidik profesional. Tujuan penelitian ini untuk mengetahui keberhasilan PLPG dalam meningkatkan kompetensi akademik dan pedagogik guru. Populasi penelitian adalah semua guru PAUD peserta PLPG tahun 2013 dengan menggunakan metode ex post facto. Teknik analisis data menggunakan t-test. Hasil penelitian membuktikan bahwa pada tingkat signifikansi 95% ternyata PLPG dapat meningkatkan kompetensi pedagogik guru PAUD tetapi tidak berhasil untuk meningkatkan kompetensi akademik.",,2015-01-15,http://repository.lppm.unila.ac.id/id/eprint/37389,Unila,disk0/00/03/73/89,Jurnal Penelitian pendidikan,['FKIP23'],(p) 1412-565X; (e) 2541-4235,public,34875.0,2021-12-22 08:44:20,pub,9,,
2,2016-10-04 03:11:28,717,archive,show,1-7,35,2.0,,2021-08-09 03:56:56,"[{'files': [{'filesize': 5655220, 'objectid': 615, 'filename': 'Jurnal PAUD vol 2 no 2 2015 unesa.zip', 'uri': 'http://repository.lppm.unila.ac.id/id/file/4119', 'hash_type': 'MD5', 'mtime': '2016-10-04 02:11:28', 'datasetid': 'document', 'fileid': 4119, 'mime_type': 'application/zip', 'hash': 'a74d382c5128830c3eb53313f4128041'}], 'main': 'Jurnal PAUD vol 2 no 2 2015 unesa.zip', 'docid': 615, 'format': 'archive', 'rev_number': 1, 'language': 'en', 'mime_type': 'application/zip', 'placement': 1, 'eprintid': 717, 'uri': 'http://repository.lppm.unila.ac.id/id/document/615', 'pos': 1, 'security': 'public'}]",article,"[{'id': 'arisofia76@gmail.com', 'name': {'family': 'Sofia', 'lineage': None, 'honourific': None, 'given': 'Ari'}}, {'id': 'eenhaenilah@gmail.com', 'name': {'family': 'Haenilah', 'lineage': None, 'honourific': None, 'given': 'Een Yayah'}}]",Hubungan antara penguasaan kompetensi kepribadian guru dengan upaya mengembangkan kemampuan sosial emosional anak usia dini,TRUE,published,['L1'],"Banyak hal yang dapat berpengaruh terhadap upaya yang dilakukan guru dalam mengembangkan keterampilan sosial anak, salah satunya adalah kepribadian. Penelitian ini bertujuan untuk mengetahui peranan penguasaan kompetensi kepribadian dengan upaya guru mengembangkan keterampilan sosial anak. Subjek penelitian ini berjumlah 104 orang yang dipilih dengan teknik purposive sampling, dengan karakteristik guru taman- kanak-kanak, telah bekerja minimal selama 5 tahun dan pendidikan S1. Lokasi penelitian di Bandar lampung. Alat ukur yang digunakan adalah skala kompetensi kepribadian guru dan skala upaya meningkatkan perilaku sosial. Data penelitian di analisis menggunakan analisis regresi. Hasil penelitian menunjukkan ada hubungan antara penguasaan kompetensi kepribadian guru dengan upaya guru meningkatkan keterampilan sosial anak (F=8,231; p=0.005 (p<0,01); R=0,273 dan R=0,075), sumbangan prediktor (R) penguasaan kompetensi kepribadian adalah 7,5 %. Hal ini menunjukkan masih banyak hal lain yang berperan terhadap upaya yang dilakukan guru dalam meningkatkan perilaku sosial anak. Misalnya kompetensi professional dan kompetensi sosial.
Kata kunci: kepribadian, upaya pengembangan, sosial",2.0,2015-10-01,http://repository.lppm.unila.ac.id/id/eprint/717,,disk0/00/00/07/17,Jurnal Pendidikan Anak Usia Dini,['FKIP23'],2355-5815,public,,2016-10-04 03:11:28,pub,9,,
3,2021-08-24 04:39:08,33609,archive,show,8-17,1020,2.0,,2021-08-24 04:39:08,"[{'format': 'text', 'docid': 153747, 'main': 'Jurnal PAUD Vol 2 No 2 Unesa.pdf', 'files': [{'filesize': 5065977, 'objectid': 153747, 'uri': 'http://repository.lppm.unila.ac.id/id/file/398397', 'filename': 'Jurnal PAUD Vol 2 No 2 Unesa.pdf', 'hash_type': 'MD5', 'mtime': '2021-08-24 04:29:59', 'fileid': 398397, 'datasetid': 'document', 'hash': '4bf4ad44612e5ee99b09c3f91ffab5c1', 'mime_type': 'application/pdf'}], 'mime_type': 'application/pdf', 'language': 'en', 'rev_number': 1, 'eprintid': 33609, 'placement': 1, 'security': 'public', 'uri': 'http://repository.lppm.unila.ac.id/id/document/153747', 'pos': 1}]",article,"[{'id': 'arisofia76@gmail.com', 'name': {'given': 'Ari', 'lineage': None, 'family': 'Sofia', 'honourific': None}}, {'id': 'eenhaenilah@gmail.com', 'name': {'honourific': None, 'family': 'Haenilah', 'lineage': None, 'given': 'Een Yayah'}}]",Hubungan antara penguasaan kompetensi kepribadian guru dengan upaya mengembangkan kemampuan sosial emosional anak usia dini,TRUE,,['L1'],,2.0,2015-10-01,http://repository.lppm.unila.ac.id/id/eprint/33609,PS S1 PG PAUD FIP Unesa,disk0/00/03/36/09,Jurnal Pendidikan Anak Usia Dini Jurnal Kajian Teori dan Hasil Penelitian,['FKIP23'],2335-5815,public,,2021-08-24 04:39:08,pub,9,eenhaenilah@gmail.com,paper
