,status_changed,issn,full_text_status,rev_number,ispublished,publisher,divisions,publication,dir,volume,abstract,date,uri,subjects,type,creators,refereed,title,number,userid,documents,lastmod,eprint_status,referencetext,eprintid,datestamp,pagerange,metadata_visibility,date_type,official_url
0,2021-02-02 01:42:39,0853-4349,public,6,pub,"Pusat Studi Irigasi, Sumberdaya Air, Lahan dan Pembangunan Universitas Andalas (PSI-SDALP UNAND)",['FP2'],"IRIGASI, SUMBERDAYA AIR, LAHAN DAN PEMBANGUNAN",disk0/00/02/75/95,27,"Land Use Intensity and Formation of Rubber Agroforesty in Jambi: From Shifting Cultivation Back to Forest (Rusdi Evizal).
In South Sumatera, Jambi rubber is
a model of traditional smallholder rubber plantation, cultured by less intensive management, known as rubber agroforesty system. This research was to study the
intensity and formation of land use on rubber agroforestry in Jambi. A survey using purposive grading system was conducted at 2003 2004 at Pelepat Ilir and Rantau
Pandan Sub district. Based on vegetation characteristic and formation, Jambi rubber agroforestry could be classified into monoculture rubber (agroforest phase 0), shrub
rubber (agroforest phase 1), forest rubber (agroforest phase 2), and rubber jungle (agroforst phase 3). The land use intensity consisted of 55% for monoculture rubber,
37% for shrub rubber, and 12% for forest rubber and rubber jungle. Increasing in land use intensity would increase rubber productivity (r = 0,93). Upland field (ladang)
played a central role in land use change toward rubber agroforestry system.
Keywords:land use, rubber agroforestry, shifting cultivation, Jambi",2008,http://repository.lppm.unila.ac.id/id/eprint/27595,['SB'],article,"[{'id': 'rusdi.evizal@fp.unila.ac.id', 'name': {'honourific': None, 'lineage': None, 'family': 'Evizal', 'given': 'Rusdi'}}]",TRUE,Intensitas Lahan dan Formasi Agroforestry Karet di Jambi: Dari Ladang Kembali ke Hutan,1,978,"[{'format': 'text', 'main': 'Rusdi visi27.pdf', 'files': [{'fileid': 246609, 'datasetid': 'document', 'mime_type': 'application/pdf', 'hash': 'a2a47c6efe868e29534b38c8a04fb8b2', 'filesize': 221941, 'objectid': 41607, 'uri': 'http://repository.lppm.unila.ac.id/id/file/246609', 'filename': 'Rusdi visi27.pdf', 'hash_type': 'MD5', 'mtime': '2021-02-01 14:48:01'}], 'docid': 41607, 'language': 'en', 'rev_number': 1, 'mime_type': 'application/pdf', 'eprintid': 27595, 'placement': 1, 'security': 'public', 'uri': 'http://repository.lppm.unila.ac.id/id/document/41607', 'pos': 1}]",2021-02-02 01:42:39,archive,"Belcher, B., G. Michon, A. Angelsen, M. Ruiz-Perez, H. Asbjornsen. 2000. Cultivating (in) ropical Forest? The Evolution and Sustainability of System of Management between Extractivism and Plantation.

Boerhendhy, I. dan C. Anwar. 1998. Pemanfaatan daerah aliran Sungai Musi untuk pengembangan karet. Jurnal Agrotropika. 3(1): 1-9.

Dove, M.R. 1988. . Gadjah Mada Univ. Press. 509 hlm.

Evizal, R., S. Budidarsono, F.E. Prasmatiwi. 2005. Land use history, intensity, and socio-economic background of Sumberjaya Window, Lampung Benchmark, Indonesia. Paper presented in CSM-BGBD Annual Meeting, Manaus, Brazil 11-17
April. 15 pp.

Gouyon, A.1999. Fire in the rubber jungle: Fire prevention and sustainable tree crop development in South Sumatra. 
IFFN (21): 48-56.


Gouyon,A., H. de Forestra, dan P. Levang. 2000. Kebun karet campuran di Jambi dan Sumatera Selatan. Dalam Forestra, H. de, A. Kusworo, G. Michon, dan W.A. Djatmiko (Eds.). Ketika
kebun berupa hutan: Agroforestri khas Indonesia, sebuah
sumbangan masyarakat. Hlm. 65-83.

Joshi, L., G. Wibawa, G.Vincent, D. Boutin, R. Akiefnawati, G. Manurung, M. van Noordwijk, and S. Williams. 2002. Jungle Rubber: A Traditional Agroforstry System under Pressure. ICRAF, Bogor. 37 pp. 

Noordwijk, M. van, T.P. Tomich, R. Winahyu, D. Murdiyarso, Suyanto, S. Partoharjono, and A.M. Fagi. 1995. Alternatives to Slashand-Burn in Indonesia. ASB-Indonesia Report No. 4. Bogor. 154 pp. 

Wibawa, G., M.J. Rosyid, danA. Gunawan. 2000. Pola Tumpangsari pada Perkebunan Karet. Balai Penelitian Sembawa. Palembang. 39 hlm. 

Williams, S.E., M. van Noordwijk, E. Penot, J.R. Healey, F.L. Sinclair, and G. Wibawa. 2001. On-farm evaluation of the establishment of clonal rubber in multistrata agroforests in Jambi, Indonesia. Agroforest System, 53(2): 227-237.",27595,2021-02-02 01:42:39,37-46,show,,
1,2020-02-17 03:40:45,0215-0212,public,8,pub,Pusat Penelitian Kopi dan Kakao Indonesia,['FP2'],Pelita Perkebunan,disk0/00/01/74/14,25,"Pohon pelindung bernilai penting dalam skema sertifikasi sistem produksi kopi berkelanjutan. Pohon pelindung memegang peranan penting dalam berfungsinya ekosistem perkebunan kopi. Penelitian ini bertujuan untuk mempelajari layanan lingkungan oleh pohon pelindung di beberapa agroekosistem kopi Robusta (Coffea canephora) pada sumbangan unsur hara dan produktivitas lahan. Empat agroekosistem kopi yaitu kopi tanpa pelindung, kopi berpelindung pohon cempaka, kopi berpelindung pohon gamal, dan kopi berpelindung pohon dadap, dilakukan evaluasi dalam periode 2007—2008. Penelitian ini dilakukan di perkebunan rakyat di Kecamatan Sumberjaya, Kabupaten Lampung Barat menggunakan rancangan RCBD dengan 3 ulangan. Kebun dirawat menurut standar lokal, yaitu dosis pupuk NPK (150—50—100), pengendalian gulma secara dikored 4 kali setahun. Hasil menunjukkan bahwa dinamika kerontokan seresah pohon pelindung dan pohon kopi dipengaruhi oleh musim kemarau. Produktivitas seresah ditentukan oleh adanya pohon pelindung. Pohon pelindung memberi layanan lingkungan berupa memproduksi seresah, mengurangi kerontokan daun kopi pada musim kemarau, dan menekan pertumbuhan gulma. Agroekosistem berpelindung pohon gamal atau dadap memberi hasil kopi yang lebih tinggi daripada kopi tanpa pelindung atau kopi berpohon pelindung cempaka. Pada agroekosistem tanpa pelindung serta kopi berpelindung gamal atau dadap, hasil kopi berkorelasi positif (r =0,99) dengan produktivitas seresah dan berkorelasi negatif (r = -0,82) dengan biomassa gulma. Produksi biomass (rontokan seresah + gulma) pada kebun kopi tanpa pelindung dengan kopi berpelindung tidak menunjukkan perbedaan yang nyata. Guguran seresah pohon pelindung sangat penting dalam menyumbang unsur hara terutama nitrogen untuk menggantikan kehilangan unsur hara yang terangkut panen buah kopi",2008,http://repository.lppm.unila.ac.id/id/eprint/17414,['SB'],article,"[{'id': 'rusdi.evizal@fp.unila.ac.id', 'name': {'given': 'Rusdi', 'lineage': None, 'family': 'Evizal', 'honourific': None}}, {'id': None, 'name': {'given': 'Tohari', 'honourific': None, 'lineage': None, 'family': 'Tohari'}}, {'id': None, 'name': {'given': 'Irfan D', 'family': 'Prijambada', 'lineage': None, 'honourific': None}}, {'id': None, 'name': {'honourific': None, 'lineage': None, 'family': 'Widada', 'given': 'Jaka'}}, {'id': None, 'name': {'given': 'Donny', 'honourific': None, 'family': 'Widianto', 'lineage': None}}]",TRUE,Layanan Lingkungan Pohon Pelindung pada Sumbangan Hara dan Produktivitas Agroekosistem Kopi,1,978,"[{'format': 'text', 'main': 'PelitaPerkeb.pdf', 'docid': 30540, 'files': [{'hash': 'f6d9799f90eb544e09a04278a7315517', 'mime_type': 'application/pdf', 'datasetid': 'document', 'fileid': 147350, 'filename': 'PelitaPerkeb.pdf', 'uri': 'http://repository.lppm.unila.ac.id/id/file/147350', 'filesize': 149909, 'objectid': 30540, 'mtime': '2019-12-26 14:50:26', 'hash_type': 'MD5'}], 'language': 'en', 'rev_number': 1, 'mime_type': 'application/pdf', 'eprintid': 17414, 'placement': 1, 'security': 'public', 'uri': 'http://repository.lppm.unila.ac.id/id/document/30540', 'pos': 1}]",2020-02-17 03:40:45,archive,,17414,2020-02-17 03:40:45,23-37,show,published,https://www.ccrjournal.com/index.php/ccrj
