,issn,full_text_status,status_changed,rev_number,ispublished,publisher,publication,divisions,dir,abstract,volume,date,uri,date_type,subjects,creators,type,title,refereed,userid,number,lastmod,official_url,documents,datestamp,eprintid,eprint_status,metadata_visibility,pagerange,referencetext,id_number,related_url,contributors,funders,contact_email
4,ISSN: 2822-0838 (online),public,2023-05-02 07:34:54,7,pub,Chiang Mai University,Natural and Life Sciences Communications,['FP2'],disk0_bak/00/05/09/18,"The aim of the study was to compare responses of different corn 
varieties to the fall armyworm Spodoptera frugiperda J.E. Smith 
(Lepidoptera: Noctuidae) attack and to map patterns of single 
nucleotide polymorphism of the RGA genes. The study consisted of 
two activities, i.e., the field experiment to observe corn damage 
intensity and the laboratory observation to study the SNP pattern. 
Field experiment was conducted to compare eight corn varieties set 
in randomized block design with 3 replications. Damage intensity of 
the corn due to S. frugiperda attack was observed on the field and 
the corn samples were analyzed in the laboratory to examine the RGA 
(resistance gen analogue) which contained single nucleotide 
polymorphism (SNP). The results from the field and the laboratory 
analysis showed that the response of Bisi 321 variety to S. frugiperda
attack was better than the other tested varieties. Based on the 
electrophoresis of the PCR results with the SNP2_MNBS_Alt primer, 
samples of corn varieties coded as V1 (Pertiwi 5), V3 (P-36), V6 (NK 
Super), V7 (Exotic), and V8 (Local) produced amplicons with the size 
of ±150 bp. The samples that did not have amplification were V2 
(NK7328), V4 (Bisi 321), and V5 (Bisi 18). There is a possibility that 
the amplification results may indicate some degrees of tolerance 
clusters of corn varieties to S. frugiperda attack. Further validation is 
required to apply the SNP-based markers of corn to develop tolerant 
or resistant varieties.",22,2023-04-07,http://repository.lppm.unila.ac.id/id/eprint/50918,published,['S1'],"[{'name': {'honourific': None, 'family': 'Timotiwu', 'lineage': None, 'given': 'P.B.'}, 'id': 'paul.timotiwu@fp.unila.ac.id'}, {'name': {'given': 'Agus', 'honourific': None, 'lineage': None, 'family': 'Agustiansyah'}, 'id': 'agustiansyah@yahoo.com'}, {'name': {'given': 'A.  Setiawan', 'lineage': None, 'family': 'Wawan', 'honourific': None}, 'id': 'wawan.a.setiawan@gmail.com'}, {'name': {'given': 'Hamim', 'honourific': None, 'lineage': None, 'family': 'Sudarsono'}, 'id': 'hamim.sudarsono@fp.unila.ac.id'}]",article,"Evaluation of SNP-Based Markers 
Utilization for Resistance to Fall Armyworm 
Spodoptera frugiperda on Eight Corn 
Varieties",TRUE,1003,3,2023-05-02 07:34:54,https://cmuj.cmu.ac.th/,"[{'rev_number': 1, 'language': 'en', 'mime_type': 'application/pdf', 'files': [{'datasetid': 'document', 'fileid': 548068, 'hash': '574ee157ab3bf00c069349145eed4559', 'mime_type': 'application/pdf', 'filesize': 514165, 'objectid': 190632, 'uri': 'http://repository.lppm.unila.ac.id/id/file/548068', 'filename': '20230421040256_36a680cf69c3d23ec9099874aabbe010.pdf', 'hash_type': 'MD5', 'mtime': '2023-05-02 03:09:01'}], 'main': '20230421040256_36a680cf69c3d23ec9099874aabbe010.pdf', 'docid': 190632, 'format': 'text', 'uri': 'http://repository.lppm.unila.ac.id/id/document/190632', 'pos': 1, 'security': 'public', 'placement': 1, 'eprintid': 50918}]",2023-05-02 07:34:54,50918,archive,show,1-11,"Abrahams, P., Beale, T., Cock, M., Corniani, N., Day, R., Godwin, J., Murphy, S., Richards, G., and Vos, J. 2017. Fall armyworm status impacts and control options in Africa: Preliminary evidence note (April 2017).
Davis, F. M., Ng, S. S., and Williams, W. P. 1992. Visual rating scales for screening whorl-stage corn for resistance to fall armyworm. Technical bulletin -Mississippi Agricultural and Forestry Experiment Station (USA). 186: 9. 
http://europepmc.org/abstract/AGR/IND93032614
Gao, Y., Guo, W., Wang, L., and Zhang, T. 2006. Isolation and characterization of resistance and defense gene analogs in cotton (Gossypium barbadense L.). Science in China, Series C: Life Sciences. 49(6): 530-542. 
Gupta, P. K., Roy, J. K., and Prasad, M. 2001. Single nucleotide polymorphisms: A new paradigm for molecular marker technology and DNA polymorphism detection with emphasis on their use in plants. Current Science. 80(4): 542-535.
Kowarsch, A., Fuchs, A., Frishman, D., and Pagel, P. 2010. Correlated mutations: A hallmark of phenotypic amino acid substitutions. PLoS Computational Biology, 6(9): e1000923.
Lestari, P., Budiarti, A., Fitriana, Y., Susilo, F., Swibawa, I. G., Sudarsono, H., Suharjo, R., Hariri, A. M., Purnomo, Nuryasin, Solikhin, Wibowo, L., Jumari, and 
Hartaman, M. 2020. Identification and genetic diversity of Spodoptera frugiperda in Lampung province, Indonesia. Biodiversitas. 21(4): 1670–1677.
R Core Team. 2021. R: language and environment for statistical computing. R Foundation for Statistical Computing.
Sambrook, J. and Russell, D. 2001. Molecular cloning: A laboratory manual, 3rd edn. Cold Spring Harbor, NY: Cold Spring Harbor Laboratory Press.
Sudarsono, H. 2019. Ulat Grayak Spodoptera frugiperda: Kondisi Terkini dan Analisis Dampaknya., Diskusi Roundtale CIPS Indonesia, 17 Juli 2019. Diskusi Roundtale CIPS Indonesia, 17 July 2019, Diskusi Roundtale CIPS Indonesia.
Sudarsono, H., Susilo F.X., Lestari P., Suharjo R., Swibawa I G., and Hariri A.M. 2019. Identification of Spodoptera Specimens Collected on Corn Field in Pringsewu District, Lampung Province. South East Asia Plant Protection Conference, 14 August 2019, Bogor. Indonesia.
Sutanto, A., Hermanto, C., Sukma, D., and Sudarsono, S. 2016. Pengembangan marka SNAP berbasis resistance gene analogue Pada Tanaman Pisang (Musa spp.). Journal Hortikultura. 23(4): 300. 
Syvänen, A. C. 2001. Accessing genetic variation: genotyping single nucleotide polymorphisms. Nature Reviews. Genetics. 2(12): 930–942. 
Yaish, M. W. F., Sáenz De Miera, L. E., and Pérez De La Vega, M. 2004. Isolation of a family of resistance gene analogue sequences of the nucleotide binding site (NBS) type from Lens species. Genome, 47(4): 650-659.",,[{'url': 'https://cmuj.cmu.ac.th/nlsc/journal/article/995'}],"[{'id': 'paul.timotiwu@fp.unila.ac.id', 'name': {'lineage': None, 'family': 'Timotiwu', 'honourific': None, 'given': 'PBT'}, 'type': 'http://www.loc.gov/loc.terms/relators/AUT'}, {'type': 'http://www.loc.gov/loc.terms/relators/AUI', 'name': {'given': 'AA', 'family': 'Agustiansyah', 'lineage': None, 'honourific': None}, 'id': 'agustiansyah@yahoo.com'}, {'type': 'http://www.loc.gov/loc.terms/relators/AQT', 'name': {'honourific': None, 'lineage': None, 'family': 'Wawan', 'given': 'WAS'}, 'id': 'wawan.a.setiawan@gmail.com'}, {'id': 'hamim.sudarsono@fp.unila.ac.id', 'name': {'given': 'HH', 'honourific': None, 'family': 'Sudarsono', 'lineage': None}, 'type': 'http://www.loc.gov/loc.terms/relators/CRP'}]",['the University of Lampung under the scheme of the  Unila Professorship Research Grant 2021'],hamim.sudarsono@fp.unila.ac.id
5,"2964 - 3295, eISSN 2964 - 3287",public,2023-03-20 02:03:01,7,pub,Research and Social Study Institute (RESSI) bekerjasama dengan  Program Studi Penyuluhan Pertanian Fakultas Pertanian  Universitas Lampung,Jurnal Pengabdian dan Pemberdayaan Masyarakat Partisipatif,['FP2'],disk0_bak/00/04/90/11,"Tujuan dari kegiatan pengabdian ini adalah untuk meningkatkan pengetahuan dan kesadaran masyarakat mengenai pentingnya pengggunaan bahan-bahan organik dan pemanfaatan limbah menjadi sesuatu yang bermanfaat dalam pertanian yang berkelanjutan, sebagai pupuk dan perawatan tanaman. Untuk mencapai tujuan tersebut, metode yang digunakan berjenis kualitatif dengan pendekatan eksplanatif-deskriptif. Kegiatan pengabdian ini berhasil memberikan dampak yang signifikan pada masyarakat, dengan peningkatan pengetahuan mengenai pupuk organik, pengelolaan limbah puntung rokok menjadi bio-pestisida, dan perawatan tanaman alpukat. Masyarakat juga menjadi lebih berkeinginan untuk memperbaiki cara mereka mengolah sampah organik menjadi sesuatu yang berguna bagi tanaman dan mengurangi penggunaan pestisida kimia. Berdasarkan hasil diskusi, evaluasi, dan penggalian informasi selama program ini berlangsung, diperlukan pelatihan dan pendampingan lebih lanjut, terutama bab eksportir alpukat. Pelatihan dan pendampingan ini diharapkan dapat membantu masyarakat memperoleh hasil panen
yang lebih baik dan mengembangkan cara menanam tanaman alpukat dengan lebih efisien.",2,2023-01-17,http://repository.lppm.unila.ac.id/id/eprint/49011,published,"['R1', 'S1']","[{'name': {'given': 'RA. Diana', 'family': 'Widyastuti', 'lineage': None, 'honourific': None}, 'id': 'rdiana.widyastuti@fp.unila.ac.id'}, {'id': 'muhammad.nur@fp.unila.ac.id', 'name': {'lineage': None, 'family': 'Nur', 'honourific': None, 'given': 'Muhammad'}}]",article,PENGAPLIKASIAN BIO-PESTISIDA LIMBAH PUNTUNG ROKOK PADA TANAMAN ALPUKAT DI PEKON SUKAMAJU KECAMATAN LUMBOK SEMINUNG KABUPATEN LAMPUNG BARAT,TRUE,131,1,2023-03-20 02:03:01,https://jurnalppm.org/index.php/JPPMI/,"[{'eprintid': 49011, 'placement': 1, 'security': 'public', 'uri': 'http://repository.lppm.unila.ac.id/id/document/188461', 'pos': 1, 'format': 'text', 'docid': 188461, 'main': 'pengabdian Diana Aplikasi Biopestisida.pdf', 'files': [{'hash': '62d7c2f33a6401cf9b3ffdea25535569', 'mime_type': 'application/pdf', 'fileid': 533100, 'datasetid': 'document', 'mtime': '2023-03-18 14:55:07', 'hash_type': 'MD5', 'filename': 'pengabdian Diana Aplikasi Biopestisida.pdf', 'uri': 'http://repository.lppm.unila.ac.id/id/file/533100', 'filesize': 155970, 'objectid': 188461}], 'language': 'en', 'mime_type': 'application/pdf', 'rev_number': 1}]",2023-03-20 02:03:01,49011,archive,show,1-6,,,,,,
6,"2964 - 3295, eISSN 2964 - 3287",public,2023-03-20 02:02:59,6,pub,Research and Social Study Institute (RESSI) bekerjasama dengan  Program Studi Penyuluhan Pertanian Fakultas Pertanian  Universitas Lampung,Jurnal Pengabdian dan Pemberdayaan Masyarakat Partisipatif,['FP2'],disk0_bak/00/04/90/09,"Pengabdian ini dilakukan sebagai upaya meningkatkan kesadaran dan pengetahuan masyarakat dalam mengelola sampah organik menjadi eco-enzyme. Eco-enzyme merupakan cairan alami yang dihasilkan dari proses fermentasi percampuran antara bahan organik, air, dan gula. Kegiatan pelatihan dilakukan di Balai Pekon Lombok pada tanggal 24 Januari 2023, yang ditujukan kepada ibu rumah tangga di Pekon Lombok yang tergabung dalam Kelompok Pemberdayaan Kesejahteraan Keluarga (PKK). Kegiatan dilakukan dengan metode sosialisasi dan demonstrasi untuk memudahkan para peserta dalam memahami materi dan tata cara pembuatan eco-enzyme. Berdasarkan hasil evaluasi kegiatan, peserta sangat antusias dalam belajar ilmu baru yang sebelumnya tidak diketahui. Peserta mengetahui teknologi baru tentang pembuatan eco-enzyme dari sampah rumah tangga. Selain dapat menciptakan lingkungan yang bersih, hasil eco-enzyme memberikan manfaat yang beragam bagi kehidupan, salah satunya sebagai pupuk cair organik yang dapat digunakan oleh masyarakat
Pekon Lombok, yang mayoritas penduduknya bekerja sebagai petani.",2,2023,http://repository.lppm.unila.ac.id/id/eprint/49009,published,['S1'],"[{'name': {'given': 'RA. Diana', 'family': 'Widyastuti', 'lineage': None, 'honourific': None}, 'id': 'rdiana.widyastuti@fp.unila.ac.id'}, {'name': {'honourific': None, 'family': 'Nur', 'lineage': None, 'given': 'Muhammad'}, 'id': 'muhammad.nur@fp.unila.ac.id'}]",article,"Pelatihan Pembuatan Eco-Enzyme Sebagai Upaya Mengurangi 
Sampah Organik Rumah Tangga Di Pekon Lombok 
Kecamatan Lumbok Seminung Kabupaten Lampung Barat",TRUE,131,1,2023-03-20 02:02:59,https://jurnalppm.org/index.php/JPPMI/,"[{'security': 'public', 'uri': 'http://repository.lppm.unila.ac.id/id/document/188459', 'pos': 1, 'eprintid': 49009, 'placement': 1, 'language': 'en', 'rev_number': 1, 'mime_type': 'application/pdf', 'format': 'text', 'main': 'Pengabdian Eco+Enzyme_13-20.pdf', 'files': [{'hash': 'afc0d404e31b713663b1399d9cf20173', 'mime_type': 'application/pdf', 'fileid': 533085, 'datasetid': 'document', 'filename': 'Pengabdian Eco+Enzyme_13-20.pdf', 'uri': 'http://repository.lppm.unila.ac.id/id/file/533085', 'objectid': 188459, 'filesize': 468334, 'mtime': '2023-03-18 13:50:28', 'hash_type': 'MD5'}], 'docid': 188459}]",2023-03-20 02:02:59,49009,archive,show,13-20,,,,,,
7,1842-4309,public,2023-03-06 01:55:34,6,pub,"University of Agricultural Sciences and Veterinary Medicine, Cluj-Napoca",Notulae Botanicae Horti Agrobotanici Clucj-Napoca,['FP2'],disk0_bak/00/04/87/10,"Plant breeding through hybridization in cassava is facing a problem due to inconsistent flowering, and also the donor genes controlling superior traits are limited. An alternative method of breeding is through genetic transformation, and regeneration via somatic embryogenesis is a promising route to achieve this. As somatic embryogenesis in cassava is genotype-specific, in the present study a protocol has been developed for UJ-3 and BW-1 genotypes. Immature sterile leaves from 7-10 days axillary shoots in a pre-condition medium were used as an explant. Leaves were inoculated on Murashige and Skoog (MS) medium containing picloram(0.0, 7.5, 10.0, 12.5, and 15.0 mg/L) and 1-naphthalene acetic acid (NAA, 6 mg/L) for induction of somatic embryos (SEs). Genotype BW-1 showed the best results as early callus formation time i.e. 8.04±0.32 days after induction (dai) compared to UJ-3 (8.67±2.13 dai). The callus fresh weight (0.64 g) was also higher in BW-1 than UJ-3 (0.38 g) after 4 weeks in the callus induction medium (CIM), and the callus formation ranges between 85.19±3.70 to 96.30±3.70% for both genotypes. Subculturing embryogenic callus to MS+CuSO4 (4 μM) + picloram (6 mg/L) +NAA (0.5 mg/L) (SK1 medium) germinated maximum SEs in BW-1 (46.56±36.86), whereas the number was less for UJ-3 (11.89±11.90). Further, shoots were developed from green cotyledons followed by hardening and acclimatization of plantlets",51,2023-02,http://repository.lppm.unila.ac.id/id/eprint/48710,published,['SB'],"[{'name': {'given': 'Fitri', 'honourific': None, 'family': 'Yelli', 'lineage': None}, 'id': 'fitri.yelli@fp.unila.ac.id'}, {'name': {'given': 'UTOMO', 'lineage': None, 'family': 'SETYO DWI', 'honourific': None}, 'id': 'setyo.dwiutomo@fp.unila.ac.id'}, {'name': {'given': 'titin', 'honourific': None, 'family': 'agustin', 'lineage': None}, 'id': 'gaustintitin991@gmail.com'}, {'id': 'ashutosh.pathak87@gmail.com', 'name': {'given': 'ashutosh', 'family': 'pathak', 'lineage': None, 'honourific': None}}]",article,Somatic embryogenesis in two cassava  (Manihot esculenta Crantz)genotypes,TRUE,152,1,2023-03-06 01:55:34,https://notulaebotanicae.ro/index.php/nbha/article/view/13039/9513,"[{'pos': 1, 'uri': 'http://repository.lppm.unila.ac.id/id/document/188086', 'security': 'public', 'placement': 1, 'eprintid': 48710, 'rev_number': 1, 'language': 'en', 'mime_type': 'application/pdf', 'main': 'View of Somatic embryogenesis in two cassava (Manihot esculenta Crantz) genotypes.pdf', 'files': [{'fileid': 530847, 'datasetid': 'document', 'hash': 'aea75f4fc432f5a91cabd672c1bc4ba3', 'mime_type': 'application/pdf', 'hash_type': 'MD5', 'mtime': '2023-03-03 13:08:15', 'filesize': 4990009, 'objectid': 188086, 'uri': 'http://repository.lppm.unila.ac.id/id/file/530847', 'filename': 'View of Somatic embryogenesis in two cassava (Manihot esculenta Crantz) genotypes.pdf'}], 'docid': 188086, 'format': 'text'}]",2023-03-06 01:55:34,48710,archive,show,1-13,,,,"[{'type': 'http://www.loc.gov/loc.terms/relators/AUT'}, {'type': 'http://www.loc.gov/loc.terms/relators/AUT'}, {'type': 'http://www.loc.gov/loc.terms/relators/AUT'}, {'type': 'http://www.loc.gov/loc.terms/relators/AUT'}]",,
8,,public,2023-04-08 13:25:31,7,pub,,Indonesian Journal of Community Services Cel,['FP2'],disk0_bak/00/04/98/41,"Bulurejo Village is one of the villages in Gadingrejo Subdistrict, Pringsewu Regency, Lampung Province. Bulurejo Village has a quite active Women Farmer Group (Kelompok Wanita Tani/ KWT) known as ‘Ayu Tani’, which was formed in 2014 with 27 members. Bulurejo Village is one of the villages that has the potential to develop the cultivation program of potted vegetable plants (Tanaman Sayur Dalam Pot: TASAPOT). TASAPOT cultivation is conducted to increase the consumption of various food sources in the form of vegetables with the principles of being nutritious, balanced, diverse, and healthy, so that organic farming can be applied during a pandemic era with the aim of increasing body immunity. This community services program aims to equip the community of Bulurejo Village with theoretical and practical knowledges regarding the cultivation techniques of vegetable plants in pots. The method used includes extension, discussion, mentoring, and training or direct practice in the field based on the initial evaluation as a basis for determining the knowledge level of the target partner's regarding the cultivation techniques of TASAPOT. The implementation of this community services program has succeeded to achieve the expected outcomes, namely increased knowledge of the community and members of the 'Ayu Tani' KWT in Bulurejo Village about the importance of Sustainable Food Houses (Rumah Pangan Lestari: RPL) and the cultivation techniques of TASAPOT to improve family’s health the community's standard of living. In addition, there has been an increase in partners’ understanding of the cultivation techniques of TASAPOT, starting from the benefits of utilizing the house yard, the growing media used, planting techniques, and plant maintenance until harvest.",2,2023-01-08,http://repository.lppm.unila.ac.id/id/eprint/49841,published,['S1'],"[{'id': 'radianawidyastuti@yahoo.co.id', 'name': {'given': 'diana', 'honourific': None, 'family': 'widyastuti', 'lineage': None}}, {'id': 'hidpuji@yahoo.com', 'name': {'lineage': None, 'family': 'Hidayat Pujisiswanto', 'honourific': None, 'given': 'Hidayat'}}, {'id': None, 'name': {'lineage': None, 'family': 'Warganegara', 'honourific': None, 'given': 'Hayane Adeline'}}, {'id': None, 'name': {'given': 'Purba', 'honourific': None, 'lineage': None, 'family': 'Sanjaya'}}, {'name': {'given': 'Sri', 'lineage': None, 'family': 'Ramadiana', 'honourific': None}, 'id': 'sri.ramadiana@fp.unila.ac.id'}]",article,Building the Creativity of Bulurejo Village Community through the TASAPOT Cultivation in the Pandemic Era,TRUE,131,1,2023-04-08 13:25:31,,"[{'format': 'text', 'main': 'Widyastuti+et+al.,+2023.pdf', 'files': [{'hash_type': 'MD5', 'mtime': '2023-04-07 04:53:24', 'filesize': 488767, 'objectid': 189484, 'uri': 'http://repository.lppm.unila.ac.id/id/file/539724', 'filename': 'Widyastuti+et+al.,+2023.pdf', 'fileid': 539724, 'datasetid': 'document', 'mime_type': 'application/pdf', 'hash': 'f1ba6e571899577d5698a00a4056e804'}], 'docid': 189484, 'mime_type': 'application/pdf', 'language': 'en', 'rev_number': 1, 'eprintid': 49841, 'placement': 1, 'security': 'public', 'pos': 1, 'uri': 'http://repository.lppm.unila.ac.id/id/document/189484'}]",2023-04-08 13:25:31,49841,archive,show,,,http://ijcomcel.org/index.php/IJCSC/article/view/32,,,,
