,issn,full_text_status,status_changed,rev_number,ispublished,publisher,publication,divisions,dir,abstract,volume,date,uri,date_type,subjects,creators,type,title,refereed,userid,number,lastmod,official_url,documents,datestamp,eprintid,eprint_status,metadata_visibility,pagerange,referencetext,id_number,related_url,contributors,funders,contact_email
0,1755-1315,public,2023-07-31 09:40:05,9,pub,IOP Publishing,IOP Conf. Series: Earth and Environmental Science,['FP2'],disk0_bak/00/05/23/13,"Abstract. Lampung is one the biggest areas for planting cassava in Indonesia, approximately
119 thousand ha with a productivity of 26 tons/ha. Optimum harvest time for cassava high
yield could be 10-12 months after planting (MAP). However, most farmers used to harvest
cassava around 7 MAP leading to low yield. This condition needs to introduce early age of
harvest cassava to achieve the alternative solution. The objective of this study were to evaluate
the growth characteristics of early cassava harvest for high yield. Treatment were arranged by
a single factor in a randomized complete block design (RCBD) with three replications. Factors
were 12 cassava clones as CMR 51-61-1, CMR 51-48-17, CMR 51-48-16, UJ-3, UJ-5, Vamas,
Adira, CMR 51-07-03, OMM 0806-57, CMR 51-06-16, MC 6.10.311, and Litbang UK2. In
this study, the variables measured included plant height, root fresh weight, starch content, and
starch yield. Result indicated that the Vamas clone had relatively low plant height. At 7 MAP,
the Vamas clone showed high starch content compared to the UJ-3 clone. Low plant height
and starch content could be used to detect early-harvest cassava clones at harvest of 7 MAP",1208,2023-07-21,http://repository.lppm.unila.ac.id/id/eprint/52313,published,['S1'],"[{'name': {'given': 'Ardian', 'honourific': None, 'lineage': None, 'family': 'Ardian'}, 'id': 'ardian.unila@gmail.com'}, {'name': {'given': 'Kukuh', 'family': 'Setiawan', 'lineage': None, 'honourific': None}, 'id': 'kukuhsetiawan38@gmail.com'}, {'name': {'honourific': None, 'lineage': None, 'family': 'Noerwijati', 'given': 'Kartika'}, 'id': None}, {'id': 'setyo.dwiutomo@fp.unila.ac.id', 'name': {'given': 'Setyo Dwi', 'family': 'Utomo', 'lineage': None, 'honourific': None}}, {'name': {'given': 'fitri', 'lineage': None, 'family': 'yelli', 'honourific': None}, 'id': 'fitri.yelli79@gmail.com'}, {'id': None, 'name': {'given': 'Akhmad', 'honourific': None, 'family': 'Syaifudin', 'lineage': None}}, {'id': None, 'name': {'honourific': None, 'lineage': None, 'family': 'Sungkono', 'given': 'Sungkono'}}]",article,"Detection of early harvest cassava clone through plant height
development and starch content in dry land of Lampung",TRUE,1006,1,2023-07-31 09:40:05,https://iopscience.iop.org/issue/1755-1315/1208/1,"[{'language': 'en', 'rev_number': 1, 'mime_type': 'application/pdf', 'format': 'text', 'files': [{'objectid': 253333, 'filesize': 1183003, 'filename': 'Ardian_2023_IOP_Conf._Ser.__Earth_Environ._Sci._1208_012034.pdf', 'uri': 'http://repository.lppm.unila.ac.id/id/file/620031', 'hash_type': 'MD5', 'mtime': '2023-07-31 06:34:12', 'datasetid': 'document', 'fileid': 620031, 'mime_type': 'application/pdf', 'hash': '3f98aa9cb91eb9084720ffbd6d77ef19'}], 'main': 'Ardian_2023_IOP_Conf._Ser.__Earth_Environ._Sci._1208_012034.pdf', 'docid': 253333, 'security': 'public', 'pos': 2, 'uri': 'http://repository.lppm.unila.ac.id/id/document/253333', 'eprintid': 52313, 'placement': 2}]",2023-07-31 09:40:05,52313,archive,show,1-5,,,,,,
1,0216-7662,public,2023-07-03 01:51:28,6,pub,Jurnal Agrotropika,Jurnal Agrotropika,['FP2'],disk0_bak/00/05/21/95,"Biochar is a carbon-rich solid produced from the pyrolysis of biomass such as wood, manure, and leaves under high temperature and low oxygen conditions which is used for agricultural applications as a soil amendment. This paper reviews the utilization and practical application of biochar. The application of biochar into the soil can improve the physical, chemical and biological properties of the soil, namely increasing porosity, water holding capacity, soil aggregation, increasing pH, cation exchange capacity, soil organic carbon, nutrient retention and availability, and increasing microbial life, meso and soil macrofauna. Aside from being a soil amendment, biochar has a function on issues of global warming, climate change, and the environment, namely its role in carbon sequestration and stabilization, greenhouse gas emissions, and soil pollutant remediation. If biochar is applied properly, namely using the right feedstock materials, method of manufacture, dosage, method of application, and place, it will affect agronomic performance and crop yields. Reduced yields are mostly occured in temperate climates as biochar significantly increases soil pH causing an effect such as liming resulting in immobilization of key nutrients such as Mg, Fe, B, and P. Biochar needs to be mixed or applied together with fertilizer ingredients such as chemical fertilizers, bio-fertilizers, compost, and manure. Another effort is to enrich biochar with those materials so that biochar is categorized as a biochar-based fertilizer that has a higher selling price.

Key words : Application, biochar, benefit, crop yield, method",22,2023-06-31,http://repository.lppm.unila.ac.id/id/eprint/52195,published,['S1'],"[{'id': 'rusdi.evizal@fp.unila.ac.id', 'name': {'honourific': None, 'lineage': None, 'family': 'Evizal', 'given': 'Rusdi'}}, {'name': {'given': 'Fembriarti Erry', 'family': 'Prasmatiwi', 'lineage': None, 'honourific': None}, 'id': 'fembriarti.erry@fp.unila.ac.id'}]",article,Biochar: Pemanfaatan dan Aplikasi Praktis,TRUE,978,1,2023-07-03 01:51:28,https://jurnal.fp.unila.ac.id/index.php/JAT/issue/view/441,"[{'format': 'text', 'docid': 252665, 'main': '1-Erry-7151-23341-2-ED.pdf', 'files': [{'uri': 'http://repository.lppm.unila.ac.id/id/file/618511', 'filename': '1-Erry-7151-23341-2-ED.pdf', 'objectid': 252665, 'filesize': 622761, 'mtime': '2023-07-01 02:49:27', 'hash_type': 'MD5', 'mime_type': 'application/pdf', 'hash': '2c89698734d990f49ca051e879296294', 'datasetid': 'document', 'fileid': 618511}], 'language': 'en', 'rev_number': 1, 'mime_type': 'application/pdf', 'eprintid': 52195, 'placement': 1, 'security': 'public', 'uri': 'http://repository.lppm.unila.ac.id/id/document/252665', 'pos': 1}]",2023-07-03 01:51:28,52195,archive,show,1-12,"Achakzai, A. G., S. Gul, A. H. Buriro, H. Khan, A. Mushtaq, A. Bano, S. Agha, K. Kamran, Z. Ponya, and T. Ismail. 2023. “Biochar-Fertilizer Mixture: Does Plant Life History Trait Determine Fertilizer Application Rate?” Environmental Pollutants and Bioavailability 35 (1): 1–14. https://doi.org/10.1080/26395940.2023.2170282.

Acharya, Nischal, Shree Prasad Vista, Shova Shrestha, Nabina Neupane, and Naba Raj Pandit. 2022. “Potential of Biochar-Based Organic Fertilizers on Increasing Soil Fertility, Available Nutrients, and Okra Productivity in Slightly Acidic Sandy Loam Soil.” Nitrogen 4 (1): 1–15. https://doi.org/10.3390/nitrogen4010001.

Alarefee, H. A., C. F. Ishak, D. S. Karam, and R. Othman. 2021. “Efficiency of Rice Husk Biochar with Poultry Litter Co-Composts in Oxisols for Improving Soil Physico-Chemical Properties and Enhancing Maize Performance.” Agronomy 11 (12). https://doi.org/10.3390/agronomy11122409.

Barrow, C. J. 2012. “Biochar: Potential for Countering Land Degradation and for Improving Agriculture.” Applied Geography 34: 21–28. https://doi.org/10.1016/j.apgeog.2011.09.008.

Biederman, L. A., and W. S. Harpole. 2013. “Biochar and Its Effects on Plant Productivity and Nutrient Cycling a Meta-Analysis.” GCB Bioenergy 5: 202–14.

Chew, J., L. Zhu, S. Nielsen, E. Graber, D. R.G. Mitchell, J. Horvat, M. Mohammed, et al. 2020. “Biochar-Based Fertilizer: Supercharging Root Membrane Potential and Biomass Yield of Rice.” Science of the Total Environment 713 (August 2019): 136431. https://doi.org/10.1016/j.scitotenv.2019.136431.

Evizal, R., and F. E. Prasmatiwi. 2022. “Gejala Produktivitas Rendah Dan Pertanian Degeneratif.” Jurnal Agrotropika 21 (2): 75–85.

Fitzpatrick, G. E., E. C. Worden, and W. A. Vendrame. 2005. “Historical Development of Composting Technology during the 20th Century.” HortTechnology 15 (1): 48–51. https://doi.org/10.21273/horttech.15.1.0048.

Haider, F. U., J. A. Coulter, L. Cai, S. Hussain, S. A. Cheema, J. Wu, and R. Zhang. 2022. “An Overview on Biochar Production, Its Implications, and Mechanisms of Biochar-Induced Amelioration of Soil and Plant Characteristics.” Pedosphere 32 (1): 107–30. https://doi.org/10.1016/S1002-0160(20)60094-7.

Hanisah, R. Evizal, F. Yelli, and Sugiatno. 2020. “Pengaruh Formulasi Biochar Dan Limbah Kulit Kopi Terhadap Pertumbuhan Bibit Kopi.” Jurnal Agrotropika 19 (2): 102–9.

Hossain, M. Z., M. M. Bahar, B. Sarkar, S. W. Donne, Y. S. Ok, K. N. Palansooriya, M. B. Kirkham, S. Chowdhury, and N. Bolan. 2020. “Biochar and Its Importance on Nutrient Dynamics in Soil and Plant.” Biochar 2 (4): 379–420. https://doi.org/10.1007/s42773-020-00065-z.

Hussain, M., M. Farooq, A. Nawaz, A. M. Al-Sadi, Z. M. Solaiman, S. S. Alghamdi, U. Ammara, Y. S. Ok, and K. H. M. Siddique. 2017. “Biochar for Crop Production: Potential Benefits and Risks.” Journal of Soils and Sediments 17 (3): 685–716. https://doi.org/10.1007/s11368-016-1360-2.

Iskandar, I., and K.D. Santoso. 2005. Panduan Singkat Cara Pembuatan Arang Kayu: Alternatif Pemanfaatan Limbah Kayu Oleh Masyarakat. CIFOR. Bogor. https://doi.org/10.17528/cifor/001804.

Jabborova, D., K. Annapurna, R. Choudhary, S. N. Bhowmik, S. E. Desouky, S. Selim, I. H. El Azab, M. M. A. Hamada, N. El Nahhas, and A. Elkelish. 2021. “Interactive Impact of Biochar and Arbuscular Mycorrhizal on Root Morphology, Physiological Properties of Fenugreek (Trigonella Foenum-Graecum L.) and Soil Enzymatic Activities.” Agronomy 11 (11): 1–16. https://doi.org/10.3390/AGRONOMY11112341.

Joseph, S., A. L. Cowie, L. Van Zwieten, N. Bolan, A. Budai, W. Buss, M. L. Cayuela, et al. 2021. “How Biochar Works, and When It Doesn’t: A Review of Mechanisms Controlling Soil and Plant Responses to Biochar.” GCB Bioenergy 13 (11): 1731–64. https://doi.org/10.1111/gcbb.12885.

Kammann, C. I., H. P. Schmidt, N. Messerschmidt, S. Linsel, D. Steffens, C. Müller, H. W. Koyro, P. Conte, and J. Stephen. 2015. “Plant Growth Improvement Mediated by Nitrate Capture in Co-Composted Biochar.” Scientific Reports 5: 1–13. https://doi.org/10.1038/srep11080.

Kang, Z., X. Jia, Y. Zhang, X. Kang, M. Ge, D. Liu, C. Wang, and Z. He. 2022. “A Review on Application of Biochar in the Removal of Pharmaceutical Pollutants through Adsorption And” 14: 1–25.

Kern, D. C., H. P. Lima, J. A. da Costa, H. V. de Lima, A. B. Ribeiro, B. M. Moraes, and N. Kämpf. 2017. “Terras Pretas: Approaches to Formation Processes in a New Paradigm.” Geoarchaeology 32 (6): 694–706. https://doi.org/10.1002/gea.21647.

Kimetu, J. M., J. Lehmann, S. O. Ngoze, D. N. Mugendi, J. M. Kinyangi, S. Riha, L. Verchot, J. W. Recha, and A. N. Pell. 2008. “Reversibility of Soil Productivity Decline with Organic Matter of Differing Quality along a Degradation Gradient.” Ecosystems 11 (5): 726–39. https://doi.org/10.1007/s10021-008-9154-z.

Kulkarni, M. G., M. E. Light, and J. Van Staden. 2011. “Plant-Derived Smoke: Old Technology with Possibilities for Economic Applications in Agriculture and Horticulture.” South African Journal of Botany 77 (4): 972–79. https://doi.org/10.1016/j.sajb.2011.08.006.

Langeroodi, A. S., P. Tedeschi, E. Allevato, S. R. Stazi, R. M. Aadil, R. Mancinelli, and E. Radicetti. 2022. “Agronomic Response of Sunflower Subjected to Biochar and Arbuscular Mycorrhizal Fungi Application under Drought Conditions.” Italian Journal of Agronomy 17 (3): 2086. https://doi.org/10.4081/ija.2022.2086.

Lehmann, J., and S. Joseph. 2015. “Biochar for Environmental Management: An Introduction.” In Biochar for Environmental Management, edited by J. Lehman and S. Joseph, 1–13. London: Taylor and Prancis.

Lehmann, J., Y. Kuzyakov, G. Pan, and Y. S. Ok. 2015. “Biochars and the Plant-Soil Interface.” Plant and Soil 395: 1–5. https://doi.org/10.1007/s11104-015-2658-3.

Liu, Xiangrong, Jiayuan Liao, Haixing Song, Yong Yang, Chunyun Guan, and Zhenhua Zhang. 2019. “A Biochar-Based Route for Environmentally Friendly Controlled Release of Nitrogen: Urea-Loaded Biochar and Bentonite Composite.” Scientific Reports 9 (1): 1–13. https://doi.org/10.1038/s41598-019-46065-3.

Nurida, N. L. 2014. “Potensi Pemanfaatan Biochar Untuk Rehabilitasi Lahan Kering Di Indonesia (Potency of Utilizing Biochar for Dryland Rehabilitation in Indonesia).” Jurnal Sumberdaya Lahan Edisi Khusus, 57–68.

Nurida, N. L., A. Rachman, and S. Sutono. 2015. Biochar Pembenah Tanah Yang Potensial. Jakarta: Balai Penelitian dan Pengembangan Pertanian.

Oni, B. A., O. Oziegbe, and O. O. Olawole. 2019. “Significance of Biochar Application to the Environment and Economy.” Annals of Agricultural Sciences 64 (2): 222–36. https://doi.org/10.1016/j.aoas.2019.12.006.

Phares, C. A., E. Amoakwah, A. Danquah, A. Afrifa, L. R. Beyaw, and K. A. Frimpong. 2022. “Biochar and NPK Fertilizer Co-Applied with Plant Growth Promoting Bacteria (PGPB) Enhanced Maize Grain Yield and Nutrient Use Efficiency of Inorganic Fertilizer.” Journal of Agriculture and Food Research 10 (May): 100434. https://doi.org/10.1016/j.jafr.2022.100434.

Rombel, Aleksandra, Patrycja Krasucka, and Patryk Oleszczuk. 2022. “Sustainable Biochar-Based Soil Fertilizers and Amendments as a New Trend in Biochar Research.” Science of the Total Environment 816: 1–17. https://doi.org/10.1016/j.scitotenv.2021.151588.

Schmidt, H., C. Kammann, N. Hagemann, J. Leifeld, T. D. Bucheli, M. A. S. Monedero, and M. L. Cayuela. 2021. “Biochar in Agriculture A Systematic Review of 26 Global Meta‐analyses.” GCB Bioenergy 13: 1708–30.

Schmidt, H. P., C. Kammann, C. Niggli, M. W.H. Evangelou, K. A. Mackie, and S. Abiven. 2014. “Biochar and Biochar-Compost as Soil Amendments to a Vineyard Soil: Influences on Plant Growth, Nutrient Uptake, Plant Health and Grape Quality.” Agriculture, Ecosystems and Environment 191 (June): 117–23. https://doi.org/10.1016/j.agee.2014.04.001.

Schmidt, H. P., B. H. Pandit, G. Cornelissen, and C. I. Kammann. 2017. “Biochar-Based Fertilization with Liquid Nutrient Enrichment: 21 Field Trials Covering 13 Crop Species in Nepal.” Land Degradation and Development 28 (8): 2324–42. https://doi.org/10.1002/ldr.2761.

Schmidt, H. P., B. H. Pandit, V. Martinsen, G. Cornelissen, P. Conte, and C. I. Kammann. 2015. “Fourfold Increase in Pumpkin Yield in Response to Low-Dosage Root Zone Application of Urine-Enhanced Biochar to a Fertile Tropical Soil.” Agriculture (Switzerland) 5 (3): 723–41. https://doi.org/10.3390/agriculture5030723.

Septiana, L. M., G. Djajakirana, and Darmawan. 2018. “Characteristics of Biochars from Plant Biomass Wastes at Low-Temperature Pyrolysis.” Sains Tanah - Journal of Soil Science and Agroclimatology 15 (1): 15–28. https://doi.org/10.15608/stjssa.v15i1.21618.

Sheil, D., I. Basuki, L. German, T. W. Kuyper, G. Limberg, R. K. Puri, B. Sellato, M. van Noordwijk, and E. Wollenberg. 2012. “Do Anthropogenic Dark Earths Occur in the Interior of Borneo? Some Initial Observations from East Kalimantan.” Forests 3 (2): 207–29. https://doi.org/10.3390/f3020207.

Solomon, D., J. Lehmann, J. A. Fraser, M. Leach, K. Amanor, V. Frausin, S. M. Kristiansen, D. Millimouno, and J. Fairhead. 2016. “Indigenous African Soil Enrichment as a Climate-Smart Sustainable Agriculture Alternative.” Frontiers in Ecology and the Environment 14 (2): 71–76. https://doi.org/10.1002/fee.1226.

Tan, X., Y. Liu, G. Zeng, X. Wang, X. Hu, Y. Gu, and Z. Yang. 2015. “Application of Biochar for the Removal of Pollutants from Aqueous Solutions.” Chemosphere 125: 70–85. https://doi.org/10.1016/j.chemosphere.2014.12.058.

Thiele-Bruhn, S., P. Leinweber, K. U. Eckhardt, H. K. Siem, and H. P. Blume. 2014. “Chernozem Properties of Black Soils in the Baltic Region of Germany as Revealed by Mass-Spectrometric Fingerprinting of Organic Matter.” Ganoderma 213: 144–54.

Vijay, V., S. Shreedhar, K. Adlak, S. Payyanad, V. Sreedharan, G. Gopi, T. S. van der Voort, et al. 2021. “Review of Large-Scale Biochar Field-Trials for Soil Amendment and the Observed Influences on Crop Yield Variations.” Frontiers in Energy Research 9 (August). https://doi.org/10.3389/fenrg.2021.710766.

Wang, J., L. Shi, L. Zhai, H. Zhang, S Wang, J. Zou, Z. Shen, C. Lian, and Y. Chen. 2021. “Analysis of the Long-Term Effectiveness of Biochar Immobilization Remediation on Heavy Metal Contaminated Soil and the Potential Environmental Factors Weakening the Remediation Effect: A Review.” Ecotoxicology and Environmental Safety 207: 1–13. https://doi.org/10.1016/j.ecoenv.2020.111261.

Xiang, Y., Q. Deng, H. Duan, and Y. Guo. 2017. “Effects of Biochar Application on Root Traits: A Meta-Analysis.” GCB Bioenergy 9 (10): 1563–72. https://doi.org/10.1111/gcbb.12449.",,,,,
2,2829-2235,public,2023-05-10 03:36:41,8,pub,Fakultas Pertanian Universitas Lampung,Jurnal Pengabdian Fakultas Pertanian Universitas Lampung,['FP2'],disk0_bak/00/05/13/42,"Gisting merupakan representasi wilayah pertanian frontier, antara pedesaan padat penduduk dan gunung berupa hutan lindung, yang merupakan sentra produksi sayur, ternak, kopi, dan pariwisata. Kegiatan pengabdian kepada masyarakat ini yang dilaksanakan di Desa Sidokaton, Kecamatan Gisting, Kabupaten Tanggamus bertujuan untuk meningkatkan pengetahuan dan keterampilan anggota kelompok tani Tanggamus Handayani dalam memahami pengembangan pertanian frontier dan agroforestry untuk peningkatkan produktivitas lahan dan pengembangan agrowisata menuju desa wisata.
Kegiatan ini dilaksanakan dengan metode ceramah dan tatap muka, Focus Group Discussion (FGD), pendampingan penguatan kelompok, serta anjangsana dan anjangkarya. Kegiatan ini melibatkan mahasiswa anggota PERMA AGT Fakultas Pertanian Universitas Lampung. Pengabdian ini dapat berjalan lancer dengan skore partisipasi 10 (skor 0-15) dan dapat meningkatkan pengetahuan dan keterampilan petani dalam pengembangan sistem usahatani pertanian dan agroforestry di wilayah frontier desa dan hutan lindung pegunungan serta pengembangan agrowisata dengan skore 38 (dari 0-50) yang berkategori baik.",2,2023-03,http://repository.lppm.unila.ac.id/id/eprint/51342,published,['SB'],"[{'name': {'given': 'Rusdi', 'lineage': None, 'family': 'Evizal', 'honourific': None}, 'id': 'rusdi.evizal@fp.unila.ac.id'}, {'id': 'setyo.widagdo@fp.unila.ac.id', 'name': {'given': 'Setyo', 'family': 'Widagdo', 'lineage': None, 'honourific': None}}, {'name': {'given': 'Sri', 'honourific': None, 'family': 'Yusnaini', 'lineage': None}, 'id': 'sri.yusnaini@fp.unila.ac.id'}, {'id': 'solikhin@fp.unila.ac.id', 'name': {'given': '.', 'lineage': None, 'family': 'Solikhin', 'honourific': None}}, {'name': {'given': 'Suskandini', 'honourific': None, 'family': 'Ratih', 'lineage': None}, 'id': 'suskandini.ratih@fp.unila.ac.id'}, {'id': ""nyimas.sa'diyah@fp.unila.ac.id"", 'name': {'family': ""Sa'diyah"", 'lineage': None, 'honourific': None, 'given': 'Nyimas'}}, {'name': {'given': 'Sugiatno', 'family': 'Sugiatno', 'lineage': None, 'honourific': None}, 'id': 'sugiatsugiatno@gmail.com'}, {'name': {'family': 'Karyanto', 'lineage': None, 'honourific': None, 'given': 'Agus'}, 'id': 'agus.karyanto@fp.unila.ac.id'}, {'name': {'given': 'Fembriarti Erry', 'family': 'Prasmatiwi', 'lineage': None, 'honourific': None}, 'id': 'fembriarti.erry@fp.unila.ac.id'}]",article,"Pengembangan Pertanian Frontier di Desa Sidokaton, Kecamatan Gisting, Tanggamus",TRUE,978,1,2023-05-10 03:36:41,https://jurnal.fp.unila.ac.id/index.php/JPFP/article/view/6831,"[{'eprintid': 51342, 'placement': 1, 'security': 'public', 'pos': 1, 'uri': 'http://repository.lppm.unila.ac.id/id/document/248076', 'format': 'text', 'main': '6831-22363-1-PB-Abdi FP.pdf', 'files': [{'fileid': 608254, 'datasetid': 'document', 'hash': '503a4303e318c655a4ff5b5f2fe3ef62', 'mime_type': 'application/pdf', 'objectid': 248076, 'filesize': 436256, 'uri': 'http://repository.lppm.unila.ac.id/id/file/608254', 'filename': '6831-22363-1-PB-Abdi FP.pdf', 'hash_type': 'MD5', 'mtime': '2023-05-10 03:10:19'}], 'docid': 248076, 'language': 'en', 'mime_type': 'application/pdf', 'rev_number': 1}]",2023-05-10 03:36:41,51342,archive,show,256-264,"A’inun, F., H. Krisnani, dan R.S. Darwis. 2015. Pengembangan desa wisata melalui konsep community base tourism. Prosiding KS: Riset dan PKM  2(3): 341-444.

BPS Kab. Tanggamus. 2022. Kabupaten Tanggamus dalam Angka 2021. In Kabupaten Tanggamus Dalam Angka 2022.

BPS Provinsi Lampung. 2022. Provinsi Lampung Dalam Angka 2022. In Badan Pusat Statistik Provinsi Lampung.

Evizal, R., Pujisiswanto, H., Utomo, S. D., Warganegara, H. A., Prasmatiwi, F. E., & Sadiyah, N. 2022. Pengembangan klon unggul dan diversifikasi usaha perkebunan kopi rakyat di Sekincau, Lampung Barat. Jurnal Pengabdian Fakultas Pertanian Universitas Lampung, 1(1), 11–20.

Khoirunnisa, A., Haryono, D., & Nugraha, A. 2013. Analisis Pendapatan dan Pengamblan Keputusan Dalam Menentukan Tanaman Sayuran Unggulan di Kecamatan Gisting Kabupaten Tanggamus. Jurnal Ilmu Ilmu Agribinis, 1(2), 98–104.

Septiadi, D., & Nursan, M. 2020. Optimasi Produksi Usaha Tani Sebagai Upaya Peningkatan Pendapatan. Jurnal Agrifo, 5(2), 87–96.

Susfenti, E.M.   2016.  Pengembangan desa wisata berbasis masyarakat (Community Based Tourism – CBT) di Desa Sikajadi Kecamatan Carita. Lembaran Masyarakat: Jurnal Pengembangan Masyarakat Islam 2(1): 73-86.",http://dx.doi.org/10.23960/jpfp.v2i1.6831,,,,
3,2337-4993,public,2023-05-17 04:06:45,7,pub,Jurusan Agroteknologi FP Unila,Jurnal Agrotek Tropika,['FP2'],disk0_bak/00/05/17/37,"Cabai keriting (Capsicum annum L.) merupakan komoditas hortikultura yang memiliki nilai ekonomi. Kebutuhan
cabai yang terus meningkat menyebabkan perlunya pasokan cabai yang mencukupi. Alternatif untuk mengatasi
kondisi tersebut adalah budidaya perkotaan pemanfaatan pekarangan. Budidaya perkotaan dapat dilakukan
dengan penggunaan wadah polybag. Media tanam perlu mengandung unsur hara yang mencukupi bagi tanaman
dan memiliki sifat fisik yang baik. Penelitian ini bertujuan untuk mengetahui pengaruh media tanam tanah,
serbuk kayu, arang sekam, dan serbuk sabut kelapa atau kombinasinya dan media tanam yang terbaik di antara
tanah, serbuk kayu, arang sekam, dan serbuk sabut kelapa atau kombinasinya untuk pertumbuhan dan produksi
cabai dalam polybag. Penelitian ini menggunakan Rancangan Acak Kelompok (RAK) dengan faktor tunggal 3
ulangan dan 7 perlakuan yaitu A0 (Tanah/Kontrol), A1 (Tanah + Serbuk Kayu), A2 (Tanah + Arang Sekam), A3
(Tanah +Serbuk Sabut Kelapa), A4 (Tanah +Serbuk Kayu +Arang Sekam), A5 (Tanah +Serbuk Kayu +Serbuk
Sabut Kelapa), dan A6 (Tanah +Arang Sekam +Serbuk Sabut Kelapa). Data yang diperoleh diuji keaditifan
dengan uji Tukey, homogenitas ragamnya dengan uji Barlett dan perbedaan nilai tengah diuji dengan
menggunakan Uji BNJ pada taraf 5%. Produksi tanaman terbaik hingga 18 MST terdapat pada jenis media
tanam tanah +arang sekam +serbuk sabut kelapa dengan jumlah buah layak konsumsi per tanaman terbanyak
yaitu 132,33 buah dan bobot buah per tanaman yaitu 393,67 g. Pada penelitian lanjutan 27 MST bahan media
yang menggunakan serbuk kayu mulai terdekomposisi dengan hasil jumlah buah total per tanaman paling
banyak pada perlakuan tanah +serbuk kayu +serbuk sabut kelapa yaitu 13 buah dan bobot buah total per
tanaman paling banyak yaitu 52,26 g.",11,2023-02,http://repository.lppm.unila.ac.id/id/eprint/51737,published,['S1'],"[{'name': {'family': 'Ranisa Putri', 'lineage': None, 'honourific': None, 'given': 'Evridini'}, 'id': None}, {'name': {'lineage': None, 'family': 'Widagdo', 'honourific': None, 'given': 'Setyo'}, 'id': 'setyo.widagdo@fp.unila.ac.id'}, {'id': None, 'name': {'given': 'Kus', 'family': 'Hendarto', 'lineage': None, 'honourific': None}}, {'name': {'given': 'Rugayah', 'honourific': None, 'lineage': None, 'family': 'Rugayah'}, 'id': 'rugayah.1961@fp.unila.ac.id'}]",article,PENGARUH BEBERAPA JENIS MEDIA TANAM TERHADAP PERTUMBUHAN DAN PRODUKSI CABAI KERITING (Capsicum annum L.) DALAM POLYBAG,TRUE,777,1,2023-05-17 04:06:45,https://jurnal.fp.unila.ac.id/index.php/JA/article/view/6923,"[{'placement': 1, 'eprintid': 51737, 'uri': 'http://repository.lppm.unila.ac.id/id/document/250106', 'pos': 1, 'security': 'public', 'docid': 250106, 'main': '20. Putri et al. 151 - 158.pdf', 'files': [{'mtime': '2023-05-17 03:04:39', 'hash_type': 'MD5', 'filename': '20. Putri et al. 151 - 158.pdf', 'uri': 'http://repository.lppm.unila.ac.id/id/file/612919', 'objectid': 250106, 'filesize': 789055, 'hash': '2919b8cb9cc88abea346e899c26626c5', 'mime_type': 'application/pdf', 'datasetid': 'document', 'fileid': 612919}], 'format': 'text', 'language': 'en', 'mime_type': 'application/pdf', 'rev_number': 1}]",2023-05-17 04:06:45,51737,archive,show,151-158,,,,,,
