,date,uri,corp_creators,abstract,subjects,event_title,ispublished,rev_number,status_changed,full_text_status,event_type,divisions,dir,lastmod,userid,metadata_visibility,eprintid,eprint_status,datestamp,event_location,refereed,event_dates,title,pres_type,type,creators,publisher,publication,issn,date_type,volume,contact_email,pagerange,number,official_url,documents,referencetext,related_url
7,1970-01-01 00:00:00.000002014,http://repository.lppm.unila.ac.id/id/eprint/37466,,"Oil palm (Elaeis guineensis Jacq.) in Indonesia commonly cultivated on land that is classified as marginal land such as soil type ultisol with a low fertility rate, so it is
necessary to improve the quality of seeds with the use of arbuscular mycorrhiza fungi (AMF) and NPK fertilizers. This study aimed (1) to determine the most appropriate type of AMF for oil palm seedling, (2) to determine the dose of NPK
fertilizeris best for the growth of oil palm seedlings, (3) to determine whether the response of oil palm seedlings to be determined by the type of NPK fertilizer, (4) to
determine the best dose of NPK fertilizer for each type of AMF. Research compiled using factorial treatment design (6 x2) with 5 replications. The first factor is the type of mycorrhizal (M) which consists of 6 levels iem0 (without AMF), m1 (Entrophospora sp. Isolates MV 3 ), m2 (Entrophospora sp. Isolates MV12), m3 (Glomus sp. Isolates MV 4), m4 (Glomus sp. Isolates MV11), and m5 (Glomus sp.
Isolates MV13). The second factor is the dose of NPK fertilizer (P) which consists of 2 level p1 (100% of the recommended dose), p2 (75% of the recommended dose).
The similarity of variance between treatments were tested with Least Significant Difference test (LSD) at 5% significance level. The results showed (1) All types of
FMA being tested can increase the growth of oil palm seedlings compared without exception AMF Glomus sp. MV isolates 11, (2) dose of NPK fertilizer 100% of
recommended doses produce the best growth of oil palm seedlings shown by the fresh weight of shoot, dry weight of shoot, fresh weight of root, dry weight of root, and leaf greenness level, (3) palm seedling growth response to AMF
inoculation is not determined by a given dose of NPK fertilizer, (4) there is no optimum dose of NPK fertilizer for each type of AMF were used.",['S1'],,pub,6,2021-12-28 04:13:09,public,,['FP25'],disk0/00/03/74/66,2021-12-28 04:13:09,741,show,37466,archive,2021-12-28 04:13:09,,TRUE,,Seleksi Lima Isolat Fungi Mikoriza Arbuskular untuk Pembibitan Kelapa Sawit (Elaeis guineensis Jacq.) pada dua Dosis Pupuk NPK,,article,"[{'name': {'given': 'Retta Ramadina', 'honourific': None, 'lineage': None, 'family': 'Rias'}, 'id': 'rettaramadhinarias@yahoo.com'}, {'id': 'maria.vivarini@fp.unila.ac.id', 'name': {'given': 'Maria Viva', 'honourific': None, 'family': 'Rini', 'lineage': None}}, {'id': 'fitri.yelli@fp.unila.ac.id', 'name': {'given': 'Fitri', 'lineage': None, 'family': 'Yelli', 'honourific': None}}]",Poloiteknik Negeri Lampung,Jurnal Penelitian Pertanian Terapan,1410-5020,published,15.0,,24-32,1.0,https://jurnal.polinela.ac.id/jppt/article/view/108,"[{'security': 'public', 'pos': 1, 'uri': 'http://repository.lppm.unila.ac.id/id/document/158391', 'eprintid': 37466, 'placement': 1, 'mime_type': 'application/pdf', 'language': 'en', 'rev_number': 1, 'format': 'text', 'main': 'JPPT-Retta dkk.pdf', 'docid': 158391, 'files': [{'datasetid': 'document', 'fileid': 428177, 'hash': 'd04944c493622004fcd472af1287126e', 'mime_type': 'application/pdf', 'objectid': 158391, 'filesize': 330583, 'filename': 'JPPT-Retta dkk.pdf', 'uri': 'http://repository.lppm.unila.ac.id/id/file/428177', 'hash_type': 'MD5', 'mtime': '2021-12-28 02:43:46'}]}]",,
8,1970-01-01 00:00:00.000002014,http://repository.lppm.unila.ac.id/id/eprint/37570,,"Salah satu upaya yang dapat dilakukan untuk meningkatkan pertumbuhan dan produksi kopi yang ditanam di lahan marginal seperti tanah Podsolid Merah Kuning (Ultisol) adalah dengan menggunakan pupuk hayati berbasis fungi mikoriza arbuskular (FMA) yang diaplikasikan pada saat pembibitan. Fungi ini
mampu meningkatkan kemampuan akar dalam menyerap unsur hara dan air dari tanah. Manfaat fungi ini akan terus berlanjut hingga tanaman ditanam di lapangan. Salah satu faktor yang mempengaruhi efektivitas FMA adalah jenis dan kesuburan media tanam. Oleh karena itu, penelitian ini dijalankan dengan tujuan untuk mendapatkan jenis FMA dan dosis pupuk yang paling sesuai untuk bibit kopi robusta dan untuk mencari dosis pupuk terbaik untuk masing-masing jenis
FMA. Rancangan perlakuan faktorial (6 x 2) digunakan dengan faktor pertama jenis FMA yaitu tanpa FMA, Glomus sp.1, Glomus sp.2, Glomus sp.3, Entrophospora sp. dan Gigaspora sp. Faktor ke dua adalah dosis pupuk yaitu setengah dosis anjuran dan dosis anjuran. Rancangan percobaan yang digunakan adalah rancangan kelompok teracak sempurna dengan 4 kelompok. Sebelum penelitian dilaksanakan, setiap jenis FMA yang digunakan diuji daya kecambahnya dengan mengecambahkan spora dalam sumur cell cluster plates
yang diisi dengan air suling yang telah disterilisasi. Plate kemudian bungkus dengan alumunium foil dan diinkubasi dalam inkubator pada suhu 31 oC selama 3 minggu. Hasil penelitian menunjukkan bahwa spora dari semua jenis FMA yang digunakan sudah berkecambah satu minggu setelah inkubasi dengan daya
kecambah 11—15% dan pada minggu ketiga meningkat jadi 39—54%. Dari 4 jenis FMA yang diuji, Glomus sp.3 memberikan respon terbaik dengan meningkatkan bobot basah dan bobot kering tajuk sebesar 35% dan 40% berturut-turut dan
meningkatkan bobot segar dan bobot kering akar sebesar 111% dan 42% berturut-turut. Perlakuan dosis pupuk tidak mempengaruhi pertumbuhan bibit.",['S1'],Seminar Nasional Pengembangan Teknologi Pertanian 2014,pub,10,2022-01-03 10:00:34,public,conference,['FP25'],disk0/00/03/75/70,2022-01-03 10:00:34,741,show,37570,archive,2022-01-03 10:00:34,Politeknik Negeri Lampung,FALSE,24 Mei 2014,"Pengaruh Lima Jenis Fungi Mikoriza Arbuskular Dan Dosis
Pupuk Anorganik Pada Pertumbuhan Bibit Kopi Robusta
(Coffea canephora Pierre)",paper,conference_item,"[{'id': 'maria.vivarini@fp.unila.ac.id', 'name': {'family': 'Rini', 'lineage': None, 'honourific': None, 'given': 'Maria Viva'}}, {'id': None, 'name': {'given': 'Ari D.', 'family': 'Januarsyah', 'lineage': None, 'honourific': None}}, {'id': 'sugiatno.1960@fp.unila.ac.id', 'name': {'given': 'Sugiatno', 'family': 'Sugiatno', 'lineage': None, 'honourific': None}}]",,,,published,,,551-559,,https://scholar.google.com/citations?user=qes2hdsAAAAJ&hl=en&oi=ao,"[{'files': [{'filename': 'PRosiding Semnas Pengembangan Teknologi Petanian Polinela 2014.pdf', 'uri': 'http://repository.lppm.unila.ac.id/id/file/429018', 'objectid': 158507, 'filesize': 441024, 'mtime': '2022-01-03 07:30:24', 'hash_type': 'MD5', 'hash': 'f0daac32c7932c3952d4d550737c0ee9', 'mime_type': 'application/pdf', 'datasetid': 'document', 'fileid': 429018}], 'main': 'PRosiding Semnas Pengembangan Teknologi Petanian Polinela 2014.pdf', 'docid': 158507, 'format': 'text', 'language': 'en', 'mime_type': 'application/pdf', 'rev_number': 1, 'placement': 1, 'eprintid': 37570, 'pos': 1, 'uri': 'http://repository.lppm.unila.ac.id/id/document/158507', 'security': 'public'}]",,
9,2014-09-01 00:00:00.000000000,http://repository.lppm.unila.ac.id/id/eprint/15656,,"Anggrek dinilai sebagai salah satu bunga yang indah. Minat terhadap pertumbuhan anggrek cenderung meningkat di kalangan
masyarakat Indonesia baru-baru ini. Salah satu genus yang populer di keluarga anggrek adalah Phalaenopsis. Hampir semua
anggrek tumbuh lambat, termasuk Phalaenopsis, beberapa perawatan tertentu harus diterapkan untuk meningkatkan
pertumbuhannya. Penelitian ini bertujuan untuk menyelidiki pengaruh konsenterasi dari vitamin B dan benziladenin (BA)
terhadap pertumbuhan Phalaenopsis. Penelitian dilakukan dengan rancangan acak lengkap dengan tiga ulangan. Perlakuan
diatur secara faktorial yang terdiri dari vitamin B (0 dan 1 g l-1) dan konsentrasi BA (20, 40, dan 60 mg l-1). Hasil penelitian
menunjukkan bahwa aplikasi vitamin B mengakibatkan peningkatan pertumbuhan sedangkan peningkatan konsentrasi BA
menyebabkan penurunan pertumbuhan seperti yang ditunjukkan oleh berat tanaman segar, jumlah daun, dan jumlah akar.
Perlakuan tersebut tidak mempengaruhi jumlah tunas baru. Kedua faktor menunjukkan pengaruh interaksi diantara keduanya,
di mana peningkatan pertumbuhan akibat pengaruh vitamin B bergantung pada konsentrasi BA. Hasil penelitian menunjukkan
bahwa kombinasi dari 1 g l-1 vitamin B dan 20 mg l-1 BA merupakan perlakuan terbaik dalam meningkatkan pertumbuhan
tanaman anggrek.
Kata kunci : Anggrek, benzyladenine, Phalaenopsis, vitamin B.",['S1'],,pub,6,2019-11-05 10:59:00,public,,['FP25'],disk0/00/01/56/56,2019-11-05 10:59:00,328,show,15656,archive,2019-11-05 10:59:00,,TRUE,,"PENGARUH VITAMIN B DAN BENZILADENIN TERHADAP
PERTUMBUHAN BIBIT ANGGREK PHALAENOPSIS HASIL
KULTUR JARINGAN",,article,"[{'name': {'family': 'Sukartini', 'lineage': None, 'honourific': None, 'given': 'Sukartini'}, 'id': None}, {'id': 'sri.ramadiana@fp.unila.ac.id', 'name': {'given': 'Sri', 'family': 'Ramadiana', 'lineage': None, 'honourific': None}}, {'id': 'dwi.hapsoro@fp.unila.ac.id', 'name': {'honourific': None, 'lineage': None, 'family': 'Hapsoro', 'given': 'Dwi'}}]",Jurusan Agroteknologi Fakultas Pertanian Universitas Lampung,Jurnal Agrotek Tropika,2337-4993,published,2.0,,358-363,3.0,,"[{'format': 'text', 'docid': 28774, 'main': '15. Sukartini et al 2014.pdf', 'files': [{'hash': '8a1062ba9345652cde96c6245ee13829', 'mime_type': 'application/pdf', 'fileid': 134721, 'datasetid': 'document', 'filename': '15. Sukartini et al 2014.pdf', 'uri': 'http://repository.lppm.unila.ac.id/id/file/134721', 'filesize': 277353, 'objectid': 28774, 'mtime': '2019-11-05 09:26:51', 'hash_type': 'MD5'}], 'language': 'en', 'rev_number': 1, 'mime_type': 'application/pdf', 'eprintid': 15656, 'placement': 1, 'security': 'public', 'pos': 1, 'uri': 'http://repository.lppm.unila.ac.id/id/document/28774'}]","Alicia, J. 2011. Pengaruh Jenis Pupuk Daun dan
Frekuensi Pemberian Benziladenin terhadap
Pembesaran Seedling Anggrek Dendrobium
Hibrida. (Skripsi). Fakultas Pertanian. Universitas
Lampung. 49 hlm.
Griesbach, R.J. 2002. Development of Phalaenopsis
orchids for the mass-market. p. 458–465. In: J.
Janick and A. Whipkey (eds.), Trends in New
Crops and New Uses. ASHS Press, Alexandria,
VA.
Handayani, Y. 2011. Persilangan Dialel Lengkap Dua
Tetua Anggrek, Pengecambahan Biji dan
Pembesaran Seedling In Vitro serta Aklimatisasi
Planlet Phalaenopsis. (Tesis). Pascasarjana
Magister Agronomi. Universitas Lampung. 82
hlm.
Hapsoro, D., A.P. Febrianie, and Yusnita. 2012. In
vitro shoot formation on sugarcane (Saccharum
officinarum L.) callus as affected by
benzyladenine concentrations. J. Agron.
Indonesia. 40 (1): 56 – 61.
Harjadi, S. S. 2009. Zat Pengatur Tumbuh. Penebar
Swadaya. Jakarta. 76 hlm.
Limarni, L., N. Akhir, I. Suliansyah, dan A. Riyadi. 2008.
Pertumbuhan bibit anggrek (Dendrobium sp.)
dalam kompot pada beberapa jenis media tanam
dan konsentrasi vitamin B1. Jurnal Jerami. 1(1):
38 – 45.
Palee, J., S. Dheeranupattana, A. Jatisatienr, and S.
Wangkarn. 2013. Effects of BA and NAA on
micropropagation and Stemona Alkaloids
production of Stemona curtisii Hook. f. Chiang
Mai J. Sci. 40(3) : 356 – 363
Surtinah dan E. Mutryarny. 2013. Frekuensi pemberian
Grow Quick LB terhadap pertumbuhan bibit
anggrek Dendrobium pada stadia komunitas Pot.
Jurnal Ilmiah Pertanian. 10 (2) : 31 – 40.
Wati, I. 2009. Pengaruh Jenis Pupuk, Frekuensi
Pemupukan, Vitamin B1, dan Benziladenin (BA)
pada Aklimatisasi dan Pembesaran Bibit Anggrek
Dendrobium. (Skripsi). Fakultas Pertanian.
Universitas Lampung. 57 hlm.
Yusnita, T. Wahyuningsih, P. Sulistiana, dan D. Hapsoro.
2013. Perbanyakan in vitro Sansevieria
trifasciata ‘Lorentii’: regenerasi tunas,
pengakaran, dan aklimatisasi planlet. J. Agron.
Indonesia. 41(1): 70 – 76.
Yusnita. 2014. Perbanyakan In Vitro Tanaman
Anggrek. Universitas Lampung. Lampung. 132
hlm.",
10,2014-09-02 00:00:00.000000000,http://repository.lppm.unila.ac.id/id/eprint/413,,"Having very small number of seeds, ‘Crystal’ guava fruit leads guava cultivars sold in Indonesian markets. Its thin skin and climacteric-typed respiration cause high transpiration and respiration rate, and shorten its shelf-life. Eventhough 2.5% chitosan was proofed to increase its shelf-life, but the effect of ethylene trapped under chitosan coating needs to be blocked in order to increase its coating effectively. This research which was conducted during September-October 2013 was aimed at studying the effects of 1-MCP and its combination with 2.5% chitosan in increasing fruit shelf-life and maintaining fruit qualities of ‘Crystal’ guava fruit. A completely randomized design of two factors was used. The first factor was 1-MCP gassing (control and 1-MCP), and the second one was chitosan (control and 2.5% chitosan). 1-MCP gas was developed by diluting 0.5 g 1-MCP powder into 30 ml of water. The results showed that (1) the sole application of 1-MCP increased fruit shelf-life and maintained fruit quality of ‘Crystal’ guava, and (2) the effect of 1-MCP was more profound in combination with chitosan application.",['S1'],,pub,7,2016-08-28 13:10:25,restricted,,['FP25'],disk0/00/00/04/13,2016-08-28 13:10:25,1038,show,413,archive,2016-08-28 13:10:25,,TRUE,,EFFECTS OF 1-METHYLCYCLOPROPENE AND CHITOSAN APPLICATIONS ON FRUIT SHELF-LIFE AND QUALITIES OF ‘CRYSTAL’ GUAVA FRUITS,,article,"[{'id': 'sestiwidodo@gmail.com', 'name': {'given': 'Soesiladi E.', 'lineage': None, 'family': 'Widodo', 'honourific': None}}, {'id': 'zulferiyenni@gmail.com', 'name': {'honourific': None, 'family': 'Zulferiyenni', 'lineage': None, 'given': 'None'}}]","Faculty of Industrial Technology UPN Veteran, STIKOM Bali",PROC. BALI INTERNATIONAL SEMINAR ON SCIENCE AND TECHNOLOGY (BISSTECH) II 2014,978-602-9372-70-0,published,,sestiwidodo@gmail.com,1-5,,http://www.bisstech.org,"[{'content': 'published', 'language': 'en', 'rev_number': 2, 'mime_type': 'application/pdf', 'format': 'text', 'date_embargo': '2024-09-04', 'files': [{'datasetid': 'document', 'fileid': 2259, 'hash': 'e5416a0c1c9be9d1123377d8f83b3ff5', 'mime_type': 'application/pdf', 'hash_type': 'MD5', 'mtime': '2016-08-24 09:57:02', 'objectid': 372, 'filesize': 478631, 'uri': 'http://repository.lppm.unila.ac.id/id/file/2259', 'filename': 'Article A3.1 (SEW).pdf'}], 'main': 'Article A3.1 (SEW).pdf', 'docid': 372, 'security': 'staffonly', 'uri': 'http://repository.lppm.unila.ac.id/id/document/372', 'pos': 1, 'eprintid': 413, 'placement': 1}]",,"[{'url': 'http://www.bisstech.org', 'type': 'pub'}]"
11,2014-05-01 00:00:00.000000000,http://repository.lppm.unila.ac.id/id/eprint/3701,,"Produktivitas kedelai di Indonesia masih rendah. Upaya meningkatkan produktivitas kedelai dapat dilakukan melalui dosis
pemupukan baik pupuk makro maupun mikro. Penelitian ini bertujuan (1) mengetahui pengaruh pemberian P terhadap
pertumbuhan dan hasil tanaman kedelai; (2) mengetahui tanggapan tanaman kedelai terhadap pemberian Si dalam meningkatkan
pertumbuhan dan hasil tanaman; (3) mengetahui tanggapan tanaman kedelai terhadap kombinasi pemberian P dan Si dalam
meningkatkan pertumbuhan dan hasil tanaman. Penelitian dilaksanakan di Laboratorium Lapang Terpadu Fakultas Pertanian
Universitas Lampung dari bulan Januari—Juni 2013. Perlakuan disusun secara faktorial (5x3) dalam RKTS dengan 3 ulangan.
Faktor pertama adalah dosis pupuk fosfor: 0 g 10 kg-1 tanah (P(0)); 0,5 g 10 kg-1 tanah (P(1)); dan 1 g 10 kg-1 tanah (P(2)). Faktor
kedua adalah dosis pupuk silika: 0 g 10 kg-1 tanah (Si(0)), 1 g 10 kg-1 tanah (Si(1)), 2 g 10 kg-1 tanah (Si(2)), 3 g 10 kg-1 tanah (Si(3)),
dan 4 g 10 kg-1 tanah (Si(4)). Data dianalisis dengan anara dan pemisahan nilai tengah dengan ortogonal polinomial (silika) dan
ortogonal kontras (fosfor) pada α 5%. Hasil penelitian menunjukkan bahwa pemberian P tidak tergantung dari pemberian Si.
Pemberian P 0,5 g 10 kg-1 tanah dan 1 g 10 kg-1 tanah lebih baik daripada tanpa pemberian P berdasarkan variabel jumlah daun,
jumlah buku subur, bobot kering berangkasan, bobot kering akar, dan bobot polong/tanaman dengan selisih masing-masing
sebesar 3 helai; 6,21 buku; 10,15 gram; 1,17 gram; dan 2,73 gram sedangkan pemberian P 0,5 g 10 kg-1 tanah tidak berbeda
dengan 1 g 10 kg-1 tanah pada pertumbuhan dan hasil tanaman kedelai kecuali pada tinggi tanaman dengan selisih 5,99 cm.
Pemberian silika sampai 4 g/10 kg tanah tidak menunjukkan pengaruh yang berbeda pada semua variabel pengamatan.",['S1'],,pub,6,2017-07-20 09:11:34,public,,['FP25'],disk0/00/00/37/01,2017-07-20 09:11:34,53,show,3701,archive,2017-07-20 09:11:34,,TRUE,,"PENGARUH APLIKASI FOSFOR DAN SILIKA TERHADAP PERTUMBUHAN
DAN HASIL TANAMAN KEDELAI (Glycine max [L.] Merrill.)",,article,"[{'name': {'given': 'E.A', 'honourific': None, 'family': 'puteri', 'lineage': None}, 'id': 'alinaputer262@yahoo.com'}, {'name': {'given': 'Y', 'lineage': None, 'family': 'Nurmiaty', 'honourific': None}, 'id': None}, {'name': {'given': 'Agustiansyah', 'family': 'Agustiansyah', 'lineage': None, 'honourific': None}, 'id': 'agustiansyah.1972@fp.unila.ac.id'}]",Jurnal Agrotek Tropika,Jurnal Agrotek Tropika,2337-4993,published,,,,,,"[{'pos': 1, 'uri': 'http://repository.lppm.unila.ac.id/id/document/3564', 'security': 'public', 'placement': 1, 'eprintid': 3701, 'rev_number': 1, 'language': 'en', 'mime_type': 'application/pdf', 'main': 'PENGARUH APLIKASI FOSFOR DAN SILIKA TERHADAP PERTUMBUHAN.pdf', 'files': [{'hash': 'da74288aa3d3c0e0a0f0eb1759230e57', 'mime_type': 'application/pdf', 'datasetid': 'document', 'fileid': 25819, 'uri': 'http://repository.lppm.unila.ac.id/id/file/25819', 'filename': 'PENGARUH APLIKASI FOSFOR DAN SILIKA TERHADAP PERTUMBUHAN.pdf', 'filesize': 75075, 'objectid': 3564, 'mtime': '2017-07-18 07:33:14', 'hash_type': 'MD5'}], 'docid': 3564, 'format': 'text'}]",,
