,date,uri,corp_creators,abstract,subjects,event_title,ispublished,rev_number,status_changed,full_text_status,event_type,divisions,dir,lastmod,userid,metadata_visibility,eprintid,eprint_status,datestamp,event_location,refereed,event_dates,title,pres_type,type,creators,publisher,publication,issn,date_type,volume,contact_email,pagerange,number,official_url,documents,referencetext,related_url
0,1970-01-01 00:00:00.000002014,http://repository.lppm.unila.ac.id/id/eprint/751,"['Auburn University, Auburn, Alabama, USA', 'USDA, Sugarcane Reseach Station, Florida', 'University of Lampung, Indonesia']","The synchronization of flowering time for sugarcane clones is critical for the success of sugarcane breeding program. Two known factors that contribute to flowering time were photoperiod and physiological age of clone. Little research about genotype, shade, rate of fertilizer (N), and soil types (soil) effecting flowering time has been reported for sugarcane. The objectives of this study were to identify major factors and interactions among those factors that are responsible for the flowering time. Three varieties, CP xx-1143, CP xx-2390, and CP 89-2143, were selected to represent early, mediate, and late flowering in this study. The three clones were plant in a split-split plot design with three replications in 2010 and 2011. AUFPC (Area under flowering progress curve) index was adapted to measure flowering progress. An analysis of variance (ANOVA) was conducted to evaluate the differences among four factors. A multiple comparison T-test by Fisher’s Least Significant Differences (LSD) was used to test the differences among AUFPC mean of each treatment within four factors. Highly significant differences were found for genotype in both years but for rate of fertilizer and soil type in 2011. The interaction of N x Soil consistently showed from year to year and genotype x N x Soil was detected in 2010 and the interactions of Genotype x N and N x Soil werepresented in 2011. The results from T test demonstrated the greatest difference for mean AUFPC index of each treatment within four factors was genotype ranging from 0.03 to 0.68, compared to 0.29 to 0.38, 0.31 to 0.38, and 0.34 to 0.36 for N, soil type, and shade, respectively. The results implied that genotype plays a major role in flowering time for sugarcane; therefore, extending crossing season in sugarcane breeding program is essential to manipulate the crosses by design.",['S1'],"ASA, CSSA, SSA International Annual MeetingLong Beach, CA, USA, At Long Beach, CA, USA",pub,7,2016-10-13 15:37:48,none,conference,['FP25'],disk0/00/00/07/51,2016-10-13 15:37:48,1078,show,751,archive,2016-10-13 15:37:48,al,FALSE,November 2014,"The Effects of Genotype, Soil Type, Rate of Fertilizer, and Shade on Sugarcane Flowering Time.",paper,conference_item,"[{'name': {'family': 'Chen', 'lineage': None, 'honourific': None, 'given': 'C.Y'}, 'id': None}, {'name': {'given': 'B.', 'family': 'Glaz', 'lineage': None, 'honourific': None}, 'id': None}, {'name': {'family': 'Utomo', 'lineage': None, 'honourific': None, 'given': 'Setyo Dwi'}, 'id': 'setyo.dwiutomo@fp.unila.ac.id'}]",,,,,,,,,,,,
1,2014-06-01 00:00:00.000000000,http://repository.lppm.unila.ac.id/id/eprint/1885,,"Sorghum (Sorghum bicolor (L.) Moench) is one of the cereal crops utilized as source of food, feed and bioethanol production. Intercropping with cassava is a promising means of developing sorghum plants in Lampung province of Indonesia. However, little information on sorghum intercropped with cassava has been documented. The study sought to evaluate the effect of planting dates on grain yield and content N, P, K and seed starch of several sorghum genotypes intercropped with cassava. A field experiment was conducted in Waway Karya of East Lampung, Lampung Province-Indonesia in 2009-2010. The treatments were arranged factorially with split-plot in randomized block design with three replications. The main plot was planting dates consisting of three levels, that was, 0, 2 and 4 weeks after planting cassava. Sub-plot was sorghum genotypes including Kawali, Mandau, B-76 and B-92. Fertilizers used were urea, SP-36 and KCl. Sorghum plants were intercropped with cassava and planted in interrows of cassava, while cassava was planted with row spacing of 80 cm x 60 cm. Sorghum plants intercropped with cassava and planted at 2 and 4 weeks after planting cassava resulted in lower grain yield and content of nutrient and seed starch compared to that planted at the same date of cassava planting. The highest reduction occured at the planting date of 4 weeks after planting cassava, that was, 72.9% for sorghum grain yield. The reduction in N, P and K content of sorghum plants caused by 4-weeks delayed planting was 14.5, 26.7 and 41.9%, respectively, while the reduction of seed starch content was only 6.0%.

Key words: cassava canopy, competition, nutrient content, panicle, planting date, shade, starch",['SB'],,pub,8,2017-05-30 01:18:57,public,,['FP25'],disk0/00/00/18/85,2017-05-30 01:18:57,847,show,1885,archive,2017-05-30 01:18:57,,TRUE,,"GRAIN YIELD AND, NUTRIENT AND STARCH CONTENT OF SORGHUM
(Sorghum bicolor (L.) Moench) GENOTYPES AS AFFECTED BY DATE OF INTERCROPPING WITH CASSAVA IN LAMPUNG, INDONESIA",,article,"[{'id': 'mkamal1961@yahoo.com', 'name': {'lineage': None, 'family': 'Kamal', 'honourific': None, 'given': 'Muhammad'}}, {'id': 'msyamshadi@yahoo.co.id', 'name': {'given': 'Muhammad Syamsoel', 'lineage': None, 'family': 'Hadi', 'honourific': None}}, {'name': {'honourific': None, 'family': 'Hariyanto', 'lineage': None, 'given': 'E.'}, 'id': None}, {'id': None, 'name': {'given': 'Jumarko', 'lineage': None, 'family': 'Jumarko', 'honourific': None}}, {'name': {'lineage': None, 'family': 'Ashadi', 'honourific': None, 'given': 'Ashadi'}, 'id': None}]",Journal of ISSAAS,J. ISSAAS,0859-3132,published,20.0,issaas15@nodai.ac.jp,64-76,1.0,http://issaas.org/journal/index.html,"[{'format': 'text', 'main': '2014 - Kamal et al - Grain Yield of sorghum.pdf', 'docid': 1743, 'files': [{'hash': '2aef2dae9603463414bd20067d574121', 'mime_type': 'application/pdf', 'datasetid': 'document', 'fileid': 13167, 'mtime': '2017-05-29 08:42:02', 'hash_type': 'MD5', 'uri': 'http://repository.lppm.unila.ac.id/id/file/13167', 'filename': '2014 - Kamal et al - Grain Yield of sorghum.pdf', 'filesize': 223840, 'objectid': 1743}], 'mime_type': 'application/pdf', 'language': 'en', 'rev_number': 1, 'eprintid': 1885, 'placement': 1, 'security': 'public', 'pos': 1, 'uri': 'http://repository.lppm.unila.ac.id/id/document/1743'}]",,
2,1970-01-01 00:00:00.000002014,http://repository.lppm.unila.ac.id/id/eprint/37582,,"Efektivitas  FMA selain tergantung dari jenis FMA juga tergantung jenis tanaman, dan bahan organik (BO).  Tujuan penelitian
yaitu menentukan (1) jenis FMA terbaik untuk pertumbuhan bibit; (2) dosis BO terbaik untuk pertumbuhan bibit; (3) apakah
respons bibit terhadap pemberian jenis FMA ditentukan oleh dosis BO; 4) kombinasi perlakuan yang paling baik untuk
pertumbuhan bibit.   Penelitian dalam faktorial (4x3) dengan 5 ulangan.  Faktor pertama jenis FMA (M) dalam 4 taraf  yaitu tanpa
FMA (m0
), Gigaspora sp. MV16 (m1
), Glomus sp. MV7 (m2
), Gigaspora sp. MV16 + Glomus sp. MV7 (m3
).  Faktor kedua bahan
organik : subsoil (B) dalam 3 taraf yaitu 1 : 3 (b1
),
 
1: 2 (b2
), 1: 1 (b3
).  Perlakuan diterapkan dalam RKTS.  Kehomogenan ragam
dan keaditifan data diuji dengan uji Bartlet dan uji Tukey, Bila asumsi tidak terpenuhi data akan ditransformasi, selanjutnya data dianalisis ragam dan diuji BNT pada taraf 5%.  Hasil penelitian (1) semua jenis FMA menghasilkan pertumbuhan bibit yang lebih baik dibandingkan  kontrol; (2) setiap dosis bahan organik  tidak mempengaruhi pertumbuhan bibit; (3) Pertumbuhan bibit tidak bermikoriza dipengaruhi oleh dosis bahan organik, bibit bermikoriza tidak dipengaruhi oleh dosis bahan organik; (4) jika tanaman tidak bermikoriza, maka dosis BO terbaik 1:1 dan 1:2.",['S1'],Seminar Nasional dan Rapat Tahunan Dekan Bidang Ilmu Pertanian BKS PTN Wilayah Barat 2014,pub,10,2022-01-04 01:56:40,public,conference,['FP25'],disk0/00/03/75/82,2022-01-04 01:56:40,741,show,37582,archive,2022-01-04 01:56:40,Bandar Lampung,FALSE,19-21 Agustus 2014,"PERTUMBUHAN BIBIT KELAPA SAWIT (Elaeis guineensis Jacq.)
DENGAN APLIKASI JENIS FUNGI MIKORIZA ARBUSKULAR (FMA)
PADA BERBAGAI DOSIS BAHAN ORGANIK",paper,conference_item,"[{'name': {'given': 'Krisnarini', 'honourific': None, 'lineage': None, 'family': 'Krisnarini'}, 'id': 'krisnarini7@gmail.com'}, {'id': 'maria.vivarini@fp.unila.ac.id', 'name': {'given': 'Maria Viva', 'lineage': None, 'family': 'Rini', 'honourific': None}}, {'id': 'paul.timotiwu@fp.unila.ac.id', 'name': {'given': 'P B', 'family': 'Timotiwu', 'lineage': None, 'honourific': None}}]",,,,published,,,237-243,,,"[{'content': 'published', 'language': 'id', 'rev_number': 2, 'mime_type': 'application/pdf', 'format': 'text', 'docid': 158517, 'main': 'Semirata 2014.PDF', 'files': [{'datasetid': 'document', 'fileid': 429085, 'mime_type': 'application/pdf', 'hash': 'fa6c4e37cce6df880850ebb79477d4e0', 'objectid': 158517, 'filesize': 56126, 'uri': 'http://repository.lppm.unila.ac.id/id/file/429085', 'filename': 'Semirata 2014.PDF', 'hash_type': 'MD5', 'mtime': '2022-01-03 11:10:24'}], 'security': 'public', 'uri': 'http://repository.lppm.unila.ac.id/id/document/158517', 'pos': 1, 'eprintid': 37582, 'placement': 1}]",,
3,2014-08-01 00:00:00.000000000,http://repository.lppm.unila.ac.id/id/eprint/3632,,"Pemuliaan tanaman merupakan upaya untuk memperoleh varietas unggul sehingga mampu menghasilkan benih
yang bermutu. Penelitian ini bertujuan untuk (1) mengetahui perbedaan respons viabilitas benih yang ditunjukkan antarkarakter
kuantitatif jumlah anakan dan jumlah bulir; (2) mengetahui perbedaan respons viabilitas benih antarvarietas nasional dengan
sumber genetik lokal; (3) mengetahui perbedaan respons viabilitas benih antarsumber genetik asal Lampung dengan luar
Lampung; (4) mengetahui perbedaan respons viabilitas benih antarsumber genetik asal Lampung; dan (5) mengetahui apakah
respons viabilitas benih antarkarakter kuantitatif ditentukan oleh sumber genetik. Rancangan perlakuan disusun secara
faktorial menggunakan rancangan kelompok teracak sempurna dengan tiga ulangan yang masing-masing ulangan terdapat
duplo. Faktor pertama adalah karakter kuantitatif jumlah anakan dan jumlah bulir dan faktor kedua adalah sumber genetik.
Homogenitas data diuji dengan uji Bartllet dan aditivitas data diuji dengan uji Tukey, setelah asumsi aalisis ragam terpenuhi
selanjutnya dilakukan perbandingan kelas. Hasil penelitian menunjukkan bahwa (1) adanya perbedaan viabilitas benih yang
ditunjukkan antarkarakter kuantitatif; (2) adanya perbedaan respons viabilitas antara varietas nasional dengan sumber
genetik lokal; (3) sumber genetik lokal Lampung dan lokal luar Lampung tidak menunjukkan adanya perbedaan respons
viabilitas; (4) perbedaan respons viabilitas antarsumber genetik lokal Lampung ditunjukkan oleh Kesit, Tewe, dan Gendut; (5)
respons viabilitas antarkarakter kuantitatif dipengaruhi oleh sumber genetik.
Kata kunci : padi, sumber genetik, viabilitas benih.",['S1'],eminar Nasional dan Rapat Tahunan Dekan Bidang Ilmu Pertanian BKS-PTN Wilayah Barat 2014,pub,9,2017-07-20 09:12:16,public,conference,['FP25'],disk0/00/00/36/32,2017-07-20 09:12:16,53,show,3632,archive,2017-07-20 09:12:16,,TRUE,,"EVALUASI VIABILITAS BENIH PADI BERDASARKAN KARAKTER
KUANTITATIF JUMLAH ANAKAN DAN JUMLAH BULIR
PADA TANAMAN INDUKNYA",paper,conference_item,"[{'name': {'given': 'Ade Yunike', 'honourific': None, 'family': 'Larassati', 'lineage': None}, 'id': 'Adeyunikelarassati@yahoo.com'}, {'name': {'family': 'Timotiwu', 'lineage': None, 'honourific': None, 'given': 'P.B.'}, 'id': 'paul.timotiwu@gmail.com'}, {'name': {'given': 'Agustiansyah', 'lineage': None, 'family': 'Agustiansyah', 'honourific': None}, 'id': 'agustiansyah.1972@fp.unila.ac.id'}]",,PROSIDING Seminar Nasional dan Rapat Tahunan Dekan Bidang Ilmu Pertanian BKS-PTN Wilayah Barat 2014,,published,,,1-8,,,"[{'security': 'public', 'uri': 'http://repository.lppm.unila.ac.id/id/document/3490', 'pos': 1, 'eprintid': 3632, 'placement': 1, 'language': 'en', 'mime_type': 'application/pdf', 'rev_number': 1, 'format': 'text', 'main': 'EVALUASI VIABILITAS BENIH PADI BERDASARKAN KARAKTER.pdf', 'docid': 3490, 'files': [{'filename': 'EVALUASI VIABILITAS BENIH PADI BERDASARKAN KARAKTER.pdf', 'uri': 'http://repository.lppm.unila.ac.id/id/file/25386', 'filesize': 737067, 'objectid': 3490, 'mtime': '2017-07-05 07:03:07', 'hash_type': 'MD5', 'mime_type': 'application/pdf', 'hash': '29a1f703b46a44e5d9461048122e25d7', 'datasetid': 'document', 'fileid': 25386}]}]",,
4,1970-01-01 00:00:00.000002014,http://repository.lppm.unila.ac.id/id/eprint/3702,,The aim of the research was to investigate the effect of bokashi compost and NPK fertilizer on the growth and yield of kangkkong during two planting times.  The experiment was conducted in field experimentation BPTP Bandar Lampung from September 2012 until February 2013.  The experimental design was completely  randomized block design with 3 replications.  The treatments were: control; recommended inorganic fertilizers NPK 15:15:15 500 kg ha-1 ; cow manure compost 20 t ha-1 + recommended NPK fertilizer; cow manure compost + 50%  recommended NPK fertilizer; vegetables municipal waste compost + recommended NPK fertilizer; vegetables municipal waste compost + 50%  recommended NPK fertilizer; chicken manure compost + recommended NPK fertilize;  chicken manure compost + 50% recommended NPK fertilizer; maize straw compost + recommended NPK fertilizer; maize straw compost + 50% recommended NPK fertilizer.  Result of experiment showed that chicken manure compost combined with NPK fertilizers was the best compost among other composts.  Chicken manure compost had a residual effect until the second planting time.  This implied that the use of chicken compost could reduce the use of inorganic fertilizers during two planting times of kangkung.  The application of  50%  inorganic fertilizers combined with chicken compost bokashi was recommended to apply,['S1'],,pub,6,2017-07-20 09:10:14,public,,['FP25'],disk0/00/00/37/02,2017-07-20 09:10:14,842,show,3702,archive,2017-07-20 09:10:14,,TRUE,,KOMPOS BOKASHI DAN PUPUK NPK MENINGKATKAN PERTUMBUHAN DAN PRODUKSI KANGKUNG SELAMA DUA KALI PERTANAMAN,,article,"[{'id': 'darwin.pangaribuan@fp.unila.ac.id', 'name': {'given': 'Darwin H', 'family': 'Pangaribuan', 'lineage': None, 'honourific': None}}]",Perhimpunan Hortikultura Indonesia,Prosiding Seminar Nasional Perhimpunan Hortikultura Indonesia,978-979-25-1268-7,published,,,316-323,,http://perhorti.or.id/front,"[{'mime_type': 'application/pdf', 'language': 'en', 'rev_number': 1, 'format': 'text', 'files': [{'mime_type': 'application/pdf', 'hash': 'a4b11fca612e76fda19caee3d17ac39a', 'fileid': 25829, 'datasetid': 'document', 'filename': 'perhorti 2013 Kangkung.pdf', 'uri': 'http://repository.lppm.unila.ac.id/id/file/25829', 'objectid': 3565, 'filesize': 376683, 'mtime': '2017-07-19 07:19:59', 'hash_type': 'MD5'}], 'main': 'perhorti 2013 Kangkung.pdf', 'docid': 3565, 'security': 'public', 'pos': 1, 'uri': 'http://repository.lppm.unila.ac.id/id/document/3565', 'eprintid': 3702, 'placement': 1}]",,
5,2014-05-01 00:00:00.000000000,http://repository.lppm.unila.ac.id/id/eprint/6552,,"Produktivitas kedelai di Indonesia masih rendah penyebabnya yaitu iklim tropis di Indonesia yang kurang optimal bagi
pertumbuhan tanaman kedelai. Upaya untuk meningkatkan produktivitas tanaman kedelai di Indonesia yaitu dengan aplikasi
zat pengatur pertumbuhan (ZPT) seperti giberelin (GA3). Penggunaan giberelin dapat menggantikan panjang hari yang
dibutuhkan oleh tanaman kedelai. Tujuan penelitian adalah untuk (1) mengetahui konsentrasi giberelinyang efektif pada
pertumbuhan tanaman dan produksi dua varietas tanaman kedelai, (2) mengetahui perbedaan respons dua varietas yang
berbeda pada pertumbuhan dan produksi tanamankedelai, dan (3) mengetahui respons dua varietas kedelai dan konsentrasi
giberelinpada pertumbuhan dan produksi tanaman kedelai. Perlakuan terdiri atas lima taraf konsentrasi giberelinyaitu 0, 100,
200, 300, dan 400 ppm sebagai faktor pertama dan dua varietas kedelai yaitu varietas Burangrang dan Tanggamus sebagai
faktor kedua. Perlakuan disusun secara faktorial pada rancangan kelompok teracak sempurna (RKTS). Kesamaan ragam data
antarperlakuan diuji dengan uji Barlett dan aditivitas ragam data antarperlakuan diuji dengan uji Tukey. Uji lanjut terhadap
peningkatan konsentrasi giberelin diuji dengan uji beda nyata jujur (BNJ) pada taraf nyata 5%. Hasil penelitian menunjukkan
bahwa pengaruh interaksi antara konsentrasi giberelindan varietas hanya terlihat pada variabel tinggi tanaman dan jumlah
bunga tanaman kedelai. Pemberian giberelin dengan konsentrasi 200 ppm efektif dalam meningkatkan tinggi tanaman kedelai
dan varietas Tanggamus memiliki tingkat pertumbuhan dan produksi yang lebih baik dibandingkan dengan varietas Burangrang.",['SB'],,pub,6,2018-04-25 08:31:01,public,,['FP25'],disk0/00/00/65/52,2018-04-25 08:31:01,53,show,6552,archive,2018-04-25 08:31:01,,TRUE,,"PENGARUH GIBERELIN (GA3)TERHADAP PERTUMBUHAN
DAN PRODUKSI TANAMAN KEDELAI (Glycine max (L.) Merrill.)",,article,"[{'name': {'honourific': None, 'family': 'Pertiwi', 'lineage': None, 'given': 'P.D'}, 'id': None}, {'id': 'agustiansyah.1972@fp.unila.ac.id', 'name': {'honourific': None, 'lineage': None, 'family': 'Agustiansyah', 'given': 'Agustiansyah'}}, {'id': None, 'name': {'honourific': None, 'family': 'Nurmiaty', 'lineage': None, 'given': 'Y'}}]",Jurnal Agrotek Tropika,Jurnal Agrotek Tropika,2337-4993,published,2.0,,276-281,2.0,,"[{'uri': 'http://repository.lppm.unila.ac.id/id/document/19501', 'pos': 1, 'security': 'public', 'placement': 1, 'eprintid': 6552, 'mime_type': 'application/pdf', 'language': 'en', 'rev_number': 1, 'main': 'PENGARUH GIBERELIN (GA3)TERHADAP PERTUMBUHAN.pdf', 'files': [{'fileid': 60524, 'datasetid': 'document', 'mime_type': 'application/pdf', 'hash': '9865ae5225d9e815d43c1746665de071', 'hash_type': 'MD5', 'mtime': '2018-02-28 07:48:29', 'filesize': 87651, 'objectid': 19501, 'filename': 'PENGARUH GIBERELIN (GA3)TERHADAP PERTUMBUHAN.pdf', 'uri': 'http://repository.lppm.unila.ac.id/id/file/60524'}], 'docid': 19501, 'format': 'text'}]",,
6,2014-01-01 00:00:00.000000000,http://repository.lppm.unila.ac.id/id/eprint/15781,,"Untuk pertumbuhan vegetatif, tanaman membutuhkan pupuk dengan kandungan nitrogen (N) yang tinggi, sedangkan untuk
masuk ke fase generatif tanaman membutuhkan pupuk dengan kandungan fosfor (P) dan kalium (K) yang tinggi. Pemberian
ZPT benziladenin dilaporkan dapat merangsang pertumbuhan anggrek Phalaenopsis dan Dendrobium pada waktu aklimatisasi.
Disamping itu, pemberian BA juga dilaporkan dapat merangsang pembungaan pada anggrek Doritaenopsis dan Phalaenopsis. Penelitian ini bertujuan (1) mengetahui pengaruh jenis pupuk Growmore terhadap pertumbuhan dan pembungaan anggrek Dendrobium, (2) mengetahui pengaruh benziladenin terhadap pertumbuhan dan pembungaan anggrek Dendrobium, dan (3)mengetahui apakah ada interaksi antara jenis pupuk dan benziladenin dalam mempengaruhi pertumbuhan dan pembungaan anggrek Dendrobium. Penelitian bertempat di rumah kaca Fakultas Pertanian Universitas Lampung, dan dilaksanakan selama 4 bulan, yaitu dari bulan Februari sampai dengan bulan Juli 2011. Perlakuan disusun secara faktorial (3x2) dalam rancangan kelompok teracak sempurna (RKTS) dengan 3 ulangan. Faktor pertama adalah pupuk daun, yaitu pupuk GrowmoreBiru (G1),GrowmoreMerah (G2),GrowmoreBiru + GrowmoreMerah (G3) dengan kosentrasi pupuk masing-masing adalah 2 g l-1. Faktor kedua adalah benziladenin (BA), yaitu tanpa pemberian BA (B0), dan pemberian BA (B1), dengan kosentrasi50 mg l-1. Setiap
satuan percobaan terdiri dari 6 pot tanaman. Kesamaan ragam antar-perlakuan diuji dengan uji Bartlett. Kemudian data diolah dengan menggunakan sidik ragam yang dilanjutkan dengan uji BNT pada taraf nyata 5%.Hasil analisis ragam menunjukkan bahwa pemberian GrowmoreBiru, GrowmoreMerah dan GrowmoreBiru + GrowmoreMerah tidak berpengaruh nyata terhadap tinggi tunas baru, jumlah tunas baru, jumlah akar primer, jumlah bunga, panjang malai, dan jumlah kuntum bunga. Pemberian BA dengan konsentrasi 50 mg l-1 tidak berpengaruh nyata terhadap tinggi tunas baru, jumlah tunas baru, jumlah akar primer, jumlah bunga, panjang malai dan jumlah kuntum bunga. Tidak ada pengaruh interaksi yang nyata antara pemberian pupuk dan pemberian ZPT terhadap seluruh variabel yang diamati yaitu tinggi tunas baru, jumlah tunas baru, jumlah akar primer,jumlah daun, panjang malai, dan jumlah kuntum bunga.
Kata kunci : benziladenin, growmore, pembungaan",['S1'],,pub,6,2019-11-07 02:55:57,public,,['FP25'],disk0/00/01/57/81,2019-11-07 02:55:57,328,show,15781,archive,2019-11-07 02:55:57,,TRUE,,"PENGARUH JENIS PUPUK GROWMORE DAN BENZILADENIN
TERHADAP PERTUMBUHAN DAN PEMBUNGAAN ANGGREK Dendrobium",,article,"[{'id': None, 'name': {'given': 'Pitriyanto', 'honourific': None, 'lineage': None, 'family': 'Pitriyanto'}}, {'id': 'dwi.hapsoro@fp.unila.ac.id', 'name': {'family': 'Hapsoro', 'lineage': None, 'honourific': None, 'given': 'Dwi'}}, {'name': {'given': 'Yusnita', 'family': 'Yusnita', 'lineage': None, 'honourific': None}, 'id': 'yusnita.1961@fp.unila.ac.id'}]",Jurnal Agrotek Tropika,Jurnal Agrotek Tropika,2337-4993,published,2.0,,7-10,1.0,http://jurnal.fp.unila.ac.id,"[{'language': 'en', 'rev_number': 1, 'mime_type': 'application/pdf', 'format': 'text', 'docid': 28887, 'main': '14. Pitriyanto et al 2014.pdf', 'files': [{'fileid': 135585, 'datasetid': 'document', 'mime_type': 'application/pdf', 'hash': 'cb30ac2557fdfb114ab3471d13d725a8', 'filesize': 55489, 'objectid': 28887, 'filename': '14. Pitriyanto et al 2014.pdf', 'uri': 'http://repository.lppm.unila.ac.id/id/file/135585', 'hash_type': 'MD5', 'mtime': '2019-11-06 08:39:20'}], 'security': 'public', 'pos': 1, 'uri': 'http://repository.lppm.unila.ac.id/id/document/28887', 'eprintid': 15781, 'placement': 1}]","Alicia, J. 2011. Pengaruh Jenis Pupuk Daun dan
Frekueni Pemberian Benziladenin terhadap
Pembesaran Seedling Anggrek Dendrobium
Hibrida. Skripsi. Universitas Lampung.
Blanchard, M. G. And E. S. Runkle. 2008. Benziladenine
promotes flowering in Doritaenopsis and
Phalaenopsis orchids. J. Plant Growth Regul.
27:141-151.
BPS. 2011. http://www.bps.go.id/menutab.php?tabel
=1&kat=3&id_subyek=55. Diakses maret 2013.
Handayani, Y. 2011. Persilangan Diallel lengkap dua
Tetua Anggrek, Perkecambahan Biji dan
Pembesaran Sedling in Vitro serta Aklimatisasi
Phalaenopsis.Tesis. Program Magister Agronomi
Universitas Lampung.
Hendaryono, D.S. 1998. Budidaya Anggrek Dengan
Bibit dalam Botol. Yogyakarta. Kanisius.
Lingga, P. 1999. Petunjuk Penggunaan Pupuk.
Penebar Swadaya. Jakarta.
Nambiar, N. Siang, C.T, dan Mahmood, M. 2012. Effect
of 6-benzylaminopurine on flowering of a
Dendrobium orchid.Australian Journal of Crop
Science6(2):225-231.
Suhar. 2012. Respon Pertumbuhan Planlet Anggrek
Dendrobium Hibrida pada Berbagai Konsentrasi
Zat Pengatur Tumbuh selama Aklimatisasi.
Skripsi. Jurusan Agroteknologi Fakultas
Pertanian, Perikanan, dan Biologi. Universitas
Bangka Belitung.
Widiastoety, D., N. Solvia, dan M, Soedarjo. 2010.
Potensi anggrek Dendrobium dalam
meningkatkan variasi dan kualitas anggrek bunga
potong. Jurnal Litbang Pertanian.29 (3):101-
106.
Winarso, S. 2005. Kesuburan Tanah: Dasar
Kesehatan dan Kualitas Tanah. Gava Media.
Yogyakarta.
Wu, P. H and D. C. N. Chang. 2009. The use of N-Gbenziladenine
to regulate flowering of phalaenopsis
orchids. Hort Tech. 19(1):200-203.",
