,uri,volume,subjects,date_type,rev_number,status_changed,funders,publication,dir,divisions,lastmod,metadata_visibility,contact_email,title,creators,type,date,corp_creators,abstract,keywords,ispublished,full_text_status,issn,publisher,related_url,documents,official_url,number,userid,pagerange,eprintid,referencetext,eprint_status,id_number,datestamp,refereed,place_of_pub,patent_applicant
0,http://repository.lppm.unila.ac.id/id/eprint/51145,15.0,['TA'],published,6,2023-05-08 02:04:46,['Indocement Ltd'],Civil and Environmental Research,disk0_bak/00/05/11/45,['FT4'],2023-05-08 02:04:46,show,chatarinaniken@yahoo.com,Short-term Deformation Model based on Surrounding Relative Humidity of Concrete Plate under Humid Tropical Weather,"[{'name': {'given': 'Niken', 'honourific': None, 'lineage': None, 'family': 'Chatarina'}, 'id': 'chatarinaniken@yahoo.com'}]",article,2023-02-28,['University of Lampung'],"This paper presents the deformation model based on surrounding relative humidity on one full scale concrete plate with compressive strength of 60MPa in which the concrete plate was placed on several pedestals. This research was conducted in Indonesia, a country with humid tropical weather with dry-wet conditions. A plate specimen measuring 3.00m × 1.60m × 0.15m was used for the experiment. The load was applied at the age of 14 days. The concrete plate behaviour was obtained by using four embedded vibrating wire strain gauges. The specimen was observed between 7 to 97 days of period. As a result, deformation model is similar to surrounding relative humidity reflection model. The result of Omar et al., 2008 research in Malaysia also shows a resemblance to the reflection of surrounding relative humidity (SRH) model. The deformation or shrinkage model for high performance concrete plate is εt= -SRHt.10-5 + SRHinitial.10-5. f + C. “f” is a factor of initial surrounding relative humidity, C is the factor related to the position, and surface area.  Meanwhile, the average error in maximum deformation position is about 26.8%. A large difference indicates that the level of difficulty for humidity enter the pore network.","Concrete, Deformation, Humidity, Plate, Shrinkage",pub,public,2225-0514,IISTE,[{'url': 'https://iiste.org/Journals/index.php/CER/article/view/60394'}],"[{'uri': 'http://repository.lppm.unila.ac.id/id/document/190867', 'pos': 1, 'security': 'public', 'placement': 1, 'eprintid': 51145, 'language': 'en', 'rev_number': 1, 'mime_type': 'application/pdf', 'docid': 190867, 'main': 'Short term deformation model based on surrounding relative humidity.pdf', 'files': [{'objectid': 190867, 'filesize': 1162300, 'uri': 'http://repository.lppm.unila.ac.id/id/file/549748', 'filename': 'Short term deformation model based on surrounding relative humidity.pdf', 'hash_type': 'MD5', 'mtime': '2023-05-06 15:00:47', 'datasetid': 'document', 'fileid': 549748, 'mime_type': 'application/pdf', 'hash': '65a78ad5dca5d70d115dc78502f074b1'}], 'format': 'text'}]",https://www.iiste.org,1.0,846,31-41,51145,"ACI (1992). Prediction of Creep, Shrinkage, and Temperature Effects in Concrete Structures, ACI 209R-92, Farmington Hills, USA, 1-47. http://www.bpesol.com/bachphuong/media/images/book/209r_92.pdf
Aghdam, S.R., Masoero, E., Rasoolinejad, M., & Bazant, Z.P. (2019). Century long expansion of hydrating cement counteracting concrete shrinkage due to humidity drop from self-desiccation external drying. Materials and Structure, 52 (11), 1-21. https://link.springer.com/article/10.1617/s11527-018-1307-8
Bažant, Z.P., & Wittman, F.H. (1982). Creep and Shrinkage in Concrete Structures. John Wiley & Sons, Inc., New York, 129 – 161. http://www.civil.northwestern.edu/people/bazant/PDFs/Papers/S09.pdf
Derjaguin, B.V., & Churaev, N.V. (1978). On the question of determining the concept of disjoining pressure and its role in the equilibrium and flow of thin film. Journal of Colloid and Interface Science, 66 (6), 389 – 398. https://www.sciencedirect.com/science/article/pii/0021979778900565
Dey, A., Vastrad, A.V., Bado, M.F., Sokolov, A., & Kaklauskas, G. (2021). Long-term concrete shrinkage influence on the performance of reinforced concrete structure. Material, 14 (2), 1-16, DOI: 10.3390/ma14020254
Elzokra, A.A., Al-Houri, A., Habib, A., Habib, M., & Malkawi, A.B. (2020). Shrinkage behavior of conventional and nonconventional concrete: A Review. Civil Engineering Journal, 6 (9), 1839-1851. https://doi.org/10.28991/cej-2020-03091586
Gao, P., Chen, Y., Huang, H., Qian, Z., Schlangen, E., Wei, J., & Yu, Q. (2020). Effect of relative humidity on drying-induced damage in concrete: A comparative study of digital image correlation and lattice modelling. Materials & Design, 196. https://doi.org/10.1016/j.matdes.2020.109128.
Holzer, L., Gasser, P., & Muench, B. (2006). Quantification of capillary pores and Hadley grains in cement paste using FIB-nanotomography: measuring, monitoring and modeling concrete properties. In 2nd International Symposium on Advance in Concrete through Science and Engineering. Springer, Quebec City, Canada, Sept, 509-516. https://www.dora.lib4ri.ch/empa/islandora/object/empa%3A8363/datastream/PDF/Holzer-2006- Quantification_of_capillary_porosity_in-%28published_version%29.pdf
Latief, R.H. (2019). Evaluation of the performance of glassphalt concrete mixtures for binder course. International Journal on Advanced Science Engineering Information Technology, 9 (4), 1251-1259. DOI: 10.18517/ijaseit9.4.5858.
Lentzkow, M. (2018). Shrinkage of concrete: minimizing/eliminating the potential for cracking. Tilt-up today-A publication of the Tilt-up concrete association (TCA). [Online]. https://tilt-up.org/tilt-uptoday/2018/01/27/shrinkage-of-concrete-minimizingeliminating-the-potential-for- cracking/
Li, L., Zhou, D., & S. Wu. (2019). Comparison of calculation methods of creep coefficients and shrinkage strains based on four specifications. IOP Conference Series: Earth and Environmental Science, 242, 1-5. DOI; 10.1088/1755-1315/24.
Li, P., & He, S. (2018). Effects of variable humidity on the creep behavior of concrete and the long-term deflection of RC beams. Advances in Civil Engineering, 2018. https://doi.org/10.1155/2018/8301971
Maruyama, I., Kishi, N., & Aili, A. (2021). The relative humidity range for the development of irreversible shrinkage in hardened cement paste. Journal of Advanced Concrete Technology. 19 (6), 585-592. DOI: 10.3151/jact.19.585
Mohammad, I. (2019). Deformation of concrete. FKA- UTM. 1-70 slides. [Online]. Available: https://people.utm.my/mohammad/files/2018/04/K18-Durability-Deformation.pdf
Mukhopadhyay, A. K., Ye, D., & Zollinger, D.G. (2006). Moisture – related cracking effects on hydrating concrete pavement. Texas Department of Transportation Research and Technology Implementation. Texas. Research Report, no: FHWA/TX-05/0-1700-6, 172 pages. [Online]. https://trid.trb.org/view.aspx?id=798354
Namita. (2020). Shrinkage cracking in concrete structures - Long-term effects. [Online]. https://civildigital.com/long-term-shrinkage-cracking-of-concrete/             
Niken, C., Elly, T., Supartono, F.X., & Laksmi, I. (2018). Deformation of high-performance concrete plate under humid tropical weather. IOP Conference Series: Material Science and Engineering, 316, 1-9. DOI:10.1088/1757- 899X/316/1/012036
Niu, X-J., Li, Q-B., Liu, W-J., & Hu, Y. (2020). Effects of ambient temperature, relative humidity and wind speed on interlayer properties of dam concrete. Construction and Building Materials, 260. https://doi.org/10.1016/j.conbuildmat.2020.119791
Omar, W., Makhtar, A.M., Mahir, A., Lai, T.P., Omar, R., & Ng, M.K. (2008). Creep, shrinkage and elastic modulus data of Malaysian concrete. Project Report, Faculty of Civil Engineering, Johor, Malaysia, 1-230. [Online]. http://eprints.utm.my/id/eprint/6691/1/73300.pdf
Pecker, H. (2020). Diagnosing 6 types of concrete cracks. Concrete Material. [Online]. https://constructionhow.com/types-of-concrete-cracks
Szlachetka, O., Witkowska-Dobre, J., Dohojda, M, & Cala, A. (2021). Influence of compressive strength and maturity conditions on shrinkage of ordinary concrete. Advances in Mechanical Engineering, 13 (6), 1-11. DOI: 10.1177/16878140211024434
Termkhajornkit, P. & Nawa, T. (2006). A Study of composition of CSH gel in cement paste, recent development of concrete technology and structure. in Second Asian Concrete Federation Conference. repository.unhas.ac.id/bitstream/handle/123456789/2395/ACFC RPP-20
Tran, N. P., Gunasekara, C., Law, D.W., & Houshyar, S. (2021). A critical review on drying shrinkage mitigation strategies in cement-based materials. Journal of Building Engineering, 38 (9). DOI: 10.1016/j.jobe.2021.102210
Wang, L., & Zollinger, D.G., (2000). A mechanistic design framework for spalling distress. Transportation Research Board, National Research Council, 1730 (1), 18 – 24. https://trid.trb.org/view/671709
Yang, Y., Ma, L., Huang, J., Gu, C., Xu, Z., Liu, J., & Ni, T. (2019). Evaluation of the thermal and shrinkage stresses in restrained high-performance concrete. Materials, 12 (22). www.mdpi.com › 12 › 22 › pdf
Yu, J., Zhao, J., Jin, T., Zhang, S., & Yang, Y. (2020). Analysis of bearing capacity of the six-sided plate pavement structure considering connection. IOP Conference Series: Earth and Environmental Science, 1-9. DOI:10.1088/1755-1315/525/1/012052
Zhang, J., Han, Y., & Sun, W. (2012). Shrinkage and interior humidity under dry-wet cycles. Drying Technology, 30 (6), 583-596. https://www.researchgate.net/publication/259811012_Shrinkage_and_Interior_Humidity_of_Concrete_under_Dr y-Wet_Cycles
Hadi, M., Faria, R., Azenha, M., & Guang Ye, G. (2021). Modeling macroscopic shrinkage of hardened cement paste considering C-S-H densification. Advances in Cement Research, 33(6), 257-284. https://doi.org/10.1680/jadcr.19.00141",archive,10.7176/CER/15-1-04,2023-05-08 02:04:46,TRUE,,
1,http://repository.lppm.unila.ac.id/id/eprint/51146,,['TA'],,7,2023-05-08 02:04:51,,,disk0_bak/00/05/11/46,['FT4'],2023-05-08 02:04:51,show,chatarinaniken@yahoo.com,Turnitin Short-term Deformation Model based on Surrounding Relative Humidity of Concrete Plate under Humid Tropical Weather,"[{'id': 'chatarinaniken@yahoo.com', 'name': {'given': 'Niken', 'honourific': None, 'lineage': None, 'family': 'Chatarina'}}]",other,2023-02-28,['University of Lampung'],13% Overall Similarity,,pub,public,,Universitas Lampung,,"[{'placement': 1, 'eprintid': 51146, 'pos': 1, 'uri': 'http://repository.lppm.unila.ac.id/id/document/190868', 'security': 'public', 'docid': 190868, 'main': 'Turnitin Short term deformation model based on surrounding relative humidity.pdf.pdf', 'files': [{'datasetid': 'document', 'fileid': 549755, 'mime_type': 'application/pdf', 'hash': '8d9c5e0d93fcb4feb078144c1f826a45', 'hash_type': 'MD5', 'mtime': '2023-05-06 15:19:39', 'filesize': 1209140, 'objectid': 190868, 'uri': 'http://repository.lppm.unila.ac.id/id/file/549755', 'filename': 'Turnitin Short term deformation model based on surrounding relative humidity.pdf.pdf'}], 'format': 'text', 'language': 'en', 'rev_number': 1, 'mime_type': 'application/pdf'}]",,,846,,51146,,archive,,2023-05-08 02:04:51,,Bandar Lampung,
2,http://repository.lppm.unila.ac.id/id/eprint/49636,3.0,['TA'],published,6,2023-04-04 08:47:47,,JURNAL PERENCANAAN DAN PENGEMBANGAN KEBIJAKAN,disk0_bak/00/04/96/36,['FT4'],2023-04-04 08:47:47,show,,"TINGKAT AKSESIBILITAS KAWASAN TRANSIT STASIUN MANGGARAI, JAKARTA SELATAN","[{'name': {'given': 'Aleksander', 'honourific': None, 'lineage': None, 'family': 'Purba'}, 'id': 'aleksander.purba@eng.unila.ac.id'}]",article,2023-04-04,,"Manggarai Station is one of DKI Jakarta Province's busiest stations. Manggarai Station's existence as a transit node promotes mobility from residential areas to the station. Many activities are impacted by land use around the  station.  In  order  to  accommodate  this  matter,  good  accessibility  is  required.  The  development  of  the Manggarai  Station  area  appears  to  follow  the  Transit  Oriented  Development  concept  (TOD).  The implementation of the TOD concept is expected to improve the accessibility of the Manggarai Station transit area. As a result, the purpose of this research is to determine the level of accessibility of the Manggarai Station transit area.",,pub,public,2775-0566,Department of Urban and Regional Planning Institut Teknologi Sumatera,,"[{'format': 'text', 'files': [{'hash': '1d686201c9e57914415faaf1f049172e', 'mime_type': 'application/pdf', 'fileid': 538147, 'datasetid': 'document', 'filename': 'Tingkat Aksesibilitas kawasan transit stasiun Manggarai-Galih et.al..pdf', 'uri': 'http://repository.lppm.unila.ac.id/id/file/538147', 'objectid': 189275, 'filesize': 1873184, 'mtime': '2023-04-04 08:04:06', 'hash_type': 'MD5'}], 'main': 'Tingkat Aksesibilitas kawasan transit stasiun Manggarai-Galih et.al..pdf', 'docid': 189275, 'language': 'en', 'mime_type': 'application/pdf', 'rev_number': 1, 'eprintid': 49636, 'placement': 1, 'security': 'public', 'pos': 1, 'uri': 'http://repository.lppm.unila.ac.id/id/document/189275'}]",https://journal.itera.ac.id/index.php/jppk/about,1.0,392,24-33,49636,,archive,,2023-04-04 08:47:47,TRUE,,
3,http://repository.lppm.unila.ac.id/id/eprint/51945,29.0,['TA'],published,8,2023-05-22 06:18:23,,Journal of The Indonesian Mathematical Society,disk0_bak/00/05/19/45,['FT4'],2023-05-22 06:18:23,show,luh_ratnawidyawati@yahoo.co.id,"AN IMPLICIT FINITE DIFFERENCE METHOD FOR
THIN FILM FLOW","[{'id': None, 'name': {'given': 'Gusrian', 'lineage': None, 'family': 'Putra', 'honourific': None}}, {'id': 'leo@math.itb.ac.id', 'name': {'given': 'Leo Hari', 'family': 'Wiryanto', 'lineage': None, 'honourific': None}}, {'name': {'family': 'Widyawati', 'lineage': None, 'honourific': None, 'given': 'Ratna'}, 'id': 'luh_ratnawidyawati@yahoo.co.id'}]",article,2023-03-01,,"Thin film flow on an inclined plane can be modeled from lubrication theory. Together with boundary conditions, the governing equations can be formulated into a single equation of the thickness of the fluid, and solved numerically by
an implicit finite difference method. In analyzing the equation, the linearized equation is considered here, to see the characteristic of the solution as wave propagation
and the effect of the physical parameter. We found that the wave propagates by reducing the amplitude, and the wave speed is affected by the steepness of the plane.
All of these can be indicated in the linearized equation. Numerical wave-simulation is presented in this paper.

Keywords and Phrases: thin film flow, theory of lubrication, single equation, numerical wave-simulation",,pub,public,2086-8952 (p) | 2460-0245 (e),The Indonesian Mathematical Society,[{'url': 'https://jims-a.org/index.php/jimsa'}],"[{'docid': 251264, 'main': '1110-Article Text-5422-5481-10-20230404.pdf', 'files': [{'mtime': '2023-05-22 04:58:44', 'hash_type': 'MD5', 'uri': 'http://repository.lppm.unila.ac.id/id/file/615458', 'filename': '1110-Article Text-5422-5481-10-20230404.pdf', 'objectid': 251264, 'filesize': 511757, 'hash': '54bc833e6bb8430419415c447860b5a9', 'mime_type': 'application/pdf', 'datasetid': 'document', 'fileid': 615458}], 'format': 'text', 'mime_type': 'application/pdf', 'language': 'en', 'rev_number': 1, 'placement': 1, 'eprintid': 51945, 'uri': 'http://repository.lppm.unila.ac.id/id/document/251264', 'pos': 1, 'security': 'public'}]",https://jims-a.org/index.php/jimsa/article/view/1110,1.0,362,99-105,51945,,archive,,2023-05-22 06:18:23,TRUE,,
4,http://repository.lppm.unila.ac.id/id/eprint/51943,,['TA'],published,7,2023-05-22 06:18:16,,,disk0_bak/00/05/19/43,['FT4'],2023-05-22 06:18:16,show,,Similarity Check An Implicit Finite Difference Method for Thin Film Flow,"[{'id': None, 'name': {'lineage': None, 'family': 'Putra', 'honourific': None, 'given': 'Gusrian'}}, {'name': {'honourific': None, 'lineage': None, 'family': 'Wiryanto', 'given': 'Leo Hari'}, 'id': 'leo@math.itb.ac.id'}, {'id': 'luh_ratnawidyawati@yahoo.co.id', 'name': {'given': 'Ratna', 'honourific': None, 'family': 'Widyawati', 'lineage': None}}]",other,2023-03-01,,"Thin film flow on an inclined plane can be modeled from lubrication theory. Together with boundary
conditions, the governing equations can be formulated into a single equation of the thickness of the
fluid, and solved numerically by an implicit finite difference method. In analyzing the equation,
the linearized equation is considered here, to see the characteristic of the solution as wave propagation
and the effect of the physical parameter. We found that the wave propagates by reducing the amplitude,
and the wave speed is affected by the steepness of the plane. All of these can be indicated in the
linearized equation. Numerical wave-simulation is presented in this paper.",,pub,public,,Journal of Indonesian Mathematics Society,,"[{'eprintid': 51943, 'placement': 1, 'security': 'public', 'pos': 1, 'uri': 'http://repository.lppm.unila.ac.id/id/document/251261', 'format': 'text', 'main': 'Similarity AN IMPLICIT FINITE DIFFERENCE METHOD FOR THIN FILM FLOW.pdf', 'docid': 251261, 'files': [{'uri': 'http://repository.lppm.unila.ac.id/id/file/615446', 'filename': 'Similarity AN IMPLICIT FINITE DIFFERENCE METHOD FOR THIN FILM FLOW.pdf', 'filesize': 533136, 'objectid': 251261, 'mtime': '2023-05-22 04:49:19', 'hash_type': 'MD5', 'hash': '26e32441c3f86cdb4ddc389d3d51c573', 'mime_type': 'application/pdf', 'datasetid': 'document', 'fileid': 615446}], 'language': 'en', 'rev_number': 1, 'mime_type': 'application/pdf'}]",https://jims-a.org/index.php/jimsa/article/view/1110,,362,,51943,,archive,,2023-05-22 06:18:16,,Indonesia,
5,http://repository.lppm.unila.ac.id/id/eprint/49871,,['TA'],published,9,2023-05-22 06:18:19,,,disk0_bak/00/04/98/71,['FT4'],2023-05-22 06:18:19,show,,Sistem Informasi Angkutan Penyeberangan (SIAP) Bakauheni,"[{'name': {'family': 'Trimoyo', 'lineage': None, 'honourific': None, 'given': 'Trimoyo'}, 'id': 'Trimoyo1986@gmail.com'}, {'name': {'given': 'Ratna', 'honourific': None, 'lineage': None, 'family': 'Widyawati'}, 'id': 'luh_ratnawidyawati@yahoo.co.id'}, {'name': {'given': 'Gigih Forda', 'lineage': None, 'family': 'Nama', 'honourific': None}, 'id': 'gigih@eng.unila.ac.id'}]",patent,2023-03-20,,,,pub,public,,,,"[{'language': 'en', 'mime_type': 'application/pdf', 'rev_number': 1, 'main': '1. Sertifikat HaKI SIAP sertifikat_EC00202322544.pdf', 'files': [{'mtime': '2023-04-07 11:01:07', 'hash_type': 'MD5', 'filename': '1. Sertifikat HaKI SIAP sertifikat_EC00202322544.pdf', 'uri': 'http://repository.lppm.unila.ac.id/id/file/539970', 'filesize': 2107745, 'objectid': 189547, 'hash': '8d94bc98ee92376258550da473f41591', 'mime_type': 'application/pdf', 'datasetid': 'document', 'fileid': 539970}], 'docid': 189547, 'format': 'text', 'pos': 1, 'uri': 'http://repository.lppm.unila.ac.id/id/document/189547', 'security': 'public', 'placement': 1, 'eprintid': 49871}]",,,362,,49871,,archive,455467,2023-05-22 06:18:19,,,Trimoyo
