,metadata_visibility,pagerange,datestamp,eprint_status,eprintid,lastmod,documents,userid,number,title,refereed,creators,type,contact_email,date_type,subjects,date,uri,abstract,volume,publication,publisher,divisions,dir,rev_number,ispublished,full_text_status,issn,status_changed,related_url,official_url
0,show,1195-1198,2016-10-25 01:11:20,archive,888,2016-10-25 01:11:20,"[{'mime_type': 'application/pdf', 'language': 'en', 'rev_number': 1, 'format': 'text', 'files': [{'mtime': '2016-10-24 22:47:31', 'hash_type': 'MD5', 'uri': 'http://repository.lppm.unila.ac.id/id/file/5543', 'filename': 'J. Pakistan Gafur Subli & Titik.pdf', 'objectid': 799, 'filesize': 1010039, 'mime_type': 'application/pdf', 'hash': '0410112c57518452e00eb11f88953f9a', 'fileid': 5543, 'datasetid': 'document'}], 'main': 'J. Pakistan Gafur Subli & Titik.pdf', 'docid': 799, 'security': 'public', 'pos': 1, 'uri': 'http://repository.lppm.unila.ac.id/id/document/799', 'eprintid': 888, 'placement': 1}]",380,11,"Morphological and Pathological Variations in the Indonesian Cochliobolus heterostrophus (Pleosporaceae, Pleosporales, Euascomycetes)",TRUE,"[{'name': {'lineage': None, 'family': 'Gafur', 'honourific': None, 'given': 'Abdul'}, 'id': 'gafur@uwalumni.com'}, {'name': {'lineage': None, 'family': 'Mujim', 'honourific': None, 'given': 'Subli'}, 'id': None}, {'name': {'honourific': None, 'lineage': None, 'family': 'Aeny', 'given': 'Titik Nur'}, 'id': 'titik.nuraeny@fp.unila.ac.id'}]",article,gafur@uwalumni.com,published,['S1'],1970-01-01 00:00:00.000002002,http://repository.lppm.unila.ac.id/id/eprint/888,"The present study was aimed at elucidating the morphological variations of Indonesian isolates of Cochliobolus heterostrophus (Drechsler) Drechsler as well as exploring pathogenicity of the isolates. Potential specificity between host varieties and pathogen isolates in the corn-southern leaf blight pathosystem was also exploited. Isolates of C. heterostrophus were collected from ecologically different parts of the country including the islands of Bali, Java, Sulawesi and Sumatera. Variations in morphological and pathogenic characteristics were observed among the isolates although possible host specificity was unlikely to exist between the corn varieties and fungal isolates tested. These results suggested that agricultural ecosystems might have affected morphological and pathological variations within Indonesian isolates of the fungus provided the existence of a common ancestor of the isolates.",5,"Pakistan Journal of Biological Sciences, 5: 1195-1198.",Asian Network for Scientific Information,['FP24'],disk0/00/00/08/88,11,pub,public,1028 8880,2016-10-25 01:11:20,,
1,show,42-46,2020-07-29 09:19:06,archive,23461,2020-07-29 09:19:06,"[{'main': 'Vol. 2 No. 2.pdf', 'docid': 37082, 'files': [{'hash_type': 'MD5', 'mtime': '2020-07-29 04:17:19', 'objectid': 37082, 'filesize': 154843, 'filename': 'Vol. 2 No. 2.pdf', 'uri': 'http://repository.lppm.unila.ac.id/id/file/214564', 'fileid': 214564, 'datasetid': 'document', 'hash': '5db2490712f11d209b23554dce44ad2c', 'mime_type': 'application/pdf'}], 'format': 'text', 'rev_number': 1, 'language': 'en', 'mime_type': 'application/pdf', 'placement': 1, 'eprintid': 23461, 'pos': 1, 'uri': 'http://repository.lppm.unila.ac.id/id/document/37082', 'security': 'public'}]",840,2,"DAMPAK APLIKASI INSEKTISIDA PERMETRIN TERHADAP
SERANGGA HAMA (THOSEA SP.) DAN SERANGGA PENYERBUK
(ELAEIDOBIUS KAMERUNICUS) DALAM AGROEKOSISTEM KELAPA SAWIT",FALSE,"[{'id': 'rosma.hasibuan@fp.unila.ac.id', 'name': {'honourific': None, 'family': 'Hasibuan', 'lineage': None, 'given': 'Rosma'}}, {'name': {'honourific': None, 'lineage': None, 'family': 'Pramono', 'given': 'Sudi'}, 'id': 'sudi.pramono@fp.unila.ac.id'}, {'id': 'igede.swibawa@fp.unila.ac.id', 'name': {'given': 'I Gede', 'lineage': None, 'family': 'Swibawa', 'honourific': None}}]",article,,published,['S1'],2002-09-01 00:00:00.000000000,http://repository.lppm.unila.ac.id/id/eprint/23461,"Impact of Permethrin-Insecticide Application on Insect Pest (Thosea sp.) and Insect Pollinators (Elaeidobius
kamerunicus) in Oil Palm Agroecosystem. Insecticide efficacy studies are usually determined from the target insect (pest)
data without regard to the effect of that treatment on the non-target insects (such as pollinators). This study examined the
effect of permethrin (one of widely used insecticides for agriculture) on defoliating insect pest (nettle caterpillar, Thosea
sp.) and insect pollinator (weevil, Elaeidobius kamerunicus) which lives on pollen of male oil palm flowers. A complete
block design was used in which each of four blocks consisted of 5 treatments (4 concentrations of permethrin; 50; 100;
200; and 250 ppm and control) . The results clearly demonstrated that the application of permethrin reduced significantly
the number of nettle caterpillar throughout all sprayed plants (up to 100% 14 d after treatments). A significant difference
in mean population of the caterpillar were detected between plots sprayed with permethrin (0.05; 0.25; 0.53; and 2.00
larvae/leaves at concentrations of 250; 200; 100; and 50 ppm respectively) and control plant (5.2 larvae/leaves) 3 d after
treatments. This insecticide effects persisted for at least 14 d after treatments. On the other hand, permethrin application
in oil palm agroecosystem had adverse effects on main pollinator (E. kamerunicus). The number of weevil pollinators on
sprayed plants (12.5; 59.3; 77.5; and 209.5 weevil/male flower at concentrations of 50; 100; 200; and 250 ppm
respectively) were significantly fewer compared to the control plants (976.0 weevil/male flower). The results indicate that,
despite high efficacy of permethrin in reducing number of insect pests of oil palm (Thosea sp.), its application also cause a
severe impact on important insect pollinators (E. kamerunicus).",2,J. Hama dan Penyakit Tumbuhan Tropika,Jurusan HPT Unila,['FP24'],disk0/00/02/34/61,6,pub,public,1411-7525,2020-07-29 09:19:06,[{'url': 'http://jhpttropika.fp.unila.ac.id/index.php/jhpttropika'}],http://jhpttropika.fp.unila.ac.id
