,uri,date,volume,abstract,subjects,date_type,rev_number,ispublished,status_changed,issn,full_text_status,publisher,divisions,publication,dir,documents,official_url,lastmod,number,userid,contributors,pagerange,metadata_visibility,eprintid,eprint_status,datestamp,refereed,title,type,creators,succeeds,corp_creators,event_title,event_type,event_dates,pres_type,event_location
0,http://repository.lppm.unila.ac.id/id/eprint/864,1970-01-01 00:00:00.000002009,16.0,"ABSTRACT

Intensifi ed cultivation of physic nut (Jatropha curcas L.) could raise the importance of
plant diseases. T e objectives of this research were to diagnose diseases occurring on physic nut
in Lampung Province and to determine their intensity. Field observation was conducted in four
districts: South Lampung, Tanggamus, Bandarlampung, and Tulang Bawang. Disease intensity,
whether expressed as disease incidence or severity, was recorded from plant samples determined by
making diagonal lines across the fi eld on which fi ve observation spots were made. On each spot, fi ve
plant samples were observed. Specimens were also collected and placed individually in plastic bags
for laboratory observation. T e diseases found on physic nut in Lampung Province were cercospora
leaf spot, alternaria leaf spot, fusarium wilt, and bacterial wilt. In addition, leaf malformation
fi rst thought to be viral disease was commonly found in many locations. Further mechanical
transmission failed to produce similar symptom on tested plants and higher population of mites
were found on malformed leaves than that in normal leaves. Based on the disease distribution and
intensity, the most likely threatening disease in physic nut cultivation is bacterial wilt. Fusarium
also caused wilt, but it was only found in one subdistrict with low incidence.

Key words: Alternaria, Cercospora, fusarium wilt, bacterial wilt, Jatropha curcas diseases",['S1'],published,15,pub,2016-10-24 01:30:50,2165023,public,Biotrop,['FP24'],"BIOTROPIA Vol. 16 No. 1, 2009: 45 - 54",disk0/00/00/08/64,"[{'language': 'en', 'rev_number': 1, 'mime_type': 'application/pdf', 'files': [{'filesize': 150381, 'objectid': 750, 'uri': 'http://repository.lppm.unila.ac.id/id/file/5206', 'filename': 'Biotropia Vol 16.pdf', 'hash_type': 'MD5', 'mtime': '2016-10-23 03:53:48', 'fileid': 5206, 'datasetid': 'document', 'hash': '243c51853205b4e91add06f2f6d48e95', 'mime_type': 'application/pdf'}], 'main': 'Biotropia Vol 16.pdf', 'docid': 750, 'format': 'text', 'uri': 'http://repository.lppm.unila.ac.id/id/document/750', 'pos': 1, 'security': 'public', 'placement': 1, 'eprintid': 864}]",http://journal.biotrop.org,2016-10-24 01:30:50,1.0,1039,"[{'name': {'honourific': None, 'lineage': None, 'family': 'Purwanto', 'given': 'Didik'}}, {'name': {'lineage': None, 'family': 'Rijaya', 'honourific': None, 'given': 'Tedy Achmad'}}]",45-54,show,864,archive,2016-10-24 01:30:50,TRUE,"PHYSIC NUT (JATROPHA CURCAS L.) DISEASES
IN LAMPUNG PROVINCE",article,"[{'name': {'family': 'Ginting', 'lineage': None, 'honourific': None, 'given': 'Cipta'}, 'id': 'cipta.ginting@fp.unila.ac.id'}, {'name': {'honourific': None, 'lineage': None, 'family': 'Maryono', 'given': 'Tri'}, 'id': None}]",,,,,,,
1,http://repository.lppm.unila.ac.id/id/eprint/810,2009-09-01 00:00:00.000000000,9.0,"A study was conducted to evaluate the corelation between soil characters and white rot incidence. The study was done in Penumangan Lampung from June 2007 to July 2008. Seven sites were observed on the incidence of white rot of indicator plants (cassava) . Physical, chemical, and biological soil characters were correlated and regressed with white rot incidence. The results showed that there were correlation between white rot incidence and soil characters such as pH KCl, number of fungal genus (fungal diversity), Ca+, total cation, CEC, and saturation base. Ion Ca+, total cation, saturation base correlated positively with white rot incidence, on the contrary, fungal diversity, cation exchange capacity, and pH KCl correlated negatively with white rot incidence. Thus, efforts to increase fungal diversity, cation exchange capacity, and pH (in acidic soil) could be used as basic strategies to develope intergrated  control of white rot disease.",['S1'],published,9,pub,2016-10-17 14:29:47,1411-7525,public,,['FP24'],Jurnal Hama dan Penyakit Tumbuhan Tropika,disk0/00/00/08/10,"[{'security': 'public', 'uri': 'http://repository.lppm.unila.ac.id/id/document/704', 'pos': 1, 'eprintid': 810, 'placement': 1, 'content': 'published', 'mime_type': 'application/pdf', 'language': 'en', 'rev_number': 4, 'format': 'text', 'main': 'JHPT Tropika 09-2-149-157-September 2009.pdf', 'files': [{'uri': 'http://repository.lppm.unila.ac.id/id/file/4823', 'filename': 'JHPT Tropika 09-2-149-157-September 2009.pdf', 'objectid': 704, 'filesize': 2110967, 'mtime': '2016-10-15 01:13:39', 'hash_type': 'MD5', 'mime_type': 'application/pdf', 'hash': '1e4a3b1baae30cfa2775044e74f00b5f', 'datasetid': 'document', 'fileid': 4823}], 'docid': 704}]",,2016-10-21 03:53:03,2.0,380,,149-157,show,810,archive,2016-10-17 14:29:47,TRUE,"The corelations between White Rot (Rigidoporus lignosus L.) incidence and  soil characters of rubber ecosystem in Penumangan Baru, Lampung.",article,"[{'name': {'given': 'Joko', 'family': 'Prasetyo', 'lineage': None, 'honourific': None}, 'id': 'joko.prasetyo@fp.unila.ac.id'}, {'id': 'titik.nuraeny@fp.unila.ac.id', 'name': {'honourific': None, 'family': 'Aeny', 'lineage': None, 'given': 'Titik Nur'}}, {'id': 'radix.suharjo@fp.unila.ac.id', 'name': {'family': 'Suharjo', 'lineage': None, 'honourific': None, 'given': 'Radix'}}]",808.0,,,,,,
2,http://repository.lppm.unila.ac.id/id/eprint/18804,1970-01-01 00:00:00.000002009,9.0,,['S1'],,6,pub,2020-03-18 07:30:16,1410-5020,public,Poloiteknik Negeri Lampung,['FP24'],Jurnal Penelitian Pertanian Terapan,disk0/00/01/88/04,"[{'language': 'en', 'rev_number': 1, 'mime_type': 'application/pdf', 'main': 'Purnomo Sudiono Kutu Kebul.pdf', 'docid': 32002, 'files': [{'mime_type': 'application/pdf', 'hash': '264cb790d4a034e1287389830821283f', 'fileid': 157856, 'datasetid': 'document', 'filename': 'Purnomo Sudiono Kutu Kebul.pdf', 'uri': 'http://repository.lppm.unila.ac.id/id/file/157856', 'filesize': 5038643, 'objectid': 32002, 'mtime': '2020-03-18 07:27:48', 'hash_type': 'MD5'}], 'format': 'text', 'pos': 1, 'uri': 'http://repository.lppm.unila.ac.id/id/document/32002', 'security': 'public', 'placement': 1, 'eprintid': 18804}]",,2020-03-18 07:30:16,2.0,990,,,show,18804,archive,2020-03-18 07:30:16,TRUE,POPULASI KUTU KEBUL (BEMISIA TABACI GENN.) PADA BERBAGAI POLA TANAM CABAI,article,"[{'name': {'lineage': None, 'family': 'Purnomo', 'honourific': None, 'given': '.'}, 'id': 'purjomo@yahoo.com'}, {'name': {'lineage': None, 'family': 'Sudiono', 'honourific': None, 'given': '-'}, 'id': None}]",,['UNIVERSITAS LAMPUNG'],,,,,
3,http://repository.lppm.unila.ac.id/id/eprint/2756,2009-08-01 00:00:00.000000000,75.0,"In 2007, stem rot and wilt symptoms were observed on potato plants in Shizuoka city. A bacterium was isolated from the symptoms and characterized as Dickeya sp. (former Erwinia chrysanthemi). It has been recorded as the pathogen, though, the species assignment of the organism in the genus Dickeya had not yet been confirmed. The isolates showed biochemical properties similar to those of E. chrysanthemi bv.1 (= pv. dianthicola), which is now presumed to be D. dianthicola. Through sequence analysis of the 16SrDNA, rpoD and gyrB genes, the potato isolates were allocated within a cluster together with D. dianthicola. Cross inoculation experiment of the potato isolates and a carnation isolate of D. dianthicola showed that both of the isolates can infect potato and carnation, having a tendency of stronger virulence against the original hosts. Therefore, the potato isolates were identified as D. dianthicola. Comparative genetic studies on related Dickeya strains isolated in Japan revealed that they are heterogeneous and some of them could not be allocated to existing Dickeya species.",['S1'],completed,9,pub,2017-06-02 06:49:04,0031-9473,public,The phytopathological society of japan,['FP24'],Japanese Journal of Phytopathology,disk0/00/00/27/56,"[{'docid': 2616, 'main': 'japan jurnal phyto vol 75 No 3.pdf', 'files': [{'filesize': 3382492, 'objectid': 2616, 'uri': 'http://repository.lppm.unila.ac.id/id/file/18882', 'filename': 'japan jurnal phyto vol 75 No 3.pdf', 'hash_type': 'MD5', 'mtime': '2017-06-01 06:47:19', 'fileid': 18882, 'datasetid': 'document', 'hash': '3c6286d9c7375c46f352e86f5fcbcae0', 'mime_type': 'application/pdf'}], 'format': 'text', 'language': 'en', 'rev_number': 1, 'mime_type': 'application/pdf', 'placement': 1, 'eprintid': 2756, 'pos': 1, 'uri': 'http://repository.lppm.unila.ac.id/id/document/2616', 'security': 'public'}]",http://www.ppsj.org/index_en.html,2018-05-28 03:26:35,3.0,579,,272-272,show,2756,archive,2017-06-02 06:49:04,TRUE,Identification of Dickeya sp. isolated from bacterial stem rot of potato,article,"[{'name': {'family': 'Suharjo', 'lineage': None, 'honourific': None, 'given': 'Radix'}}, {'name': {'lineage': None, 'family': 'Hayakawa', 'honourific': None, 'given': 'T'}}, {'name': {'given': 'H', 'honourific': None, 'lineage': None, 'family': 'Tsujimoto'}}, {'name': {'honourific': None, 'lineage': None, 'family': 'Nomura', 'given': 'K'}}, {'name': {'given': 'H', 'lineage': None, 'family': 'Sawada', 'honourific': None}}, {'name': {'given': 'Y', 'honourific': None, 'family': 'Takikawa', 'lineage': None}}]",,,,,,,
4,http://repository.lppm.unila.ac.id/id/eprint/906,1970-01-01 00:00:00.000002009,,"Survey of the papaya mealybug infestation that has been done in more than 100 home yards in Bandarlampung City and vicinity during the period of October – November 2009 informed that the papaya plants in 8 out of 13 subdistricts in the city were in general severely infested by the papaya mealybug. However, the infestation was less severe in areas farther away north or west from the city. No northward infestation was found in Wated Village and Bandarjaya Village (Central Lampung District) nor was it westward in Gadingrejo Subdistrict and Pringsewu Subdistrict (Pringsewu District). The population build-up, invasion, and geographical spread of the mealybug were thought to be associated with the symbiotic activity of either one or more of the six ant genera. This study also recorded that 31 plant genera (other than Carica) of 20 families were found infested by the mealybug, including 5 plant genera that have been previously reported (Hibiscus, Citrus, Capsicum, Persea, and Mangifera). It is clearly shown from this study that such important food crops as Zea (corn), Glycine (soybean), and Manihot (cassava) were also found severely and massively infested by the papaya mealybug.",['S1'],,9,pub,2016-10-26 03:33:54,,public,,['FP24'],,disk0/00/00/09/06,"[{'placement': 1, 'eprintid': 906, 'pos': 1, 'uri': 'http://repository.lppm.unila.ac.id/id/document/802', 'security': 'public', 'docid': 802, 'main': 'Papaya mealybug in Lampung - Indonesia (Susilo - Purnomo - Swibawa 2009).pdf', 'files': [{'datasetid': 'document', 'fileid': 5591, 'hash': '48ca9da7f223189bdb615f368dc6b457', 'mime_type': 'application/pdf', 'hash_type': 'MD5', 'mtime': '2016-10-25 06:24:55', 'filesize': 2488646, 'objectid': 802, 'uri': 'http://repository.lppm.unila.ac.id/id/file/5591', 'filename': 'Papaya mealybug in Lampung - Indonesia (Susilo - Purnomo - Swibawa 2009).pdf'}], 'format': 'text', 'mime_type': 'application/pdf', 'language': 'en', 'rev_number': 1}]",,2016-10-26 03:33:54,,1054,,81-92,show,906,archive,2016-10-26 03:33:54,TRUE,"Infestation of the Papaya Mealybug in Home Yard Plants in Bandarlampung, Indonesia",conference_item,"[{'name': {'family': 'Susilo', 'lineage': None, 'honourific': None, 'given': 'FX'}, 'id': 'fx.susilo@fp.unila.ac.id'}, {'id': 'purjomo@yahoo.com', 'name': {'honourific': None, 'family': 'Purnomo', 'lineage': None, 'given': '.'}}, {'id': 'gede.swibawa@fp.unila.ac.id', 'name': {'given': 'I Gede', 'family': 'Swibawa', 'lineage': None, 'honourific': None}}]",,,3rd International Meeting for the Development of Integrated Pest Management (IPM) in Asia and Africa,conference,7-9 December 2009,speech,Bandarlampung - INDONESIA
