,type,creators,refereed,title,number,userid,documents,official_url,lastmod,id_number,eprintid,eprint_status,datestamp,pagerange,metadata_visibility,status_changed,full_text_status,issn,rev_number,ispublished,publisher,divisions,publication,dir,related_url,volume,abstract,uri,date,subjects,date_type,corp_creators,contributors
0,article,"[{'name': {'given': 'Tarsim', 'honourific': None, 'lineage': None, 'family': '-'}, 'id': 'tarsimlampung@gmail.com'}, {'id': 'indra_gumay@yahoo.com', 'name': {'given': 'Indra Gumay', 'honourific': None, 'lineage': None, 'family': 'Yudha'}}, {'id': 'rara.diantari@fp.unila.ac.id', 'name': {'honourific': None, 'family': 'Diantari', 'lineage': None, 'given': 'Rara'}}, {'name': {'honourific': None, 'family': 'Mulyasih', 'lineage': None, 'given': 'Dwi'}, 'id': 'dwi.mulyasih29@gmail.com'}, {'id': 'ptcinthia@yahoo.com', 'name': {'lineage': None, 'family': 'Delis', 'honourific': None, 'given': 'Putu Cinthia'}}, {'name': {'honourific': None, 'family': 'Susanti', 'lineage': None, 'given': 'Oktora'}, 'id': 'oktora.susanti@fp.unila.ac.id, oktorasusanti@gmail.com'}, {'id': 'darma.msdp2011@gmail.com', 'name': {'given': 'Darma', 'honourific': None, 'lineage': None, 'family': 'Yuliana'}}, {'id': 'elisdiana.yeni@gmail.com', 'name': {'given': 'Yeni', 'lineage': None, 'family': 'Elisdiana', 'honourific': None}}]",TRUE,"BUDIDAYA IKAN LELE BERBASIS TEKNOLOGI REKAYASA
HORMONAL PADA KELOMPOK MINA TANI GARUDA KECAMATAN
SUKABUMI BANDAR LAMPUNG DAN MANDIRI SENTOSA KECAMATAN
JATI AGUNG LAMPUNG SELATAN",3.0,1239,"[{'pos': 1, 'uri': 'http://repository.lppm.unila.ac.id/id/document/37087', 'security': 'public', 'placement': 1, 'eprintid': 23465, 'language': 'en', 'rev_number': 3, 'mime_type': 'text/html', 'content': 'published', 'main': 122, 'docid': 37087, 'files': [{'mime_type': 'text/html', 'hash': 'e73d8701070f2d283fef32886c565c3c', 'datasetid': 'document', 'fileid': 214597, 'filename': 122, 'uri': 'http://repository.lppm.unila.ac.id/id/file/214597', 'filesize': 21663, 'objectid': 37087, 'mtime': '2020-07-29 08:18:17', 'hash_type': 'MD5'}], 'format': 'text'}]",http://jss.lppm.unila.ac.id/index.php/ojs/article/view/122,2020-07-29 09:19:30,http://dx.doi.org/10.23960/jss.v2i3.122,23465,archive,2020-07-29 09:19:30,131-138,show,2020-07-29 09:19:30,public,2550-1089,8,pub,SAKAI SAMBAYAN — Jurnal Pengabdian kepada Masyarakat,['FP21'],SAKAI SAMBAYAN — Jurnal Pengabdian kepada Masyarakat,disk0/00/02/34/65,"[{'type': 'pub', 'url': 'http://jss.lppm.unila.ac.id/index.php/ojs/index'}]",2,"One of the popular freshwater fish to consume In Bandar Lampung is catfish. Increasing market demand of catfish
commodities requires more standardized cultivation management. Many catfish farmers have been not informed that
there is technical standards for the good fish hatchery (CPIB) and the good fish aqaculture (CBIB) methods which in
the form of certificate. The main problem faced by the Minatani Garuda farmers community in Sukabumi is catfish
seeds which have decreased seed quality and the Mandiri Sentosa farmers community in Jati Agung is the slow growth
of catfish. The problems caused the low level of survival and production of catfish. The general objective of this activity
is (1) to increase certified seed productivity, have good quality, and accelerate fish growth in both of the farmers
community, (2) increasing the knowledge and skills of partner groups using hormonal engineering technology, (3) build
effective partnerships and cooperation between universities and community of fish farmer. The methods used are
survey, training, demonstration plots of hormonal technology, mentoring and evaluation of the program success.
Based on research, used the hormonal technology in fish is able to give a solution for the community problems. In
addition to getting quality seeds at the partner ""Minatani Garuda"", it can also accelerate the growth of catfish
aquaculture in Mandiri Sentosa community. Thus, the availability of catfish commodity in Lampung will always be
fulfilled. Based on the training and mentoring result, this activity succeeded in increasing farmers' knowledge
about the hormonal technology in Mandiri Sentosa and Minatani Garuda from 10% to 90%. Aquaculture in
Sukabumi and Jati Agung has the potential to appy the hormonal technology.",http://repository.lppm.unila.ac.id/id/eprint/23465,1970-01-01 00:00:00.000002018,['SH'],published,,
1,article,"[{'name': {'family': 'Buli', 'lineage': None, 'honourific': None, 'given': 'Willyam'}, 'id': None}, {'id': 'samsul.bakri@fp.unila.ac.id', 'name': {'honourific': None, 'family': 'Bakri', 'lineage': None, 'given': 'Samsul'}}, {'id': 'indragumay@yahoo.com', 'name': {'honourific': None, 'family': 'Febryano', 'lineage': None, 'given': 'Indra Gumay'}}]",TRUE,Coal Mining Institution in Private Forest,3.0,753,"[{'security': 'public', 'uri': 'http://repository.lppm.unila.ac.id/id/document/22419', 'pos': 1, 'eprintid': 9362, 'placement': 1, 'language': 'en', 'mime_type': 'application/pdf', 'rev_number': 1, 'format': 'text', 'docid': 22419, 'main': 'WILLIYAM BULI 2723-6558-1-PB.pdf', 'files': [{'filename': 'WILLIYAM BULI 2723-6558-1-PB.pdf', 'uri': 'http://repository.lppm.unila.ac.id/id/file/89499', 'filesize': 606928, 'objectid': 22419, 'mtime': '2018-11-03 02:43:39', 'hash_type': 'MD5', 'hash': 'c77bf699237361db2ef1b750f795aa9e', 'mime_type': 'application/pdf', 'datasetid': 'document', 'fileid': 89499}]}]",http://jurnal.fp.unila.ac.id/index.php/JHT/index,2018-11-03 11:27:52,ISSN (online) 2549-5747,9362,archive,2018-11-03 11:27:52,81-90,show,2018-11-03 11:27:52,public,2339-0913,6,pub,Faculty of Agriculture,['FP21'],Sylva Lestari,disk0/00/00/93/62,,6,"ABSTRACT 
 
Coal Mining Institution in Private Forest

Unlicensed Mining (PETI) conducted by community groups in private forest area is rife in Muara Enim district which causing environmental degradation. The purpose of this study is to find out the institutional forms associated with illegal coal mining activities. The study used a qualitative approach that illustrated how unlicensed mining (PETI) still able to operate despite violating the law. The result of this study indicates the existing formal institutions did not run so well which lead to the creation of non-formal institutions who permits illegal activities. There are few technical requirements that PETI could not provide if they were legalized to be public mining. Good coordination and teamwork between government and law enforcers along with mining corporation are desirable to control the development of PETI and the impact it brings, especially in private forest. 
Keywords: private forest, institution, environmental damage, unlicensed mining, coal mining.",http://repository.lppm.unila.ac.id/id/eprint/9362,2018-09-01 00:00:00.000000000,['SD'],published,,
2,article,"[{'id': 'edypeni@yahoo.com', 'name': {'given': 'Esti', 'lineage': None, 'family': 'Harpeni', 'honourific': None}}, {'id': 'supono_unila@yahoo.com', 'name': {'honourific': None, 'lineage': None, 'family': 'Supono', 'given': 'Supono'}}, {'id': None, 'name': {'honourific': None, 'lineage': None, 'family': 'Septiani', 'given': 'Dwi Risca'}}]",TRUE,"THE GROWTH KINETICS OF Bacillus sp. D2.2 AT
DIFFERENT pH AND SALINITY",1.0,550,"[{'mime_type': 'application/pdf', 'language': 'en', 'rev_number': 1, 'format': 'text', 'files': [{'filesize': 236164, 'objectid': 24536, 'filename': 'Harpeni et al, Nov 2018.pdf', 'uri': 'http://repository.lppm.unila.ac.id/id/file/104709', 'hash_type': 'MD5', 'mtime': '2019-05-03 02:41:16', 'fileid': 104709, 'datasetid': 'document', 'mime_type': 'application/pdf', 'hash': '6ee0f5fe9827103a3a7c7bbe5cd27ea9'}], 'main': 'Harpeni et al, Nov 2018.pdf', 'docid': 24536, 'security': 'public', 'uri': 'http://repository.lppm.unila.ac.id/id/document/24536', 'pos': 1, 'eprintid': 11534, 'placement': 1}]",http://jurnal.fp.unila.ac.id/index.php/JPBP/article/view/3084,2019-05-06 04:44:36,10.23960/aqs.v7i1.p647-656,11534,archive,2019-05-06 04:44:36,647-656,show,2019-05-06 04:44:36,public,2301-816X,6,pub,"Jurusan Perikanan dan Kelautan, Fakultas Pertanian, Universitas Lampung",['FP21'],Aquasains,disk0/00/01/15/34,,7,"Isolate D2.2 is a bacterial
isolate with 97% homology level with
Bacillus sp. This isolate is a biocontrol
bacterium capable of inhibiting the growth
of Gram positive bacteria and Gram
negative bacteria. The use of biocontrol
bacteria is one solution of disease
problem in cultivation organism. Prior
to being applied to the ﬁeld, D2.2 isolates
need to go through a series of tests,
one of which is growth kinetics testing
under various environmental conditions,
such as different degrees of pH
and salinity. This is because environmental
factors can affect the rapid growth
of bacteria. The purpose of this study
was to study the bacterial growth kinetics
of D2.2 at different pH and salinity.
The growth kinetics was observed
by measuring optical density (OD) through
a method of turbidimetry using a
spectrophotometer at a wavelength of
625 nm to the stage of death. The results
showed that the fastest growth rate
was found at 20 ppt salinity with 0.179
h-1 and generation time of 5,588 hours. While in all pH treatments, generation
time and growth rates achieved
all treatments have the same pattern.",http://repository.lppm.unila.ac.id/id/eprint/11534,2018-11-01 00:00:00.000000000,['SH'],,,
3,article,"[{'id': None, 'name': {'given': 'Juliana', 'honourific': None, 'lineage': None, 'family': 'Marbun'}}, {'id': 'edypeni@yahoo.com', 'name': {'given': 'Esti', 'honourific': None, 'family': 'Harpeni', 'lineage': None}}, {'name': {'family': 'Wardiyanto', 'lineage': None, 'honourific': None, 'given': 'Wardiyanto'}, 'id': None}]",TRUE,Penanganan Penyakit White Feces Disease Pada Udang Vaname    (Litopenaeus vannamei) Menggunakan Aplikasi Pakan Yang Dicampur Ekstrak Lengkuas Merah (Alpinia purpurata K. Schum),,550,"[{'mime_type': 'application/msword', 'language': 'en', 'rev_number': 1, 'docid': 25119, 'main': 'revisi terbaru.doc', 'files': [{'filesize': 472064, 'objectid': 25119, 'uri': 'http://repository.lppm.unila.ac.id/id/file/108531', 'filename': 'revisi terbaru.doc', 'hash_type': 'MD5', 'mtime': '2019-05-09 02:34:50', 'datasetid': 'document', 'fileid': 108531, 'hash': 'a9ca670124fd6f78c001150e5284dc20', 'mime_type': 'application/msword'}], 'format': 'text', 'uri': 'http://repository.lppm.unila.ac.id/id/document/25119', 'pos': 1, 'security': 'public', 'placement': 1, 'eprintid': 12133}]",http://jurnal.unsyiah.ac.id/depik/index,2019-05-09 03:03:25,,12133,archive,2019-05-09 03:03:25,,show,2019-05-09 03:03:25,public,2502-6194,6,submitted,"Faculty of Marine and Fisheries Syiah Kuala University, Indonesian Association of Oceanologists, and  School of Syiah Kuala University and Center for Marine and Fishery Studies of Syiah Kuala University, Banda Aceh, Indonesia.",['FP21'],"Depik Jurnal Ilmu-Ilmu Perairan, Pesisir dan Perikanan (Depik)",disk0/00/01/21/33,,,"The main problem in vaname shrimp (Litopenaeus vannamei)  culture is a disease. One of the diseases that can infect vaname shrimp is White Feces Disease (WFD) caused by bacteria Vibrio sp. The Treatment can be done by using Red galangal Rhizome extract. Due to  the MBC testing result galangal extract can be a treat of Vibrio sp bacteria. This research used randomized complete design (RAL) with five treatments and three replications which treatment A (negative control), B (positive control), C (7.5 grams), D (10 grams) and (12.5 grams) which are mixed with pellet for treating White Feces Disease \in vaname shrimp. The result shows that red galangal rhizome extracted give effect to SR (Survival Rate), RPS   (Relative  Percent Survival), TVC (Total Vibrio Count), but it didn’t give effect to the  clinical  and histopathalogy.
Keywords: vaname shrimp, white feces disease, extract red galangal Rhizome",http://repository.lppm.unila.ac.id/id/eprint/12133,1970-01-01 00:00:00.000002018,['SH'],submitted,,
4,article,"[{'name': {'lineage': None, 'family': 'Muhaemin', 'honourific': None, 'given': 'Moh.'}, 'id': 'mmuhaemin@gmail.com'}, {'name': {'given': 'Neviaty', 'honourific': None, 'family': 'Zamani', 'lineage': None}, 'id': 'npzamani@gmail.com'}, {'name': {'honourific': None, 'family': 'Soedharma', 'lineage': None, 'given': 'Dedi'}, 'id': 'dsoedharma@gmail.com'}, {'id': 'maddupppa@gmail.com', 'name': {'family': 'Maddupppa', 'lineage': None, 'honourific': None, 'given': 'Hawis'}}]",TRUE,"The effect of light and nitrogen on the lipid
and carotenoid production in Symbiodinium",2.0,475,"[{'rev_number': 1, 'language': 'en', 'mime_type': 'application/pdf', 'main': '10(2)2018_AES.87-96_AES.pdf', 'docid': 33229, 'files': [{'datasetid': 'document', 'fileid': 188562, 'mime_type': 'application/pdf', 'hash': '4984ab3f7405174d1a9b6457a7510d07', 'hash_type': 'MD5', 'mtime': '2020-05-18 03:37:13', 'objectid': 33229, 'filesize': 911227, 'filename': '10(2)2018_AES.87-96_AES.pdf', 'uri': 'http://repository.lppm.unila.ac.id/id/file/188562'}], 'format': 'text', 'pos': 1, 'uri': 'http://repository.lppm.unila.ac.id/id/document/33229', 'security': 'public', 'placement': 1, 'eprintid': 19923}]",,2020-05-18 03:55:37,,19923,archive,2020-05-18 03:55:37,87-96,show,2020-05-18 03:55:37,public,,12,pub,Bioflux,['FP21'],AES Bioflux,disk0/00/01/99/23,"[{'type': 'author', 'url': 'http://www.aes.bioflux.com.ro/docs/2018.87-96.pdf'}]",10,"The marine photoautotrophic and endosymbiotic organism, Symbiodinium, uses a combination
of solar radiation and nutrient as its principal sources to maintain its physiological processes which
include photosynthesis, growth, and intracellular chemical compound production such as lipid and
carotenoid. The present study examined the synergetic effect of light and nitrogen on the intracellular
lipid production and carotenoid accumulation in Symbiodinium. The pure and isolated Symbiodinium was
cultured and treated with a combination of light intensity and nitrogen depletion. Data such as biomass
growth, lipid content, and carotenoid in its initial culture condition were analysed to examine their
correlation. The results showed that the initial stresses reduced biomass, increased total lipid content
which was dominated by palmitic acid (C16:0), linoleic acid (C18:2n6), and linolenic acid (C18:3n3), and
increased the intracellular carotenoid of Symbiodinium. The research identified a highly positive linear
correlation between intracellular lipid production and carotenoid accumulation of Symbiodinium in initial
culture condition.",http://repository.lppm.unila.ac.id/id/eprint/19923,2018-07-29 00:00:00.000000000,"['Q1', 'QH301', 'QP', 'SH']",published,"['Jurusan Perikanan dan Kelautan FP Unila', 'Jurusan Ilmu Kelautan FPIK IPB', 'Jurusan Ilmu Kelautan FPIK IPB', 'Jurusan Ilmu Kelautan FPIK IPB']",
5,article,"[{'name': {'given': 'Sagada Sangdiana', 'honourific': None, 'lineage': None, 'family': 'Safitri'}, 'id': 'sagadassafitri@gmail.com'}, {'id': 'eko.efendi@fp.unila.ac.id', 'name': {'given': 'Eko', 'family': 'Efendi', 'lineage': None, 'honourific': None}}, {'id': 'indra.yudha@fp.unila.ac.id', 'name': {'given': 'Indra Gumay', 'honourific': None, 'lineage': None, 'family': 'Yudha'}}]",FALSE,"Pencemaran Pb dan Cu pada Kerang Hijau di Pulau Pasaran,
Lampung",1.0,274,"[{'uri': 'http://repository.lppm.unila.ac.id/id/document/22739', 'pos': 1, 'security': 'public', 'placement': 1, 'eprintid': 9709, 'rev_number': 3, 'language': 'en', 'mime_type': 'application/xml', 'content': 'published', 'main': 5217, 'files': [{'datasetid': 'document', 'fileid': 92020, 'mime_type': 'application/xml', 'hash': 'a3acd935d04363223a58327b03f928b1', 'hash_type': 'MD5', 'mtime': '2018-11-10 18:39:25', 'filesize': 22760, 'objectid': 22739, 'uri': 'http://repository.lppm.unila.ac.id/id/file/92020', 'filename': 5217}], 'docid': 22739, 'format': 'text'}]",http://journal.unhas.ac.id/index.php/,2018-11-14 02:45:40,,9709,archive,2018-11-14 02:45:40,10-18,show,2018-11-14 02:45:40,public,2620-6552,14,pub,MSP UNHAS,['FP21'],Jurnal Pengelolaan Perairan,disk0/00/00/97/09,,1,"Pencemaran logam Pb dan Cu telah terjadi di wilayah pesisir Kota Bandar Lampung yang disebabkan oleh berbagai industri logam, galangan kapal, aktivitas pelabuhan, stockpile batubara dan PLTU. Pencemaran logam tersebut dikhawatirkan dapat menyebabkan akumulasi Pb dan Cu pada kerang hijau yang banyak dibudidayakan di sekitar Pulau Pasaran. Penelitian ini
bertujuan untuk menganalisis logam Pb dan Cu di air dan kerang hijau dengan metode MPAES. Hasil penelitian menunjukkan bahwa konsentrasi logam Pb dan Cu tertinggi pada air masing-masing adalah 0,63 mg/l dan 0,14 mg/l. Adapun konsentrasi logam Pb dan Cu tertinggi pada kerang hijau masing-masing sebesar 8,45 mg/kg dan 14,32 mg/kg. Kondisi ini
menunjukkan bahwa konsentrasi Pb telah melebihi baku mutu sehingga dikhawatirkan dapat berdampak terhadap gangguan kesehatan bagi masyarakat.",http://repository.lppm.unila.ac.id/id/eprint/9709,2018-10-04 00:00:00.000000000,['SH'],published,,
6,article,"[{'name': {'honourific': None, 'lineage': None, 'family': 'Suri', 'given': 'Ratna'}, 'id': 'ratna.suri.18@gmail.com'}, {'name': {'given': 'Berta', 'honourific': None, 'family': 'Putri', 'lineage': None}, 'id': 'berta.putri@fp.unila.ac.id'}, {'name': {'given': 'Oktora', 'lineage': None, 'family': 'Susanti', 'honourific': None}, 'id': 'oktora.susanti@fp.unila.ac.id, oktorasusanti@gmail.com'}]",TRUE,STUDI TENTANG PENGGUNAAN PAKAN KOMERSIL YANG DICAMPUR DENGAN BAKTERI BACILLUS COAGULANS TERHADAP PERFORMA LITOPENAEUS VANNAMEI,1.0,1239,"[{'uri': 'http://repository.lppm.unila.ac.id/id/document/37083', 'pos': 1, 'security': 'public', 'placement': 1, 'eprintid': 23463, 'mime_type': 'application/pdf', 'language': 'en', 'rev_number': 1, 'files': [{'hash_type': 'MD5', 'mtime': '2020-07-29 07:22:53', 'filesize': 282310, 'objectid': 37083, 'filename': '2831-6805-1-SM.pdf', 'uri': 'http://repository.lppm.unila.ac.id/id/file/214571', 'datasetid': 'document', 'fileid': 214571, 'hash': '86a09d42997cbc44cbc6ea8e107dd14d', 'mime_type': 'application/pdf'}], 'main': '2831-6805-1-SM.pdf', 'docid': 37083, 'format': 'text'}, {'uri': 'http://repository.lppm.unila.ac.id/id/document/37084', 'pos': 2, 'security': 'public', 'placement': 2, 'eprintid': 23463, 'language': 'en', 'rev_number': 3, 'mime_type': 'application/xml', 'content': 'published', 'main': 2831, 'docid': 37084, 'files': [{'filesize': 30160, 'objectid': 37084, 'filename': 2831, 'uri': 'http://repository.lppm.unila.ac.id/id/file/214574', 'hash_type': 'MD5', 'mtime': '2020-07-29 07:24:06', 'datasetid': 'document', 'fileid': 214574, 'mime_type': 'application/xml', 'hash': '29169fba41d7f5a61bceb808a4ceb779'}], 'format': 'text'}]",http://jurnal.fp.unila.ac.id/index.php/bdpi/article/view/2831,2020-07-29 09:19:25,http://dx.doi.org/10.23960/jrtbp.v7i1.p751-762,23463,archive,2020-07-29 09:19:25,,show,2020-07-29 09:19:25,public,2597-5315,12,pub,e-Jurnal Rekayasa dan Teknologi Budidaya Perairan,['FP21'],e-Jurnal Rekayasa dan Teknologi Budidaya Perairan,disk0/00/02/34/63,[{'url': 'http://jurnal.fp.unila.ac.id/index.php/bdpi/article/view/2831/2339'}],7,"In vaname shrimp cultivation, one of the problem that often arise is the high production costs in provision of feed The use of probiotics is a viable alternative to reduce production costs. The probiotic that used in this research was Bacillus coagulans bacteria. This research was aimed to know the effect of the use of Bacillus coagulans bacteria in feed on weight growth, lenght growth, survival rate, feed conversion ratio, and water quality in cultivation on vaname shrimp. Post larvae 10 vaname shrimp as much as 25 pcs were placed in each aquariums with volume 50x40x40 cmfor 30 days. The probiotics with dosage of treatment 30 ml/kg; 50 ml/kg; 70 ml/kg were combined in commercial feed with the protein content 32%. The shrimp feeding method that used in this research was blind feeding with 4 times feeding a day. The result showed that the best treatment was 70 ml/kg feed giving the significant effect on weight growth, length growth, andfeed conversion ratio. The treatments didn't effect on SR however. The water quality such as DO, temperature, salinity, and was TAN still in the optimum value.",http://repository.lppm.unila.ac.id/id/eprint/23463,1970-01-01 00:00:00.000002018,['SH'],,,"[{'type': 'http://www.loc.gov/loc.terms/relators/AUT'}, {'type': 'http://www.loc.gov/loc.terms/relators/AUT'}, {'type': 'http://www.loc.gov/loc.terms/relators/AUT'}]"
7,article,"[{'name': {'given': 'Ratna', 'lineage': None, 'family': 'Suri', 'honourific': None}}, {'name': {'given': 'Berta', 'lineage': None, 'family': 'Putri', 'honourific': None}}, {'name': {'given': 'Oktora', 'lineage': None, 'family': 'Susanti', 'honourific': None}}]",TRUE,STUDI TENTANG PENGGUNAAN PAKAN KOMERSIL YANG DICAMPUR DENGAN BAKTERI Bacillus coagulans TERHADAP PERFORMA Litopenaeus vannamei,1.0,142,,http://jurnal.fp.unila.ac.id/index.php/bdpi/article/view/2831,2019-05-10 02:34:06,,12336,archive,2019-05-10 02:34:06,739-750,show,2019-05-10 02:34:06,none,"p-ISSN: 2302-3600, e-ISSN: 2597-5315",5,pub,"Jurusan Budidaya Perairan, Fakultas Pertanian Universitas Lampung",['FP21'],E Jurnal Rekayasa dan Teknologi Budidaya Perairan,disk0/00/01/23/36,[{'type': 'org'}],VII,"Abstract

In vaname shrimp cultivation, one of the problem that often arise is the high production costs in provision of feed The use of probiotics is a viable alternative to reduce production costs. The probiotic that used in this research was Bacillus coagulans bacteria. This research was aimed to know the effect of the use of Bacillus coagulans bacteria in feed on weight growth, lenght growth, survival rate, feed conversion ratio, and water quality in cultivation on vaname shrimp. Post larvae 10 vaname shrimp as much as 25 pcs were placed in each aquariums with volume 50x40x40 cmfor 30 days. The probiotics with dosage of treatment 30 ml/kg; 50 ml/kg; 70 ml/kg were combined in commercial feed with the protein content 32%. The shrimp feeding method that used in this research was blind feeding with 4 times feeding a day. The result showed that the best treatment was 70 ml/kg feed giving the significant effect on weight growth, length growth, andfeed conversion ratio. The treatments didn't effect on SR however. The water quality such as DO, temperature, salinity, and was TAN still in the optimum value",http://repository.lppm.unila.ac.id/id/eprint/12336,2018-10-01 00:00:00.000000000,['SH'],,,
8,article,"[{'id': None, 'name': {'lineage': None, 'family': 'Taris', 'honourific': None, 'given': 'Muhammad Ridho'}}, {'id': 'limin.sentiko@gmail.com', 'name': {'given': 'Limin', 'family': 'Santoso', 'lineage': None, 'honourific': None}}, {'id': 'edypeni@yahoo.com', 'name': {'lineage': None, 'family': 'Harpeni', 'honourific': None, 'given': 'Esti'}}]",TRUE,"PENGARUH SUBTITUSI TEPUNG IKAN DENGAN TEPUNG  
CACING TANAH (Lumbricus sp.) TERHADAP PERTUMBUHAN
BENUR UDANG WINDU (Penaeus monodon)",2.0,550,"[{'rev_number': 1, 'language': 'en', 'mime_type': 'application/pdf', 'format': 'text', 'main': 'Taris dkk 2018.pdf', 'docid': 20821, 'files': [{'uri': 'http://repository.lppm.unila.ac.id/id/file/69671', 'filename': 'Taris dkk 2018.pdf', 'objectid': 20821, 'filesize': 446139, 'mtime': '2018-06-26 01:05:30', 'hash_type': 'MD5', 'hash': '9a70256277fc93fb4f8d4b3fe253709a', 'mime_type': 'application/pdf', 'datasetid': 'document', 'fileid': 69671}], 'security': 'public', 'uri': 'http://repository.lppm.unila.ac.id/id/document/20821', 'pos': 1, 'eprintid': 7787, 'placement': 1}, {'docid': 20822, 'main': 2118, 'files': [{'fileid': 69674, 'datasetid': 'document', 'hash': 'daa693749ed816e4f7dc497aad6a4b51', 'mime_type': 'application/xml', 'hash_type': 'MD5', 'mtime': '2018-06-26 01:05:57', 'objectid': 20822, 'filesize': 29065, 'filename': 2118, 'uri': 'http://repository.lppm.unila.ac.id/id/file/69674'}], 'format': 'text', 'language': 'en', 'rev_number': 3, 'mime_type': 'application/xml', 'placement': 2, 'eprintid': 7787, 'uri': 'http://repository.lppm.unila.ac.id/id/document/20822', 'pos': 2, 'security': 'public'}]",http://jurnal.fp.unila.ac.id/index.php/bdpi/index,2018-06-26 02:44:33,10.23960/jrtbp.v6i2.p699-704,7787,archive,2018-06-26 02:44:33,699-704,show,2018-06-26 02:44:33,public,p-ISSN: 2302-3600; e-ISSN: 2597-5315,9,pub,Universitas Lampung,['FP21'],e-Jurnal Rekayasa dan Teknologi Budidaya Perairan,disk0/00/00/77/87,,VI,"Availability of good-quality shrimp feed is an important factor of shrimp increased production. High protein feed can be generated by adding raw materials that contains high protein. One of the raw materials that contains high protein is earthworm meal (Lumbricus sp.). This research goal was to study the influence of the substitution of fish meal by earthworm feed with different proportions toward growth and survival rate of tiger shrimp larvae (Penaeus monodon). The experimental design used Completely Randomized Design (RAL) consists of five treatments with three replications: Feed test A (25%  earthworm meal + 75% fish meal), feed test B (50% earthworm meal + 50% fish meal), feed test C (75% earthworms meal + 25% fish meal), feed test D (100% earthworms meal) and feed test E (commercial feed). Results showed that the tiger shrimp which given feed test E is the best result for tiger shrimp growth with 0.480 ± 0.076 grams/individual, while feed test B was the best result for tiger shrimp survival rate with 82 ± 3.46%., and on the feed test D was the best result for tiger shrimp feed conversion rate with 4.0 ± 0.17. Based on results of statistical tests showed that the substitution of fish meal with earthworm meal did not give significant effect on growth and survival rate of tiger shrimp.",http://repository.lppm.unila.ac.id/id/eprint/7787,2018-02-01 00:00:00.000000000,['SH'],published,,
