,type,creators,refereed,title,number,userid,documents,official_url,lastmod,id_number,eprintid,eprint_status,datestamp,pagerange,metadata_visibility,status_changed,full_text_status,issn,rev_number,ispublished,publisher,divisions,publication,dir,related_url,volume,abstract,uri,date,subjects,date_type,corp_creators,contributors
9,article,"[{'id': None, 'name': {'honourific': None, 'family': 'Wijayanti', 'lineage': None, 'given': 'Arlin'}}, {'id': None, 'name': {'honourific': None, 'lineage': None, 'family': 'Dwinitasari', 'given': 'Nandya'}}, {'id': None, 'name': {'family': 'Febriyani', 'lineage': None, 'honourific': None, 'given': 'Uun'}}, {'name': {'honourific': None, 'family': 'Harpeni', 'lineage': None, 'given': 'Esti'}, 'id': 'edypeni@yahoo.com'}, {'name': {'honourific': None, 'lineage': None, 'family': 'Wardiyanto', 'given': 'Wardiyanto'}, 'id': None}]",TRUE,ANALISIS UJI TANTANG UDANG VANAME (Litopenaeus vannamei)  YANG DIBERBAKTERI PROBIOTIK Bacillus sp. D2.2 DAN EKSTRAK UBI JALAR SEBAGAI SINBIOTIK,2.0,550,"[{'security': 'public', 'pos': 1, 'uri': 'http://repository.lppm.unila.ac.id/id/document/22908', 'eprintid': 9898, 'placement': 1, 'content': 'published', 'language': 'id', 'mime_type': 'text/html', 'rev_number': 3, 'format': 'text', 'docid': 22908, 'main': 5716, 'files': [{'mime_type': 'text/html', 'hash': 'e721bba400052bd6f14f1bf8dcff0083', 'fileid': 93247, 'datasetid': 'document', 'mtime': '2018-11-14 05:40:01', 'hash_type': 'MD5', 'uri': 'http://repository.lppm.unila.ac.id/id/file/93247', 'filename': 5716, 'filesize': 16580, 'objectid': 22908}]}, {'uri': 'http://repository.lppm.unila.ac.id/id/document/22909', 'pos': 2, 'security': 'public', 'placement': 2, 'eprintid': 9898, 'language': 'en', 'rev_number': 1, 'mime_type': 'application/pdf', 'main': '5716-Article Text-12134-1-10-20181009.pdf', 'files': [{'mime_type': 'application/pdf', 'hash': '98145814b91dc92d731f501b24fa0866', 'fileid': 93250, 'datasetid': 'document', 'mtime': '2018-11-14 05:41:02', 'hash_type': 'MD5', 'uri': 'http://repository.lppm.unila.ac.id/id/file/93250', 'filename': '5716-Article Text-12134-1-10-20181009.pdf', 'filesize': 386723, 'objectid': 22909}], 'docid': 22909, 'format': 'text'}]",https://online-journal.unja.ac.id/index.php/biospecies/article/view/5716,2018-11-14 07:02:06,,9898,archive,2018-11-14 07:02:06,63-71,show,2018-11-14 07:02:06,public,1979-0902,9,pub,Biology Education Studies Program Faculty of Teacher Training and Education Jambi University,['FP21'],Biospecies,disk0/00/00/98/98,[{'url': 'https://online-journal.unja.ac.id/index.php/biospecies/article/view/5716'}],11,"Abstract,  In vaname shrimp cultivation system,  bacterial  disease is a problem that  often arises that
mainly caused by the bacteria Vibrio sp. Sinbiotic application is one way to prevent disruption of the
disease. Sinbiotic is nutritional supplements that  made from the combination of probiotic and prebiotic
that can provide beneficial effects to the host. This research uses a local sinbiotic of probiotic bacteria
Bacillus sp. D2.2, which comes from the traditional ponds in the Mulyosari village, Pasir Sakti district,
Lampung Timur Regency, Lampung. Prebiotic that used in this research made from meal extracts of
purple sweet potato that had the best capability to support the growth of bacteria probiotic Bacillus sp.
D2.2. This research aims to know the effectivity of sinbiotic against the infection of vibriosis againts to
vaname shrimp by doing analysis of clinical  symptoms and tissue damage post  test challenge using
bacteria  Vibrio harveyi.  The results showed that  addition sinbiotic gave effect  to SR 6,25 %, MTD
13,80  hour,  and clinical  symptoms  and then tissue  damage  is  lower  than without  the  feeding of
sinbiotik.
Key Word: Sinbiotic, probiotic, prebiotic, Bacillus sp. D2.2",http://repository.lppm.unila.ac.id/id/eprint/9898,2018-07-01 00:00:00.000000000,['SH'],published,,
10,article,"[{'name': {'given': 'Rio Anggria', 'honourific': None, 'family': 'Yudha', 'lineage': None}}, {'name': {'honourific': None, 'family': 'Putri', 'lineage': None, 'given': 'Berta'}}, {'name': {'honourific': None, 'family': 'Diantari', 'lineage': None, 'given': 'Rara'}}]",TRUE,Kesesuaian Perairan untuk Budidaya Ikan Baung (Mystus nemurus) di Sungai Way Kiri Desa Panaragan Kabupaten Tulang Bawang Barat,2.0,142,"[{'security': 'public', 'uri': 'http://repository.lppm.unila.ac.id/id/document/25470', 'pos': 1, 'eprintid': 12487, 'placement': 1, 'content': 'published', 'language': 'id', 'mime_type': 'application/xml', 'rev_number': 3, 'format': 'text', 'docid': 25470, 'main': 56, 'files': [{'datasetid': 'document', 'fileid': 110970, 'hash': '1e73e2932c824fef1a8709d5744f8063', 'mime_type': 'application/xml', 'filesize': 17923, 'objectid': 25470, 'uri': 'http://repository.lppm.unila.ac.id/id/file/110970', 'filename': 56, 'hash_type': 'MD5', 'mtime': '2019-05-10 04:35:40'}]}]",,2019-05-14 07:53:20,,12487,archive,2019-05-14 07:53:20,48-57,show,2019-05-14 07:53:20,public,ISSN: 2599-1701,9,pub,,['FP21'],Jurnal Sains dan Teknologi Akuakultur (JSTA),disk0/00/01/24/87,,2,"Abstract

Penelitian ini bertujuan untuk mengidentifikasi kesesuaian perairan untuk budidaya ikan baung sistem karamba di Sungai Way Kiri, Kabupaten Tulang Bawang Barat. Penelitian ini dilaksanakan pada bulan November 2017 - Januari 2018. Metode yang digunakan dalam penelitian ini adalah deskriptif kuantitatif dengan cara pengamatan kualitas air yang meliputi parameter fisika (kecepatanarus, suhu, kedalaman, dan kecerahan) serta kimia (DO, pH, TAN, dan BOD). Selanjutnya dilakukan evaluasi kesesuaian perairan dengan menitikberatkan pada nilai kualitas air sesuai dengan ikan yang akan dibudidayakan menggunakan metode analisis matching dan scoring. Berdasarkan hasil penelitian pengukuran kualitas air di Sungai Way Kiri menunjukkan rerata untuk  kedalaman 19,22 m, DO 6,89 mg/L, kecerahan 25 cm, suhu 28,32 oC, kecepatan arus 0,225 m/dt, pH 6,10, TAN 0,548 mg/L dan BOD 5,57 mg/L. Berdasarkan penelitian yang telah dilakukan dapat disimpulkan bahwa perairan Sungai Way Kiri sangat sesuai untuk dilakukan budidaya ikan baung (Mystus nemurus).",http://repository.lppm.unila.ac.id/id/eprint/12487,1970-01-01 00:00:00.000002018,['SH'],published,,
