,subjects,date_type,date,uri,abstract,publisher,divisions,dir,rev_number,ispublished,status_changed,full_text_status,metadata_visibility,eprint_status,editors,eprintid,datestamp,documents,lastmod,userid,refereed,title,creators,type,isbn,place_of_pub,pages,number,pagerange,issn,publication,volume
0,['SD'],published,2005,http://repository.lppm.unila.ac.id/id/eprint/6481,"strategi Nasional penanggulangan Kemiskinan (SNPK, 2005), mendefinisikan kemiskinan sebagai kondisi seseorang atau sekelompok orang, laki-laki dan perempuan, yang tidak terpenuhi hak-hak dasamya2 untuk mempertahankan dan mengembangkan kehidupan yang bermartabat. Definisi kemiskinan ini beranjak dari pendekatan berbasis hak yang mengakui bahwa masyarakat miskin, baik laki-laki maupun perempuan/ mempunyai hak-hak dasar yang sama dengan anggota masyarakat lainnya. Kemiskinan tidak lagi dipahami hanya sebatas ketidakmampuan ekonomi, tetapi juga kegagalan pemenuhan hak-hak dasar dan perbedaan perlakuan bagi seseorang atau sekelompok orang, laki-laki dan perempuan, dalam menjalani kehidupan secara bermartabat. Definisi ini menggariskan bahwa kemiskinan sebenarnya merupakan suatu peristiwa penolakan dan tidak teryenuhinya hak, serta adanya pengakuan bahwa orang miskin terpaksa menjalani kemiskinan dan seringkali mengalami pelanggaran hak yang dapat merendahkan martabatnya sebagai manusia. oleh karena itu, konsep ini memberikan penegasan terhadap kewajiban negara untuk menghargai, melindungi dan memenuhi hak-hak dasar masyarakat miskin.",WWF-Indonesia,['FP11'],disk0/00/00/64/81,8,pub,2018-02-14 06:51:26,public,show,archive,"[{'id': None, 'name': {'given': 'Sulton', 'honourific': None, 'lineage': None, 'family': 'Mawardi'}}, {'id': None, 'name': {'family': 'Hardijanto', 'lineage': None, 'honourific': None, 'given': 'Andik'}}, {'id': 'christine.wulandari@fp.unila.ac.id', 'name': {'given': 'Christine', 'honourific': None, 'family': 'Wulandari', 'lineage': None}}]",6481,2018-02-14 06:51:26,"[{'mime_type': 'application/pdf', 'language': 'en', 'rev_number': 1, 'files': [{'datasetid': 'document', 'fileid': 60005, 'hash': '69f0cba6e1c16ed538e2ea17abbd5c3e', 'mime_type': 'application/pdf', 'objectid': 19423, 'filesize': 5647521, 'uri': 'http://repository.lppm.unila.ac.id/id/file/60005', 'filename': 'pendekatan praktis penerapan kebijakan pro-poor budget-ilovepdf-compressed.pdf', 'hash_type': 'MD5', 'mtime': '2018-02-14 05:03:23'}], 'main': 'pendekatan praktis penerapan kebijakan pro-poor budget-ilovepdf-compressed.pdf', 'docid': 19423, 'format': 'text', 'pos': 1, 'uri': 'http://repository.lppm.unila.ac.id/id/document/19423', 'security': 'public', 'placement': 1, 'eprintid': 6481}]",2018-02-14 06:51:26,981,TRUE,Pendekatan Praktis Penerapan Kebijakan Pro-poor Budget (Kebijakan Anggaran Berpihak pada Orang Miskin),"[{'name': {'given': 'Ade', 'lineage': None, 'family': 'Ade', 'honourific': None}}, {'name': {'lineage': None, 'family': 'Raharjo', 'honourific': None, 'given': 'Diah'}}, {'name': {'honourific': None, 'family': 'Setiyaningrum', 'lineage': None, 'given': 'Retno'}}, {'name': {'given': 'Rinusu', 'lineage': None, 'family': 'Rinusu', 'honourific': None}}, {'name': {'lineage': None, 'family': 'Wahyudini', 'honourific': None, 'given': 'Siti'}}, {'name': {'lineage': None, 'family': 'Sunartono', 'honourific': None, 'given': 'Sunartono'}}, {'name': {'honourific': None, 'lineage': None, 'family': 'Sintawaty', 'given': 'Sintawaty'}}]",book,979-25-1040-0,Jakarta,,,,,,
1,['SD'],,2005,http://repository.lppm.unila.ac.id/id/eprint/6490,"sejalan dengan pengertian tersebut, strategi Nasional penanggulangan Kemiskinan (SNPK, 2005), mendefinisikan kemiskinan sebagai kondisi seseorang atau sekelompok orang, laki-laki dan perempuan, yang tidak terpenuhi hak-hak dasamya2 untuk mempertahankan dan mengembangkan kehidupan yang bermartabat. Definisi kemiskinan ini beranjak dari pendekatan berbasis hak yang mengakui bahwa masyarakat miskin, baik laki-laki maupun perempuan/ mempunyai hak-hak dasar yang sama dengan anggota masyarakat lainnya. Kemiskinan tidak lagi dipahami hanya sebatas ketidakmampuan ekonomi, tetapi juga kegagalan pemenuhan hak-hak dasar dan perbedaan perlakuan bagi seseorang atau sekelompok orang, laki-laki dan perempuan, dalam menjalani kehidupan secara bermartabat. Definisi ini menggariskan bahwa kemiskinan sebenarnya merupakan suatu peristiwa penolakan dan tidak teryenuhinya hak, serta adanya pengakuan bahwa orang miskin terpaksa menjalani kemiskinan dan seringkali mengalami pelanggaran hak yang dapat merendahkan martabatnya sebagai manusia. oleh karena itu, konsep ini memberikan penegasan terhadap kewajiban negara untuk menghargai, melindungi dan memenuhi hak-hak dasar masyarakat miskin.","WWF-Indonesia, DFID MFP, Departemen Kehutanan, Ford Foundation",['FP11'],disk0/00/00/64/90,9,pub,2018-02-20 03:35:41,public,show,archive,"[{'id': None, 'name': {'given': 'Sulton', 'honourific': None, 'family': 'Mawardi', 'lineage': None}}, {'id': None, 'name': {'honourific': None, 'family': 'Hardijanto', 'lineage': None, 'given': 'Andik'}}, {'name': {'honourific': None, 'lineage': None, 'family': 'Wulandari', 'given': 'Christine'}, 'id': 'christine.wulandari@fp.unila.ac.id'}]",6490,2018-02-20 03:35:41,"[{'rev_number': 1, 'language': 'en', 'mime_type': 'application/pdf', 'main': 'pendekatan praktis penerapan kebijakan pro-poor budget-ilovepdf-compressed.pdf', 'docid': 19434, 'files': [{'uri': 'http://repository.lppm.unila.ac.id/id/file/60106', 'filename': 'pendekatan praktis penerapan kebijakan pro-poor budget-ilovepdf-compressed.pdf', 'objectid': 19434, 'filesize': 5647521, 'mtime': '2018-02-17 04:27:12', 'hash_type': 'MD5', 'hash': '69f0cba6e1c16ed538e2ea17abbd5c3e', 'mime_type': 'application/pdf', 'fileid': 60106, 'datasetid': 'document'}], 'format': 'text', 'uri': 'http://repository.lppm.unila.ac.id/id/document/19434', 'pos': 1, 'security': 'public', 'placement': 1, 'eprintid': 6490}]",2018-02-20 03:35:41,981,TRUE,Penerapan Kebijakan Pro-poor Budget (Kebijakan Anggaran Berpihak pada Orang Miskin),"[{'name': {'given': 'Kelompok Kerja', 'family': 'Pro-poor Budget Policy', 'lineage': None, 'honourific': None}}]",book,979-25-1040-0,Jakarta,38.0,,,,,
2,['SD'],published,2005,http://repository.lppm.unila.ac.id/id/eprint/6491,"sejalan dengan pengertian tersebut, strategi Nasional penanggulangan Kemiskinan (SNPK, 2005), mendefinisikan kemiskinan sebagai kondisi seseorang atau sekelompok orang, laki-laki dan perempuan, yang tidak terpenuhi hak-hak dasamya2 untuk mempertahankan dan mengembangkan kehidupan yang bermartabat. Definisi kemiskinan ini beranjak dari pendekatan berbasis hak yang mengakui bahwa masyarakat miskin, baik laki-laki maupun perempuan/ mempunyai hak-hak dasar yang sama dengan anggota masyarakat lainnya. Kemiskinan tidak lagi dipahami hanya sebatas ketidakmampuan ekonomi, tetapi juga kegagalan pemenuhan hak-hak dasar dan perbedaan perlakuan bagi seseorang atau sekelompok orang, laki-laki dan perempuan, dalam menjalani kehidupan secara bermartabat. Definisi ini menggariskan bahwa kemiskinan sebenarnya merupakan suatu peristiwa penolakan dan tidak teryenuhinya hak, serta adanya pengakuan bahwa orang miskin terpaksa menjalani kemiskinan dan seringkali mengalami pelanggaran hak yang dapat merendahkan martabatnya sebagai manusia. oleh karena itu, konsep ini memberikan penegasan terhadap kewajiban negara untuk menghargai, melindungi dan memenuhi hak-hak dasar masyarakat miskin.","WWF-Indonesia, DFID MFP, Departemen Kehutanan, Ford Foundation",['FP11'],disk0/00/00/64/91,7,pub,2018-02-20 03:35:50,public,show,archive,"[{'id': None, 'name': {'given': 'Sulton', 'honourific': None, 'lineage': None, 'family': 'Mawardi'}}, {'id': None, 'name': {'given': 'Andik', 'family': 'Hardijanto', 'lineage': None, 'honourific': None}}, {'id': 'christine.wulandari@fp.unila.ac.id', 'name': {'lineage': None, 'family': 'Wulandari', 'honourific': None, 'given': 'Christine'}}]",6491,2018-02-20 03:35:50,"[{'eprintid': 6491, 'placement': 1, 'security': 'public', 'pos': 1, 'uri': 'http://repository.lppm.unila.ac.id/id/document/19435', 'format': 'text', 'main': 'pendekatan praktis penerapan kebijakan pro-poor budget-ilovepdf-compressed.pdf', 'files': [{'mime_type': 'application/pdf', 'hash': '69f0cba6e1c16ed538e2ea17abbd5c3e', 'datasetid': 'document', 'fileid': 60115, 'uri': 'http://repository.lppm.unila.ac.id/id/file/60115', 'filename': 'pendekatan praktis penerapan kebijakan pro-poor budget-ilovepdf-compressed.pdf', 'filesize': 5647521, 'objectid': 19435, 'mtime': '2018-02-17 05:09:19', 'hash_type': 'MD5'}], 'docid': 19435, 'language': 'en', 'mime_type': 'application/pdf', 'rev_number': 1}]",2018-02-20 03:35:50,981,TRUE,Penerapan Kebijakan Pro-poor Budget (Kebijakan Anggaran Berpihak pada Orang Miskin),"[{'name': {'honourific': None, 'lineage': None, 'family': 'Pro-poor Budget Policy', 'given': 'Kelompok Kerja'}, 'id': None}, {'name': {'honourific': None, 'lineage': None, 'family': 'Wulandari dkk (Editors)', 'given': 'Christine'}, 'id': 'christine.wulandari@fp.unila.a.c.id'}]",book,979-25-1040-0,Jakarta,,,,,,
3,['SD'],published,2005,http://repository.lppm.unila.ac.id/id/eprint/6688,"Market oriented approaches to environmental management are increasingly common in all sectors of the economy. Forestry is no exception. Many instruments available to policy-makers, by far the most ambitious to date is the development of markets for environmental services, such as carbon sequestration, biodiversity conservation, watershed protection, and landscape value. Of particular concern on implementation of payment for environmental services mechanism, there were lacking of knowledge related to what market creation means for pro poor people. Market are thought to and should be offered an efficient mechanism for promoting and financing forest protection, sustainable forest management, and well-being of community surround the forests.",Jurusan Manajemen Kehutanan Fakultas Pertanian Universitas Lampung,['FP11'],disk0/00/00/66/88,7,pub,2018-04-12 07:52:14,public,show,archive,,6688,2018-04-12 07:52:14,"[{'rev_number': 1, 'language': 'en', 'mime_type': 'application/pdf', 'format': 'text', 'docid': 19649, 'main': 'Pembayaran Jasa Lingkungan sebagai Alternatif Mekanisme Insentif bagi Masyarakat Pemelihara Kelestarian Sumberdaya Hutan.pdf', 'files': [{'objectid': 19649, 'filesize': 16147773, 'uri': 'http://repository.lppm.unila.ac.id/id/file/61561', 'filename': 'Pembayaran Jasa Lingkungan sebagai Alternatif Mekanisme Insentif bagi Masyarakat Pemelihara Kelestarian Sumberdaya Hutan.pdf', 'hash_type': 'MD5', 'mtime': '2018-04-11 16:10:56', 'datasetid': 'document', 'fileid': 61561, 'mime_type': 'application/pdf', 'hash': '2f90b2f72d2fd9b48cf9f4760a370795'}], 'security': 'public', 'uri': 'http://repository.lppm.unila.ac.id/id/document/19649', 'pos': 1, 'eprintid': 6688, 'placement': 1}, {'language': 'en', 'mime_type': 'application/pdf', 'rev_number': 1, 'format': 'text', 'main': 'Pembayaran Jasa Lingkungan sebagai Alternatif Mekanisme Insentif bagi Masyarakat Pemelihara Kelestarian Sumberdaya Hutan.pdf', 'files': [{'hash': '2f90b2f72d2fd9b48cf9f4760a370795', 'mime_type': 'application/pdf', 'fileid': 61563, 'datasetid': 'document', 'mtime': '2018-04-11 16:14:53', 'hash_type': 'MD5', 'filename': 'Pembayaran Jasa Lingkungan sebagai Alternatif Mekanisme Insentif bagi Masyarakat Pemelihara Kelestarian Sumberdaya Hutan.pdf', 'uri': 'http://repository.lppm.unila.ac.id/id/file/61563', 'objectid': 19650, 'filesize': 16147773}], 'docid': 19650, 'security': 'public', 'pos': 2, 'uri': 'http://repository.lppm.unila.ac.id/id/document/19650', 'eprintid': 6688, 'placement': 2}]",2018-04-12 07:52:14,981,TRUE,Pembayaran Jasa Lingkungan sebagai Alternatif Mekanisme Insentif Bagi Masyarakat Pemelihara Kelestarian Sumberdaya Hutan,"[{'id': 'christine.wulandari@fp.unila.ac.id', 'name': {'lineage': None, 'family': 'Wulandari', 'honourific': None, 'given': 'Christine'}}]",article,,,,2.0,73-82,1858-2583,Jurnal Hutan Tropika,1
4,['SD'],published,2005,http://repository.lppm.unila.ac.id/id/eprint/6687,"This study is to measure the Social Acceptability lndex (SAI) of forest communities to apply agroforestry in their homegarden (pekarangan). Social Acceptability lndex is a formula consists ,f participation, value and attitude degree of communities regarding their work in using agroforestry. Methodology used in study is descriptive statistic and logit model. Based on the analysis of data, SAI is a significant factor in all districts in Lampung province. lt means the success of development program must consider participation, value, and attitude or social culture aspects of community. particularly, community who will directly do development activities/programs.",Fakultas Kehutanan Universitas Gadjah Mada,['FP11'],disk0/00/00/66/87,6,pub,2018-04-12 07:52:01,public,show,archive,,6687,2018-04-12 07:52:01,"[{'security': 'public', 'uri': 'http://repository.lppm.unila.ac.id/id/document/19648', 'pos': 1, 'eprintid': 6687, 'placement': 1, 'mime_type': 'application/pdf', 'language': 'en', 'rev_number': 1, 'format': 'text', 'main': 'Tingkatan Penerimaan Sosial Masyarakat Sekitar Hutan dalam Mengadopsi Agroforestri di Lahan Pekarangan.pdf', 'docid': 19648, 'files': [{'hash': '3a5b70ae79a563349071d0d6866de98e', 'mime_type': 'application/pdf', 'datasetid': 'document', 'fileid': 61555, 'mtime': '2018-04-11 15:50:11', 'hash_type': 'MD5', 'filename': 'Tingkatan Penerimaan Sosial Masyarakat Sekitar Hutan dalam Mengadopsi Agroforestri di Lahan Pekarangan.pdf', 'uri': 'http://repository.lppm.unila.ac.id/id/file/61555', 'filesize': 10614493, 'objectid': 19648}]}]",2018-04-12 07:52:01,981,TRUE,Tingkatan Penerimaan Sosial Masyarakat Sekitar Hutan dalam Mengadopsi Agroforestri di Lahan Pekarangan,"[{'id': 'christine.wulandari@fp.unila.ac.id', 'name': {'given': 'Christine', 'honourific': None, 'family': 'Wulandari', 'lineage': None}}]",article,,,,1.0,17-26,1411-1861,Jurnal Hutan Rakyat,VII
